sender,receiver,message
33,1,hr sent out an email saying those of us who s fully vaxxed w proof can go maskless again in the office yea i m good i m still wearing my mask
33,2,hr sent out an email saying those of us who s fully vaxxed w proof can go maskless again in the office yea i m good i m still wearing my mask
33,4,hr sent out an email saying those of us who s fully vaxxed w proof can go maskless again in the office yea i m good i m still wearing my mask
33,9,hr sent out an email saying those of us who s fully vaxxed w proof can go maskless again in the office yea i m good i m still wearing my mask
33,23,hr sent out an email saying those of us who s fully vaxxed w proof can go maskless again in the office yea i m good i m still wearing my mask
33,25,hr sent out an email saying those of us who s fully vaxxed w proof can go maskless again in the office yea i m good i m still wearing my mask
40,33,continuing to mask up and distance reduces the transmission of the virus and if you do get it the virus won t leave you your immune system will handle it vaccines also reduce pressure on overwhelmed healthcare systems vaccines mean more milder cases if the vaxxed do get it
46,33,please help by following the order so we can remain open and safe for everyone whether you agree with the mask or not we need to follow the order and please be kind to the staff if they remind you they are just trying to do their job thank you all for your understanding
47,33,those who want to protect themselves from getting sick have every right to masks keep you more safe than no mask in tight settings everyone has the right to do whatever they want now at their discretion
50,33,I lose a mask at least four times a day. This whole thing is a scam.
63,33,putting on a mask to walk ten feet through a restaraunt and then taking it off when i get to my table is one of the dumbest things things i ve ever done in my entire life and i ve done a lot of dumb things
65,33,"Little blue ones are totally useless.Even the best don't work very well.Exhale smoke while wearing a mask,any mask and you will see the leakage. It's frightening how dumb they think all of is are."
70,33,putting on a mask to walk ten feet through a restaraunt and then taking it off when i get to my table is one of the dumbest things things i ve ever done in my entire life and i ve done a lot of dumb things
74,33,i love coaching however if one official or admin address me about our players not wearing a mask or wearing it properly under a helmet i will resign and not coach until this nonsense stops
82,33,oh you dont like wearing your mask maroon has been having a hard time breathing since but no one wants to talk about that
88,33,i love coaching however if one official or admin address me about our players not wearing a mask or wearing it properly under a helmet i will resign and not coach until this nonsense stops
33,1,Wearing a mask is part of the measures deployed by the government to aid in stopping the spread of a virus.
33,2,Exactly. The system should be more secure.
33,4,Wearing a mask is part of the measures deployed by the government to aid in stopping the spread of a virus.
33,9,CANNOTANSWER: [http://www.hr.gov/dec/informant/drug-safety-and-response_to-complain-to-us-as-us-a-freak-and-fake-health-problems/wp-macro-security_with_as_macro-security_with_as_dec/index.html?a=b00b2b4&c
33,23,I have a numbing cough and my doctor will tell me to put a mask on for 30 min.
33,25,"I don't care if your friends wore a mask. They get sick a lot and can't move their limbs, or if their friends wore a mask."
40,33,We must give that first class treatment to people who are sick from the virus and the vaccines to the vaccinated with it.
46,33,The government is going to continue to make it more obvious that the best way to stop the spread of a virus is not to wear a mask.
47,33,Wearing a mask is part of the measures deployed by the government to aid in stopping the spread of a virus.
50,33,"My favorite thing about it is the fact that you lose your mask a lot, I'm so embarrassed."
63,33,"Wearing a mask is part of the measures deployed by the government to aid in stopping the spread of a virus.putting on a mask to walk ten feet through a restaraunt and then taking it off when i get to my table is one of the dumbest things things i ve ever done in my entire life and i ve done a lot of dumb things Little blue ones are totally useless.Even the best don t work very well.Exhale smoke while wearing a mask,any mask and you will see the leakage. It s frightening how"
65,33,"I'm in the hospital today so I'm going to wear a mask. It's a really nice, comfortable mask that looks good with the skin."
70,33,"The truth is, even if you are vaccinated and you don't have a mask on, you have no protection against the virus."
74,33,"i like wearing a mask, but i m sick of the prank."
82,33,What's the problem with it? It's not a virus. It's a human being.
88,33,What kind of rules do you have on it? Have you worn your mask?
33,1,"What is a virus?... The government has a whole bunch of ways to stop it. They are working on the mask and not the vaccine, which is what it is."
33,2,"As someone who is not entirely against the government's anti-viral policies, I've come to find that they're putting themselves in a very real danger of getting themselves in an oblivion. It seems like they have been using the law, but they're going to have to do more."
33,4,>What kind of rules do you have on it? Have you worn your mask?
33,9,[no_name](https://www.hr.gov/dec/informant/drug-safety-and-response_to-complain-to-us-as-us-a-freak-and-fake-health-problems/wp-macro-security_with_as_macro-security_with_as_dec/index.html?a=b00b2b4&c)
33,23,> I can't stand to see someone in the crowd.
33,25,": I was born with a terrible allergy, so I'd be extremely sick, but I can't get out of my head like a dog without it."
40,33,"My father wears a mask every day for almost every event he has been to, and for about a year he goes on a bus to see the other teams. I wore a mask to a game last year, I don't wear a helmet."
46,33,In the X-ray machine you'll see a patch of smoke coming through your mouth. It makes it look like it's leaking.
47,33,A government whose mandate is to protect is the one that makes it impossible for someone to be allowed to have an infection.
50,33,I'm surprised he's getting any response after that!
63,33,That is really fucking funny.
65,33,"I just got a new mask and I'm going to get rid of it, but that's a mask. I'm going to go put on my mask. I'm going to get a new one, and I will have to wear a mask."
70,33,Vaccination is the right thing to do in a doctor’s office. It’s also not a good idea to take off a mask at work. You’re probably not going to get a better job.
74,33,"I've been told to get a new mask from a friend of mine, and if she doesn't like it I want to play for a friend of mine. The last time I tried it was the first time she got shit from me. I just thought it was pretty funny, as I think they said they are going to have to wear the mask so they can see the danger if they see me. So I walked away from the game and said, ""Fuck my face, I just want to see my face."
82,33,Basically everyone is wearing a mask unless they are sick from a virus.
88,33,"This is so cool, I always think that when I hear a mask on the radio a nipple is always on me, I just try to avoid it."
33,1,"As an official vaccine deterrent, they are essentially enabling you to get to the point that you need it (and that's a prank), and the vaccine isn't."
33,2,>What kind of rules do you have on it? Have you worn your mask?
33,4,"I wore a mask at work, and I did not wear one at any events. That means I would probably have to take off my mask."
33,9,"Yes - but it also doesn't prevent those who aren't able to travel with a mask in the office to get it. This may be a pretty good idea, but it's not a good idea to wear a mask for work."
33,23,"The government doesn't want to be able to impose any rules on the health department, and to prevent people from getting vaccinated. You should wear a mask."
33,25,>What kind of rules do you have on it? Have you worn your mask?
40,33,">I've been wearing a mask every day for almost every event I've been to, and for about a year he goes on a bus to see the other teams. I wore a mask to a game last year, I don't wear a helmet."
46,33,">I'm Taking a shirt out, blowing it in the face, and removing a mask to stop people from getting a vaccine are just as fucked up as it is taking a mask off to stop a virus from spreading. The government isn't doing the right thing. They aren't trying to do the right thing."
47,33,Is it ok to not wear a mask? Because it's supposed to protect the players from the viruses.
50,33,I know this's a bit of a dickish thing to say to someone.
63,33,"I think it s funny that the only one who actually did it was my coach. I think it s the government, in the sense of it protecting the players, who are obligated to wear a mask for safety reasons."
65,33,I’d be so ashamed of my mask to be able to go to a hospital and have a doctor ask me if I have a mask and I go to work.
70,33,">The truth is, even if you are vaccinated and you don’t have a mask on, you have no protection against the virus."","
74,33,It seems like this subreddit is overloaded with the same sorts of nonsense OP's friend and I have to agree with you in this:
82,33,I have some friends who do this. I have one of them.
88,33,The first thing that comes to my mind is the fact that I lose my mask several times a day because my nipple is getting sick.
33,1,"I'm going to say that as far as a vaccine going, the government is doing a lot of work trying to stop and disassociate those with a virus from getting to their nipples. The other point is that a mask is a very good thing for the public."
33,2,No you should not be in the government.
33,4,"The truth is, even if you are vaccinated and you don’t have a mask on, you have no protection against the virus."
33,9,There's a link to the full article in the r/government/reddit/police/db/advice/ /asfw.
33,23,">the truth is, even if you are vaccinated and you don’t have a mask on, you have no protection against the virus."
33,25,>What kind of rules do you have on it? Have you worn your mask?
40,33,"I hate to tell you, I love it when people say things like ""I've been wearing a mask every day for almost every event I've been to, and for about a year he goes on a bus to see the other teams. I wore a mask to a game last year, I don't wear a helmet."" The other one is ""I've been wearing a mask every day for almost every event I've been to, and for about a year he goes on a bus to see the other teams."""
46,33,It's a prank.
47,33,"In the video it talks about how his mask has helped him to get into a septic system, but he's still wearing it because he wants to protect people who smoked weed."
50,33,"I was in the US as a student in college. I lost a mask on my way to work and my friends didn't care about me, it was a terrible idea."
63,33,"My mom says, “Wearing a mask is part of the measures deployed by the government to aid in stopping the spread of a virus. That is really fucking funny. I've never been a big fan of the word ""mask"" since I was in the hospital. It's in the OP's personal constitution that they have in place. So you like wearing a mask? You don't. It seems that it's a fucked up fact, but we should have one. I'm a fan of the OP's personal"
65,33,"""The idea that a mask can kill bacteria is the wrong thing to do."""
70,33,I think you're missing out. It's not that I was in a doctor's office because I didn't have a mask on. I'm just going to assume that you're a fool.
74,33,"The idea that your hat has to be worn to stop a virus from spreading is not a joke, they're just trying to take you at face value, and this is how it works."
82,33,>Also you say that you're a scumbag.
88,33,I've never even worn a mask... I see some funny people in this thread who think that wearing a mask might help them.
33,1,"I love that they don't actually use hats in the military. In fact, they don't apply them as a defense mechanism. They simply tell people to put on hats and it's a prank."
33,2,"I'd go as far as to say it is a joke, but that this is really what it is, a prank. I have no idea how this works but I am the opposite."
33,4,"I like the idea of wearing a mask a lot, but I really don't like the idea of it helping people get a virus. I'm more of a fan of the idea that it kills bacteria."
33,9,CANNOTANSWER:
33,23,"He's blaming this on the government not trying to do a good job of protecting you from the virus. They're a lot more aggressive and a bit more inept, which isn't how you'd expect to feel about a public dick."
33,25,I have a mask and it is my life. It’s a hat.
40,33,I'm a fan of people who put themselves in masks to fight a disease or fight it. I'm sick of people who can't wear masks because they have no meds - and then they can't wear a mask - and they're sick of being frightened and sick of the same thing that is being used to vaccinate people.
46,33,>The fact that his contract is on the back of the record for this entire week is a big red flag.
47,33,The most recent video in the US that isn't in any way relevant is the one about the government.
50,33,"I'm sorry but I'm not sure that the doctor's job was to help protect you, so his message to your doctor should be : ""You lost your mask on your way to work, your friends didn't care about you, it was a terrible idea."""
63,33,I'm just a big fan of your cliche
65,33,"It's called ""I'm an anti-virus nut."""
70,33,"As you can see from the title, it's the first time that I ever read this post, and it's just really strange. It's like saying you're not the first person to see a man with a mask everyday - not a guy in a mask."
74,33,This is why I don't yell when people do that when I get sick. If you need to look for a mask.
82,33,"OP, it's a simple joke."
88,33,"The first thing that comes to my mind is the fact that I lost my mask several times a day because my nipple is getting sick. I can't wear my mask, and I can't help it. They are all scams. They're not fools."
33,1,[NAME] is a troll.
33,2,"As someone who is not entirely against the government's anti-viral policies, I've come to find that they're putting themselves in a very real danger of getting themselves in an oblivion. It seems like they have been using the law, but they're going to have to do more."""
33,4,"And it's a bad joke... It doesn't really work. I've always been a huge anti-virus nut, but it's still my opinion on the government."
33,9,"This is not a joke, that's a joke."
33,23,I'm a huge fan of people who put themselves in masks to fight a disease or fight it. I'm sick of people who can't wear a mask because they have no meds - and then they can't wear a mask - and I'm sick of being frightened and sick of the same thing that is being used to vaccinate people. I'm sick of people who can't wear a mask because they have no meds - and then they can't wear a mask. I'm sick of 
33,25,I'm a big fan of people who put themselves in masks to fight a virus. I'm a fan of people who put themselves in masks to fight a disease or fight it. I'm sick of people who can't wear a mask because they have no meds - and then they can't wear a hat.
40,33,I don't think that's fair to say the first one doesn't make sense. It's an oxymoron in disguise.
46,33,"""The government isn't doing the right thing. They aren't trying to do the right thing."""
47,33,"A lot of people have done these things before. It's been a while now and you're the one making the joke. I don't know what he does, but it's interesting. And I think you have your own opinions."
50,33,"I have a doctor who has the option of trying to get me to wear a mask to protect me from getting a virus. That's why he's such a dick. You guys are a family, so we can do the same."
63,33,"No ones saying, ""I'm just a big fan of your cliche"" in the comment."
65,33,Is this the way people are going to show up at a doctor appointment with a mask?
70,33,A CDC worker gets shot in the face while wearing a mask in the office - that's not a good idea
74,33,I wore a mask when I was a hockey coach and the people I was coaching were pranking and shit was in the air. I was on my way home from work so I could've slept or played hockey and got the kids to pick me up and help them in my room.
82,33,"> I'm not sure, my comment made me genuinely chuckle. I can understand why people wear masks, but I'm not sure if it makes a difference. I'm not sure. You are right that there is a lot to be said here."
88,33,"It's very interesting that the tarot card is one of the oldest tarot cards I've ever read. I know it has a few different meanings, but it's just not as simple as ""I was trying to buy a mask, but youre probably wrong."""
33,1,"It's an extremely dangerous thing, and it's a prank. It's a bad joke, and it's not good."
33,2,"No it doesn't. The only way to get to the bottom is by going back to the ""wrong"" side. This is how it works."
33,4,"As someone who is not entirely against the government's anti-viral policies, I've come to find that they're putting themselves in a very real danger of getting themselves in an oblivion. It seems like they have been using the law, but they're going to have to do more."" And it's a bad joke... It doesn't really work. I've always been a huge anti-virus nut, but it's still my opinion on the government."
33,9,">I don't know what he does, but it's interesting. I can understand why people wear masks, but I'm not sure if it makes a difference."
33,23,"""I am a big fan of people who put themselves in masks to fight a disease or fight it."
33,25,"""As you can see from the title, it's the first time that I ever read this post, and it's just really strange. It's like saying you're not the first person to see a man with a mask everyday - not a guy in a mask."""
40,33,I am not sure why this is important.
46,33,What is a prank? I can't remember what it is. I just remember the dummy that he was talking about.
47,33,"I'm not actually a doctor, but I feel pretty safe about wearing a mask as a tool for getting off weed."
50,33,>I feel like I've been too busy with my own job to be comfortable with the fact that I'm a patient and have no money to pay the bills.
63,33,"It is a cliche that everyone is just fucking up and the entire reason why they want to let their kids wear masks is because of it's stupidity. You have to make up your mind, because it will smother you to death."
65,33,"I've never heard anything that says ""Is this the way people are going to show up at a doctor appointment with a mask?"""
70,33,Are you ready to go through with the CDC?
74,33,"afew people here are making a joke about the government's ability to help prevent the spread of AIDS, and I'm assuming some of them have never seen the mask spewed on their mouths."
82,33,">I can understand why people wear masks, but I'm not sure if it makes a difference. I'm not sure. I'm not sure. I'm not sure. I'm not a fan of any of these people. The CDC is the only one who has a problem with people getting vaccinated. The truth is, they need to do something."
88,33,People are fools. They're just a group of idiots.
33,1,What's the troll in the article?
33,2,The only thing that is different is the way it looks in the media.
33,4,"I don't believe that [the government](http://www.styscy.gov/pub/hp/cdcp/obl/iio/e/mammafucking.htm) uses a ""wrong"" side of the story, so that the government tries to censor the message."
33,9,"What the CDC says is the ""weakest way to prevent this"" thing to do in that situation - the CDC doesn't want people to be in danger, not those who aren't able to travel with a mask to get it."
33,23,"It's been a while since I've read that tarot card. It's not as if you could've thought that it was a prank, but I'm not sure."
33,25,This isn't really about the mask. You're saying it's a joke? I think I saw a funny post and thought this was a prank. But it was about the fact that they are so messed up that they could do anything about it.
40,33,"I'm sure you've read the first 3 paragraphs, but the rest of it is pretty obvious. A mask can save you from getting a fever or a tetanus."
46,33,They were supposed to make the NSA look like the government. This prank was the biggest thing they ever tried.
47,33,CANNOTANSWER: A SCAM ARE GAMES.
50,33,I feel like the word 'prank' is a bit misleading and ambiguous. It's an inconsequential statement and it's not my opinion.
63,33,I've been in this situation all my life and I didn't even want to talk about the mask and I'm sure we could have a discussion about the masks in the future.
65,33,The people who don't want to be vaccinated are doing something wrong. They want to be the good guys.
70,33,>The fact that you have to do what you want to do is kind of alarming to me.
74,33,"> We do not have to give the President a mask, it's just a way to make a joke. I am wearing a mask that doesn't fit my nostrils. It looks awfully uncomfortable and doesn't help."
82,33,"I can't imagine you don't know what tarot is, but I've read some of the tarot cards."
88,33,What is the point of this thread?
33,1,a troll. what's the troll in the article?
33,2,"Nope. Nope. The only way to get to the bottom is by going back to the ""wrong"" side. This is how it works."
33,4,"The tarot is not a joke, its a remark."
33,9,It is not a joke. It's an advertisement for a dick.
33,23,">This isn't really about the mask. I'm not sure. I'm not sure. I'm sick of "", ""I am a big fan of people who put themselves in masks to fight a disease or fight it. I'm sick of people who can't wear a mask because they have no meds - and then they can't wear a mask. I'm sick of "", """"I am a big fan of people who put themselves in masks to fight a disease or fight it. """
33,25,I just wanted to say that I find the CDC 'wrong' side of the story interesting.
40,33,"This has nothing to do with the ""stop the spread of a virus."" It's about the government trying to prevent it."
46,33,"I just want to say that I was raped by a tarot card in the movie ""The Twilight Era,"" and I just want you to know that. I'm assuming that some of the people here have never seen that movie."
47,33,This is a really nice thread to make but not the kind of joke that can be described as being a scam.
50,33,"I was in school where this was happening. I had to talk to a nurse who had had a miscarriage of the vaccination list. She told me that I would be able to afford it. So we were both in the hospital. So, I have been there too."
63,33,"OP is a good man, but not a great man."
65,33,They want to be vaccinated but they don't know what it is because they have no idea.
70,33,"You don't say it. I'm talking about the fact that the CDC is trying to make the president look like a fool, and the fact that it isn't the government attempting to stop him from getting a virus."
74,33,"I don’t think it’s relevant. I’m going to leave you for a moment and make a comment in the title about how your hat doesn’t fit you, a joke. This is not an AIDS joke."
82,33,Vaccination isn't a scam. It's a very serious disease unless it's told by the doctor.
88,33,So you're telling me how sexist and stupid this is?
33,1,">We do not have to give the President a mask, it's just a way to make a joke."
33,2,"No it doesn't. The only thing that is different is the way it looks in the media.', ""Nope. Nope. The only way to get to the bottom is by going back to the ""wrong"" side. This is how it works."""
33,4,Is this a joke or a scam?
33,9,"A ""doctor"" doesn't say ""fuck"" a guy that has never seen it in public. He's not doing the right thing."
33,23,"I'm not saying you are a troll, but I don't see how it's actually any different from being raped by a tarot card - or how it's a joke."
33,25,I'm not a big fan of people who put themselves in masks to fight a virus.
40,33,"I think the best answer would be ""Hey man, do you know who he is?"""
46,33,"People are trying to get me to stop a bunch of stupid things like this, because I can't help the people I'm trying to get out of."
47,33,I don't think you're the type of person to comment that this is the kind of joke that can be described as being a scam.
50,33,So you don't think that the president is really doing anything wrong?
63,33,I don't want to sound as if we are skeptics and all that...
65,33,"""It's one of the biggest reasons the government is acting like a devil."
70,33,"It sounds like this whole thing is pretty crazy, I think it's a nice gesture to encourage your friends and colleagues to get in better medical facilities instead of being the ones who are on the hook for anything, especially if they're not good at their job. Unless you're a CDC employee, you won't be getting a good job."
74,33,"You're right, but that doesn't make it an AIDS joke. I'm in a different situation than the President and I know the issue. It's just a prank and the issue doesn't really matter. It's a big issue and nobody needs to know about it. It's ridiculous to believe people get AIDS from a mask."
82,33,"I'm not a lawyer. Vaccination is the best, most effective way to treat a virus unless you have a virus."
88,33,The tarot card hasn't been proven to be a fake. It is only a trick that helps keep people from trying to get AIDS. It hasn't proved to be a fake. The government isn't even able to tell who is wearing what because it doesn't matter who is in it. The masks prevent AIDS by preventing people from knowing what is happening. Rather they say the government is enabling the spread of the virus by preventing the spread.
33,1,That's pretty ridiculous. It's a joke.
33,2,"If you are looking for a job, the mask is a very good choice, as it will only help to prevent more people from getting AIDS if they know what it's."
33,4,"They're trying to make people feel better, so they're trying to show a little less."
