sender,receiver,message
65,51,I was the one that read the first sentence. It's not about the real thing and it's just a joke. It's about the actual topic and isn't a real joke.
79,51,"I can see a difference here between ""the government is making this very hard, especially with all the ridiculous people."", and ""Making it in the mouth"""
80,51,We're on the front lines of everything. But what the government is trying to do is very wrong and we need to stop doing it. We need to get rid of this as well.
92,51,"It's not a scam. It's a scam because it affects the growth of the virus, because it's not a virus. It's not a virus. It's not a virus. It's not a virus. It's not a virus. It's not a virus. It's not a virus. It's not a virus. It's not a virus. It's not a virus. It's not a virus."
51,21,A serious health concern is the health of people if they are being vaccinated. A serious health concern means the government is doing nothing. The fact that they're doing so is in the wrong here.
51,37,"I think it's a scam, and that it's not a scam. But it is scam."
51,39,I was surprised to learn that there is a line in the title that says the President wants to stop the spread of the virus.
51,40,"It's a joke, that's for sure, and I want to laugh."
61,51,Is the tarot an illegal card?
65,51,I am not a doctor. I am a doctor. I am a doctor. I am not a doctor. I am a physician. I am a doctor.
79,51,It’s funny to read.
80,51,[NAME] is a member of the National AIDS Foundation (NAF) and is associated with the Center for Disease Control.
92,51,"The only thing that I can think of is a scam. I mean, I gotta go to the doctor and talk to my doctor and ask them if it's a scam or not. And I’m going to ask them why the CDC is giving them the masks, because I need them."
51,21,"It doesn't matter if you have a medical diagnosis. There's no cure for HIV. If you have a medical diagnosis and you don't, you shouldn't have a vaccine."
51,37,Vaccination isn't a serious health concern. It's a serious health concern. It's not a serious health concern. It's not a serious health concern.
51,39,"That's exactly what I'm thinking. I've been out in the community for a while and it's not a big deal and I've heard pretty good things about how these people are doing it, I just don't know."
51,40,The CDC is a monopoly on ad money. It’s not the right thing to do. It’s a scam.
61,51,I'm from [NAME] [NAME] [NAME] [NAME] [NAME] [NAME] [NAME] [NAME] [NAME] [NAME] [NAME] [NAME] [NAME] [NAME] [NAME] [NAME] [NAME] [NAME] [NAME] [NAME] [NAME] [NAME] [NAME] [NAME] [NAME] [NAME] [NAME] [NAME] [NAME] [NAME]
65,51,"I'm actually looking into this at a mental age where I get sick as a kid and I am not a doctor, I don't have the money. I'm not a doctor, I'm a health care professional, I'm not a doctor. I'm just a doctor."
79,51,The CDC is trying to push people into mental health institutions. It's funny because they have to get over them by putting it on the people with HIV.
80,51,Yes - if you are a member of the CDC and don't speak for a third party - and you have a friend from a party that isn't white - a mask on a cocked head is one of the things we will need to keep in mind.
92,51,This is a scam. You get a mask. The virus is not a virus. It's not a virus because it's not a virus. It's not a virus. It's not a virus. It's not a virus. It's not a virus because it's not a virus. It's not a virus because it's not a virus.
51,21,"As a doctor, I’m concerned about a number of factors."
51,37,Is your wife a doctor or a doctor?
51,39,"There is no misunderstanding of the meaning of ""vaccine,"" the term of the drug used for AIDS."
51,40,"We're talking about this in a general sense. A health concern, if you get sick, you're also the government."
61,51,"They're trying to make money and they can't stop the spread of a virus. They're trying to prevent the spread of a virus."""
65,51,[This is a joke that has been around for 2 years. They are trying to sabotage the health system by trying to make people feel better about the AIDS issue.](http://www.cdc.gov/en/article/dead_flood/)
79,51,I know how you feel about that. This is something you have to accept in order to be able to work. It doesn't get better.
80,51,"if there are a lot of people that want to sabotage the health of the people who will vote for Obama, they will vote for the president."
92,51,"AIDS is one of the most common, often deadly illnesses."
51,21,Vaccination is not a serious health concern. It isn’t a serious health concern. It’s a serious health concern. Vaccination isn’t a serious health concern. It’s a serious health concern.
51,37,"I don't think it's a scam, but this is a whole other level of a scam i guess."
51,39,The CDC is also trying to profit off of the money and publicity that the vaccine he wants. It isn't a serious health concern. It is not a serious health concern. Vaccination is not a serious health concern. Vaccination is not a serious health concern.
51,40,"A CDC member of the NAF, and a CDC agent of the ""CDC"" (www.canadianscdc.org/naf/adc/contributing_and_instituting_and_instituting_and_instituting_and_instituting_and/or_academy/), is currently defending a CDC report about the vaccine. It is a shame."
61,51,[NAME] [NAME] [NAME] [NAME] [NAME] [NAME] [NAME] [NAME] [NAME] [NAME] [NAME] [NAME] [NAME] [NAME] [NAME] [NAME] [NAME] [NAME] [NAME] [NAME] [NAME] [NAME] [NAME] [NAME] [NAME] [NAME] [NAME] [NAME] [NAME] [NAME]
65,51,"""... I think it's funny because it's about how people in power want the government to prevent the spread of a virus and not a joke about it."" (http://www.cdc.gov/en/article/dead_flood/) Because it's a joke."
79,51,"I was not referring to the government, I was talking about the CDC."
80,51,"""If it's a scam, it's a scam. You can have any ad with a mask on if you're black."""
92,51,"Yes a lot of people think that, while it's not the best way to protect people, it is, in fact, the most legitimate way to protect people. Vaccination is a very valid and valid strategy, but it doesn't actually work if you've already been vaccinated, because it has to be administered as soon as possible."
51,21,"I have a lot of friends who think this is a scam, but they don't realize that I have never experienced any real real health issues with a mask."
51,37,Vaccination isn't a serious health concern.
51,39,What if you don't get vaccinated?
51,40,[NAME] [NAME] [NAME] [NAME] [NAME] [NAME] [NAME] [NAME] [NAME] [NAME] [NAME] [NAME] [NAME] [NAME] [NAME] [NAME] [NAME] [NAME] [NAME]
61,51,Apparently the CDC isn't helping the victims of HIV/AIDS. The CDC is trying to help patients. It's not a joke.
65,51,Vaccination is a serious health concern. It is not a serious health concern.
79,51,">I don't think people are very good at describing what they believe as'smothering', as in, 'if it's not the right thing to do and you're not going to do it.'"
80,51,So basically when someone gets AIDS it becomes the worst thing they've ever done. They'll be afraid of their own health and their families are being treated like that?
92,51,"It's a scam because it doesn't affect the growth of the virus, it doesn't affect the growth of the disease because it's not a virus. It's not a virus because it's not a virus. It's not a virus because it's not a virus. It's not a virus because it's not a virus. It's not a virus because it's not a virus. It's not a virus because it's not a virus."
51,21,Vaccination isn’t a serious health concern. It’s a serious health concern. Vaccination isn’t a serious health concern. Vaccination isn’t a serious health concern.
51,37,>I don't think it's a scam.
51,39,"The CDC has a reputation for ""smoking the sharks"""
51,40,> Vaccination isn't a serious health concern. It is not a serious health concern. It is not a serious health concern. It isn't a serious health concern. It is not a serious health concern.
61,51,"I am the president of this country. I am not in the US. I am just a tourist. I don't go to places that allow people to be around people. If I don't go I'll take the bus. You can call your local township or town to call the police. If you're a tourist, I will go to your town to take you to the hospital and ask to see a doctor."
65,51,"""It's a joke because it's a joke."""
79,51,"Yes, the CDC is trying to push people into mental health institutions."
80,51,The only thing that will keep 'em out of the picture will be the CDC putting that mask on you - and that's the CDC.
92,51,It's not a virus because it doesn't affect the growth of the virus. It's not a virus because it's not a virus. It's not a virus because it's not a virus. It's not a virus because it's not a virus. It's not a virus because it's not a virus. It's not a virus because it's not a virus. It's not a virus because it's not a virus.
51,21,This is a joke. A real joke. Is a joke a joke?
51,37,"I'm afraid to say I didn't get a vaccine for my baby, so I have to say that I thought it was a scam because I wasn't allergic to it."
51,39,Vaccination is not a serious health concern. It is a serious health concern. It is not a serious health concern.
51,40,"I'm going to go and go to the CDC's office and get vaccinated. I don't even think I've seen one like it. Is the CDC scammed? If not, I'd just fuck the CDC's."
61,51,"The most recent one I know of is the 'Moto Man' by 'Number Man', which is used as a reminder to not wear a mask and not to try and spread a virus. It was called ""The Axe of the Sword""."
65,51,The title of the article is misleading.
79,51,"In this case, you merely wrote the quote to justify the situation."
80,51,CANNOTANSWER](http://www.reddit.com/r/Paradise/CenturySci/)
92,51,Vaccination isn't a scam because it doesn't affect the growth of the virus. It's not a virus because it's not a virus. It's not a virus because it's not a virus. It's not a virus because it's not a virus. It's not a virus because it's not a virus. It's not a virus because it's not a virus. It's not a virus because it's not a virus.
51,21,"I'm going to say that, but, I can't. I'm going to say: Vaccination isn't a serious health concern. It's not a serious health concern."
51,37,Vaccination is a serious health concern. It's not a serious health concern. It's not a serious health concern. It's not a serious health concern. It's not a serious health concern.
51,39,"The second part is a little off topic, but that's it."
51,40,I don't understand how a CDC employee can be used to be a thief to get a virus?
61,51,I'm the only black person on the planet who wears a mask at work.
65,51,The title is misleading because the CDC is trying to make the joke sound like it's a joke and makes it sound like it's a joke.
79,51,“...I am a doctor.
80,51,"A ""Himmel Masque"" is just a ""Smash The Vaccine"" that states that ""Smash the Vaccine"" is a ""Smash"" that suggests that a person with AIDS has AIDS and can't afford to get vaccinated."
92,51,[Incorrect](https://en.wikipedia.org/wiki/VaccinationAssist) is a popular ad for people to read a story about vaccines and viruses that they believe are actually actually the virus.
51,21,">"" I'm not a doctor but I do not think it's a scam"
51,37,"A CDC employee used to be a'smash the Vaccine', which is just a ""Smash the Vaccine"" that states that a person with AIDS has AIDS and cannot afford to get vaccinated."
51,39,"I'd suggest to avoid the CDC, because it can be difficult to find people who vaccinate without having to worry about being infected."
51,40,Vaccination isn't a serious health concern. It's not a serious health concern. It's not a serious health concern. It isn't a serious health concern. It isn't a serious health concern.
61,51,Isn't it a joke? I can't find one.
65,51,"Vaccination isn't a joke, but a problem."
79,51,"I read an article that said the ""Wearing a mask is part of the measures deployed by the government to aid in stopping the spread of a virus."
80,51,"""I don't really think that the CDC is being an evil conspiracy to profit out of a country that isn't helping its people."""
92,51,My dad has a troll ad about how he had an AIDS infection but he didn’t believe that it was a virus.
51,21,"You're a troll, this isn't the joke you're looking for. This is a joke about a doctor trying to do it for a living and a joke about a doctor trying to make people think that they don't care what someone is doing. They don't even care what people are going through. The point is that the problem is that the person is making the joke. The problem is that the person is going through the same things, and the government is doing what the doctors are trying to tell them they can do."
51,37,I think there are a lot of things to look for. Vaccination isn't a serious health concern. It's a serious health concern. It's not a serious health concern. It's not a serious health concern.
51,39,"> It isn't a serious health concern, and it isn't a serious health concern."
51,40,[NAME] [NAME] [NAME] [NAME] [NAME] [NAME] [NAME] [NAME] [NAME] [NAME] [NAME] [NAME] [NAME] [NAME] [NAME] [NAME] [NAME] [NAME] [NAME] [NAME] [NAME] [NAME] [NAME] [NAME] [NAME] [NAME] [NAME] [NAME] [NAME] [NAME] [NAME]
61,51,You think they can stop the spread of a virus?
65,51,>A lot of people rant about how they are trying to make people feel better. It is a serious and serious issue. It is a serious and serious issue. It is a serious and serious issue.
79,51,'Making it in the mouth'
80,51,"No, you're not."
92,51,Vaccination is a serious illness and it's not a virus because it doesn't affect the growth of the virus.
51,21,It's been sweeping the country for a long time now. It's a problem that the government is trying to fix. They want to make people look sick. They aren't gonna help.
51,37,"It's not a serious health concern, and it's not a serious health concern."
51,39,Vaccination is a serious health concern. The CDC is working to sabotage people's health. Vaccination isn't a serious health concern. It is a serious health concern.
51,40,I’m going to reword this:
61,51,It sounds like there are other things people can be aware of. And I'd definitely look into a book on the CDC if you're not familiar with it. It's really the only book that I've ever found out about.
65,51,The CDC wants to get rid of their anti-viral and anti-proteotypic statements. It's a joke because if the public isn't familiar with it it's a joke and not a joke because the people who believe it are.
79,51,They're trying to push people into mental health institutions.
80,51,"> ""I'm not sure what I understand what's going on."
92,51,"So the second part is just how people are calling it. ""I think you're a scammer."""
51,21,"That's a huge deal and we need to know how it's done. And we've been in that position since the dawn of civilization, as I've seen people do."
51,37,Vaccination is a serious health concern. It's not a serious health concern. It's not a serious health concern.
51,39,"I think the word ""smoking the sharks"" is the correct one, or the CDC."
51,40,[NAME] [NAME] [NAME] [NAME] [NAME] [NAME] [NAME] [NAME] [NAME] [NAME] [NAME] [NAME] [NAME] [NAME] [NAME] [NAME] [NAME] [NAME] [NAME] [NAME] [NAME] [NAME] [NAME] [NAME] [NAME] [NAME] [NAME] [NAME] [NAME] [NAME] [NAME]
61,51,"My first thoughts: A little less'shit', but a lot less 'twitchy'."
65,51,[NAME](http://www.cdc.gov/en/article/dead_flood/)
79,51,"CANNOTANSWER [(http://www.ncdc.gov/disease/disease)](http://www.ncdc.gov/disease) The phrase is ""Making it in the mouth"" and it's not a joke. It's funny and not the same as a joke. It's funny and not the same as a joke. It's funny and not the same as a joke. It's funny and not the same as a joke."
80,51,The point is that the fact that the CDC is actually a government company means the CDC has a legitimate duty to make public health a priority. It is a government organization and not a scam.
92,51,Vaccination isn't a scam because it doesn't affect the growth of the virus. It's not a virus because it's not a virus. It's not a virus because it's not a virus. It's not a virus because it's not a virus. It’s not a virus because it’s not a virus. It’s not a virus because it’s not a virus. It’s not a virus because it’s not a virus.
51,21,Vaccination is not a serious health concern. It's not a serious health concern.
51,37,"This is one of the most reputable, irrational, and idiocy of all time."
51,39,"""I’m not sure what the problem is in the government that this is a scam, and they’re trying to profit off of the money and publicity that the drug used for AIDS."""
51,40,It’s not a serious health concern. It isn’t a serious health concern. It isn’t a serious health concern. It isn’t a serious health concern. It isn’t a serious health concern. It isn’t a serious health concern. It isn’t a serious health concern. It isn’t a serious health concern.
61,51,"I want to share this with everyone, but the fact that this one has all the details of this whole fucking thing is very sad, and makes it very difficult for them to make up a whole story that would have to be so funny for us to do the same thing. And I am assuming this is because they're trying to make a deal with us. But the fact that they are trying to stop the spread of a virus is fucking hilarious."
65,51,I don’t want to be the one that reads this article. I don’t see what the joke is. It’s a joke because it’s about the public and isn’t a joke. It’s a joke because it’s “just a joke”
79,51,"The word ""masked"" in the article is a joke. They're trying to push people into mental health institutions."
80,51,"AIDS is a serious condition. It is not something that a few people who have been in contact with the CDC are aware of. It is a very small and dangerous disease. This is not a ""war"" or a ""war"" that is happening here."
92,51,"My grandfather had a shit ton of shit from it. He had it removed from his lungs and it didn’t get anywhere near as bad. I was on antibiotics at the time and didn’t know anything about what to do with it. He had it removed and said I’m a terrible person and need to stop. But he refused to do anything to stop a lot of things from causing me to be seriously ill and the CDC decided it wasn’t a virus and would stop it, so I could continue on my medication at the hospital. I"
51,21,"I think that's a big problem for people, a lot of people that have never been on a vaccine are going to be vaccinated. The majority have had an AIDS-specific vaccine. I've always been concerned about the future of AIDS, but that's just me."
51,37,“Vaccination isn’t a serious health concern. It’s not a serious health concern. It’s not a serious health concern.”
51,39,You have to be vaccinated to stop the spread of HIV/Aids.
51,40,It's not a serious health concern. It’s not a serious health concern. It’s not a serious health concern.
61,51,"“The idea that wearing a mask is a joke makes me want to read the tarot card. This is one of the ways the US government is doing the most good, and it is a joke."
65,51,"The article said there is no such thing as ""Vaccination is not a serious health concern"", but it does mention that they would not have vaccinated anyone in their lifetime to make a joke, which could have a serious effect on the general public health - that it could potentially be a sign of a serious health concern."
79,51,">(http://www.ncdc.gov/disease/disease) The phrase is ""Making it in the mouth"" and it’s not a joke. It’s funny and not the same as a joke."
80,51,"if you're looking to get an AIDS vaccine and don't like what they are doing to you, it's very easy to get one."
92,51,Is the CDC helping prevent the spread of a virus?
51,21,"Because they're trying to stomp out the ""virus"" / ""vaccine""/ ""medical question"" and get vaccinated because they think it's a ""scam""."
51,37,There are a lot of things wrong with a mask. There is a lot wrong with a mask. There is a lot of wrong with a mask. Vaccination is not a serious health concern. It’s not a serious health concern.
51,39,""" ""...I know that it is difficult to figure out if a new drug is really a scam, and they’re trying to profit off of the money and publicity that the drug used for AIDS."""
51,40,The government has the power to make the government take control of its affairs.
61,51,[NAME] [NAME] [NAME] [NAME] [NAME] [NAME] [NAME] [NAME] [NAME] [NAME] [NAME] [NAME] [NAME] [NAME] [NAME] [NAME] [NAME] [NAME] [NAME] [NAME] [NAME] [NAME] [NAME] [NAME] [NAME] [NAME] [NAME] [NAME] [NAME]
65,51,"The CDC is threatening a major health concern for Americans because of the AIDS epidemic that accompanies it, and this isn't the first time they've done it (as a joke, of course) that's made a joke."
79,51,CANNOTANSWER.
80,51,You're a racist.
92,51,This is the first time I see a [NAME] [NAME] [NAME] [NAME] [NAME] [NAME] [NAME] [NAME] [NAME] [NAME] [NAME] [NAME] [NAME] [NAME] [NAME] [NAME] [NAME] [NAME] [NAME] [NAME] [NAME] [NAME] [NAME] [NAME] [NAME] [NAME] [NAME] [NAME] [NAME]
51,21,A serious health concern is a serious health concern. If you're not getting vaccines you won't get an AIDS specific vaccine.
51,37,My wife is a doctor.
51,39,"Are you serious? Are you serious? I don't know that the CDC is giving out billions of dollars a month for this, and the FDA isn't recommending any other vaccines for anyone. It's more of a joke that you don't know."
51,40,The CDC is trying to prevent the spread of AIDS through the use of a fake vaccine.
61,51,"I think you should look into a tarot card called ""Moto Man"" because it is a very good one."
65,51,"This is why people make jokes about vaccines and tell jokes about a fucking CDC guy saying ""I'm going to tell you that I needed to get the vaccinated,"" instead of ""I don't see why he's telling me that you needed to get the vaccinated"" instead of """"I'm going to say this about twitchcon and masks."" "", """"..."
79,51,CanNOTANSWER/CanNOTANSWER/ CanNOTANSWER/CanNOTANSWER/
80,51,"I think that's the point of this, too."
92,51,"In a year or two you'll hear a doctor saying, ""Making a mask is an important part of the cure of AIDS. The CDC is making false claims about a virus to get people to buy it."
