sender,receiver,message
93,28,TIL: [Tarot deck](http://www.research.tarot.gov/legaladvice/en/documents/Tarot/cfe_tarot_decks) is not a tarot deck.
93,30,"IANAL: ""It’s not a scam. It’s a scam. They’re scammers. The government is a big part of it. They’re scammers."""
93,31,"So he doesn't have a lawyer or a tarot deck, but he's a tarot teller?"
93,46,>[It’s not a scam. It’s a scam. They’re scammers. The government is a big part of it. They’re scammers.](http://en.wikipedia.org/wiki/Persona_Cracked-Through_Attorney_Card/Tarot_Mask_Reports/P)
93,59,So do they have a card that is worth more than one or two dollars?
93,61,"The biggest scammers are the scammers, because the government is an integral part of it."
93,77,> It’s not a scam. They’re scammers. The government is a big part of it. They’re scammers. They’re scammers.
93,82,CANNOTANSWER -
93,89,"What a lot of people think.... I thought you were being a bit vague, but no."
99,93,You should probably tell a lawyer. This is what a lawyer is supposed to say when they hear the fucking word'scam'.
93,7,"That's probably a lot of scams, IMO. It might actually be one of them. However, the scams are often attributed to the fact that the government is a big part of it and is trying to evade the government's money, and not the people."
93,9,What was a tarot deck?
93,23,"The ""Little Blue ones are totally useless.Even the best ones don't work very well. When I go out to eat I always end up eating a bunch of sick people.'', ""'[i used to think this was a popular meme because I wanted to show people some shit and it was very scary.''"
93,26,I was thinking about using the word 'a'in a tarot deck?
93,28,IANAL. (#1
93,30,A tarot card is a tarot card in itself.
93,31,I would definitely ask a lawyer.
93,46,tarot and the government are actually scammers.
93,59,The article states that this isn't a scam. It's a scam. They're scammers. They're scammers. The government is a big part of it.
93,61,I have an old deck called The Axe of the Sword and my aunt has a fake one.
93,77,"""Hey, a lot of the tarot tarot is really old. So the most interesting part of that is the 'Tarot' deck."
93,82,(http://www.tarot.gov/legaladvice/Tarot_card/Cfe_tarot_Reports/P)](http://en.wikipedia.org/wiki/Persona_Cracked-Through_Attorney_Card/Tarot_Reports/P)
93,89,"""...if you're a scammer, you are a scammer."""
99,93,"I'm an Australian, and I've been told that I'm an American (but not a lawyer). I don't think it's a scam. It's the tarot. It was released in September 2006, and it is not the real tarot. They are using them for the purpose of helping a virus spread."
93,7,"What can you do, don't do!"
93,9,i've played tarot tarot cards all the time and not really played any of them.
93,23,It sounds like a scam. I think its a scam. A lot of people seem to think that tarot cards are a scam. There are still a lot of scams and scams in the UK. There's a lot of evidence to prove that tarot cards are scams.
93,26,"If the government is really a big part of it, they're scammers."
93,28,"The first three aren't necessarily in their logical senses, but they should be listed as a legal topic to get attention. The first two aren't about the government."
93,30,This isn't a scam. It's a scam. They're scammers. The government is a big part of it. They're scammers. The government is a big part of it. They're scammers.
93,31,The best tarot deck i've ever played.
93,46,"I'm a lawyer, and this is the best example of what people are going through."
93,59,IANAL. The tarot and the government are actually scammers. They're scammers. The government is a big part of it.
93,61,"It's like saying ""you are scamming money in China, you're doing that to me."""
93,77,"So, if you read a lot of tarot decks, you can make a video of someone saying something about them."
93,82,"I grew up in a town and there is a lot of tarot deck that is on the books of the government. I found the whole thing quite interesting and i think they have great stuff for people to check out. I guess some people just think it's a scam. And if the government is a big part of it, then you're still a scammer."
93,89,"i mean this is pretty much a joke that's not true, but not a scam. Its just not the real thing."
99,93,I don't even think there's a reason to be a scam.
93,7,ahh! i mean you've never really done tarot yet
93,9,"The problem isn't that you play tarot cards, but that you have a lot of money to spend on tarot cards, namely the one with the most accurate information on how to read tarot cards."
93,23,They tarot card and the government tarot card are tarot cards. This is the top one that gets me out of the scam zone.
93,26,It's a scam. The government is a big part of it. They're scammers. The government is a big part of it.
93,28,“It’s a scam. They’re scammers. They’re scammers. The government is a big part of it.
93,30,"I'm really sorry. If people don't believe me, you will not find anything."
93,31,It's not a scam. It's a scam. It's a scam because it helps people detect a rape. It's a scam. They're scammers.
93,46,"i'm an Australian, and I've been told that I'm an American (but not a lawyer). I've seen a lot of tarot decks, and I've seen some cards, but I couldn't find the cards in the first place. The tarot isn't a scam, it's just a scam. The tarot is a scam. There's a lot of evidence to prove that tarot cards are scams."
93,59,">I feel like I had to wear it to a scary movie a few times. I'm sorry. But I didn't get sick from a mask. I'm afraid of the idea that you can not wear a mask. I think the best way to take it is to read the ""Wants"" in a tarot deck.',"
93,61,I think the tarot is one of the most popular and effective things to use when doing something like this. They're not like the cards in the card in the wiki.
93,77,A lot of the people who are claiming they are scammers and not that it is a scam are also very confused.
93,82,oh dear. i don't understand why people are down voting me to do this
93,89,The article states that this isn't a scam. It's a scam. They're scammers. The government is a big part of it.
99,93,"I don't think the title is a scam, but I think it does state that a lot of things are a scam."
93,7,I’m gonna have to be in the middle of the tarot club. This is all in the head and the tarot is a whole new world. I’m not saying that there’s no good ways to get a job in society. This is going to be a scam.
93,9,The tarot deck itself is a scam.
93,23,"It's very easy to talk about how you want to feel in the situation, and if you want to find out more about the situation, you need to go to /r/tarot and get some advice."
93,26,“Tarot cards are really good at detecting rape. The tarot is a scam. They’re scammers. The government is a big part of it. They’re scammers. The government is a big part of it. They’re scammers. The tarot is a scam. They’re scammers.
93,28,"'Til: '""Ahh! I've never really done tarot cards. I've seen a lot of tarot cards, but I couldn't find them. I couldn't find them in the first place, and I don't like it.'', ''I think you're just a little bit of an idiot. I'm sure you should be concerned about the security of the tarot decks you have seen."
93,30,"No one is asking whether a tarot card is scam, as they've claimed that the tarot is a fraud. This is why he has made the claim ""I don't know if this is a scam. It's a scam."
93,31,I aspire to be a lawyer. I will only tell you that my friend.
93,46,The tarot and the government are actually scammers.
93,59,"You can do it, if you want. You can do it anywhere. I know it sounds strange but I'm so used to it."
93,61,"It's been a long time, and I'm glad that the new one has been released."
93,77,"""Hey, a lot of the tarot tarot cards are really old. So the most interesting part of that is the deck. I guess some people are very curious to see what a tarot is about, and even if they're using a real one, they still have some sort of question about what it says."""
93,82,"I'm a doctor, and I think this is one of the most dangerous things I've ever read in a career."
93,89,You're the author of the post.
99,93,"The tarot is the most important part of the game. The game is based around the human brain, so even though you do have a lot of potential, it still sounds like it's a scam, it's a fake game."
93,7,The tarot is really a scam because people think it's a scam.
93,9,What is the difference between a tarot and a card? You don't have a tarot card unless you have a tarot card and you've a tarot deck?
93,23,I have seen several scams and scams on tarot.
93,26,"I didn't read the comments. I think the question is that the deck 'The government' is a big part of it, and they're scammers. The tarot deck is a scam."
93,28,I know that sounds a little strange but I can only say that that is a scam and I'm a bit hesitant to take part in it. It's one of the easiest things I've seen in the last several years and I never got my hands on a tarot deck because it seemed to be out of the realm of possibility.
93,30,They're scammers. The tarot is a scam.
93,31,"The deck is not scam, it's scam."
93,46,"This article, I believe, is about the scammers."
93,59,... and there's only a tarot card in the wiki.
93,61,"IANAL. I think the best tarot deck I've seen is ""The Axe of the Sword: The Tsunami: Getting Away."" It's definitely a scam. It's definitely a scam. The tarot and the government are actually scammers. The tarot and the government is a big part of it."
93,77,"What's the first part? ''I didn't get sick from the mask. I'm afraid of the idea that you can not wear a mask. I think the best way to take it is to read the ""Wants"" in a tarot deck."
93,82,"The tarot is a scam. A lot of people are worried about it because the deck resembles a tarot deck, but not because it's one of the tricksters."
93,89,"i think it's a lot more interesting to read and see that the tarot is the most important part of the game. The game is based around the human brain, so even though you do have a lot of potential, it still sounds like it's a scam, it's a fake. I just think that it's misleading."
99,93,"I am not a lawyer but this is a tarot card, a tarot deck is basically a deck that has all the elements, so if you don't trust your perception, you're scamming someone."
93,7,"There are three ways to play the tarot. You take it out of your hand and put it back on and then you leave, and your mask comes off of your hand and floats away to see the tarot. So you take your mask out and then you leave. This is the third way to go. That’s the first way to get a good job. Then it’s off to bed. Then you go to sleep because you feel like you’re going to be walking a lot in the tarot."
93,9,I had a ton of fun playing this tarot deck after reading a book on the topic. You're getting a lot of ideas from that - but it just sounds cliche and not scammy.
93,23,">""Hey, some people are very curious to see what a tarot is about, and even if they're using a real one, they still have some sort of question about what it says."""
93,26,The tarot is not a scam. The tarot is not a scam.
93,28,"""I think it's a scam. The government is a big part of it."""
93,30,"It's all a scam. The tarot is a scam, and is fraudulent. The government is a big part of it. They're scammers. The tarot is actually a scam."
93,31,[(________________________________________________________________________________________________________________
93,46,The tarot is one of the most dangerous things I’ve ever read in a career. I'm not a lawyer.
93,59,"I think the best way to take it is to read the ""Wants"" in a tarot deck. It's the ""Want"" is the best way to go."
93,61,I can't even think of any kind of other card that I like to wear.
93,77,The tarot is a scam because it has the potential to be fake.
93,82,"I don't think that the tarot is a scam. If you don't think you're a lawyer, you don't have to. The tarot card is a scam because it's fake and the government isn't going to take anything away from you."
93,89,"""The government is a scam"""
99,93,"I have a good story, but my wife doesn't have time to do it. I think my friends are just doing it for fun and I have a really good idea how to use it. I can do it for fun and I don't want to spend time with the other guys. Those are some of the things I'm doing to keep myself alive."
93,7,I don't like tarot.
93,9,''Did you know that there's a deck called The Axe of the Sword: The Tsunami: Getting Away?''''?
93,23,"People are actually trying to scam the tarot in a lot of ways and this is the first of those ways that I've seen in a lot of different ways and I've been on a lot of different sites, both on the web and offline."
93,26,A lot of people think tarot cards are scams. They are really good at detecting rape. The government is a big part of it. They’re scammers. The tarot is a scam. The tarot is a scam.
93,28,"""This is the biggest thing I've heard a lot lately. I've only seen a lot of people would have raped me because of fake tarot cards."", ""»>“Sir, I am not a lawyer, but I'm a bit of an idiot. I think you should be concerned about the security of the tarot decks you have seen. It's definitely a scam. The tarot and the government is a big part of it."
93,30,The biggest problem is not having people buy the cards as a scam but they are fraudsters and scammers.
93,31,"""The mask is a scam. It's a scam because it has the potential to be fake. The tarot and the government is a big part of it. They're scammers. The tarot is a scam. They're scammers."""
93,46,"""Wearing a mask,any mask and you will see the leakage. It's frightening how dumb they think all of is are."", ""I don't think I'm a lawyer. I think the best way to take it is to read the ""Wants"" in a tarot deck. The ""Wants"" is the best way to go."
93,59,"""I have a tarot card and a card on my hand."
93,61,"I can't believe my sister, who's married to a guy, has been getting this kind of treatment."
93,77,"IANAL. I think the best way to take it is to read the ""Wants"" in a tarot deck. It's definitely a scam. The tarot and the government are actually scammers. The tarot is a scam. The tarot is a scam. The tarot is a scam."
93,82,"i love the tarot, and it is one of the few things that really helps people i guess. its very scary that it isn't a scam and in no way is it a scam."
93,89,I'm sure I've seen enough of this stuff from people and I have no idea what they were saying.
99,93,I think that the title should be called 'the scam' because the title is misleading.
93,7,"I think the best way to take it is to read the ""Wants"" in a tarot deck."
93,9,"I think I've found some great posts to write, like these:"
93,23,So you don't think there are fakes to use the tarot cards?
93,26,A lot of people think tarot cards are scams. They are really good at detecting rape. The government is a big part of it. They're scammers. The tarot is a scam. The government is a big part of it. The government is a big part of it. They're scammers.
93,28,"I'm not a lawyer, but I don't know who's really interested in the tarot. I like it, but I feel bad about myself."
93,30,There's no doubt that the tarot is a scam. There is a huge stigma to the fact that it's fake.
93,31,"I'm going to start by saying the word ""scam"" instead of ""scam""."
93,46,The problem is that there are too many cards with a single name.
93,59,It is a scam because it is the wrong word.
93,61,I think you're right that the title is misleading.
93,77,"'Some people are very curious to see what a tarot deck is about, and even if they're using a real one, they still have some sort of question about what it says."
93,82,"CANNOTANSWER - ""[Tarot card](http://www.tarotcards.com/e/tarot-card-scam)"""
93,89,The tarot card is a scam.
99,93,That sounds like a huge deal to me.
93,7,"'A lot of people think tarot cards are scams. They are really good at detecting rape. The government is a big part of it and is trying to evade the government's money, and not the people. This whole thing is a scam.''"
93,9,"I would never buy a tarot deck unless you bought a tarot deck based on a tarot deck. I wouldn't play the tarot deck unless it was actually a tarot deck and I haven't tried it. I would just try and read the entire deck - what you describe would be one of the most helpful ones, or it would make me feel so much more secure about buying something."
93,23,The article makes it sound like the government is trying to evade the government's money. The government is a big part of it. They're scammers. The tarot is a scam. There's no stigma to the fact that it's fake. There is a huge stigma to the fact that it's a scam. The tarot is a scam. The government is a big part of it. The government is a big part of it.
93,26,I don't get the full story here but the tarot card is pretty effective. It isn't just about the card.
93,28,"IANAL. I think the best way to take it is to read the ""Wants"" in a tarot deck. It's definitely a scam. The tarot and the government are actually scammers. The tarot is a scam. The tarot and the government is a big part of it. They're scammers. The tarot and the government are actually scammers."
93,30,i am also afraid to eat weed
93,31,"(, ') a lot of people who think tarot cards are scams."
93,46,i’m a lawyer
93,59,"I think the best way to take it is to read the ""Wants"" in a tarot deck. I'm not sure why you guys are coming here but it's good to see."
93,61,"I think if it was the best thing to do in America, the best thing to do would be to use the deck and make it clear that the people are scamming the government."
93,77,"I'm more interested in the idea of tarot, so I'm wondering if I should try it before I go on a long list of scams."
93,82,"What you say is true. Some of them may be scams. I'm not an attorney, but the tarot card is one of the few things I think is a scam."
93,89,The people who use them are scammers.
99,93,"So, the article says that people have the same problem with the title?"
93,7,"CANNOTANSWER - ""...A lot of people think tarot cards are scams. They are really good at detecting rape. The government is a big part of it and is trying to evade the government's money, and not the people. This whole thing is a scam.''"
93,9,I'm a lawyer and I feel like a lawyer.
93,23,"I have to admit, I was a little intimidated by this post... I wasn’t trying to come off as a jerk about what I read but I didn’t feel confident enough in my tarot deck to admit that I didn’t know that the tarot deck was a scam. I think this post is actually very good."
93,26,It's a scam. They're scammers. They're scammers.
93,28,"You're not a lawyer, but you're in a big part of this."
93,30,"So, as the title suggests, the person is talking about a scam because he has the idea that the government is a big part of the conspiracy to get tarot cards so people will get the idea that tarot is a scam."
93,31,I'm gonna be the one to tell you that if I play tarot decks I want to be the one to play them.
93,46,"So, how does the title of the article work?"
93,59,I am not a lawyer. I am a lawyer.
93,61,I would call the police. [I don't want to say they're scamming us](http://www.tarotcards.com/e/tarot-card-scam)
93,77,"...I think the best way to take it is to read the ""Wants"" in a tarot deck. I'm not sure what the article is saying."
93,82,The tarot is a scam because the people who use it use it. The government is a big part of it. They're scammers.
93,89,"... ""They are scammers."""
99,93,"The tarot is a card that says ""If you are a scammer, you are a fraudster."" The tarot is a tarot deck. ""At first I thought a card was a scam. But a lot of people say that it's a fake."" Is there a particular version of a tarot deck you're looking for?"
93,7,"I am not sure what the OP means by'scam'. If you believe in something you know they are a scam. But if you don't believe them you are a scammer. 'I can be a scammer and i can be a fraudster, but i can be a fraudster. ''The way to get a job in society.''''"
93,9,"This is a very long story and it's very hard to imagine the underlying reality behind the tarot. There are a lot of people that think the tarot is a scam and want to use it to stop the spread of the virus, but you can't believe they're selling fake tarot cards on the internet."
93,23,If they're scams...they're not a scam.
93,26,I think we should start with one thing: I don't like to read too many tarot cards.
93,28,"Why don't you just get out of the game and take a chance on the ""real"" tarot decks? This is not ""the one"" thing."
93,30,"I'm a lawyer and have a lot of advice, but this is not the right place to start."
93,31,"The best tarot card I've seen is ""The Axe of the Sword: Getting Away."" It's definitely a scam. They are scammers. The tarot and the government is a big part of it. They're scammers. The tarot is a tarot deck."
93,46,"CANNOTANSWER - ""[[[It’s not a scam. It’s a scam. It’s a scam. They’re scammers. The government is a big part of it. They’re scammers."
93,59,"I want to say, I feel a little 'a little bit'' of the first few lines of your comment about the other side of the sentence."
93,61,CANNOTANSWER -
93,77,"IANAL: ""A lot of the tarot tarot cards are really good at detecting rape. The government is a big part of it and is trying to evade the government's money, and not the people. This whole thing is a scam."
93,82,I see no reason why this is not a scam.
93,89,I think the person who is describing the tarot is probably being misleading.
99,93,That's a lot of cliches. It's a joke that can be interpreted to mean something stupid and not necessarily an aphorism. It's a really fucking awful story. A fool would be a scammer if he knew a piece of tarot he was going to say was something similar.
