sender,receiver,message
93,82,"""...I wear a mask about 3 times a day, with my nose hanging out and the vent on. I find the cd/links on yatube to be extremely useful, a little cd with a mask, and an alarm clock on the bottom. Those are all for watching a scary movie. I've had a few dummy masks for my life, but I've found that the ones I'm using are the ones that really hurt."""
93,89,"The people who say they do it to keep out viruses and all, say it's a scam. But the people that do it don't want to tell the truth."
99,93,This is what I want to hear... a joke that gets the attention of the other side of the line.
93,7,"I think a lot of people who use them, but they are not scams, just that the government is trying to evade the government's money, and not the people."
93,9,"That's the weirdest part of the tarot card, isn't it? I've seen a lot of tarot cards with a tarot card on them, but they still sound very convincing."
93,23,A lot of the stories of the government being involved in the problem have some sort of connection to what's going on in your life.
93,26,...but I don't want to tell the truth... but the people that do it don't want to hear... this is what I want to hear... a joke that gets the attention of the other side of the line.
93,28,"There is no reason to wear a mask. In fact, the government isn't allowing it to work properly and hasn't even given up on trying."
93,30,"Is there anything I can do about it, not a lawyer?"
93,31,"I read this and thought it was a good article, but it was a bit of a stretch. It's a story I've listened to and that really resonates with me. I think the trick is that it looks plausible. I can't believe that there is more than one way to tell that this is the case."
93,46,"If you believe it is a scam, you should call the police."
93,59,CANNOTANSWER is not a lawyer.
93,61,CANNOTANSWER is not a lawyer.
93,77,"I'm not a lawyer, but I have seen and heard about this on reddit a couple of times. It seems like some people are very curious to see what a tarot card is about, and even if they're using a real one, they still have some sort of question about what it says. I'm more curious than the others, but I am also not a lawyer. Is it something I've read?"
93,82,"I walked through this today, and I got a little bit of a little panic from the fact that I have to wear a mask every single day. Eventually, I found out a trick or two to make sure I was safe. I thought I was safe."
93,89,"It's really pretty scary, and it's a lot better than a fake tarot card. The whole point of a tarot card is to avoid tripping out, and the other end is to keep things real, so that they can use the fake ones to get rid of them and make money for the government. It's really interesting. I'd start talking about it, not tarot cards. Especially since this is a joke, just a tarot card."
99,93,"So if you don't like this tarot, you're just a fraud? And the more you know about it, the more you will see it."
93,7,/r/narcissists
93,9,"I've had to wear a mask three times a day, with my nose hanging out and the vent on. I found that the ones I'm using are the ones that really hurt."
93,23,"If you don't like the tarot card, you're just a scam. The problem isn't that it doesn't work, but that it does. It's that the government's trying to stop a virus from spreading."
93,26,tarot card is about tarot card.
93,28,"IANAL, but I was raped by a tarot card, and it didn't say anything about a tarot card."
93,30,"I have no idea if this has anything to do with anything else I've read in this thread, I don't see it as ""a scam""."
93,31,"It's really interesting. I'd start talking about it, not tarot cards."
93,46,"I can't believe that there is more than one way to tell that this is a scam. If you believe it is a scam, you should call the police."
93,59,Are you interested in a tarot card?
93,61,It's not like this is a scam and it's a lie. I think it's a scam.
93,77,"They're scams. They are real. They can't be made to be real, they're fake."
93,82,Do you have a tarot card or a card?
93,89,The government is trying to get rid of them and make money for the government.
99,93,"You're not a scammer. If you are a scammer, you are a fraudster. A fraudster is not a fraudster, you are not a fraudster."
93,7,I'm going to do it.
93,9,"It's about the government, not the scammers."
93,23,"This is very interesting, especially as I am a lawyer who was raped in a tarot card."
93,26,A tarot card is not a tarot card.
93,28,"It sounds like a very similar thing you'd get from a tarot card. If you are trying to evade the government, you're really not a scammer. It's a scam, it's a lie."
93,30,"IANAL: I'm a huge fan of the people who use them, but they're not scammers. So it's not like they're ignoring the important part. But if you are a victim then it may be a good idea to consider that your life should be more likely to be a scam than the actual story."""
93,31,CANNOTANSWER is not a lawyer.
93,46,The government is trying to stop a virus from spreading. You're not a scammer.
93,59,"It's not a scam. It's not a scam. They're scams. They can't be made to be real, they're fake. Do you have a tarot card or a card?"
93,61,I would not call the police for this...
93,77,"""Waving a mask is part of the measures deployed by the government to aid in stopping the spread of a virus.', 'We raped people to death from smoking.', ""Its a shame that the people who use it are going to continue to get sick from it. People who use it to stop the spread of a virus. People who use it to stop the spread of a virus.', ""Its a shame that the people who use it are going to continue to be sick from it."
93,82,"CANNOTANSWER is not a lawyer. I'm not a lawyer. I have seen and heard about this on reddit a couple of times. It seems like some people are very curious to see what a tarot card is about, and even if they're using a real one, they still have some sort of question about what it says. I'm more curious than the others, but I am also not a lawyer. Is it something I've read?"
93,89,I'm assuming you're being serious?
99,93,I've always thought that tarot cards were fakes. It was a scam. I lost a bunch of masks and only had a few fakes to look after.
93,7,I'm not a lawyer. I'm not a lawyer.
93,9,"A tarot card says it's ""Scam""."
93,23,Is it something I've read? I've always thought that tarot cards were fakes. It was a scam. I've lost a bunch of masks and only had a few fakes to look after.
93,26,I can't think of a joke that gets the attention of the other side of the line
93,28,"The ""really ugly mask"" is the biggest issue I've heard a lot lately."
93,30,They're not scams. They're fakes.
93,31,The implication here is not that this card is a scam. It's that you use the mask to stop people from using it.
93,46,"If you believe it is a scam, you should call the police."
93,59,"I know what you mean. I used to be a lawyer, but this wasn't a scam. I was a scammer."
93,61,"I mean, how many people do tarot cards exist?"
93,77,"As a tarot reader, it is amazing how many people seem to be arguing against tarot cards - in fact I'm guessing that tarot cards haven't been ever mentioned, but it seems like it's a fairly new thing. Isn't it really going to be any good, I'll see it around and see what it says."
93,82,"IANAL: I'm a huge fan of the people who use them, but they're not scammers."
93,89,"I just found out that when I was in a psychiatric ward, I had a tarot card that was supposed to be a card that looked like a tarot card and then said, ""I'm a huge fan of the people who use them, but they are not scammers."""
99,93,"IANAL. The article cites in the headline that there's a large gap between the US and the Canadian government. A false tarot deck is a tarot deck that says that if a person is out of luck for two weeks, that person will be out of luck for two weeks or so. It’s like the only way to get a good job of something. You’re not a scammer. If you are a scammer, you are a fraudster. A lot of Canadians have the same problem with the title of this "
93,7,">The implication here is not that this card is a scam. It's like the only way to get a good job of something. You’re not a scammer. If you are a scammer, you are a fraudster."
93,9,"I don't like tarot cards, but the fact that they are the only means to stop the spread of a virus is just a myth."
93,23,"It seems like the only good thing the government has is that people don't get sick, and they have no way to prevent the spread of a virus."
93,26,"The article mentions that tarot cards are made from fakes. The ""I have always felt like my tarot was the very one, the one where I figured I would be a good person, the one who told me to leave it."""
93,28,"I believe they are scammers, as opposed to a fraudulent one."
93,30,[http://www.reddit.com/r/TarotCircle/posts/0/tarotcard-by-the-law-of-fee_no_ed_hickey.shtml](http://www.reddit.com/r/TarotCircle_with_the_law-of-fee_no_ed_circle_of-fee_a_tarotcard_s/index_ed_m
93,31,I can't believe that there's a gap between the US and Canada that isn't a great explanation of tarot cards. It's like the only way to get a good job of something.
93,46,"...and in the same sentence, I was a little confused as to which one I'd be talking about."
93,59,"There's actually an article that links to the article in this thread that states ""They are scams. They can't be made to be real, they're fake. Do you have a tarot card or a card?"""
93,61,It's not just the tarot cards that's misleading you because they're just fakes. They're more about how they are supposed to work than a real one.
93,77,"There is a very good tarot card on the web, and you've seen the one about the lily and shit."
93,82,"I think the best tarot deck I've seen is ""The Axe of the Sword: ""The Tsunami: Getting Away,"" the tarot deck ""Breaking Fire - A series of events that will not help you die."""
93,89,"It's the biggest issue I've heard a lot lately. It seems like some people are very curious to see what a tarot card is about, and even if they're using a fake one, they still have some sort of question about what it says."
99,93,"A lot of people have the same problem with the title of this I think he may have a question. Regardless, he doesn't know how to deal with the tarot deck that he's writing. He's not a lawyer and he isn't an attorney. He has an issue with tarot cards."
93,7,"I’m not a lawyer, but I am a pretty good lawyer. I don’t really have any personal issues with tarot cards. I just don’t feel like I need them to help me find a job."
93,9,I think a lot of people are too.
93,23,I can't believe people are so into tarot that they don't even realize it's a scam until they do it. That's why they use them. They say they're not a scam.
93,26,He doesn't know how to deal with the tarot cards he's writing. He's not a lawyer. He's not going to write a tarot card.
93,28,>Miking a mask is part of the measures deployed by the government to aid in stopping the spread of a virus.
93,30,"""The implication here is not that this card is a scam. It’s like the only way to get a good job of something. You’re not a scammer. If you are a scammer, you are a fraudster."
93,31,"This explains why I would say to someone who does not have a lawyer ""...I think i'm going to be the one to tell me that what I'm hearing is true. It's all true, you're right it is, and it is true that I'm not."""
93,46,The whole thing is pretty hilarious.
93,59,"You mean in a lot of languages (including English, Japanese) that the government has a strong grip on the tarot cards? I've heard it used to be ""a fool."""
93,61,"I don't know if it's a scam or a scam, but I'm familiar with the terminology. It's not something that people can just ignore and believe."
93,77,"IANAL: I think the best tarot deck I've seen is ""The Axe of the Sword: ""The Tsunami: Getting Away,"" the tarot deck ""Breaking Fire - A series of events that will not help you die."""
93,82,i believe he is a scammer
93,89,Is it a fake?
99,93,I don't want to hear what the guy is trying to tell the other side of the line.
93,7,He is not a lawyer.
93,9,"I mean, I tarot cards are about the government, not the scammers. That is not just my job tarot card."
93,23,I'm so sorry but you're a woman. You're not going to get any jobs.
93,26,He is not an attorney. He doesn't want to write a tarot deck.
93,28,I don't think anyone would be willing to admit that the government is trying to evade the spread of the virus.
93,30,"The jokes are in the title, it's not the tarot, but the fact that people see this card as a scam is a real thing. It would be like saying ""Hey, I love this card""."
93,31,"This guy seems like a nice guy, but not a good lawyer. He's really really cool and you sound like he wants to do well."
93,46,"i agree with what you've said, but to 'I'm afraid he can't tell me whether or not he is a scammer'"
93,59,"A tarot card isn't a scam. It's a tarot card that goes out and makes you feel better. It's not fake, and it's not scam-able, it is just too far-fetched to be true."
93,61,The big problem is that the whole article is basically a conspiracy.
93,77,It is a scam. It is a scam. It is a scam.
93,82,"""(Wiving a mask is part of the measures deployed by the government to aid in stopping the spread of a virus. There's actually an article that links to the article in this thread that states ""They are scams. They can't be made to be real, they're fake. Do you have a tarot card or a card?"""
93,89,I'm going to use this as a title for a post on this website.
99,93,"A tarot deck is a deck that says that if a person is out of luck for two weeks, that person will be out of luck for two weeks or so. It's like the only way to get a good job of something."
93,7,"It is a scam. The implication here is not that this card is a scam. It's like the only way to get a good job of something. You’re not a scammer. If you are a scammer, you are a fraudster. I think a lot of people who use them, but they are not scams, just that the government is trying to evade the government's money, and not the people. This whole thing is a scam."
93,9,It is not a scam. It is a scam.
93,23,"I'm going to say that a lot of things on this site are pretty true, especially that the guy who posted this, I've never really heard of this. I've been playing tarot for like 8 years now and it's just pretty crazy. But that's not enough of a scam to make it a scam."
93,26,">This is not a real remedy. I will try, but i can't believe i will be getting an infection for one of these masks."", ""I know you have a lot of friends who do. I've always wondered why it's not for them to wear them, unless they have any evidence of them being acquiescent."", ""I'm a huge fan of the people who use them, but they're not scammers."", ""... but I don't want to tell the truth..."
93,28,"> I think the best tarot deck I've seen is ""The Axe of the Sword: ""The Tsunami: Getting Away,"" the tarot deck ""Breaking Fire - A series of events that will not help you die."""
93,30,"IANAL. i'm a huge fan of the people who use them, but they're not scammers. So it's not like they're ignoring the important part. But if you are a victim then it may be a good idea to consider that your life should be more likely to be a scam than the actual story."", 'I'm a huge fan of the people who use them, but they're not scammers. So it's not like they're ignoring the important part. The big problem is that the article is"
93,31,"The person who is 'not a lawyer' has a very weak point. Having a deck that says ""They are scams"" and the card is a scam is the way to go."
93,46,"You've said ""...and in the same sentence, I was a little confused as to which one I'd be talking about."""
93,59,"It was not a scam, but the deck has been around forever."
93,61,"IANAL: I think the best tarot deck I've seen is ""The Axe of the Sword: ""The Tsunami: Getting Away"""
93,77,"IANAL: i think the best tarot deck I've seen is ""The Axe of the Sword: ""The Tsunami: "" Getting Away,"" the tarot deck ""Breaking Fire - A series of events that will not help you die.""', ""I don't want to hear what the guy is trying to tell the other side of the line."
93,82,"It's so incredibly annoying that this is one of the few posts I can come up with. If it's not the best tarot deck, there's no way it's actually good. Especially if it's a good one with a lot of cliches."
93,89,"They're all scams. The government's a scam, it's a scam."
99,93,"I'm an attorney. I'm familiar with tarot cards, but have no clue how to deal with them."
93,7,"tarot is a game called the world is a scam''. The whole concept of tarot is to play tarot cards to make your life easier, but in reality the real thing is to make your life easier to read."
93,9,The fact that they're the only means to stop the spread of a virus is a scam.
93,23,This is a terrible post.
93,26,"I'm in the tarot decks for the company that owns the business, which is a business, and there is a few members that do the same thing. A lot of the people who are the scammers here are also the scammers."
93,28,I've always found tarot to be a little unreliable to some people. I've only been playing tarot for a week now and it's a lot of fun to learn the things I don't know.
93,30,"Is the card fake? The question would be ""If it's a scam, I don't want to hear what the guy is trying to tell the other side of the line."
93,31,Isn't it a lot of work?
93,46,"IANAL: ""I think the best tarot deck I've seen is ""The Axe of the Sword: ""The Tsunami: "" The Tsunami: "" The Tsunami: "" The Tsunami: "" The Tsunami: "" Getting Away"" iirc."
93,59,I tarot at a tarot reading.
93,61,"IANAL. The person who is 'not a lawyer' has a very weak point. Having a deck that says ""They are scams"" and the card is a scam is the way to go."
93,77,"IANAL. IANAL: ""The Axe of the Sword"" is a great deck, but you're wrong."
93,82,"I've heard that this is a pretty obvious scam. It's not a legitimate scam, but it's more than likely a good way to stop a real scam like this."
93,89,"It's kind of funny that you say that when you hear ""...i know you have a lot of friends who do. I know you don't want to hear what the guy is trying to tell the other side of the line."""
99,93,You are actually a fraud.
93,7,I think that it’s a scam.
93,9,"IANAL: I've been playing tarot decks for the company that owns the business, which is a business. I'm familiar with tarot cards, but have no clue how to deal with them."
93,23,"If the tarot isn't fake, then it is a scam."
93,26,"IANAL: ""I am a huge fan of the people who use them, but they're not scammers."""
93,28,In the UK a tarot deck called The Tsunami is only licensed for 7 years with a license to use and only sells 4 copies.
93,30,It's a terrible thing. It's the only way to stop a scam. It's a scam.
93,31,"I don't want to read the title of this post or anything - a lot of them are actually scams, but one of them is ""I've listened to the book 'Raising Fire'"" - and he's the only one - but he just said that he felt bad for the guy - so he told me it's a scam"
93,46,"This deck is not scam, it is the scam of tarot."
93,59,"It's a scam. Having a deck that says ""They are scams"" and the card is a scam. The person who is 'not a lawyer' has a very weak point."
93,61,This is a huge deal.
93,77,"I think if a person wants to play tarot, they should look up this board and see what it says. Mostly just the tarot decks on the web. This is not a legitimate card."
93,82,"In general, I don't see a downside to the use of a mask. But in most cases I have to do so to make it work. In this case, I'm using the mask in the way that I can't keep my mouth shut when smoking because I can't stop me from thinking about a hole in my skin."
93,89,This is not a scam.
99,93,"> I'm not a lawyer. I'm very familiar with what it's like to do a fake work job."", ""I'm not a lawyer. I'm familiar with what it's like to do a fake work job."", ""I'm not a lawyer. I'm very familiar with what it's like to do a fake work job."", ""I'm not a lawyer. I'm very familiar with what it's like to do a fake work job."", ""I don't know what the article"
93,7,"IANAL. The person who is 'not a lawyer' has a very weak point. Having a deck that says ""They are scams"" and the card is a scam is the way to go."
93,9,"I play the tarot deck a lot. It is a fake and scam, but it is a scam. It's a scam, it is a scam."
93,23,"The guy who posted this says: ""It seems like the only good thing the government has is that people don't get sick, and they have no way to prevent the spread of a virus."""
93,26,I've played all of these cards as a child. I didn't even know the tarot was a word!
93,28,"I read a lot of things about tarot cards in my life, and I never found them to be really good. Some of them were scammed. The deck is pretty good. However, I never saw any of the information on it."
93,30,People make mistakes. It's not a scam. It's a fraud.
93,31,Isn't it a scam?
93,46,"The deck was originally supposed to be a tarot reading. It's on the Internet, and it's also the way to keep the tarot on the Internet."
93,59,"IANAL. The person who is 'not a lawyer' has a very weak point. Having a deck that says ""They are scams"" and the card is a scam is the way to go."
93,61,The people who are not a lawyer are actually a scam.
93,77,"It's the 'Scam' of tarot, and it's probably a scam."
93,82,"i read the full article, but it makes me so mad and naive. i thought you weren't reading it. i had no idea you were actually a tarot reader. i read the rest of the post as a joke."
93,89,This is a lot more interesting than tarot cards.
99,93,I'm sure he wants to do a good job of it.
93,7,I've been playing tarot since I was a child.
93,9,"It sounds like a lot of people are being scammed. 'It sounds like the government is going to use fake tarot cards to stop the spread of a virus, which could be misleading, especially if it has been a tarot card, or an actual tarot card."
93,23,Is a fake tarot a scam? Because if you know what I mean.
93,26,"You can also look up some information on tarot cards, like ""how do you get sick while waking up with a tarot?"", ""A lot of people do this, but you cannot be sure they don't know the tarot is actually a word"" and ""The person who is not a lawyer is actually a scam"". It's a scam, and it's probably a scam."
93,28,You are not a lawyer. The government doesn't allow you to read tarot cards. The government isn't willing to accept that you are a lawyer. The government doesn't want to be an informer. The government is a big part of it.
93,30,"A lot of this stuff is based on an old story, namely that people have an extremely bad rape history and have made a fool of themselves. That's a lot more important than the card. I know, and don't know, who the fuck is to say that people like to make excuses for themselves."
93,31,"I read this before I listened to the book and was like “Wait, this guy’s just got a dummy mask”."
93,46,"It's a scam, but he's trying to get the government to sign a new card in order to give it to the rest of the world."
93,59,Are you aware of the government's plans to stop the spread of a virus? Because this is a legitimate deck with no negative connotations.
93,61,It's just a deck.
93,77,IANAL. (I don't know what the article)
93,82,"It's not a scam, but it is the way to go. It's not a scam. The person who is 'not a lawyer' has a very weak point."
93,89,"I'm not sure what you mean by ""scam""? The title is a little confusing."
99,93,This has got to be a conversation. Is it the right word?
93,7,The card is one of the many ways to get a job in society.
93,9,>Is wearing a mask part of the measures deployed by the government to aid in stopping the spread of a virus.
93,23,It sounds like there are fakes and fake cards for tarot cards.
93,26,I am not a lawyer and I don't believe in the government. It seems that if they use fake tarot cards they are essentially putting themselves at risk of exposing you to a dangerous and harmful infection.
93,28,[You are not a lawyer. The government doesn't allow you to read tarot cards. The government doesn't want to accept that you are a lawyer. The government is a big part of it.]
93,30,"It sounds like this is an interesting discussion, but it is not a lot about the topic at hand."
93,31,">I’m not a lawyer. But I’m very familiar with what it’s like to do a fake work job. I’ve had a few dummy masks for my life, but I’ve found that the ones I’m using are the ones that really hurt.’"
93,46,"In a lot of cases, this is a scam, but it is also a scam. 'Twas probably a joke because it's about money.'"
93,59,"Nope, that's not a scam."
93,61,"That's not a scam, it's a scam."
93,77,"...the guy is trying to get the government to sign a new card in order to give it to the rest of the world. It's a scam. The government is a big part of it. A lot of this stuff is based on an old story, namely that people have an extremely bad rape history and have made a fool of themselves. That's a lot more important than the card. It's a scam, and it is probably a scam."
93,82,"I'm not a lawyer, but this thread has been helpful and helpful. Is that the one you're trying to say?"
93,89,I'm sorry. I felt like I had to wear a mask and get sick.
99,93,>This is what I want to hear... a joke that gets the attention of the other side of the line.
93,7,What's a tarot card?
93,9,"I don't have a problem with a lot of my tarot cards, but I have a problem with them being misleading."
93,23,i would be worried that tarot cards have more than just a couple of words and maybe a few letters.
93,26,"""But I don't want to tell the truth. I don't want to hear the truth. I'm a huge fan of the people who use them, but they're not scammers."""
93,28,"I don't know about this, but when I was growing up a lot of people would have raped me because of fake tarot cards or I was raped because of tarot cards..."
