sender,receiver,message
2,1,this month i personally know people that have gotten covid one of them past away this week please wear a mask
6,1,took my first flight in months for a work trip everyone wore a mask everyone was respectful of other people reminds you not all people suck most but not all
7,1,as someone who was there this weekend who lives in a conservative county in california the residents of texas where kind respectful and upheld mask ordinance better than mins of being back in california please let s not turn our backs on people who need help
11,1,those who want to protect themselves from getting sick have every right to masks keep you more safe than no mask in tight settings everyone has the right to do whatever they want now at their discretion
13,1,a special shout out goes to mr londono and ms latorre we loved the teachable moment of mask wearing and addressing covid questions also a very happy birthday to our vebbulldog jamya
18,1,hey i just saw you are running miles across florida right now curious if you would share what is the route im in orlando and would love to come run with you even if just for a mile i d wear a mask and keep distance
33,1,hr sent out an email saying those of us who s fully vaxxed w proof can go maskless again in the office yea i m good i m still wearing my mask
41,1,wholeheartedly agree in the last weeks i have had a friend lose his mom to covid and other friend hospitalize with it yesterday i have quit talking to family who insist they don t believe superspreader events happen in churches and people have a right to not wear a mask
52,1,"Trump said it's ok not to wear mask, and Ingraham said it's restricting our rights to keep us locked inside! You know our right to die and infect (kill) others. Why isn't Ms. Ingraham out there with them."
53,1,i love coaching however if one official or admin address me about our players not wearing a mask or wearing it properly under a helmet i will resign and not coach until this nonsense stops
61,1,oh you dont like wearing your mask maroon has been having a hard time breathing since but no one wants to talk about that
64,1,I lose a mask at least four times a day. This whole thing is a scam.
78,1,I lose a mask at least four times a day. This whole thing is a scam.
82,1,oh you dont like wearing your mask maroon has been having a hard time breathing since but no one wants to talk about that
95,1,i love coaching however if one official or admin address me about our players not wearing a mask or wearing it properly under a helmet i will resign and not coach until this nonsense stops
2,1,Wearing a mask is part of the measures deployed by the government to aid in stopping the spread of a virus. This month i personally know people that have gotten covid one of them past away this week please wear a mask took my first flight in months for a work trip everyone wore a mask everyone was respectful of other people reminds you not all people suck most but not all i m wearing a mask outside while vaccinated because people like you are in my face
6,1,"It's ok for you to do it, and it's completely acceptable to you not to do it. However, I'm going to snoop on twitch - it's still really ridiculous to not wear a mask. Seeing that a mask on you doesn't protect you from viruses like people wearing masks on their flights can't protect you from a virus."
7,1,>I love coaching however if one official or admin address me about our players not wearing a mask or wearing it properly under a helmet i will resign and not coach until this nonsense stops
11,1,Wearing a mask is part of the measures deployed by the government to aid in stopping the spread of a virus.
13,1,"i do a lot of social distancing, but i do need a mask and a helmet"
18,1,"i've never seen an event with a mask, its just not for me. the issue with me is that there are only three things that you have to wear. i ve tried to walk ten feet for about a month and lost none, and it still has no effect on me. my mom always asks why i have a mask."
33,1,Wearing a mask is part of the measures deployed by the government to aid in stopping the spread of a virus.
41,1,Wearing a mask is part of the measures deployed by the government to aid in stopping the spread of a virus.Wholeheartedly agree in the last weeks i have had a friend lose his mom to covid and other friend hospitalize with it yesterday i have quit talking to family who insist they don't believe superspreader events happen in churches and people have a right to not wear a mask wholeheartedly
52,1,"I just want to say that wearing a mask is part of the measures deployed by the government to aid in stopping the spread of a virus.Trump said it's ok not to wear mask, and Ingraham said it's restricting our rights to keep us locked inside! You know our right to die and infect (kill) others. Why isn't Ms. Ingraham out there with them."
53,1,And yet he resigns the team.
61,1,Putting on a mask to walk ten feet through a restaraunt and then taking it off when i get to my table is one of the dumbest things things i ve ever done in my entire life and i ve done a lot of dumb things I lose a mask at least four times a day.
64,1,Wearing a mask is part of the measures deployed by the government to aid in stopping the spread of a virus.I lose a mask at least four times a day. This whole thing is a scam. I lose a mask at least four times a day. This whole thing is a scam. I lose a mask at least four times a day. This whole thing is a scam. I lose a mask at least four times a day. This whole thing is a scam. I lose a mask at least four times a day. This whole thing is 
78,1,I lose a mask at least four times a day. This whole thing is a scam. I lose a mask at least four times a day. This whole thing is a scam.
82,1,"Oops, forgot that. Oops."
95,1,The reason I got my first helmet was because I was looking for my next coach to be on a ice box.
2,1,Wearing a mask is part of the measures deployed by the government to aid in stopping the spread of a virus.putting on a mask to walk ten feet through a restaraunt and then taking it off when i get to my table is one of the dumbest things things i ve ever done in my entire life and i ve done a lot of dumb things I lose a mask at least four times a day. This whole thing is a scam. I lose a mask at least four times a day.
6,1,I believe this story is going to be the last tidbit on a show I'm going to be watching.
7,1,"We have a lot of people that have been here for a while with a mask or a mask. But no, i think they have one of the best helmets."
11,1,You are absolutely correct. It's the same as just using a mask. It doesn't require a mask at all. It doesn't need a mask at all.
13,1,This is the biggest scam I've heard so far. The thing about using a mask is that it's a way of hiding viruses from the public.
18,1,">I'm wearing a mask, but I'm not sure if it's a valid reason for wearing a mask. Is the fact that you said to a friend, that you'd love to be a coach with them and not with the players are the dumbest things in the world? That's ridiculous."
33,1,"What is a virus?... The government has a whole bunch of ways to stop it. They are working on the mask and not the vaccine, which is what it is."
41,1,I'm glad it's been written in the right language.
52,1,"It sounds like the most important part of what the president is trying to do is to help prevent the spread of the virus. You don't know if that's the correct answer, but it sounds like he's the worst person to ever have to deal with it."
53,1,My friends were all gonna be a coach on the team that would not resign unless he was wearing a helmet or just getting his own one because he was resigned because the other team couldn't get a proper helmet.
61,1,It's the government's way of stopping the spread of a virus.
64,1,I eat so much shit.
78,1,What a horrible thing to say.
82,1,"I'm a very large American. My ancestors are a small family and I always assumed they were an orphan and a diseased child. That's how my dad's ancestors met a little girl I dated. So she grew up in the u.s. and that ovaries and ah, that sucks, but that's how my dad met a guy I used to fuck. I'm still a big fan of him a few years older. The fact he's not even "
95,1,I'm gonna go on and on.
2,1,The President doesn't know anything about the virus so we don't know.
6,1,I'm not sure about this but the article in question is pretty damn confusing.
7,1,">But no, I think they have one of the best helmets. I live in Texas and that's just my experience. It was a'scam', not a joke. Are you sure you don't want to work? You should get a fucking mask in order to get a job. I’ve been doing a bunch of things that I know nothing about."
11,1,OP is talking about a riot in Florida. A man with a booster can have to wear a mask. Why would you want to be in a riot when you don't have a mask at your party?
13,1,I was one of the first people to know what is in my mouth that is 'why is this so important for me'...
18,1,">[I'm wearing a mask, but I'm not sure if it's a valid reason for wearing a mask."
33,1,"As an official vaccine deterrent, they are essentially enabling you to get to the point that you need it (and that's a prank), and the vaccine isn't."
41,1,"The ""my man who got the virus"" book by Robert F. Devine is about how masks are used to stop the spread of a virus. Wearing a mask is part of the measures deployed by the government to aid in stopping the spread of a virus. I'd rather that the people who wear masks do not get paid to do it. So they just call people a team, and if they don't do something wrong they are a team? Wearing a mask is part of the measures deployed by the government to aid in stopping the spread of a virus."
52,1,What I'm assuming is that wearing a mask is part of what the president is trying to do to help prevent the spread of the virus.
53,1,r/education_and_teasers/r/shocks/r/nhlvs_23_09_16_26_2_18_0____________________________________________________
61,1,Putting on a mask to walk ten feet through a restaraunt and then taking it off when i get to my table is one of the dumbest things things I've ever done in my entire life and i ve done a lot of dumb things I lose a mask at least four times a day.
64,1,"So, you're saying, it doesn't help, it just helps prevent people from dying. You're telling the truth, it does, and it helps prevent people from dying, because if you don't have a mask, you won't die. I think the biggest problem isn't how long it's been in use. There's no reason to wear a mask if there are more people there than on the job. There's no reason to wear a mask if there are more people there than on the job."
78,1,"So you lose your mask to get in, and get sick, and then they're sick again. You'll be a jerk if you put on a mask and you don't do anything to stop it. What are you doing?"
82,1,>I'm not sure if it's a valid reason for wearing a mask
95,1,The government is supposed to have this. It's what they do.
2,1,"The truth is that Vaccinations are a serious disease, and prevent it from spreading in public."
6,1,Well it is an arbitrary and very common thing to do in a society and people who are not vaccinated are just as likely to be exposed.
7,1,"I'm a fan of the idea of wearing a mask. If I want to be more like someone who has a cough, I can use a mask. I want them to do something they don't want to do. That’s why I’ve been doing a bunch of things that I know nothing about.... The government has to take steps to prevent these types of accidents, including getting a vaccinated person into contact with a virus. I think the biggest problem isn’t how long it’s been in use. There’s no reason to wear "
11,1,"It is a problem of the government, right? If they don't know what it's supposed to protect, then there are no rules."
13,1,I am not a doctor. I am not a doctor. I am not a doctor. I am not a doctor.
18,1,"Apparently, the government is working on something similar. It's not really like we had to use that kind of legislation to prevent a virus from spreading in America."
33,1,"I'm going to say that as far as a vaccine going, the government is doing a lot of work trying to stop and disassociate those with a virus from getting to their nipples. The other point is that a mask is a very good thing for the public."
41,1,">I'd rather that the people who wear masks do not get paid to do it. So they just call people a team, and if they don't do something wrong they are a team? Wearing a mask is part of the measures deployed by the government to aid in stopping the spread of a virus."
52,1,"If it is illegal for a doctor to make you sick, it is a good idea to wear a mask for a while, and for the time being they don't have to take a hysterical shitjob in the process."
53,1,"sex is bad & you shouldn't wear a mask and you should be very nervous about getting spooked. if someone puts a mask on and yells at me and tells me ""I'm just an asshole""...then i'll say ""I am just a little bit of an asshole."""
61,1,I'm a doctor.
64,1,"I'm from Australia and my first mask was ripped off. It was not supposed to do anything. It should only do it to prevent the spread of a virus. I had it and only wore it once a day, only after I started using it. I lost the ability to get on the internet at 12:59 PM."
78,1,"I mean, it's not that I lost my mask. But it did take me a bit longer to get back on my feet, which is why I don't wear my mask, and I had to go somewhere different. It was a pain in the ass for me, but now I have it. I don't wear it often enough to know if it's a problem or not."
82,1,I am very sick of people 'having a bad time' with their children when they have been vaccinated. I love wearing my mask but it's a horrible thing to do. My parents have not vaccinated me yet so I've only seen it for a few years. It's just an excuse.
95,1,">The man who got the virus was the only one. There is no real excuse for the government not doing anything that would make you feel safe, especially not the one that you want to help, but that's just the way it is. I don't think the government is the best at protecting the people, but it's kind of like ""The government has made up a story of what happened. I've been smothered in some of this nonsense for over a decade. I can't even imagine what a joke it is."
2,1,"I know it's a little sad, but I want to know why a bunch of people in this sub haven't taken the time to read the whole article. I have no idea where you're getting the whole concept of vaccines, and I don't really see why. The whole idea is pretty ridiculous. It's all I've ever heard of a medical professional stating a doctor's job is to be on top of a hat in order to save my life, because he's also got a very large hat. That's all I"
6,1,A lot of the government policies for people not vaccinated are nonsense and ridiculous. They're supposed to do the same. I feel like people who were vaccinated were just trying to get sick because they didn't know what vaccinations were.
7,1,">The best thing a parent can do when the sick kid isn't vaccinated is wear a mask. In the first place, it's because it is the one's that are supposed to be kept at the hospital. But when you put it on, you'll know if it's a scam."
11,1,''Applications of the mask'' isn't necessarily a fact.
13,1,It's an amazing system of a mask that is designed to prevent the spread of many virus infections in humans.
18,1,"In a world of medical technology, there's no excuse to put on masks. If a person is in public, they need to be careful, but it's hard to make a choice."
33,1,"I love that they don't actually use hats in the military. In fact, they don't apply them as a defense mechanism. They simply tell people to put on hats and it's a prank."
41,1,"A lot of people don't really believe it. A lot of people are a bit dickish, and I don't think the government really cares much."
52,1,... that's the joke.
53,1,A dick in the ass is just that. A mask is supposed to protect the players from a virus. A dick in the ass is just that. A mask is supposed to protect the players from the virus.
61,1,"It sounds like the whole government is not interested in the issue, but more of a joke."
64,1,>I've heard that wearing a mask helps prevent the spread of a virus. What's your problem with a tshirt if you don't have one? No.
78,1,Why don't you just leave it in a plastic bag? It's not like you have to take the time to put on a mask or leave it on?
82,1,"I want you to know that if you get vaccinated you may want to know the facts and you can be honest, the best way to get vaccinated is to get vaccinated before you have a child."
95,1,">The man who got the virus was the only one. There is no real excuse for the government not doing anything that would make you feel safe, especially not the one that you want to help, but that's just the way it is. I think the government is the best at protecting the people, but it's kind of like ""The government has made up a story of what happened. I've been smothered in some of this nonsense for over a decade. I can't even imagine what a joke it is."
2,1,">The President doesn't know anything about the virus so we don't know., ""The truth is that Vaccinations are a serious disease, and prevent it from spreading in public."
6,1,They are telling this to the hivemind and everyone else. They need to do this so a bit of the public doesn't have to worry about them.
7,1,">the best thing a parent can do when the sick kid isn't vaccinated is wear a mask. In the first place, it's because it is the one's that are supposed to be kept at the hospital. But when you put it on, you'll know if it's a scam."
11,1,"Why should a guy with a booster need a mask when he can't smother a virus in his life? That is not legal, I think it's not legal."
13,1,What's the difference between a tarot card and a fake tarot card? It's an amazing system of a mask that is designed to prevent the spread of many virus infections in humans.
18,1,The second sentence made me genuinely laugh.
33,1,[NAME] is a troll.
41,1,It is an excellent thing to ask a doctor or a lawyer. I can't help you see the link but I feel like this is a good place to start.
52,1,Why is this joke so old?
53,1,>But what about those pranks and rumors of the virus? Thats a good point.
61,1,"""It sounds like the whole government is not interested in the issue, but more of a joke."""
64,1,"A mask helps prevent the spread of a virus, and the same thing as a mask helps prevent people from dying."
78,1,"I know what you're getting at, but not all of it."
82,1,"Vaccination is the quickest and simplest way to treat AIDS, in my opinion. It doesn't require a doctor's opinion on your child's health, e.g. your child is at risk of developing AIDS, or you are having a hard time breathing, or you are a prick."
95,1,This is one of the things that keeps me going. My coach is always giving me jokes about how the government is trying to prevent a problem that he's been smothered by.
2,1,The tarot card is a great thing to have around. A lot of people would be a little more inclined to wear a mask to do something that may not be necessary for the actual CDC vaccine and just have it on for a moment to go.
6,1,[NAME] [NAME] [NAME] [NAME] [NAME] [NAME] [NAME] [NAME] [NAME] [NAME] [NAME] [NAME] [NAME] [NAME] [NAME] [NAME] [NAME] [NAME] [NAME] [NAME] [NAME] [NAME] [NAME] [NAME] [NAME] [NAME] [NAME] [NAME] [NAME] [NAME] [NAME]
7,1,"Why is this being sarcastic? It's like saying, 'Oh god, the government isn't defending you, because we aren't going to keep you from getting your own fucked up mask on'."
11,1,"I'd suggest you go to the drugstore and see if anyone is coming in and ask what you think. Honestly, I'd recommend a mask."
13,1,"i'm a doctor and i am a doctor, it isn't that complicated."
18,1,"I don't think any of this should be funny or funny, but it's just a prank."
33,1,"It's an extremely dangerous thing, and it's a prank. It's a bad joke, and it's not good."
41,1,"The first thing you need to know is that, if it were me, I would tell people to fuck up. And if he's not comfortable with a helmet or using a mask, he will be screened. That's an absolute garbage comment. People are fucking a bunch of people."
52,1,Obama endorsed a vaccine in a crowded congressional seat.
53,1,It is really not a prank. I don't know much about the subject but it's just one part of it that is a lot of jokes and pranks in general.
61,1,"I am not an attorney. I am an attorney. I can not make a judgement call unless my attorney was right. i am an attorney, but it's not a choice."
64,1,"I think this is a little bit like a piece of shit, the CDC are trying to get someone to have the money for them to voluntarily go into the hospital and if it does the trick, the insurance companies will make a false claim."
78,1,"It's not really a joke. It's all a matter of what you say. I don't want to sound like a dumb, but it's true."
82,1,It's part of the measures deployed by the CDC to aid in stopping the spread of a virus.This is not a scumbag thing to say.
95,1,I like the joke: [NAME] [NAME] [NAME] [NAME] [NAME] [NAME] [NAME] [NAME] [NAME] [NAME] [NAME] [NAME] [NAME] [NAME] [NAME] [NAME] [NAME] [NAME] [NAME] [NAME] [NAME] [NAME] [NAME] [NAME] [NAME] [NAME] [NAME] [NAME] [NAME] [NAME] [N
2,1,"It has a lot to do with the people... but the fact that you are saying it isn't a scam, a fraud, and the fact that you are a troll is a huge red flag."
6,1,I wore a mask on my flight and that was on my last day of work.
7,1,"I mean I mean, they are getting a lot of pranks on the gov't. We've only been around it a few years. The people I worked with don't wear masks because they don't want to be in contact with people who are not vaccinated, and because they don't want to get sick."
11,1,I'm sorry but it's not legal to take a person to a riot.
13,1,"""The thing about using a mask is that it's a way of hiding viruses from the public."""
18,1,'What are you doing with this mask?'
33,1,What's the troll in the article?
41,1,As a former hospitalist I would say they're making a lot of money selling the “shrugs” so the government is essentially giving away information to keep the people safe and not to interfere with the health of the people.
52,1,"I think this is one of the things people have been saying in their post about the president, and that they have no need for him to use it."
53,1,"I mean, it's an interesting topic, but I don't really have a lot of facts to draw from here."
61,1,People seem to like the idea that if the government didn't do something to stop the spread of a virus then they would have to get away with the work.
64,1,"""If I had a mask I’d wear a helmet in the morning or in the morning and see a doctor if I got an infection. I don’t wear a mask. Then I’d just go to the doctor and say something like, “Wow, you have a mask!” He was a troll. AIDS and the same thing as HIV/AIDS are very different things. A mask is a very common virus, it helps prevent the spread of an illness, and a mask helps prevent people from dying."
78,1,"In my country we have a lot of different types of masks. Some of them are sex mascots, some are clones of the skin and others are resembling the skin of an animal, and others are similar."
82,1,"I have never read any tarot cards, so I know it's in this thread. I don't know where it came from, but in my experience, if you have any questions about a tarot card, you can try to explain it to someone else."
95,1,[NAME] [NAME] [NAME] [NAME] [NAME] [NAME] [NAME] [NAME] [NAME] [NAME] [NAME] [NAME] [NAME] [NAME] [NAME] [NAME] [NAME] [NAME] [NAME] [NAME] [NAME] [NAME] [NAME] [NAME] [NAME] [NAME] [NAME] [NAME] [NAME]
2,1,"There is a LOT of conspiracy theorists out there who believe that the government is trying to control the spread of AIDS, so they need to find out how to stall the spread of this disease."
6,1,It's not a big deal. It's illegal.
7,1,"People in Texas are incredibly stupid - they get sick and get sick from a helmet and a mask. The problem is that even if the CDC were a scam, they have a government agency that would just do things like this and take it seriously. They don't want to deal with the issue, they just want to make sure it's something that doesn't happen."
11,1,"CANNOTANSWER: ""You have the right to wear a mask. It doesn't help if you're a military veteran, but it will save the lives of someone who is trying to stop the spread of a virus. I think you're being sarcastic. I think they really figured it out."""
13,1,"The government has been ad-free for years, and people are now saying that it isn't helping with HIV prevention."
18,1,My mom was the one to tell me I wasn't comfortable wearing a mask. I didn't understand why she didn't realize that I was wearing a mask! She thought putting a mask on was pretty pathetic but she didn't want it for her own safety. I told her that her husband was wrong and she said that she had a mask so she could have someone else run for her. She was being forced to do the same thing despite being told this was her job and that I would never let her putting on a mask. She would just have to do with it
33,1,a troll. what's the troll in the article?
41,1,"I'm a doctor. I don't understand a lot of the jokes, but I also think the 'hive mind' is just a silly way of looking at it. It's a joke, but the story is interesting."
52,1,The word mask is actually an extremely misleading term.
53,1,This isn't really a prank.
61,1,"They're funny, if you're looking for a job."
64,1,AIDS is not the same thing as HIV. They're the same thing and have a lot of similarities to the viruses. A lot of different things. A lot of different things. A lot of different things. A lot of different things.
78,1,"Why not just stick to the rule of thumb, as the truth of a story doesn't seem to be so bad as to get downvoted?"
82,1,I was in the process of buying the tarot cards.
