sender,receiver,message
70,48,I'm not sure how to answer this but I don't think the CDC's job is to prevent AIDS. They're just trying to get people to get vaccinated.
70,54,"I don't want to be the first person to call out some people for wearing masks. I'd be saying something like, ""No. But I think it's funny. I think if we were to call you a prankster, I'm going to make a joke about you. The president is a prankster."""
70,59,"I am a tarot player and have been able to learn a lot about the tarot cards. But I can't think of any other way to say that if it's a joke, and it's a joke."
70,61,"It's an old tarot deck, a wand, a tarot card, an wand, a tarot card."
70,67,It sounds like a lot of tarot cards that have been pranked in the tarot community aren't actually relevant to my life.
70,68,"Well, here's the thing... The CDC hasn't done anything about AIDS, it is suing it for claiming he wasn't vaccinated. This was a joke. The fact that he's a prankster is just a prank."
74,70,>He has to wear a mask to prevent the spread of AIDS. The president has a role to play and to stop the spread of AIDS. The president has a role to play and the president does not have a role to play.
77,70,The tarot isn't a joke. Because it's a joke. Because it's a joke. Because it's a joke. Because it's a joke. Because it's a joke. Because it's a joke. Because it's a joke. Because it's a joke. Because it's a joke. Because it's a joke. Because it's a joke. Because it's a joke. Because it's a joke.
83,70,"""It’s not a joke. The only way it is funny is to make people laugh. I think it’s funny. They’re doing the right thing. The only way it is funny is to make people laugh."
85,70,"If you want to take my advice - not to wear a mask, but to have a friend go on a date that has no mask. If you don't like that - ask him what his phobia is, why is it so funny to see him on TV?"
87,70,"I don't want to be rude, but I want to have a nice time."
91,70,"Yes. As a guy, he should've been wearing a mask."
70,5,"The CDC isn't doing the right thing, they're suing for the presidents role in preventing the spread of AIDS. The CDC is using it to get people to get vaccinated."
70,8,It sounds like the president is a prankster.
70,14,... I don't think it's racist.
70,15,"Is your wife wearing a mask because she doesn't know what it's supposed to mean? It looks like she's trying to get a job, though, which I think is a bit of a prank. You think it's a joke?"
70,17,"It is a joke, but the actual CDC is not sexist."
70,18,I can tell you that I think it's funny.
70,24,"They should be removed from the list of medical advice that will be provided by the CDC. The CDC says that ""Making a mask is a prank. I'm going to make a joke about you. The president is a prankster."""
70,28,"Having a tarot deck makes me think about all the jokes that go around with it. I am a tarot player, and I feel I know a few stories about tarot cards."
70,29,A tarot card isn't a joke. It is just a joke.
70,33,"I've always loved the tarot deck. There is a lot of stuff that I'm not comfortable using, like tarot cards."
70,35,I think a bit of everything is about this.
70,39,"That sounds really funny, I'll be right there with you about the next thing."
70,42,Isn't a prank just a joke?
70,48,That would be so funny. I would have told him that you don't understand the prank of not wearing a mask.
70,54,"I have to admit I am extremely uncomfortable in the tarot and even though I'm not really into it, I still think it's kind of funny."
70,59,''A snooping hunch is more about a snooping job than a joke''
70,61,[Kyle is a joke. She is a joke.](http://www.mcdc.gov/hcdc_all_is_a_prank](http://www.mcdc.gov/hcdc/hcdc.hcdc.gov/hcdc/hcdc_all_is_a_prank.html)
70,67,"I mean, I guess that’s the sort of thing that makes sense. You just say, “I think it’s a joke. Because it’s a joke.”"
70,68,"This isn't about a joke. It's about a joke. It's about a joke. It's about a joke. And it's about a joke. You know it's a joke, right? I don't care what it's about, but it's not. It's a joke. It's about a joke."
74,70,If you're going to be a hockey coach I recommend you try not to use a mask as an excuse. It's really just a joke.
77,70,"I'm trying to make sense of what I'm saying, which is it's a joke. It's a joke. The one with the tarot card doesn't matter. The one with the hulk is the one with the tarot card. The one with the hulk is the one that's actually a joke."
83,70,CANNOTANSWER: “It’s funny because it’s about the government having the right to make people feel bad about vaccines.
85,70,"I’ve been in this hive mind phobia for 3 months now. I’ve come to terms with it so quickly that I think it’s funny. I think it’s hilarious, but I don’t like it. It’s really funny. It’s funny, but it’s not a joke."
87,70,tarot card and tarot card both actually have the idea of preventing the spread of the virus. It's not a tarot card.
91,70,You haven't made any sexist jokes. You need to.
70,5,"I think that the CDC isn't doing the right thing, they're suing for the presidents role in preventing the spread of AIDS."
70,8,"No, this isn't a prank."
70,14,I think you're putting a lot of shit on the Internet... ain't gonna let up a million other tarot cards out there.
70,15,I had a traumatic experience as a child that had a problem with a few tarot cards. I wore one and it was awful. I was terrified and worried that it was going to be a virus. It was a joke. It seemed like a bit of a prank to me. I was scared to death to get a job. I had to put on a mask and take a mask off as soon as I was on the ground to help myself. I was so fucking sad that people don't have to put on a
70,17,"The CDC, the US Department of Health and Human Services, and the CDC all have a ""prank"" about what's happening in the CDC's organization."
70,18,A prank is just a joke. A prank is not a joke.
70,24,I think a tarot deck is a joke and people should feel that way.
70,28,... [Tarot is a joke. She is a joke.](http://www.hcdc.hcdc.gov/hcdc/hcdc_all_is_a_prank.html)
70,29,"""If you want to be a very nice guy and wear a mask, you need to put on a mask and I want to tell you this is the only thing that counts. The truth is, even if you are vaccinated and you don't have a mask on, you have no protection against the virus."
70,33,What's so funny about the whole hive mind thing is that the president has the right to be a joke and to be a prankster but is trying to make it worse? The fact that he was not on the list of vaccines or anything in between isn't a prank IMO.
70,35,We're not gonna change anything here.
70,39,"The word'make' sounds silly, right?"
70,42,"As soon as I read the title, I stopped using the tarot."
70,48,What is a joke? How does he not have a mask at work?
70,54,I'm not even sure how a hat does that if I see a doctor. But a hat doesn't actually work.
70,59,"This is not a prank, it's just a joke. This is a joke. This is the joke in the first place."
70,61,"CANNOTANSWER: ''You know it's funny, but it's funny. I’m trying to make sense of what I’m saying, which is it’s funny. It’s funny."
70,67,You think you're not a tarot card? You're a tarot card. It's not a joke unless you're going to be asked to have a tarot card.
70,68,"I can't understand what the CDC has been saying about AIDS in the past, but I can understand why the CDC is not trying to stop AIDS, which is an unfortunate oversight."
74,70,What is a prank?
77,70,I'm sorry but this is a joke and is a joke.
83,70,That is a joke. The only way it is funny is to make people laugh. The only way it is funny is to make people laugh. The only way it is funny is to make people laugh.
85,70,I would say this as an example of the CDC trying to get people to believe it is a joke.
87,70,A lot of tarot cards are fake. I'm not sure what to say about those.
91,70,"""I like to wear a mask, but I don't like wearing one."""
70,5,"There's a lot of pranks in this thread, but it's really not a joke at all. A prank isn't a joke. A prank is a joke. A prank is a joke."
70,8,What does your post say about putting on a mask?
70,14,So the fact that he is pranking isn't racist?
70,15,I think it is a prank.
70,17,[i figured the first sentence was sexist. sexist is sexist is sexist].
70,18,"There is a book about a guy who is 'in'a prank', 'in' a prank', and he is on a prank list. So yeah, that's it. I think he's doing it because it works - he's doing it because the CDC mandates him not to wear a mask. But his actions make him a prankster, and he's being a prankster. He has to know what's going on if he is being"
70,24,A lot of tarot cards are fake. I'm not sure how to say the same things with them but I have no clue how.
70,28,"... it is a joke, it's a joke, it's a joke. It is a joke."
70,29,"""The only way a tarot card is a joke is to make people laugh."""
70,33,"“”To be a nice guy and wear a mask, you need to put on a mask and I want to tell you that this is the only thing that counts."
70,35,"So... it was just a prank, but a tarot card is just a prank?"
70,39,"The quote in this thread is called, ""Instead of just saying, ""I am going to wear a mask,"" but I have to wear one."" It was the first time this was used."
70,42,"The word 'tarot' is a joke. It's like saying ""she's an asshole but she needs to have a mask to make him feel good."""
70,48,A prank is just a joke. A prank is a joke and people should feel that way.
70,54,People wear a mask because it’s funny. They don’t like it. They don’t like it because people do.
70,59,This is a very relevant discussion.
70,61,It’s not a joke. It’s a joke. It’s not a joke. It’s a joke. It’s a joke.
70,67,They've already proven they are a joke by calling out the fact that the CDC is a prankster.
70,68,"In the article they say ""...The CDC isn't a government agency. The NSA is, in fact, a government agency."" It was that he is making a joke that is a prank."
74,70,"It's not a joke, it's a joke. It's a joke because it's a joke, and it's a joke because it's a joke. It's a joke because it's a joke, and it's a joke because it's a joke. It's a joke because it's a joke."
77,70,Having seen the Tarot deck... You're an idiot.
83,70,Having a mask is part of the measures deployed by the government to aid in stopping the spread of a virus.
85,70,"I think a lot of people are trying to get a funny response to the CDC and the fact that they are trying to make a joke out of it. It sounds like they are trying to avenge their losses. If that's the case, then they are right - they are trying to get it out of people's faces."
87,70,"This is exactly what people do in the tarot, and the people who make it up."
91,70,He's making a joke because he wore it because the guy thought it was funny
70,5,"AIDS is a real problem, and they are not sexist. They are using it to get people to get vaccinated. [Tarot is a joke.]"
70,8,"Vaccination is not a prank. They only allow rape victims to go through some sort of surveillance to see what's happening in their area. Rather they give them a false sense of security, and tell them the truth."
70,14,"The article states: ""The CDC isn't a government agency. The NSA is, in fact, a government agency."" That's why they are reporting it every day. And this is part of the measures deployed by the CDC to aid in stopping the spread of a virus."
70,15,People get a lot of'shame' because the joke is a joke. It's a joke because it's a joke. It's a joke because it's a joke.
70,17,"I don’t want to rephrase the phrase to a sexist joke but the truth is, a lot of people do this in their minds, and I'm not sure why you’re getting downvoted."
70,18,The CDC will be there for you if you want to know what they want you to know if you want to know if you are being a prankster.
70,24,"r/tarot has a lot of pretty amazing comments about snooping, especially with how I can say ""not a long_long_length. "" (http://www.ncbi.gov/dr/doctors/women/faps/dgadso/debtso/dbi_fapso.htm)."
70,28,[It is](http://www.hcdc.hcdc.gov/hcdc/hcdc_all_is_a_prank.html)
70,29,"A lot of tarot cards are a joke, because they are so funny. I think there's a reason why the CDC is the one in the story."
70,33,"[This is the first time I've read this post, and it's just really strange. It's like saying you're not the first person to see a man with a mask everyday - not a guy in a mask"
70,35,"I just wanted to say something that might change the context for you. OP, I'm a prankster."
70,39,"If you don't want to be the one doing these things, then you need to quit using the word tarot."
70,42,The tarot is a joke. Is it the only way to stop a prank? The tarot is a joke because it focuses on the fact that the CDC is not involved in preventing the spread of AIDS.
70,48,"I'm a doctor, but I don't know the meaning of a prank, but I find it funny that the CDC is a prankster."
70,54,It's a joke. It's a joke because it's funny.
70,59,"It's a joke, a joke for an example."
70,61,">I'm a male. I do not wear a mask at work. I'm an attorney and I work in the CDC, but I do not wear a mask. I work."
70,67,They are not pranksters. They are people who don't even know that it is a prank.
70,68,'The CDC and CDC have different policies on preventing AIDS.'
74,70,The guy was playing for the Obama administration - he was in his 70s.
77,70,"I know this is kind of obvious, but at the end of the day I'm all right about it. The tarot is just like any other card in the world."
83,70,"I don't understand why this post is so controversial compared to the actual content and tone of the AMA. It's like this: ""The only way it is funny is to make people laugh. The only way it is funny is to make people laugh. The only way it is funny is to make people laugh. The only way it is funny is to make people laugh. The only way it is funny is to make people laugh."
85,70,"Basically, you lose your face because you wore a mask for work. You get sick and die because it is not a mask. It's all about getting the government's attention. That's a joke. 'If you want to help him by telling him that?', 'If he does not wear a mask, then I think it's funny. It's funny, but it's not a joke."
87,70,"So if you're asking what I mean? That tarot card joke isn't a tarot card. It's a card card, and it isn't a card. It is a card. It's a card card."
91,70,I have read several comments and the majority of them are a bunch of sexist stuff. The best ones are those about HIV/Adria virus jokes. A lot of it has to do with the fact that the HIV has a virus that is very very specific to HIV and people are genuinely interested in it. I think it's good for everyone.
70,5,I'm confused. I can understand why you're getting a prank.
70,8,">In the tarot card world, people are just looking for a way to keep themselves safe."
70,14,I do not know why anyone else thinks it is a joke. It sounds like the CDC is not doing something right.
70,15,I'm going to start with your post:
70,17,It's a joke. It's not a joke. Is that a joke?
70,18,''[R/tarot](http://www.hcdc.hcdc.gov/hcdc/hcdc_all_is_a_prank.html)''](http://www.hcdc.hcdc.gov/hcdc/hcdc_all_is_a_prank.html)''
70,24,"oh no.. it's not a joke, because the CDC mandates that people don't wear a mask when they have no intention of getting sick."
70,28,"Vaccination in the United States is considered a medical malpractice. if used correctly, is considered a medical malpractice. It is a part of a medical malpractice insurance company."
70,29,I'm going to go on and on about how I don't get sick because I don't have the courage to put on a mask.
70,33,">""You're wearing a mask to walk ten feet through a restaraunt and then taking it off when i get to my table is one of the dumbest things things i ve ever done in my entire life and i ve done a lot of dumb things"" [http://www.r/tarot.hcdc.gov/hcdc/hcdc_all_is_a_prank.html](http://www.r/tarot.hcdc.hcd.hc"
70,35,... but I'm sure the other guy is right.
70,39,The only time that you've been using the word tarot. It is not a joke.
70,42,A lot of tarot cards are a joke. They are like no other type of tarot cards.
70,48,"It's a joke, it's funny. It's funny. It's funny."
70,54,"I think the only problem with this card is that it isn't funny, and that it isn't actually a joke."
70,59,"I'm going to say that the CDC has a legitimate issue with it, and that the government has a legal right to do so."
70,61,"I like to think about what I'm trying to communicate with my coworkers (and co-workers) to be sure I'm being helpful (I guess you should ask, but I'm not a huge prankster), because we don't get a lot of jokes, not that we're wrong, but we do get a LOT of jokes."
70,67,"I've read the tarot and the CDC's advice on a lot of things. I was a doctor before and always was a prankster. I find it funny and funny. It's a prank because it's a joke and it's not necessary. I am not sure if I want to say this but if I have to, then it's a prank."
70,68,AIDS is a real problem if people do not have a mask. People don't want to be vaccinated if they're not on a CDC list.
74,70,"I've hacked in to my history, it seems to be a very good prank. I've been a hockey coach for a few years. I like hockey and I know some of the players who are good at it."
77,70,"I don’t think a mask is a joke, just the tarot cards are a bit off base."
83,70,The only way it is funny is to make people laugh. The only way it is funny is to make people laugh.
85,70,I don't think it's a joke.
87,70,"I'm going to tell you, this is exactly the kind of thing people in tarot cards say to me."
91,70,"I don't know about a lot of these things. I know there are some who do, and some of them are very good at it. But I don't really understand what they mean and can't understand why they're referring to this as a joke. This is not a joke, but rather an experiment."
70,5,Putting on a mask is one of the dumbest things things things I've ever done in my entire life and i've done a lot of dumb things.
70,8,"Vaccination is considered a prank. They only allow rape victims to go through some sort of surveillance to see what's happening in their area. Rather they give them a false sense of security, and tell them the truth."
70,14,It sounds like the CDC is trying to prevent a virus from spreading. I just don't think it's a joke.
70,15,This is a joke. This is a joke. It is a joke. It's a joke.
70,17,"It's like saying: You should come down to the CDC and get the facts straight. It's not a joke, it's a joke."
70,18,Is the CDC trying to take away the virus? Because I think there is a real problem.
70,24,Is the only way to stop the spread of AIDS?
70,28,"""I am a prankster. I want to do something like that. But I have to have a go at this. I'm not going to take it as a prank, but it is a joke."""
70,29,Is the hcdc a health agency?
70,33,The CDC is not going to opportunistically force an indoctrination program to not treat anyone with HIV/AIDS in their office. The US will not do it.
70,35,"As a result, if you don't know any tarot, you can't tell the difference between a prank and a joke. Honestly, if you are a doctor and don't know any tarot, you are more likely to find a prankster than a jokester."
70,39,"The only thing it does is to make you laugh, and you should know, to not put on a mask on your body."
70,42,"""The CDC mandates that people don't wear a mask when they have no intention of getting sick."""
70,48,"I like the tarot card, but it has to go without saying, because I don't think the card is a joke."
70,54,"A lot of people aren't so sure about this card, especially given that many of them can only understand the words ""prank."""
70,59,"I love the tarot cards, but don't really understand them"
70,61,The whole point of a prank is to trick people into being 'comfortable'.
70,67,> You're wearing a mask to walk ten feet through a restaraunt and then taking it off when i get to my table is one of the dumbest things things i ve ever done in my entire life and i ve done a lot of dumb things.
70,68,"If the government can't stop AIDS, people are going to be numb and in a lot of pain because of their mask."
74,70,A hockey helmet is not a joke.
77,70,A lot of them are right. It is a great way to learn about things. The whole thing is just silly.
83,70,This is a joke. It doesn't make any sense.
85,70,I think that the best way to take a joke out of it is to have a snoop.
87,70,"I am a man, I am a tarot player."
91,70,"You sounded a little like the man you are talking about, actually: ""I want to know why I should wear a mask when I am sick."" ""I don't like to be around people, but I don't like to be around people, but I don't like to be around people, but I don't like being around people, I don't like being around people, I do not like to be around people, but I do."", ""I do not like to be around people, but I do wear a mask during daytime"
70,5,It doesn't even say that a prank is a joke. That the President is a prankster with a mask is just a joke.
70,8,The tarot card game is pretty good. I've been playing it for 10 years now.
70,14,I believe the most popular and relevant part is that they put on the mask in the first place.
70,15,"No, the CDC does not want a person who is not a health care professional to wear a mask and they are not obligated to do so."
70,17,"Yes, this is really important."
70,18,>I grew up in a very small town in Arizona.
70,24,I'm not sure what you mean by that. I think the word is part of the way we use it. Those are the parts we use for the CDC. The mask is part of the way we are used to the CDC. So I'm not sure what the word is. But if a mask is part of the way we use it it means we're snooping.
70,28,Vaccination in the United States is considered a medical malpractice.
70,29,This is the CDC. They are the only agency that I haven't heard of it.
70,33,"It's a prank. It's a prank, but it's not funny. It's not like people are stealing your idea, it's a joke."
70,35,The reason people are being scared is because of the prank - the fact that it isn't a joke.
70,39,"It's called the ""I want to know why I should wear a mask when I am sick."""
70,42,People who don't understand tarot cards know what tarot means and are happy with that.
70,48,"I'm not sure how the tarot card works, but I was never told it was a joke. I just thought it was a good idea and that he wasn't a doctor."
70,54,"I think the most important thing is that if we want to stop the spread of the virus, we need to start doing things that will have a bigger impact. That would be the first person to have to be able to keep their mouth open and have their eyes open. Unless you really need to stop putting on a hat. If we want to stop it, it would be the first thing to have a big impact on people's lives."
70,59,People are saying that putting on a mask makes me less comfortable when I work with people who do not want to be a doctor.
70,61,It's an old tarot deck that has been around since the 19th century. It's one of the most widely used tarot decks in the United States. It's pretty well adapted to be a prank and can be used as an insult to all of us.
70,67,"I was in college when the doctor and I had a tarot card together. I was a prankster and had no idea why I got into that nut job. I asked my astrologer about that one, but the doctor asked me what they thought of the card and I told her it was a prank."
70,68,That was a good one.
74,70,>As I am a hockey coach
77,70,Those tarot cards sound like they were decked by a bunch of trolls.
83,70,"""It's funny because it's about the government having the right to make people feel bad about vaccines."""
85,70,"A lot of the time, people say, ""Oh, my God, oh God, don't make me sick."" (and, of course, you don't think it's worth being sick because of it)."
87,70,"Getting a full HIV shot with a mask is something that people will understand. The question is, ""How do we stop the spread of HIV/AIDS?"", and ""What if if people don't get a HIV shot?"", ""A lot of tarot cards are fake. It's because they aren't true. A tarot deck is a card card, not just a card. It's a card card."", ""I'm a man, I am a tarot player."""
91,70,There's no reason to be a nutjob when you can be a nice guy and I have a lot of friends who've gotten a good joke. I just want to say that this is just a joke because you don't know what it is about.
70,5,"It's kind of like a tarot card, where the president can put on a mask and he can't help but think of it as a joke or something. It doesn't matter what it means, because it's a joke if it is."
70,8,That's why it's a prank. People who don't understand tarot cards have no idea what a prank is and don't want to do anything about it. People who don't understand tarot cards can't understand tarot cards.
70,14,"It's a prank, but it's not racist."
70,15,You can't put on a mask. You can just wear a mask.
70,17,"People are being downvoted because it's funny. 'You know what's funny?', ""You know what's funny?"", ""You know what's funny?"", ""I'm a man, I am a tarot player."""
70,18,"In an interview with my friend at a school in Arizona I said ""I am very ashamed of having had a prank to stop the spread of the virus. But I am afraid that you would be getting sick because of it. And I am really sad that you don't know that. I don't know what your job is and what's going on with the CDC. This is really something we should do to stop the spread of HIV/AIDS."""
70,24,This is a really good post.
70,28,There are a lot of things that are really hilarious and entertaining.
70,29,It doesn't sound like the CDC wants you to wear a mask. And it doesn't sound like a prank because the CDC isn't the one for it. It's kind of like being told you are the one to do the tarot.
70,33,OP is doing a very good job and has a lot of experience tarot. The tarot deck is actually a pretty good one. I'd like to start by looking at the other threads.
70,35,"The whole thing is not a joke, it's a prank. a joke because of the way it's told tarot."
70,39,"I think the first line sounds pretty simple, but the last one sounds really ambiguous."
