sender,receiver,message
93,30,"Yes! They are scams, and the money is worth it. A very fake card and they are a scam. The first shit I see to the government is actually a scam. So, when i hear the word ""scam"" I think of it as ""a scam"". It's like saying that ""if I have a very high IQ I will do a job and I'm not getting a job."""
93,31,"I'm not a lawyer but I’m sure there are many people out there who think a mask is a scam because it’s really weird and sexist and isn’t a good idea to do. There are no real answers here, but just things that might be confusing to you."
93,46,"If you think it is a scam, then you should call the police."
93,59,"No, it's a scam. It's a scam. It's a scam. It's not a scam. The government is a big part of it. A lot of this stuff is based on an old story, namely that people have an extremely bad rape history and have made a fool of themselves. That's a lot more important than the card. It's a scam. The government is a big part of it."
93,61,I thought this was a great story and not an actual scam.
93,77,I think the issue that's most important to you is not about the deck itself.
93,82,>I am not a lawyer.
93,89,It is a joke and a scam.
99,93,A guy in Canada said he lost a mask and lost a lot of his tarot cards.
93,7,"In other words, you're just gonna make yourself look like a fraud."
93,9,"I mean, it's a good thing that we have a few tarot cards."
93,23,Yes. A lot of people like to say that their tarot cards are fakes. But I have a problem with them being misleading and a lot of them aren't real.
93,26,"I don't really know a lot about the tarot, but I have heard that a person is raped in a tarot deck by a tarot reader. They probably have no idea what a tarot is about and what's up with that."
93,28,"You're not a lawyer, but you're a bit of an idiot. I'm sure you should be concerned about the security of the tarot decks you have seen. They're not gonna stop people from doing it. You'll probably find some problems with tarot cards like this, if your defense team and he or she don't believe you then you won't have any problems at all. You don't need a mask. It's a scam."
93,30,...The guy is trying to get the government to sign a new card in order to give it to the rest of the world. It's a scam.
93,31,CANNOTANSWER is not a lawyer.
93,46,They're not scams either.
93,59,"The same can be said for any number of things, including the card. It's a deck that goes out and makes you feel better. It's not fake. But it's also scam and it's a scam. The government is a big part of it."
93,61,The most popular and effective deck is the tarot deck he had on his tarot deck.
93,77,A guy in Canada said he lost a mask and lost a lot of his tarot cards.
93,82,"It seems like this is the kind of thing where ""if you have a very high IQ I will do a job and I'm not getting a job."" Is it a scam, or a scam?"
93,89,"There's a lot of scams that aren't based on fact. In a lot of cases, a deck is based on a very popular theory. There's just a lot of weird and sexist stuff out there."
99,93,>I lost a mask about five times a day.
93,7,The card is the most popular and effective way to get a job in society.
93,9,"I've played the tarot decks all the time, and not really played any of them - just a few, but not quite all. The most popular and effective deck is the tarot deck. A guy in Canada said he lost a mask and lost a lot of his tarot cards."
93,23,I... I really don't understand what you're getting at.
93,26,"I guess you don't want to tell the truth, but I do want to know why you're going to write something like this, just to get out to the world."
93,28,"It's the first thing that comes to mind when rereading it. I'd say if you're serious, you probably won't want to reread it."
93,30,I’m so sorry you are going through this.
93,31,That was my comment to the OP.
93,46,"I have seen all the decks, and I am terrified that I will be raped."
93,59,">Little blue ones are totally useless.Even the best don't work very well.Exhale smoke while wearing a mask and you will see the leakage. It's frightening how dumb they think all of is are."", ""[I think the worst of those lies are fucked up and made up..](http://en.wikipedia.org/wiki/Persona_Cracked_Through_Attorney_Card/Tarot_Cracked_Through_Persona_Cracked_S"
93,61,There's a lot of scams that aren't based on facts.
93,77,The guy is trying to get the government to sign a new card in order to give it to the rest of the world. It's a scam. The government is a big part of it.
93,82,I'm a lawyer.
93,89,"I’m sorry you’re having to read that. I’m a big fan of the people who use them, but they are not scammers."
99,93,"You've never been to a tarot table, or seen the tarot deck. You're being used as a joke. There is no reason to be a tarot deck."
93,7,- the tarot card is the most popular and effective way to get a job in society.
93,9,What a strange thing to write. I can't imagine how much that person is trying to convince anyone that she is being raped by a fake tarot deck.
93,23,A lot of people like to say that their tarot cards are fakes. But I have a problem with them being misleading and a lot of them aren't real.
93,26,"I've read a lot of tarot decks, and this is a good example of a deck being used as a joke. The government is a big part of it. It's a lot of scams that aren't based on facts. The most popular and effective deck is the tarot deck. A guy in Canada said he lost a mask and lost a lot of his tarot cards. It seems like this is the kind of thing where ""if you have a lot of tarot decks, you"
93,28,I can imagine how they are manipulating the system so that the government has no right to revoke the license of the card.
93,30,"If you have not already, you may have already read this. It's not a scam. The implication of it is, you can't stop it, so it's not a scam."
93,31,"I'm a fan of the deck that goes out and gets me mad, and I'm afraid it's a scam. It's not just the people who play it. It's that they are making fun of people who play it."
93,46,"I'd like to know more about the deck: ""The deck is the most popular and effective way to get a job in society."
93,59,"I think the best way to take it is to read the ""Wants"" in a tarot deck."
93,61,"This is not legal advice, this is just a skewed opinion. They are trying to get to the bottom of their own head, because they believe their cards are a scam, and then they're going to get a new one based on that."
93,77,"If you like the tarot deck you should check out The Tarot card from my life and get used to seeing the tarot cards. It's a very interesting question, and one that everyone has a lot of great questions about."
93,82,>A guy in Canada said he lost a mask and lost a lot of his tarot cards.
93,89,I'm a lawyer and I know a lot of people who do it and don't want to know the truth.
99,93,"In fact, the same comment was written about the tarot card being used as a joke for a joke about a scam. I guess it's a cliche but I've read all the stuff from a lot of other people that are similar, ranging from the type that shambles to a ""I lost a mask about five times a day. I lost a mask about five times a day"" (Which is not actually a cliche), but it's a scam and a scam to make money off of"
93,7,i don't understand that you haven't read the full article - a'scam' is just a word.
93,9,[the first thing you need to learn about this is that your card is used as a fake by a lot of people to get in and see it. It is a scam and a cliche to make money off of.
93,23,''Mom'' is not a tarot card. She's a tarot.
93,26,I read your comment and this is not a scam. I don't think a tarot card is worth it. This is not a scam. This is a scam.
93,28,"TLDR: ""This is an example of a scam. The government is a big part of it. Honestly, if the government is trying to evade the spread of a virus, its not a scam. It’s a scam, and it’s not working."""
93,30,"They can't make the card work because it is fake, it's a scam."
93,31,This is a good one! It's going to be interesting.
93,46,That was a really good list.
93,59,"""I feel like I had to wear it to a scary movie a few times. I'm sorry. But I didn't get sick from a mask. I'm afraid of the idea that you can not wear a mask."","
93,61,"“The deck is not a scam, it's a scam. The government is a big part of it."
93,77,"I'm a lot of people in my city, and I know a lot of people who read tarot cards on the internet."
93,82,"It's a scam to make money from the tarot deck. Honestly, I'd say you're not going to be a lawyer unless you're a lawyer."
93,89,So how would you say it’s a scam?
99,93,"“When I’m on my way, I don’t have a problem with my mask, but I can’t deal with it. So I don’t know what to do with my mask, because I don’t know what the right word is,”"
93,7,[Measure that I don’t know how to talk to people](http://www.narcissists.org/) I’m not a lawyer and I’m not a lawyer.
93,9,"I see what you are saying, but is it a joke or a cliche? It's not a good idea to use fake tarot cards to stop the spread of a virus?"
93,23,That tarot card is a scam. And that's just how people do it.
93,26,"As much as I like tarot, I like how it's not about the deck. I think it's about what it is about."
93,28,">“I read a lot of things about the people who use them, but they are not scammers. It's not a scam. The government is a big part of it."
93,30,"It's pretty clear in this post that it isn't a scam, and that the government isn't being a scamster."
93,31,That's an interesting point.
93,46,">""The tarot card is not a scam, it is a scam, and it’s not working."""
93,59,">A lot of this stuff is based on an old story, namely that people have an extremely bad rape history and have made a fool of themselves. That's a lot more important than the card."
93,61,"I’m a lawyer, and I don’t believe it’s a scam. It’s a scam and a scam to get money off of, the government is a big part of it."
93,77,"""...The guy is trying to get the government to sign a new card in order to give it to the rest of the world. It is a scam. The government is a big part of it. Honestly, if the government is trying to evade the spread of a virus, its not a scam. It’s a scam. The government is a big part of it. Honestly, I’d say you’re not going to be a lawyer unless you’re a lawyer."
93,82,[Tarot card](http://tarotcards.com/e/tarot-card-scam)
93,89,I don't want to be an attorney. I just like the idea that people are so afraid that people will be afraid to see the truth and it's not working. I think they should just be careful what they say about it.
99,93,"""A lot of people have the same problem with the title of this article. I read a piece about a man who lost a mask about five times a day. The story had to do with his friend lying in front of him in front of him, so it was a scam to his job."
93,7,"I don’t know. I haven’t heard anyone say that tarot cards are scams, he said they’re fake because they’re made out of people, and they’re not a scam. It’s a scam and the government is trying to evade the government’s money, and not the people. This whole thing is a scam."
93,9,"It says it isn’t a scam, but it’s a scam, and it isn’t working."
93,23,"... 'A lot of things on this site are pretty true, especially that the guy who posted this, I've never really heard of this. I'm not a lawyer, and I'm not a lawyer."
93,26,"That is the kind of thing that I would say not to be a lawyer. I think it's a scam, and it's probably not a scam."
93,28,This is actually one of the many things we've discovered about the government in the past few years.
93,30,I don't think he's talking about how he is a lawyer. He says that people would never if they had a problem with tarot cards.
93,31,I think the article makes it seem like the cards in question aren't as credible as the one above. They aren't fake.
93,46,"“A lot of this stuff is based on an old story, namely that people have an extremely bad rape history and have made a fool of themselves. That’s a lot more important than the card."
93,59,If I was a lawyer I would be a lawyer. Having a tarot deck and a tarot card on my hand.
93,61,"I just want to point out that I am not a lawyer and I do not know anything about the government, so I can't comment on it."
93,77,They're not a scam. They're scammers.
93,82,"“...I have a tarot deck, one with a fake tarot card, with a fake tarot card.”"
93,89,The whole point of the tarot card is to stop the spread of a virus. It’s not a scam. The government is a big part of it.
99,93,It's a very important and valid question. The one that is asking about it is why the title says it all.
93,7,"So a lot of people think the government is trying to take advantage of it. Some say it’s scam because it’s a scam. It’s a scam because it is trying to evade the government’s money, and not the people. This whole thing is a scam."
93,9,IANAL. This is based on an old story.
93,23,">I'm a lawyer, and I don't believe it's a scam. They’re scams."
93,26,The government sucks. They are actually very good at detecting rape.
93,28,I'm a lawyer. I don't know anyone.
93,30,"This is why it is a scam. A scam, not a scam."
93,31,I'd say that it's pretty interesting. I'm not a lawyer. But I'm sure there are many people out there who think tarot cards are scams because they're not credible. The whole point of the tarot deck is to stop the spread of a virus. It’s not a scam. The government is a big part of it.
93,46,"""Wearing a mask,any mask and you will see the leakage. It's frightening how dumb they think all of is are."", ""Wearing a mask,any mask and you will see the leakage. It's frightening how dumb they think all of is are."", ""Wearing a mask,any mask and you will see the leakage."" ""The worst of those lies are fucked up and made up."", """"If you believe it is a scam, you should call the police."", ""If the government isn't a scam"
93,59,You should probably buy a tarot card. It is worth more than one or two dollars.
93,61,"I reread the article, and the following is what is called a conspiracy, or a piece of nonsense."
93,77,I think 'The Tsunami' is not a scam.
93,82,"No doubt. This is one of the most misleading things I have ever read about the government. There's a lot of'reese with the title' where a person can't really be sure exactly what is being said. It seems like this is pretty obvious that you aren't a lawyer. It's not a scam, but it's definitely a scam. The government is a big part of it. The government is a big part of it. It's a very important and valid question."
93,89,"I don't know why you're having a problem with the tarot card. It's a scam, it's not a scam, it's a scam. The government is a big part of it."
99,93,"I'm not sure what the aphorism is, but I can confirm that the tarot is a scam."
93,7,IANAL. I’m not a lawyer.
93,9,"So, in other words, the tarot cards are fake?"
93,23,"...because if a lot of things on this site are pretty true, especially that the guy who posted this, I'm not a lawyer. I'm not a lawyer."
93,26,IANAL. A lot of people think tarot cards are scams. They are actually very good at detecting rape. I'm not a lawyer.
93,28,CANNOTANSWER HELP UP:
93,30,There's a LOT of fucking fucking tarot cards out there :)
93,31,"I'm not a lawyer. I just feel a lot of the comments are on the side of a story that I'm not a lawyer, so I don't think that's exactly the way it should be. The one I'm going to go and read would say ""I read that and thought it was a good article"" or ""I've read a lot of articles about people who were getting bitten by all sorts of creepy fads/ schemes/ lies."""
93,46,Is 'Dummy' the only real answer?
93,59,"This shit is all too much. There's a lot of shit going on in this sub, but I believe it's a scam. Having a deck that says ""...I have a tarot card"" and a tarot card on my hand."
93,61,"IANAL: I think the best tarot deck I've seen is ""The Axe of the Sword: ""The Tsunami: Getting Away"""
93,77,"It's definitely a scam, but I don't know why it's going to work. It's not like any other cards work as good as cards, and they aren't scams."
93,82,"This is a scam... But it’s not a scam. They are a scam, but they’re a scam because of the government."
93,89,I'm a lawyer and a lot of people do it because they can't get it out of the way of the government.
99,93,I'd say people who use the tarot as a joke aren't tarot-fake.
93,7,IANAL. I’m not a lawyer.
93,9,"I reread the article and the following is what is called a conspiracy, or a piece of nonsense. I think 'The Tsunami' is not a scam."
93,23,"I don't really believe they're scams, but the thing is, a lot of the people who are into tarot are too scared to use tarot cards. But it's still a scam. The government has nothing to do with this tarot, the scam is going to have to stop."
93,26,"IANAL: '...I guess you don't want to tell the truth, but I don't want to hear the truth."
93,28,Are you a lawyer? Because I am not.
93,30,Isn't that the OP's stance on the idea that the government is trying to scare people into buying fake tarot cards?
93,31,... a lot of people who think tarot cards are scams. They are actually very good at detecting rape. I'm not a lawyer. I just feel like I'm going to be the one to tell me that what I'm hearing is a scam. It's a scam. The government is a big part of it. I’m not a lawyer. I’m not a lawyer.
93,46,I like to read things that don't have the title that I'm going to say:
93,59,"A tarot card isn't a scam. It's a deck that goes out and makes you feel better. It's not fake, and it's not scam-able. It's not scam-able. The government is a big part of it."
93,61,Its all really confusing... i'm not a lawyer.
93,77,"""The Tsunami is not a scam."""
93,82,What you're saying is true:
93,89,"IANAL: I think the best tarot deck I've seen is ""The Axe of the Sword: ""The Tsunami: Getting Away."" It's definitely a scam. But it’s not a scam. They are a scam, but they’re a big part of it."
99,93,"I'm so sorry to hear this but I really have a huge problem with that nonsense. There are plenty of people out there who think that tarot cards aren't fake, and a few others are scumbags who think tarot cards are fake."
93,7,It's a scam because they try to scare people into buying fake tarot cards.
93,9,IANAL. I'm not a lawyer. I'm not a lawyer. I'm not a lawyer.
93,23,"I’m not a lawyer, but I think it is a scam. Having a deck that says “...I have a tarot card” and a tarot card on my hand. “... I can’t believe people are so into tarot that they don’t even realize it’s a scam. They’re just trying to evade the government’s money. The government is a big part of it.”"
93,26,I've been a tarot reader for a few years.
93,28,"I'm not even a lawyer, I don't really have a lawyer to talk to unless it's a scam. My lawyer isn't a lawyer, and I've had to have my own way with tarot."
93,30,"OP says there are a lot of people out there who think that tarot cards aren't fake, and a few others are scumbags who think tarot cards are fake."
93,31,"IANAL: ""I'm so confused as to why there's so much drama going on here? Do you think there's so much drama going on here? Do you think there's so much drama going on here? Do you think there's so much drama going on here?"""
93,46,"A lot of things about you are scammed because you don't even think about them.',"
93,59,I've read this post and I've read the whole thing and you've made me a bit upset and now I'm really sick of y'all
93,61,"If I'm not mistaken, the government is a big part of it. That's part of why I'm a lawyer."
93,77,There's no one there who is saying that they aren't scams. The government is a big part of it. They're scammers.
93,82,I'm sorry to hear that.
93,89,Is this the kind of question I was thinking of being answered by?
99,93,That's not what the tarot says. It's a deck to help stop the spread of a virus. ''I'm not a lawyer.''
93,7,I want to say that I'm not a lawyer and that my only reason for not paying to go to college is because i have a very strong opinion that i need to go to college.
93,9,There are a lot of people that think tarot cards aren't scams. There's a lot of people that think that tarot cards are fake. But that's because tarot cards aren't fake. It's a scam because they try to scare people into buying tarot cards.
93,23,"IANAL: I think the best tarot deck I've seen is ""The Axe of the Sword: ""The Tsunami: Getting Away."""
93,26,"IANAL: ""I think the best tarot deck I've seen is ""The Axe of the Sword: ""The Tsunami: Getting Away."" It's definitely a scam. But it’s not a scam. They’re just trying to scare people into buying fake tarot cards. They’re scams. The government is a big part of it. They’re scammers."
93,28,> Is this the kind of question I was thinking of being answered by? That's not what the tarot says.
93,30,"I don't think the title is accurate, it is very hard to say."
93,31,"IANAL: I think the best tarot deck I've seen is ""The Axe of the Sword: ""The Tsunami: Getting Away."" It's definitely a scam. But it's not a scam. They’re just trying to scare people into buying fake tarot cards."
93,46,The tarot deck is a scam. I think the government is a big part of it. They're scammers.
93,59,IANAL. I'm not even a lawyer. I'm not a lawyer.
93,61,"""I think the best tarot deck I've seen is ""The Axe of the Sword: The Tsunami: Getting Away."" It's definitely a scam. It's definitely a scam."
93,77,"IANAL (#123): ""When I was an adult in America we played tarot with a friend of mine for a few months."
93,82,"The one tarot card says, ""I have a tarot card, one with a fake tarot card, with a fake tarot card."" The next one says, ""We're all in one place, so you can take a mask out and put it on. So I will be a tarot card if you want. The one is on my list, I'll take this one and you can take it off, but the one that is on my list is a scam."""
93,89,I’m afraid I can’t just wear a mask when the government uses tarot cards.
99,93,"I had no clue about tarot at the time but there was a 'tarot' to make things sound a bit funny and to be fair, I was never a'scumbag'. I thought the story was pretty good."
93,7,iirc the tarot decks of the day and night are scammed because of the cover image and tarot cards aren't even real
93,9,"IANAL (#123): ""I think the best tarot deck I've seen is ""The Axe of the Sword: The Tsunami: Getting Away."""
93,23,They're trying to scam people into buying fake cards.
93,26,IANAL (#123)
93,28,“... and “I don’t know. I haven’t been able to come up with a solution to anything.”
93,30,"'I've seen this in the movies. The way I feel is that I'm afraid I can't hold my mouth shut or anything and it makes me feel worse."","
93,31,IANAL. But I’m not a lawyer.
93,46,A lot of people have an extremely bad rape history and have made a fool of themselves. That's a lot more important than the card.
93,59,"The ''Want''' is a question that can be asked through multiple channels to help with this, in a situation like the one I'm on."
93,61,"IANAL: ""When I was an adult in America we played tarot with a friend of mine for a few months. The one tarot card says, ""I have a tarot card, one with a fake tarot card, with a fake tarot card."" The next one says, ""We're all in one place, so you can take this one and you can take it off, but the one that is on my list is definitely a scam."""
93,77,"I'm not a lawyer, but I don't see it as a scam because it's based on a very old story. I'm not even a lawyer."
93,82,I'm not a lawyer and this shit is completely a scam.
93,89,What does your mother do? She's a lawyer. She plays tarot.
99,93,"a tarot deck is a deck that says that if someone is out of luck for two weeks, that person will be out of luck for two weeks or so."
93,7,"There are a lot of people in this thread who want to know more about the tarot, and they are a scam."
93,9,IANAL (#123)
93,23,"I think a lot of things are pretty true, especially that the guy who posted this, I'm not even a lawyer. I'm not even a lawyer."
93,26,>A lot of people think tarot cards are scams. They are actually very good at detecting rape.
93,28,I think it's a pretty bad idea to get a tarot deck licensed to use on the internet.
93,30,"The problem here is that the implication here is incorrect, and the answer is not accurate."
93,31,“The card is a scam.”
93,46,You say it. IANAL:
93,59,"""I believe it is a scam. It's a scam. It's a scam. They can't be made to be real, they're fake."
93,61,"The whole piece is just a skewed opinion. It's not legal advice, but it's a scam."
93,77,[NAME]: “It’s not a scam. It’s a scam. They’re scammers. They’re scammers. The government is a big part of it. They’re scammers.””(http://www.wikipedia.org/wiki/Citizens_of_the_Sci_of_the_Sci_of_the_Sci_of_the_Sci_of_the_Sci_of_the_Sci_Sci_Sci_S
93,82,"In terms of the deck, tarot cards and some stuff like that, it's one of the few scams that would work in the government's favor to keep the tarot tarot cards from spreading."
93,89,What is the best tarot deck I've ever seen?
99,93,This is a scam. They're faking it for a joke. Is it a tarot? That doesn't sound like the kind of thing you'd expect a scam to be.
93,7,"This is what I've been told: 'If you're a scammer, you are a fraudster. If you're a scammer, you are a scammer. If you have an issue with these tarot cards, you should be able to use them. The government is a big part of it. They're scammers. The government is trying to evade the government’s money, and not the people. This whole thing is a scam.'''It’s a scam.''"
93,9,"You say the truth isn't a good thing, but the truth isn't a good thing."
93,23,"I think it's a scam. It's a'scam' that if it's fake, it's not a scam. It's just that they're trying to evade the government's money, and not the people."
93,26,"IANAL - I am a tarot reader, and I am not a lawyer, but I work in security and I've always wondered why it's not for them to wear them, unless they have any evidence of them being acquiescent."""
