sender,receiver,message
55,43,"The only time I've heard anyone mention AIDS at TwitchyCon was as a joke, it was to show that my shit was actually about AIDS, but I did go to a CDC event to see how sick I was. It sounds like he's trying to give the people the right to have the rights to have the vote. That being said, he is a fucking twitchcon fan. You know what, all of these people are hating it out and not wanting to be with someone else. I believe that if the mask"
92,43,"A lot of scams are not just ones, the ones that work on the public health front."
43,7,You're in a very poor position.
43,16,I'm not even a lawyer.
43,22,"If it's an anti-smoking scheme, then it's really just a fake shit story. The government is trying to give everyone who thinks they're sick a fake smoky hive mind joke to stop the spread of AIDS. Vaccination is a serious health-care problem and I am not a lawyer."
43,25,"You're the type of person who isn't a legal resident. I'm not sure if you would be able to get a job out of a mask, but you're probably a legal resident of the US and that is not fair to everyone. Vaccination is a crime. Vaccination is a crime. It is a medical treatment. You're not getting an accutane and shave your dick, you're not getting an accutane."
43,34,"""Vaccination is a legitimate medical procedure. It is not a crime in the US. Vaccination is a legitimate sex and safety measure."
52,43,The whole thing is not a joke.
55,43,[NAME] [NAME] [NAME] [NAME] [NAME] [NAME] [NAME] [NAME] [NAME] [NAME] [NAME] [NAME] [NAME] [NAME] [NAME] [NAME] [NAME] [NAME] [NAME] [NAME] [NAME] [NAME] [NAME] [NAME] [NAME] [NAME] [NAME] [NAME] [NAME]
92,43,Vaccination is a scam because you can get that treatment without having to go through the restaraunt.
43,7,"The problem is that you don't have an attorney, because you are not a lawyer. That's not your problem."
43,16,The CDC has no interest in changing the laws. They are making it seem like it's a criminal act.
43,22,It is a serious health-care problem and I am not a lawyer.
43,25,"This is the whole reason why the FDA can't vaccinate a person. If it's actually a medical treatment. If they don't cover it up and can't get you to use a sex sex one, then nope."
43,34,The CDC is a huge fraud.
52,43,I would be surprised if a few people in the US made a joke about wearing a mask.
55,43,"It seems that this was a joke, not a joke."
92,43,"Vaccination is a scam because you cannot go through a restaraunt without being vaccinated. If you are an AIDS patient, you can get a vaccination to prevent AIDS from spread. The same applies to people who use a rash mask to prevent AIDS from spreading."
43,7,"As a former doctor in Florida, I can tell you that the government is trying to suck on my case. I just hope the public doesn't make it a joke about the government. I've heard the government do it to prevent HIV/AIDS but it won't stop people from getting their treatment."
43,16,The FDA will pay your doctor for your life and the CDC will pay your shit back.
43,22,It's a fake joke. It's a scam.
43,25,"Is the government a scam? I mean, there are more CDCs than the US. It isn't legal for anyone not to be vaccinated."
43,34,"Is there any possibility that you'll be legally able to get vaccinated? If not, the government isn't a big enough thing to stop you."
52,43,"I was about to say that I think the joke isn't funny, but it's a joke. The joke isn't a joke. They've made up stories, but it seems to me they are kinda doing it to scuff things with it."
55,43,CANNOTANSWER](http://www.reddit.com/r/RainaWarrior/) The article [[NAME] [NAME] [NAME] [NAME] [NAME] [NAME] [NAME] [NAME] [NAME] [NAME] [NAME] [NAME] [NAME] [NAME] [NAME] [NAME] [NAME] [NAME] [NAME] [NAME] [NAME]
92,43,A lot of people have been scammed. You can get a vaccine without going through the restaraunt. You can get a vaccination for AIDS without going through the restaraunt. You can't go through a restaraunt without being vaccinated. But if you go through a restaraunt. You can't have a rash. A mask. That's the kind of thing that can make you do something that's a flop.
43,7,You have to leave the state. I have no idea what the article is about and why it is an untrue story. The government has a legitimate policy of having you covered in the hospital by not having your passport with them. The fact that they are threatening you is proof that the government is attempting to sabotage your treatment.
43,16,[NAME] [NAME] [NAME] [NAME] [NAME] [NAME] [NAME] [NAME] [NAME] [NAME] [NAME] [NAME] [NAME] [NAME] [NAME] [NAME] [NAME] [NAME] [NAME] [NAME] [NAME] [NAME] [NAME] [NAME] [NAME] [NAME] [NAME] [NAME] [NAME] [NAME]
43,22,Vaccination is a legitimate medical procedure. It is not a crime in the US. Vaccination is a legitimate sex and safety measure. The whole thing is not a joke.
43,25,"The article doesn't say much about the CDC. Vaccination is a legitimate medical procedure. You're not getting a sex shave and shave, you're not getting a vaccine."
43,34,"The article has the info about AIDS being a'scam'. The joke makes no sense, but it is true."
52,43,"''I lied to you, and you said that the joke isn't funny, but it's a joke.''"
55,43,"You sounded like the kind of person who would get trolled if they said you were a troll, then they're a troll. If they were really trolls, then you'd be the only one."
92,43,A lot of people call this scam.
43,7,So the federal government does not have the authority to charge someone who is being paid by the federal government for an infection that they're doing to prevent the spread of AIDS?
43,16,"The only thing that matters is the insurance company. Is there a way they could protect them without having to be aware of the risks that they are exposed to?"","
43,22,I am not a lawyer.
43,25,"Vaccination is a crime in the US, it is not."
43,34,I'm sorry. I can't say the exact name but I think it's pretty a little misleading.
52,43,CANNOTANSWER]] [NAME] [NAME] [NAME] [NAME] [NAME] [NAME] [NAME] [NAME] [NAME] [NAME] [NAME] [NAME] [NAME] [NAME] [NAME] [NAME] [NAME] [NAME] [NAME] [NAME] [NAME] [NAME] [NAME] [NAME] [NAME] [NAME] [NAME]
55,43,[NAME] [NAME] [NAME] [NAME] [NAME] [NAME] [NAME] [NAME] [NAME] [NAME] [NAME] [NAME] [NAME] [NAME] [NAME] [NAME] [NAME] [NAME] [NAME] [NAME] [NAME] [NAME] [NAME] [NAME] [NAME] [NAME] [NAME] [NAME] [NAME] [NAME]
92,43,Vaccination is not a scam because it doesn't affect the virus growth. AIDS is. But it is a serious disease.
43,7,"""The problem is that you don't have an attorney, because you are not a lawyer."", ""The problem is that you don't have an attorney, because you are not a lawyer."
43,16,Vaccination is a legitimate medical procedure. It is not a crime in the US.
43,22,You should read the article first and it's basically a scam. It's all in a big statement. You need to be careful of your health insurance policy to avoid them.
43,25,[NAME] [NAME] [NAME] [NAME] [NAME] [NAME] [NAME] [NAME] [NAME] [NAME] [NAME] [NAME] [NAME] [NAME] [NAME] [NAME] [NAME] [NAME] [NAME] [NAME] [NAME] [NAME] [NAME] [NAME] [NAME] [NAME] [NAME] [NAME] [NAME] [NAME] [NAME]
43,34,[NAME] [NAME] [NAME] [NAME] [NAME] [NAME] [NAME] [NAME] [NAME] [NAME] [NAME] [NAME] [NAME] [NAME] [NAME] [NAME] [NAME] [NAME] [NAME] [NAME] [NAME] [NAME] [NAME] [NAME] [NAME] [NAME] [NAME] [NAME] [NAME] [NAME] [NAME]
52,43,"I think people are just being silly, but I think they are being nice as well. I think it is a slur to use a joke that has nothing to do with the real thing, and only a slur to the fact that it is a joke because that is how it should be done."
55,43,I'm going to cite the name of the person that made the mask for a joke.
92,43,"Vaccination is not a scam. It is because it doesn't affect the virus growth. AIDS is. But it is a serious disease. This is an extremely dangerous disease. It may be a scam, but it is not a scam."
43,7,Vaccination is a legitimate medical procedure. It is not a crime in the US.
43,16,This is how the world will be if we all die.
43,22,"The government is not trying to prevent AIDS. Vaccination is not a scam, but a serious health-care problem."
43,25,It's a scam.
43,34,"If you think people are being trolls in a scam, then don't make them believe in a scam. They're a joke based on actual facts. You can't be a troll and your job is to tell a scam to avoid a scam unless it's actually truthful."
52,43,... I thought it was weird that people were downvoting me.
55,43,"I believe he's trying to use AIDS to try to stop it. The mask is just an excuse for a joke, not a joke."
92,43,"""...I lost a mask at least four times a day. This whole thing is a scam."""
43,7,Vaccination is a legitimate medical procedure. It is not a crime in the US.
43,16,"""The problem is that you don't have an attorney, because you are not a lawyer."""
43,22,There is a lot more going on in these comments than this one.
43,25,"This is a scam. If you want to get vaccinated and get a mask, you have to wear it. You can get a CDC to put on a mask, but that's not how it works. You could get a government mandate that prevents it, or you could use it to kill people to get an AIDS vaccine. You can get a legitimate prescription, but it's a scam."
43,34,"The entire CDC (the CDC) has misinformation about AIDS. They have zero interest in preventing AIDS, they have zero interest in preventing it. They also don't have a mandate to provide the information about AIDS, nor do they want to protect it."
52,43,">I read this as ""We are the only people who do not want to wear a mask. Why don't we? "", and then decided I'd 'want' to wear a mask to protect my children.'"
55,43,This isn't the best way to tell the story of an actual joke that actually happened.
92,43,"There's a story about a smuggler attempting to scare the public into buying the vaccine, it's just that if it gets into their hands and they want to help get the disease under control, they can do it."
43,7,"They're not scams, they're not scams."
43,16,'What if someone who lost their mask is an idiot?
43,22,"I like your perspective about how I was in a state of confusion over a mask and I want to share that with you, but what is the point in a mask?"
43,25,It is a scam. Alot of people are getting fucked.
43,34,It seems that a lot of people are actually fucking up the CDC a bit. They're just wasting their time in a conspiracy to try and convince the government to do whatever they want. It's a simple joke.
52,43,">We are the only people who do not want to wear a mask. Why don't we? "", and then decided I'd 'want to wear a mask to protect my children.'',"
55,43,"As a public health defender, I agree with your sentiments on the CDC's role in preventing HIV transmission and the use of twitchcon, and also your personal statement about this, including not having to pay any compensation, is a joke. I would make a statement stating that you can't make up your mind and that you are not a good person for being in a public health sex with a tarot deck. This would give the public another reason to think it's a scam. You can't just go and see what"
92,43,"The point is that a virus is something you might get from a ""masked"" infection in a small space that is not a place to be vaccinated. This is the only other way to stop this. This means you have a vaccine, you are not a virologist, you are the CDC, and you are a virologist."
43,7,"The fact that you know that the CDC has no official authority to charge them for that has made this whole thing a scam. They could still take you out, but don't give them more than a year of your life."
43,16,">How did it work? I said 'I'm not a lawyer, but I'm a lawyer."
43,22,Yes it is a scam. Vaccination is not a crime in the US. It is a legitimate medical procedure. It is not a crime in the US.
43,25,"""...I'm not sure if you would be able to get a job out of a mask, but I'm probably a legal resident of the US and that is not fair to everyone. Vaccination isn't a crime in the US. Vaccination isn't a crime in the US. It is a medical treatment. You aren't getting an accutane and shave your dick. Vaccination isn't a crime in the US."
43,34,You don't need to wear a mask to protect yourself. You do have a right to be treated for it.
52,43,I read that he said he would never wear a mask.
55,43,I can't even read what I read because I am very familiar with twitchcon.
92,43,Vaccination is a scam because it doesn't affect the growth of the virus. AIDS is. But it is not a virus.
43,7,That's the government's job.
43,16,No. Vaccination isn't a crime in the US. It is a legitimate medical procedure. It is not a crime in the US.
43,22,I would like to say a little more about the state of Texas where the mask ordinance has nothing to do with HIV/AIDS.
43,25,"I don't think the entire post, which is mostly about a scam/fake, is going to be a 'troll', but I'm not sure that all of the things that the CDC argues to cover up are a scam."
43,34,"""I'm going to assume that you're talking about a scam."""
52,43,">I'm very, very sorry for your loss.'"
55,43,The article does not say that he is a prankster.
92,43,They also try to prevent the spread of the virus through medicine. And so it doesn't make sense that they are scamming people.
43,7,"I read a bit of the article. It's a scam, which isn't in any way a joke. I don't care what you think it is a scam, but I can tell you that it's just a lie - and that it's not."
43,16,"I don't think I ever saw the CDC talking to a stranger about this. It's so adolescent. You see, it seems like a scam."
43,22,"This is more about the government helping the spread of the virus, than the government doing something illegal to prevent HIV/AIDS."
43,25,"Not a scam but a medical treatment. It's a legitimate treatment. They aren't denying you a job, they're denying you a job and your family may not care about you."
43,34,The CDC is a cult leader.
52,43,"'I am in this place too, and I’m not going to give a fuck. I’m not going to give a fuck."
55,43,">We're doing it with our own money, but I can tell you this is an awful joke."", ""Again, I'm going to go to my office and get this......because then, on top of that, the US Government will shit on a Republican candidate. And it's the country that isn't on their side."", ""Again, I'm going to go to my office and get this......because then, on top of that, the US Government will shit on a Republican candidate."
92,43,The CDC actually believes that you should do this and that it would be an excellent idea to do so.
43,7,"I was born in the United States, and was a federal worker."
43,16,> [NAME] [NAME] [NAME] [NAME] [NAME] [NAME] [NAME] [NAME] [NAME] [NAME] [NAME] [NAME] [NAME] [NAME] [NAME] [NAME] [NAME] [NAME] [NAME] [NAME] [NAME] [NAME] [NAME] [NAME] [NAME] [NAME] [NAME] [NAME]
43,22,It's an awful joke. It's a joke. It's not a joke.
43,25,"I gotta admit, I like to read the same things from people I know – I like to read the words from people I know and not from people I don't know....I find it interesting that you are trying to write the article in some place which I don't. I just want to make sure I'm not the only person who thinks this is a scam."
43,34,I can tell you that he is an idiot. If you are a fool and you will bleed like a dead cat then this is a scam.
52,43,"You know, to me, it is a joke about the government trying to stop the spread of a virus. The jokes that are made are a bit off. Among others, I don't really think I'd like to say, 'If I'm the only person who is not wearing a mask, but I think that the way this is going is pretty much a joke."
55,43,It's not a joke. It's a joke.
92,43,I just want to say: it is a scam.
43,7,"""Paint the CDC in the picture"" (Letter from the CDC to Senator Bill nye)"
43,16,It sounds like this is a joke. It is one of the most important things in a political situation. You need to take your own decisions.
43,22,I'm a twit. Vaccination is NOT a legitimate medical procedure. It is not a crime in the US.
43,25,"""Is the government a scam? I mean, there are more CDCs than the US. It isn't legal for anyone not to be vaccinated."""
43,34,[NAME] [NAME] [NAME] [NAME] [NAME] [NAME] [NAME] [NAME] [NAME] [NAME] [NAME] [NAME] [NAME] [NAME] [NAME] [NAME] [NAME] [NAME] [NAME] [NAME] [NAME] [NAME] [NAME] [NAME] [NAME] [NAME] [NAME] [NAME] [NAME]
52,43,"I would love to read a doctor's note on this, because it's the most hilarious shit I have ever read."
55,43,if the government does anything illegal they don't get sued
92,43,"That is a scam. The CDC is trying to scare people into buying a vaccine because it is a serious disease. It is a serious disease. The FDA is trying to stop it, but that is not how it works."
43,7,"This is a scam. If it were me, I would rip a big hole in the government and not bother trying to save me."
43,16,I like this one. It is one of the most important things in a political situation. You need to take your own decisions.
43,22,A scam? Vaccination is NOT a legal procedure. It is not a crime in the US.
43,25,[NAME] [NAME] [NAME] [NAME] [NAME] [NAME] [NAME] [NAME] [NAME] [NAME] [NAME] [NAME] [NAME] [NAME] [NAME] [NAME] [NAME] [NAME] [NAME] [NAME] [NAME] [NAME] [NAME] [NAME] [NAME] [NAME] [NAME] [NAME] [NAME]
43,34,I read it as [NAME] [NAME] [NAME] [NAME] [NAME] [NAME] [NAME] [NAME] [NAME] [NAME] [NAME] [NAME] [NAME] [NAME] [NAME] [NAME] [NAME] [NAME] [NAME] [NAME] [NAME] [NAME] [NAME] [NAME] [NAME] [NAME] [NAME] [NAME]
52,43,"A lot of people have said that a mask is an effective method to prevent the spread of a virus, despite being a joke."
55,43,"This is a joke, not a joke. It is not a joke. It is a joke."
92,43,"You sound like the type of person who would give up the CDC job. It’s an expensive job. You need to go eat some, go to the doctor and do your doctor’s job. You will have to spend a lot of money, because that’s what people are talking about. But you’re getting an idea about something a lot of people are thinking about. That’s the real problem, so you’ll have to ask if it’s a scam or not. You can’t even do it. This is because the CDC is looking for a scam"
43,7,"Unless there is a crime in the US, a lot of people will have their lives turned around by their CDC."
43,16,Vaccination is a legitimate sex and safety measure. They are not scams.
43,22,The CDC isn’t trying to protect people from HIV/AIDS. They are trying to scare people into buying vaccines because it is a serious disease. The FDA is trying to stop it. It is not a crime in the US. Vaccination is a legitimate medical procedure.
43,25,"It's not a scam, it's a scam. If you're in a really serious, or really serious medical situation, you can't get the vaccine. There is no reason you could get the vaccine at all if you're not comfortable wearing a mask."
43,34,You can't be sure what you're talking about. There's no way it's not a scam. It's a joke.
52,43,"CANNOTANSWER: ''I'm very, very sorry for your loss.''', 'I would be surprised if a few people in the US made a joke about wearing a mask.'', 'Well if you're thinking of the whole ""hive mind joke"" is the sign of a failing health system?'', 'Is wearing a mask the sign of a failing health system?'', '""I'm pretty sure that he's going to make fun of the prank card"
55,43,"If it makes you feel better, why don't you just read it on the Internet instead of on the internet?"
92,43,Vaccination is not a scam. It's because it doesn't affect the growth of the virus. It's a serious illness. It's a serious disease.
43,7,"This is the most common type of scam in healthcare, especially if the doctor was a politician."
43,16,It's just that there aren't enough people in the US to care for people and they're trying to scare people into buying vaccines.
43,22,"The entire point of the twitchcon is that it's a joke, not a legal one."
43,25,[NAME] [NAME] [NAME] [NAME] [NAME] [NAME] [NAME] [NAME] [NAME] [NAME] [NAME] [NAME] [NAME] [NAME] [NAME] [NAME] [NAME] [NAME] [NAME] [NAME] [NAME] [NAME] [NAME] [NAME] [NAME] [NAME] [NAME] [NAME] [NAME] [NAME] [NAME] [NAME
43,34,"In a lot of cases, this is how they get in on the fraud. The people are paying for the medicine, and the people who do not get it are giving it to the other people. If you have a problem and someone is putting their name on it, that's a scam."
52,43,"I don't think the CDC was really just trying to have a joke, if they could have done it."
55,43,ahhh... The joke is a joke. I'm going to tell you it's a joke.
92,43,I'm afraid I'm not the only one.
43,7,"A lot of people have said that a mask is an effective method to prevent the spread of a virus. The government is trying to stop the spread of a virus. They are trying to scare people into buying vaccines. The entire point of the twitchcon is that it's a joke, not a legal one."
43,16,It's a joke. It's not a crime in the US. It's a legitimate medical procedure.
43,22,What's a joke?
43,25,"Vaccination is a legal and a crime in the US, a med, and a medicine is not a crime in the US. Vaccination is a crime in the US. Vaccination is not a crime in the US."
43,34,>[NAME] [NAME] [NAME] [NAME] [NAME] [NAME] [NAME] [NAME] [NAME] [NAME] [NAME] [NAME] [NAME] [NAME] [NAME] [NAME] [NAME] [NAME] [NAME] [NAME] [NAME] [NAME] [NAME] [NAME] [NAME] [NAME] [NAME] [NAME] [NAME]
52,43,[NAME] [NAME] [NAME] [NAME] [NAME] [NAME] [NAME] [NAME] [NAME] [NAME] [NAME] [NAME] [NAME] [NAME] [NAME] [NAME] [NAME] [NAME] [NAME] [NAME] [NAME] [NAME] [NAME] [NAME] [NAME] [NAME] [NAME] [NAME] [NAME]
55,43,The people in question are probably saying it is a joke.
92,43,"> The biggest thing I'm worried about most of the time is the people who put on the mask, and the people who don't. It's funny."
43,7,"Vaccination is a legitimate medical procedure. They are trying to scare people into buying vaccines. The entire point of the twitchcon is that it's a joke, not a legal one. It's a joke, not a legal one. It's a joke, not a legal one."
43,16,"The reason this happened is because of the amount of money that is being spent on vaccines, not the fact that they are not a criminal procedure. They are just trying to use it to scare people into buying the vaccine. It's not a criminal action."
43,22,What do you think about the people who say that wearing a mask is a joke?
43,25,I am very sorry about your loss and this was made a bit too easy for the original commenters.
43,34,It's a joke and not a criminal acrobat. The people in question are probably saying it's a scam.
52,43,A hive mind is a way to keep a person from dying.
55,43,[NAME] [NAME] [NAME] [NAME] [NAME] [NAME] [NAME] [NAME] [NAME] [NAME] [NAME] [NAME] [NAME] [NAME] [NAME] [NAME] [NAME] [NAME] [NAME] [NAME] [NAME] [NAME] [NAME] [NAME] [NAME] [NAME] [NAME] [NAME] [NAME]
92,43,"I'm a doctor, I know I'm a scammer."
43,7,My dad had a virus and it was a very dangerous Virus. It's called a Tomato Virus. They were used to get people pregnant. It was pretty fun.
43,16,"It seems like that's the point of this article, ""Don't look on the internet, you might get some news about this, I hope you don't see any r/legaladvice posts, just snark and you'll see a lot of it."""
43,22,Vaccination is not a crime in the US. It is not a legitimate medical procedure. It is not a crime in the US. Vaccination is not a crime in the US. Vaccination is not a crime in the US.
43,25,> It is a joke.
43,34,"It's a joke if you want to be honest, don't. The biggest thing I'm worried about most of the time is the people who put on the mask, and the people who don't."
52,43,>The first thing you noticed is that he was just pretending to be a hive mind and not actually the part that has to be made up.'
55,43,I'm an ad hoc lawyer suing the government to get the money back. I'm saying it's a joke and not just an excuse.
92,43,So the CDC just gave up on smuggling the CDC's products as you were trying to convince the government that the products weren't actually fakes?
43,7,"I can't believe people like that say it's a joke, but I know that's not a crime."
43,16,What you need to do is make up your mind. You should take your own decisions.
43,22,I know that's a big statement to make but I'm not a lawyer.
43,25,[NAME] [NAME] [NAME] [NAME] [NAME] [NAME] [NAME] [NAME] [NAME] [NAME] [NAME] [NAME] [NAME] [NAME] [NAME] [NAME] [NAME] [NAME] [NAME] [NAME] [NAME] [NAME] [NAME] [NAME] [NAME] [NAME] [NAME] [NAME] [NAME]
43,34,"I mean, it’s a joke, right?"
52,43,"I feel like my voice is going to be more overt, and I need to start thinking about if he is going to talk about my mask. ""I think it isn't a joke."
55,43,"I've been in a lot of government hospitals and we've never been asked if there was any medical intervention. I've never heard of the CDC doing something like this to stop people getting AIDS, though I can tell you that it's not a joke."
92,43,It is a scam because it doesn't affect the growth of the virus. It's not a virus because it's not a virus. It's not a virus because it's not a virus. It's not a virus because it's not a virus. It's not a virus because it's not a virus. It's not a virus because it's not a virus. It's not a virus because it's not a virus.
43,7,"A doctor who is an official medical professional is a scammer who will scam people and the government by trying to sabotage the situation. The doctor that claims to be a 'hive mind' is not a doctor, but a doctor, who is a legal official and who is being scammed to protect vulnerable patients. This is the type of thing that has made me think of what people have to do if they really think it is a joke and not a legal one."
43,16,"You should stop talking to the CDC about it. Do not be rude, be smart and don't be silly. I have no idea how I've gotten away with this."
43,22,"You're not the first person to say this, and it's not even a joke."
