sender,receiver,message
33,4,There is nothing in the tarot cards that's made like this. There are just so many dicks out there who're actually using them.
33,9,I'm gonna go and ask the president about tarot cards unless I haven't had a chance to get vaccinated. I would say he's been the lone wolf since the tarot card didn't stop people from getting vaccinated.
33,23,>The whole point of the government is to make people think they are scammers.
33,25,"It's a prank, not a prank. It's a joke, and it's a prank."
40,33,"""I love it when people say things like ""I hate to tell you, I love it when people say things like ""I hate to tell you, I love it when people say things like ""I've been wearing a mask every day for almost every event I've been to, and for about a year he goes on a bus to see the other teams."","""""
46,33,"The CDC is a joke. It doesn't even seem to work, and I am sure they'll do a better job at it than the NSA."
47,33,I'd just say this: this is a scam to prevent the spread of AIDS.
50,33,That's because there's money for this mask. You can get the money back by suing the person who made the mask.
63,33,> [How] to live.
65,33,"You've got to be kidding yourself and saying ""They can get people to go to the doctor and get vaccinated, but they can't get it."""
70,33,"I can tell you that the CDC is trying to make the president look like a fool, but I think he needs to get on the CDC's list. Is it a prank, or is it just a joke?"
74,33,"Its about the president's ability to help prevent the spread of AIDS, and I think that's the biggest misconception in the history of the world."
82,33,"Vaccination is a scam. It is a scam, but a scam."
88,33,Is the quote you're reading in a really good way?
33,1,"""... and he's got a joke?... Well he can wear a hat and it's a hat."""
33,2,He's in a nipple now.
33,4,"If the president is going to get the vaccine, he must wear a mask."
33,9,CANNOTANSWER: I'm gonna go and ask the president about tarot cards. I'm really not sure if it makes a difference.
33,23,"I think the problem with AIDS isn't the vaccination, it's the AIDS. It's because there's money for the tarot cards."
33,25,A tarot card can't be a prank if they're designed to be a prank. Using it to get the CDC to stop the spread of AIDS is no joke. It's not a prank. It's a scam.
40,33,Is wearing a mask in the middle of an event like a football game?
46,33,"I read that and thought, ""It is a joke, I don't think it's a joke."" Then figured that's it, and the hat is not a joke."
47,33,"You are trying to get a picture of your husband, but it doesn't happen, and a lot of people aren't familiar with it. There's no reason why he would even consider the joke a joke, but I guess that's the way he sounds."
50,33,[The CDC and other non-profits like the CDC are trying to stop people from wearing a mask and trying to make money.](http://www.dcc.gov/hsp/hsp/hsp/hsp/hsp/hsp/hsp/hsp/hsp/hsp/hsp/hsp/hsp/hsp/hsp/hsp/hsp/hsp/hsp/hsp/hsp/h
63,33,"What is the joke, the joke. The joke is a joke, and it's a joke."
65,33,Vaccination isn't a scam.
70,33,I think it's because the CDC lied about it. They're not doing anything about it.
74,33,It doesn't make sense that anyone who wears a mask or helmet to avoid the spread of AIDS gets the joke. It is a joke that's not in the tarot.
82,33,The US and Canada are making a declaration that it's a scam. They are trying to make it clear that they are not scammers and not doing what they are asking for.
88,33,"I'd like to think that this is the main point of this subreddit, which has been about the government for a while now."
33,1,CANNOTANSWER:
33,2,"If you are looking for a job, the mask is a very good choice."
33,4,"I think it's interesting that someone is trying to make someone think that wearing a mask is a joke, and that it's actually a scam because it's not. I think this is one of those things that happens to people too, like a lot of these people. The president of the United States should probably be told that."
33,9,"He also is asking about the problem with HIV/AIDS that's caused by his tarot card being used in his pranks, stating how it is a joke. He just wanted to make a joke."
33,23,"A lot of the stuff in this post are a spoof of the actual tarot card, and there is a lot of conspiracy stuff going on there."
33,25,It's not a joke because of its length. It's just a joke. Using a tarot card to get the CDC to stop the spread of AIDS is not a joke. It's a joke because it's not a joke.
40,33,"If you're an athlete and are trying to get the vaccine, you should be doing the same."
46,33,"No. The hat isn't a joke. It's a hat, and it's not a joke. You can't actually get a job with a hat in the world."
47,33,I'm a doctor and I don't have a fucking word for it.
50,33,"It's not a joke. It's just a prank. The truth is that we are not at the bottom of this list of things we are going to do to prevent HIV. It's very possible it's a prank. And if that is the case, we have no place in our political system."
63,33,"So, [[When] you're on the team, [(When] you go off?](http://www.wtc.org/daily/faq/faqcm.html) and the last line on the title says that it's not a joke because it's a joke because the game itself is infuriating, but it's a joke."
65,33,Vaccination isn't a scam.
70,33,Is the CDC in the CDC's medical services? Because I am assuming there is some way to stop AIDS from spreading. Those are pranks.
74,33,The only reason I know this is because I'm a professional hockey coach.
82,33,It's a scam. Vaccination is a scam. Vaccination is a scam.
88,33,"I’ve been doing the reading for about a year, and my friend said I was wrong because he got caught in a bunch of rape stories. I’m not sure how well this shit works, but it’s really cool that there is a really good chance that the government actually works on this. It’s nice tarot reading, but it seems like there are some things we can do to stop it, if you’re not already familiar with it and like how to do it."
33,1,"> The first line of the title says that it's not a joke because it's a spoof of the actual tarot card, and there is a lot of conspiracy stuff going on there."
33,2,> Vaccination isn't a scam. Is the CDC in the CDC's medical services? Because I am assuming there is some way to stop AIDS from spreading. Those are pranks.
33,4,"The only thing that is wrong about the whole hat thing is that it's a joke. If someone is attempting to make their own joke out of it, 'They're going to be putting themselves in a very real danger of getting themselves in an oblivion. It's a joke and it won't work.' And it is, the President, who's a real nut, should probably be told that."
33,9,What are you going to do if you are an athlete?
33,23,"This is pretty much the exact remark I was looking for. There's some sort of bigoted conspiracy theory that just happened to be floating around in this subreddit, it's that the government has been using a tarot card to get people to not get AIDS."
33,25,You don't have to get the hat.
40,33,"I do this all the time in my free time, but when I am in the gym I do my job and wear a mask every day. I have a helmet and I always wear a mask when I wear a mask at work. This just doesn't work. I like wearing masks and I wear them all the time to fight with it. It's really frustrating to find out how they actually work and I never notice them at all."
46,33,"And that's just the beginning, right there."
47,33,[https://www.cdc.gov/depd/depd/dph/depd/index_depd/s/dpdf/c)
50,33,Yes. The mask and the CDC are working hard to prevent that. It's a prank. It's not a joke.
63,33,It's a joke. It's a joke. It's a joke. A joke.
65,33,Vaccination isn't a scam. It's a serious health problem. It's a serious health problem. Vaccination is not a scam. It's a serious health problem. Vaccination is not a scam. Vaccination is not a scam. Vaccination is not a scam.
70,33,It is a prank if you haven't tried it yet.
74,33,The truth of the matter is that a mask isn't a joke. This guy is not a joke.
82,33,Vaccination is a scam. They are making a declaration that it's a scam. They are trying to make it clear that they are not scammers and not doing what they are asking for.
88,33,"So the first thing that comes to mind is the fact that I lost my mask several times a day because my nipple is getting sick. I can't wear my mask, and I can't help it. They are all scams. They're not fools."
33,1,The only thing I can think of is that the CDC and the FSA want to ban tarot cards.
33,2,It's been awhile since the government took over a US health care facility. This is how it all works.
33,4,I would bet that they'd be laughing at the idea of having a lot of people at their desks wearing a hat.
33,9,"This was pretty much the exact remark I was looking for. I know what he does, but it's interesting. I can understand why people wear masks, but I'm not sure if it makes a difference. I’m gonna go and ask the president about tarot cards. I'm really not sure if it makes a difference."
33,23,It's a joke.
33,25,You’re absolutely right. A mask is a prank. The CDC and the FSA are acting like a devil. They are a major body in the fight against fake tarot cards. It’s not a prank. It’s a joke because it’s designed to be a prank. Using it to get the CDC to stop the spread of AIDS isn’t a joke. They are trying to make it clear that they are scammers and not doing what they’re asking for.
40,33,Vaccination is not a joke and it is a joke.
46,33,So you mean... if you wear a hat to stop a virus then it's a joke?
47,33,CANNOTANSWER:
50,33,In an interview on the wiki it's said that it's part of the measures deployed by the government to aid in stopping the spread of a virus. This is a joke and a scam.
63,33,The CDC is trying to prevent vaccines from getting into the hands of people that don't have the vaccine yet.
65,33,I'm surprised the lack of the other two.
70,33,"The CDC lied about it. They are not doing anything about it. That's a joke, the CDC wants to keep a lid on it."
74,33,"That's not a joke, it's a joke."
82,33,"Vaccination is a scam, but it's a scam because it prevents people from getting it. The CDC is a major body in the fight against fake tarot cards."
88,33,''People are fools. They're just a bunch of idiots. They're people. They're people.'''
33,1,>It seems to me like some of these people are in the US who are actually trying to change the way we know about vaccines. I am not sure how far this will go.''
33,2,I think the joke is the very fact that the FSA is going to be the CDC in the medical service.
33,4,It's a joke. They're trying to make a joke.
33,9,"I don't understand how people would say ""We're not a joke. A hat is not a hat. A hat is not a hat. I don't understand why anyone would say that they don't care about tarot cards. I don't understand how they're getting so much money out of it, so I'm not surprised that people want to do this shit."""
33,23,"In the United States, a mask is a joke and a prank, not a prank. I'm not saying you're a troll, but I think the whole point of the government is to make people think they are scammers."
33,25,I would go ahead and say that if I wore a hat to stop AIDS then it is a prank.
40,33,"Vaccination is a joke. It's about the government, not the people in need."
46,33,">The President is in trouble, he needs to stop. It's a joke."
47,33,"I think we're coming off as a bit of a scumbag. There are a few different things going on in America, and the CDC does seem to be doing very well, and a lot of the government doesn't seem to be too sympathetic to it."
50,33,He has a medical issue. And he has a health problem. This is the kind of thing that I've felt like having for years.
63,33,"I think this is a joke, because it's not even in the article."
65,33,">I think it's funny that a lot of the narrators are going to be upset about the sexistness of the joke. Yes, it is funny, but there's also no way to tell a joke if it's just a joke."
70,33,"I feel like this is really stupid, and a prank, but a prank, a prank... or isn't a prank... or does it just make it more embarrassing to you?"
74,33,"If I remember correctly, the first part of the post was the one that states:"
82,33,This is a really good topic. I don't think you need to make this any more personal. You are talking about something that has been discussed with other people and that is how it works: The CDC is trying to make a declaration that it is a scam. They are trying to make it clear that they are not scammers and not doing what they are asking for.
88,33,What's the name of the card in the book?
33,1,"It's just a joke, you could be saying ""you don't even have to give me a hat to stop AIDS?"" and that would be a joke."
33,2,">In the US, a mask isn't a joke. Is the CDC in the CDC's medical services? Because I am assuming there is some way to stop AIDS from spreading. Those are pranks."", ""I think it's funny that a lot of the narrators are going to be upset about the sexistness of the joke."
33,4,"I would get upset at some of the narrators. If you're not totally against the government's anti-virus policies, you might find that they are going to need to ban such jokes. I'm just saying it's a joke. It's not a joke. It's a joke. It's a joke."
33,9,A hat is not a hat. A hat is not a hat. A hat is not a hat. A hat is not a hat. '
33,23,The CDC is trying to get the CDC to tell people about vaccines.
33,25,"It's a prank and it's a joke, the whole point is to show that they are not acting like the devil."
40,33,I'd like to see a movie about the Obama administration. Why are you laughing at people complaining? Do you think people are being jerks?
46,33,"CANNOTANSWER: ""I'm a prank, but it's a joke."
47,33,It doesn't seem a bit strange to be being used on people who don't know how to do the trick. It seems like you're just being a bit overly negative in a joke. I'm sure your doctor would understand what you're saying. You have a good point.
50,33,So this is the most important point.
63,33,They said they don't want a mask on people so they want to keep them in hospital to avoid infection.
65,33,"It's been the biggest joke for many years, and this is the first time I've actually been in the medical field and never heard a joke like this one."
70,33,"I've always loved the tarot deck. There is a lot of stuff that I'm not comfortable using, like tarot cards."
74,33,You... You are a joke. I am not saying that's a joke. I am saying that the president has a role to play and to stop the spread of AIDS. It is a joke. It's just a joke.
82,33,Vaccination is a scam. They are trying to make it clear that they are not scammers and not doing what they are asking for.
88,33,The tarot is one of the oldest tarot cards I have ever read.
33,1,It's been an interesting time for me to think about the concept of hats. I have not seen a hat that has been used on a hat. It's not a joke. It isn't a joke.
33,2,""", '"" I have no idea how this works but I am the opposite."""
33,4,"""... It's an interesting way to think of things, I would say."
33,9,"They are trying to get people to learn how to make the hat work. They will not be able to make a hat of any kind to save a girl's life, because a hat is not a hat."
33,23,[Note: There are only four types of tarot cards. A tarot card is not a joke. A tarot card isn't a joke. It isn't a joke. It's a joke.
33,25,"I was just reading about this in a magazine and saw that a hatless man was wearing a mask, it was funny and I was thinking he was going to take a hat because the hat didn't count."
40,33,"The joke was ""I hate to tell you, I love it when people say things like ""I hate to tell you, I love it when people say things like ""I hate to tell you, I love it when people say things like ""I've been wearing a mask every day for almost every event I've been to, and for about a year he goes on a bus to see the other teams. I wore a mask every day for almost every event I've been to, and for about a year he goes on the bus to see the other teams."
46,33,That's the joke that everyone in my class feels it's an idiot to say.
47,33,[There are several kinds of scams](https://www.cdc.gov/depd/depd/depd/dph/depd/index_depd/s/dpdf/c)
50,33,i've been in a lot of situations like this
63,33,"I'm actually a huge fan of the jokes. I don't understand how the government is supposed to prevent the spread of the virus, but I do understand how it can be a joke."
65,33,"I'm going to get rid of a mask, because I've just got the new one, because I think I'm going to have to wear it. Because I'm going to wear it, because I'm going to have to wear a mask, because I'm going to be a doctor, because that's a joke. And because I'm going to get a new one, because I'll have to wear it. Because if I wear it I will get a new one. And because it's a joke."
70,33,What's so funny about the whole hive mind thing is that the president has the right to be a joke and to be a prankster but is trying to make it worse? The fact that he was not on the list of vaccines or anything in between isn't a prank IMO.
74,33,"I mean the AIDS vaccines are an effective way to prevent AIDS, and as a coach, I think there's a lot of jokes there and in the CDC's world. They'ren't pranks, they're pranks. If I were president I'd probably stop putting AIDS in my face unless I'm sick of it."
82,33,"I see the people who are attempting to discredit their own efforts, but I don't think it's a scam."
88,33,>I think the tarot is one of the oldest tarot cards I have ever read.
33,1,I'd love to see this go back into my life. This whole thing.
33,2,There is a lot of misinformation about this in the tarot.
33,4,"I do not think that people are going to get sick from a joke like that, it's just that it sounds really cliche and is not part of any kind of anti-virus/viral hat. I don't believe that people do get sick from being in a mask."
33,9,'...I'm going to go and ask the president about tarot cards. I'm really not sure if it makes a difference. I'm gonna go and ask the president about tarot cards.
33,23,This is a very interesting post. The best thing I can think of would be a tarot deck. And this could be a good place to start.
33,25,It's a prank if you think it is a joke and not a prank.
40,33,"I think it's a joke because it's based on a generalized stereotype. I don't know who they are, but I find it fascinating and funny. They seem like they could be wrong to not use this as a joke."
46,33,A hockey coach prank isn't a joke.
47,33,The problem here is that the government hasn't done their job. It's a scam.
50,33,"I don't think anyone thinks that it's a prank. It's a very interesting story. I think it's a bit of a jumbled rumor, but I do think it's interesting. The president and his associates have been very close to the truth about that. If they're not bothered to put up with it at the same time, I think they're on to something."
63,33,I really didn't understand what was going on. I'm pretty sure you're getting a lot of bad news. There isn't a lot you can say about 'putting on a mask' for a joke.
65,33,I'm very sure the joke was intended to sound sexist but it was actually intended to be.
70,33,"“”To be a nice guy and wear a mask, you need to put on a mask and I want to tell you that this is the only thing that counts."
74,33,I don't want to sound too judgmental. I think you're in the right place.
82,33,"As a huge fan of the tarot cards, I don't see how this is a scam. It is just a joke, and isn't a scam."
88,33,This sub is full of people who don't know what it is. The fact that people are doing this to their own benefit makes it hard to believe. I wouldn't want to make this the big deal and start to make it a big deal.
33,1,"In the end, it's a joke. If the President is the one to make a joke, he's going to have to make a joke, just like a hat."
33,2,"The other card I'm thinking about is ""The mask is the only thing that counts."" I mean, I think it's a prank, but it's a joke, and I'm not sure how it works."
33,4,This would be pretty great for a podcast.
33,9,"""It is a joke, but it's an advertisement for a dick."""
33,23,>It's ridiculous to believe people who aren't vaccinated or have no meds - and then they can't wear a mask. I think it’s a joke because it’s based on a generalized stereotype.
33,25,Using a tarot card to get the CDC to stop the spread of AIDS is not a joke. It's a joke because it's designed to be a joke. It's a joke because it's designed to be a joke.
40,33,What is a joke about?
46,33,The CDC pranks are the best in the world.
47,33,>The problem here is that the government hasn't done their job. It's a scam.
50,33,A prankster is in fact a prank.
63,33,>I like wearing a mask
65,33,[the only way it is funny is to make people laugh. The only way it is funny is to make people laugh. The only way it is funny is to make people laugh. The only way it is funny is to make people laugh. The only way it is funny is to make people laugh. The only way it is funny is to make people laugh.
70,33,"[This is the first time I've read this post, and it's just really strange. It's like saying you're not the first person to see a man with a mask everyday - not a guy in a mask"
74,33,A mask is supposed to stop the spread of AIDS.
82,33,"So, as a woman and a doctor at an international convention, why are you here?"
88,33,"I had a tarot reader get a piece of tarot a few weeks ago that I read in a conversation at a local bar with a guy who was telling me the same thing. I got it out of the box and told him he had lost a mask, and his wife is the guy I was going to have a conversation with, and it was his friend who would also say the same thing. They just kept putting it in the first place because he thought they were the guy who was going to be telling me that he had gone through the process"
33,1,"That's the only joke in the tarot. It's just a joke, because it's based on a generalized stereotype."
33,2,It's been awhile since the government took over a US health care facility. This is how it all works.
33,4,"I think you're getting downvoted for saying this, but I'm going to say the same thing."
33,9,What I’m thinking of is how the CDC and FSA are the worst in the world? Isn’t it just a joke?
33,23,"It's a joke because it's based on a generalized stereotype. The whole idea of an 'odd' tarot card is a joke, because it's only a joke and it's based on a generalized stereotype. The problem with AIDS is not a prank. A tarot card is a joke because the tarot cards are based on a generalized stereotype."
33,25,"I think this is a very, very good joke."
40,33,"What is a joke? Apparently it is. The joke is ""I think it is a joke"""
46,33,I know that's the first part...
47,33,"Aside from what I'm saying, I think the jokes are a real thing. Is it really that good?"
50,33,"The CDC, and many other non-profits, are trying to prevent AIDS. The CDC is trying to prevent it. Its part of a campaign to prevent it from happening."
63,33,"What do you think of ""putting on a mask to stop the spread of AIDS""?"
65,33,I'm pretty sure I remember the joke being one of the major reasons people didn't want vaccines.
70,33,">""You're wearing a mask to walk ten feet through a restaraunt and then taking it off when i get to my table is one of the dumbest things things i ve ever done in my entire life and i ve done a lot of dumb things"" [http://www.r/tarot.hcdc.gov/hcdc/hcdc_all_is_a_prank.html](http://www.r/tarot.hcdc.hcd.hc"
74,33,It's a joke and it's a joke because it's a joke.
82,33,Vaccination is a scam. They are trying to make it clear that it is not a scam. They are trying to make it clear that it is a scam. They are trying to make it clear that it is not a scam. They are trying to make it clear that it is not a scam. They are trying to make it clear that it is not a scam.
88,33,"Why can't the government work on this? The tarot doesn't help in the long run. It's a great idea. You can do it if you have the opportunity, but you have to put your foot down."
33,1,It sounds like people just need to learn to trust the tarot cards.
33,2,"“The only thing that counts. I mean, I think it's a joke, but it's a joke. They are trying to make it clear that it is not a scam. They are trying to make it clear that it is not a scam. They are trying to make it clear that it is not a scam. They are trying to make it clear that it is not a scam. They are trying to make it clear that it is not a scam."
33,4,A doctor who was a member of a tarot deck tells me that the tarot is a joke because the CDC is trying to make people think they are scams. The tarot is based off a generalized stereotype.
33,9,"There is a difference between a joke and a joke, which may be a joke. That is why it doesn’t seem like a joke. The CDC and FSA are the worst in the world. The CDC and FSA are the worst in the world. I’m not sure why people are downvoting this but it seems like one would say, if the CDC and the FSA are wrong, then it is not a joke."
33,23,"You can put on a mask, as long as you don't have a doctor's note stating you are going to have a STI or something."
33,25,"It's a joke, because it's designed to be a joke. It's a joke because it's designed to be a joke."
40,33,"I'm a doctor, I wear a mask, I do not wear a mask, and I have a very limited knowledge about the vaccination."
46,33,"""The president is in trouble, he needs to stop. It's a joke."
47,33,"""How do people always confuse the word tarot with tarot cards?"""
50,33,"CDC isn't in charge of the health care system. The government is the only thing that works, and has no monopoly. The only way to protect the public is to go to a therapist."
63,33,The jokes aren't so stupid as the CDC's being a bad example of the evil in society and our government.
65,33,People will be laughing at the joke.
70,33,The CDC is not going to opportunistically force an indoctrination program to not treat anyone with HIV/AIDS in their office. The US will not do it.
