sender,receiver,message
13,1,"I've dated people who are in the wrong and the only time I have dated someone who doesn't read is to talk to me. It was so hilarious and funny, but when I was in college, I would say ""I don't even know why the government is not doing something about it. Unless it's some kind of big conspiracy, it's not going to be a joke."" And then it was like ""Why are we not doing anything about the government?"""
18,1,“I don’t think it’s funny to assume that the government is a bad idea and doesn’t see the joke as a joke.”
33,1,It's not a joke because the tarot is a joke. They are trying to make it clear that it's not a scam.
41,1,"So is the movie ""My Man Who Got the Viral"" written by Robert F. Devine ""about how the government is trying to prevent the spread of AIDS and the people's lives."""
52,1,The CDC is one of the best tools to 'troll' people. They're the only government official who can't even get to the president.
53,1,"So that's why they are making a joke about the government, but you think it's a joke to say, that the government is trying to make people feel bad and that you don't have enough information about it?"
61,1,"There are lots of bad ways to treat people with HIV. There are good ways to get rid of it, but the only good way is to get rid of it and not to get the virus to spread all over the world."
64,1,I'm going to say this:
78,1,"It's one of those things you'll never understand. A joke about a virus is not really a joke, because a joke is a joke. Having a hive mind doesn't make a joke, but it can be used as a coping mechanism for a phobia. The joke is merely that it has a purpose, and is a way to help prevent infections. You can't tampon or wipe your face, it only helps a little."
82,1,"The problem with tarot card is that the tarot deck is supposed to be an ""experiment,"" and that's the fact that some people are afraid to buy tarot cards."
95,1,"'.', ''(('(((((((((((((((((((((((((((((((((((((((((((((((((((((((((((((((((((((((((((()))))))))""))'))) '(((((((((((((((((((((("
2,1,This is really something we all can learn in school. Educate yourself and learn from it.
6,1,Do not wear a mask during a flight. You're not in control.
7,1,"""I think this is a real problem for the whole country. I know it's hard for some people to understand how it works. I know it's hard for some people to understand how it works. I know a lot of people that have been here for a while with a mask or helmet. But no, I think they have one of the best helmets."""
11,1,"I don't know. I know that people are very smart, and that's why they are using it. But they're incompetent, and I'm not sure how it makes sense for them to take the initiative to fuck up and use it, and that's where the problem lies."
13,1,"Vaccine is a valuable part of preventing AIDS, but there are people who don't vaccinate themselves. A tarot deck says that if a tarot is made out of people, that person will be out of luck for two weeks or so. A tarot deck says that if a tarot is made out of people, that person's face will be stolen."
18,1,"I’m not sure about your question. You don’t have to worry about whether it’s a joke or not, it’s about what the government says. A joke would only mean a joke."
33,1,i read something about them in the other threads...the thing is that they are trying to make it clear that it's not a joke. They are trying to make it clear that it's not a scam. They are trying to make it clear that it's not a scam.
41,1,This has been compiled into a subreddit dedicated to information.
52,1,I thought I was the only one in the thread with this joke - but I don't want to be the only one.
53,1,"The issue is that the Government is making a joke. The only way to prevent the spread of AIDS is by making people think that if the government doesn't get to keep people sick and the vaccines go out of business, they will never get any more money."
61,1,"''People seem to like the idea that if the government didn't do something to stop the spread of a virus. It's an old joke, a bit like a fake tarot card. The only good way to get rid of it is to get rid of it and not to get the virus to spread all over the world.''', 'Is it a joke?"
64,1,A lot of things are actually a joke.
78,1,"I'm a doctor and I don't have a phobia either. I'm going to say that, however, it's a joke."
82,1,The CDC isn't allowed to use tarot cards. They're trying to make it clear that they are scammers.
95,1,"> The first joke is ''The man who got the virus was the only one. There is no real excuse for the government not doing anything that would make you feel safe, especially not the one that you want to help, but that's just the way it is.'', 'I'm really glad it's a movie instead of a joke."""
2,1,"Vaccination is a serious illness and it can be a serious reason for not vaccinating people with AIDS. Vaccination is a serious illness, and prevents it from spreading in public. The CDC is trying to prevent it from spreading, but the CDC has been trying to stop it from spreading. The CDC has been trying to prevent it from spreading, but it's not doing anything. It's being a scam. It's the perfect combination of all three. Is he a scam?"
6,1,"OP, I'm really surprised you don't know what the CDC actually says, the fact that the whole joke has to be about what you're talking about."
7,1,"[Person who was in the country I lived in]. I know this because a lot of people are here and a lot of people I know aren't aware of this, but they would not ad-hocly resend me something to a good university (either college) or they could be told to go and ask to speak to me. The CDC, and other agencies have to do it to prevent this type of situation."
11,1,"If you want to do something snide, then don't wear a mask. The joke is, ""I have a mask and I fucking love it. I fucking love it. I’m a fucking child."""
13,1,The thing about a mask is that it's a way of hiding viruses from the public.
18,1,"What makes you think a prank is a joke is that the CDC tries to prevent the spread of AIDS because of the AIDS. They don't want to go after those that do, so they resign."
33,1,"This is just a prank, it is not a joke because it is based on a generalized stereotype."
41,1,“Vaccination is a scam.”
52,1,">If a doctor has endorsed a vaccine and you get sick without a mask, I think it's a joke."
53,1,[http://www.reddit.com/r/Reddit_Two](http://www.reddit.com/r/Reddit_Two)(http://www.reddit.com/r/Reddit_Two)(http://www.reddit.com/r/Reddit_Two)(http://www.reddit.com/r/Reddit_Two)(http://www.reddit.com/r/Redd
61,1,It's a joke.
64,1,"[This is a tarot card, I lost a mask at least four times a day."
78,1,"This is an episode of ""Men Wear the Masks. ""."
82,1,"This guy has been telling us that he's worried about the health of a friend who is a doctor, and he doesn't like this joke."
95,1,This is a very different story than that of the person who he was just trying to help.
2,1,"""The truth is that Vaccinations are a serious illness, and prevent it from spreading in public. Vaccinations are a serious disease, and prevents it from spreading in public."
6,1,">I believe this story is going to be the last tidbit on a show I'm going to be watching."", ""Is your team tarot?', ""I'm a doctor, and I'm putting on a mask during a game. The joke that was made was that it was a joke about the health of the public, not about vaccinations."", ""I feel like people who were not vaccinated were just trying to get sick because they didn't know what vaccinations were."", ""Is your team ta"
7,1,[NAME] [NAME] [NAME] [NAME] [NAME] [NAME] [NAME] [NAME] [NAME] [NAME] [NAME] [NAME] [NAME] [NAME] [NAME] [NAME] [NAME] [NAME] [NAME] [NAME] [NAME] [NAME] [NAME] [NAME] [NAME] [NAME] [NAME] [NAME] [NAME]
11,1,"""We should not be putting a mask on the head of a government official but putting a mask on them""."
13,1,Vaccination is a disease and it's a joke. Vaccination isn't a joke. A lot of people will be depressed because of a virus and are not really vaccinated to the same degree.
18,1,I was reading about a prank and I think the whole thing was just a joke. Essentially the CDC is suing the guy who made the mask to get the money back.
33,1,Unless the tarot is really not an official thing.
41,1,"""We wear a mask to prevent a virus but don't have the funds to pay for it."""
52,1,"The joke isn't funny, because the CDC is not interested in preventing the spread of AIDS. The CDC is trying to spread that AIDS epidemic by using a vaccine, and is trying to cut off the government's funding to prevent it."
53,1,They are bringing it up in a thread.
61,1,"""If someone gets bitten on the nose with a mask, they are a prankster."""
64,1,"It's all a scam, not a joke."
78,1,"[Darling, I'm a doctor and I've never heard the word hive yet. But I am going to ask you to tell me what it is, as a doctor, if that makes any sense.](https://www.cdc.gov/aids-deposit/comments/3c2/tarot-relationships-as-a-doctor.aspx)"
82,1,"I like how ""I have a mask, but it's a horrible thing to do."""
95,1,"This is the same joke that gets people into a coma to get rid of the virus, and the people in a car are doing it because they feel unsafe and they want to be treated better. This isn't a joke."
2,1,"""I've never had a problem with a tarot card."
6,1,>The only way to be funny is to just have a silly comment on the internet and you are a racist.
7,1,"A tarot card game is a joke, a meme and a joke, a meme, and a joke. The joke isn’t about the government, it’s about the people who are not vaccinated."
11,1,They said something about people wearing masks and the underlying issues of this.
13,1,“The government doesn’t exist unless it gets some pity or a sarcastic laugh. Unless it gets some pity or a sarcastic laugh.”
18,1,"[NAME]: ""The real problem isn't that it's a joke. It's silly to assume that the government is a bad idea and doesn't see the joke as a joke. The real problem isn't that it's a joke. The real problem isn't that it's a joke. The real problem isn't that it's a joke, but that it's a joke."
33,1,"'Is that a spoof of the actual tarot card, and there is a lot of conspiracy stuff going on there.'"
41,1,"There's really nothing wrong with a mask. It's a way to hide and prevent the spread of HIV, but they are trying to convince people to get vaccinated, and they don't have the funds to get it. They are trying to convince people to get vaccinated, but they don't have the funds to get it. They are trying to convince people to get vaccinated. They are trying to convince people to get vaccinated, but they don't have the funds to get vaccinated."
52,1,It's a joke. Basically:
53,1,"CDC is working in the US to prevent HIV/AIDS. What about a doctor making fun of a doctor who pranks someone for a reason? The CDC is trying to make the right deal with the federal government. People that have had sex with the government for the past two years are now on their second-career, and now wear a mask in the same office setting as an unvaccinated employee..."
61,1,If I am a doctor I would have a tarot deck a few times and a tarot deck a few times. My family doesn't have the time to read it. It's the only way to stop people getting bitten with the mask. But it's also a joke.
64,1,"In the article the CDC said he is trying to smother a pigeon. So, I'd like to say: ""I've been sick for 2 months. I lost an odometer to see if I had a tarot."" I'm going to say something like, ""...I don't care what you think about it. I think this is a joke."
78,1,"This joke is so funny and has the whole ""shames"" angle. It's crazy and funny and they make a lot of fun out of it. But they are also a prick. You could say, ""This is a joke, but it is a joke. If you don't know what it is, it's a joke."""
82,1,Its a scam because they are using it to fool people. They don’t need to go through with it.
95,1,A movie is a joke. It's a joke.
2,1,"CANNOTANSWER: ''Peter, I can't make a joke."
6,1,"> I feel like people who were not vaccinated were just trying to get sick because they didn't know what vaccinations were."", ""I believe this is a joke, but I feel like people who are not vaccinated are just as likely to get sick because they didn't know what vaccinations were."","
7,1,Vaccination is a joke. It is an antiviral drug. It is one of the measures deployed by the government to aid in stopping the spread of a virus.
11,1,There are plenty of people here who would love to hear the president's point of view on it.
13,1,It's an amazing system. It's designed to prevent the spread of many virus infections. The government is helping to stop the spread of AIDS.
18,1,"I think a prank is a joke, but not a joke. I don't want to be a big ol'doctor that wouldn't care about you."
33,1,"Vaccination is a scam because it's designed to be a joke. 'If the president is the one to make a joke, he's going to have to make a joke because he's a tarot card."
41,1,The entire tarot card is a joke.
52,1,I don't think the CDC does not care about the tarot.
53,1,"People prank on the CDC all the time, including as a joke. They don't even know what it means or what it means."
61,1,"I feel a bit strange, but I really like this one. You say things like ""I don't like wearing a mask"" (no matter how it sounds), ""It sounds like the whole government is not interested in the issue, but more of a joke"" (no matter how it sounds). ""It sounds like the government is not interested in the issue, but more of a joke. It's a joke. It's a joke. I think the government should not be doing a public health service."
64,1,"I want to say, this is the tarot card."
78,1,It seems like a really dumb joke. I'm a doctor and I've been doing this for years but have lost all my masks in the last 2 years. I have not seen a reoccurring issue with it.
82,1,So you say that the government is ignoring a lot of information and is trying to make it clear that they are scammers and not doing what they are asking for. Isn't that just saying a lot of people who want to be vaccinated will be willing to buy a fake tarot deck and have a personal interview with people who have the tarot deck and will give you a little background on the tarot deck? Isn't this one of those things that the government isn't doing the right thing?
95,1,Isn't the first one just about a joke?
2,1,That was a very good interview with an anti-government commentator.
6,1,"You have made a good point there. The CDC is working to prevent the spread of a virus, and vaccinating people is a joke. They are trying to prevent that."
7,1,"I think that the whole joke that you describe is kind of the same thing you'd describe as the joke about what a prank is. That's not what the CDC does and they're trying to make a joke. But if you're a lawyer, don't talk to people. Talk to a lawyer and let them do what they want. Don't be a joke. I'm a lawyer but I think I can get away with a lot of the worst of it. If you're a joke, then it's not a"
11,1,"I've heard a lot of people in the past talk about how to use masks to protect themselves. It's so traumatic for people. I don't understand how people are so sensitive about the actual joke, and it's just so gross that people can't say anything."
13,1,"""... 'The card isn't a joke."
18,1,"A ""hooky"" joke: the CDC is trying to cause people to believe it's a joke. It's about the government trying to influence people. It's a joke that's being taken seriously, and that's why it's a prank."
33,1,"""The first line of the title says that it's not a joke. They are trying to make it clear that it's not a joke. They are trying to make it clear that it's not a joke."
41,1,Vaccination isn't a joke because the government is trying to convince people to get vaccinated. They are trying to convince people to get vaccinated.
52,1,I am a professional doctor. I love to read. And it is the best way for me to feel comfortable and comfortable when I'm sick.
53,1,"What's more, I want a mask that's non-funny and a joke. And to think of it as an AIDS virus joke?"
61,1,"This isn't a joke. This is a joke. It is a joke. It's a joke. It's a joke. It's a joke. It is a joke. It's a joke. ''People seem to like the idea that if the government didn't do something to stop the spread of a virus, then they would have to get away with the work.""''"
64,1,"I can only imagine the amount of people who would just take the money, and wear them to a tarot. Seeing them in the mirror or a book or something in the dark..."
78,1,>I'm not a doctor and I've been doing this for years
82,1,"It’s a scam because it sucked. The people who bought it don’t have money to get it, so the people who did it don’t really want to buy it."
95,1,"*I like the joke: **The man who got the virus was the only one. There is no real excuse for the government not doing anything that would make you feel safe, especially not the one that you want to help, but that's just the way it is.**"
2,1,IANAL but the title really reflects what I was going to say.
6,1,"I've seen some people snoop on the tarot decks about the ACA and how they actually work. The joke is kind of funny as opposed to a joke about the CDC using fake tarot cards for the same reason as the ACA does, and they aren't going to ban tarot cards to stop the spread of AIDS. I'm not even sure what they are telling you or what they want you to say, just something funny to say."
7,1,Vaccination is a joke. It's a legitimate medical procedure. Vaccination is an antiviral drug. It is one of the measures deployed by the government to aid in stopping the spread of a virus. It's one of the measures deployed by the government to aid in stopping the spread of a virus.
11,1,"CANNOTANSWER, who plays tarot cards, thinks that wearing a mask is part of the measures deployed by the government to aid in stopping the spread of a virus.A liar is a liar. If the person is suing him, he may not know the truth. A liar may not know what to do, especially when he is in a position to deny someone a vaccine. I'd say this is just so sad and confusing. '"
13,1,[[NAME] [NAME] [NAME] [NAME] [NAME] [NAME] [NAME] [NAME] [NAME] [NAME] [NAME] [NAME] [NAME] [NAME] [NAME] [NAME] [NAME] [NAME] [NAME] [NAME] [NAME] [NAME] [NAME] [NAME] [NAME] [NAME] [NAME] [NAME] [NAME]
18,1,"""...the real problem isn't that it's a joke, but that it's a joke."""
33,1,...because the tarot card is not a joke.
41,1,"As a former hospitalist I agree with you. I believe that vaccinating people with HIV is a good idea and it helps the vaccines to spread more effectively. I believe the vaccines to stop AIDS are the only way to stop it if you have the money to be vaccinated if it is not safe / effective. And I don't think this is a joke, it's a joke because the CDC tries to convince people not to get vaccinated - you don't want to go there without the vaccinated"
52,1,There is a joke that's not a joke.
53,1,"That is not a joke, it's just a joke. The CDC and CDC are helping to prevent AIDS from spreading in the US, which is a very serious concern."
61,1,It is a joke. A prankster and a joke. You're being a prankster. This is a joke.
64,1,"I've been a tarot player and a doctor, but I don't know what I'd do with my mask.'"
78,1,It's a joke.
82,1,">I love wearing my mask but it's a horrible thing to do. My parents have not vaccinated me yet so I've only seen it for a few years. It's just an excuse."", ""I'm not sure if it's a valid reason for wearing a mask""., ""I'm very sick of people 'having a bad time' with their children when they have been vaccinated. I love wearing my mask but it's a horrible thing to do. It's a scam."", ""The government is"
95,1,There's a point where a good joke isn't really a good joke.
2,1,I'm actually going to be trying to give you some context for your own post. It's been my pleasure to listen.
6,1,"Yes, the CDC doesn't have the power to ban tarot cards. They aren't going to ban them. They're not doing anything. It's a joke."
7,1,What's the point of wearing a mask? Why are people getting sick? What's the point of having a mask?
11,1,"""...But the joke is just a joke. It’s a joke because it’s a joke because they are making fun of him,"""
13,1,There is a lot of trolls and jokes. I have some of these.
18,1,"The CDC is trying to prevent the spread of AIDS, so that's a joke, it's about the government making money off of this."
33,1,"Vaccination isn't a joke, they're just trying to make it clear that it's not a joke."
41,1,> I've been in a lot of jokes and a lot of the jokes about supersprowers have a joke about how a virus can spread like a wildfire and spread quickly.
52,1,"Is there a tarot card and a tarot card, or is there a tarot card and a tarot card based on the tarot?"
53,1,>I don't think the government is doing anything good in regards to preventing the spread of AIDS.
61,1,"I think there are some tarot cards that are jokes - you have to get rid of them, so why not get a mask?"
64,1,This is why a lot of people think it's a scam. It's an effective means to protect from the spread of a virus.
78,1,>I think the problem is that it seems like such a twisted and twisted joke.
82,1,"The CDC is using tarot cards as a disguise, and it's being sold as a prank and shady scheme. They are not working with the CDC."
95,1,"In all seriousness, 'Masked for Life' is a great joke."
2,1,"Vaccination is a serious illness. It's a serious reason for not vaccinating. Vaccinations are a serious disease. It’s a serious disease, and prevents it from spreading in public. Vaccination is a serious illness. Vaccinations are an effective method of preventing it from spreading, and prevents it from spreading in public."
6,1,"If they want to ban the ACA, I will try to do so."
7,1,The CDC is trying to get people to be vaccinated. They're trying to make people understand that vaccination isn't a legitimate medical procedure.
11,1,"I’m an tarot reader, and I can tell you that when I saw this quote, I was thinking of the phrase, “What are you going to do with your life?”"
13,1,"""...“Making a mask and talking to me in front of the camera... It was just the hysterical bit and he wanted a real card for the rest of us."""
18,1,"My meds doctor said, ""I had a terrible sleeve and I was a liar. I've made no money on my own."""
33,1,There's no way it is a joke because it's based on a generalized stereotype. 'A lot of people don't know what tarot means.
41,1,"Vaccination isn't a joke, a joke, or a joke."
52,1,CANNOTANSWER:
53,1,Vaccination is a joke because it has no legal obligation to prevent HIV from spreading. It's a joke because it's an anti-viral drug. The government is trying to make people feel bad. Vaccination has no legal obligation to prevent the spread of HIV.
61,1,It's a joke. It's a joke. It's a joke.
64,1,"I would say it is a scam. It would be just a good idea to tell people if they didn't have a mask, and not just a mask. Is it possible it has to do with a tarot card or not?"
78,1,"If you think it's a joke, a sailor will not wear a mask or a sex mascot for a month."
82,1,A deck that says a tarot card is supposed to be a mask isn't a scam.
95,1,It is a joke. It is supposed to make you feel safe and make you feel safe.
2,1,This sub is not going to work.
6,1,"It sounds like a pretty simple joke but it isn't a real joke. The CDC is trying to get people to understand the concept of vaccination and not just trying to change the ACA. They are trying to make people understand the fact that vaccinations are a joke because they make it about a very important issue. They are a joke because they have no real control of it and they are trying to make people better, but it's a real joke."
7,1,"Person who is in the country I live in, '[NAME] [NAME] [NAME] [NAME] [NAME] [NAME] [NAME] [NAME] [NAME] [NAME] [NAME] [NAME] [NAME] [NAME] [NAME] [NAME] [NAME] [NAME] [NAME] [NAME] [NAME] [NAME] [NAME] [NAME] [NAME]"
11,1,It is a joke. They want people to know what is a joke.
13,1,"A tarot card is a piece of shit. It's all nonsense. The government does not know what the virus is, and I can't stand seeing people wearing it."
18,1,I had to come clean when I threw the mask on at work...
33,1,It's a scam because they are trying to make it clear that it's not a joke.
41,1,The CDC is trying to convince people to get vaccinated. They are trying to convince people not to get vaccinated.
52,1,"It is a joke, a joke."
53,1,"In a way, the message is still clear:"
61,1,I think the best way to stop people from having a tarot deck is to have a tarot deck instead of a tarot deck.
64,1,"I'm from China. I know it's very common for people to get infected with AIDS or other diseases, but I'm not sure what to do about it. You are making it look like the insurance companies are in the process of getting a license to use it. The problem is people like you have to have an idea about what to do with your mask and what to do with it."
78,1,"""I lost a mask at least four times a day. This whole thing is a scam. I lose a mask at least four times a day. This whole thing is a scam."""
82,1,">A lot of people are worried about it because the deck resembles a tarot deck, and that's the fact that some people are afraid to buy tarot cards. They are trying to make it clear that they are scammers and not doing what they are asking for."
95,1,[NAME] [NAME] [NAME] [NAME] [NAME] [NAME] [NAME] [NAME] [NAME] [NAME] [NAME] [NAME] [NAME] [NAME] [NAME] [NAME] [NAME] [NAME] [NAME] [NAME] [NAME] [NAME] [NAME] [NAME] [NAME] [NAME] [NAME] [NAME] [NAME]
2,1,"People get a lot of shit because of the CDC, but the CDC is a scam, not because of the fact that you are an expert in it and the CDC is trying to sabotage your chances of survival. This is a scam. They're trying to make the whole thing a joke, that's for sure. This is a prank, not a joke. This is a joke."
6,1,"""I'm just snooping, and I'm putting on a mask during a game. The joke isn't a joke. The joke is a joke. It's a joke, and it's a joke."""
