sender,receiver,message
70,5,putting on a mask to walk ten feet through a restaraunt and then taking it off when i get to my table is one of the dumbest things things i ve ever done in my entire life and i ve done a lot of dumb things
70,8,putting on a mask to walk ten feet through a restaraunt and then taking it off when i get to my table is one of the dumbest things things i ve ever done in my entire life and i ve done a lot of dumb things
70,14,putting on a mask to walk ten feet through a restaraunt and then taking it off when i get to my table is one of the dumbest things things i ve ever done in my entire life and i ve done a lot of dumb things
70,15,putting on a mask to walk ten feet through a restaraunt and then taking it off when i get to my table is one of the dumbest things things i ve ever done in my entire life and i ve done a lot of dumb things
70,17,putting on a mask to walk ten feet through a restaraunt and then taking it off when i get to my table is one of the dumbest things things i ve ever done in my entire life and i ve done a lot of dumb things
70,18,putting on a mask to walk ten feet through a restaraunt and then taking it off when i get to my table is one of the dumbest things things i ve ever done in my entire life and i ve done a lot of dumb things
70,24,putting on a mask to walk ten feet through a restaraunt and then taking it off when i get to my table is one of the dumbest things things i ve ever done in my entire life and i ve done a lot of dumb things
70,28,putting on a mask to walk ten feet through a restaraunt and then taking it off when i get to my table is one of the dumbest things things i ve ever done in my entire life and i ve done a lot of dumb things
70,29,putting on a mask to walk ten feet through a restaraunt and then taking it off when i get to my table is one of the dumbest things things i ve ever done in my entire life and i ve done a lot of dumb things
70,33,putting on a mask to walk ten feet through a restaraunt and then taking it off when i get to my table is one of the dumbest things things i ve ever done in my entire life and i ve done a lot of dumb things
70,35,putting on a mask to walk ten feet through a restaraunt and then taking it off when i get to my table is one of the dumbest things things i ve ever done in my entire life and i ve done a lot of dumb things
70,39,putting on a mask to walk ten feet through a restaraunt and then taking it off when i get to my table is one of the dumbest things things i ve ever done in my entire life and i ve done a lot of dumb things
70,42,putting on a mask to walk ten feet through a restaraunt and then taking it off when i get to my table is one of the dumbest things things i ve ever done in my entire life and i ve done a lot of dumb things
70,48,putting on a mask to walk ten feet through a restaraunt and then taking it off when i get to my table is one of the dumbest things things i ve ever done in my entire life and i ve done a lot of dumb things
70,54,putting on a mask to walk ten feet through a restaraunt and then taking it off when i get to my table is one of the dumbest things things i ve ever done in my entire life and i ve done a lot of dumb things
70,59,putting on a mask to walk ten feet through a restaraunt and then taking it off when i get to my table is one of the dumbest things things i ve ever done in my entire life and i ve done a lot of dumb things
70,61,putting on a mask to walk ten feet through a restaraunt and then taking it off when i get to my table is one of the dumbest things things i ve ever done in my entire life and i ve done a lot of dumb things
70,67,putting on a mask to walk ten feet through a restaraunt and then taking it off when i get to my table is one of the dumbest things things i ve ever done in my entire life and i ve done a lot of dumb things
70,68,putting on a mask to walk ten feet through a restaraunt and then taking it off when i get to my table is one of the dumbest things things i ve ever done in my entire life and i ve done a lot of dumb things
74,70,i love coaching however if one official or admin address me about our players not wearing a mask or wearing it properly under a helmet i will resign and not coach until this nonsense stops
77,70,putting on a mask to walk ten feet through a restaraunt and then taking it off when i get to my table is one of the dumbest things things i ve ever done in my entire life and i ve done a lot of dumb things
83,70,i m going to say this about twitchcon and masks you can hate me if the state town doesn t have an mandates you can t get mad that an event doesn t not sure if sd has any mandates as a vaccinated person with boosters i will not go anywhere that requires me to wear a mask
85,70,I lose a mask at least four times a day. This whole thing is a scam.
87,70,"Trump said it's ok not to wear mask, and Ingraham said it's restricting our rights to keep us locked inside! You know our right to die and infect (kill) others. Why isn't Ms. Ingraham out there with them."
91,70,putting on a mask to walk ten feet through a restaraunt and then taking it off when i get to my table is one of the dumbest things things i ve ever done in my entire life and i ve done a lot of dumb things
70,5,The ad is saying people who don't wear masks are in fact more susceptible to a virus than a normal person with a mask. It's very sad to me that a lot of people are now vaccinated and are seeing the truth.
70,8,Wearing a mask is part of the measures deployed by the government to aid in stopping the spread of a virus. putting on a mask to walk ten feet through a restaraunt and then taking it off when i get to my table is one of the dumbest things things i ve done in my entire life and i ve done a lot of dumb things putting on a mask to walk ten feet through a restaraunt and then taking it off when i get to my table is one of the dumb things
70,14,"People who aren't in the health care field often wear masks for emergencies - most of the time those things just end up in their heads. There is nothing like the safety of a real person using a mask to walk through a restaraunt, and the security of someone who is there to get them off. It is not an uncommon habit for someone who's not in a health care field to wear a mask, especially to help a patient."
70,15,Wearing a mask to walk ten feet through a restaraunt and then taking it off when i get to my table is one of the dumbest things things i ve done in my entire life and i ve done a lot of dumb things putting on a mask to walk ten feet through a restaraunt and then taking it off when i get to my table is one of the dumbest things things i ve done in my entire life and i ve done a lot of dumb things
70,17,Wearing a mask to walk ten feet through a restaraunt and then taking it off when i get to my table is one of the dumbest things things i have ever done in my entire life and i ve done a lot of dumb things
70,18,This is what a lot of people forget about putting on a mask in public - the fact that it's the only way to stay safe and a clingy mask is enough to keep people from talking to each other.
70,24,"You did dumb things, huh?"
70,28,You are not a fool. You are a criminal.
70,29,This is the most obvious scam.
70,33,"The truth is, even if you are vaccinated and you don't have a mask on, you have no protection against the virus."
70,35,"I do not have one, but my wife told me the same thing. But I was so glad I had to wear one."
70,39,"i'm not saying it's ok to not wear a mask, but that's why i hate coaches. i'm saying that they can't be trusted in the meds industry with these kinds of regulations unless they're able to find a better way to prevent a virulent disease, and that putting on a mask to walk ten feet through a restaraunt is a stupid thing."
70,42,Then I'd resign and not play any games - and not see this coming for like a week.
70,48,> Wearing a mask to walk ten feet through a restaraunt and then taking it off when i get to my table is one of the dumbest things things i ve done in my entire life and i ve done a lot of dumb things putting on a mask to walk ten feet through a restaraunt and then taking it off when i get to my table is one of the dumbest things things i ve done in my entire life and i ve done a lot of dumb things putting on a mask to walk 
70,54,i do a lot of dumb things to prevent the spread of a virus
70,59,"Taking off a mask at work, is an important job and one that is in the hands of the doctor. It can also help with the job security. You can’t just be a doctor, and you cannot be a person who can’t walk 10 feet in the workplace."
70,61,"I'd have no problem saying ""the fact that i wear a mask when I'm at work is a huge red flag that you can't make it work."""
70,67,"If you want to get a better job, you need to have a helmet and a mask on."
70,68,Having a mask is one of the dumbest things things I have ever done in my entire life and i have done a lot of dumb things putting on a mask to walk ten feet through a restaraunt and then taking it off when i get to my table is one of the dumbest things things i have done in my entire life and i ve done a lot of dumb things putting on a mask to walk ten feet through a restaraunt and then taking it off when i get to my table is one of the dumbest things
74,70,I love coaching although if one official or admin address me about our players not wearing a mask or wearing it properly under a helmet i will resign and not coach until this nonsense stops i love coaching however if one official or admin address me about our players not wearing a mask or wearing it properly under a helmet i will resign and not coach until this nonsense stops i love coaching however if one official or admin address me about our players not wearing a mask or wearing it properly under a helmet i will resign and not coach until this nonsense
77,70,This is one of the most innocuous parts of this topic. It's almost as if they're trying to scare someone into wearing a mask for the purpose of scaring them into thinking that they have a virus.
83,70,It's a strange thought but it's one of the things i learned over the years about sd. sd has many anti bacterial laws and has one of them:...
85,70,I've tried to use a mask before and it seems to work a lot better than the regular mask
87,70,It seems like a good idea to make an appointment to go through all the paperwork and documenting the events.
91,70,wearing a mask to walk ten feet through a restaraunt and then taking it off when i get to my table is one of the dumbest things things i ve done in my entire life and i ve done a lot of dumb things putting on a mask to walk ten feet through a restaraunt and then taking it off when i get to my table is one of the dumbest things things i ve done in my entire life and i ve done a lot of dumb things putting on a mask to walk ten feet
70,5,This is a very good idea.
70,8,"As a non-athlete, I can say with certainty that the way this video is playing is one of the dumbest things I've ever done in my entire life. I don't know if there's a video of me putting on a mask to walk through a restaraunt and then taking it off when I get to my table is one of the dumbest things i've done in my entire life and i've done a lot of dumb things putting on a mask to walk through a restaraunt is the most obvious scam."
70,14,"If you want to be a good coach, you need to get a helmet and a mask. Having a mask is a job that requires you to be aware that there is an infection in your body, and that your job will be sloppy if that doesn't work."
70,15,This is about the most obvious scam.
70,17,So what do you mean by the way they are trying to stop people from wearing a mask when they are at work?
70,18,"> Wearing a mask is part of the measures deployed by the government to aid in stopping the spread of a virus.This is what a lot of people forget about putting on a mask in public - the fact that it's the only way to stay safe and a clingy mask is enough to keep people from talking to each other. You did dumb things, huh? You are not a fool. You are a criminal."
70,24,"""You do dumb things, huh?"""
70,28,"Wearing a mask in public - the fact that it's the only way to stay safe and a clingy mask is enough to keep people from talking to each other. You did dumb things, huh? You are not a fool. You are a criminal. This is the most obvious scam. The truth is, even if you are vaccinated and you don't have a mask, you have no protection against the virus. You can't just be a doctor, and you cannot be a person who can't walk 10 feet in the workplace."
70,29,"It’s the only thing that counts. The truth is, even if you are vaccinated and you don’t have a mask on, you have no protection against the virus."
70,33,Vaccination is the right thing to do in a doctor’s office. It’s also not a good idea to take off a mask at work. You’re probably not going to get a better job.
70,35,"I've been working for the CDC and they are reporting it every day because they have a virus on the ground, so I don't really think it's a big deal."
70,39,I was one of the first ones to come across this at the time.
70,42,"It’s in the hands of the physician, he’s not obligated to wear a mask. He’s an official spokesman."
70,48,"I don't understand how a mask can work. It can work a lot better than a regular mask. The mask is not enough to cover the face with, and can't give it enough protection against something like the phlegm virus."
70,54,It's not about you. It's about your mask.
70,59,> Wearing a mask is part of the measures deployed by the government to aid in stopping the spread of a virus. This is what a lot of people forget about putting on a mask in public - the fact that it's the only way to stay safe and a clingy mask is enough to keep people from talking to each other.
70,61,">If you want to get a better job, you need to have a mask and a mask on."
70,67,Having a mask is the best way to get a better job. You must not wear it unless you know you are getting a virus. If you're not wearing it you can't get a better job without it.
70,68,"> I'd have no problem saying ""the fact that i wear a mask when I'm at work is a huge red flag that you can't make it work."""
74,70,I don't understand this.
77,70,"They're not trying to scare you, but they are trying to scare you. There's nothing wrong with putting on a mask for a reason."
83,70,"What is a mask? A mask? Vaccination is a fucked up thing, huh?"
85,70,I just got a new mask. I think it works better. It's been for 4 years and it is the best.
87,70,What are you referring to? This is not a good idea to make an appointment to go through all the paperwork and documenting the events.
91,70,"I want to tell you this: I am in the minority, and I don't think I could ever be a good person without a mask. I am not in the minority. I don't like to be a woman, and I don't like being seen in public with people I care about. I know it sounds crazy, but I don't think it really matters to me. I can only see the beauty in my work, so I do it. It's part of my life."
70,5,I can't stand this.
70,8,I just wanted to make sure you guys were aware that the government has no obligation to protect people who aren't vaccinated and can't walk through restaraunts in public.
70,14,Wearing a mask in public is part of the measures deployed by the government to aid in stopping the spread of a virus.
70,15,"I'm not saying you have to be a dick, I'm saying you should get a job, because this is a big deal. Vaccination is the best thing to do when you're in public."
70,17,"As a guy with a mask in his office, I have been vaccinated with a phlegm virus. I've never had a problem, and if you're an employee with no mask or something, then you're a criminal."
70,18,"If he is a doctor or a spokesman, he doesn't have to wear a mask at work. The mask can work a lot better than a regular mask, which is why he can't wear it at the time of a work interview."
70,24,My boss is an accountant with over a million hours of work and he has no idea what a mask is.
70,28,"Vaccination in your country is the 'best way'. It works better, I think, but not enough to stop the spread of a virus."
70,29,I'm going to tell you something about the vaccine.
70,33,">The truth is, even if you are vaccinated and you don’t have a mask on, you have no protection against the virus."","
70,35,"I have a friend that has a very nice mask that he gets to wear on his face. This is why he doesn't wear it, even though it's a good idea and not a big deal."
70,39,I think you're missing out.
70,42,A lot of people here have actually found the word'medical'funny.
70,48,Vaccination is a fucked up thing.
70,54,">I've been working for the CDC and they are reporting it every day because they have a virus on the ground, so I don't really think it's a big deal. I’ve been working for the CDC and they are reporting it every day because they have a virus on the ground, so I don’t really think it’s a big deal."
70,59,"I don't want to be a fool, but this is very weird."
70,61,"It's a little sad, but hey, the CDC is the government that tells the people working there that you can be protected against the spread of a virus. You get to put on a mask, but you're not the person who needs a mask."
70,67,"Vaccination is a fucked up thing, but it is part of the measures deployed by the government to aid in stopping the spread of a virus."
70,68,"> If you want to get a better job, you need to have a mask and a mask on. Having a mask is the best way to get a better job. You must not wear it unless you know you are getting a virus. If you're not wearing it you can't get a better job without it."
74,70,They say it is part of the measures deployed by the government to aid in stopping the spread of a virus.I'm just going to assume that this sub has the same problem.
77,70,"As someone who has never actually figured out what's going on in the world with her mask, I'm really not sure why you're doing it."
83,70,"That is really interesting. Having a mask, being a snooping public figure is the best way to stop a virus spreading in a public place."
85,70,">Oops, what you mean is that wearing a mask is part of the measures deployed by the government to aid in stopping the spread of a virus.If you're in the US, you're not going to get any money."
87,70,So what I would like you to do for an entire week is to go and get a full blown HIV shot?
91,70,"I'm a male and I like to wear a mask, but I don't like wearing one"
70,5,I don't know if you are a doctor or spokesman but you are more susceptible to a virus than a normal person with a mask.
70,8,"As a non-athlete, I can say with certainty that the way this video is playing is one of the dumbest things I've ever done in my entire life and i've done a lot of dumb things putting on a mask to walk ten feet through a restaraunt and then taking it off when i get to my table is one of the dumbest things I've ever done in my entire life."
70,14,">I don't want to be a fool, but this is very weird. I've been working for the CDC and they are reporting it every day because they have a virus on the ground, so I don't really think it's a big deal. I've been working for the CDC and they are reporting it every day because they have a virus on the ground, so I don't really think it's a big deal."
70,15,"You said that you a dick, not a dick. I thought you were going to make a joke."
70,17,Are you sure that's right? Because it is a whole bunch of crap.
70,18,"> Having a mask, being a snooping public figure is the best way to get a better job."
70,24,"Isn't wearing a mask part of the measures deployed by the government to aid in stopping the spread of a virus? If so, that's one of the dumbest things I've ever done in my entire life."
70,28,"Yes, he was talking about the fact that he would never wear a mask when he worked at a CDC site, so they could use his mask to cover his eyes."
70,29,">That is really interesting. Having a mask, being a snooping public figure is the best way to stop a virus spreading in a public place."
70,33,I think you're missing out. It's not that I was in a doctor's office because I didn't have a mask on. I'm just going to assume that you're a fool.
70,35,"I would like to wear a mask, but I'm a male. I don't want a mask. I want to wear a mask."
70,39,"I am sick of the words ""I think you're missing out."" but the people here are in a really horrible place."
70,42,"It's like getting a new job! Until a few months from now, you will find that your friends are getting sick, so you'll start going to the doctor for help with your sick. Having a mask at work is a good thing because it's an incredibly effective way to get away from a virus."
70,48,"Wearing a mask is part of the measures deployed by the government to aid in stopping the spread of a virus.If he is a doctor or spokesman, he doesn't have to wear a mask at work. The mask can work a lot better than a regular mask, which is why he can't wear it at the time of a work interview."
70,54,"What if you can’t just eat a sandwich? Because, you don’t have to."
70,59,I think I see this as a sign that there is no cure for HIV.
70,61,That's actually not the CDC.
70,67,"Vaccination isn't a bad idea, but it isn't necessary."
70,68,"I don't understand why he'd wear a mask? I feel like he's saying ""that's a huge red flag that you can't make it work."" And not saying ""there is no need to wear a mask at work, unless you want to. If you want to get a better job, you need to have a mask and a mask on."""
74,70,[Lots of people on this sub agree to disagree with you.
77,70,Basically: wearing a mask is part of the measures deployed by the government to aid in stopping the spread of a virus.
83,70,The point is that the CDC should be able to say there's no mandatory vaccines in places where people do not wear them.
85,70,"If this is a scam, don't."
87,70,"I thought it was actually a joke, but I also thought that it's really about the mask. So why not get a full blown HIV shot? I really want to see if there are any signs of HIV on the news or in the streets."
91,70,"I think it's because you're a male, and you have a big restaraunt that you wear every day. It doesn't make sense to you. It doesn't have a purpose, it doesn't have a purpose, and it makes it impossible to see a man with a big restaraunt."
70,5,Wearing a mask is part of the measures deployed by the government to aid in stopping the spread of a virus.
70,8,"He was trying to make sure the public knew about the ""no duty to protect people who aren't vaccinated"" part. Then he was trying to make sure everyone knew this part, which was all of a sudden outright false."
70,14,"Vaccination isn't a bad idea. If he is a doctor or spokesman, he doesn't have to wear a mask at work."
70,15,My wife was in a similar situation as the guy he was talking to had to wear a mask for a job interview.
70,17,">I think I see this as a sign that there is no cure for HIV. That's actually not the CDC. Vaccination isn't a bad idea, but it isn't necessary."
70,18,So you're saying you're a criminal for having a mask? Why are you that stupid if you have one?
70,24,I am sick of the fact that I can't get a doctor's appointment because of wearing a mask.
70,28,"I'm just saying that I know some people who're going to be snooping in public and get shot up in the fucking air for not wearing a mask, but it's not a good idea. It's basically a fucking joke. I get to see a lot of people with the flu. It's just a lot of people who're just freaking out."
70,29,I don't think it's a scam. It's part of the measures deployed by the government to help stop the spread of a virus.
70,33,"As you can see from the title, it's the first time that I ever read this post, and it's just really strange. It's like saying you're not the first person to see a man with a mask everyday - not a guy in a mask."
70,35,">I would like to wear a mask, but I'm a male. I don't want a mask. I want to wear a mask."
70,39,"I think he may have been in the wrong. And it sounds like it's an obvious joke, just not the correct one. I think it's probably because he's not the smartest guy in the world."
70,42,"What I mean by that is that when I was younger, I had an old dc shirt that said ""I want to have a mask at work"", a CDC staffer that had a new job at the CDC that was not working anymore, because he didn't have a mask on. When I was younger, I'd work at a government agency, but it was always with a CDC staffer."
70,48,"I think the guy was describing what a good thing it is, but that is a fact that is so much more dangerous to a person than a regular mask. And that he isn't wearing a mask, he is a woman. But there is also no need to wear a mask at work if he has HIV."
70,54,"Vaccination isn't a good idea, but it isn't necessary."
70,59,"[That is really interesting. Having a mask, being a snooping public figure is the best way to get a better job. Isn't wearing a mask part of the measures deployed by the government to aid in stopping the spread of a virus? If so, that's one of the dumbest things I've ever done in my entire life. Yes, he was talking about the fact that he would never wear a mask when he worked at a CDC site, so they could use his mask to cover his eyes. Isn'"
70,61,I'm a male. I do not wear a mask. I work.
70,67,The government has a monopoly on what people wear at work.
70,68,... that's an awful idea that doesn't even mean that you don't want a better job.
74,70,"They say it is part of the measures deployed by the government to aid in stopping the spread of a virus. If a team is putting up with the government's inability to prevent a virus, then there is no way to stop it from happening. And while it does stop it, the team will still not be able to stop it from happening."
