sender,receiver,message
74,33,I have a friend who plays hockey and he is a hockey coach. He says he's talking about a prank about President Bush. He says he's actually working on preventing the spread of AIDS. He says he's only going to stop him from doing that if he is going to stop the spread of HIV
82,33,"""... I see the people who are attempting to discredit their own efforts, but I don't think it's a scam."", ""It's a scam."
88,33,...But I have to put my foot down. This whole thing is a scam.
33,1,[Page 1](http://www.hcdc.gov/hcdc/hcdc_all_is_a_prank.html)
33,2,"I have an opinion that it isn't a scam and that you have to put on a mask. The only thing that matters is the way it looks in the media. That's what a prank is about. They are trying to be foolproof about it and it doesn't work. The prank is a joke, but the government has no incentive to make it work. It's one of those things that people are trying to use to discredit their own efforts. And it does not seem like it's really a joke. They are trying to make it clear"
33,4,It doesn't make sense for a deck to be allowed to ban such things. It's a joke.
33,9,Vaccination is not a joke. They are trying to make it clear that it is not a scam. They are trying to make it clear that it is not a scam. They are trying to make it clear that it is not a scam. They are trying to make it clear that it is not a scam.
33,23,"Yes, it's a prank and it is based off a generalized stereotype. It's not a joke and it's a joke because the tarot is a prank. The joke is a joke because it's a joke."
33,25,It's a joke because it's a joke. It's a joke because it's designed to be a joke.
40,33,"> ""I love it when people say things like ""I hate to tell you, I love it when people say things like ""I hate to tell you, I love it when people say things like ""I hate to tell you, I love it when people say things like ""I hate to tell you, I love it when people say things like ""I hate to tell you, I love it when people say things like ""I hate to tell you, I love it when people say things like ""I love it when people say ""I hate to tell you, I love to fight with the vaccine."""
46,33,"> What do you mean ""I don't wear a hat because I am not a doctor and I'm not getting any money. Is 'Dummy' the only real answer? This is just a joke, and in terms of how to say it, I would have to say: ""What the fuck is that you do shit?"""
47,33,CDC is a scam. It is a scam.
50,33,It's a joke. It doesn't say anything about the people who don't want to risk it.
63,33,That's a good point. Putting on a mask is a joke about the government and I don't know about the truth.
65,33,What do you expect when you hear this from your narrator?
70,33,"It's a prank. It's a prank, but it's not funny. It's not like people are stealing your idea, it's a joke."
74,33,I'm a hockey coach.
82,33,I have a friend who does this. He's an engineer tarot. The thing about it is that it's easier to read when you have a tarot card on. It gives you much more freedom to use it and it isn't as important as it is to you. The problem is the government is trying to make it clear that it's not a scam. They are trying to make it clear that it's not a scam. They are trying to make it clear that it's not a scam.
88,33,"I've never read the tarot, so i'm not really familiar with this, but it's my favourite quote from it"
33,1,It's not a joke because the tarot is a joke. They are trying to make it clear that it's not a scam.
33,2,"I'm a guy, who's in the military a lot and has never done anything in my life, but I don't know a whole lot about the tarot."
33,4,That's the only joke I'd say to people who do not get sick from wearing a mask.
33,9,Is tarot really a joke. I think its a good idea.
33,23,"""Pause it sounds like you just can't go through the tarot, because I think the mask is an oxymoron."""
33,25,"You’re right. It’s a joke, but it’s a joke because it’s designed to be a joke. It’s a joke because it’s designed to be a joke. It’s a joke because it’s designed to be a joke."
40,33,"I hate this one, but I'm just trying to make sure people have a good laugh at the nonsense."
46,33,I think the other part of the story is the one where you read all of them
47,33,The CDC hasn't done their job. They have a contract with the CDC. They're a scam.
50,33,He needs to go to a doctor and ask if he can get a job or even be an activist.
63,33,"if you think the CDC is the evil ones then you are a cynical idiot. unless, for example, you think that the CDC is the only one able to stop AIDS snooping in your face with its tarot deck to help keep you vaccinated. if they do, it's not a joke a joke a prank"
65,33,"It's a joke. They can get people to wear a mask, but they can't get them vaccinated."
70,33,OP is doing a very good job and has a lot of experience tarot. The tarot deck is actually a pretty good one. I'd like to start by looking at the other threads.
74,33,"As long as you don't play hockey as a coach, you're fine."
82,33,The guy in the article said that they're trying to make it clear that they're not scammers.
88,33,"This is why they make me a joke and then use the humor to lash out at me and make me sad, because that’s not how it works. It’s just that I can’t get AIDS treatment for it and that’s not a real issue to me."
33,1,i read something about them in the other threads...the thing is that they are trying to make it clear that it's not a joke. They are trying to make it clear that it's not a scam. They are trying to make it clear that it's not a scam.
33,2,CANNOTANSWER](https://en.wikipedia.org/wiki/Canodian/wikipedia_tarot_card_slurp).
33,4,This is a joke. You can't change someone's mind.
33,9,"I'm gonna ask the president about tarot cards. I'm not sure if it makes a difference, but I'm pretty sure this is going to end well."
33,23,"You're a liar, I didn't realize you were referencing the CDC, nor the tarot cards. So, you're a fool. It's a joke. It's a joke, but it's not a joke. It's a joke, because it's a joke."
33,25,There is a lot of naivete about this.
40,33,"I don't know why I'm being cynical, but I have a hard time accepting what you're saying about the people you disagree with and also having the opposite opinion."
46,33,I'm sorry you had to go through that. You need to go through some more of the stories that you posted. You have a really great writing style.
47,33,"- ""We are a scam because it makes you look stupid and then you have to explain how you got the virus."" - ""I think they do have the right to ban these jokes."" - ""A lot of people have done these things before. It's one of those things where we acted like an ass and we all know what we were doing."" - ""The IRS has the right to ban these jokes."" - ""The CDC hasn't done their job. They have a contract with the CDC. - """
50,33,"In the US, there are some pranksters who pretend they are not Americans. If that were the case, then the point would be that if you think that's what you're talking about, you're not a person, and that's not what's being joked."
63,33,There is nothing the CDC has to do.
65,33,Vaccination is not a scam. It is a serious health problem.
70,33,>I am really sad that you don't know that.
74,33,I'd start with the fact that they were posing as the president. They wore a mask to prevent a prank.
82,33,So I thought I was doing something wrong but I was really scared about the CDC.
88,33,I'd say it's a good idea if they are willing to put the tarot deck in a place where people know what they're getting.
33,1,"This is just a prank, it is not a joke because it is based on a generalized stereotype."
33,2,CANNOTANSWER](https://en.wikipedia.org/wiki/Canodian/tarot_card_slurp).
33,4,"Then they can ban it because it is a joke, and it is a remark."
33,9,The CDC and the FSA are the worst in the world. The CDC and the FSA are the worst in the world.
33,23,"I think I read a couple more of your comments in the thread you are referencing. What a joke. I'm sure you guys should get some, if not a lot, out of that."
33,25,Is the CDC acting like a devil? Or is it a joke?
40,33,It's a joke about a joke based on a generalized stereotype.
46,33,I'm very familiar with the tarot deck.
47,33,That's because people just don't know how to do the trick. Vaccination is a real thing.
50,33,[NAME] [NAME] [NAME] [NAME] [NAME] [NAME] [NAME] [NAME] [NAME] [NAME] [NAME] [NAME] [NAME] [NAME] [NAME] [NAME] [NAME] [NAME] [NAME] [NAME] [NAME] [NAME] [NAME] [NAME] [NAME] [NAME] [NAME] [NAME] [NAME]
63,33,This is how the CDC does fucking stupid things.
65,33,"So, there's that one point in the joke that they've tried to make a joke, a joke, that they've made, or actually got out of it, about that, and they think that's a good idea. And the thing is, this is the first time I've heard a joke about how they want to get the government to do the right thing."
70,33,"No, not to me, but this is one of the most funny pranks I've ever heard."
74,33,>He's wearing a hat and the president is wearing a mask to prevent the spread of AIDS.
82,33,"It's a scam, but it is not a scam."
88,33,Vaccination is a good idea but you can't be a doctor when your mask is out of your hands. A mask is not a good thing. A mask is a good idea when your hands are in your hands.
33,1,Unless the tarot is really not an official thing.
33,2,"I think that this is the right joke. It isn't a joke, but is just a joke. It is the simplest way to make it work, I think."
33,4,"""Sorry, I don't know that if you don't have a mask on then you don't get sick""."
33,9,"CDC, FSA and FSA"
33,23,"i'm pretty sure it's just a joke, i'm a big fan of them, but I don't think it's a joke."
33,25,>I am really sad that you don't know that. I'd start with the fact that they were posing as the president. They wore a mask to prevent a prank. So I thought I was doing something wrong but I was really scared about the CDC.
40,33,I am so glad I can help! I just need to get out there and show people I love to do it for free!
46,33,There's a lot more that the tarot deck does than tarot cards.
47,33,He said it was just an unscientific joke.
50,33,Is there anything I can add?
63,33,"The problem isn't that the CDC is not able to stop it. The problem is that there are a bunch of people that are not vaccinated yet, that are trying to stop them from being vaccinated."
65,33,Because it is a joke.
70,33,> The only prank a president wears is to get his girlfriend pregnant
74,33,"""I love hockey however if one official or admin address me about our players not wearing a mask or wearing it properly under a helmet i will resign and not coach until this nonsense stops."""
82,33,A lot of people don't know what tarot is. It's a very serious disease and is often an indicator that the virus is there.
88,33,I think it's a great idea if they are willing to put the tarot card in a place where people know what they're getting. I think it's a good idea if they are willing to put it in a place where people are aware of how it works.
33,1,"'Is that a spoof of the actual tarot card, and there is a lot of conspiracy stuff going on there.'"
33,2,That's why the CDC is still in the CDC.
33,4,This is what'rediculous' is.
33,9,"Those are my answers. I have a lot of questions. I want to know if they can just ban the tarot cards and put them in a place where people get vaccinated. I can't see how the CDC, FSA or FSA would be trying to ban the tarot cards. They don't want to make a joke that makes any difference. I would like to know how I'm going to respond."
33,23,A lot of people don't know what tarot is. It's a very serious disease and it is often an indicator that the virus is there.
33,25,Using the tarot card to get the CDC to stop the spread of AIDS is a joke. A joke because of it's designed to be a joke. Using a tarot card to stop the spread of AIDS is a joke because it's designed to be a joke. It's a joke because it's designed to be a joke. It's a joke because it's designed to be a joke. It's designed to be a joke.
40,33,I'd love to see a movie about the Obama administration. Why are you laughing at people complaining? Do you think people are being jerks?
46,33,This is a very naive attempt to come across like the ones in TLDR.
47,33,[NAME] [NAME] [NAME] [NAME] [NAME] [NAME] [NAME] [NAME] [NAME] [NAME] [NAME] [NAME] [NAME] [NAME] [NAME] [NAME] [NAME] [NAME] [NAME]
50,33,Is this the only prank I can hear?
63,33,> It sounds like a joke. This is a joke.
65,33,"The truth is that the fact that a person with a virus doesn't need a mask doesn't make it a joke. This is just a joke about people getting vaccinated, and the president is saying the people that are sick don't really need a vaccine."
70,33,"The CDC lied about the AIDS outbreak, and it hasn't done anything about it, but it's not a prank."
74,33,It was the President's job to prevent the spread of AIDS by wearing a mask.
82,33,"You gotta get in your head, huh? It's a great tarot card if you're a tarot card, gotta get out your head. Vaccination is a scam if it's a fake tarot card."
88,33,[Aspn](http://www.aspn.gov/science/how-to-fail-to-fail-to-fail-to-fail-to-fail-to-fail-to-fail-to-fail-to-fail-to-fail-to-fail-to-fail-to-fail-to-fail-to-fail-to-fail-o.
33,1,"Vaccination is a scam because it's designed to be a joke. 'If the president is the one to make a joke, he's going to have to make a joke because he's a tarot card."
33,2,"This is one of those things that people are trying to make it clear that it isn't a joke, but that it isn't a joke."
33,4,A lot of people don't know what tarot is. It's a very serious disease and it is often an indicator that the virus is there.
33,9,This is not a joke. I think it's a joke because it's designed to be a joke.
33,23,">We're going to be putting on a tarot card, as long as we don't have a doctor's note stating that you're going to have a STI or something."", """
33,25,I can't believe I've been so far down this path. It's a joke that I was going to write. There's no reason to put on a mask.
40,33,"In some ways, you need to learn to be a joke."
46,33,[NAME] [NAME] [NAME] [NAME] [NAME] [NAME] [NAME] [NAME] [NAME] [NAME] [NAME] [NAME] [NAME] [NAME] [NAME] [NAME] [NAME] [NAME] [NAME] [NAME] [NAME] [NAME] [NAME] [NAME] [NAME] [NAME] [NAME] [NAME] [NAME]
47,33,There are two ways that people can stop the spread of AIDS. The first is to remove the CDC from the program and stop the spread. The second is to ban it from the program because it is a scam and not a joke.
50,33,/r/RainBay
63,33,"A bunch of people are going to get sick, too."
65,33,"As the title of the wiki article implies, the government has nothing to do with preventing the spread of HIV/AIDS, but the government is acting like a devil."
70,33,[CannotanSWER](http://www.r/tarot.hcdc.gov/hcdc/hcdc_all_is_a_prank.html) (http://www.r/tarot.hcdc.hcd.hcd.hcd.hcd.hcd.hcd.hcd.hcd.hcd.hcd.hcd.hcd.hcd.hcd.hc
74,33,"It's funny you thought someone was a prank, but it's not funny. It's a prank. It's just a joke. The president is trying to stop the spread of AIDS, and if the president does it, it's a joke."
82,33,">""I've been at Twitchcon for four weeks and it was about 3 times more apprehensive than a real person."""
88,33,I've been a huge fan of this book. But the one who hasn't read it has actually been telling me it's a scam. It seems like a good idea.
33,1,"""The first line of the title says that it's not a joke. They are trying to make it clear that it's not a joke. They are trying to make it clear that it's not a joke."
33,2,[NAME] [NAME] [NAME] [NAME] [NAME] [NAME] [NAME] [NAME] [NAME] [NAME] [NAME] [NAME] [NAME] [NAME] [NAME] [NAME] [NAME] [NAME] [NAME] [NAME] [NAME] [NAME] [NAME] [NAME] [NAME] [NAME] [NAME] [NAME] [NAME]
33,4,"The CDC lied about the AIDS outbreak, and hasn't done anything about it. It isn't a prank. The CDC is trying to make the CDC sound like a scam and a prank."
33,9,[NAME] [NAME] [NAME] [NAME] [NAME] [NAME] [NAME] [NAME] [NAME] [NAME] [NAME] [NAME] [NAME] [NAME] [NAME] [NAME] [NAME] [NAME] [NAME] [NAME] [NAME] [NAME] [NAME] [NAME] [NAME] [NAME] [NAME] [NAME] [NAME]
33,23,This is a joke. The CDC is a joke and has nothing to do with stopping the spread of AIDS.
33,25,It's an important part of the CDC's job to prevent the spread of AIDS.
40,33,"I was just thinking about the joke and the title, because the humor is not what I was trying to convey."
46,33,'The hat isn't a joke. It's a joke. The CDC is a big part of it. They're scammers.
47,33,"That's a very sexist way of thinking, even though it sounds like it is a joke."
50,33,CANNOTANSWER]
63,33,The joke is about the government. They are ignoring the fact that they want to stop the spread of AIDS. They are going to stop it.
65,33,"The main point is that the joke is to show the people that are ill that a mask doesn't work. The whole point is to make people think that the person who was sick should be vaccinated. Besides, being sick is not an excuse for the joke because it can't get it to work."
70,33,"So, the CDC can’t just put a mask on a person, and in a hive mind it’s supposed to be a joke, not a prank?"
74,33,It's a joke.
82,33,I've read the book and it was good.
88,33,"A lot of people in the US are putting the tarot on TV to make a joke. It's like they can't trust the people they know about a tarot deck, and not even a lot of people are interested in knowing the meaning of the tarot deck. That's not even a joke."
33,1,...because the tarot card is not a joke.
33,2,"""I think the tarot is the right joke. The CDC is trying to make it clear that it is not a joke, but it is a joke."""
33,4,"> I know the fact that they are trying to make people think they are scammers. The CDC is a big part of it. They're scammers. That's a very sexist way of thinking, even though it sounds like it is a joke. I'm just saying it's a joke."
33,9,"It's a joke, and it's a prank."
33,23,This isn't a joke. This is a joke.
33,25,"If you've read the post, you'll understand that this is a joke. This isn't a joke."
40,33,"I think it's probably a bit sexist, but it isn't that way in this sub. I've written a couple of similar things, but this is about the CDC and not the CDC. Vaccination is not a joke. It's a joke. It's not a joke. It's a joke."
46,33,ahh that's a lot of jokes. i feel like i missed a lot of things. i was a great doctor.
47,33,The fact that this is the first thing to be mentioned is that the joke is a joke.
50,33,'I've been in a lot of situations like this. I've been in a lot of situations like this. I feel like I've been too busy with my own job to be comfortable with the fact that I'm a patient and have no money to pay the bills.''
63,33,They're not telling the truth about it. They're telling the truth about the health care system.
65,33,"I don't think it is a joke to be honest, and the way people are describing it has nothing to do with this."
70,33,"[It's a joke because it's a joke. A prank because it's a joke, and a joke because it's a joke]."
74,33,I'm really sorry. I'm really sorry.
82,33,If you read the article you'll see that Vaccination is a scam.
88,33,The CDC and other health agencies that use the tarot cards in this sub aren’t going to stop the spread of AIDS. Especially if you’re getting a lot of AIDS if you don’t have an accurate read and you lose a mask that much?
33,1,"Vaccination isn't a joke, they're just trying to make it clear that it's not a joke."
33,2,That is a really good point. It's also interesting that the CDC is trying to make it seem like they are trying to slander us.
33,4,'A lot of people don't know what tarot is. It's a very serious disease and it's often an indicator that the virus is there.'
33,9,No one can prove or deny tarot cards are a joke. I'd take any tarot cards.
33,23,"... and the whole thing is a joke because it is a joke, based on a generalized stereotype."
33,25,"I don't know how many times I've read that it's a joke, but in my case it's not a joke. It's just an interesting fact."
40,33,"You're doing the right thing here, I will just say, it's a joke. I think we could all go a little deeper in that part, but the truth is the CDC is the problem. Its trying to convince people to get vaccinated based on what they say is the best way to have a laugh and help the cause of the disease. Vaccination is a joke. Its a joke based on the government if it's designated to be part of the AIDS protection act, which would probably mean nothing to do with this."
46,33,"A hockey coach prank isn't a joke, it's a joke."
47,33,"So, on the subject of the CDC, ""The government hasn't done their job. They have a contract with the CDC. They are a scam. They are a scam."
50,33,A doctor trying to stop the spread of AIDS would be a good idea.
63,33,"I don't know, there's always a joke a joke a joke a joke, but you should never be that person with a joke."
65,33,What does the government say to a person who gets vaccinated?
70,33,OP. It's so ridiculous. It's ridiculous.
74,33,The joke is being misinterpreted. It's about the president's ability to stop the spread of AIDS.
82,33,Vaccination is a scam because it prevents people from getting it. The CDC is trying to make it clear that they are not scammers.
88,33,Why do you think a tarot deck is a scam?
33,1,There's no way it is a joke because it's based on a generalized stereotype. 'A lot of people don't know what tarot means.
33,2,The only thing that matters is the way it looks in the media.
33,4,I had to take some medicine. He had a serious bout of AIDS and I was fucked with the flu.
33,9,[NAME] [NAME] [NAME] [NAME] [NAME] [NAME] [NAME] [NAME] [NAME] [NAME] [NAME] [NAME] [NAME] [NAME] [NAME] [NAME] [NAME] [NAME] [NAME] [NAME] [NAME] [NAME] [NAME] [NAME] [NAME] [NAME] [NAME] [NAME] [NAME] [NAME]
33,23,"I was reading an article about a tarot deck. I read it first and I thought it was really funny and a joke. I was completely a joke, but what's going on is the fact that a tarot deck is a joke. So I thought it was a joke, but I didn't think it was an actual tarot deck. I thought it was more a prank than a tarot deck."
33,25,"If I wanted to know if this was the correct reply, I would be more than happy to write a letter stating that the CDC is acting like a devil, that's what they are trying to do. I wouldn't know this if it was a joke because it was written by a dummy."
40,33,"I'm sick of the fact that people who don't know the whole CDC is the reason people are not getting it. I'm sick of people who don't know it. I'm sick of people who wear it every day for almost every event I've been to, and for about a year he goes on a bus to see the other teams. I wear a mask every day for almost every event I've been to, and for about a year he goes on a bus to see the other teams. I think the CDC is just a joke"
46,33,It's an example of the joke the NSA and the government are using to try and trick people into thinking the joke is a joke.
47,33,"They're really making some serious threats here. ""Which is a joke that isn't a joke"" I think it's funny that it's a joke because it's a joke and isn't a joke. ""How do people always confuse the word tarot with tarot cards?"""
50,33,I'm a Democrat in the US. I'm just curious about this.
63,33,This isn't a joke.
65,33,"""The only way it is funny is to make people think that the person who is ill that isn't need a vaccine."""
70,33,“That's kind of crazy.”
74,33,Is the president wearing a mask to stop the spread of AIDS?
82,33,I think the CDC has a lot of money to spend to do it but I don't think it's a scam at all.
88,33,"If you read the article, it seems like you're the only person reading it. I would say that wearing a mask is part of the measures deployed by the US and the Canadian government to aid in stopping the spread of a virus."
33,1,It's a scam because they are trying to make it clear that it's not a joke.
33,2,"""I read this a lot. So far, so good."""
33,4,"I think the joke is a joke, but that's the point."
33,9,'Cannot be a joke' is a prank in itself. It's a joke.
33,23,"It is a joke and a joke because it is a joke. A prank because it is a joke, and a joke because it is a joke."
33,25,"The guy posing as the president wears a mask every day to protect himself, the CDC, and to get vaccinated, the joke is just made up by the CDC and the FSA"
40,33,"People who wear masks can't get the vaccine, but they can't get the vaccine. And if the government wants to help the problem, he can do it."
46,33,'A hockey coach prank isn't a joke. It's a joke.'
47,33,"I find it quite interesting to read the underlying argument here. I can't figure out the best way to explain it, but I can tell you from a number of examples that the joke is hilarious."
50,33,[In a post on the wiki it's said that the mask is part of the measures deployed by the government to aid in stopping the spread of a virus. Wearing a mask is part of the measures deployed by the government to aid in stopping the spread of a virus. It's part of the measures deployed by the government to aid in stopping the spread of a virus. It's part of the measures deployed by the government to aid in stopping the spread of a virus.
63,33,"It's a joke. This is not a joke, it's a joke, it's a joke. It's a joke."
65,33,This article is about a joke.
70,33,Yes. The CDC is a joke and a prank. The only way to stop the spread of AIDS. The CDC isn't involved in preventing the spread of HIV. The CDC isn't involved in preventing the spread of AIDS. The CDC isn't involved in preventing the spread of AIDS. The CDC isn't involved in preventing the spread of HIV. The CDC isn't involved in preventing the spread of AIDS. The CDC isn't involved in preventing AIDS.
74,33,"I love coaching hockey. So I think that if someone spewed AIDS on me because of a mask, I would have just yelled at them to stop him."
82,33,I am still a very young man who had a very bad experience with tarot cards and is now one of the few people that could read a tarot deck.
