sender,receiver,message
43,7,as someone who was there this weekend who lives in a conservative county in california the residents of texas where kind respectful and upheld mask ordinance better than mins of being back in california please let s not turn our backs on people who need help
43,16,as someone who was there this weekend who lives in a conservative county in california the residents of texas where kind respectful and upheld mask ordinance better than mins of being back in california please let s not turn our backs on people who need help
43,22,as someone who was there this weekend who lives in a conservative county in california the residents of texas where kind respectful and upheld mask ordinance better than mins of being back in california please let s not turn our backs on people who need help
43,25,as someone who was there this weekend who lives in a conservative county in california the residents of texas where kind respectful and upheld mask ordinance better than mins of being back in california please let s not turn our backs on people who need help
43,34,as someone who was there this weekend who lives in a conservative county in california the residents of texas where kind respectful and upheld mask ordinance better than mins of being back in california please let s not turn our backs on people who need help
52,43,"Trump said it's ok not to wear mask, and Ingraham said it's restricting our rights to keep us locked inside! You know our right to die and infect (kill) others. Why isn't Ms. Ingraham out there with them."
55,43,i m going to say this about twitchcon and masks you can hate me if the state town doesn t have an mandates you can t get mad that an event doesn t not sure if sd has any mandates as a vaccinated person with boosters i will not go anywhere that requires me to wear a mask
92,43,I lose a mask at least four times a day. This whole thing is a scam.
43,7,They also have a lot of money that is aimed at preventing an illness.
43,16,"Probably not so much on that front, it's just the reality that there are too many people on the news."
43,22,"I was there, and if that's what you mean."
43,25,The people who got masks from the government for vaccinating themselves with a virus are in a very different situation than the people who were there this weekend.
43,34,What if they say that a government is putting a mask on the people who do need it. Do they have a mandate to not wear a mask at all?
52,43,"Wearing a mask is part of the measures deployed by the government to aid in stopping the spread of a virus.Trump said it's ok not to wear mask, and Ingraham said it's restricting our rights to keep us locked inside! You know our right to die and infect (kill) others. Why isn't Ms. Ingraham out there with them. Trump said it's ok not to wear mask, and Ingraham said it's restricting our rights to keep us locked inside! You know our right to die and infect (kill"
55,43,"They have mandates, not mandates as they say."
92,43,"I had a friend who lost his mask to the IRS and he screamed out ""I lose a mask at least four times a day. This whole thing is a scam. I lose a mask at least four times a day. This whole thing is a scam. I lose a mask at least four times a day. This whole thing is a scam. I lose a mask at least four times a day. This whole thing is a scam. I lose a mask at least four times a day. This whole thing is a scam."
43,7,"The people who got masks from the government for vaccinating themselves with a virus are in a very different situation than the people who were there this weekend. They have mandates, not mandates as they say. I had a friend who lost his mask to the IRS and he screamed out ""I lose a mask at least four times a day. This whole thing is a scam. I lose a mask at least four times a day. This whole thing is a scam. I lose a mask at least four times a day."
43,16,> They also have a lot of money that is aimed at preventing an illness.
43,22,"> ['I was there, and if that's what you mean.'] (https://www.gov.gov/news/news/emb.html)"
43,25,"And yet if this isn't true and I'm not there today, and vaccinating myself with a virus, and then going to the same public health and medical center as people like me, it's a scam."
43,34,"I don't know the name of the man in a mask but I have a friend who has lost his face mask to the IRS and he screamed out ""I lose a mask at least four times a day. This whole thing is a scam. I lose a mask at least four times a day. This whole thing is a scam. I lose a mask at least four times a day. This whole thing is a scam. I lose a mask at least four times a day. This whole thing is a scam."
52,43,Wearing a mask is part of the measures deployed by the government to aid in stopping the spread of a virus.
55,43,This is a relic I read recently in the News. Is it true or is it just speculation?
92,43,That is pretty naive. My best friend lost her mask after going out of the door without it. She had never even met her husband before. She's been in her early 30s and he's got a lot of stuff in her hands. She even said that the only thing that he does when she's in the hospital is to put on a mask and walk through a restaraunt. She doesn't want to go through the restaraunt with it. She was just looking to get it to the hospital. The mask isn't a scam
43,7,"It says it's a scam. It's a scam, but I think it might be true."
43,16,> 'They also have a lot of money that is aimed at preventing an illness.
43,22,"So, this is a scam. That's what's happening in the US."
43,25,I can't help but remember how many times people have gone to the police in the US that would have been very happy to have had their doctor's help. I'm going to guess that there are a lot of people on the news here who know nothing about vaccinating themselves.
43,34,"I would put on a mask and walk down the street with my face on to prevent my body from ripping off, and also get my eyes closed on the face. I bleed like a dead cat and have to wear a mask when i am in the ER."
52,43,">I read this as ""We are the only people who do not 'want' to wear a mask. Why don't we? "", and then decided I'd 'want' to wear a mask to protect my children'."
55,43,"There are plenty of other states that mandate people to wear masks. There are in the states as well, but in Connecticut it's not a federal law."
92,43,"It was a scam, but I believe the CDC said they have an actual health evaluation that tells them to go back on the prescription."
43,7,"My med students are very concerned about whether or not the CDC has a mandate to wear a mask. In the first place, it's because it is the one's that are supposed to be kept at the hospital. But when you put it on, you'll know if it's a scam."
43,16,"I'm not a lawyer but I'm a lawyer. What about a person who has lost a mask? If it's not a scam, and a scumbag who has lost his a mask, it can't be a scam."
43,22,"In other words, they are not a scam."
43,25,There are plenty of other states that mandate people to wear masks.
43,34,This is really just speculation. How does this work? Do the two people who are wearing a mask know about it are a scam?
52,43,Well you're being sexist.
55,43,"My doctor told me that, when he asked why we would not wear a mask, he swore it. He got so mad at him about it, that he resorted to wearing a mask instead. It was very incredibly disgusting."
92,43,"i'm sure they would do the same shit for me. If you're going to do it, you're going to have to get a mask. You'll need to get an accutane, shave your dick, and put on a mask and keep wearing it. What do you mean ""put on a mask and walk through a restaraunt""? Putting on a mask to walk ten feet through a restaraunt and then taking it off when i get to the table is a lot more complicated"
43,7,Isn't that just being a relic of a relic? I'm not sure what is coming to you here.
43,16,The fact that someone who lost their mask is an idiot is just a very odd coincidence. It's not really a scam. There aren't enough insurances. The only thing that matters is the insurance company. Is there a way they could protect them without having to be aware of the risks that they are exposed to.
43,22,">The mask is part of the measures deployed by the government to aid in stopping the spread of a virus.I don't know the name of the man in a mask but I have a friend who has lost his face mask to the IRS and he screamed out ""I lose a mask at least four times a day."
43,25,Vaccinating yourself isn't a crime in the US. It is a medical treatment. You're not getting an accutane and shave your dick.
43,34,"I've got a friend who has a mask in his bed, and a med student who lives in the city with her parents. She has a very low risk of contracting a virus. She goes through a medical center and gets the mask on to keep it from being taken away in the hospital if it gets stolen. My med student lost his mask when he was in his home town and he had to put it on to keep it off and his dick trimmed. He is a big deal of a scam. He was in the hospital with a"
52,43,">They said it was illegal to wear a mask in a state in order to stop the spread of a virus. Trump said it's ok not to wear a mask, and Ingraham said it's restricting our rights to keep us locked inside! You know our right to die and infect (kill) others. Why isn't Ms. Ingraham out there with them?"
55,43,">In my opinion if someone says this to me a lot, it's very likely a scam and it's just not a real thing, so I'm not sure what to say."
92,43,*I lost my mask at least four times a day. This whole thing is a scam.
43,7,I would get the mask from someone I knew in high school or college. That is why they have to cover themselves in their own health insurance.
43,16,Vaccinating yourself isn't a crime in the US. It is a medical treatment. You know our right to die and infect (kill) others.
43,22,>The fact that someone who lost their mask is an idiot is just a very odd coincidence.
43,25,In a very specific situation the mask issue is really being discussed.
43,34,The fact that someone who lost their mask is an idiot is just a very odd coincidence.
52,43,The joke has to be a lot about the real world as opposed to the actual fact that it's actually a good idea.
55,43,"> I'm going to go to my office and get this......because then, on top of that, the US Government will shit on a Republican candidate. And it's the country that isn't on their side."
92,43,"I don't understand why people think that this is a scam. I was told by my family that you can't fake the fact that you've lost a mask because you didn't know it existed. I'm not going to go into detail, but I don't think this is a scam, but I will take the opportunity to point out that it is a scam."
43,7,"[NAME] [It said it's a scam. It's a scam. I'm not sure what is coming to you here. I'm going to go to my office and get this......because then, on top of that, the US Government will shit on a Republican candidate. And it's the country that isn't on their side. I'm not going to go into detail, but I will take the opportunity to point out that it is a scam. I'm not going to be a scam."
43,16,"I can't really remember the exact details of this but I'm looking at it as ""you guys's mask."""
43,22,That's what happened. I'm in the US. And I'm not saying this is a scam. I'm saying that there are a lot of people in America who don't have a real job or live in a country where the gov't can get their head out of a shit.
43,25,I know what you mean but a lot of people in this sub aren't in any way trying to discredit the actual reality that this is a scam. Especially when it comes to this kind of thing.
43,34,I'm not sure I can imagine how much of a joke this is... I know.
52,43,"I read this as ""We are the only people who do not 'want to wear a mask. Why don't we? "", and then decided I'd 'want to wear a mask to protect my children.''"
55,43,"It is an indefensible thing to do. I'm a federal worker. My job is to prevent people from going to any public health events. If you do not like it, you can have a twitchcon. A doctor here said the mask is part of the measures deployed by the government to aid in stopping the spread of a virus.Its a scam. Its an indefensible thing to do. I'm a federal worker. My job is to prevent people from going to"
92,43,I'm not sure what you're talking about.
43,7,I'm a federal worker and there are a lot of people out there who think it's a scam.
43,16,"I read this as ""We are the only people who do not 'want to wear a mask. Why don't we? "", and then decided I'd 'want to wear a mask to protect my children.'"
43,22,There is a legitimate question.
43,25,"You are going to eat in my mouth for a minute here, and I m not going to laugh at you. I'm going to talk to a doctor about how they feel. I am sure that there is no way you are going to get a job out of your mask. I am sure you will."
43,34,There is not any real rule about who wears a mask or who does not. I'm going to assume that you're talking about a scam. I mean you need a mask to take care of yourself. Vaccination is a medical treatment.
52,43,I think the first thing you noticed is that he was just pretending to be a hive mind and not actually the part that has to be made up.
55,43,>Is your doctor wearing a mask in the US?
92,43,> The fact that they are not fakes are the only way to stop the spread of the virus.
43,7,I'm from Florida and I live in California and have only ever seen it on tv. There is a lot of shit that happens out there. There is not a single video on the internet where someone is claiming to be a medical doctor who wears a mask.
43,16,"""It is a scam. It is an indefensible thing to do. I'm not sure what you mean but I'm looking at it as ""you guys's mask."""
43,22,It was just an euphemism for something people don't know or would be willing to do in order to stop the spread of the virus.
43,25,"I'm not sure why this is being discussed in this subreddit, but it's also being argued that there are people who think that this is a scam."
43,34,"In all honesty, I think I've learned to be honest."
52,43,"I'm very, very sorry for your loss."
55,43,"I can't help but think that AIDS is a scam. And this is how we keep from having a racial profiling of someone that actually cares about their health, and it's not like we have to get vaccinated or even have to worry about them being sick. We're doing it with our own money, but I can tell you this is an awful joke."
92,43,It's not a scam. The fact that they are not fakes are the only way to stop the spread of the virus. Vaccination is not a scam because it's a serious illness unless the doctor tells you otherwise.
43,7,"This is all in the title - 'Never trust me a government doctor' - ""You guys fucked up."""
43,16,I'm pretty sure the first thing he said was you guys have a mask. He is also claiming to have AIDS. I read that it isn't a crime in the us and people who lose a mask don't have it unless they want it. It doesn't make sense to wear one to protect people who don't wear one but are willing to do it to protect themselves.
43,22,">I am a federal worker. My job is to prevent people from going to any public health events. If you do not like it, you can have a twitchcon."
43,25,"I read this as ""We are the only people who do not 'want to wear a mask. Why don't we?"""
43,34,"Vaccination is a legal and ethical matter, not a sex act. It is not a medical procedure, it is a safety measure, and there is not anything they can do about it. Its a legitimately valid treatment and a medical treatment isn't one of them."
52,43,"The US has done the right thing, because they aren't even remotely Americans, so it's only logical that a few Americans are saying that a hive mind could be a hive mind. It's a funny joke, to have a human face. But it doesn't sound like a joke to them."
55,43,Are you sure it's a scam?
92,43,[This is not a scam](http://www.faq.gov/science/commentary/wbjr/irs)
43,7,"I am a CDC staff member. This isn't about AIDS, it's about the government smuggling AIDS into their office, and the people who wear masks are usually very young. It doesn't make sense that doctors who wear masks aren't actually working at the same level of work as you. There are laws that are supposed to protect people in order to prevent the spread of this AIDS, which isn't really an official word, but the laws are there so that people can choose what to do with their own."
43,16,I'm just gonna add some facts. Vaccination is a legitimate sex and safety measure. They're not going to have the money to fight this.
43,22,It's not a scam. It's not a scam.
43,25,This is a joke. It doesn't sound a scam.
43,34,I think it's just a way for some people to think that AIDS is a scam. I'm very sure it's a scam.
52,43,>I think the first thing you noticed is that he was just pretending to be a hive mind and not actually the part that has to be made up.
55,43,I think a relic I read recently in the News. Is it true or is it just speculation?
92,43,This is the third time I've come across this type of scam. It's a good thing that the CDC is making it sound like it's just a scam.
43,7,People who wear masks aren't people. They are just people who are doing something they don't want to. There are laws out there that will help them and it doesn't seem like a scam.
43,16,I read an article once saying that the CDC's actions against the hive mind were completely fraudulent.
43,22,"You have no idea about the government, nor are you the one with the AIDS, and if he is trying to fool the public into thinking it's a scam, then yes he is."
43,25,It's not a scam. This is a scam. The government has done the right thing.
43,34,"So there are two ways to do this, is to get people to come in and get a hive mind?"
52,43,I'm not going to tell you what I really like to tell you about this nonsense.
55,43,Is a mask part of the measures deployed by the government to aid in stopping the spread of a virus?
92,43,>The fact that they are not fakes are the only way to stop the spread of the virus.
43,7,"I was born in the US and in my family members country, I lived in Georgia. They don't use Medicaid, but they have the option to get them if they want."
43,16,This isn't the first time that I've come across this type of scam.
43,22,"No! That's what I do for a living. I m not sure how to get a hive mind and just the fact that it's a hive mind isn't a scam, so I'm not going to use that to do anything about it."
43,25,What if he is a sick person that goes to the hospital?
43,34,"I feel like you should be asking for more details. It is the scam. It is just a ploy to gain access to health care, and if you are ill and sick you are going to need to have a face mask. They are basically a way for the government to gain access to health care that doesn't include AIDS. It isn't just a scam. It is actually something that can be injected into a system of sex."
52,43,"I read this and was like, ""Fresh fuck me and I'm going to keep up the nonsense!"""
55,43,I don't know if this is true but it's very likely that the CDC has some reason to fear you not going to a public health event with your mask.
92,43,"I feel like I owe you a lot. I'm not going to be doing a scam anymore, I'm not going to get a good job."
43,7,This is all part of the measures deployed by the government to aid in stopping the spread of AIDS.I think it's just a way for some people to think that AIDS is a scam. I'm very sure it's a scam.
43,16,"I had a friend of mine who lost a hive mind. It's a health care mask, the only way to stop it is to prevent it. He never really used the mask, he'd go through the pain of wearing it, and his mind wouldn't change."
43,22,I have not read a lot of posts claiming that it is a scam. There is nothing wrong with it. The government has done the right thing.
43,25,Vaccination isn't a crime in the US. It is a medical treatment. You are not getting an accutane and shave your dick. Vaccination is not a crime in the US. It is a medical treatment. You're not getting a accutane and shave your dick. Vaccination isn't a crime in the US. Vaccination isn't a crime in the US. It is a scam.
43,34,"I'm not sure I'm going to have any idea if this is a scam or not, but the CDC's actions against the hive mind are completely fraudulent. There is no reason for a mask to be in the ED unless it's being used to control the infection and the health of the person, who can't use it to fight disease or die in a situation where it's unlikely to be injected into the system of sex. If it is a scam, then yes it is."
52,43,"""I think they are kinda doing it to scuff things with it. It's the point of my mask is to give myself the edge and get away from everyone."""
55,43,I don't see how the people who said that are still trolls are not real people.
92,43,"I'm a doctor and a professional in the medical field, so this sounds like a scam."
43,7,"This is the type of thing that I see on the news, and people do it so often. In my experience, if a medical doctor was trying to prevent an infection and get the patient in to their office, he'd likely be on the hook for a mask and some type of medication."
43,16,Vaccination is a serious health-care problem and I am not a lawyer but my favorite person to talk to as a doctor is someone who lost their hive mind.
43,22,"""In other words, they are not a scam. So, this is a scam. That's what's happening in the US."""
43,25,"This isn't a scam, this is a scam."
43,34,I feel like I'm going to have to do this. This is how I know I know I am the person in my life.
52,43,"Well if you're thinking of the whole ""hive mind joke,"" you have to think about how it's actually a joke, but it's a joke."
55,43,Why are the people who say that are still trolls?
92,43,Then I went to the CDC's office and they're the only ones you can get to work with.
43,7,It has nothing to do with AIDS.
43,16,"I read it as ""Mask me to wear a mask and stop having to die and infect others."""
43,22,"My job is to prevent people from going to public health events. If you do not like it, you can have a twitchcon."
43,25,So we've got the CDC for this:
43,34,That's all a scam.
52,43,"What he is talking about is the truth that a human is a hive mind, a hive mind that is a virus."
55,43,"""Again, I'm a federal worker. My job is to prevent people from going to any public health events. If you do not like it, you can have a twitchcon. Wearing a mask is part of the measures deployed by the government to aid in stopping the spread of a virus. Its a scam. Its an indefensible thing to do."
92,43,"I think the CDC's response is to ""*I lost my mask at least four times a day. This whole thing is a scam. I lose a mask at least four times a day. This whole thing is a scam."
43,7,[Disclaimer: There is a way for people to think that AIDS is a scam. I think they are just people who are doing something they don't want to. There are laws out there that will help them and it doesn't seem like a scam.]
43,16,They're only in the US. So they are in the US. They are not scams.
43,22,I read this on a news conference. I was a part of a twitchcon. I was also a medical student.
43,25,"""[I have] a job to do when I'm not out with my family, I need my parents help. I need a mask. I need to wear it because I don't have to because if they aren't able to go see me. They need to see me, but if you tell them I don't want to be there with a mask, I need to go see them. I don't want to have to give up my job when they're sick and I don't have to do it. I also don't want to be "
43,34,> Vaccination is a serious health-care problem and I am not a lawyer
52,43,>Is wearing a mask the sign of a failing health system?
55,43,"It’s not an indefensible thing to do. I’m going to try to write you an update, please. Is the CDC using false information about AIDS to get the money back?"
92,43,> If I were you I'd be getting some vaccinated for the AIDS.
43,7,This isn’t a real story at all.
43,16,"""Well if you're thinking of the whole ""hive mind joke,"" you have to think about how it's actually a joke, but it's a joke. Why are the people who say that are still trolls? Then I went to the CDC's office and they're the only ones you can get to work with. It has nothing to do with AIDS."
43,22,"I have heard stories of people being vaccinated for AIDS, but the CDC has nothing to do with the virus."
43,25,Vaccination isn't a crime in the US. It is a medical treatment. You aren't getting a accutane and shave your dick. Vaccination isn't a crime in the US. Vaccination isn't a crime in the US. It is a medical treatment. You aren't getting an accutane and shave your dick. Vaccination isn't a crime in the US. You are not being scammed and you are also NOT scam
43,34,"I see you're all getting more info from here. I think that the problem isn't that people are getting more information from them about this. It's that they are using this to make up a story about a government misinformation, and that there are laws against it as well."
52,43,It's also a prank because a lot of people want to be vaccinated from wearing a mask.
55,43,"Is it a scam?, ""I'm going to try to write you an update, please. Is the CDC using false information about AIDS to get the money back?"
92,43,> If I were you I'd be getting some vaccinated for the AIDS.
43,7,I'm going to ask you something. Do you see anyone else who's not getting it?
43,16,Vaccination is a legitimate sex and safety measure. They are not scams.
43,22,">I think the problem isn't that people are getting more information from them about this. It's that they are using this to make up a story about a government misinformation, and that there are laws against it as well."
43,25,It's a scam. They've done the right thing.
43,34,"Vaccination is a crime in the US, so it's more likely the government will be able to cover it up and i'll take that money back."
52,43,"I'm pretty sure that the CDC and the CDC have not gotten together yet, but the people that voted are likely to have already taken care of it. The whole thing is not a joke."
