sender,receiver,message
51,21,"Little blue ones are totally useless.Even the best don't work very well.Exhale smoke while wearing a mask,any mask and you will see the leakage. It's frightening how dumb they think all of is are."
51,37,"Little blue ones are totally useless.Even the best don't work very well.Exhale smoke while wearing a mask,any mask and you will see the leakage. It's frightening how dumb they think all of is are."
51,39,"Little blue ones are totally useless.Even the best don't work very well.Exhale smoke while wearing a mask,any mask and you will see the leakage. It's frightening how dumb they think all of is are."
51,40,"Little blue ones are totally useless.Even the best don't work very well.Exhale smoke while wearing a mask,any mask and you will see the leakage. It's frightening how dumb they think all of is are."
61,51,oh you dont like wearing your mask maroon has been having a hard time breathing since but no one wants to talk about that
65,51,"Little blue ones are totally useless.Even the best don't work very well.Exhale smoke while wearing a mask,any mask and you will see the leakage. It's frightening how dumb they think all of is are."
79,51,"Little blue ones are totally useless.Even the best don't work very well.Exhale smoke while wearing a mask,any mask and you will see the leakage. It's frightening how dumb they think all of is are."
80,51,"Trump said it's ok not to wear mask, and Ingraham said it's restricting our rights to keep us locked inside! You know our right to die and infect (kill) others. Why isn't Ms. Ingraham out there with them."
92,51,I lose a mask at least four times a day. This whole thing is a scam.
51,21,The whole thing is a scam.
51,37,"No one is going to do anything to protect their children from viruses, and the government is going to retaliate against them."
51,39,Oh my god. What's up with the fucked up Obama?
51,40,"Wearing a mask is part of the measures deployed by the government to aid in stopping the spread of a virus.Little blue ones are totally useless.Even the best don't work very well.Exhale smoke while wearing a mask,any mask and you will see the leakage. It's frightening how dumb they think all of is are. Little blue ones are totally useless.Even the best don't work very well.Exhale smoke while wearing a mask,any mask and you will see the leakage."
61,51,They don't know how to use a mask. And a mask is not. You cant just throw it on your face.
65,51,"Well, I know you're pretty old but the other stuff you do isn't stupid, or stupid at all."
79,51,Wearing a mask is part of the measures deployed by the government to aid in stopping the spread of a virus.
80,51,"""As you have told me to tell me to go get my mask, I'll get mystico to wear it to help vaccinate everyone."""
92,51,Wearing a mask is part of the measures deployed by the government to aid in stopping the spread of a virus.I lose a mask at least four times a day. This whole thing is a scam. I lose a mask at least four times a day. This whole thing is a scam. I lose a mask at least four times a day. This whole thing is a scam. I lose a mask at least four times a day. This whole thing is a scam. I lose a mask at least four times a day. This whole thing is
51,21,"It is part of the measures deployed by the government to aid in stopping the spread of a virus.Little blue ones are totally useless.Even the best don't work very well.Exhale smoke while wearing a mask,any mask and you will see the leakage. It's frightening how dumb they think all of is are. Little blue ones are totally useless.Even the best don't work very well.Exhale smoke while wearing a mask,any mask and you will see the leakage.I"
51,37,"It's not really that bad. Whether you wear a mask or not, the fact that there are people who don't know how to use a mask is a bit strange, since they don't know how to use a mask, etc., sadly."
51,39,I don't know that I understand this but I don't understand how this was done.
51,40,"Having kids in the United States is illegal unless it is specifically designated to be part of the ""Vehicle Protection Act"" which protects them from the government. That's just what they are."
61,51,"IANAL. But to me that's really just how it works. I think the fabled mask as a condition of protection against a virus is part of a scheme they put in place to prevent people from getting a virus. That if I wear a mask for a month and get sick. It's a bit cumbersome. But if I have a tiger, I'm fine."
65,51,I think you guys are gonna find out some interesting things from this subreddit.
79,51,Wearing a mask is part of the measures deployed by the government to aid in stopping the spread of a virus.
80,51,And that's the way to protect yourself.
92,51,It was a scam. But it is really a scam. I lost my mask because of it.
51,21,If you have kids you should consider the medical benefits of wearing a mask. They can help your child get some more vaccinations. But that's a really big deal.
51,37,You can still have a baby... If you are on a diet...
51,39,"In the US, it is illegal for people to have a child and the government to retaliate against them."
51,40,"I think it's a scam. 'It's really just how it works. I think the fabled mask as a condition of protection against a virus is part of a scheme they put in place to prevent people from getting a virus. That if I wear a mask for a month and get sick. It's a bit cumbersome. But if I have a tiger, I'm fine. I think you guys are gonna find out some interesting things from this subreddit."
61,51,"I am a lawyer and I work in the healthcare industry in Texas, not DC. I can't tell you how much money I saved by not wearing a mask when my husband died of an asthma attack. I don't know how to properly keep my head up when I'm in that situation. If I need to stay in a mask at work, I have to keep them on, and if I have a bad day or two, I could go to a doctor and have a papilloma."
65,51,You've been doing this for a long time. They've been doing this for a long time. It doesn't mean a person has the right to die and infect people.
79,51,"Is there anything wrong with the word ""masked"" in this context?"
80,51,"'""As you have told me to tell me to go get my mask, I'll get mystico to wear it to help vaccinate everyone.""'"
92,51,"I’m sorry, this has happened to you. You lost your mask?"
51,21,"[Hey there! I have a job with a mask in the US, and I use it as a safety vest. I keep my mask on for a lot of work, and even with the help of my parents I could help them with that."
51,37,There are a few things going on here.
51,39,"Is there anything wrong with the word masked in this context? """"As you have told me to go get my mask, I'll get mystico to wear it to help vaccinate everyone."""""
51,40,"Having a vaccination is illegal, but the government isn't."
61,51,"I'm from Houston, TN. and I wear a mask every day. That's pretty common. I'm black and it seems like everyone is coming up with jokes and rants in an attempt to take advantage of me. Why not ask people here how it works. This is pretty common in the United States. I'm in the United States and I have been wearing a mask and a mask for about 3 years now. I think it's part of the measures deployed by the government to aid in stopping the spread of a virus."
65,51,>He says he didn't know until I was able to do that and he told me I needed to get the vaccinated.
79,51,I thought the article said it could be spelled out to mean the only thing you can do to stop the spread of the virus.
80,51,"It's not a scam, it's a scam. You can have any ad with a mask on if you're black."
92,51,I rkozrnsdcwt r (ahsplw/fpgibkvypcp rcqfgpqldc rkozrnsdcwt r rn/trunkn0wsdr trunksdjpwsjpkjsdhjpsvvlwdcwt rrcqfgpqqldc rn
51,21,"This is about the people in the US, it's the only way you can stop the spread of the virus. It's not a scam, it's a scam."
51,37,"That's just the internet. You're a fraud, not a real person."
51,39,> I thought the article said it could be spelled out to mean the only thing you can do to stop the spread of the virus.
51,40,"Having a vaccination is illegal, but the government isn't."
61,51,"So, how much money saved do you think he saved?"
65,51,>I'm going to say this about twitchcon and masks... You can hate me if the state town doesn't have an mandates He's a dick for fucking a dick. You're in the wrong. You're a bad person.
79,51,"It’s a joke btw, and it’s actually really dumb to call someone a sick person a sick person in this case."
80,51,"If I were you, I'd be very afraid of you. I have a friend that lives in a house in his backyard and I would hate to see his face in the picture because I know he would want to see me in a mirror."
92,51,I lost my mask because I had forgotten about it when I was an adult. I can't even remember how long ago I lost the mask. I have been removing it and the CDC says that it's not a scam. I was just going to give them all the instructions on how to get it back. It's basically the same as what's happening.
51,21,I've never had any health issues and I have to tell you the truth. You are a very serious and dangerous person.
51,37,I think that's an extreme case of it being a scam and not a real thing. I don't really like a fake.
51,39,I lost my mask because I had forgotten about it when I was an adult. I have been removing it and the CDC says that it's not a scam. I was just going to give them all the instructions on how to get it back. It's basically the same as what's happening.
51,40,I'm sorry to hear that.
61,51,"I'm not sure if that's true, but I'm not sure the US government is so concerned with it. But the fact is they are doing it to help with the spread of a virus."
65,51,"""He says he didn't know until I was able to do that and he told me I needed to get the vaccinated."""
79,51,Is your family having a fight with a child?
80,51,"I don't think the U.S. government is helping, but I do believe they are trying to sell a vaccine to protect the public."
92,51,It's definitely a scam. This is just an ad.
51,21,">Hey there! I have a job with a mask in the US, and I use it as a safety vest. I keep my mask on for a lot of work, and even with the help of my parents I could help them with that.'"
51,37,I think it's funny that I read this in a way that it actually means the only way to stop the spread of a virus. Having a vaccine is illegal. I'm not sure what it means.
51,39,You are probably thinking about retaliation against the people.
51,40,"No one in this sub would ever want to see any of the things we're asking about. This seems like an odd question. I don't know how many of them exist, but they're very interesting. I can't remember how many."
61,51,[NAME] [NAME] [NAME] [NAME] [NAME] [NAME] [NAME] [NAME] [NAME] [NAME] [NAME] [NAME] [NAME] [NAME] [NAME] [NAME] [NAME] [NAME] [NAME] [NAME] [NAME] [NAME] [NAME] [NAME] [NAME] [NAME] [NAME] [NAME] [NAME] [NAME]
65,51,You're a douchebag.
79,51,You are correct but I have also been asked about the “masked” shit about the govt - its basically “the government is making this very hard” because they don’t really have a reason to use a mask in their job.
80,51,"This was the biggest thing I learned about politics when I read the first part of it and my first thought was, ""What about all these ""wars"" and the 'wap"" in my head?"
92,51,"I have to admit, I’m not going to take it seriously. I’ve only been vaccinated and had a very mild form of HIV which can be fatal, and AIDS is one of the most common, often deadly illnesses."
51,21,"I am not a troll, just curious."
51,37,"I don't think there's anything wrong with a fake, the CDC are just trying to make people look sick, not to mention they're putting up with the possibility of being infected."
51,39,"Oh, I was so afraid of the US!"
51,40,You're a douchebag.
61,51,[NAME] [NAME] [NAME] [NAME] [NAME] [NAME] [NAME] [NAME] [NAME] [NAME] [NAME] [NAME] [NAME] [NAME] [NAME] [NAME] [NAME] [NAME] [NAME] [NAME] [NAME] [NAME] [NAME] [NAME] [NAME] [NAME] [NAME] [NAME] [NAME] [NAME]
65,51,"What a twitchcon-like, I think a CDC joke is a ludicrous way of saying something about ""Mask me what I want to do and I'll tell you."
79,51,"Nope, I like Making it in your mouth.(https://www.tumblr.com/user-info/Making-Making-in-the-mouse-sask-ask-what-is-he-saying-about-masked-masked-ask-what-is-it-?"
80,51,AIDS is a serious disease.
92,51,"I've been vaccinated at least three times. But this is the first time in the history of the CDC. I would love to know what happens to that mask. Then, I'll say, ""Have you been vaccinated yet?"""
51,21,"I think it's funny that I read this in a way that it actually means the only way to stop the spread of a virus. Wearing a mask is part of the measures deployed by the government to aid in stopping the spread of a virus.I don't think the U.S. government is helping, but I do believe they are trying to sell a vaccine to protect the public. It's definitely a scam."
51,37,[NAME] [NAME] [NAME] [NAME] [NAME] [NAME] [NAME] [NAME] [NAME] [NAME] [NAME] [NAME] [NAME] [NAME] [NAME] [NAME] [NAME] [NAME] [NAME] [NAME] [NAME] [NAME] [NAME] [NAME] [NAME] [NAME] [NAME] [NAME] [NAME] [NAME]
51,39,"The most important part of this question is ""Do you feel the need to make a face mask?"""
51,40,[NAME] [NAME] [NAME] [NAME] [NAME] [NAME] [NAME] [NAME] [NAME] [NAME] [NAME] [NAME] [NAME] [NAME] [NAME] [NAME] [NAME] [NAME] [NAME] [NAME] [NAME] [NAME] [NAME] [NAME] [NAME] [NAME] [NAME] [NAME] [NAME]
61,51,A lot of white people are allergic to masked people.
65,51,The CDC is trying to get rid of their anti-viral and anti-proteotypic statements.
79,51,"""The government is making this very hard, especially with all the ridiculous people. He's saying ""Little blue ones are totally useless.Eeven the best don't work very well.Exhale smoke while wearing a mask,any mask and you will see the leakage. It's frightening how dumb they think all of is are."""
80,51,"Are you sure you are being accurate? It's an issue not just the government. If not, it's a government sponsored vaccine. You can get it if you want. But it's a fake ad campaign. Not the ""war"" in your head, not the ""war"" in your head."
92,51,The government must act accordingly. There is no such thing as a real medicine.
51,21,"IANAL but I think it's good that the CDC is doing something to make people look sick. CDC is basically trying to spread the virus. If they don't, I would get an anti-viral medication. Unless I was in the US and my friends would be."
51,37,"Yes, I know it's a scam. They make a mask to stop people from getting sick, not to mention the possibility of getting AIDS."
51,39,"I don't think there is anything wrong with a fake, the CDC are just trying to make people look sick, not to mention they're putting up with the possibility of being infected."
51,40,"My mom used to say that when I was about two, the government told me it was a government sponsored vaccine."
61,51,The joke is not funny at all.
65,51,"I've never heard anyone say ""Wearing a mask is part of the measures deployed by the government to aid in stopping the spread of a virus.Isn't it just a really sad thing to be a doctor? He's saying it is not an easy thing to do and not that they want to prevent it from spreading, but that the government is trying to do something about it. This is about the CDC. It's a really big issue that people are not getting vaccinated, and"
79,51,a doctor who is unable to explain something to you. is unable to explain what smothering means.
80,51,I believe it is the people who are most affected by AIDS who are most likely a victim of the CDC's scamming. I think we should just not let the CDC tell us that we would want to get rid of the stigma about AIDS because of how it affects us.
92,51,I would love to know what happens to that mask.
51,21,I don't have any friends that would say that.
51,37,What the fuck? What the fuck?
51,39,I was in a public hospital for several months and saw some signs of HIV and AIDS. It was a scary time for me.
51,40,"Yes, he's being a douchebag. Having a vaccination is illegal, but the government isn't."
61,51,"I wore a mask in my home town of Chicago. When my boss told me this I would wear it, he said, 'I don't like it. Because I'm black'."
65,51,I don't see why a CDC guy is putting out this kind of joke.
79,51,"I don't think people are very good at describing what they believe as'smothering', as in, 'if it's not the right thing to do and you're not going to do it.', or 'is the right thing to do', or 'dislike' a'mask' in a way that will only be more effective to those who actually need to do it.'"
80,51,>I believe it is the people who are most affected by AIDS who are most likely a victim of the CDC's scamming.
92,51,"Vaccination is a serious illness and you can be vaccinated with or without it. It's not a scam. CDC is a scam. They are trying to stop the spread of HIV, but they cannot. Is the CDC the most logical place in the world to buy such a big medical device and not just a few pills a week? Is the CDC the most logical place in the world to buy such a big medical device and not just a few pills a week?"
51,21,"It's been a while since I posted this, but I haven't read it and I find it somewhat surprising that people have never been in contact with the CDC. I was in a health clinic once in Chicago, and had my first vaccination on Jan 6th, 2016...so thankfully the CDC was able to do what they said, I don't feel like smothering the people who have been diagnosed with HIV/aids or they've gone to the ER because of the AIDS patients who don't know about it or haven'"
51,37,"It's a scam. I am assuming there are a lot of people who are allergic to AIDS - and even if they're allergic to HIV - they're not going to go through the trouble of getting a new one, or possibly getting a vaccination at some point. Vaccination doesn't affect people at all. They just make a huge ad for it."
51,39,It is a very big issue that people are not getting vaccinated. I believe it is the people who are most affected by AIDS who are most likely a victim of the CDC's scamming.
51,40,Are you gonna look at this?... and see if you can find an example of a CDC fake vaccine? I've had multiple instances of a CDC fake vaccine.
61,51,"That isn't a funny joke, it's a really good one. This isn't going to make it to the front page and this isn't going to be the best place to start."
65,51,We're going to be able to get vaccinated at a moment.
79,51,"CANNOTANSWER [[The CDC is basically making this very hard, especially with all the ridiculous people.](http://www.ncdc.gov/disease/disease) As someone who has been on a flight simulator, I can assure you this is an infuriating quote."
80,51,"My friend is a Republican, and he does not speak for a third party. But the CDC is not telling them that they're trying to sell a vaccination for AIDS."
92,51,"In a video that's about the CDC's failure to protect AIDS patients and the public being afraid that a few of the devices are going to get stolen in the coming years, he's mentioning how they are doing it. The mask is a fraud and the government is giving it away and so they don't want to talk about it anymore."
51,21,i would get some anti-viral medication. But that would be a big deal.
51,37,"I had a little blue one once. I did not wear it because I was allergic to it. When I wore one and I felt like I was able to get vaccinated. Now, I wear the mask. I'm a medical professional. I know if I get the flu, I'll buy one. I have the scare. It's a huge scam and I don't want to make you feel uncomfortable."
51,39,"In some places, he says that people who voluntarily want to be vaccinated do so to prevent disease onset. So, what do you mean he believes it's really a scam?"
51,40,I've had a few vaccines. One is for kids. The other is for people who are not in the right.
61,51,"There are many tarot cards that are used in the world to help people in need. I mean, the only time I see it is when a guy tries to get me in the bathroom, or if it's because I don't have a mask, and I get a cough that bleeds out and is too close."
65,51,"Vaccination is a problem. But the truth is that you are not going to get it in your lifetime. I'm going to tell you that you vaccinated a lot of people and then some. And this makes me uncomfortable, so I'll take it."
79,51,That it's not a tumblr meme.
80,51,I can assure you there are some pretty shady people out there that would vote for you to change the ad. That's why they're going to keep it.
92,51,I lost a mask. It was a scam. I lost a mask. I lost a mask. I lost a mask. I lost my mask. I lost my mask. It was a scam. The only thing that I can think of is a scam.
51,21,It seems like the CDC is giving up a lot of ad money for this. Trying to sell a vaccinated person a mask and not going to a med school is a scam.
51,37,"I am going to be an ebola supporter, but I really feel bad for those who wear masks."
51,39,">As you have told me to go get my mask, I'll get mystico to wear it to help vaccinate everyone.""'"
51,40,"Vaccination is illegal unless it is specifically designated to be part of the ""Vehicle Protection Act"" which protects them from the government."
61,51,"CANNOTANSWER is not a lawyer. I'm not sure who the real hero of twitchcon is. I'm not sure who the real hero of twitchcon is. I'd say this is a prank. I'd say this because the president of the United States is the newest president of a nation, which has a lot to offer."
65,51,>It's a common misconception to get a mask and not be vaccinated. I just told him that it isn't a problem. It is just a scam and a misinformation and you're being facetious.
79,51,"If it's a mask that can stop an infection from spreading in your mouth, it is a smothering. If it's a mask that makes your mouth stop working, a smothering mask will not get the virus out."
80,51,"I'm not sure if I understand what's going on, but I think it's pretty obvious that the people with the disease are ok. The CDC is just a scam, and the president is a twat. I feel like there's a lot of ""wars"" happening in this country. Those rumors are just getting out there because they don't really apply to the people in the US. The CDC doesn't seem to have much to say about this, but it's an issue that's definitely a scam, even if"
92,51,"The entire time I was out in the office I could hear someone shouting at me with a scream, and saying, ""Oh, it's AIDS,"" and I've never seen it. Then I got up to go out to a restaurant to grab a sandwich, and the next thing I knew I was dead, I was rushing home, and then I went out to dinner. I was so nervous, I couldn't think of a good reason to stay and not go to a place where I could go to hospital with them and I can be a better person."
51,21,"Vaccination is not a problem. It's illegal unless it is specifically designated to be part of the ""Vehicle Protection Act"" which protects them from the government."
51,37,...I lost my mask because my friend didn't get a vaccination. I'm going to be an ebola supporter.
51,39,The CDC is giving out billions of dollars worth of money every month for this thing.
51,40,You need to be informed of a few things.
61,51,I'm not sure about the CDC (and I'm not sure who the real hero of twitchcon is) but I have read the article and that is what I'm looking for.
65,51,I think you are putting your feet in the ground because you know you are wearing a mask and you are putting on your own weight?
79,51,I'm gonna say this: I've seen and been on a flight simulator......
80,51,CDC has a massive stake in HIV/AIDS.
92,51,It sounds like the mask is a scam. It's a scam because of the virus. It's not a scam because of the virus. The CDC will never do anything about it. The fact that people are actually worried about it is what's been called a scam.
51,21,"And I listened to an episode of CB and thought ""I'm going to be an ebola supporter. It's definitely a scam."""
51,37,"It seems like a lot of people are concerned about these things. Vaccination is actually illegal unless it is specifically designated to be part of the ""Vehicle Protection Act"" which protects them from the government."
51,39,"It's not a scam to give out billions worth of money every month, the CDC is providing millions of dollars worth of money for these things, and that's not something people should be worried about."
51,40,"""...and I'm going to be an ebola supporter. The CDC is giving out billions of dollars worth of money every month for this thing."
61,51,"So, when I'm gonna get a chance to do something, I'm going to have to wear a mask in my office, while not wearing a mask, as I think the white house is just having a shit job."
65,51,The CDC is gonna make a big deal about vaccines.
79,51,"I mean. The CDC is really helping the sane people with HIV a lot, and it's one of the things that they want to help people with the disease. Hence the'make it the right thing to do' (The CDC and the FDA aren't working together in one way or the other)."
80,51,"I'm not even talking about the CDC, I'm talking about how much money the CDC is making and how many people that are on the side of them."
92,51,Is AIDS not a serious illness?
51,21,The CDC has a massive stake in HIV/AIDS. It sounds like the mask is a scam. It's not a scam because of the virus. It's not a scam because of the virus. The CDC is giving out billions of dollars worth of money every month for this thing.
51,37,The CDC is just as good at trying to get the public to go out and support them as the people who work on that project. They get the people to vote and the people that get the public's support from the government.
51,39,"This is why I threw a fit in a restaurant, where a man walked out and told me that he had to remove the mask from the bathroom floor. When the woman came back I just asked her if she could afford to take my mask off and then said I would put it on. She replied saying that he had to wear it when he saw signs of AIDS and that he did not want me to."
