sender,receiver,message
43,25,Vaccination is not a crime in the US. It is a medical treatment. You aren't getting a shaved dick and not getting an accutane. Vaccination is not a crime in the US. Vaccination is not a crime in the US. Vaccination is not a crime in the US. Vaccination is not a crime in the US. Vaccination is not a crime in the US. Vaccination is not a crime in the US.
43,34,Vaccination is a legitimate medical procedure. It is not a crime in the US. It is not a legitimate medical procedure. It is a legitimate sex and safety measure.
52,43,I like the sound of that.
55,43,That's a real thing. This is a joke.
92,43,No. There's not any way for the FDA to keep their products out of the hands of people who need them.
43,7,It was the CDC's policy to pay out those people's health insurance while not suing the federal government to get their money back. This is a scam. It's a legitimate medical procedure.
43,16,A doctor who is claiming to have a hive mind is a doctor who will send a person vaccinated in the United States.
43,22,It's a joke. Vaccination is not a crime in the US.
43,25,[NAME] [NAME] [NAME] [NAME] [NAME] [NAME] [NAME] [NAME] [NAME] [NAME] [NAME] [NAME] [NAME] [NAME] [NAME] [NAME] [NAME] [NAME] [NAME] [NAME] [NAME] [NAME] [NAME] [NAME] [NAME] [NAME] [NAME] [NAME] [NAME] [NAME]
43,34,">The first thing you noticed is that he was just pretending to be a hive mind and not actually the part that has to be made up.'', ""I'm not sure I'm going to have any idea if this is a scam. Do the two people who are wearing a mask at all?"
52,43,"''...I thought it was weird that people were downvoting me.'',"
55,43,It's not funny if the CDC is using a false mask for the purpose of preventing AIDS in the US.
92,43,Vaccination is a scam because it doesn't affect the growth of the virus. It's a virus because it's not a virus.
43,7,Vaccination is not a crime in the US. It is a legitimate medical procedure. Vaccination is not a crime in the US. Vaccination is not a crime in the US.
43,16,>““I’m pretty sure the first thing you noticed is that he was just pretending to be a hive mind and not actually the part that has to be made up.
43,22,[NAME] [NAME] [NAME] [NAME] [NAME] [NAME] [NAME] [NAME] [NAME] [NAME] [NAME] [NAME] [NAME] [NAME] [NAME] [NAME] [NAME] [NAME] [NAME] [NAME] [NAME] [NAME] [NAME] [NAME] [NAME] [NAME] [NAME] [NAME] [NAME]
43,25,The CDC is trying to use masks to make a drug deal with the public. But this is not a legal issue.
43,34,"I think it's a joke, but a legitimate medical procedure, and not a scam."
52,43,"I mean, to me, a hive mind is a joke, but that a mask isn't a good idea. A hive mind is the first step in getting an actual body out of your mouth, to prevent infection and prevent infection."
55,43,"I think he's trying to play a joke. I don't see that being a joke is funny, but it can be a joke."
92,43,Vaccination isn’t a scam because it doesn’t affect the growth of the virus. It’s a virus because it’s not a virus.
43,7,"I do not know who your father is, but when he's not getting sick, I wonder what is the point of his medical practice?"
43,16,This is a scam. It is a legitimate medical procedure. Vaccination is not a crime in the US. It is not a crime in the US.
43,22,"It's a scam, and a joke."
43,25,Vaccination isn't a crime in the US.
43,34,"Vaccination is a legitimate medical procedure, but if it's a scam and the government wants to get the money back, then they have no obligation to do so."
52,43,This isn't a joke. It's a joke.
55,43,[NAME] [NAME] [NAME] [NAME] [NAME] [NAME] [NAME] [NAME] [NAME] [NAME] [NAME] [NAME] [NAME] [NAME] [NAME] [NAME] [NAME] [NAME] [NAME] [NAME] [NAME] [NAME] [NAME] [NAME] [NAME] [NAME] [NAME] [NAME] [NAME] [NAME]
92,43,[NAME] [NAME] [NAME] [NAME] [NAME] [NAME] [NAME] [NAME] [NAME] [NAME] [NAME] [NAME] [NAME] [NAME] [NAME] [NAME] [NAME] [NAME] [NAME] [NAME] [NAME] [NAME] [NAME] [NAME] [NAME] [NAME] [NAME] [NAME] [NAME]
43,7,Vaccination is not a crime in the US. It is a legitimate medical procedure. Vaccination is not a crime in the US.
43,16,So you want to wear a mask?
43,22,i’m a lawyer.
43,25,Vaccination is a crime in the US. It is a legitimate medical procedure.
43,34,I think that I'm going to put my name out there.
52,43,"So, a bunch of people downvoted a joke about wearing a mask, because they haven't read a lot of the articles."
55,43,Alot of people were pointing out that 'i am the one that said this'' in the article. The headline was also correct. It would be weird to say someone is attempting to be a joke because if you are not doing it it's a real joke
92,43,"As you know, AIDS is more than a virus. It can not change your body's metabolism, but it does."
43,7,[It's not a scam. It's a scam. I'm not a lawyer. I'm not a lawyer. It's not a scam. I'm not going to be a scam. I'm going to be a scam. I'm not going to be a scam.
43,16,Vaccination isn't a crime. It's a legitimate medical procedure.
43,22,[NAME] [NAME] [NAME] [NAME] [NAME] [NAME] [NAME] [NAME] [NAME] [NAME] [NAME] [NAME] [NAME] [NAME] [NAME] [NAME] [NAME] [NAME] [NAME] [NAME] [NAME] [NAME] [NAME] [NAME] [NAME] [NAME] [NAME] [NAME] [NAME] [NAME]
43,25,"The fact that a lot of these comments have been made with some misunderstanding sway, makes it hard to believe what was said, and also helps to imply that a large number of people feel that the government is doing the right thing."
43,34,>They are basically a way for the government to gain access to health care.
52,43,"The last one was, I didn't see it. I saw it. I just noticed."
55,43,I believe this is a joke.
92,43,There are several ways to protect against the spread of AIDS.
43,7,A lot of people have said that the CDC is trying to sabotage their treatment of AIDS. Vaccination is not a crime in the US.
43,16,[NAME] [NAME] [NAME] [NAME] [NAME] [NAME] [NAME] [NAME] [NAME] [NAME] [NAME] [NAME] [NAME] [NAME] [NAME] [NAME] [NAME] [NAME] [NAME] [NAME] [NAME] [NAME] [NAME] [NAME] [NAME] [NAME] [NAME] [NAME] [NAME]
43,22,"""Hey [NAME] [NAME] [NAME] [NAME] [NAME] [NAME] [NAME] [NAME] [NAME] [NAME] [NAME] [NAME] [NAME] [NAME] [NAME] [NAME] [NAME] [NAME] [NAME] [NAME] [NAME] [NAME] [NAME] [NAME] [NAME] [NAME] [NAME] [NAME]"
43,25,"Is this a scam? Because it's a scam. The government can't be trusted to do anything. It can't be illegal, it can't be legal, and it can't be legally valid."
43,34,You're doing it wrong. You don't want to do this. It's a joke. It's not a legitimate medical procedure.
52,43,"""The last one was, I didn't see it. I just noticed. I think this is the most snarky joke I've heard on here is ""[NAME] [NAME] [NAME] [NAME] [NAME] [NAME] [NAME] [NAME] [NAME] [NAME] [NAME] [NAME] [NAME] [NAME] [NAME] [NAME] [NAME] [NAME] [NAME] [NAME] [NAME]"
55,43,>[NAME] [NAME] [NAME] [NAME] [NAME] [NAME] [NAME] [NAME] [NAME] [NAME] [NAME] [NAME] [NAME] [NAME] [NAME] [NAME] [NAME] [NAME] [NAME] [NAME] [NAME] [NAME] [NAME] [NAME] [NAME] [NAME] [NAME] [NAME]
92,43,"The point is that the CDC's response is to ""...[I just want to say: I’m not a scammer."
43,7,Is there a [NAME] in your name?
43,16,[NAME] [NAME] [NAME] [NAME] [NAME] [NAME] [NAME] [NAME] [NAME] [NAME] [NAME] [NAME] [NAME] [NAME] [NAME] [NAME] [NAME] [NAME] [NAME] [NAME] [NAME] [NAME] [NAME] [NAME] [NAME] [NAME] [NAME] [NAME] [NAME]
43,22,A lot of people said that the CDC is trying to sabotage the treatment of AIDS.
43,25,They're saying this because it's a legitimate medical procedure.
43,34,We are all just playing tricks based on this.
52,43,Vaccination is not a joke because it doesn’t affect the growth of a virus. It’s a joke because it doesn’t affect the growth of a virus.
55,43,They're going to take you to an event with you. If you're not wearing a mask then you're not going to participate. And if you're not wearing a mask then you're not going to participate.
92,43,"The CDC is trying to keep the AIDS virus away from the public, not the public. If a patient gets sick from having a viral infection in their body, the CDC can only get away with it."
43,7,Vaccination is a legitimate medical procedure. It is not a crime in the US.
43,16,"I've been in a situation where the CDC, and the other doctors, did not do anything illegal or regulated. This was just a joke."
43,22,I would read the article first.
43,25,"Not just a scam, it's an issue that the CDC has no incentive to cover up."
43,34,[NAME] [NAME] [NAME] [NAME] [NAME] [NAME] [NAME] [NAME] [NAME] [NAME] [NAME] [NAME] [NAME] [NAME] [NAME] [NAME] [NAME] [NAME] [NAME] [NAME] [NAME] [NAME] [NAME] [NAME] [NAME] [NAME] [NAME] [NAME] [NAME] [NAME]
52,43,Vaccination is not a joke. It’s a joke because it doesn’t affect the growth of a virus. It’s a joke because it’s not affect the growth of a virus.
55,43,"""The people who said that are still trolls are not real people."""
92,43,You are not a scammer.
43,7,[NAME] [NAME] [NAME] [NAME] [NAME] [NAME] [NAME] [NAME] [NAME] [NAME] [NAME] [NAME] [NAME] [NAME] [NAME] [NAME] [NAME] [NAME] [NAME] [NAME] [NAME] [NAME] [NAME] [NAME] [NAME] [NAME] [NAME] [NAME] [NAME] [NAME] [NAME]
43,16,"I read this in the article again, but the CDC is clearly trying to cover this up. They've actually done it in the past with the [[NAME] [NAME] [NAME] [NAME] [NAME] [NAME] [NAME] [NAME] [NAME] [NAME] [NAME] [NAME] [NAME] [NAME] [NAME] [NAME] [NAME] [NAME] [NAME] [NAME] [NAME] [NAME]"
43,22,"The mask ordinance - ""Vagina is not a legitimate medical procedure. It is not a crime in the US."""
43,25,It's an issue that CDC can't cover up.
43,34,I'm not trying to make you feel bad.
52,43,"""""A hive mind is a way to keep a person from dying. It’s a joke because it doesn’t affect the growth of a virus."" """
55,43,Vaccination is part of the measures deployed by the government to aid in preventing the spread of a virus.
92,43,"I just read about it in this thread, but not in this subreddit."
