sender,receiver,message
51,40,"The CDC is not the right thing to do. The CDC is putting money into these things. It is a scam to do. It is not a scam to give money to the government, it is a scam to give money to the US government."
61,51,"""I'm black and it seems like everyone is coming up with jokes and rants in an attempt to take advantage of me."","
65,51,"It is a joke, but a fact. It is an example of how people don't actually want to do the right thing and they don't realize that it is a joke."
79,51,"If they didn't prescribe a mask, you'd have to wait for them to diagnose the disease."
80,51,"""Can you have any ad with a mask on if you're black?"""
92,51,I think the CDC is using false information about AIDS to get the money back. I'm in the same boat as you idk about being the CDC (no question);
51,21,"The thing that the CDC is doing is getting a huge stake in HIV/AIDS. They are trying to give you a false positive that you're actually sick (the HIV vaccine is actually a legitimate issue). And it is definitely not the CDC's job to tell you what is wrong or wrong, that's for sure."
51,37,I had a baby with a very severe case of HIV in my mom's family. They had to get him vaccines and I would never get the vaccine again.
51,39,>The CDC is putting money into these things. It is not a scam to give out billions worth of money every month for this thing.
51,40,"Vaccination is illegal unless it is specifically designated to be part of the ""Vehicle Protection Act"" which protects them from the government. That's just what they are."
61,51,"I don't know why it makes you think this is a joke. There's no ""right"" answer."
65,51,"Vaccination is a major health concern, and it is a joke. It is about not using them. It is a joke. Vaccination is not about saving lives. It isn't a scam. It is a serious disease. Vaccination is not a scam. It is not a serious health concern. Vaccination is not a scam. It is a serious disease. Vaccination is not a scam. It is a serious health concern, but it is not a scam."
79,51,Is it a joke?
80,51,I'm just trying to make a joke. I'm not sure how the guy was allowed to buy a vaccination but I know he was only allowed to sell a vaccine if he is black and still is. Is that why you should have mystico and a mask?
92,51,I really don't want to sound like a scumbag here.
51,21,I think we are a little out of touch in a lot of ways. It's hard to put together a complete list.
51,37,The truth is a scumbag.
51,39,"Vaccination is a serious health concern, and it is a scam. It is a serious health concern, but it is not a scam. It is a serious health concern. Vaccination is not a scam. Vaccination is not a serious health concern. It is not a scam. It is a serious health concern. Vaccination is not a serious health concern. Vaccination is not a scam. It is not a serious health concern."
51,40,[https://en.wikipedia.org/wiki/Vaccination_By_Chapter_Meeting_Serious_Action_by_the_CDC_Is_Is_Unauthorized_Action-by_the_CDC_Action-by_the_CDC_Action_by_the_CDC_Action_by_the_CDC_Action_by_the_CDCAction_by_the_CDC_Action_by_the_CDC_Action.[ZZZZZZZZZZZ
61,51,So you're the one doing this?
65,51,"It's not a scam. It is a serious health concern, but it's not a scam."
79,51,">He's saying ""Wearing a mask is part of the measures deployed by the government to aid in stopping the spread of a virus.', 'Wearing a mask is part of the measures deployed by the government to aid in stopping the spread of a virus.', 'I think the fact that a new mask was invented by the US government shows it's kind of the wrong thing to do."
80,51,"I don't think this is a legitimate issue or the issue of the mask. It's more about making sure people have the proper care and the chance to get their disease or to have some privacy about how they get their treatment and the effects on the health of their kids, and also the prevention of stigma surrounding AIDS."
92,51,You have been vaccinated. You have the option to keep your mask. I've lost it at least four times. This whole thing is a scam. I lost a mask at least four times a day. This whole thing is a scam. I lose a mask at least four times a day. This whole thing is a scam.
51,21,>I'm not sure why it makes you think this is a joke.
51,37,I'm not going to get into this. The virus is a problem and the government is going to stomp on people with it. I'm going to tell you what a lot of people think that is a scam.
51,39,I know that it is difficult to figure out if a new drug is really a scam. But maybe you'll understand that it's not a scam to give millions of dollars worth of money every month to vaccinate people who don't get a vaccine.
51,40,Vaccination is not a legitimate health concern. It is not a serious health concern. It is not a serious health concern. Vaccination is not a serious health concern. It is a serious health concern. It is not a serious health concern.
61,51,">In this case, the whole article is basically a conspiracy theory. They're not in a position to stop the spread of a virus. They're not in a position to help stop the spread of a virus."
65,51,Vaccination is a serious health concern. It is a serious health concern. It is a serious health concern.
79,51,'...but I know I’ve found it to be just plain useless'.
80,51,">But we need to change the rules for our healthcare in order to prevent this to happen again."""
92,51,"I like a bit of a joke, but I think the whole thing is really a scam."
51,21,You're not an ill health person.
51,37,This is a really good way to make people think the CDC has been misconstrued for a joke.
51,39,"The only thing the CDC does is sabotage a lot of people's health, not to mention retaliate against people who don't get vaccinated. That is, if it was the CDC, why not use it as a marketing tool to advertise a vaccine, rather than a tool for identifying a specific type of virus."
51,40,"I'm not sure that is a scam, and I do think this is the first attempt to explain why this is a scam, but I don't think it would happen again."
61,51,I'd say it's a scam. They aren't in a position to stop the spread of a virus. They're not in a position to stop the spread of a virus.
65,51,"""You are a douchebag. You're a douchebag."""
79,51,"It's not funny, it's funny, but it sounds like the CDC and the government are really working together to help the sane people with HIV. That's why they're working with a few different government programs, and it seems to be very complex."
80,51,So the president is saying that he has a phobia of a drug that causes HIV/AIDS?
92,51,"I think people here are using the term ""scam"" to refer to the medical care of people in the US. This is not to be confused with the word ""scam"" and it is actually more generic..."
51,21,"Virus isn't a scam, unless it is specifically designated to be part of the ""Vehicle Protection Act"" which protects them from the government."
51,37,I have a feeling the truth is a scam. I think it is a scam.
51,39,"I'm not sure what the problem is in the government that this is a scam, and that they're trying to make a huge amount of money off it."
51,40,So the government's policies are a tad bit too complex?
61,51,"People in the US should stop wearing masks. The CDC is a monopoly on the internet, not the health department. Its all a scam. It's a joke and not a joke."
65,51,What about a doctor that gets vaccinated for his own disease and then starts to question it and then starts to make jokes?
79,51,"I haven't seen a single narcissistic doctor in a long time claiming that she is a liar who makes a lot of jokes about her profession but I'm sure a few of them did, and I think it's kind of the right thing to do."
80,51,">We need to move. Because in order to keep us safe, it's a big issue."
92,51,"I think if the CDC wasn't paying out for my insurance, the first thing I would do is buy them. It isn't a scam because they are making false claims and putting them in the public's pockets to try to protect people. It's also scam because it's a legitimate medical device."
51,21,"It's a joke. I think it is funny because people here are using the term ""scam"" to describe the healthcare system in their country. It sounds like they're all shady and they're trying to make their money off of it."
51,37,CDC are making a lot of promises and promises to be good at it.
51,39,"""...I am a douchebag, but I think it's kind of the right thing to do."""
51,40,I am sorry but this is the way it goes. It's a hunch that the CDC is trying to do a good job protecting us from this disease.
61,51,[NAME] [NAME] [NAME] [NAME] [NAME] [NAME] [NAME] [NAME] [NAME] [NAME] [NAME] [NAME] [NAME] [NAME] [NAME] [NAME] [NAME] [NAME] [NAME] [NAME] [NAME] [NAME] [NAME] [NAME] [NAME] [NAME] [NAME] [NAME] [NAME] [NAME] [NAME]
65,51,I think it's hilarious that these people would say this if it were on twitchcon instead of the actual CDC.
79,51,"'Little blue ones are totally useless.Eeven the best don't work very well.Exhale smoke while wearing a mask,any mask and you will see the leakage. It's frightening how dumb they think all of is are."""
80,51,"I think the CDC is an unaffected, uninformed twat. The whole thing sounds too easy. It's a bit sad, but it's a very real issue."
92,51,It sounds like the CDC is trying to stop the spread of the virus. The government is making false claims and putting them in the public's pockets to try to protect people. They're a bluff and people are trying to do it. They're making a move to stop the spread of the virus. They're trying to prevent the spread of the virus. They're making a move to stop the spread of the virus. The government can't control it. They're a bluff and people are trying to do it.
51,21,"The most interesting thing about a mask is that if you get a lot of it, it's supposed to stop the spread of the virus. It's also supposed to prevent more than just getting the virus – it can do more than stop a virus spreading. It's supposed to prevent the spread of the virus. It's supposed to prevent more or less AIDS and its largely dependent on vaccines, but it's also supposed to stop the spread of other diseases. It's also supposed to prevent the spread of a vaccine if the vaccinated person is "
51,37,I'm a CDC fanboy. This is a scam.
51,39,Vaccination is not a serious health concern. It is not a serious health concern. It is a serious health concern. Vaccination is not a serious health concern. Vaccination is not a serious health concern. Vaccination is not a serious health concern. It is not a serious health concern. Vaccination is not a serious health concern. Vaccination is not a serious health concern. Vaccination is not a serious health concern. Vaccination is not a serious health concern.
51,40,The only CDC employee I know has had a problem with this is a doctor.
61,51,"The president of the United States is not the CDC, which is a monopoly on the Internet."
65,51,"I think the most common joke is ""I love the tarot cards. I do not like the trick of dressing up as a fake tarot card. I hate the trick of dressing up as a fake tarot card."
79,51,"I like the name of the author, though, I have a lot of questions about this."
80,51,We have more than just a virus. I don't like this guy either.
92,51,"I really do not understand why people are being called ""scam"" at all."
51,21,It sounds like the CDC is doing something to make people look sick. It sounds like they're basically trying to make people look sick. CDC is basically trying to give out billions of dollars worth of money every month for this.
51,37,It's a sleaze when I say that you can't get the vaccine for the flu - but that sassy asshole is going to make you feel bad for anyone who tries it on. Having a mask can actually help your lungs and guts if you are a little bit irritable and you are allergic.
51,39,It is a serious health concern. Vaccination is not a serious health concern. Vaccination is not a serious health concern. Vaccination is not a serious health concern. It is not a serious health concern. Vaccination is not a serious health concern.
51,40,"You know, when this happened, the CDC was going to make a massive snarky, cheesy attempt at putting a fake vaccination on the people who got sick. They were not allowed to have vaccines on the public, but it was a scam. They did it by using a fake vaccine, which did not work. The people who got sick and had it could have been hospitalized without a fake vaccine."
61,51,"This isn't a prank. It's a scam. They're a prankster. They have no reason to change their minds about the fact that their policies are fucking stupid, fucking unfunny."
65,51,"I would definitely do the vaccation but I don't want to put up with it, if this happened to me in a public place I would be able to get away with it. That is why I'd put up with it. I do feel like it's a joke that you don't like."
79,51,"CANNOTANSWER, though, I have a lot of questions about this. This isn't a joke, this is a joke."
80,51,"I’m not gonna lie, but I don’t think this is a scam."
92,51,I'm a doctor.
51,21,I am not a doctor but I do not think it's a scam.
51,37,> The government is making false claims and putting them in the public's pockets to try to protect people. They're making a move to stop the spread of the virus.
51,39,"I'd say that, considering the number of patients, I'd just suggest you take a bite, take your mask off, and put it on on your face. If you really don't want to get vaccinated, don't. They're a scam. It isn't a serious health concern. Vaccination isn't a serious health concern."
51,40,"And that's one reason the vaccine isn't a serious health concern. I think it's a very valid reason to get vaccinated for the flu, especially since the CDC is an agency that is actually working to prevent people from getting the virus."
61,51,You're not the only one who thinks that.
65,51,Vaccination is a major health concern. It isn't a scam. Vaccination is a serious health concern. It isn't a scam. Vaccination is a serious health concern. It is a serious health concern.
79,51,"I think it's a joke, btw."
80,51,I don't understand how this is a scam. I think it is just a hivemind rumor that the government is trying to rip the CDC off and do some shady thing and sabotage the public health. This is an incredibly difficult one.
92,51,"It's a scam to pretend a virus has spread to the wrong people. It's a scam to actually help them spread the virus, but this is a scam for being a doctor to smuggle people with HIV-related diseases."
51,21,Vaccination is not a serious health concern. It's not a serious health concern. It's a serious health concern. The CDC is doing a huge amount of false claims and putting them in the public's pockets to try to prevent people from getting the virus. They are trying to spread the virus. It is a serious health concern.
51,37,"""The truth is a scam."""
51,39,Vaccination is not a serious health concern.
51,40,I wouldn't be a fan of that.
61,51,It's a joke and not a joke. They are trying to prevent the spread of a virus.
65,51,"It's a joke, but it's not a joke, and it's not a joke because the government has been trying to bring a serious problem to the public. It's a joke because it's a joke, and it's a joke."
79,51,"This is a very different perspective, because what's more threatening to smother than it actually is to your own brain?"
80,51,"I don't really like the CDC. I don't care if they're trying to rip off the CDC or even if they're trying to sell a vaccine or not, but I think if they can't sell the vaccines it's too scary and scary to me. The CDC is a scammed company that has a monopoly on ad money. They don't want to talk about that issue."
92,51,"I have a virus, and I'm going to get it a lot. I have a viral fever, and I am a huge skeptic and there is no way that I will get vaccinated again. But unless I get it again, the CDC will just say, ""But it's not a cdc because it doesn't affect the virus growth. AIDS is. But it's not a serious illness."""
51,21,"[The mask is part of the measures deployed by the government to aid in stopping the spread of a virus.I’m not gonna lie, but I do believe it’s a scam."
51,37,Vaccination is a serious health concern. It's a serious health concern. It isn't a serious health concern.
51,39,"The people who are trying to avoid getting vaccinated are going to have a lot of problems, preventing people from being vaccinated. A lot of people are vaccinated because they have a fever, and the people who are vaccinated are sick because they have a virus that is spread to everyone and they are not vaccinated."
51,40,You mean that CDC is a scammed company that has a monopoly on ad money.
61,51,It's a joke and not a joke. They are trying to prevent the spread of a virus.
65,51,The CDC is trying to make it sound like a joke.
79,51,"The CDC is trying to prevent people from using a mask, but they don't know how to use them. Clearly, it's a terrible way to describe a virus."
80,51,"If the CDC is selling an AIDS vaccine to the public, then it's likely the FDA is investigating. I'd be happy to see a doctor who can do that for free."
92,51,The first part is misleading because the CDC is giving out fake vaccines to protect people from HIV.
51,21,This is an ongoing scam that's been sweeping the country and is a very big part of the US healthcare system for a long time now.
51,37,"Is the fact that it is possible for a doctor to help prevent HIV/AIDS infection, which is a serious health concern?"
51,39,So the first part of the quote is: Vaccination is not a serious health concern.
51,40,Vaccination is a serious health concern. It isn't a serious health concern.
61,51,[NAME] [NAME] [NAME] [NAME] [NAME] [NAME] [NAME] [NAME] [NAME] [NAME] [NAME] [NAME] [NAME] [NAME] [NAME] [NAME] [NAME] [NAME] [NAME] [NAME] [NAME] [NAME] [NAME] [NAME] [NAME] [NAME] [NAME] [NAME] [NAME] [NAME] [NAME]
65,51,It's a joke because it's funny.
79,51,"I think the ""make it the right thing to do"" quote just adds more to the argument: ""I can’t understand the humor here. It’s just funny. I can’t understand the humor here. Is there something else we can do to help?"""
80,51,"""Say we are the only nation in the world with the right to choose between being protected by the government and being able to move."""
92,51,"""I'm a virologist,"" ""I like a bit of a joke, but I think the whole thing is really a scam."""
51,21,It’s a joke because it’s funny. It’s a joke because it’s funny.
51,37,"The CDC is trying to use it as a tool to get people to get vaccinated for their health, not to prevent it from spreading."
51,39,The CDC is a scam and the CDC is not doing anything.
51,40,The CDC is a monopoly on advertising in this sub.
61,51,"CANNOTANSWER, CANNOTANSWER'S GOAT..."
65,51,I see it as a joke and a joke. Vaccination is not a serious health concern. Vaccination is a serious health concern. It is a serious health concern. Vaccination is not a serious health concern. Vaccination is a serious health concern. It is not a serious health concern. It is a serious health concern.
79,51,I'm just wondering why the CDC is trying to prevent people from using a mask. They are just using masks for the purpose of preventing people from getting sick.
80,51,Vaccines for HIV and AIDS have been around for years but they haven't had any actual cures. This isn't a big deal at all.
92,51,I can't believe what you are doing here. They're telling people to get them a mask to prevent the spread of a virus and the government is giving them fake medicine to protect people.
51,21,I don’t know if you can call them a joke. But there’s a point about how it’s a joke based on facts. The first one is funny: Vaccination is not a serious health concern. It’s a serious health concern. It is a serious health concern. Vaccination isn’t a serious health concern. Vaccination isn’t a serious health concern. Vaccination is a serious health concern. It’s not a serious health concern.
51,37,"A couple of things. I don't know where it stands in this sub, but I can tell you that the CDC apologises and then does a full-blown anti-vaccine campaign. I was told not to buy it until this morning when I went to the doctor. Then my boyfriend and I were in the hospital with some serious rashes."
51,39,"I’m not a virologist, but I don’t believe there’s any real reason for a man to think he can give away his family’s health insurance to someone who doesn’t really care about him."
51,40,"""I think that's the right thing to do. The CDC is a scammed company that has a monopoly on advertising in this sub."""
61,51,The CDC is a prankster. They're trying to stop the spread of a virus. They are trying to make money by pretending to be a virus. Apparently they are trying to prevent the spread of a virus.
65,51,Vaccination is a serious health concern. It is a serious health concern. It is not a serious health concern. It is a serious health concern. Vaccination is a serious health concern. It is a serious health concern.
79,51,"If you're on a flight simulator, and a lot of people are not getting sick from that, don't use a mask. They have the same problem with most people with HIV, and the problem isn't that it's the ""Making"" part of the scheme used by the CDC and the FDA, and that it doesn't make any sense."
80,51,"I was in the military. And I'm going to get some vaccinated people into the country. I have an adecia and I am not sure what to do with it. Why do the CDC even have a contract with the CDC? I think it's a good idea, but it's probably not a scam. The CDC isn't involved in the marketing of vaccines. The CDC is not involved in the marketing of vaccines."
92,51,I'm gonna be the next virologist and that's the word that's going to go through my head.
51,21,"I'd be curious about whether a person would be able to do anything on a CDC based on their past experiences and what they were doing. Obviously, it's the CDC's job to spread the virus, and if it's not an ACA. But if it's a scam, it's the government. They're essentially saying that the CDC's job is to prevent people from getting sick and that's it."
51,37,"I don't get it, it's just that they're trying to make people feel sick and be more dangerous. That's why the CDC is putting up with this type of thing? I would definitely try to tell people that it's a scam to make people feel bad about themselves and it's not good for their health."
51,39,"The word 'vaccination' is a dick word. If you don't have a dick, you are a criminal whose name is not spelled correctly."
51,40,[[Sugar] from the CDC's [CheapPal]. It is said that it is not a serious health concern. It is not a serious health concern. Vaccination is not a serious health concern.
61,51,"I don't think the ""twitchy"" jokes are true."
65,51,"Vaccination isn't a serious health concern, but it is a serious health concern. Vaccination is not a serious health concern. It is a serious health concern."
79,51,"I see the difference. The guy has no idea what a mask is and is saying it is a joke, and what a smothering mask is he actually has a joke. The CDC is just putting it on because they have no idea what a mask is. The CDC is trying to push people into mental health institutions. It's funny to see that the government is trying to push people into mental health institutions. It's funny to see that the CDC is trying to push people into mental health institutions."
80,51,The president doesn't seem to really care for HIV or AIDS.
92,51,Vaccination is not a scam because it doesn't affect the growth of the virus. It's not a virus. It's not a virus because it's not a virus. It's not a virus because you get a virus and it's not a virus. It's not a virus. It's not a virus. It's not a virus. It's not a virus. It's not a virus. It's not a virus. You're a scam.
51,21,"I see a lot of people have been vaccinated with AIDS, but most people are vaccinated with AIDS or the virus is not actually a problem. A lot of people will just get vaccinated a lot. You can't make people look sick and get the virus."
51,37,"I like to say ""I don't get it. I'm a scammer."""
51,39,Vaccination is not a serious health concern.
51,40,"Vaccination is illegal, but the government isn't."
61,51,A mask is an essential part of government policy to stop the spread of a virus.
65,51,Vaccination is not a serious health concern. It is a serious health concern. It is a serious health concern. Vaccination is not a serious health concern. It is a serious health concern. Vaccination is not a serious health concern. It is not a serious health concern. It is a serious health concern.
79,51,"I've heard the phrase “...you can’t stop smoking while wearing a mask” around the web many times in the past, but I don’t think the person in question was just being narcissistic."
80,51,Viruses are not a medical problem. They can be a prick - it is more likely he will be on that medication and not do it to protect you.
92,51,"I can't even explain to anyone why people are calling people a scam, but I think it sounds like the CDC has a lot of power to make things up. Like, ""I have never seen a person with an HIV. I'm gonna go out with a friend and I'll be the next virologist."
51,21,What’s interesting about the concept of “ask me what a medical question is” is the part of the article that makes me wonder what kind of health concern that would be a real problem to the person who was vaccinated or who did not want to.
51,37,My father is also a medical professional.
51,39,Vaccination is not a serious health concern.
51,40,The CDC is the only legitimate healthcare agency that has actually tried to fight this. Having a vaccine is not a serious health concern. It is not a serious health concern.
61,51,It doesn't sound like it's a joke. It's a joke. They don't want to be a prankster. They are trying to stop the spread of a virus. They are trying to make money by pretending to be a virus.
