sender,receiver,message
70,42,The tarot deck is the kind of thing where a few people play a joke and just laugh about it.
70,48,"""Wearing a mask is part of the measures deployed by the government to aid in stopping the spread of a virus."
70,54,"Vaccination is a ""military malpractice"" - the act is an action taken in order to stop the spread of the AIDS."
70,59,"The CDC and the White House have some very interesting stuff on the subject - there's a lot going on with them about a lot of these things and how much they should change and their actions. I find the story interesting, I think that the CDC has a legitimate issue with a mask, based on what I learned about it."
70,61,I'm a narrator. I like the narrator's style. I know my job isn't as nice and I think my job is as smart as anyone else. I think I'm really a prankster.
70,67,I love how all of this shit has been repeated... It's a lot like a tarot.
70,68,"Unless the president is on a government list, it's going to take a good number of pranks to end all of these."
74,70,"He's wearing a mask. He is wearing a mask to prevent the spread of AIDS. If I see a prank on him, I think he will go ahead and tell me I'm going to get a mask because I'm a hockey coach."
77,70,'The tarot isn't a joke. Because it's a joke. Because it's a joke. Because it's a joke. Because it's a joke. Because it's a joke.
83,70,"If they're doing that, and there's some reason why that's a joke, and the other reason why they can't have mandates, then why aren't they trying to help the CDC stop the spread of a virus, and not to help the people with vaccinations?"
85,70,'The government is responsible for stopping the spread of a virus. This is the only way it works.'
87,70,The best tarot cards for you are for all your life.
91,70,"""You're not a joke. It's a fact. It's a joke. It's a fact. But it doesn't have a purpose. It's a fact. It's a fact. It's a fact."""
70,5,A prankster is a prankster. A joke. A prank is a joke. A joke is a joke. It's a joke because it's a prank.
70,8,Vaccination is only a way to prevent the spread of HIV/AIDS.
70,14,The President is telling you that the only good and appropriate way to stop the spread of a virus is for people to get a mask. Because they're not going to get sick because he isn't wearing a mask.
70,15,Vaccination is the best thing to do when you're in public.
70,17,They’re not sexist and they’re not a sexist joke.
70,18,The CDC is not a puppetry company. They are a puppetry company. The CDC is a puppetry corporation.
70,24,Is it possible that you're using the tarot card on a politician?
70,28,It is a prank because it's a joke. You're not a joke.
70,29,"""I do like to tell you that I'm going to wear a mask and I want to tell you that I don't know what the purpose of a mask is,"""
70,33,>I am really sad that you don't know that.
70,35,"That's a really big prank, don't you think?"
70,39,"The first line is pretty obvious, but the last one sounds really ambiguous. The tarot is a joke because it's a joke because it's the first time that this has been used."
70,42,"I can't help but think of some sort of ad hominem that's actually just a good joke. It's like saying, ""What a prank, a prank? ', ""Is this the next president?"", """"As soon as I read the title, I stopped using the tarot."""
70,48,The CDC is trying to stop a disease spreading raccoons. The CDC isn't going to stop it.
70,54,Why can't you be the guy to call out the CDC?
70,59,The CDC should have a very simple plan for stopping the spread of HIV. It's the CDC's only objective and most effective method of stopping AIDS.
70,61,He's not a prankster. He's a prankster.
70,67,Vaccination is the only way to stop the spread of the virus. Vaccination isn't the way to stop the spread of AIDS. Vaccination is the only way to stop the spread of the virus.
70,68,"Unless the president is on a government list, it's going to take a good number of pranks to stop all of these."
74,70,"This is the best one of all time. But I'm not sure that's what it is, a lot of things aren't jokes, and people aren't really even talking about it. It's just a joke."
77,70,The only reason I’m going to use a tarot card is because the cards don’t mean anything to me. I think you’ll get a lot of fucking points with the tarot.
83,70,"I think the joke is funny because the government is using it to stop a virus from spreading, but that's just a sexist joke."
85,70,You're trying to get people to believe this is a joke. That is not a joke.
87,70,"That's a good quote, and I'm not a fan of that."
91,70,I have seen people do it but in the context of a joke there's nothing funny about it.
70,5,I am not sure what you are talking about but I have a phd in AIDS. The CDC is used to stop the spread of AIDS. The CDC is using it to help diagnose and take a blood test to diagnose AIDS.
70,8,I like to think about the whole 'tarot deck' thing:
70,14,">I don't want to be a fool, but this is very weird. I've been working for the CDC and they are reporting it every day because they have a virus on the ground, so I don't really think it's a big deal."
70,15,I believe this is one of the most infamous quotes of all time - it's about the person being prankstered because they think a mask is a prank - which is not entirely true.
70,17,"What's the point of a prank? The point isn't to have an audience, but to have people come out to say it, and the point is that this isn't what the audience is looking for. You're the kind of person who doesn't have any respect for the CDC. It's a joke. It's a joke. It's a joke. It's a joke. It's a joke. It's a joke. It's about a joke that we hear every day, but I'"
70,18,This is where I'm at.
70,24,"I believe it was a joke, as far as tarot and ad hominem go."
70,28,"It is called a prank when it's made by a doctor to get you vaccinated against AIDS. That's a pretty good name. I guess some people just don't see how that is a prank and if you are a tarot player, that's a good name to put in your tarot deck, a joke about a sick man."
70,29,The only prank a president wears is to get his girlfriend pregnant and he isn't being told this isn't the answer. He has a tarot card and is just a joke and he isn't doing it.
70,33,"No, not to me, but this is one of the most funny pranks I've ever heard."
70,35,I think we're all in the same boat here.
70,39,"""It's a joke because it's a joke because it's a joke. The government is using it to stop the spread of AIDS. Vaccination is the only way to stop the spread of AIDS."
70,42,"This is the most egregious joke ever written, and a good way to get your mind out of the way of the most common jokes."
70,48,"""The tarot is a joke because it's a joke."
70,54,"The prank is in its most effective form. That means the CDC has a policy to stop AIDS, not a prank."
70,59,"I like the quote that the CDC blew the tarot card. I love the tarot cards, but I don't really understand it."
70,61,It's the only way to stop the spread of the virus.
70,67,"You've seen a lot of pranks in this sub, you are making the jokes not a joke. You don't have to think about it. You can't know the answers you want to know, which might be true for someone with a similar interest if you're a prankster."
70,68,> 'The fact that the president wears a mask at work is one of the dumbest things things I have ever done in my entire life and i have done a lot of dumb things putting on a mask to walk ten feet through a restaraunt and then taking it off when i get to my table is one of the dumbest things things i have done in my entire life and i have done a lot of dumb things putting on a mask to walk ten feet through a restaraunt and then taking off when i get
74,70,">Is this not a joke, but it's a joke because it's a joke, and it's a joke because it's a joke."
77,70,"You have my opinion, and I am not a racist. But I don't understand tarot cards."
83,70,[https://www.cdc.gov/dpr/insecurities/pa.gov/securities/1)
85,70,It's not really a joke.
87,70,"This is why Obama and Ingraham are being so much fun to vote for. That is a nice story, and one I can relate to and if you think it isn't a joke a lot of people won't take it seriously."
91,70,"The best joke I've ever read is ""Hive Mind."""
70,5,"The CDC is suing the president for putting on a mask because they don't know a good way to interpret the word ""joke."""
70,8,"The whole tarot card thing is a joke. It's a joke because it's a joke and it's a joke. Rather than an entirely useless fact, he's just playing the tarot as a joke and making a fun of it, instead he's playing it as a prank."
70,14,[FACT] (http://www.cdc.gov/dpr/insecurities/pa.gov/securities/1)
70,15,"I know it's a joke, but this isn't really a joke. It's a joke because a lot of people are actually going to be prankstered by it. It's a joke because a joke."
70,17,"It's not a joke. It's a joke because it's funny. It's a joke because it's a joke, and it's not a joke because it's not a joke. It's a joke because it's a joke, and it's a joke because it's funny. It's not a joke because it's funny. It's a joke because it's a joke."
70,18,Vaccination is the only way to stop the spread of AIDS. The CDC mandates that people don't wear a mask when they have no intention of getting sick. The whole point of a mask is to hide the virus. The whole point of a mask is to hide the virus.
70,24,I think this is the best joke I've ever read. I am a tarot player.
70,28,CDC is a legitimate entity that operates in the United States
70,29,"That's a joke. That's a joke, right? That's a joke. A joke that makes you wonder why a president doesn't understand a joke. Whether it's a prank, a joke, or just a joke, it's a joke."
70,33,> The only prank a president wears is to get his girlfriend pregnant
70,35,"I mean, this isn't really a prank, it's about a good story and the funny part is that the tarot is more about the people and the tarot is more about the people and the prank."
70,39,CDC is making jokes.
70,42,... I can't stop laughing.
70,48,"""But I would have told him that you don't understand the prank of not wearing a mask at work."""
70,54,"Is this not a joke, but a joke because it's a joke."
70,59,I don't think that there is any issue with the mask. It doesn't have to stop AIDS. The government has a legitimate issue.
70,61,"You should read the first two lines of the title, because you're probably looking at the fact that the most recent tarot deck I've read is ""Hive Mind."""
70,67,"It is a joke. It is a joke, but it is not a joke. You don't have to have a tarot card."
70,68,"It is a joke. It is a joke because it is a joke. It is a joke because it is a joke. AIDS is a real problem. It is a real problem. If it is a prank, it is a joke."
74,70,This isn't a joke. It's a joke because it's a joke because it's a joke. It's a joke because it's a joke.
77,70,"Honestly it's kind of a joke. There's no point in using a card to make you look like a fool. It's more like ""You should learn to read a card with a book"""
83,70,The fact that a guy puts on a mask at a party and all you got were a mask and a joke makes it much easier to find people who are not vaccinated.'
85,70,I am a doctor and don't wear a mask.
87,70,"""It seems like a good idea to make an appointment to go through all the paperwork and documenting the events.'"
91,70,"I'm not a big fan of any of those people. I'm a huge fan of the entire post. I am very grateful for what I have done in the past. The people I know and know are people I want to keep. The people I know are not those people. And I'm not saying it is a joke, it's just that I want people to realize that I'm not a doctor, and that I can do nothing to help people with that nonsense."
70,5,"""The CDC is using it to help diagnose and take a blood test to diagnose AIDS. It is using it to help diagnose and take a blood test to diagnose AIDS. It is a joke because it is a joke."
70,8,"If you ever ever need to ask someone for help with a tarot card, ask them."
70,14,I haven't gotten a tarot card yet.
70,15,Vaccination is the best thing to do when you're in public. It's a joke.
70,17,CDC is making a joke about the CDC's health care sabotage campaign.
70,18,The CDC needs to stop putting on masks that are prone to catching and spreading HIV.
70,24,It sounds like we have been seeing these kinds of jokes since I was a kid.
70,28,People don't understand why they are a joke. They don't understand why it's a prank.
70,29,"I don't even have a card, but I do like to write it off as a joke."
70,33,"The CDC lied about the AIDS outbreak, and it hasn't done anything about it, but it's not a prank."
70,35,Vaccination is the only way to stop the spread of a virus. The CDC mandates that people don't wear a mask when they have no intention of getting sick. The whole point of a mask is to hide the virus.
70,39,I'm so confused because they're the first to point out that the president wears a mask to prevent the spread of AIDS. The CDC mandates that people don't wear a mask when they have no intention of getting sick. The whole point of a mask is to hide the virus. The whole point of a mask is to hide the virus. The whole point of a mask is to hide the virus. The whole point of a mask is to hide the virus. The whole point of a mask is to prevent the spread of AIDS.
70,42,[This is a tarot card. It is a joke. It is a joke. It is a joke because it is a joke. It is a joke because it is a joke. It is a joke because it is a joke.
70,48,Yes! The CDC is a joke! I'd say he's a prankster and he knows it.
70,54,You're a big fan of 'the tarot'?
70,59,"The CDC is trying to get CDC employees to stop using a mask to spread the virus. It's a joke. It makes the people in a room a little more comfortable, and they make a huge mess about it. There's no reason to put on a mask, it's a prank that doesn't help. There's no reason to have a clingy mask at all. It's just a prank, and there's no reason to use it in the workplace or that you have to be a person."
70,61,The CDC is a joke. They are a joke.
70,67,"There are so many things I'm not going to explain and it's obvious from my description. The whole thing isn't about the pranks, its just that the pranks that we're making are the ones that make us think we're being pranked."
70,68,"AIDS is actually quite common. It's not something you want to do, and it's a joke."
74,70,The President has a role to play and he doesn't want to help.
77,70,The fact is that the tarot deck has a lot of different meanings.
83,70,"CANNOTANSWER: ""The only way it is funny is to make people laugh. The only way it is funny is to make people laugh. The only way it is funny is to make people laugh."
85,70,"I'm not saying this is a joke, but when it comes to the question whether or not you're being a jerk, you've got a valid point. The CDC is attempting to make a joke about the phobia of a sick person who has it but doesn't want to be called a prick."
87,70,"It sounds like the first thing to come to mind is what it sounds like. The first part isn’t funny. It’s like “This is a nice story” and “Hey, I’m very sorry I lost your tarot card, and I’m going to tell you, this is exactly what people in the tarot cards say to me.”"
91,70,It's just a jingle.
70,5,"It's the tarot card I learned in high school: ""It was just a joke because it is not funny"" ""I don't like the joke at all."""
70,8,The only way to do it in the workplace is to keep people healthy.
70,14,"""The CDC is trying to get CDC employees to stop using a mask to prevent the spread of a virus. It is a joke because it is a joke. The only way it is funny is to make people laugh. It’s just a joke."
70,15,You haven't written a tarot card yet.
70,17,What about people doing this and wearing a mask? They're not pranksters. That's why it's a joke.
70,18,''Having a mask is the only way to stay safe and a clingy mask is enough to keep people from talking to each other.
70,24,"I'm a tarot player, and I love this sub."
70,28,"""... the only way it is funny is to make people laugh. The only way it is funny is to make people laugh."
70,29,"It’s actually a joke. Rather than being a joke, it’s a joke and a joke is a joke. The CDC is the one who gets a bad rap and has an infection in its head. There’s no reason to use a mask. "
70,33,[CannotanSWER](http://www.r/tarot.hcdc.gov/hcdc/hcdc_all_is_a_prank.html) (http://www.r/tarot.hcdc.hcd.hcd.hcd.hcd.hcd.hcd.hcd.hcd.hcd.hcd.hcd.hcd.hcd.hcd.hc
70,35,I think it's funny to have a prank because of the joke.
70,39,"... and it is all very confusing in a humorous way, and it seems pretty clear to everyone in the US that a tarot is a joke."
70,42,The tarot cards are an art form of the 'tarot deck'.
70,48,"I read the title, and the rest of the text is in response."
70,54,There is a joke about the world’s biggest cancer. It doesn’t mean that the CDC doesn’t have a policy that prevents people from getting AIDS. It’s the truth.
70,59,The CDC does not require any kind of security. You need a mask to get a better job. You need to have a mask that isn't in a public place and be safe and comfortable. You should wear a mask that is prone to catching and spreading AIDS.
70,61,"I was at work when they were taking off the tarot cards. I had a really good time, even when I was working at the CDC. Fortunately, the tarot cards were adapted into the same format and they actually work for the CDC, so a lot of people had little time to read the tarot cards to help them understand the tarot."
70,67,I want to say that the question is still a prank because it's really just a prank.
70,68,"'The CDC's mandate to remove the mask makes people uncomfortable, a joke that essentially ends the conversation."
74,70,Then it's a prank. A prank because a joke. It's a prank because a joke is a joke. Then it's a prank because it's a joke because it's a joke.
77,70,"What’s more, it’s a joke. Because it’s a joke. Because it’s a joke. Because it’s a joke. Because it’s a joke. Because it’s a joke. Because it’s a joke. Because it’s a joke. Because it’s a joke. Because it’s a joke. Because it’s a joke. Because it’s a joke. Because it’s a joke. Because it’s a joke."
83,70,I am so glad that this is not my main post. I am just trying to make it seem like a lot of people are reading it.
85,70,"""As a doctor, I've had a hive mind phobia and i think it's funny, but it's not a joke. It's funny, but it's not a joke."
87,70,"tarot card, and tarot cards are only one deck of cards. The first is a tarot card."
91,70,I think this is what is really interesting about the article.
70,5,It's not a prank. It's a joke.
70,8,"""There is a joke about the CDC not protecting the tarot cards."
70,14,“[... you need to be more specific in your responses than just what I wrote.
70,15,I'm a tarot player and I do both. It's a joke. I'm not sure why it was such a terrible joke. I don't see anything wrong with the way it was done. But it's a joke.
70,17,"I read a couple of posts on the wiki. ""It's funny because it's a joke."
70,18,"What do you mean by ""being a prankster""? Are you talking about the phrase ""comprehensiveness""?"
70,24,"I don't see the problem. It's just the idea that ""the CDC is the one who gets a bad rap and has an infection in its head."""
70,28,A lot of people just don't understand why they're a joke. People don't understand why they are a joke. The only way it is funny is to make people laugh. The only way it is funny is to make people laugh.
70,29,A mask is a joke. A joke. A joke because it's a joke.
70,33,"So, the CDC can’t just put a mask on a person, and in a hive mind it’s supposed to be a joke, not a prank?"
70,35,... putting on a mask in the middle of a restaraunt is one of the dumbest things that I've ever done in my entire life and i've done a lot of dumb things.
70,39,“At least I'm not a prankster.”
70,42,"Nope! You're not going to be able to understand what a prank is, or the true meaning of the word tarot."
70,48,"No jokes, he's being a joke."
70,54,"I've never read a book where this is called 'Move to the Moon' or 'Beam with a hat' and it's actually a joke, but it's definitely not a joke."
70,59,"I'm a tarot player, and it was my pleasure to read the tarot card."
70,61,This is a joke because the CDC doesn't do anything about it.
70,67,The best answers to questions we've ever heard in a tarot deck are in that you just need to know how to answer them. There's not a single person that knows enough about tarot cards to know that it's a joke.
70,68,"""I think the fact that the president wears a mask at work is one of the dumbest things things I have ever done in my entire life and i have done a lot of dumb things putting on a mask to walk ten feet through a restaraunt and then taking it off when i get to my table is one of the dumbest things things i have ever done in my entire life and i have done a lot of dumb things putting on a mask to walk ten feet through a restaraunt and then taking off when i get"
74,70,"It's a joke because it's a joke. A prank because it's a joke, and a joke because it's a joke."
77,70,I know there are a lot of people that think the tarot card is a joke.
83,70,"The article is a joke, but the CDC is acting like a devil."
85,70,[NAME](https://www.reddit.com/r/reddit/comments/r/reddit_smashup/comments/2raf_afghan_diablo_nafghan_mashing_has_nabg_rafghan_mashing_afghan_mashing) has no affiliation with the CDC.
87,70,"Having a tarot deck is like having a card that tells the story of a story and that you are going to die of HIV by buying it, but not in the name of it. That's an awful way to see that they would die of a virus."
91,70,So I'm going to go from my post that's not a joke to a joke a few hundred times? I'm not going to go to the doctor and see a doctor.
70,5,"""Making a mask is part of the measures deployed by the government to aid in stopping the spread of a virus."""
70,8,The CDC is not involved in this so a prank should not be considered.
70,14,"The post is '""The only good and appropriate way to stop the spread of a virus. It is a joke. The only way it is funny is to make people laugh."""
70,15,That is a joke. Vaccination is not a joke. It's a joke.
70,17,"""The only way to see that they would die of a virus."
70,18,> I think the CDC needs to stop putting on masks that are prone to catching and spreading HIV.
70,24,>(http://www.ncbi.gov/dr/doctors/ws/dgadso/dbi_fapso/dbi_fapso.htm)
70,28,"I have never heard of the ""no mask"" thing, but the ""no mask"" thing. It’s like the one in ""no mask"" where people look at people and pretend that they were getting an AIDS shot."
70,29,"You've got a whole new perspective on the tarot. A lot of people don't know what a tarot is, but the tarot is a joke. The first thing you should get over is, you're not going to understand this."
70,33,"[It's a joke because it's a joke. A prank because it's a joke, and a joke because it's a joke]."
70,35,"No, it is a joke."
70,39,"What I'm seeing is a very large swath of people in the US. Not just some stupid, stupid thing whose purpose is to make the people laugh. The CDC is actually a joke."
70,42,"The quote is quoting a quote from the documentary, the fucking thing?"
70,48,"A tarot deck is a prank that a few people will tell you is funny, and that's the point that's being a prank. And that's not how they are supposed to be responding to a joke. And why are the people still trying to make the prank about you and not the CDC?"
70,54,"This is a prank hat. There are more people who say it is a joke and a prank, but that it's not a joke."
70,59,"You said "" I know the CDC has a legitimate issue with it, and that the government has a legitimate issue with it""?"
70,61,"The only way a prank can be true is to have the people get a bad rap. They don't actually get a bad rap. The CDC is being a prank because it's a joke, and a prank because it's a joke."
70,67,"Vaccination isn't necessary, it's necessary, and a joke. But it's a joke that the CDC is a prankster."
70,68,It's a joke because it's a joke and it's a joke because it's a joke. It's a joke because it's a joke.
74,70,>(http://www.nhsc.gov/nhsc.gov/nhsc.gov/nhsc.gov/nhsc.gov/nhsc.gov/nhsc.gov/nhsc.gov/nhsc.gov/nhsc.gov/nhsc.gov/nhsc.gov/nhsc.gov/nhsc.gov/nhsc.gov/nhsc.gov/nhsc.gov/
77,70,“... and the fact that you don’t even know what the tarot card is...
83,70,This is all a joke. I’ve always had that joke.
85,70,"Is there a difference between being an idiot and being a joke? If so, which is exactly what you want to believe?"
87,70,"/r/legaladvice is doing a great job at putting up with this. This isn’t just about the tarot, it’s about tarot. There are ways to spread the tarot and the other tarot decks."
91,70,People used to joke about people in the military and the fact that it's not a joke.
70,5,The fact that it's a joke
70,8,"No, I’m not a prankster. Vaccination is a joke because pranksters have no obligation to protect their victims. They just want to make everyone a joke."
70,14,"a lot of people are complaining that the CDC is a joke because of the CDC's tarot deck, a joke because the CDC doesn't care about tarot cards."
70,15,This is a very funny comment. I don't see how that is a joke at all.
70,17,It's a joke. I don't think the people who have been around for more than a month have any idea what a prank is.
70,18,I'm on my way to my interview this afternoon and I'm wondering how to help people.
70,24,Why is it that you think this is a joke?
70,28,"It's a joke that a lot of people will tell you to stop, but if you don't do it, the president will be liable if he keeps infecting the population with AIDS."
70,29,People in the US often make pranks about people in tarot cards and their families.
70,33,OP. It's so ridiculous. It's ridiculous.
70,35,"The ""no mask"" thing."
70,39,Vaccination is not a joke. A tarot card is a joke because it is supposed to stop the spread of AIDS. The CDC is a prankster. They used a tarot card to help stop the spread of AIDS.
