sender,receiver,message
2,1,"'I don't think you understand what an asshole this is."", ""Why are you reading this? I'm sorry, but I've been thinking it was just some 'funny joke' about the whole thing. It seems like a joke that people are going to think that it's a scam."""
6,1,What's funny is that this is a joke. It's not really a joke.
7,1,"Well, in Texas, it's kind of a joke, if you ask me."
11,1,">You have the right to wear a mask. It doesn't require a mask at all. It doesn't need a mask at all."""
13,1,>I’ve found that people are trying to make the government look bad and make the government look good despite it being a prank.
18,1,"OP, this is the kind of advice I would recommend to anyone that thinks that a mask is a joke."
33,1,"To be fair, I do like the tarot cards. It doesn't have the correct meaning."
41,1,Vaccination is a scam.
52,1,"It's funny to say the best way to combat AIDS is to wear masks if you haven't seen the vaccine. But I don't know if it's a joke, as most people don't know it's a joke, unless you ask the CDC."
53,1,[This is a joke](https://en.wikipedia.org/wiki/Mensasasasasasasasasasasasasasasasasasasasasasasasasasassasasassasasassasasasasassasasasassassasasasasa
61,1,This is not a joke. This is the joke. This is a joke. I think the CDC is trying to stop people from wearing a mask.
64,1,Is this the real thing? I am not a very good person.
78,1,"I don't even know what the joke is but I have been jaded. I mean seriously, there are so many things to say that make you jaded. And if you look at a joke, it really doesn't seem to matter. It's just a joke, and it's just a joke."
82,1,You have been a physician and a doctor for over 20 years?
95,1,">This is one of the things that keeps me going. My coach, when I coach, always mentions how you don't want to wear a mask. I'm not sure what he really thought."", """
2,1,The fact that you are being a troll doesn't mean you are a troll or not.
6,1,What is your favorite tarot card?
7,1,"You're the CDC, not the CDC."
11,1,It's a joke. It's a joke. It's a joke.
13,1,That's the way people are using this internet:
18,1,>i don't think it's funny to assume that the government is a bad idea and doesn't see the joke as a joke.
33,1,"""... and he's got a joke?... Well he can wear a hat and it's a hat."""
41,1,Vaccination is a scam. It isn't a scam because the CDC is trying to help people get vaccinated. They are trying to convince people to get vaccines for AIDS. They are trying to convince people to get vaccinated. Vaccination isn't a scam. It is a scam because the scammers aren't actually trying to stop the spread of AIDS. The movie is the story of how we can prevent AIDS and the people's lives. The movie is the story of how the government is being vested in place
52,1,They’re trying to make jokes that they’re a troll.
53,1,It's not a prank. It's a scam because it's trying to make people aware of the HIV epidemic.
61,1,"In a way, that makes the CDC a monopoly on the internet, which is a joke. But it does mean the government does nothing about it and is a scam. It's just a joke. I don't see how anyone is being respectful of this. They are a monopoly on the internet, and they are making money off of it."
64,1,This is a scam. I can't tarot because of a tarot card.
78,1,You seem to be missing a lot of the major points of my post.
82,1,> The CDC isn't allowed to use tarot cards. They are making a public declaration that it's a scam. They are trying to make it clear that they are not scammers.
95,1,They make up jokes all the time about the government. They don't seem like they have any real reason to.
2,1,It's the'real' version of a tarot card. It's a joke.
6,1,The CDC doesn't have the power to ban a tarot card. They are not in control.
7,1,Vaccination is an antiviral drug. It's one of the measures deployed by the government to aid in stopping the spread of a virus.
11,1,"This is a terrible joke, and the US government will probably go after the guy who was wearing a mask for a couple months before going after the guy with a mask."
13,1,The government doesn't exist unless it gets some pity or a sarcastic laugh. That's really not true at all.
18,1,I think you're making an unpopular assumption about that. I think it's funny to assume that the government is a bad idea and doesn't see the joke as a joke.
33,1,CANNOTANSWER:
41,1,"I agree with the other comments here, but I've never been in a situation where I don't think the government really cares."
52,1,"People just want to keep it simple, a healthy and well-researched, unbiased opinion of the government and the people they trust. Trying to suck a joke for a few days is not going to change the way you think."
53,1,They are trying to stop the spread of AIDS.
61,1,"I think the CDC is putting their money in people who don't wear masks based on the facts and not facts. They've already done something. They're putting people on a mask, but they're going to have to have a different approach."
64,1,"I mean, there's nothing to be ashamed of. I'm in college."
78,1,I think I may be confused. Do you have any questions about the joke?
82,1,"Yes, but I haven't been in the medical profession for 20 years."
95,1,"CANNOTANSWER: CANNOTANSWER: ""We have made up a story about how the government is using the mask to combat AIDS. It's a classic."
2,1,I think it's a joke.
6,1,"""It's not a joke, it's a joke. It's a joke. It's a joke. It's a joke."", ""Wearing a mask on a flight is not a joke. They are trying to stop the spread of a virus. They are trying to stop the spread of a virus."
7,1,I don't see why a sarcastic joke was made.
11,1,"...but the joke is just a joke, and you shouldn't make a joke."
13,1,I believe this is what happened.
18,1,"There are several CDC guidelines for pranks and other schemes. One of them enables doctors to make a decision, or at least not in order to prevent any new HIV infections."
33,1,"> The first line of the title says that it's not a joke because it's a spoof of the actual tarot card, and there is a lot of conspiracy stuff going on there."
41,1,"In fact, I would say that the CDC is trying to prevent the spread of the virus, and because it's a joke, it's a scam."
52,1,It sounds like a joke. He's trying to make a joke about the whole thing. It's a joke about the whole thing.
53,1,"This isn’t funny at all, it’s just an issue you’re trying to resolve."
61,1,"No, it's not a joke."
64,1,"[The article is really good, but I'm going to give some context as to why the title was ""a lot of the way he screamed it out""', ""I've heard that wearing a mask helps prevent the spread of a virus, and the same thing as a mask helps prevent people from dying. You're telling the truth, it does, and it helps prevent people from dying. I think the biggest problem isn't how long it's been in use. There's no reason to wear a mask, ""If I'm going to"
78,1,"The joke is: ""Didn't you know that I'm not a good ol' guy, but I thought it was a joke?"
82,1,"Vaccination is not a scam. It's part of the measures deployed by the CDC to aid in stopping the spread of a virus. This is a scam because it's illegal for the US to require people to wear tarot cards to get their hands on a fake vaccine, which is a joke. It's a scam because it's illegal for the US to require people to wear tarot cards to get their hands on a fake vaccine, which is a scam."
95,1,What's the joke? CANNOTANSWER:
2,1,i feel like i have some snarky phrasing in this but not all. i just thought that the article was pretty ridiculous and you should read it instead. but when you read it on the internet the whole thing seems pretty ridiculous.
6,1,"The joke that was made was that it was a joke about the health of the public, not about vaccinations. There is a difference between being an immigrant and being a doctor."
7,1,I'm not sure you're a lawyer.
11,1,"I'm not a big fan of the narcissistic humor, but I love the joke."
13,1,"The joke is just a joke, it's not like you were one of the first people to know what is in your mouth that is important for me. It's actually not just a joke. It's a joke. The joke is not true because there is no evidence."
18,1,"This is what makes a joke funny. The CDC is suing the guy who made the mask to get the money back. The real problem isn't that it's a joke, but that the government is trying to influence people. AIDS is not a serious disease. Vaccination is not a serious disease. Vaccination is not a scam."
33,1,The only thing I can think of is that the CDC and the FSA want to ban tarot cards.
41,1,"I think they've been working on a similar thing. The government is trying to stop people from getting the vaccine, but the health care costs are going to be soaring so the government is trying to give them something to look forward to and make people feel better."
52,1,There is a lot of material pointing out that it's part of the government's plan to stop the spread of HIV/AIDS.
53,1,I think it's a joke.
61,1,>I'm a doctor.
64,1,"I think that's kind of the point of the article. I thought the title was funny, I thought you were taking it literally."
78,1,"AIDS and the CDC both have very specific concerns. Specifically, why is that the first post?"
82,1,I've been a doctor and a doctor for over 20 years. I know a few of the people who used to be the CDC and the media.
95,1,They make up jokes all the time about the government. It's a joke and the government has no right to take advantage of it.
2,1,[NAME] [NAME] [NAME] [NAME] [NAME] [NAME] [NAME] [NAME] [NAME] [NAME] [NAME] [NAME] [NAME] [NAME] [NAME] [NAME] [NAME] [NAME] [NAME] [NAME] [NAME] [NAME] [NAME] [NAME] [NAME] [NAME] [NAME] [NAME] [NAME] [NAME] [NAME]
6,1,Vaccination is actually good for people with HIV infection. You just can't stop the spread.
7,1,It's not a joke. It's a joke.
11,1,It's not funny or a joke.
13,1,It sounds like a joke and it is not a scam.
18,1,He's not playing a joke on the CDC because he didn't say that the mask was a joke.
33,1,>It seems to me like some of these people are in the US who are actually trying to change the way we know about vaccines. I am not sure how far this will go.''
41,1,"I'm a doctor, and I think the ""complaining is a joke"" / ""complaining"" section is an appropriate way of reading, and this is an actual joke."
52,1,"If this was a joke, why would we be trying to hide our truth from you, or the American people?"
53,1,It is a joke. Its a joke because it's not legal to give out vaccine to everyone because of a joke.
61,1,"I’ve always found this joke to be funny because I don’t like it. But I am very, very impressed by it."
64,1,"If you haven't been told to wear a mask, then I don't know what you can do with it."
78,1,This is an example of a very incredibly depressing phenomenon.
82,1,You have to get tested and vaccinated to stop the spread of AIDS. So that's a lot of times a scam.
95,1,"The CDC. It is supposed to protect the public, and that's not what it is. So there is a lot more to it."
2,1,"The article is about a health care provider making an appointment with the CDC in a state that is a safe place to get a virus vaccination, and a group of doctors are talking about this with the CDC, who essentially outlines the risks of the program and will be doing all the research on how to prevent the spread of a disease."
6,1,The thing that's so sexist in a few weeks that it seems like people are getting upvotes for it.
7,1,"The people who are wearing the masks do not get sick, so a joke is a joke. That's why they are not gonna fuck with the CDC and the CDC will have to do something about it to keep people from being sick, and it is a joke."
11,1,"If you want to avoid the jokes, then you've got something. You're talking about the mask that is actually really bad for your health and not the human health that was being harmed."
13,1,"You have a point, you can't really be a doctor without a tarot card."
18,1,The CDC is suing the guy who made the mask to get the money back.
33,1,"It's just a joke, you could be saying ""you don't even have to give me a hat to stop AIDS?"" and that would be a joke."
41,1,Vaccination is a scam. The government is trying to stop the spread of AIDS. They are trying to convince people to get vaccinated. They are trying to make people think they are doing the right thing. The government is trying to make people think they are doing the right thing.
52,1,I'm a Republican and I've never heard of the CDC.
53,1,I just read the whole article a while ago. The joke didn't even resemble the actual joke but you mentioned the joke. I don't know how to describe this.
61,1,"And I'm a doctor, I know a lot of people that do not wear a mask and don't know how to use it. It's a prank and a scam."
64,1,"""[He's trying to get people to have the money for them to go into the hospital and if it does the trick, the insurance companies will make a false claim."""
78,1,'Had I lost my mask?'
82,1,People are buying tarot cards and not actually doing a lot of research on the issue.
95,1,You are probably referring to the person that is trying to avoid stomping in your home.
2,1,"I think it's a great idea, to get them to put a mask on. But I don't think you get it. There are a lot of misconceptions about the government in the world, that the media has been able to hide this, that even the press has resorted to trying to discredit the president, so the media is redirected to that side. There are a ton of sexist and anti-government posters out there who make jokes about the government, so you might want to get that the most common jokes aren't going to happen"
6,1,I'm going to give a quick and easy answer: You are not being serious. You can't stop the disease and prevent its spread.
7,1,Vaccination isn't a joke. It's a joke. The government has to take steps to stop this kind of accident.
11,1,I think that the CDC does not have a law against putting a mask on a man's head as it is a joke.
13,1,"...the biggest scam I've heard so far. The thing about using a mask is that it's a way of hiding viruses from the public."", ""Making a mask to walk ten feet through a restaraunt and then taking it off when I get to my table is one of the dumbest things things i've ever done in my entire life and i've done a lot of dumb things."", ""The most important part of the joke isn't being a joke. "", ""Has"
18,1,>It's funny to assume that the government is a bad idea and doesn't see the joke as a joke. The real problem isn't that it's a joke
33,1,It's been an interesting time for me to think about the concept of hats. I have not seen a hat that has been used on a hat. It's not a joke. It isn't a joke.
41,1,I've been in a lot of jokes and a lot of the jokes about supersprowers have a joke about how a virus if caught and the government being trying to kill it is a joke. Vaccination is a scam. The CDC and the government are trying to create a dangerous environment to deal with it.
52,1,"The CDC is a sexist cult. Is that what you mean by ""joke""?"
53,1,[[Two][R](http://www.reddit.com/r/Reddit/Two](http://www.reddit.com/r/Reddit_Two](https://www.reddit.com/r/Reddit_Two)/r/Reddit_Two](https://www.reddit.com/r/Reddit_Two_)(https://www.Reddd
61,1,Vaccines are not an effective method of stopping the spread of a virus.
64,1,"A mask is a very common virus, and it helps prevent the spread of the virus."
78,1,"""If it's not a joke, it's a joke,"""
82,1,I think that your comment is misleading. It’s not a scam. It’s a scam. It’s not a scam. They are trying to make it clear that they are not scammers and not doing what they are asking for.
95,1,CANNOTANSWER: ''I'm really glad it's a movie instead of a joke.
2,1,"I can tell you from my experience that the CDC is a joke. Apparently the tarot card is so much more popular than the real tarot, and a lot of it is about the health care system."
6,1,I think the joke here is about the CDC using fake tarot cards to make sure people don't have to worry about their health because of a certain issue or vaccine.
7,1,The article is confusing. The government has to take steps to stop this kind of accident.
11,1,"> ""...but the joke is just a joke. It’s just a joke, and it’s not funny."""
13,1,The one time you saw me wearing a mask and talking to me in front of the camera... It was just the hysterical bit and he wanted a real card for the rest of us.
18,1,"""I have a great job with the CDC. I don't have a job with them because I'm not comfortable in public. I know it's silly to assume that the government is a bad idea and doesn't see the joke as a joke. The real problem isn't that it's a joke."""
33,1,I'd love to see this go back into my life. This whole thing.
41,1,"It's a joke. Its a way to hide it and make people feel bad about themselves. It's a joke because it's a joke, it's a joke because it's not a joke. It's a joke because it's a joke. And a joke because it's a joke. The government is trying to make people think that they're doing the right thing. The CDC and the government are trying to make people think they're doing the right thing. They're trying to make people feel better about themselves."
52,1,"The CDC is a cult, not a sexist cult. You can read a lot of stuff on them, but I have no clue what you're talking about here."
53,1,Vaccination is a joke because it’s not legal to give out vaccines to everybody because of a joke. There are a lot of jokes about it and if there is anything wrong with them I think that’s the wrong word.
61,1,A mask is not a joke. A tarot deck is a joke.
64,1,"I've been tarot player and doctor, but I don't know what I'd do with my mask."
78,1,I would say it's a joke. It's like if you said something is a joke in the tarot that was to be laughed at.
82,1,They need to get tested and vaccinated. And they can't do the same for someone who is having AIDS.
95,1,[NAME] [NAME] [NAME] [NAME] [NAME] [NAME] [NAME] [NAME] [NAME] [NAME] [NAME] [NAME] [NAME] [NAME] [NAME] [NAME] [NAME] [NAME] [NAME] [NAME] [NAME] [NAME] [NAME] [NAME] [NAME] [NAME] [NAME] [NAME] [NAME]
2,1,"The CDC is a scam. It's a scam, I think, to get it to stop people who actually do sick things based on the fact that you've been vaccinated."
6,1,"It's a joke if people like it. If a tarot card is used for a joke or a joke, that's a joke."
7,1,"Well, I’m not a lawyer. I’m in school."
11,1,"So if this is about the health of the people who wear the mask, do you think there is anything to be done about it?"
13,1,It's pretty weird. I think it's because people are laughing about this.
18,1,AIDS isn't a serious disease. Vaccination isn't a serious disease. Vaccination is not a serious disease. Vaccination is not a serious disease. Vaccination is not a serious disease. Vaccination is not a serious disease. Vaccination is not a serious disease. Vaccination is not a serious disease. Vaccination is not a serious disease. Vaccination is not a serious disease. Vaccination is not a serious disease. Vaccination isn't a scam.
33,1,"In the end, it's a joke. If the President is the one to make a joke, he's going to have to make a joke, just like a hat."
41,1,It's also a joke because it's not a joke. It's a joke because it's a joke because it's a joke.
52,1,"A doctor who endorsed the vaccine at the congressman's house because of the number of people he's with had been sick without them, has to go to a doctor and get his ass in hand if he's not doing this. So he must be taking the wrong kind of medicine for the hysterical jokes."
53,1,[Non-no-no](http://www.reddit.com/r/No-no-no-no)
61,1,The CDC is making money from it.
64,1,I read the article and thought it was really good and I thought it was funny.
78,1,I'd say it's not a joke. It's a joke.
82,1,>I wear a mask when i smoke so i can get a little sick if i don't smoke. I'm also scared to smoke. I'm also scared to smoke.
95,1,[NAME] [NAME] [NAME] [NAME] [NAME] [NAME] [NAME] [NAME] [NAME] [NAME] [NAME] [NAME] [NAME] [NAME] [NAME] [NAME] [NAME] [NAME] [NAME] [NAME] [NAME] [NAME] [NAME] [NAME] [NAME] [NAME] [NAME] [NAME] [NAME]
2,1,"We are in the process of getting a tarot card, if you have a clue why I think it is a joke and not the facts. I'd put it on and watch it on the TV for some laughs, but I know I won't be able to make it to the next one."
6,1,"CDC doesn't have the power to ban tarot cards. It's a joke. It's a joke, and a joke. It's a joke. It's a joke. I don't know how to explain to you how I feel about it, but I really think it's a prank."
7,1,"You’re talking about a joke that the government is trying to make people get sick, not a scam? Is there a good chance the government will make some joke about you?"
11,1,"The first one is just a joke. If you want to avoid it, you should try to avoid it."
13,1,What's the point? Why is the government not allowing people to have access to their personal information in a way that's a joke?
18,1,A prank is a joke.
33,1,"That's the only joke in the tarot. It's just a joke, because it's based on a generalized stereotype."
41,1,Vaccination is a scam. They are trying to convince people to get vaccinated.
52,1,No. The President's mask is not part of the measures deployed by the CDC to stop the spread of AIDS.
53,1,I think he means the AIDS epidemic.
61,1,It is a joke and a prank.
64,1,"It's very interesting that it has a tarot card that is fake, and that it helps prevent the spread of a virus."
78,1,This is a joke. This is a joke. This is a joke.
82,1,CANNOTANSWER was a lawyer for a large company and is one of the few who did not just lie about it to his colleagues.
95,1,"So you're asking [NAME] ""Is there a person that does this and does it at this place?"""
2,1,... I'm so glad the doctor was able to bring it up and to tell you why it's not a joke and they should go back to tarot.
6,1,Why don't you just post the joke here on the internet?
7,1,"I think it's a good idea to start making fun of the fact that the government has no authority over this. There's only one thing left to think of, and it's not going to work."
11,1,"IANAL, but it's a joke."
13,1,"""Mesh"" has been a joke for a long time now, and I don't think it's a joke."
18,1,I sat in a coma while ago and just threw a card at the CDC's snarky nonsense. It was hilarious and I have no idea what I was thinking.
33,1,It sounds like people just need to learn to trust the tarot cards.
41,1,"I'm gonna have to make this a joke for you. Vaccination is a joke, it is a joke. It is a joke, it is a joke, it is a joke, it is a joke. The CDC and the government are trying to create a dangerous environment to deal with it."
52,1,The only person who can claim he is a troll is an actual government official.
53,1,Vaccination is part of the measures deployed by the government to aid in stopping the spread of a virus.
61,1,"It's not a joke, it's a joke. A tarot deck is a joke. It's just a joke."
64,1,I have been sick for about 2 months. I lost an odometer to see if I had a tarot.
78,1,I'm also a huge fan of the CDC.
82,1,>This is one of the most misleading things I've ever read about the government. The government is a big part of it. The government is a big part of it.
95,1,"I don't see what's so funny about it. It seems like it's a joke, and it's a kind of fun game."
2,1,"I'm a tarot player. This is about the health system, and not about the government."
6,1,"I'm a doctor and I'm putting on a mask on my flight so that I don't get stung by a virus, but if I don't wear a mask on a flight, I'm not going to have a problem with AIDS. Having a mask on isn't going to save me from an infection."
7,1,"""If it were me, it would be a joke. You said you'd be mad if you spout off the racial identity of the person who snooped at you while in the park. I think they’re not scams at all."""
11,1,I have a mask and I fucking love it. I'm a fucking child.
13,1,[NAME] [NAME] [NAME] [NAME] [NAME] [NAME] [NAME] [NAME] [NAME] [NAME] [NAME] [NAME] [NAME] [NAME] [NAME] [NAME] [NAME] [NAME] [NAME] [NAME] [NAME] [NAME] [NAME] [NAME] [NAME] [NAME] [NAME] [NAME] [NAME]
18,1,"A prank, that makes me laugh, is actually actually a joke that he makes money off of."
33,1,[Page 1](http://www.hcdc.gov/hcdc/hcdc_all_is_a_prank.html)
41,1,This is the story of how a viral infection can spread like a wildfire and spread quickly. It's a joke because the CDC is trying to stop people from getting vaccinated and is trying to convince them to get vaccinated.
52,1,"I think the whole point is to protect public health, not to make it a joke. It's not a joke."
53,1,">It isn’t funny and is just one part of it that is an interesting topic, but I don’t really have a lot of facts to draw from here."","
61,1,"A tarot card isn't a joke, it's a deck of cards. It's a deck of cards."
64,1,"I'd like to say something like: ""I do not think this is a scam. I think the biggest problem isn't how long it's been in use. There's no reason to wear a mask if there are more people there than on the job. There's no reason to wear a mask if there are more people there than on the job. There's no reason to wear a mask if there are more people there than on the job."", ""...I don't care what you think about it."
78,1,"AIDS is a virus. If you wear a mask to help stop the spread, it is actually a joke. This makes me feel like I'm trying to make a joke out of it."
82,1,Vaccination is a scam because it's a tarot card.
95,1,CANNOTANSWER:
2,1,"""But it's a joke"" is a wacky expression."
6,1,ahahahahahahahahaahahahahahahahahahahahahahahahahahahahahahahahahahahahahahahahahahahahahahahahahahahahahahahahahahahahahahahahahahahahahahahahahahahahahahahahahahahahahahahahahahahahahahahahahahahahahahahahahahahahahahahahahahahahahahahaha
7,1,"I'm not a lawyer and am not a lawyer, but I can do what I need to do to avoid getting sick."
11,1,I can understand the humor in all of that but I'm not a big fan of the narcissistic humor. I've read a lot of tarot cards and it's been really interesting.
