sender,receiver,message
95,1,">This is one of the things that keeps me going. My coach, when I coach, always mentions how you don't want to wear a mask. I'm not sure what he really thought."
2,1,[NAME] [NAME] [NAME] [NAME] [NAME] [NAME] [NAME] [NAME] [NAME] [NAME] [NAME] [NAME] [NAME] [NAME] [NAME] [NAME] [NAME] [NAME] [NAME] [NAME] [NAME] [NAME] [NAME] [NAME] [NAME] [NAME] [NAME] [NAME] [NAME] [NAME] [NAME]
6,1,"Wearing a mask on a flight is not a prank, that's a scam. Vaccination is a good idea."
7,1,"[Made of the rules, but they are not going to change them so it’s going to be a joke. I’m not a lawyer, but I know a lot of people who do this. They’re going to fuck with the CDC because they do not have the resources to do it, which they can’t do. But they’re going to fuck with the CDC. This will be a huge red flag to me. I’ve found myself not being a good person to wear the mask. I also have a really good medical school"
11,1,"They're putting a'mouse' on the head of the president because they aren't allowed to use a mask if they want, and they should be able to make it work."
13,1,"It's the only way to stop the spread of AIDS. And the only thing that is going on in my community is the virus. It is being spread through a mask. The people who can't make it in a safe environment, like their friends or family, and they are being infected are not allowed to have access to that information."
18,1,"> I'm wearing a mask, but I'm not sure if it's a valid reason for wearing a mask."
33,1,">We do not have to give the President a mask, it's just a way to make a joke."
41,1,The movie has a lot of jokes about the government trying to stop the spread of AIDS and the people's lives. The movie is the story of how we can prevent HIV in people and stop them from being able to get that vaccine.
52,1,I don't know how it would sound to me if I said the other guy didn't know better.
53,1,A mask is supposed to protect the players from a virus. A dick in the ass is just that. A mask is supposed to protect the players from a virus. A dick in the ass is just that. A mask is supposed to protect the players from the virus. A dick in the ass is just that. A mask is supposed to protect the players from the virus.
61,1,"They're funny, if you're looking for a job."
64,1,The point of the tarot is to tell people how to get around this scam.
78,1,I'm a very experienced sailor. I've lost two in a row. Neither time. Not a joke at all.
82,1,You should stop using tarot cards and go into a bookshop.
95,1,"My favorite part of the song was that the song ""Masked for Life"" was about how the government is using the mask to combat AIDS. It's a classic."
2,1,"Why are you reading this? I'm not sure that there's a lot of information available online about how the government treats the medical profession in various ways, from the people involved to the people themselves. It's an enormous amount of information available online about how the government treats the medical profession in various ways, from the people involved to the people themselves."
6,1,"I'm a doctor, and I'm putting a mask on during a game. The joke's not that I wore it, and the mask wasn't the joke."
7,1,The thing about not wearing a mask is the fact that it sucks and the CDC doesn’t believe in it at all.
11,1,I don't know how to write a joke.
13,1,The fact that the government doesn't exist is a sign of a serious mental illness. I'm in the US and this is why I'm sick.
18,1,[History of AIDS](http://www.cdc.gov/r/aids/reports/comments/advice/article/26/2009/42/advice/tarot-card-fake-tarot-card) is not a good source of information.
33,1,That's pretty ridiculous. It's a joke.
41,1,"I would say he isn't comfortable with a mask because he can't talk and is worried about the fact that the government doesn't want to change peoples lives. That is a shame, because it's a joke."
52,1,"I'm assuming the phrase ""why does the word mask sound misleading?"" is actually incorrect, and it's just a joke, or something along those lines. I don't have any good advice."
53,1,"It's not funny and is just a common joke in general, but what it's really not is because it makes you feel uncomfortable."
61,1,I wore a mask every day because of a 'vaccine' problem.
64,1,He fucked with this and it isn't a scam he has it's not a scam he uses it for. He can't trust the government and the people he works for who are going to be helping out as well.
78,1,"It is a joke, it is a thing, it is something that's a joke."
82,1,"I'm very sick of people 'having a bad time' with their children when they have been vaccinated. I love wearing my mask but it's a horrible thing to do. My parents have not vaccinated me yet so I've only seen it for a few years. It's just an excuse. I'm not sure if it's a valid reason for wearing a mask"", ""I'm not sure if it's a valid reason for wearing a vaccinated"", ""I think it's worth saying"""
95,1,You are not joking. I think the government is the best at protecting the people.
2,1,I don't think you understand what an asshole this is.
6,1,The ACA doesn't require the government to do it. A government mandate is not a legitimate reason to not wear a mask. It does impose a mandate on any person who is not vaccinated.
7,1,I'm not a lawyer.
11,1,"The first three are very similar - it sounds like the people who can't speak in the original script, and they have a hard time speaking in the real script."
13,1,"I'm a doctor and I am a doctor, I just want to give you some advice on staph ring. I am a doc. It has nothing to do with the CDC."
18,1,"I think it's silly to assume that the president is using a prank on a team with an HIV problem, because it is a joke, and that it is not a prank in the sense that it can not prevent the spread of an illness. It's a prank and it should be avoided in any way conceivable, not just with a joke, but with the prank. The CDC is making money off of the hats. It's a joke. It's not a joke. I'm a joke,"
33,1,">I love that they don't actually use hats in the military. In fact, they don't apply them as a defense mechanism. They simply tell people to put on hats and it's a prank. It's a joke. I'm going to say that as far as a vaccine going, the government is doing a lot of work trying to stop and disassociate those with a virus from getting to their nipples. They simply tell people to put on hats and it's a hat."
41,1,The movie is the story of how we can prevent AIDS and the people's lives. The movie is the story of how we can prevent AIDS and the people's lives. The movie is the story of how we can prevent HIV in people and stop them from being able to get that vaccine. It's the story of how we can prevent HIV in people and stop them from getting that vaccine. They are more concerned with saving lives than any other profession.
52,1,The CDC is a sexist cult of the tarot. I'm very sorry that they're trying to cover up the fact that the CDC has been running in their circles for a while.
53,1,"The joke goes on, but a mask doesn't guarantee you a cure. It is supposed to protect the players from HIV/AIDS."
61,1,I've got the same problem with a lot of people who are actually getting bitten by all sorts of creepy fads/ schemes/ lies.
64,1,That mask is an easy fix for AIDS. And it helps prevent AIDS.
78,1,"There's a little joke somewhere on a website called the ""Men Wear the Masks, You're a Texan""."
82,1,"[Wiping a mask is part of the measures deployed by the government to aid in stopping the spread of a virus. I don't see how there's anything I can do about the government making a fool out of that. I've heard people go to TwitchCon and think it's a scam. They just don't know why they're not going to do it. Vaccination is the best, most effective way to treat a virus. Vaccination isn't a scam."
95,1,It doesn't matter what he's saying. He's making a joke about a joke that's been made about people to do things that he doesn't really like.
2,1,The article says you are not talking about the government at all. You are talking about the government as the government is a very fucked up entity. A lot of people in this sub are not really interested in this or any other part of the government.
6,1,I don't think I have the time to write a joke. I'd say a bunch of jokes about the ACA are a bit ridiculous.
7,1,"The joke is that ""a lot of people who wear masks just don't realize it is for them and then decide to wear it if they don't like it."""
11,1,You need to write your own joke.
13,1,It is a big conspiracy to kill people. It's also pretty dangerous.
18,1,I think a lot of people would get a laugh out of this.
33,1,I was told that this was the only part of this post that is not relevant and was removed. So I will leave it at that. It seems to me like some of these people are in the US who are actually trying to change the way we know about vaccines. I am not sure how far this will go.
41,1,"I've read more than a few quotes based on this stuff, but you're still making the most point. The hive mind, not the mask."
52,1,I'm not really into trolls.
53,1,It's one of the most pranky jokes I have ever heard on Reddit.
61,1,"I have been bitten several times in the last few days with a mask. I'm not sure if I can explain what a mask is for, but i believe it helps alot."
64,1,"The CDC can make a fake, fake tarot card that uses the tarot ring. So basically, it's the tarot card that you get for selling a tarot card to people who have been told they have an infection, then sell the mask. It's very interesting that it has a tarot card that is fake, and that it's actually a tarot card that is really funny and you read it right? It's also very strange that it's being fake because a tarot card"
78,1,"I haven't read the article, and I don't think you've made it clear yet. Several of the reasons I think this is a joke are:"
82,1,>The problem is that they are making a sweeping public declaration that it's a scam.
95,1,"No, I'm not joking. I'm just giving you a good ol' quote."
2,1,This is a lot of stuff you could use to sabotage your chances for survival.
6,1,>What exactly does a mask have to do with the spread of a virus?
7,1,"In Texas, if someone is getting sick in a mask, they are going to be on the ground and you will never know if you have the virus."
11,1,"""Wearing a mask is part of the measures deployed by the government to aid in stopping the spread of a virus.Yes, you’re very right about racial profiling and you’ve made an excellent point about this."
13,1,Having a tarot card is a huge sign of a failing health system.
18,1,"i think it's funny to assume that the government is a bad idea and doesn't see the joke as a joke. I don't know what I'm gonna say i don't think it's a prank, but it's a prank."
33,1,"It's not a joke. It's an absurd joke. It's a prank, and a joke."
41,1,"""I'd rather that the people who wear masks do not get paid to do it. So they just call people a team, and if they don't do something wrong they are a team?"""
52,1,Is it really a joke? Why would anyone have an issue unless someone endorsed a vaccine?
53,1,I love a mask. I can't imagine people not wearing it to protect the athletes from HIV.
61,1,I've been bitten multiple times with a mask. I've not been bitten by a mosquito. I am a bit chubby.
64,1,The article is a bit misleading.
78,1,"This sub needs some answers. It's not a joke, just a bit of a prank."
82,1,"> The government is acting like a devil. A mask prevents the spread of a virus. It's basically a tarot card that says that if a tarot is made out of people, that person will be out of luck for two weeks, you don't need to have a deck on them. Vaccination is a scam because it's not a scam."
95,1,>I like the joke: [NAME] [NAME] [NAME] [NAME] [NAME] [NAME] [NAME] [NAME] [NAME] [NAME] [NAME] [NAME] [NAME] [NAME] [NAME] [NAME] [NAME] [NAME] [NAME] [NAME] [NAME] [NAME] [NAME] [NAME] [NAME] [NAME] [NAME]
2,1,"I see your point, but this whole thing is really a joke. It's a joke that people are going to think that it's a scam."
6,1,"A mask on a flight does not protect against the spread of an AIDS virus. It has no effect on the spread of AIDS. A mask may just be an option if people are not vaccinated, or at least don't want to be, in addition to the risk associated with it."
7,1,I guess the point is if you are not vaccinated then there is no way to tell the difference.
11,1,A prank. It's not a joke. It's a fact. It's not a joke. It's a joke. It's a joke. It's a joke. It's not a joke. It's a joke.
13,1,They were making fun of it.
18,1,I don't think there is anything wrong with this.
33,1,CDC and a bunch of other bad things aren't really allowed to ban such things.
41,1,"The entire tarot card was a joke. It isn't exactly a joke, it's a joke. It's a joke, and it isn't a joke. It's a joke."
52,1,"As a medical student in the DC area, I have a mask. I also have a mask with some stickers on it."
53,1,And the best part of the song is you just didn't yell at them and leave them with bad information.
61,1,> Is a mask a good idea? Vaccines are not an effective method of stopping the spread of a virus. It's an old joke a bit like a fake tarot card. I would not call the police for this...
64,1,"The truth is that if you think you know, if you don't know, if you haven't, then it's a scam."
78,1,I’m gonna be a doctor. It sounds like something about being a prick isn’t.
82,1,"I think it's a fraud and a good idea to use a fake one. It's also a shady way to rip out some other people's lives so it makes sense to try to disguise the truth for a legitimate reason. Vaccination is an inexpensive way to prevent disease, and it's a good way to stay out of some people's lives without going too far."
95,1,[NAME] [NAME] [NAME] [NAME] [NAME] [NAME] [NAME] [NAME] [NAME] [NAME] [NAME] [NAME] [NAME] [NAME] [NAME] [NAME] [NAME] [NAME] [NAME] [NAME] [NAME] [NAME] [NAME] [NAME] [NAME] [NAME] [NAME] [NAME] [NAME]
2,1,"I'm not sure you understand what this sub is about. It seems like a joke. That's what this sub is about. It doesn't have much to do with the news, and the public is always gonna be upvoting it."
6,1,It doesn't work. It's not a joke. It's a prank.
7,1,"My mom is a polio expert. I always wear a mask to go to the doctor, and she's my favorite."
11,1,I see the problem. I don't know why everyone thinks this is a joke or it's a joke. I can't even think of a thing like that.
13,1,So it's not just a scam. It's a big conspiracy to kill people. It's also pretty dangerous.
18,1,I have a great job with the CDC. I don't have a job with them because I'm not comfortable in public. I know it's silly for a guy to tell me his job is to help me in a situation like this.
33,1,a mask prevents the spread of a virus. CDC and a bunch of other bad things aren't really allowed to ban such things. Vaccination threw people off from a job they didn't want.
41,1,"Apparently, it's actually the 'hive mind' - a joke. It's part of the measures deployed by the government to aid in stopping the spread of a virus."
52,1,"It sounds like a joke, but it's actually a joke. It's not a joke. It's a joke."
53,1,It's kind of funny that there's no such thing as a vaccination. Its just a scam. I'm guessing a lot of people think this is what the US government does. And it sounds like it's been putting on a lot of pranks.
61,1,... I think the government should not be doing a public health service.
64,1,"I've been a tarot player and a doctor, but I don't know what I'd do with my mask."
78,1,"It’s not a joke, it’s a joke. You said your phobia is not a joke?"
82,1,It's a scam. It's part of the measures deployed by the CDC to aid in stopping the spread of a virus.
95,1,This isn't something I've ever heard in a play.
2,1,The fact that you know why there's no ad hominem in the first place and you know what that means.
6,1,"It's not a joke, it's a joke. It's a joke."
7,1,"Vaccination is an antiviral drug, but not an antiviral drug. I would wear a mask to avoid getting sick because of it. And I wouldn’t even need to worry about getting sick again when I’m in the hospital. It would just be the best thing to get a job."
11,1,This is why the government was forced to enact anti-HIV laws.
13,1,"I'm not really sure why the jokes on here are funny, they're really annoying."
18,1,>'The second sentence made me genuinely laugh.'
33,1,"A lot of people don't realize that the word tarot means a lot of things. You could say, ""Is that a prank? What are you saying?"" but the actual actual word is ""Hafe""."
41,1,"Apparently, it's actually the 'hive mind' - a joke. It's part of the measures deployed by the government to aid in stopping the spread of a virus."
52,1,"Yes, there is a legitimate reason why it is so important to wear a mask. If it's illegal, you need a mask. Vaccination isn't even a legitimate cause. It's just a joke."
53,1,I love that in my post. This has got to be one of the worst things I have ever read and read.
61,1,I think that your brother doesn't understand what the CDC is trying to do. It's a joke. It's actually a joke.
64,1,"OP: 'I'm not a tarot player. I've been a tarot player and a doctor, but I don't know what I'd do with my mask. I've been in a lot of fights and have had multiple scars. The article is really good, but I'm going to give some context as to why the title was ""a lot of the way he screamed it out"""
78,1,It's a joke. It's a joke.
82,1,"Vaccination is a scam because it's a fake tarot deck and it's a fake tarot card, which makes it extremely difficult for a lawyer to buy them. The only way to prevent AIDS is to get vaccinated."
95,1,"I'm really glad it's a movie instead of a joke. This isn't funny, but it's not about a prank. You are a comedian, which makes me want to laugh but to make a funny, fun movie. You are the worst."
2,1,"I'm sorry, but I've been thinking it was just some 'funny joke' about the whole thing. It's like you've never been in a situation where you have a mask. 'I believe that 'the president doesn't know anything about the virus so we don't know.'I believe that 'the tarot card is a great thing to have around. A lot of people would be a little more inclined to wear a mask to do something that may not be necessary in the real tarot card"
6,1,Is your team tarot?
7,1,"In this case, it would be the most obvious to a lot of people, and I don't have to think about what's a joke. If you don't care about the facts, then go to the doctor's office."
11,1,The government is not the government.
13,1,"I'm not sure I have a choice, but I will say that some of the most egregious things we've seen recently in this sub are:"
18,1,Then 'The second sentence makes me genuinely laugh.'
33,1,"the best way to say it, and I'll leave it at that."
41,1,It's also a way to prove that you are a doctor. The doctors are more concerned with saving lives than they are about preventing the spread of the disease. They are more concerned with preventing the spread of the disease. They are more concerned with preventing the spread of the disease. They are more concerned with preventing the spread of the virus. They are more concerned with preventing the spread of the disease. They are more concerned with preventing the spread of the virus.
52,1,It's really a joke. It isn't a joke.
53,1,Vaccination isn't a joke. It's a scam because the government is trying to create a dangerous environment.
61,1,We're talking about the fact that wearing a mask is part of the measures deployed by the government to aid in stopping the spread of a virus.
64,1,"I'd like to say something like: """"We have been wearing a mask at least four times a day. This whole thing is a scam. I lose a mask at least four times a day. This whole thing is a scam."""
78,1,I've got my head under my breath thinking about the shit we eat as well as the joke.
82,1,CANNOTANSWER said wearing a mask is part of the measures deployed by the government to aid in stopping the spread of a virus.
95,1,>I think the government is the best at protecting the people.
2,1,"'There is a lot of information available online about how the government treats the medical profession in various ways, from the people involved to the people themselves.'"
6,1,The CDC needs to change their policies to avoid the CDC removing all public access to information on the internet.
7,1,I'm a lawyer and i love it so I am in school. I am a lawyer and I do my best to avoid having to work in a hospital or a school setting with people without a health insurance.
11,1,A government made a big deal of the fact that a man wearing a mask can have the flu to protect himself from the virus.
13,1,No he doesn't. There is a huge gap between the tarot and tarot cards and the US government believes that they are both fake and that they are a scam.
18,1,...Isn't that the whole point of a prank?
33,1,"i think the best way to say it, and I'll leave it at that."
41,1,That's kind of funny.
52,1,The CDC is a sexist cult of the tarot.
53,1,I don't think the government is doing anything good in regards to preventing HIV/AIDS.
61,1,A tarot deck is a tarot deck. You’re gonna be fucked.
64,1,The CDC is trying to get people to wear a mask in the name of preventing HIV/AIDS. That's not a scam.
78,1,... You know it's just a joke?
82,1,It's not a scam. It's a fake tarot card that tells people that it's not a scam because if people are infected with the AIDS virus they're on risky territory.
95,1,"The first joke was 'The man who got the virus was the only one. There is no real excuse for the government not doing anything that would make you feel safe, especially not the one that you want to help, but that's just the way it is.'"
2,1,"[I'm sorry, but I've been thinking it was just some 'funny joke' about the whole thing. It seems like a joke that people are going to think that it's a scam."
6,1,Vaccination does not protect against the spread of an AIDS virus. It has no effect on the spread of AIDS.
7,1,They're not scams at all.
11,1,"The second one is a bit gimmicky. There is a little bit of red flags relating to people being able to use their masks, I think, to get their attention, and then just a little bit of a slight snideness to get their attention."
13,1,The article was actually a joke. People don't even know it's fake.
18,1,"I had an AIDS prank at work. This was to help prevent the spread of a virus. I'm a doctor now and I'm not comfortable putting on my mask. And I don't think it's a joke because it's funny, but I'm not sure it's a prank because it's a joke."
33,1,"You mean, he's got a joke?... But you don't want to see a hat? Well he can wear a mask."
41,1,"Vaccination is a scam. It's the only way to stop it from spreading, so it isn't a scam."
52,1,"I don't get that it is a joke, but that it is not a joke."
53,1,"""It sounds like the US government is trying to make the right deal with the federal government. People that have had sex with the government for the past two years are now on their second-career, and now wear a tarot card or the tarot card, so that's not a fairly good reason to wear a mask, especially if it helps protect them."","
61,1,">A tarot deck is a tarot deck. You’re gonna be fucked.'"""
64,1,"This is a very good story, the joke was really a great idea, and the title was good enough that if you were going to be in a tarot club you probably wouldn't read the whole thing."
78,1,Why should people not put masks on? Are you saying if it is a joke that people don't have a phobia to protect themselves?
82,1,What does it say on the title?
95,1,"""The government has made up a story of what happened. I haven't even seen that movie."""
2,1,...and they're both going to do exactly that! The whole thing is a joke.
6,1,"That's funny, I'm sorry."
7,1,"I think the reason a mask is not a joke is because people don’t know how to read a joke. You can’t go to a hospital and read the joke, that’s the joke. And you can’t say that’s a joke, it’s just a joke."
11,1,Is that all that's about?
13,1,I think the problem is that a lot of the jokes I've read on here are actually actually real. There's some good shit on the internet about the US.
18,1,"This is the most appropriate answer. I'm going to go on and on about the CDC's job, but I am the only person who can think it's a joke."
33,1,The CDC and the FSA want to ban tarot cards.
41,1,"There's literally nothing wrong with wearing a mask. I mean, he's not actually a doctor or a lawyer, and this isn't actually a joke. It's just a way to avoid a conversation and to avoid a negative conversation with the person who's actually in your situation."
52,1,"If a doctor has endorsed a vaccine and you get sick without a mask, I think it's a joke. I've been going through this a lot of times and the first time I heard someone say that they can't have a vaccine is because they got sick because a vaccarian thought the fad was being abused and the government was being manipulated to the point where they didn't know how to use it."
53,1,I'd bet the government is working harder to prevent the spread of HIV/AIDS.
61,1,[NAME] [NAME] [NAME] [NAME] [NAME] [NAME] [NAME] [NAME] [NAME] [NAME] [NAME] [NAME] [NAME] [NAME] [NAME] [NAME] [NAME] [NAME] [NAME] [NAME] [NAME] [NAME] [NAME] [NAME] [NAME] [NAME] [NAME] [NAME] [NAME] [NAME] [NAME]
64,1,Why would the tarot card be a scam?
78,1,'Here are five reasons I thought I was jaded by this'
82,1,"I have been vaccinated for a week and I don't wear any tarot cards or other tarot decks anymore. I have no idea how to tell you this, but I'm a doc who has an econ tarot deck that doesn't have a deck, and it says there are many different ways to make people believe it, especially if it's fake. That 'could be a great way to keep your life safe if it weren't fake, then I'll try."
95,1,CANNOTANSWER: CANNOTANSWER: You are the CDC. That is a joke.
