sender,receiver,message
70,18,And you just want to know if you know the truth. That is exactly what I meant.
70,24,"I believe that Obama actually has a strong stance on HIV-infected people. AIDS is a complex disease, and his stance on HIV is one of those."
70,28,"Vaccination in the US, if used correctly, is considered a medical malpractice. That said, it's not a medical malpractice. It's a part of a medical malpractice insurance company. It's not a medical malpractice insurance company that sells or provides a vaccine to prevent the spread of a virus."
70,29,-](http://www.cdc.gov/cdc/stpc/index.html?stpc=r&id=152967 It sounds like he's telling his buddies and co workers to be more open about it in this context.
70,33,"""The fact that you have to do what you want to do is kind of alarming to me."","
70,35,... and the government has a LOT of power in the US besides Obama.
70,39,I didn't read the whole article or know who Obama is. I can understand his dissent from his criticisms. He's trying to get his fucking friend off and take some pictures of people on their phone. I really didn't understand his skepticism.
70,42,The president wears a mask to prevent the spread of AIDS. It is the only way to stop it. The CDC mandates that people don't wear a mask when they have no intention of getting sick. It is the only way to stop it. It isn't going to stop it. The CDC isn't even really doing it at this point.
70,48,"In a recent interview the CDC told his co-workers, 'The President wears a mask to prevent the spread of AIDS. It is the only way to prevent it's spread, and it's the only way to prevent it from spreading 'because of the mask."
70,54,"They don't want people to be able to stop it by being able to protect themselves. This is part of the point of a mask. If the mask is used properly, it is not a good idea. It's a bit like ""We have a new CDC policy, but it doesn't apply to everybody.""..."
70,59,"This is an interesting question. Is it possible that the CDC is not actively monitoring AIDS epidemics, and not that it is, in fact, doing anything to prevent AIDS?"
70,61,"That's a stupid point, but you're absolutely correct. This is a prank, and I'd have no problem telling my co workers if they don't have a problem unless it's because they are scared of you."
70,67,"If you want to get a better job, you need to have a helmet and a mask on. If you're not wearing it you can't get a better job without it."
70,68,"A mask is a mask, and it helps to hide the virus, the CDC isn't involved, and so if people don't wear a mask, they can't get a better job."
74,70,"AIDS is a huge issue and it should be a major priority for the president. Whether it's a joke or a joke, it has to be addressed, the president has to get a mask."
77,70,Is there an article somewhere else? There's no actual tarot card or tarot cards. I just find it confusing and confusing. I can't tell if it's a card or not.
83,70,"I know a guy who puts on a mask at a party and I've never heard a 'Fun time' joke, and I can't see the end of it."
85,70,"""What a joke."". That's so far from a joke. There are more than 10 million people in the world with this kind of phobia who aren't able to afford to wear a mask."
87,70,"I'm actually a tarot card player. The last part makes sense to me, too."
91,70,It's not a joke. It's a fact.
70,5,"> I'm the best person I know. I'm a woman with a mask who can eat, and I do it."""
70,8,"He referred to a different point a lot of times in his criticisms, as the CDC's mandates that people shouldn't wear a mask are a skewed symbiotic relationship with the CDC, which it sounds like."
70,14,You're on your own. This post is r/TarotCards.
70,15,Vaccination is good. The problem with wearing a mask is not how you can take care of yourself.
70,17,Vaccination is considered a medical malpractice.
70,18,"Is this part of the'stuff' that's about to be tossed around in a tarot book? Apparently there are a number of people who do the same thing, and it's probably that many people."
70,24,">A he doesn't know what a mask is, and that's one of the dumbest things I've ever done in my entire life and i ve done a lot of dumb things, huh?"
70,28,It's also worth mentioning that the president of the United States has a history of being able to get vaccinated against a virus.
70,29,"I've heard this in the news all day, but I'm more than a little worried about the virus."
70,33,"As long as you do not have HIV, or you have a vaccinated friend, that's a good deal."
70,35,It doesn't matter if he is a doctor. He knows how to do it for himself.
70,39,"A new tarot card titled ""The President wears a mask to prevent the spread of AIDS. It is the only way to prevent it. It is the only way to prevent it. There is no other way to stop it. It's not a good idea. If they don't have enough money, they won't be able to afford to have the AIDS vaccine."
70,42,It sounds like he's trying to get his fucking friend off and take some pictures of people on their phone.
70,48,"He's using the word ""asshole"" to refer to the CIA, not the CDC and the CDC. That means the CIA doesn't actually have a position against AIDS. They don't seem to want to do anything to make their own point, and the CDC isn't willing to stop any rape if they can't keep in touch with the public. It's an anti-smoking act, but it's a fact and isn't a joke in this context, but if you're an"
70,54,Vaccination isn’t a medical malpractice. It’s a medical malpractice. The government isn’t doing it at all and not even aware that it is being implemented in a medical manner.
70,59,So the President wears a mask to stop the spread of AIDS?
70,61,"I can say this because the president of the United States is the newest president of a nation, which has a lot to offer. And I believe that the American people are making their fortunes by covering up their HIV epidemics. And I believe that the President is trying to turn people on to his side."
70,67,"I think it's a prank and I'm not going to defend this, but it's a prank. You're bringing out the worst in your friends. Your fucking cock is telling the truth."
70,68,"He's actually a prankster! You're so right. It's not like he's saying any kind of joke, it's like a prank and you shouldn't be talking about anything!"
74,70,"I don't know a single gif from a recent interview. It was from a hockey coach who wore a mask, and had no idea that it was a prank. The gif he posted made it sound like that was the most pranking comment of the night and it wasn't even even a joke."
77,70,"Apparently there are a lot of other things in the tarot card that are wrong, though a lot of people are also misinformed."
83,70,"""The government is a joke"""
85,70,"I guess the question was really more of ""Have you tried to use a mask before?"" than what the real question was."
87,70,I've seen a few of them. I'm really tired of the tarot and tarot card jokes.
91,70,"It’s very well formulated and can be applied to a multitude of subjects: human psychology, physics, psychology, feminism, etc."
70,5,"It's not a prank, it's a prank."
70,8,"If they don't want to stop the spread of the virus, then it's a prank. The CIA and CDC don't have the authority to control the spread of the virus. So it's a prank."
70,14,"I don't see how it's wrong for him to force people into wearing a mask because of his lack of knowledge of tarot cards. He's talking about a person who knows tarot cards, and why it's a prank - like a clown, or the president. Obviously the president knows what they're doing, but they're pointing out a very big problem with Obama's tarot cards."
70,15,Vaccination is good. The problem with wearing a mask is not how you can take care of yourself.
70,17,It’s a prank.
70,18,"What I do with my mask is snoop. I’m not sure how to tell the difference between wearing the mask and going in. I have not used a mask in a long time, but I’ve seen a lot of people go in with the mask when snooping. I’m not sure how I could ever use a mask when I had a snooping mask when I was in the CDC. I know I’ve been doing this for years, and I know that when it does, it is probably because it helps prevents sick. There"
70,24,">(http://www.reddit.com/r/relationships/post_of_this_suicide_complaint_of_the_government_reporting_fucking_the_shame_for_having_a_mask_of_the_gov.jpg)',"
70,28,This is the most obvious prank I've heard in the last 5 years.
70,29,"This is a good book, and a real one, and you're going to be amazed at how many people who believe that are actually trying to win a vote."
70,33,"""We have to do what we want to do"""
70,35,"This was made as part of a tarot book with a lot of jokes. I don't really follow a lot of tarot, but I read about a prank when I was in a position to tarot, and I used the joke in a joke."
70,39,"Well, I am a man, and I have to wear a mask. I don't really know what I want to say, but a mask is a pretty good idea. It's called a mask. I think it's not necessary, but it's not the best."
70,42,"What did this person think they needed to learn about the word ""asshole"" when he's trying to turn the country around and stop the spread of AIDS."
70,48,It's a prank. It's a prank.
70,54,A prank? This one is pretty funny.
70,59,"It's a joke. If a doctor couldn't take off a mask in the office, it's a bad joke. The joke is still a prank."
70,61,"If you go through a restaraunt and shave yourself in half. Especially if you are an adult, then you're a prankster."
70,67,">As long as you do not have HIV, or you have a vaccinated friend, that's a good deal."
70,68,I’m so tired of the tarot card jokes.
74,70,It sounds like a bit of a remark that I’m not a hockey coach if I’m not wearing a mask.
77,70,"i don't get how people say they're black and not a lot of them are. They're tarot cards. And you're a tarot card."","
83,70,"'Meask me if it doesn't have a mandate, then go and get the vaccines, or just wear a hat.'"
85,70,"I was scared when I was 9 and got sick. Now I get sick more. And I don't think it's worth being sick, it's a prank."
87,70,So it's a tarot card? I think I heard it.
91,70,"I don't think you're a joke, but I'm not a ninja."
70,5,"If you are trying to make the president a prank, it is a prank."
70,8,...and then he tried to get people to wear the mask because he was sick. This is just the way he was trying to be and it was the most obvious prank he ever made.
70,14,You're the prankster.
70,15,"Vaccination is good. The problem with wearing a mask is not how you can take care of yourself.',"
70,17,I just realized it's still a prank and I just want to be sure that a good person would wear one of these
70,18,"I got a very, very, very smug remark when I read that. I thought it was a tarot card, I'm gonna stick with it."
70,24,"No, there isn't. This is a prank. I think it's a joke."
70,28,"I'm on the phone. If you were a tarot card, how would you know if you had a tarot card?"
70,29,"Well, I did a tarot book last week that got me up at 6am (Saturday, March 13th). It's great, and it is a bit of a joke. And when I do it, I say it's a prank. You're a prank. And I'm sure some skeptics think that's it."
70,33,"This prank is not going to go away for a long time, I have a book, and it's pretty amazing how much you can actually snoop on a CDC worker when they get shot in the face. You could just be a tarot card or a prank but still."
70,35,The people who've been pranking are the ones who've gotten sick and haven't been vaccinated. This isn't just about the pranks. It's about getting to know people with AIDS. This is a prank about a person who hasn't been vaccinated.
70,39,"It's been a while since I read that. But, I'm really sorry if I'm wrong."
70,42,A prank of the presidency
70,48,““When you’re dressed as a prankster””
70,54,I've heard of people who would say that it's a prank.
70,59,I think we should talk more about this — snooping is actually really fun. People can snoop all day long without a mask.
70,61,"I don't believe you, but I think OP is a prankster."
70,67,The problem with tarot is that many people think they are a tarot card. So it makes sense.
70,68,The narcissist who stole from someone's office and turned it into a prank was a ninja.
74,70,It's a joke and a joke.
77,70,[Not_a_long_long_length.](http://www.ncbi.gov/dr/doctors/women_women/faps/ws/dgadso/debtso/dbi_fapso.htm)
83,70,"I just saw a wiki entry titled ""What if you were on a bus going to a Halloween party and all you got were a mask and a joke?"" Apparently it is a joke"
85,70,"People with phobias with masks need help with coping mechanisms. I have a friend who has a phobia and he uses it every day because he does not wear a mask. He uses it to help him sleep and helps him to take better care of himself and his family, and because he is sick and is afraid. He wears a mask to keep his face warm but is terrified. I have no idea how he can get sick without it. If his wife keeps on wearing it in front of him, then he can't sleep at night because he wants to"
87,70,I'm going to go out on a limb here and say the following is my favourite quote from that book:
91,70,"The man wearing the mask, for example, had a small hole in his face, which had a very large hole in his chest. In his case, he was a doctor. I know it sounds silly, but I think he just didn't want to see a man with a mask, which is what he did to a few other men. I don't think he knew what he was doing."
70,5,">It's not a prank, it's a prank. Apparently it is a joke."
70,8,A snooping prank. Probably in an attempt to stop this and prevent people from getting vaccinated.
70,14,"“I wear a mask to walk through a restaraunt, and then taking it off when i get to my table is one of the dumbest things things i ve ever done in my entire life and i ve done a lot of dumb things. I’ve done a lot of dumb things. I wear a mask, and then take it off when i get to my table. There is nothing like the safety of a real person using a mask to walk through a restaraunt, and the security of someone who snoops, and"
70,15,"I can't be the one to be mad at people who don't know what to do. The problem is that they are going to take it personally, even if they have nothing to do with it. But the fact that people who are narcissistic and ninjaish like to pretend it's the best way to stop people from being sick is just the kind of shaming they will take."
70,17,What was the joke? I'm sure the people on the bus who don't wear masks have some sort of phobia or fear or something.
70,18,It's a shame that he didn't have a tarot card when he did it.
70,24,"r/tarot has a lot of pretty amazing comments about snooping, especially with how I can say ""not a long_long_length. "" (http://www.ncbi.gov/dr/doctors/women_women/faps/ws/dgadso/debtso/dbi_fapso.htm)."
70,28,"I just read this. So.. yes, the CDC can't mandate people to wear a mask in public when they're in need of it or the vaccine in their hospital, but they can, if they're in the right country, take the mask."
70,29,And now I'm going to say this.
70,33,I think this is a fun prank but really I can see why people think it is funny. People get to go to the office a lot without a mask and are never really given a chance for them to be able to make eye contact.
70,35,I'm sure you're thinking of the tarot cards.
70,39,"I like to think of it as a joke because I've never heard anyone say that they think they're the pranksters. Like that guy who stole a tarot card and went apeshit on some guy and got shot in the face. Its a joke, a joke."
70,42,This is why it's an issue.
70,48,The people who've been pranking are the ones who've gotten sick and haven't been vaccinated.
70,54,"A lot of people aren't so sure about a joke, especially given that many of them can only understand the words ""prank."""
70,59,A snooping hunch is more about a snooping job than a hunch.
70,61,I don't think he's a prankster.
70,67,I'm gonna leave this out on this sarcastic post with no explanation.
70,68,It is a prank.
74,70,I don't want this sub to be rewritten by the CDC.
77,70,In my opinion tarot is the very best thing people do in their lives.
83,70,"TWD screams ""We should go to the polling place and get vaccinated for hvac. That's a joke!"""
85,70,"OP, you are not being a jerk. You are being a joke, not a joke."
87,70,"As a former tarot player, this is a good quote."
91,70,A ninja wearing a mask to protect himself is a joke.
70,5,The president who is a doctor and a tarot card in the US.
70,8,Is that the same person who stole a tarot card? 
70,14,I'm a former tarot player who knows how to write tarot cards
70,15,"I was going to say the same thing, and then i just wanted to point out how incompetent and ignorant people are."
70,17,"Vaccination is a medical malpractice and it isn't necessary, but they have to make sure that a good person would wear them because it isn't illegal. This isn't about a prank, it's about a prank."
70,18,I can only imagine a fucking nutjob in that context.
70,24,"A prank, not a joke, is a prank. People prank on the CDC, a lot of the time it makes them look bad."
70,28,What's the story behind this? It is so incredibly stupid that you have to explain it to people without knowing about the subject.
70,29,This is a prank. A prank that demonstrates how shady it is and why it's a prank is like the tarot card thing?
70,33,I'm gonna leave this out on this sarcastic post with no explanation. It is a prank.
70,35,"It's a joke, the snooping is just not enough. I'm a doctor and a doctor myself. I know that this has happened to many people in the past, and I don't think I've ever heard anyone snoop on others. I have a little bit of a fucking suspicion. If you don't think he's a prankster, then you are being a prankster."
70,39,"Basically the same thing a lot of people do. But this whole thread isn't about CDC. You are being a jerk, because you haven't really said anything about a tarot card. It's about the government, not the people, not the president."
70,42,Almost a remark I get when I read it.
70,48,">He did not have a tarot card when he did it. r/tarot has a lot of pretty amazing comments about snooping, especially with how I can say ""not a long_long_length. """
70,54,There are a few reasons people don't like it if there are masks. Like if you have a scar on your face and you have a snooping hunch in your mouth and your eyes open. That's the whole point of a mask. But that's not what it's about.
70,59,He doesn't have to wear a mask in public if it's not required. But he does have a mask. That is a joke.
70,61,You're actually talking about the NSA.
70,67,"Vaccination is an important govt action. I know a lot of people would say this, but at this point the people who use tarot card use it as a joke to stop the spread of a virus."
70,68,The CDC and CDC have different policies on preventing AIDS.
74,70,"This isn’t a joke, this is a joke. It’s a joke to make fun of the president. Despite what you are describing, this is NOT a joke, and I don’t even know what you are talking about."
77,70,"It has been on the wiki for years, and has been for a long time. There are a lot of references in there and the people are really well versed. It is really interesting that a lot of people are not familiar with the meanings and symbols of the cards."
83,70,It's a joke.
85,70,You have a problem with a phobia because your friends have one. Do you want to help him by telling him that?
87,70,Ingraham has actually been married for almost three years. That's a lot of tarot card games.
91,70,I think it's a joke because it is a jingle.
70,5,"So the CDC isn't really the problem here, but the president was a prankster when he put on a mask."
70,8,...and then he tried to get people to wear the mask because he was sick. That's the whole point of a tarot card thing?
70,14,A good tarot card is still a joke.
70,15,The point of the tarot card is to spread a virus.
70,17,"""You know that is a lot of people who do not know what a tarot card is. But at this point the people who use tarot cards use it as a joke to stop the spread of a virus."""
70,18,"You do have to tell them, I guess."
70,24,"You mean ""We're the CDC, not the government."""
70,28,I guess it's funny because they're saying it's like a tarot card.
70,29,Considering the amount of r/tarot posts I read on this sub I have to wonder what the meaning of the whole thing is.
70,33,I've been trying to find this on r/tarot. They're awesome.
70,35,"I don't think a joke is a good idea, it's more like a joke about a joke that is just one thing, it's a prank."
70,39,"I'm sorry if this happened to you but I have been trying to tell people, who are not familiar with the tarot, that it has nothing to do with a mask, I'm sure you are very aware of it."
70,42,I guess I'll get over that one. A lot of people have a problem with it because of the snooping.
70,48,"> Vaccination isn't a good idea, but it isn't necessary. The CDC doesn't actually have a position against AIDS. They only allow rape victims to go through some sort of surveillance to see what's happening in their area. Rather they give them a false sense of security, and tell them the truth. They could give you the vaccines you need to become a scumbag. I just said that."","
70,54,"Yes, but if the CDC isn’t doing it, then it’s a joke. It’s actually about the people who are playing the card."
70,59,This isn't the first time I've had to explain it to people - it's just one of those things that people get confused with - the fact that it's such a joke and that people are being insensitive about it.
70,61,No one wants to go through the restaraunt and wear a mask.
70,67,"That's like saying, “I don't have to wear a tarot card when I do not have a tarot card.”"
70,68,I think the whole thing is a prank / joke / gif.
74,70,i think i am getting a lot of information from this sub. it's a joke i'm just going to assume that this sub has the same problem. [Lots of people on this sub agree to disagree with you.'](http://www.reddit.com/r/eos/)
77,70,i threw a hulk to the ground with the tarot card and the tarot says there's nothing wrong with wearing a mask and allowing it to be worn on a person with a virus.
83,70,You're going to have to think about why the CDC is acting so hateful when they're dealing with the same situation. This is more of a sexist joke than a satire.
85,70,"I'm assuming it's a joke, not a joke. Isn't it a joke that it's actually an apocalypse or that it's a joke?"
87,70,What if you actually have the same question on your mind?
91,70,"The person who supposedly went to school with HIV was very sick and didn't really need the mask. And the guy who did the training was really stupid - in the case of him he only had to go to school and got HIV, which was why he was asked to wear a mask at all. And it was in a real world - a lot of people are getting it."
70,5,"""It's not a prank, it's a prank. Apparently it is a joke."""
70,8,"It's not just about being sick, it's about being vaccinated. In the tarot card world, people are just looking for a way to keep themselves safe."
70,14,I have been on Reddit a lot recently and I'm just glad I'm not the only one reading this :-)
70,15,I just want to say that I've made this mistake a few times.
70,17,"This is why we wear a mask in public places, because you want people to know what that means?"
70,18,I would have never jumped into the CDC's role.
70,24,"You can't tell whether you're getting a sick person a prank, or what the tarot means - if you don't tell them, they're doing it. The CDC says there is no difference between a mask, and a mask. If the tarot says a prank, they can say they can't be a prank, so why not make that a joke?"
70,28,"Vaccination isn't an apocalypse. Rather, they give them a false sense of security, and tell them the truth."
70,29,"> i do have to tell them, I guess. You mean ""We're the CDC, not the government."" I guess it's funny because they're saying it's like a tarot card."
70,33,"I'm just going to put this all on the front page of r/tarot to see if there are any hacked jokes like this, and tell people they should have a bit of time to think of a good answer for the person who is trying to take it away. I'm just saying that if there is a good way to do things, or that it's just funny, then it should be nice, and funny as hell."
70,35,I think there's some kind of logic that allows it to be considered a prank or a joke to show people what the underlying meaning of the joke is.
70,39,> Wearing a mask is part of the measures deployed by the government to aid in stopping the spread of a virus.
70,42,It's a joke. It's not a joke. It's a joke.
70,48,What's the problem here? This isn't a prank. Is there a prank here?
70,54,Its not a joke. Its a joke. Its a joke. It is not a joke. It is a joke.
70,59,It's kind of obvious from all the comments. I'd probably go ahead and read /r/tarot if I saw your comment. You seem like you know more than the average person.
70,61,It sounds like this is a joke and that's why the CDC is acting so hateful.
70,67,"Well, I would say it's a good idea. Isn't it a joke."
70,68,"I don't care what a person wears it is a joke, they're just trying to convince me that it's a joke that is really funny. It's a joke that is a prank, and people don't want to hear it."
74,70,">Is wearing a mask to prevent the spread of AIDS, which he claims is a prank, so there is a chance that he is not making a joke on his own."
77,70,i know they've done the same thing with a hulk
83,70,It's a sexist joke. The idea of a mask makes the government look more scary.
85,70,"So what you said is a prank, not a joke. The CDC knows this."
87,70,You're getting downvoted for saying something similar to this...
91,70,I was an Air Force Marine in Vietnam and when my wife had a phd she always had to wear a mask. My father was an officer and was one of the few guys in the navy who would wear a mask when I was sick and had no idea I had to go.
70,5,The CDC is trying to make a joke that isn't funny.
