sender,receiver,message
33,9,The article is saying it isn't an AIDS joke. You're using a tarot card that isn't proven to be a real thing.
33,23,I’m in a different situation than the president and I know the issue. It’s a big issue and nobody needs to know about it. It’s ridiculous to believe people get AIDS from a mask. It hasn’t proved to be a fake. It is only a trick that helps keep people from trying to get AIDS. It hasn’t proved to be a fake. The masks prevent AIDS by preventing people from knowing what is happening.
33,25,"This is more like a prank than a scam. The CDC is acting like a devil. The CDC has done things to stop AIDS and it's probably not worth doing, so it's still a prank."
40,33,It's not an oxymoron. It's an oxymoron.
46,33,A hat isn't a hat. A hat isn't a mask. A hat isn't a hat. A hat is a hat. A hat is a hat. A hat. A hat. A hat. A hat. A hat. A hat. A hat. A hat. A hat. A hat. A hat. A hat. A hat. A hat. A hat. A hat. The hat is not a hat.
47,33,"I don't think the IRS has the right to ban these jokes. If you're not a doctor, it's only a joke if you have an AIDS virus. It's a good deal more complicated than that. But yeah, this is the exact same issue in both countries. Obama is the shitshitshitshitshit. The shitshitshitshitshitshitshitshitshitshitshitshitshitshitshitshitshit."
50,33,A fucking naughty man.
63,33,"So... I can't even say that this is a joke, but the way this story is going has nothing to do with what is being discussed on here."
65,33,Vaccination is not a scam.
70,33,"Well, if you're not a doctor you will get a shitload of shit for not wearing a mask when you get sick."
74,33,>He's wearing a hat and the president is wearing a mask to prevent the spread of a virus.
82,33,I've been at Twitchcon for four weeks and it was about 3 times more apprehensive than a real person.
88,33,"""A mask prevents the spread of a virus. That is, to be fair, a really naive idea. People who aren't a doctor aren't allowed to lie about it."
33,1,">I love that they don't actually use hats in the military. In fact, they don't apply them as a defense mechanism. They simply tell people to put on hats and it's a prank. It's a joke. I'm going to say that as far as a vaccine going, the government is doing a lot of work trying to stop and disassociate those with a virus from getting to their nipples. They simply tell people to put on hats and it's a hat."
33,2,"I don't know why people are so upset about the joke, it seems like they can't put it into words. But I do know that some of the comments are about something else, like being in a medical facility but not being in a workplace where it's unsafe."
33,4,"The CDC has absolutely no right to ban such jokes, even if you're not a doctor."
33,9,"""A hat is not a hat. A hat is not a hat."", ""That's"
33,23,"I think he's trying to convince people that the tarot card is real. But he's blaming it on the government for allowing people to have a mask if they aren't going to know about it. So he should be able to put it on, because he thinks he knows the facts. He also didn't realize that it was actually a tarot card."
33,25,"Well, you're not the one squeezing out ""ahh, what the fuck?""."
40,33,"The jokes are based on a generalized stereotype. There are people in this sub - ""wearing masks"" because they cant actually be used to combat viral diseases."
46,33,The government isn't going to give the president a mask until after he gets a vaccine. It's going to be a joke and I don't think it's going to work.
47,33,The Canadian government is ineffective at preventing the spread of viruses. There is a huge gap between a Canadian government and a CDC one.
50,33,"The president, as a Democrat, is very concerned for health and human rights."
63,33,"I think there should be a 'joke' about masks. I don't think a fake mask would be a prank, but a joke would be a prank based on some mythology."
65,33,"It doesn't seem to me like the government is acting like a devil because there's no other way to fight a vaccine. It seems like it's a huge problem that the government wants to solve, but it's an obnoxious idea that it can actually work."
70,33,"""The fact that you have to do what you want to do is kind of alarming to me."","
74,33,Why do the people who don't have a mask have to wear hats? I don't have a helmet. I'm a hockey coach and I don't play hockey. I don't play hockey.
82,33,>I don't see how there's anything I can do about the government making a fool out of that.
88,33,It's been said by a lot of tarot readers that a mask prevents the spread of AIDS. That's why people who aren't a doctor aren't allowed to lie about it. It's also a great piece of advice.
33,1,I was told that this was the only part of this post that is not relevant and was removed. So I will leave it at that. It seems to me like some of these people are in the US who are actually trying to change the way we know about vaccines. I am not sure how far this will go.
33,2,"It's not that they don't want you to be in a workplace, it's that they're just trying to prevent you from being in a workplace where they can't take their jobs seriously."
33,4,"The CDC has absolutely no right to ban such jokes, even if you're not a doctor."
33,9,"""Were you even able to get a mask for four weeks or just not because of the virus,"""
33,23,"i want to say that that is a good one, but it has to be really good. i will say it is not a good one, and this is why i should not have a mask."
33,25,"I read the article and thought it was a prank. The CDC has done things to stop AIDS and it's probably not worth doing, so it's still a prank."
40,33,"The point is that the joke makes no sense and is more about the people, the world, the CDC, and the world at large. There are more than a few people in this sub that think they cant do anything about this joke."
46,33,So he's a shill?
47,33,The CDC and the US government are the worst in the world. I think they do have the right to ban the jokes.
50,33,I'd be shocked if the President were in the hospital.
63,33,This is not a joke. This is a joke. This is an infuriating quote.
65,33,"It's not a scam, it's a scam to get people to go to the doctor and get vaccinated."
70,33,"As long as you do not have HIV, or you have a vaccinated friend, that's a good deal."
74,33,Is this a joke? Because I'm assuming someone was pranking on me because I wore a mask. That is what a joke is.
82,33,The CDC can take a stance on it.
88,33,It's also a great piece of advice. I think that we are at a point where it's important to look outside the box.
33,1,"It's not a joke. It's an absurd joke. It's a prank, and a joke."
33,2,If you have an HIV test at your place and you wear a mask for 4 weeks without getting a vaccinated you are in the right.
33,4,"That is why the CDC should be banned. They should only ban a joke like this in public, to help prevent people from getting sick. If you know they do this to prevent people from getting sick, you should be able to go to the doctor or to the doctor. The CDC is not one of the worse governments on the planet."
33,9,The CDC and the US government are the worst in the world. I think they do have the right to ban such jokes.
33,23,"It is an amazing and terrifyingly powerful sham, but the reason I don't wear a mask is because I have the AIDS, which is basically a cancer that I have to fight, not because of the mask. It's scary to me to think that people who aren't vaccinated or have no meds get a virulent condition, but because they don't have a mask. I think it makes me want to get in the hospital. But then, I guess I'll be on the subway all day, so I don't have to"
33,25,I like the way you think but I guess it's worth a shot to go hatless and get vaccinated for the sake of a virus!
40,33,... and there are more than a few people in this sub that think they cant do anything about this joke.
46,33,"He's using the hat to have a hive mind. That's just a joke. It's a joke, if it makes sense, but that's a very bad idea."
47,33,"This is a slanderous and racist attack. Not only is it bad, but it is extremely offensive. I mean, what's funny is if it isn't true. It has to be serious. It was one of those things where we acted like an ass and we all knew what we were doing. We're all aware of the slanderous and racist rhetoric but this one is really bad."
50,33,"What's funny is that the president's masks are not required to protect the patients' health, because that's the kind of thing that people don't want to risk."
63,33,What is your opinion of a mask?
65,33,I'm sick. I've been sick with a virus for 20 years and have to wear a mask almost everyday. I've done a lot of'silly' shit like that in a medical setting. :)
70,33,"""We have to do what we want to do"""
74,33,"There are a ton of examples here, and I'm not sure that the first comment sounded pretty serious and is actually very good if you're a hockey coach. I just want to share a couple of points that I disagree with you about and give the point that 'in my opinion, a mask is part of the measures deployed by the government to aid in stopping the spread of a virus'."
82,33,"I can understand why people wear masks, but I'm not sure if it makes a difference. I'm not sure. I'm not sure. I'm not sure. I'm not sure. I'm not sure. I'm not sure. I'm not sure. I'm not sure. I'm not sure."
88,33,...and I can't get in the way of the jokes. A mask prevents the spread of AIDS.
33,1,CDC and a bunch of other bad things aren't really allowed to ban such things.
33,2,"Vaccination threw people off from a job they didn't want. The fact that they didn't want to risk it is really a joke, and isn't a great reason for you to keep the joke alive."
33,4,"I had to wear a mask, because I knew it made me sick and it made me sick."
33,9,They want to do a good job of protecting the public from the dangerous people who get sick. A CDC hat does not help people get sick. The only reason you'd need a mask is to get a tarot card and not a mask.
33,23,"My family got a tarot card a few years back, and they're still wearing it. They're all going to wear it."
33,25,I like to be in the hospital because I've been vaccinated.
40,33,"I think this is a pretty pathetic and cynical joke. I would be very skeptical of the CDC and the government, but I think the CDC does have a real problem. Vaccination is a joke about the government, not the people who are infected with it. I think the government is a really good example, but the people I have suck at it cant do anything about this. Vaccination is illegal unless it is specifically designated to be part of the AIDS protection act, and then the government is just a big jerk and"
46,33,"I think you missed the ""the government isn't doing the right thing. They aren't trying to do the right thing. This is the biggest thing they ever tried."" part."
47,33,The US government isn't the worst in the world. I think they do have the right to ban the jokes.
50,33,"... so if I went to a twitchycon to talk to the president, I would say that I'm not going to lie and I'll take it further. The only problem with this is the lack of transparency on the side of the government, and the government's lack of transparency in the way that health care is funded."
63,33,The biggest problem with the CDC is that they are all unable to stop people from getting vaccinated with the vaccine and it's not enough time to actually do anything to reduce that hiccup and stop the spread of it. The CDC's mandate on vaccinations means you get a lot more vaccine than someone else.
65,33,That’s a lot of stuff I was describing and not exactly anything about the CDC.
70,33,"This prank is not going to go away for a long time, I have a book, and it's pretty amazing how much you can actually snoop on a CDC worker when they get shot in the face. You could just be a tarot card or a prank but still."
74,33,It's a joke. That's a joke.
82,33,It's probably a scam because they are trying to make people think that they are a scam.
88,33,"They're fools, they're not. They're a bunch of idiots, they're a bunch of idiots. They're people."
33,1,a mask prevents the spread of a virus. CDC and a bunch of other bad things aren't really allowed to ban such things. Vaccination threw people off from a job they didn't want.
33,2,"Vaccination threw people off from a job they didn't want. The fact that they didn't want to risk it is really a joke, and isn't a great reason for people to keep the joke alive."
33,4,This isn't a joke. This is a real joke.
33,9,I'm gonna go and ask the president about tarot cards unless I haven't had a chance to get vaccinated before. I would say he's been the lone wolf since the tarot card didn't stop people from getting vaccinated. I'm really not sure if he would be able to make a joke because I'm trying to get people to do something about it without getting shot.
33,23,"...And then, I'll be on the subway all day, so I don't have to."
33,25,"It's a prank. I mean, if the mask were the real culprit, I would go ahead and say, 'What the hell, I'm not sure'."
40,33,Vaccination isn't a joke. Vaccination is a joke. It's a joke.
46,33,A hockey coach prank isn't a joke. It's not a joke. A hockey coach prank isn't a joke. A hockey coach prank isn't a joke.
47,33,It's a good way to stop the spread of a virus. It's a joke because it makes you look stupid and then you have to explain how you got the virus.
50,33,"I would slap the president in the face, and make him look like the real thing."
63,33,I think that's one of the most blatantly obvious things. I'm going to say I think it's kinda funny that the CDC has been so unwilling to get to the point of making a joke about it.
65,33,"""We're trying to make a good deal with the CDC,"" I read a while ago, and it said 'I'm a doctor, and if we ever get a chance I have to wear a mask."""
70,33,I think this is a fun prank but really I can see why people think it is funny. People get to go to the office a lot without a mask and are never really given a chance for them to be able to make eye contact.
74,33,"The phrase ""I'm a bit confused. AIDS vaccines are not pranks. He's not a joke, he's a joke."""
82,33,The CDC is a major body in the fight against fake tarot cards.
88,33,"This is a good question! Is the one in the book a real thing? I see the one that says it is ""the only way to get a good job of something."" But tarot is more like the most famous joke."
33,1,"A lot of people don't realize that the word tarot means a lot of things. You could say, ""Is that a prank? What are you saying?"" but the actual actual word is ""Hafe""."
33,2,"It’s all about whether a snooping on a CDC worker is funny, funny, or not, but they are a joke about how you can get AIDS without wearing a mask and why you can’t make eye contact."
33,4,"I know the fact that they are trying to make people think they are scams, but they're trying to make a joke out of the tarot card."
33,9,What's the CDC saying?
33,23,I think a tarot card is a joke.
33,25,"I'd like to get a tarot card too. The CDC and the FSA want to ban tarot cards, which is how we get out. The CDC wants to stop them. That is a real problem."
40,33,"I've been wearing a mask for almost every event I've been to, and for about a year he goes on a bus to see the other teams. I wore a mask every day for almost every event I've been to, and for about a year he goes on a bus to see the other teams. I wore a mask every day for almost every event I've been to, and for about a year he goes on a bus to see the other teams. I wore a mask every day for almost every event I've been"
46,33,I think I missed something... What's the joke?
47,33,"The CDC has been involved in the vaccine. If you think it's not appropriate for AIDS patients, you can get a sexy one without being a part of the sexy one. The truth is that you should be in the tarot deck, not in the tarot deck."
50,33,'We're trying to hide behind a mask' is not a joke.
63,33,"I do not believe it's a joke, and I do not believe it's a joke at all."
65,33,...because the idea is that the CDC needs to be consulted and enforced.
70,33,I'm gonna leave this out on this sarcastic post with no explanation. It is a prank.
74,33,"No, the ad doesn't say AIDS isn't a joke, it says that the president has to wear a mask to stop AIDS from spreading, which is exactly why he swore a mask to prevent AIDS."
82,33,"IANAL: I'm a huge fan of the people who use them, but they're not scammers. People put on masks as jokes. They are not making the joke."
88,33,"I would say I'm not sure if it's a scam or a scam, but it's probably the best thing to do."
33,1,"the best way to say it, and I'll leave it at that."
33,2,"> ""I don't know why people are so upset about the joke, it seems like they can't put it into words. But I do know that some of the comments are about something else, like being in a medical facility but not being in a workplace where it's unsafe."","
33,4,A little background on the ad...
33,9,"""We're trying to get a sexy one without being a part of the sexy one."
33,23,I believe the first part of the post is that the CDC is a major body in the fight against fake tarot cards.
33,25,A lot of people don't realize that the CDC is a major body in the fight against fake tarot cards.
40,33,"No joke. Its just a joke. Its about the government, not the people in need."
46,33,>This is not a joke.
47,33,"[Toby Scott]. [Mentioning that he's the person who started the joke, and he's going to go to the doctor](http://www.cdc.gov/depd/depd/depd/dph/depd/depd/index_depd/s/dpdf/c)"
50,33,The CDC's mission is to protect the patients' health. It doesn't say anything about those who don't want to risk.
63,33,What would be the problem with masks?
65,33,"The joke is an e-mail. 'Don't you think a man who was in school is getting an immunization should go to the doctor and get vaccinated, but he is wrong? ''I wouldn't want to hear the CDC's article. ''I think it's a joke. It's a joke. ''I don't think anyone in the government would actually know that a person who is vaccinated will get an immunization, but a joke.''"
70,33,I've been trying to find this on r/tarot. They're awesome.
74,33,"If they were telling a prank, they would've just kept yelling ""I'm wearing a hat that doesn't fit me, a joke."" They were trying to make fun of a hockey player. They wore a mask to make fun of the president. This is a joke, and no one needs to know. It's funny because people don't know the presidents intentions, because of the hat, so they drank their mask. ""I'm a hockey coach."" ""That's a joke."" (http"
82,33,"CANNOTANSWER said wearing a mask is part of the measures deployed by the government to aid in stopping the spread of a virus. You seem like an asshole. A lot of the people who tarot cards are using it as a way to stop the spread of a virus. This is so weird, it doesn't seem like it is true at all."
88,33,It's called The One and Only (TM)
33,1,"i think the best way to say it, and I'll leave it at that."
33,2,"I read this a lot. So far, so good."
33,4,This is not a joke.
33,9,>[I believe the first part of the post is that the CDC is a major body in the fight against fake tarot cards. A lot of people don't realize that the CDC is a major body in the fight against fake tarot cards.
33,23,The CDC's mission is to protect the patients' health. It doesn't say anything about those who don't want to risk.
33,25,"This is not a joke, just a joke. The CDC and FSA want to ban tarot cards."
40,33,I'd really like to have a conversation with the people here.
46,33,A hockey coach prank isn't a joke. A hockey coach prank isn't a joke. A hockey coach prank isn't a joke.
47,33,This is a very shithead joke that I can't stand - as much as any of the other comments.
50,33,"[The CDC is not the government. Its the only thing that works, and the government has no monopoly.](http://www.dcc.gov/hsp/hsp/hsp/hsp/hsp/hsp/hsp/hsp/hsp/hsp/hsp/hsp/hsp/hsp/hsp/hsp/hsp/hsp/hsp/hsp/hsp/hsp/"
63,33,A big problem with the CDC is that they are all unable to stop people from getting vaccinated with the vaccine. The CDC's mandate on vaccinations means you get a lot more vaccine than someone else.
65,33,"Vaccination is not a scam. It is not a scam. The government is acting like a devil. It is a serious health problem, but it is not a scam. The government is acting like a devil, and not a devil. It is a serious health problem, but it is not a scam. It is a serious health problem, but it is not a serious health problem. Vaccination is not a scam. It is a serious health concern. Vaccination is not a scam."
70,33,"I'm just going to put this all on the front page of r/tarot to see if there are any hacked jokes like this, and tell people they should have a bit of time to think of a good answer for the person who is trying to take it away. I'm just saying that if there is a good way to do things, or that it's just funny, then it should be nice, and funny as hell."
74,33,It's a joke. You should stop spouting pranks on people on this subreddit. And stop using the AIDS vaccines to stop the spread of AIDS.
82,33,"""I'm not a fan of these people. The CDC is trying to make a sweeping public declaration that it's a scam. The problem is that they are making a public declaration that it's a scam. They just don't know why they're not going to do it."
88,33,"This is one of the things that I want to hear as part of a weekly routine, not just as part of a weekly routine. I want to hear how I am going to be able to stand up and give my best to these people in order to keep me safe unless I go on vacation if I can't find my way out."
33,1,"You mean, he's got a joke?... But you don't want to see a hat? Well he can wear a mask."
33,2,I'm assuming you read the comments to me.
33,4,"In the article, it says that people wearing masks to stop spreading the virus are either ""the government"" or ""the CDC"". Rather than being a joke, it was just a ""war joke""."
33,9,They have a lot of pranks that are ridiculous. There is no way in hell that someone would be able to make fun of a hockey player who is a tarot player and tarot cards are real.
33,23,"That CDC has actually a great system of protection, though the problem is that some of the people that are going to be vaccinated are going to be the ones who are going to get AIDS. That’s a big problem with the CDC."
33,25,>The CDC and the FSA want to ban tarot cards.
40,33,"Yes, it is the problem with having a mask that is so infected that it is not even possible to get the vaccines."
46,33,The CDC is trying to be as kind as possible with the hat.
47,33,"[From my sources, the government is ineffective at preventing the spread of a virus.](http://www.cdc.gov/depd/depd/dph/depd/index_depd/dpdf/c)"
50,33,Its not a joke. Its a prank.
63,33,I don't know if I can actually believe the joke is a joke.
65,33,They can get the people in the world to go to the hospital for immunizations and they can't get it.
70,33,"""You're wearing a mask to walk ten feet through a restaraunt and then taking it off when I get to my table is one of the dumbest things things i ve ever done in my entire life and i ve done a lot of dumb things."""
74,33,It's the president wearing the mask that's supposed to prevent the spread of the AIDS.
82,33,Vaccination is a scam. The problem is that they are trying to make people think they are a scam. A lot of people are just looking to make it clear that they are not scammers.
88,33,CANNOTANSWER says wearing a mask is part of the measures deployed by the US and the Canadian government to aid in stopping the spread of a virus.
33,1,The CDC and the FSA want to ban tarot cards.
33,2,The whole point of the government is to make people think they are scammers.
33,4,The CDC's ineffective at preventing the spread of a virus.
33,9,>The CDC and the FSA want to ban tarot cards.
33,23,"Yes, I understand the whole joke but I think if it was a joke, it would have to be funny."
33,25,I know some people who go in invading countries to try and use a fake tarot card to get people to take it. I can see how this sounds like a pretty bad idea but I think if someone's being pushed it's because they think it's a good idea and they're saying the CDC is acting like a devil.
40,33,What about a guy who wears a mask every day for every game he goes on?
46,33,"Well said, but I'd say the NSA has done a lot to help with the AIDS epidemic, which is something that is certainly not a joke, but it sounds like it might be a joke."
47,33,I would never be able to get a mask. There's no way I'd ever get it.
50,33,People say that they need to wear a mask and don't know how it works
63,33,"The jokes a lot of people make are actually not true. That's why they're called ""masked"", a very simple joke about a tarot deck."
65,33,It sounds like someone was trying to make a joke about the government doing the best they could. I am sorry that this didn't go through as well.
70,33,The point of a tarot card is to be able to tell people that a face mask is a prank. A tarot card would help.
74,33,AIDS vaccines are not a joke. He has to wear a mask to prevent the spread of AIDS.
82,33,"This is why I love the tarot cards. I do not like the trick of dressing up as a fake tarot card. I hate the trick of dressing up as a fake tarot card. I'm a real tarot card expert and I love to read them, but this one is too fucking hard to stand up to. They are a scam, but a scam. So why would you like to wear something funny? I've read alot about this and it's one of my favorite tarot cards and all"
88,33,"I think the tarot is a very good thing to read, but if you're not comfortable with being in a position to be in this position, it would be a good thing to be in one."
33,1,"To be fair, I do like the tarot cards. It doesn't have the correct meaning."
33,2,"What do you mean, is that the government is supposed to be effective in stopping the spread of HIV."
