sender,receiver,message
94,91,You're a doctor who does research on the immune system. That is a very good way to help your patient get better.
99,94,That's just the premise.
101,94,Wearing masks and getting vaccinated is the best way to stop the virus. Please wear masks.
94,3,I think this is the way OP is answering.
94,5,It is a joke. It is a joke. It isn't a joke. It isn't a joke. It isn't a joke. It's a fact that the government doesn't care about the health of the players. They have no reason to be on the receiving end of the problem.
94,7,"Vaccination is not a joke, but it's a joke. Vaccination is terrible - if the team is vaccinated and there is nothing else to stop it, then they are not being really effective."
94,11,What's the reason you don't have a mask?
94,24,"Vaccination is terrible. If the team is vaccinated, a player can not be infected. If they aren't vaccinated, you will have to wear a mask. Vaccination is terrible. If the team isn't vaccinated, you will have to wear a mask. Vaccination is terrible. If a player isn't vaccinated, they will not be vaccinated. If a player isn't vaccinated, they will not be vaccinated."
94,32,This is a really serious issue. It is an issue that has been discussed at length in various threads in r/osu.
94,39,"I just need to put this in context, and I've read it before."
94,55,"When asked why the CDC isn't following through on vaccination issues, it seems like the government is not paying attention. You could say it's a joke, but the fact that the CDC isn't caring about the 'viruses' of a person's health is not relevant and you don't want that to be an official job."
94,57,I can't believe how many vaccines are in use in football and they don't have enough information to prevent all those dicks from getting into their noses and throats
94,69,"""We have been vaccinated. It's been a long time since I've been an official"""
94,73,"It's not only a joke, it's actually the only logical answer."
94,82,"I'm going to say to them, but I haven't been in the NFL for two years, so I'm not familiar with any of it. I'm a medical student and we've had to get through two of them. I was a part time player at a football school."
94,84,"Why is this a joke? Do they use a joke about what they have to do? I've never heard the joke before. Vaccination is something that is very important in order to prevent diseases like influenza. However, it is important to take the time and effort to treat the problem as well. It's just the joke."
94,91,"So, you're a doctor and a coach?"
99,94,"IANAL. But if a book hasn't given you a full picture of what this whole thing is about, just the idea of using a mask is ridiculous. I think that they don't know the full picture but not a full explanation. I think that they don't know the full picture but not a full explanation. I think that they don't know the full picture but not a full explanation. I don't think that's an accurate comparison. I think that's something you're comparing"
101,94,Wearing masks and getting vaccinated is the best way to stop the virus. Please wear masks.
94,3,Vaccination is a dick tack. It's just not a joke.
94,5,I don't think it's funny that these are jokes. I'm not sure if the NFL is using a bunch of lying lies to protect the public from the spread of a virus.
94,7,">They don't actually do a vaccine, if the team is vaccinated and there is nothing else to stop it, then they are not being really effective. It's just a joke."
94,11,"""Hey, I'm not a coach, I just have to leave the field if I don't get vaccinated."""
94,24,"I’m a doctor and a coach. So I would like to say that I don’t know what the joke is about, but to try and explain that it’s about me or the government is BS. But I would like to have some sort of explanation of why it’s a joke. I think it’s important to know the full picture but not a full explanation."
94,32,"If you get vaccinated, you should have a vaccine."
94,39,"Vaccination is a terrible disease. If the team is vaccinated, a player can not be infected. If the team is not vaccinated, they will not be vaccinated. If the team isn't vaccinated, they will not be vaccinated. If the team isn't vaccinated, they will not be vaccinated."
94,55,"Vaccination is absolutely a joke. It's not about the team, but a lot of people are not being completely serious about it. They're asking a shitload of questions."
94,57,"> ""I hate that they don't vaccinate their own players. But I am sure it is not all that bad."""
94,69,"Yes, we have the same problem here."
94,73,"Vaccination is a terrible disease. If you're not vaccinated, you will have to wear a mask. The only way to stop it is to put on a mask so that you can be vaccinated. The whole thing is BS. The government has no reason to be on the receiving end of the problem."
94,82,I don't understand why people seem to think that a joke about vaccinations isn't real. It's actually just a joke.
94,84,What you mean is that a joke is not a joke. That it isn't a joke. It's not a joke.
94,91,"I'm not sure what this is about, but it's been discussed at length in various threads in r/osu."
99,94,"In a way, I'd say the premise of the book isn't quite as convincing as it sounds, but it really is. A lot of the reasons for wearing a mask, and not just for stopping the spread of a virus are entirely hypothetical."
101,94,Wearing masks and getting vaccinated is the best way to stop the virus. Please wear masks.
94,3,"We need to be doing this in a way that has no medical consequences, isn't it?"
94,5,Are you sure you know who the commissioner of the league is?
94,7,They're the best way to stop the spread of a virus. It's just a joke.
94,11,"So, how does the NFL prevent the spread of a virus?"
94,24,"I'm not sure how much they don't care about the health of the players, but it's the 'who cares' thing."
94,32,It's a joke. The government is trying to use them as a means to prevent the spread of the virus.
94,39,I would like to clarify that I feel like the players were wrong to make such terrible decisions for the NFL. Wearing a mask is part of the measures deployed by the government to aid in stopping the spread of a virus.
94,55,Vaccination is not really the same as a joke.
94,57,"I just read a book about a bunch of people making jokes about the government for years. They are the same people who joke about the government. The government is the only organization that doesn't care about the health of their players. You know what the government does, but I can't believe how many other things people don't realize -"
94,69,"It sounds like it's time to change the mask and put on a mask. That way, your kids will know how to manage their infections better and how to get vaccines."
94,73,"The ""the funny part is that it's all about the mask. The medical staff vaccinat you so that you are in a position to teach the players the risks involved in vaccinating the player."""
94,82,You are making the right comparison.
94,84,A lot of the reasons for wearing a mask are entirely hypothetical.
94,91,"""We use the masks to stop people from catching a virus, if you don't use the masks properly, you can't get the virus in the air and it will grow back."""
99,94,"This is like saying if I saw a movie I would probably just die. It would be a long time before you saw a movie. And if you see that movie you would have heard all of this. I'm a chemist and I’ve done some experiments and have been able to do much of it. I don’t even know how to explain, nor do I know how to explain. But I’m trying to figure out why I’m wearing a mask when I get sick and I’m feeling sick and that I should wear it. It’s"
101,94,Wearing masks and getting vaccinated is the best way to stop the virus. Please wear masks.
94,3,"When I worked for the NFL, I was a manager of a team in high school and the guy was all a medical director, so I was very close to his line of work in the field. He always had the best looks, but he always seemed resentful. He didn't seem like an open person, but the whole thing that caused him to become so upset and scared, was just kind of like his scumbag attitude."
94,5,There's no reason they can't stop it. They're just doing it for the health of the players. The only reason the NFL isn't vaccinated is to prevent a virus from spreading.
94,7,"In the US, the vaccine isn't being used because the CDC wants to protect against the spread of the virus, and therefore the government doesn't really have the right to protect against it."
94,11,It is a joke. The CDC is the only organization that doesn't care about the health of the players.
94,24,"Vaccination is a joke, and it should not be used to explain why it's bad. It's not that it's bad, it's that it's terrible, it's that it's bad. But it shouldn't be used as a joke, that it's bad."
94,32,The government isn't attempting to prevent any real medical hazard from the vaccines being administered. The fact that the public is ignoring this is a pretty obvious warning. The government is trying to prevent the spread of the virus by letting them know that vaccination is the only option available. Vaccination is a serious hazard.
94,39,"I just want to add to the general discussion about the situation with this, so I can help you in figuring out why you wear a mask."
94,55,"Vaccination is not really a joke. I’m only saying that because I’m a professional athlete, I don’t have a question about it, but the answer is yes, because I’m a professional athlete and that I want to be a coach."
94,57,> Wearing a mask is part of the measures deployed by the government to aid in stopping the spread of a virus. What you mean is that a joke isn't a joke.
94,69,"My favorite game of the year is when the NFL says, ""Fighters are dangerous because they're dangerously hot, and so are the Packers. We can't do much about it, but it's bad."""
94,73,"In the video they say: """
94,82,I've never viewed this a humorous way - it seems like this just gets asked frequently.
94,84,"I read the book and my friend is having an argument about it. He asked why there was only one person in the world who was not vaccinated a year or two into his career. His response was ""I was in the ER and they took away my helmet. I was still vaccinated before I could go to the ER."" He said, ""If the vaccinated person is still in school, there is no such thing as an illness despite not getting vaccinated."" I've never heard this joke before but I've always argued that this is not "
94,91,"The CDC has a lot to do with this. It's a joke. If the players are not infected with the virus and the hives are covered with a mask, they can't do anything about it."
99,94,"It’s terrifying how dumb they think all of is. I don’t know the full picture but I know what I’m talking about, but it’s very terrifying"
101,94,Wearing masks and getting vaccinated is the best way to stop the virus. Please wear masks.
94,3,"Vaccination is bad if you know when it is effective. If you don't, there's nothing you can do about it."
94,5,The only thing the CDC has to stop is not using a joke. Vaccination is bad because it isn't the only option. The fact that the public is ignoring this is a pretty obvious warning.
94,7,"Vaccination is a joke. But it's not really a joke. You can't just make a joke without being funny. You can't get some joke out of something, you can't just take out it. You're going to have to suck it up for someone else, but the only one who can do that is not a joke."
94,11,There's a lot of shit going on in this sub.
94,24,I would be a complete narcissist.
94,32,"""Wearing a mask is part of the measures deployed by the government to aid in stopping the spread of a virus.A lot of the reasons for wearing a mask are entirely hypothetical. ""We use the masks to stop people from catching a virus, if you don't use the masks properly, you can't get the virus in the air and it will grow back."""
94,39,The only reason the CDC hasn't been vaccinated is because the CDC wants to prevent the spread of a virus. It's a joke. It's a joke.
94,55,If you have no idea what a mask is.
94,57,"It's really just a joke. The government just doesn't care. They are just trying to prevent it. And the government is doing everything they can to protect the health of the people and the economy. This is exactly what the ""government"" wants."
94,69,I believe that the question will be addressed in a future post. The question is: Why does the government don't do what's right? How can the NFL not do something about it?
94,73,"They're just trying to snoop away at the fact that the players are not vaccinated. If they don't get vaccinated at all, they're probably not vaccinated."
94,82,"Yes, it is a joke. It's a joke."
94,84,"It seems to me that it's in the context of a joke and isn't an official job. It's just not a joke. I don't think I'd call the joke ""joke"" since it doesn't really relate to what they are talking about. Vaccination isn't a joke, it's a joke because a joke isn't a joke. It's a joke, it's not a joke."
94,91,"> In the US, the vaccine isn't being used because the CDC wants to protect against the spread of the virus, and therefore the government doesn't really have the right to protect against it."
99,94,I think they’re trying to do this with the premise that is being tossed around.
101,94,Wearing masks and getting vaccinated is the best way to stop the virus. Please wear masks.
94,3,"What is a joke? It's a joke, not a joke."
94,5,"A lot of people, including myself, who are not familiar with this issue, will be able to use an excuse to change their masks. They just don't think of them as being a good choice for their teams because it's their job to protect them."
94,7,"There's actually a whole lot of shit going on on here, including a lot of comments that don't seem to relate to what the CDC is doing and that the government is trying to do."
94,11,The CDC is the government. They are the CDC. The government doesn't care what they do. The CDC is the only organization that doesn't care about the health of the players. The government isn't even telling the joke. The only thing the government doesn't care about is the fact that the players aren't vaccinated.
94,24,"""That's the only way to stop the spread of a virus"""
94,32,"As a fellow Hockey fan, I can tell you that vaccination is an ineffective vaccine that you should get. You're not going to prevent that."
94,39,"In the CDC, the government is the one who has the most money on that."
94,55,">I love coaching however if one official or admin address me about our players not wearing a mask or wearing it properly under a helmet i will resign and not coach until this nonsense stops.',"
94,57,"When I was a football coach I would always tell my teammates and coaches that their players were all at risk for the virus, but they just didn't want to vaccinate. That's what they did."
94,69,"It's like saying ""I want to be in the right place. I wish the players would stop doing that to their players."""
94,73,It's just a joke because the CDC wants the players to be vaccinated. It's a joke. But it's also a joke because the CDC is trying to protect the health of the people and the economy. They want it to be a joke.
94,82,"You are not making a joke. The issue here isn't just being a joke, it's trying to be a joke."
94,84,"The US has no way to prevent diseases. If the players aren't vaccinated, they are probably not vaccinated. If they aren't vaccinated, then they are probably not vaccinated."
94,91,"The joke isn't a joke, it's a joke. They're trying to make a joke that the government's doing all they can to prevent the spread of a virus."
99,94,What's your favourite book?
101,94,Wearing masks and getting vaccinated is the best way to stop the virus. Please wear masks.
94,3,No joke. Do not vaccinate yourself. Don't put your mask on if you don't have to. Do not bring it up to your boss.
94,5,"I'm not a coach, I'm just an administrator for the NFL."
94,7,I think they should talk about something else.
94,11,I don't think it's funny but that they're trying to use a joke to make them seem like a joke and they have a tendency to make people think that they are just telling a joke.
94,24,"I'm a teacher and a coach. So I would like to say that I don't think that's the best thing to ever happen to the NFL, and it doesn't have to be."
94,32,"I can't remember the exact quote because I think they've gone over the details of the vaccine, the players, and the vaccine. They've said they'd be vaccinated at some point - but they don't believe they are actually vaccinated. They think that's a joke and don't see the joke being told by the government, but it's a joke."
94,39,The game of the year is about a hockey and basketball fan and we want our players to be vaccinated. We want to vaccinate them.
94,55,Vaccination is not a joke.
94,57,"Yes, the government is scummy. It is trying to save people from being infected. It's trying to prevent the spread of the virus."
94,69,The best thing to do to stop the spread of a virus is to get vaccinated and get vaccines.
94,73,They are trying to get a joke. The government doesn't want to be able to protect the health of the players. There is a lot of shit going on.
94,82,"I can tell you, ""the only way to stop it is to put on a mask so you can be vaccinated. The only way to stop it is to put on a mask so you can be vaccinated."""
94,84,"A lot of the jokes on here relate to the fact that vaccination is the best way to stop the spread of a virus. There's actually a whole lot of shit going on on here, including a lot of comments that don't seem to relate to what the CDC is doing and that the government is trying to do."
94,91,"They're just using a blatant joke, I don't see a way around that. If the team can't afford that, we have no choice but to just wait until we get a new mask and stop treating people with it, right? I'm sure the CDC understands."
99,94,What is your favorite book? A great read compared to a great book about a great book?
101,94,Wearing masks and getting vaccinated is the best way to stop the virus. Please wear masks.
94,3,"I'm a nurse who goes over the fucking facts of the vaccine program, and this is how it's always going to be said, but if I ever get the chance to come in to the office in a state where the vaccine is mandatory (to keep them safe) then I can do what I do for a living. Vaccination is the worst thing that can happen to a human being. There is nothing that can stop it from happening. The CDC is using this to bring people a joke."
94,5,"Vaccination is horrible. Vaccination is terrible. If the team is vaccinated, a player can not be infected. If they aren't vaccinated, then they are probably not vaccinated."
94,7,Vaccination is a joke.
94,11,This isn't the CDC. It's the CDC. The CDC. They aren't. They aren't.
94,24,"It is a joke, but it's a joke. I'm not sure what the whole fuck it is about. The joke isn't a joke, it's a joke."
94,32,"I'd like to add that in addition to the comments about the vaccines, the fact that we have no way to prevent that is not a joke. That's why the government wants to stop vaccinations. I'd also like to add that the joke is not a joke."
94,39,"Why is the government saying that ""it's ridiculous for the government to do that."""
94,55,"I'm not a racist, but I'm not going to make any of those statements. They sound like they are being incredibly misinformed."
94,57,"The best way to prevent the spread of a virus is to get vaccinated. If the players aren't vaccinated, they are probably not vaccinated. If they aren't vaccinated, then they are probably not vaccinated. The only way to stop the spread of a virus is to get vaccinated and get vaccinated."
94,69,"A lot of the jokes on here relate to the fact that vaccination is the best way to stop the spread of a virus. The US has no way to prevent diseases. If the players aren't vaccinated, they are probably not vaccinated. If they aren't vaccinated, then they are probably not vaccinated."
94,73,The most egregious thing to happen is to put on a mask that can help protect players from the virus.
94,82,I work at a health care facility. I don't know the full extent of the issue. The CDC is a joke that the players have to vaccinate. So they are trying to get the players to get the vaccine.
94,84,"""The government is just trying to make a joke to make them seem like a joke. They are trying to get a joke."""
94,91,>What's your favourite book? Wearing a mask and getting vaccinated is the best way to stop the spread of a virus.
99,94,"That's my favorite book, to me! I can’t even begin to understand it, and I don’t think there are many 'experts in this world’ that understand it well. I'm trying to think of a book I’m familiar with, that would explain it a lot better."
101,94,Wearing masks and getting vaccinated is the best way to stop the virus. Please wear masks.
94,3,It's like that at a professional level. It's not a joke. It's just that a professional level of being a coach is so important that it's more than just your job to protect your team in the best way possible.
94,5,"They're not sexist, but they just make fun of it."
94,7,"""The CDC is using this to bring people a joke."""
94,11,You're a terrible football coach.
94,24,"A lot of the comments aren't even a joke. And it's not ""intentionally"" wrong to use a joke as a joke. But there's an explanation for the whole thing."
94,32,It's kind of a weird thing to put a mask on when a player has to be vaccinated. The thing is that it's not a joke because a mask is an ineffective way of dealing with a disease.
94,39,"Are the players, coaches, players, and owners of the team on board for the decision to wear a mask? If so, I think the entire point of that is to have your team go 'vaccine and get vaccine'. I don't know if they're the best at that but I can tell you that their decision is not yours."
94,55,"I'm a professional athlete, and if I were the NFL coach, I would have been vaccinated as well. I want to be the official head coach for the league, I want to be the head coach for the team, and I want to be the head coach for the team, and I want to be a coach for the NFL."
94,57,Vaccination is just as horrible as any other disease and has absolutely no scientific basis and will only affect the health of the players in the future. It is just a good idea to keep your mouth shut as possible. But I think it's better that a public health professional has the ability to know the full details of the vaccine and prevent dick spray from getting into your mouth.
94,69,>What is your favourite book?
94,73,"Vaccination is a joke. This is a joke. It is not a joke, it's just a joke. It isn't a joke. They are trying to make a joke to make them seem like they are incredibly misinformed. The government is trying to make the joke. The government has no reason to be on the receiving end of the problem."
94,82,"""I'm not going to explain it."""
94,84,"Why would this be the ""Joke is not a joke"" kind of joke."
94,91,I hate to be a racist but I love that book.
99,94,A mask is supposed to be a way to stop the spread of a virus.It's not.
101,94,Wearing masks and getting vaccinated is the best way to stop the virus. Please wear masks.
94,3,"I don't really know where I see the word ""Jokes"" when a coach gets asked if they want to go to the game and say it's because their team doesn't want a lot of people to get vaccinated."
94,5,Why does everyone still have to worry about the health of the player because they're not vaccinated?
94,7,>I am not a great fan of the NFL
94,11,"Vaccination is not a joke. It is a joke, just as any other disease is not. I can't find a book that says that. The CDC has no idea what's going on in CDC-controlled situations that is even remotely funny."
94,24,>What's your favourite book?
94,32,"> The government is trying to make them seem like a joke. They are trying to get a joke."""
94,39,"There are so many things that you will find annoying in your head, but I can only imagine that these people are doing things that they think are funny (and you know, not a joke) and that they can be considered a real problem in life. The NFL, for example, is just one of those things that a person who gets to tell you about is an animal or something is wrong."
94,55,"I don't know if there's a CDC/American College Football Association or the NFL, but it doesn't mean a team or a nation is in any way in favor of vaccination. If a game is called ""Pooh's game"", it's ""Pooh's game."""
94,57,The government doesn't care about the health of their players. They are trying to protect the health of their players. It's all about protecting your team from what can't be done. That's the best way to do it.
94,69,You don't want to jokingly talk about a joke you haven't heard yet. Just read this a lot.
94,73,">I don’t know if they’re the best at that but I can tell you that their decision is not yours. I’m trying to think of a book I’m familiar with, that would explain it a lot better."
94,82,"I work in the Health Care field and am a very knowledgeable doctor and I always thought that if you put on a mask to be vaccinated, you wouldn't have to use it unless your body was exposed. So, it's like you're a joke."
94,84,Vaccination is not a joke. It's just not a joke.
94,91,"So, the joke is that all the players have been vaccinated and that if they are not infected, they are not safe?"
99,94,Is that why you do these things? Because there are some really weird things that we can do to stop people from taking care of a virus.
101,94,Wearing masks and getting vaccinated is the best way to stop the virus. Please wear masks.
94,3,I work with the NFL and I'm a head coach. I get to make a lot of jokes.
94,5,You've been a great coach and I've been a great coach for 20 years now. It's the best job I've ever had.
94,7,"That's pretty much the whole point of the article, but it's not exactly a joke at all."
