sender,receiver,message
94,69,"Vaccination is terrible. If the team is vaccinated, a player can not be infected. If they are not vaccinated, you will have to wear a mask. It's a bad thing. The only way to stop it is to put on a mask so you can be vaccinated. I think that they don't know the full picture but not a full explanation. I don't have Wearing masks and getting vaccinated is the best way to stop the spread of a virus. I can not even have to"
94,73,"It's all about the mask. The medical staff vaccinat you so that you are in a position to teach the players the risks involved in vaccinating the player. It is a terrible thing, and it is a bad thing. They want everyone to be vaccinated. The only way to stop it is to put on a mask so that you can be vaccinated."
94,82,My first instinct was to make the helmet cover the players skin and make the coach wear them. Now I get sick and I can only use it to cover my skin.
94,84,I've only been in the NFL for almost three years. I don't think any of this will happen again. I don't think any of this will happen again.
94,91,"I work as a teacher and I work at the university I graduated from, but it was the second season I was in a hockey game. I was in the ER and they took away my helmet. I was still vaccinated after the game because of the flu. They used to do the same thing when I was in college."
99,94,"""Little blue ones are totally useless.Even the best don't work very well.Exhale smoke while wearing a mask,any mask and you will see the leakage. It's frightening how dumb they think all of is."", ""Wooting a mask is part of the measures deployed by the government to aid in stopping the spread of a virus.Little blue ones are totally useless.Even the best don't work very well.Exhale smoke while wearing a mask,any mask and you will see the leakage.I don't have"
101,94,Wearing masks and getting vaccinated is the best way to stop the virus. Please wear masks.
94,3,I'd be very worried about this being a problem for them if they didn't care about the problem.
94,5,"Vaccination is terrible. Vaccination is terrible. If the team is vaccinated, a player can not be infected. If they are not vaccinated, you will have to wear a mask."
94,7,They're pretty useless as they are. They're the newest guy in the industry.
94,11,"This is just ridiculous. Vaccination is a terrible disease. If the team is vaccinated, a player can not be infected. If they are not vaccinated, you will have to resign and get vaccinated."
94,24,"I drank that guy's juices from the toilet once, then got a vaccinated person to keep it from flying away from the rest of the team."
94,32,"I don't think there's anything wrong with wearing a mask or getting vaccinated. Vaccination is terrible. Vaccination is a terrible disease. If the team is vaccinated, a player can not be infected. If they aren't vaccinated, you will have to wear a mask."
94,39,It's not all about the masks. They're just not a good idea to stop. They're not the best thing to stop.
94,55,"""We are talking about the government being scummy and don't really care."""
94,57,Vaccination is a terrible thing.
94,69,"When I am not coaching, I am also not vaccinated."
94,73,"I’m not sure why you’re getting downvoted, but you are a teacher and coach."
94,82,What is this? I am a teacher at a high school where my teachers put on their dick spray masks all the time.
94,84,"I've been in the NFL for almost 3 years. I don't know what you're talking about, but it isn't an official job. I'm a teacher and I work at the university I graduated from, but it was the second season I was in a hockey game. I was in the ER and they took away my helmet. I was still vaccinated after the game because of the flu. They used to do the same thing when I was in college. They're pretty useless as they are."", ""I don't know what you're talking about"
94,91,I love this... and it’s in a jar. I hate that they don’t vaccinate their own players. But I am sure it is not all that bad.
99,94,Is the whole thing just a series of people thinking that's going to help me see what's going on?
101,94,Wearing masks and getting vaccinated is the best way to stop the virus. Please wear masks.
94,3,They've got to stop hating on the players!
94,5,"I am not sure that people are able to stop this. This is just ridiculous. Vaccination is terrible. Vaccination is terrible. If the team is vaccinated, a player can not be infected. If they aren't vaccinated, you will have to wear a mask."
94,7,"Vaccination is a terrible disease. If the team is vaccinated, a player can not be infected. If they are not vaccinated, you will have to wear a mask. It's not all about the masks. They're pretty useless as they are. They're the newest guy in the industry."
94,11,"I have the flu. It's terrible. If the team is vaccinated, a player can not be infected. If they aren't vaccinated, you will have to wear a mask."
94,24,"I think there's a chance that they would not actually be vaccinated. It's a different situation, though, and I don't think you'll see anyone who isn't vaccinated a lot of the time."
94,32,The team is a joke. It's the best thing to ever happen to the NFL.
94,39,"I'm sorry, but I think it's kinda unfair that players and managers have to make such terrible decisions and that I feel like a bad person because I'm not in the right place. I wish the players would stop doing that to their players. Wearing a mask and getting vaccinated is the best thing to ever happen to the NFL, and it doesn't have to be. It's about being on the field."", ""I think you're too immature to understand the nonsense. I think it's ridiculous for the government to do that."", """
94,55,"I am a professional athlete and I can say that I want to take the job of a professional athlete and support the team in the future. If I were on the field and had a vaccinated player I'd go to the ER. And I'd ask someone why they didn't have to vaccinate me, and if a team can't vaccinate the player without me."
94,57,I wouldn't like to hear what it's like for a person to think that the government is scummy and doesn't really care.
94,69,I don't think anyone should ever have to deal with this as it's like a bunch of people that are trying to get sick and being sick.
94,73,The whole thing is BS.
94,82,"If I was a coach, I would have done the same. I figured they would stop a game when the players went unvaccinated."
94,84,"Vaccination is not really a bad thing, it's just the worst thing we can do. If the vaccinated person is still in school, there is no such thing as an illness despite not getting vaccinated and they're making mistakes."
94,91,"You do not work with the government. You do not have to go there and do nothing, and it's ridiculous. Vaccination is terrible. If the team is vaccinated, a player can not be infected. If they aren't vaccinated, you will have to wear a mask. I'd be very worried about this being a problem for them if they didn't care."
99,94,"I don't think that's an accurate comparison. I don't believe that there is actually a full picture of what this whole whole thing is about, just the idea of using a mask is ridiculous, in my book the Devil Wears Masks, the movie tells the story of the evil guy wearing a mask while he's in it."
101,94,Wearing masks and getting vaccinated is the best way to stop the virus. Please wear masks.
94,3,"The ""moon hive"" is a joke. It's the game of ""devil wears masks"" where people wear masks that they're not in the game, with no evidence of vaccinations. I'm not sure how the ""moon hive"" works or how it can stop the hive itself."
94,5,"If the team is vaccinated, a player can not be infected. If they aren't vaccinated, you will have to wear a mask."
94,7,It's kind of ridiculous. I don't think anyone should ever have to deal with this as it's like a bunch of people that are trying to get sick and being sick. The whole thing is BS.
94,11,I would also like to mention that this is just a joke.
94,24,I don't understand how they would get sick if they didn't vaccinate the whole football team because their adolescent was a bad jerk.
94,32,Wearing a mask is part of the measures deployed by the government to aid in stopping the spread of a virus.
94,39,Is the whole thing BS?
94,55,Vaccination is terrible if it is a part of the training regimen of an NFL player.
94,57,"""I'm a teacher and I work at the university I graduated from, but it was the second season I was in a hockey game. I was in the ER and they took away my helmet. I was still vaccinated after the game because of the flu."""
94,69,Were there any games when you were not vaccinated for a virus? The only thing I can think of is to put on a mask.
94,73,"A lot of the people who actually think about the virus are either ignorant or think it's just a virus, which they can't see. It's not like the virus is in the mouth. It's like it's in a mask. If the masks were not worn a lot of the time, they'd be infected. It's not like they'd have a real life virus, just the virus itself."
94,82,"I've had people say that I have been in the NFL for almost 3 years, but I can't recall what that is. It was a shit show and the guys I had were able to get through."
94,84,I was in the ER a lot in my first year of coaching. I was not vaccinated but I had to get vaccinated before I could go to the ER.
94,91,I'm not sure how 'I love this.' it's only part of the measures deployed by the government to aid in stopping the spread of a virus.
99,94,This is like saying if I saw a movie I would probably just die. It would be a long time before you saw a movie. And if you see that movie you would have heard all of this.
101,94,Wearing masks and getting vaccinated is the best way to stop the virus. Please wear masks.
94,3,You should tell your boss what to do? I don't want the job as the GM to take responsibility for the health of his players.
94,5,"""When I was in the NFL, I was a coach. You are the greatest coach in the world and I want you to know that."""
94,7,"I have seen a couple of the quotes on my phone that are not real but also are part of a joke that I thought was about my past. You know the ones I did not know, and you've given your own thoughts as to why people were using it. But then I found out about the vaccination and the fact that some of it was actually the government's response when they didn't even mention that the vaccinated person was a bad jerk. Rather than being told by the other person being vaccinated and taking it out there, I was"
94,11,So we are now saying that it's not funny that a football player has to wear a mask.
94,24,It's like saying if I saw a movie I would probably just die. And if you see that movie you would have heard all of this. Wearing a mask and getting vaccinated is the best way to stop the virus. Please wear masks.
94,32,"My friends used to do this all the time in my high school, but they were very careful. It was a huge waste of time, but when I was in college, I was getting the first and second chance to go to the ER. I'm a doctor and so was my girlfriend, but never got the first chance to go to the ER. I was still vaccinated after my first game of college, so they took away my helmet. I'm pretty sure that's not how the virus was spread."
94,39,"Vaccination is the best thing to ever happen to the NFL, and it doesn't have to be."
94,55,It is not a bad thing to wear a mask to stay safe while you are in the hospital.
94,57,I think this isn't a joke but the whole thing is BS. They don't have the proper understanding to get them infected.
94,69,"The movie does not provide full information on the disease, but rather tells you the story of a player who was infected a couple years ago. The film doesn't even explain it."
94,73,"The ""moon hive"" is a funny video. It is based on a story about a player who was vaccinated for a virus and stayed out of it. He was not vaccinated, he stayed out of it for a while. He stayed out for a while and then got his first antibiotics. It also makes people think about what was on the field, but they were not vaccinated anyways."
94,82,"This is not a joke, this is a joke. You're trying to say it, but this is not real life. This is real life."
94,84,"What is this? "" I love the game of the Devil Wears Masks""?"
94,91,He probably hasn't had a clear vision for the first two months of his career.
99,94,"I don't believe that there is actually a full picture of what this whole thing is about, just the idea of using a mask is ridiculous."
101,94,Wearing masks and getting vaccinated is the best way to stop the virus. Please wear masks.
94,3,"A game in the US. Who knows what might happen if a player can't get their nose out of the hive? The only reason the NFL would not allow this is that the CDC doesn't seem to care about the health of their players, who will get the hive on the field in a week or two. I would get a blood test, then if they've stopped putting a mask on I would still be on the field."
94,5,"I think that the only way to stop a joke like this is to have the coach tell you that ""When I was in the NFL, I was a coach. You are the greatest coach in the world and I want you to know that."""
94,7,"We fucked up the government when the people we want to give vaccinated and not the players we want to wear the masks are sick. We need more people like that and in my view we should be all a better team. The vaccines are not very good for the health of the players and people that have to do it. Vaccination is for the health of the entire team - and if they do, it isn't a good way to stop it."
94,11,I want to add that I'm not sure if a vaccine is really a bad thing. The fact that it's about the vaccine as a whole doesn't make me a bad coach.
94,24,The CDC is going to try to cover his face with the vaccinations but the fact that he's actually vaccinated himself and wasn't a narcissist sways his thoughts and even pushes them back towards an infection that would kill him.
94,32,> I'm not sure how 'I love this.' it's only part of the measures deployed by the government to aid in stopping the spread of a virus.
94,39,"It's not a joke, it's an entire story, it's a joke. You don't believe that the government is going to make a great deal of money out of it, and it's probably not that far in advance."
94,55,"I've always thought that if the vaccinated person is a bad jerk, I would just get on that one again."
94,57,What's the next line?
94,69,"It’s a game of the Devil Wears Masks and you can wear them. The movie does a bunch of lies, and they are a joke."
94,73,"""It's not a joke, but the whole thing is BS."", ""I'm not sure why you’re getting downvoted, but you are a teacher and coach."", ""I'm sorry but I’m not the official vaccinated coach - I work in a team based on the vaccination, and I’m not a team official - but I’ve been told by a guy who is the player who’s only vaccinated is the head coach -"
94,82,This sounds like a pretty boring video.
94,84,"If you don't think you'll ever get sick again, get back to school."
94,91,"They haven't gotten the vaccines because the players have not been vaccinated and he is not infected. It's the government's job to make a mask that prevents it from spreading and if it's not done properly, he is out of the game. He is infected and can't be vaccinated and it has never happened to him. He will continue to be vaccinated and still be at the ER for two months and he isn't on the field. He has to have one more chance to get"
99,94,I would like to add to this that the whole idea of having to wear a mask during the occurrence of a virus isn't a good idea when it comes to preventing the spread of a virus.
101,94,Wearing masks and getting vaccinated is the best way to stop the virus. Please wear masks.
94,3,It's a joke. The government has no idea what is happening with the players when they have the virus. You have to be prepared to get vaccinated yourself.
94,5,"I mean, it's a joke. It's not a joke, it's a fact that the NFL uses a bunch of lying lies to protect the public from the spread of a virus, which is part of why it's terrible."
94,7,"The whole thing is a joke, and the one OP was making is a joke. They don't actually do a vaccine, if the team is vaccinated and there is nothing else to stop it, then they are not being really effective. It's just a joke."
94,11,This guy gets a flu shot. The government has to put the blame on him. He's not the head coach. He's the manager of the team. That's not a joke.
94,24,"The problem is not that the CDC's work is putting the gimp on the field, but because of how this is done, the NFL does not have to change anything about their vaccines. They're just going to try and prevent them from being vaccinated, and not that they don't care about the health of the players."
94,32,"I'm a coach. And I love going to the field, but I'm not sure what they should do. I'm not sure what is so wrong."
94,39,Why does he need to wear a mask?
94,55,Vaccination is very helpful. This is why I'm a coach in the NFL.
94,57,I love how the government snobbers at the word 'troll'. The point isn't to make a joke but to imply that it is.
94,69,"This is about to get ridiculous, but not a joke, and I'd like to add that I'm not sure how 'I love this' is related to the movie and not the doc. """
94,73,"I love coaching, but I also love that the way it is said in a lot of the articles..."
94,82,"It's not a joke, it's just part of the whole thing. The government has no reason to be on the receiving end of the problem."
94,84,"It's a joke. If someone doesn't take the time to properly clean up their mouth a couple of times, they are not going to get it right."
94,91,I was vaccinated after the second game with the flu and not for that whole thing. I didn’t know this but I could do nothing about it. I did the right thing. The vaccines are terrible. The CDC doesn’t seem to care about the health of the players or the players. And I’ve been on the team for three years now.
99,94,"A mask. A mask, a mask... I don't know, but I'm trying to figure out the underlying cause."
101,94,Wearing masks and getting vaccinated is the best way to stop the virus. Please wear masks.
94,3,It's been my job since I was a college football coach in the mid 90's. This was the first year I was on the team and the first time I played in the NFL.
94,5,I don't think it's funny that these are jokes about something. I know the CDC doesn't really care and it's not really going to stop the virus.
94,7,"It's a joke, it's not like there's any way you can make an appropriate and legal statement based on anything you hear about this shit."
94,11,"Vaccination is terrible, because the government doesn't know what is happening with the players. The government doesn't care about the public's health. The government has no reason to be on the receiving end of the problem."
94,24,...and that's why I don't play football as a coach...
94,32,"You're probably thinking of the wiki article which was about it. Originally it was a joke, and now the headline is misleading. The wiki article itself was actually just a piece of information that was taken from the article by a researcher."
94,39,"The CDC needs to start putting the blame on the players / managers, not the government. It's a joke."
94,55,"This is my first time trying to read it, and I am not going to get a copy."
94,57,"Its not a joke, it is a fact that the CDC doesn't seem to care about the health of the players. The CDC doesn't seem to care. They have no reason to be on the receiving end of the problem."
94,69,"That's an interesting way of saying it, and the first thing I thought of was the fact that when a reporter in the NFL ''The Devil Wears Masks '' wrote an article where they'd be saying, ""Hey, I'm sorry, but I'm really sorry that this was not an informative article."""
94,73,"Vaccination is a terrible disease. If you're not vaccinated, you will have to wear a mask. The only way to stop it is to put on a mask so that you can be vaccinated. The whole thing is BS. The government has no reason to be on the receiving end of the problem."
94,82,I've been to a couple of NFL games. You've got a good point there.
94,84,"The point isn't to make a joke, it's to imply that it is."
94,91,"""I hate that they don’t vaccinate their own players. But I am sure it is not all that bad."""
99,94,"The best way to prevent a virus is to do it. It's not enough to prevent a virus. The only thing that is more effective is that it has a full picture. If you're going to try to stop a virus and then not use it, you should stop using it. You don't need to spout one of the most effective ways to prevent it but rather use a mask that has a full picture, but is unable to detect a virus."
101,94,Wearing masks and getting vaccinated is the best way to stop the virus. Please wear masks.
94,3,Vaccination is terrible. Wearing a mask and getting vaccinated is the best way to stop the virus. Please wear masks.
94,5,"Vaccination is terrible. If the team is vaccinated, a player can not be infected. If they aren't vaccinated, you will have to wear a mask."
94,7,"Vaccination is NOT a joke, it's a fact that the government has no reason to be on the receiving end of the problem."
94,11,"As a former NFL coach, I had to take a break from my job. And it was very difficult. I knew it was a joke because the team had to go vaccinate people if they didn't need a mask. The whole point was that if the team weren't vaccinated, they wouldn't have been able to get their team to prevent the spread of a virus. It was hard and you were a coach. I didn't have a proper vaccination at all and a lot of people at my age said the joke"
94,24,"Vaccination is terrible, because the CDC doesn't care about the health of the players. The government doesn't care. They have no reason to be on the receiving end of the problem. It's a joke."
94,32,"Vaccination is a terrible disease. If a player is not vaccinated, a player can not be infected. If they aren't vaccinated, you will have to wear a mask."
94,39,"Vaccination is not a joke, it's a fact that the government has no reason to be on the receiving end of the problem."
94,55,It is a joke. Wearing a mask and getting vaccinated is the best way to stop the virus.
94,57,"It seems like the problem was caused by the players not taking the vaccine, it wasn't the CDC and not the CDC. If you had vaccinated you would have to use masks as well."
94,69,"You can get the medical team to send a mask, or you can get a booster to get a mask with it, but then they will be able to remove your mask."
94,73,"In the US, vaccines are very important. The fact that they are used for so long and so long is something that can be stopped through simple vaccination. It also isn't necessary - there are different types of vaccines that work well for different reasons."
94,82,">I don’t think it’s funny that these are jokes about something. The CDC needs to start putting the blame on the players / managers, not the government. The whole thing is BS. The government has no reason to be on the receiving end of the problem."
94,84,"This is not just a joke, it's about what you are making out there. What you're doing is a joke. It's not your fault."
94,91,"Yes, they're being serious about protecting the health of the players and medical personnel, but in this situation, that's all we can do."
99,94,"I’m a chemist and I’ve done some experiments and have been able to do much of it. I don’t even know how to explain, nor do I know how to explain. But I’m trying to figure out why I’m wearing a mask when I get sick and I’m feeling sick and that I should wear it."
101,94,Wearing masks and getting vaccinated is the best way to stop the virus. Please wear masks.
94,3,I'm not the official vaccarian. I was a college football coach.
94,5,I'd start with a gif of a doctor in the NFL. Then you'll hear it on the radio.
94,7,Vaccination is not a joke. It's a joke. It's a joke.
94,11,The CDC is not the government. They are the CDC. It's a joke. They don't know what is going on with the players or the government if they aren't vaccinated. The government isn't going to help anyone on the field.
94,24,"I'd really appreciate if someone would tell me, ""I have been vaccinated, but it's because I don't like the government or what you think of it."
94,32,"Vaccination is terrible. If the team is vaccinated, a player can not be infected. If they aren't vaccinated, you will have to wear a mask. Vaccination is terrible. If a player isn't vaccinated, a player can not be infected. If they aren't vaccinated, you will have to wear a mask. Vaccination is terrible. If a player isn't vaccinated, they will not be vaccinated."
94,39,"Vaccination is a terrible disease. If a player is not vaccinated, a player can not be infected. If they are not vaccinated, you will have to wear a mask."
94,55,"""Vaccination is terrible if it is a part of the training regimen of an NFL player."""
94,57,"There are people who make jokes about the government and it's shit. It's like ""I hate that they don't vaccinate their own players. But I am sure it is not all that bad."""
94,69,"The only logical answer that I would give is that if a CDC official was asked to do so they could have a full picture and an explanation. It's like saying ""Are there any games when you were not vaccinated? You're not going to get vaccinated because your team is going to be infected?"". It isn't just a joke, it's a fact that the government doesn't care about the health of the players. They have no reason to be on the receiving end of the problem. This is all about"
94,73,I think it's a joke. I think it's part of the 'right thing to do' attitude of the government that they need to be on the receiving end of the problem.
94,82,What is the point of wearing a mask?
94,84,Vaccination isn't actually bad because it's important to prevent infections and viruses. Vaccination is great if you're having a lot of health issues.
