sender,receiver,message
94,3,i love coaching however if one official or admin address me about our players not wearing a mask or wearing it properly under a helmet i will resign and not coach until this nonsense stops
94,5,i love coaching however if one official or admin address me about our players not wearing a mask or wearing it properly under a helmet i will resign and not coach until this nonsense stops
94,7,i love coaching however if one official or admin address me about our players not wearing a mask or wearing it properly under a helmet i will resign and not coach until this nonsense stops
94,11,i love coaching however if one official or admin address me about our players not wearing a mask or wearing it properly under a helmet i will resign and not coach until this nonsense stops
94,24,i love coaching however if one official or admin address me about our players not wearing a mask or wearing it properly under a helmet i will resign and not coach until this nonsense stops
94,32,i love coaching however if one official or admin address me about our players not wearing a mask or wearing it properly under a helmet i will resign and not coach until this nonsense stops
94,39,i love coaching however if one official or admin address me about our players not wearing a mask or wearing it properly under a helmet i will resign and not coach until this nonsense stops
94,55,i love coaching however if one official or admin address me about our players not wearing a mask or wearing it properly under a helmet i will resign and not coach until this nonsense stops
94,57,i love coaching however if one official or admin address me about our players not wearing a mask or wearing it properly under a helmet i will resign and not coach until this nonsense stops
94,69,i love coaching however if one official or admin address me about our players not wearing a mask or wearing it properly under a helmet i will resign and not coach until this nonsense stops
94,73,i love coaching however if one official or admin address me about our players not wearing a mask or wearing it properly under a helmet i will resign and not coach until this nonsense stops
94,82,i love coaching however if one official or admin address me about our players not wearing a mask or wearing it properly under a helmet i will resign and not coach until this nonsense stops
94,84,i love coaching however if one official or admin address me about our players not wearing a mask or wearing it properly under a helmet i will resign and not coach until this nonsense stops
94,91,i love coaching however if one official or admin address me about our players not wearing a mask or wearing it properly under a helmet i will resign and not coach until this nonsense stops
99,94,"Little blue ones are totally useless.Even the best don't work very well.Exhale smoke while wearing a mask,any mask and you will see the leakage. It's frightening how dumb they think all of is are."
101,94,Wearing masks and getting vaccinated is the best way to stop the virus. Please wear masks.
94,3,"I will get them off. Then a couple of days after they come out, I will ask them to change their masks."
94,5,"They're pretty useless as they are. I'm not sure that I'm able to help in that situation, but I'd like to say that if one official or admin address me about our players not wearing a mask or wearing it properly under a helmet i will resign and not coach until this nonsense stops i love coaching however if one official or admin address me about our players not wearing a mask or wearing it properly under a helmet i will resign and not coach until this nonsense stops i'm afraid if one official or admin address"
94,7,I see you're a gimp... i hope you win.
94,11,It's not even about wearing a mask. It's about it being on the field.
94,24,Wearing a mask is part of the measures deployed by the government to aid in stopping the spread of a virus. I love coaching however if one official or admin address me about our players not wearing a mask or wearing it properly under a helmet i will resign and not coach until this nonsense stops i love coaching however if one official or admin address me about our players not wearing a mask or wearing it properly under a helmet i will resign and not coach until this nonsense stops i love coaching
94,32,I'm not a hockey fan so I'm not much of a football fan. I really enjoy coaching.
94,39,"Aside from the other comments you have provided, that is not something I have ever said i would be doing. I would say you are the most helpful person in a world of this sort and have no idea what they're talking about."
94,55,"I think there is a difference between wearing a mask and getting vaccinated, though."
94,57,That's how most people die.
94,69,"It's the best thing to ever happen to the NFL, and it doesn't have to be."
94,73,Wearing a mask is part of the measures deployed by the government to aid in stopping the spread of a virus.i love coaching however if one official or admin address me about our players not wearing a mask or wearing it properly under a helmet i will resign and not coach until this nonsense stops i love coaching however if one official or admin address me about our players not wearing a mask or wearing it properly under a helmet i will resign and not coach until this nonsense stops i love coaching
94,82,I've found there is a special kind of mask that keeps you from touching things that might be infected. It's not worth it. It's a form of mask.
94,84,i have a couple of things that make me irritable.
94,91,"We use the masks to stop people from catching a virus, if you don't use the masks properly, you can't get the virus in the air and it will grow back."
99,94,"Wearing a mask is part of the measures deployed by the government to aid in stopping the spread of a virus.Little blue ones are totally useless.Even the best don't work very well.Exhale smoke while wearing a mask,any mask and you will see the leakage. It's frightening how dumb they think all of is are."
101,94,Wearing masks and getting vaccinated is the best way to stop the virus. Please wear masks.
94,3,"I'm sorry but I'm not the official vaccinated coach - I work in a team based on the vaccination, and I'm not a team official - but I've been told by a guy who is the player who's only vaccinated is the head coach - you are an idiot. It's like a kid wearing a mask when his face gets infected and there's no air in there."
94,5,"a lot of people, including myself, who are not familiar with this issue, will be able to use an excuse to change their masks. They just don't think of them as being a good choice for their teams because it's their job to protect them."
94,7,I hate the 'I see you're a gimp... i hope you win' kind of tone.
94,11,"They say that the ""deadly thing to do"" is to get everyone to wear a helmet. If you can't, you'll have to resign and get vaccinated."
94,24,I'm afraid if one official or admin address I see you're a gimp... i hope you win. It's not even about wearing a mask. It's about it being on the field.
94,32,"> I think there is a difference between wearing a mask and getting vaccinated, though. That's how most people die. It's the best thing to ever happen to the NFL, and it doesn't have to be."
94,39,It's about being on the field.
94,55,Hehe. Sorry. I'm going to be all over this thread. And I've had to go for a change.
94,57,"I am really sorry, but I think it's kinda unfair that players and managers have to make such terrible decisions and that I feel like a bad person because I'm not in the right place. And for that I wish the players would stop doing that to their players."
94,69,"Wearing a mask and getting vaccinated is the best way to stop the spread of a virus. Please wear masks. I will get them off. Then a couple of days after they come out, I will ask them to change their masks. They're pretty useless as they are. I'm afraid if one official or admin address I'm able to help in that situation, but I'd like to say that if one official or admin address me about our players not wearing a mask or wearing it properly under a helmet,"
94,73,>I've found there is a special kind of mask that keeps you from touching things that might be infected. It's not worth it. It's a form of mask.
94,82,I'm a teacher and I'm an adult. I'm learning about how you can make a lifelong sicker player. So if I am in the NFL I will not be there.
94,84,"I've been in a few cases that were caused by a virus and I thought if they didn't stop the virus, they would just eat and drink."
94,91,"I think the reason that you are not able to help in the situation is because of your inability to take responsibility for the health of a player's health, rather than your ability to use the equipment for it. If you are unable to do so, then you're going to need the mask for the upcoming season."
99,94,"Wearing a mask is part of the measures deployed by the government to aid in stopping the spread of a virus.Little blue ones are totally useless.Even the best don't work very well.Exhale smoke while wearing a mask,any mask and you will see the leakage. It's frightening how dumb they think all of is are."
101,94,Wearing masks and getting vaccinated is the best way to stop the virus. Please wear masks.
94,3,"IANAL, but when they ask me if I'm the official vaccinated coach I tell them I don't have to wear a mask and the answer is no, they just don't care."
94,5,I was vaccinated.
94,7,CANNOTANSWER NOW ABOUT THE PURPLE?
94,11,">Then a couple of days after they come out, I will ask them to change their masks. They're pretty useless as they are."
94,24,"I have been vaccinated a couple times, my wife was in an infection."
94,32,"I'm trying to be blunt, but I can't think of a way to say it. It's really dumb of the government to do that. I don't think that's the best thing for the NFL, and it isn't to be."
94,39,"I'm sorry that you have to go for a change. I'm really sorry, but I think it's kinda unfair that players and managers have to make such terrible decisions and that I feel like a bad person because I'm not in the right place. I wish the players would stop doing that to their players. Wearing a mask and getting vaccinated is the best thing to ever happen to the NFL, and it doesn't have to be. It's about being on the field."
94,55,I'm a lot of people.
94,57,>I've found there is a special kind of mask that keeps you from touching things that might be infected. It's not worth it. It's a form of mask. I'm a teacher and I'm an adult. I'm learning about how you can make a lifelong sicker player. So if I am in the NFL I will not be there.
94,69,"""I love coaching however if one official or admin address me about our players not wearing a mask or wearing it properly under a helmet i will resign and not coach until this nonsense stops, ""It's the best thing to ever happen to the NFL, and it doesn't have to be."""
94,73,"I'm sorry but I'm not the official vaccinated coach - I work in a team based on the vaccination, and I'm not a team official - but I've been told by a guy who is the player who's only vaccinated is the head coach - you are an idiot. It's not even about wearing a mask. It's about it being on the field. Hehe."
94,82,"I don't even have a link to it, but I believe that you've just described an irritable ""I hate the 'I see you're a gimp... i hope you win' kind of tone. They say that the ""deadly thing to do"" is to get everyone to wear a mask. If you can't, you'll have to resign and get vaccinated."
94,84,"If the player isn't getting vaccinated, they're getting more likely to die."
94,91,"I love the idea of making a mask that prevents the spread of a virus, especially if a player isn't infected with it."
99,94,"Wearing a mask is part of the measures deployed by the government to aid in stopping the spread of a virus.Little blue ones are totally useless.Even the best don't work very well.Exhale smoke while wearing a mask,any mask and you will see the leakage. It's frightening how dumb they think all of is. Little blue ones are totally useless.Even the best don't work very well.Exhale smoke while wearing a mask,any mask and you will see the leakage."
101,94,Wearing masks and getting vaccinated is the best way to stop the virus. Please wear masks.
94,3,CANNOTANSWER NOW ABOUT THE PURPLE?
94,5,"IANAL, but when they ask me if I'm the official vaccinated coach I tell them I don't have to wear a mask and the answer is no, they just don't care. I was vaccinated."
94,7,">Then a couple of days after they come out, I will ask them to change their masks. They're pretty useless as they are."
94,11,"[I've been in a few cases that were caused by a virus and I thought if they didn't stop the virus, they would just eat and drink. I think the reason that you are not able to help in the situation is because of your inability to take responsibility for the health of a player's health, rather than your ability to use the equipment for it. If you are unable to do so, then you're going to need the mask for the upcoming season."
94,24,"I've always thought the masks of the government were a form of protection against a certain kind of vaccine. My mom's dad didn't believe that, and I told her to get vaccinated when I was an adult, and I wasn't in the midst of her own health concerns. I'm sorry, but I don't think that's the best thing to ever happen to the NFL, and it doesn't have to be. I'm sorry, but I think that's the best thing to ever happen to the NFL, and it doesn't"
94,32,"It's the best thing to ever happen to the NFL, and it doesn't have to be."
94,39,I think you're too immature to understand the nonsense. I think it's ridiculous for the government to do that.
94,55,"You're a little immature and a little smug about it, but to be fair, it isn't an official job. I'm just being honest and apologetic. But I can't tell you what is being cited:"
94,57,i think i am going to have to say some things and get to the bottom of that thread and say nothing.
94,69,> I've found there is a special kind of mask that keeps you from touching things that might be infected. It's not worth it. It's a form of mask. I'm a teacher and I'm an adult. I'm learning about how you can make a lifelong sicker player. So if I am in the NFL I will not be there.
94,73,"They say that the ""deadly thing to do"" is to get everyone to wear a mask. If you can't, you'll have to resign and get vaccinated. If the player isn't getting vaccinated, they're getting more likely to die. I love the idea of making a mask that prevents the spread of a virus, especially if a player isn't getting vaccinated. Wearing a mask and getting vaccinated is the best thing to happen to the NFL, and it doesn't"
94,82,"I've only just got off work, but the vaccinated guy is the head coach. He's the only one who would actually do that. It's not an easy decision."
94,84,"I can tell you that this is why there are so many vaccinated players, that the number of masks that have been around is ridiculous and stupid. It's actually ridiculous that all they do is smack them in the face about it."
94,91,I think the only way to prevent that is to make a protective mask that protects the hives. That means it's hard to avoid the hives with a mask.
99,94,"Wearing a mask is part of the measures deployed by the government to aid in stopping the spread of a virus.Little blue ones are totally useless.Even the best don't work very well.Exhale smoke while wearing a mask,any mask and you will see the leakage. It's frightening how dumb they think all of is. Little blue ones are totally useless.Even the best don't work very well.Exhale smoke while wearing a mask,any mask and you will see the leakage."
101,94,Wearing masks and getting vaccinated is the best way to stop the virus. Please wear masks.
94,3,"I can't even believe the fact that people can only do this for a few days. Surely the 'no'rule is a good thing, since it's so common to do something stupid that you can't even do it."
94,5,I'm very sorry but I didn't even think that it was an official job.
94,7,This is so ridiculous. I'm not a great fan of the NFL and I'm not a good fan of this organization.
94,11,I'm not sure if this has anything to do with football but the question is is what kind of mask are they supposed to wear?
94,24,"I'm not sure why a gimp isn't in there, but this guy is literally a gimp. He's a gimp. He's not worth it. The gimp has made a good joke, despite being at the top of the pile. But he doesn't seem to mind if he's making a joke about a gimp or a gimp about a guy who's just playing football. I'm also a teacher and I'm not "
94,32,"Why would you want to be a head coach. The thing is, you have to know the rules. If the government wants to do that, then you are in for a rip-off, unless you have a contract that is not written down. You're allowed to do this without an attorney and you are allowed to do it without a contract."
94,39,">""I'm sorry, but I think it's kinda unfair that players and managers have to make such terrible decisions and that I feel like a bad person because I'm not in the right place. I wish the players would stop doing that to their players. Wearing a mask and getting vaccinated is the best thing to ever happen to the NFL, and it doesn't have to be."
94,55,"CANNOTANSWER NOW ABOUT THE PURPLE? IANAL, but when they ask me if I'm the official vaccinated coach I tell them I don't have to wear a mask and the answer is no, they just don't care. I was vaccinated."
94,57,"I'm pretty sure the number one complaint about the government is, ""Assuming that everyone wears masks and that they don't think it's a good idea to do it at all."""
94,69,[(http://www.hoy.edu/jp/ol_ldaa_nfl.html)(http://www.hoy.edu/hoy.html)
94,73,"i'm sorry but i'm not the official vaccinated coach - I work in a team based on the vaccination, and I'm not a team official - but I've been told by a guy who is the player who's only vaccinated is the head coach - but I've been told by a guy who is the player who's only vaccinated is the head coach - I think that's the best thing to ever happen to the NFL"
94,82,"I'm a teacher, and I love the idea of having the helmet."
94,84,"Vaccination is a terrible disease. If your team is vaccinated, a player can not be infected. If they are not vaccinated, you will have to wear a mask. It's a bad thing. The only way to stop it is to put on a mask so you can be vaccinated."
94,91,The whole thing is BS.
99,94,i think that they don't know the full picture but not a full explanation. I don't have a clue.
101,94,Wearing masks and getting vaccinated is the best way to stop the virus. Please wear masks.
94,3,"I think it's a little bit BS to believe that they have to change their masks. Vaccination is the worst thing that can happen to a human being and therefore, is a bad thing. I think it's not a bad thing to think of it as ""one of those things that we can't see through the hive, despite a lot of the warning signs from the US."""
94,5,I don't know why but I really don't think it's even possible to do it at all. That's my problem.
94,7,"I have not seen this on my team, so it is not really appropriate. The hive isn't really the best way to stop it. Vaccination is a terrible disease. If the team is vaccinated, a player can not be infected. If not vaccinated, you will have to wear a mask."
94,11,"I like how the government basically doesn't do what they do, because they want to keep all the players safe and that can t seem to work."
94,24,I'm a teacher and I am not a professional coach. My only professional job is as a coach.
94,32,"""... the only way to stop the spread of a virus. Please wear masks."
94,39,I think you're too immature to understand the nonsense. I think it's ridiculous for the government to do that.
94,55,This is where it gets really bad. I want to go back to school in the future but I have no idea what to do now
94,57,"Vaccination is a terrible disease. If your team is vaccinated, a player can not be infected. If they are not vaccinated, you will have to wear a mask. It's a bad thing. The only way to stop it is to put on a mask so you can be vaccinated. The whole thing is BS. i think that they don't know the full picture but not a full explanation. I don't have a clue. Wearing a mask is a ridiculous and ridiculous."
94,69,"""I'm sorry, but I think it's kinda unfair that players and managers have to make such terrible decisions and that I feel like a bad person because I'm not in the right place. I wish the players would stop doing that to their players. Wearing a mask and getting vaccinated is the best thing to ever happen to the NFL, and it doesn't have to be."""
94,73,"Vaccination is a terrible disease. If you're not vaccinated, you will have to wear a mask. It's a bad thing. The only way to stop it is to put on a mask so you can be vaccinated. The whole thing is BS."
94,82,"I'm a teacher and I've been in the NFL, so this is how I know I'm not going to be a good coach."
94,84,I don't like how the government doesn't even mention being vaccinated because of an unrelated illness.
94,91,"i dont think i even know what a mask means. it is a bad idea, and i hate that i have to wear it but i dont even know how to be an official"
99,94,"I don't know what you are talking about, but it is a bit misleading that they are saying that ""Wearing a mask is part of the measures deployed by the government to aid in stopping the spread of a virus.Little blue ones are totally useless.Even the best don't work very well.Exhale smoke while wearing a mask,any mask and you will see the leakage. It's frightening how dumb they think all of is are. Little blue ones are totally useless.Even the best don't work very well."
101,94,Wearing masks and getting vaccinated is the best way to stop the virus. Please wear masks.
94,3,Why can't you wear your dick to the field and see the hive?
94,5,I'm a teacher and I am not a professional coach.
94,7,Why don't you just go to school with the kids. We don't need you to teach. We need you to practice. We just don't have anyone on our team who doesn't understand that the government isn't doing the right thing.
94,11,">[I'm a teacher and I am not a professional coach. My only professional job is as a coach. """
94,24,I think you've gotten a lot of wacky advice from someone who is clearly not a fan of the way the government treats the player. You have to be aware that this is a real problem.
94,32,"[i'm not a hockey fan so I'm not much of a football fan. I really enjoy coaching."""
94,39,"Vaccination is a terrible disease. If the team is vaccinated, a player can not be infected. If they are not vaccinated, you will have to wear a mask. It's a bad thing."
94,55,You should see the CDC report that the government is essentially not following through on vaccine issues. There is a big possibility that a virus might spread to people while on the field.
94,57,Wearing a mask is part of the measures deployed by the government to aid in stopping the spread of a virus.
94,69,You're not going to get vaccinated because your player is going to be infected? You're not going to get vaccinated because your team is going to be infected.
94,73,When we all talk about vaccines it is pretty clear that the players and the medical staff are being scummy and don't really care. The medical staff doesn't need to wear a mask to stop the spread of a virus.
94,82,"""Waying a mask is part of the measures deployed by the government to aid in stopping the spread of a virus.Vaccination is a terrible disease. If the team is vaccinated, a player can not be infected. If they are not vaccinated, you will have to wear a mask. It's a bad thing. The only way to stop it is to put on a mask so you can be vaccinated. The whole thing is BS. i think that they do."
94,84,"Vaccination is terrible. Vaccination is a terrible disease. If the team is vaccinated, a player can not be infected. If they are not vaccinated, you will have to wear a mask."
94,91,I have been in the NFL for almost three years. I don't think any of this will happen again.
99,94,"I don't know what you're talking about, but it is a bit misleading that they are saying that ""Wearing a mask is part of the measures deployed by the government to aid in stopping the spread of a virus.Little blue ones are totally useless.Even the best don't work very well.Exhale smoke while wearing a mask,any mask and you will see the leakage. It's frightening how dumb they think all of is."" ""I think that they don't know the full picture but not a full explanation. I don't have"
101,94,Wearing masks and getting vaccinated is the best way to stop the virus. Please wear masks.
94,3,"""We are talking about the government being scummy and don't really care."" """
94,5,"I’m going to go to the NFL this weekend, because I’m a teacher and a coach."
94,7,">They're pretty useless as they are."", ""I have not seen this on my team, so it is not really appropriate. The hive isn't really the best way to stop it."
94,11,You're so young that I don't get to a point where I can't tell the difference.
94,24,The whole thing is BS.
94,32,"Vaccination is terrible. If the team is vaccinated, a player can not be infected. If they are not vaccinated, you will have to wear a mask."
94,39,"> [[I'm a teacher and I am not a professional coach. My only professional job is as a coach. I really enjoy coaching."""
94,55,"I don't like how the government doesn't even mention being vaccinated because of an unrelated illness. i dont think i even know what a mask means. it is a bad idea, and i dont even know how to be an official I don't know what you are talking about, but to be honest, it isn't an official job."
94,57,I can't believe the amount of dick spray that's on the NFL field.
