sender,receiver,message
94,91,"I'm a doctor, and I know this because I've been vaccinated before, but it's also because I'm a doctor, so I can make jokes about anything in this thread."
99,94,“We have to wear masks and it’s a really bad idea.”
101,94,Wearing masks and getting vaccinated is the best way to stop the virus. Please wear masks.
94,3,If a coach is in a position to give vaccine to everyone at the NFL he can do that.
94,5,"What if it's a joke, but I feel like there's no real sexist reason to think the government is telling jokes, and is referring to the reality of the jokes and what if they don't?"
94,7,No jokes. You're talking about the government. But you think it's a joke. There's a good reason why the government shouldn't give vaccines to vaccinate someone and it's not really a joke.
94,11,"As a former football coach I can say that I'm so relieved by this situation that I'm no longer able to watch football. I don't really care about that. I just think that it's a joke because I've been on my best team and I've tried it many times. It's not like the NFL is doing so poorly right now. I don't know why this guy's comment is still relevant, because it's still a joke and probably something the NFL needs."
94,24,">I'm a doctor and a coach. So I would like to say that I don't think that's the best thing to ever happen to the NFL, and it doesn't have to be."
94,32,"I think the government has to give the players a chance to take the vaccine, but for the time being it is a joke, and there are some dissenters to this."
94,39,It sounds like the players are putting in the work.
94,55,Vaccination is a joke because the vaccines are needed to protect against viruses. There are very many different types of vaccines. Vaccination is not a joke because vaccines are a common symptom of the illness that is not vaccinated. The only way to protect against a virus is with a mask.
94,57,"Vaccination is a joke, but it isn't actually a joke. You don't know what a joke is, but it is something that is a joke, and not a joke. It's like saying a funny cartoon is being portrayed, but I don't think that it's. It doesn't even need to be a joke to make sense, since the joke is ""I don't like you saying that the government is scummy and doesn't care"" as if the joke is about the government being a joke."""
94,69,Vaccination is not the only cure to influenza that we have.
94,73,"There are so many jokes claiming that vaccines aren't necessary or the correct response is ""yes, we have to do that!"""
94,82,I think the issue of vaccines is a joke. But the whole thing is BS.
94,84,Vaccination is an important part of the CDC's policy and it's good for the people and those that make decisions. The CDC is the reason why they're getting vaccines.
94,91,"""In the US, the vaccine isn't being used because the CDC wants to protect against the spread of the virus. They are the CDC. They are the CDC. They are the CDC. They are the CDC."""
99,94,"""I'm not sure what the book is about."
101,94,Wearing masks and getting vaccinated is the best way to stop the virus. Please wear masks.
94,3,"The word ""Jokes"" in this thread is a joke about the vaccines being used to protect people against the virus."
94,5,"Vaccination is terrible because it's so incredibly harmful, and you know what it's like to not be a coach and have a good day. There is no way a doctor could ever get a sick person in a hospital. Vaccination is horrible because it's not supposed to protect a person's health. However if the government actually has to take them down, it is the least of the problems."
94,7,"This is a joke. You can’t make a joke about the government, even if you’re not the one making it, just a joke. You can’t make a joke about the government."
94,11,Vaccination is a joke because it's necessary to prevent the spread of a virus.
94,24,"If I were a physician I would just get all the vaccines, but not all the vaccines."
94,32,I just want to say that I feel like the joke is being a joke that I just don't get.
94,39,It is a joke that people have the right to do it. But the government has a right to do it. Vaccination is a joke because it's a joke and the government has no legitimate reason to be in the receiving end of it. The fact that you've been vaccinated in the past is irrelevant to the actual message you've conveyed here.
94,55,I don't know if that makes sense but it's a lot of people saying that the government is shit and doesn't really care.
94,57,I have always thought about vaccines as bad as those other things. I think we know that vaccines are used for something that is absolutely necessary but it is not just to prevent the spread of the disease and the government is trying to stop it.
94,69,"""[The Devil Wears Masks](http://www.hoy.edu/jp/ol_ldaa_nfl.html) (http://www.hoy.edu/hoy.html)[(http://www.hoy.edu/jp/ol_ldaa_nfl.html)[[[NAME]](http://www.hoy.edu/jp/ol_ldaa_nfl.] [NAME]]["
94,73,The joke is being a joke about the US Government getting rid of the CDC (which isn't going to appoint anyone).
94,82,[How can i get vaccinated?](http://www.soho.gov/en/Fresh/Fresh/fresh/index.html) [Is the best way to get vaccinated because they aren't putting on a mask?](http://www.doesnt.gov/en/fresh/en/Fresh/index.html)[Waying a mask is part of the measures deployed by the government](http://www.so
94,84,"Vaccination is one of the many things that Americans have always hated about the government. I think it's good for them to know that vaccinations are a good thing - but if you don't give them a good dose of vaccines and it causes your dick to not go to school, they may as well not get vaccinated."
94,91,"""As a medical assistant at a university that's already been vaccinated, it's really nice of me to have them on while playing football,"""
99,94,"I read your first sentence, 'Wooting a mask is part of the measures deployed by the government to aid in stopping the spread of a virus.Little blue ones are totally useless.Even the best don't work very well.Exhale smoke while wearing a mask,any mask and you will see the leakage."
101,94,Wearing masks and getting vaccinated is the best way to stop the virus. Please wear masks.
94,3,I can't even imagine how much work it would be to see that this guy in the hive resembling this. If you're looking at the top five things I can't imagine that being a doctor's job would be like to make a joke about this as a joke on the internet.
94,5,"I had the same problem, I was a teacher, and my teachers are not all that knowledgeable on the subject. When you say the jokes, the actual jokes are made up in a way that is only hilarious for some people and the other coaches who aren't even sure of it."
94,7,>[How can i get vaccinated because they aren't putting on a mask?](http://www.doesnt.gov/en/fresh/Fresh/index.html)[(http://www.hoy.edu/jp/ol_ldaa_nfl.html)(http://www.hoy.edu/jp/ol_ldaa_nfl.html)(http://www.hoy.e
94,11,Weird. The Devil Wears Masks is a really good book.
94,24,Vaccination is a joke. The government is trying to stop the spread of the virus and is trying to keep it off the ground. Vaccination is bad because it's a joke.
94,32,"It sounds like a joke. It was originally a joke to try and get people to get to the hospital, but since they're not the first in line to take it down, it was a joke to say something like ""Oh, we're already vaccinated."""
94,39,"As a CDC official who was sick last year when I got the vaccine, I still don't know how much of a joke it is, even though I believe the government is still going to make money off of it. I don't think there is a lot of actual value to the CDC if they don't have the means."
94,55,The CDC doesn't really care for vaccines because they aren't used to prevent people from getting vaccinated.
94,57,"""I know that we do not have a legitimate reason to be on the receiving end of a joke."""
94,69,What I was reading was about the CDC.
94,73,I think the CDC is trying to get rid of the CDC because they can't do anything about it to actually get people vaccinated. I think they are doing it so that the health care system can't get too infected.
94,82,"Vaccination is the best way to stop the spread of the virus. If the team is vaccinated, a player can not be infected. If they are not vaccinated, then they are probably not vaccinated."
94,84,"It was the first time I saw a joke about the government being a joke about the CDC. It was a joke about the health of the players, they weren't in the medical field, and they were in the ER. That's the sort of joke that you see in jokes."
94,91,"I'd really like to make a joke about this. In my opinion, vaccines are an important part of a health care system, so it should be used to prevent the spread of viruses."
99,94,Using a mask to make people sick or sick.
101,94,Wearing masks and getting vaccinated is the best way to stop the virus. Please wear masks.
94,3,If you wear a mask you'll be able to tell people that you love your job - and you don't care what other people think of that.
94,5,"""How can i get vaccinated because they aren't putting on a mask?"""
94,7,"""I don't know why the government would say that they can't do a vaccine, but they can do it, because they don't want to keep people sick""."
94,11,As a former football coach I can say that I'm relieved by this situation that I'm no longer able to watch football. I don't care about that.
94,24,Vaccination is one of the many things that Americans have always hated about the government.
94,32,It's a joke. Vaccination is bad because it's a joke.
94,39,This is a terrible joke.
94,55,What's a joke? A joke.
94,57,The jokes are about the CDC. They are trying to prevent the spread of a virus. They are trying to prevent it because it's a joke and it doesn't exist. That's not the joke.
94,69,""", ""I love coaching however if one official or admin address me about our players not wearing a mask or wearing it properly under a helmet i will resign and not coach until this nonsense stops."""
94,73,"""Vaccination is a terrible disease. If you're not vaccinated, you will have to wear a mask. The only way to stop it is to put on a mask so that you can be vaccinated. The whole thing is BS. The government has no reason to be on the receiving end of the problem. The government has no reason to be on the receiving end of the problem."""
94,82,"The government has no purpose in trying to stop the spread of a virus.Vaccination is a terrible disease. If the team is vaccinated, a player can not be infected. If they aren't vaccinated, then they are probably not vaccinated. If the players don't get vaccinated, then they are probably not vaccinated."
94,84,"No. It's not a joke, because they want to make money off of the vaccine."
94,91,"I'm a doctor, and i wear masks for the sake of the game, and I've swum it around for the entire game."
99,94,"I think I have read the book. I didn’t have it in the first place, but I do know a lot about it."
101,94,Wearing masks and getting vaccinated is the best way to stop the virus. Please wear masks.
94,3,Why is the CDC trying to put masks on you? What does it say?
94,5,I'm a bit surprised you're not mentioning this in any of the other titles.
94,7,It's a joke. It's a joke. They should stop doing it and not take it too seriously.
94,11,They can't just give their vaccines to the team. They're going to need to wear a mask in a few months - so he has to stay on the field.
94,24,"I believe that the CDC tries to be a joke. You don't know what a joke is, you think that a joke is."
94,32,"Nope, a joke. Vaccination is a horrible disease. If you're not vaccinated, you can not get infected. If you're not vaccinated, then you will have to wear a mask. Vaccination is horrible. If you are not vaccinated, then you are likely not vaccinated. If you are not vaccinated, then you are likely not vaccinated. If they aren't vaccinated, then they are likely not vaccinated."
94,39,Vaccination is not a joke. Vaccination is a joke. The government doesn't have the means to take action. It's not a joke. It's a joke.
94,55,What is a joke? The CDC is not a shithole.
94,57,">I'm pretty sure the number one complaint about the government is, ""Assuming that everyone wears a mask and that they don't think it's a good idea to do it at all."""
94,69,"I'd like to add that I don't think anyone should ever have to deal with this as it's like saying """
94,73,It's a joke.
94,82,Vaccination is not a joke. It is a joke. It's a joke. It is a joke. The government is trying to make it a joke.
94,84,So I'm a public health officer. I would take a long look at your comment history and try to look at this as an excuse to make money off of the vaccine.
94,91,"Aside from the fact that you didn't get vaccinated, it was really good to be vaccinated as a result of that. A bad idea for someone that has a vaccine but not a doctor can't really do anything about it, as that's why they didn't get it."
99,94,It's more like saying if I read the book if I was sick i would probably die. I wouldn't get sick again if I didn't. But I can tell you that I've read the book. The book is about a virus that can cause pain in people's eyes
101,94,Wearing masks and getting vaccinated is the best way to stop the virus. Please wear masks.
94,3,I'm going to give a short one:
94,5,"""It's terrible. Vaccination is terrible. If the team is vaccinated, a player can not be infected. If they aren't vaccinated, then they are probably not vaccinated. If they aren't vaccinated, then they are probably not vaccinated. If the player gets infected, then they are probably not vaccinated. If they aren't vaccinated, then they are likely not vaccinated."""
94,7,There's a question here about whether the government has a reason to do that?
94,11,"The CDC needs to start putting all vaccines on the field. If you didn't get vaccinated, then you could stay on the field. The CDC is also working with the players and the media, not the players. If the players aren't vaccinated, you could stay on the field. And you could be a coach. Vaccination is awful. If the players aren't vaccinated, they could be on a team."
94,24,"It says in a note: ""But that's not a joke."""
94,32,"Is it possible to be vaccinated before getting your first infection? If it's really not possible to be vaccinated before getting your first, it is unlikely to have a virus."
94,39,"In my experience, a lot of people in the NFL get vaccinated, even with a mask. That's because they've seen enough about the vaccine and the people who've been around them. You're right about vaccines, but if you're not vaccinated, then you don't go to the CDC and buy them anyway. I think I'm comparing this to the problem a lot of people have that they can't be vaccinated, but who doesn't have the money?"
94,55,"Vaccination is a joke because vaccines are needed to protect against the disease that's not vaccinated. There are very many different types of vaccines. It is terrible because vaccines aren't used to prevent people from getting vaccinated. If you aren't vaccinated, then you are probably not vaccinated."
94,57,"If you’re a politician, do you want to be the top commentator?"
94,69,"I think it's fair to call the football players ""I don't have a real job. If we have no opportunity to do anything to protect them,"" but if they don't, it's fair to say they're all in an era of government. Isn't this a common practice in the NFL?"
94,73,"A lot of the jokes are about the US government trying to keep a joke from being a joke. ""The word 'job' is an acronym for jobs that are not jobs."", ""I think the government is trying to get rid of the CDC because they can't do anything about it to actually get people vaccinated."
94,82,"I think the point of this is that the vaccine is not a joke, it is a joke."
94,84,The most common jokes of the world are that you don't get the vaccine because you're not vaccinated and you aren't in the medical field. If you don't get the vaccine you are at risk of getting it from people who aren't in the medical field.
94,91,It's kind of the same thing with the CDC. They are the CDC. They are the CDC. They are the CDC. They are the CDC. They are the CDC. They are the CDC. They are the CDC. They are the CDC. They are the CDC. They are the CDC. They are the CDC. They are the CDC. They are the CDC. They are the CDC. They are the CDC. They are the CDC. They are the CDC. The CDC is a joke.
99,94,">We have to wear a mask,any mask and you will see the leakage. It's frightening how dumb they think all of is."""
101,94,Wearing masks and getting vaccinated is the best way to stop the virus. Please wear masks.
94,3,What's the joke about this?
94,5,"I'm sure that you guys are joking too. I'd like to add that the joke of if the players don't get vaccinated, they are probably not vaccinated and not vaccinated."
94,7,I would just love if a reporter came forward and made a joke about vaccines and he'd just take it.
94,11,"It's funny that they have a problem with the vaccine, that they are not getting vaccinated."
94,24,Vaccination is terrible. It is terrible because vaccines aren't used to prevent the spread of a virus. There are very many different types of vaccines.
94,32,It is a joke. It is an ineffective way of dealing with the spread of a virus.
94,39,"""Vaccination is a terrible disease. If the team is vaccinated, a player can not be infected. If they aren't properly vaccinated, they will not be vaccinated."""
94,55,Vaccination is a joke. It's not about vaccines.
94,57,"This is why if I asked people to stop putting on a mask and they didn't, the question would be, ""how did they get all this nonsense to stop? Because you are doing this because you aren't vaccinated, so you are infected?"""
94,69,"I don't see why you have to deal with this. This is the first time I've seen a government official talking to a CDC official that actually believes it's a joke and not a fact, but it's a general statement that you think is ""unfair"" and it is not. That means that you can't think of any other good reason for the government to have this attitude. It's as simple as if a doctor who doesn't like to be a public health officer would even be able to understand that the government should have been "
94,73,"I'm not sure you know anything about the actual issue with vaccines. They're a joke because they're used to being snooping, but you've seen them and your team."
94,82,This is a joke. It's a joke. It's a joke. A joke. It's a joke. It's a joke. It's a joke.
94,84,It's a joke. Vaccination is the best way to prevent the spread of disease.
94,91,I love the idea of the mask in the sports. I've done it for a little while now and I've never felt this safe or anything like that.
99,94,"The guy is wearing a mask and if you look close enough, you will see a lot of the leakage."
101,94,Wearing masks and getting vaccinated is the best way to stop the virus. Please wear masks.
94,3,Vaccination isn't a joke. It's about how vaccines are used to prevent and spread infections. If a player does not get it then he's still in the hive and there's no air in there.
94,5,Vaccination is terrible. Vaccination is horrible. Vaccination is terrible. It is terrible because it's not supposed to protect the public from the spread of a virus.
94,7,The CDC is a joke.
94,11,"The CDC, which has been running a campaign to prevent the spread of infectious diseases, is on fire and out of business."
94,24,"I'm a physician, and I think it's a good idea to start working on the vaccine. The CDC doesn't care much, unless you are vaccinated for the illness or to get vaccines for the disease. It's the best thing to ever happen to the NFL, and it doesn't have to be."
94,32,"""We have to wear a mask and get vaccinated."
94,39,"I don't like the joke, but I'm a great coach and a good coach. I would like to be on the team and not be on the field. I'm a good coach but I like to play the game of football."
94,55,"I have an opinion on vaccines, and I really like the idea that some people feel the best way to stop the spread of a virus is to wear a mask in a game or competition, or to do what other people say and do."
94,57,"Is a vaccine a joke? If not, why don't you make a joke about vaccinating your teammates? If not, why don't you make a joke about the CDC."
94,69,"I can't believe the CDC hasn't done anything about it. It's a joke about people claiming that a virus is just ""a joke"" as far as I can tell."
94,73,The vaccines that go around are not really that bad.
94,82,"You are trying to do a bad thing by being silly, but the CDC is trying to keep the government from doing the right thing and not the right thing. This is not funny at all."
94,84,"I'm not arguing for the joke, but I'm trying to explain the truth: vaccination is the best way to prevent infection and viruses."
94,91,"""I love the idea of making a mask that prevents the spread of a virus,"""
99,94,I'm really sick and tired. I don't know what I'm doing.
101,94,Wearing masks and getting vaccinated is the best way to stop the virus. Please wear masks.
94,3,I'm a dick.
94,5,It's a joke. The CDC has been running a campaign to prevent the spread of infections.
94,7,"This is going to come down to the fact that the fact that a guy is wearing a mask is not a joke about anything but the vaccine is a joke. The government isn't doing anything about it. That is not a joke, I'm not sure what it means in practice, but I don't think it's the right thing to do."
94,11,"I think he is being racist because it says he was in a position of power and he does not like it, but that he was actually a politician, and that he thinks it's a good idea to do this. He's not a politician, and he's not a joke."
94,24,I don't have a favorite but this one is good to ask.
94,32,Yes it is a joke. It's a joke because of how you have to put up with it. And it's really a joke because the CDC isn't involved with the vaccines.
94,39,I'm gonna look into the definition of the term in the context of the following quote.
94,55,"I am an athlete and have been vaccinated a few times, and I feel the same way."
94,57,The vaccine is the best way to stop the spread of the virus.
94,69,"If you go to the football games with your kids, it's going to be a lot harder to make them vaccinated."
94,73,""" Vaccination is terrible. If you're not vaccinated, you will have to wear a mask. The only way to stop it is to put on a mask so that you can be vaccinated. The whole thing is BS. The government has no reason to be on the receiving end of the problem. The government has no reason to be on the receiving end of the problem."", ""The joke is trying to make them seem like they're the best at that but I can tell you that their decision is BS."", ""The joke is about how vaccines are used"
94,82,"The joke is an attempt to be naive, but they are trying to make it a joke."
94,84,There's no way you can get vaccinated if you don't get the vaccine?
94,91,"That's the kind of joke that people have heard from the media. It's not like the NFL is going to continue to use masks on their players, that's why they're still using them."
99,94,"So, you mean that people are wearing a mask and not just an imaginary mask to stop the spread of the virus?"
101,94,Wearing masks and getting vaccinated is the best way to stop the virus. Please wear masks.
94,3,"Yes. Do not tame or use any kind of hive for anyone, not a team."
94,5,Is there any real reason that you're not vaccinated? I know the truth but there's no reason the NFL doesn't have to take them down.
94,7,Vaccination is not a joke. It's a joke. The government has no reason to be on the receiving end of the problem. They don't have a reason to be on the receiving end of the problem. Vaccination is not a joke.
94,11,"What are you talking about? It's not just a joke, it's the best way to prevent a serious illness like the flu. You have to be in a very good position to prevent the spread of viruses and bacteria. I mean, when you want to prevent the spread of viruses, a team member should do it."
94,24,The one that comes closest to this is:
94,32,"Vaccination is terrible. If you're not vaccinated, you can not be infected. If they're not vaccinated, they will have to wear a mask. Vaccination is horrible. If you're not vaccinated, then they'll have to wear a mask. If you're not vaccinated, then you'll have to wear a mask."
94,39,"I think you need to give me context to my comment, because I was thinking of this very thing."
94,55,Vaccination is a joke. But that doesn't make it a joke.
94,57,The government is working to stop dick spray from reaching players. They are trying to do everything they can to make it safe.
94,69,">When I am not coaching, I am also not vaccinated."
94,73,I think we should take the most important part of a joke with a grain of salt.
94,82,It's not that the government doesn't want to stop the spread of a virus. It's that it does not want the government to do something that is intended to make the government stop the spread of a virus.
94,84,That is not the whole point of vaccination. It is important that people know how to prevent a disease and to make them feel better about themselves.
94,91,"... [Milwaukee, Maryland](https://www.reddit.com/r/reddit-mashing-hives-and-virus-religious/r/seniors-and-villegs/) ""In my opinion, vaccines are an important part of a health care system, so it should be used to prevent the spread of a virus."""
99,94,It sounds like the book is basically 'Two Blue Masks'.
101,94,Wearing masks and getting vaccinated is the best way to stop the virus. Please wear masks.
94,3,So what's the issue?
94,5,"""Don't have to wear a mask if you aren't vaccinated. Vaccination is horrible because it isn't supposed to protect the public from the spread of a virus."
94,7,The government is not supposed to be on the receiving end of the problem.
94,11,The guy in the first line is a great coach.
