sender,receiver,message
95,1,"The ''I don't know what the word virus'' comes from the word virus'.', ""Virican'', and 'viruses' in the same sentence."
95,2,"It seems that if you just wear a mask outside, you will be able to hear the ""sadness"" of the conversation and not feel any guilt if it happens. If that's a joke, then you aren't a bad person. I know it sounds very saddened. I feel like it's a really good idea to let people know that the government is attempting to stop the spread of a virus, and that there is a lot of sexist, irrational and anti-sassy jokes. This"
95,14,This isn't really a joke.
95,29,"You say they have a lot of sexist, racist, and anti-Semitic language in the US, iirc."
95,31,">I don't see how the govt is going to do that, because they are just making excuses to continue."
95,33,"I hate it when a guy comes up and says something like ""The joke is very anti-semitic. It is not a joke, but it's a joke"" because it implies something very non-semitic. ""[You've had a bad time with this stuff. The joke isn't that funny"". That is very obvious."
95,43,A cloak is very offensive in a joke like this. But it isn't.
95,45,">Is wearing a mask outside or in your car alone your gullible and submissive not traits you want to project', 'I was really disappointed when I read this', 'Is wearing a mask part of the measures deployed by the government to aid in stopping the spread of a virus?',"
95,50,I can't even remember the last time I read the post. Then the government said: 'If you wear a mask outside or in your car alone is part of the measures deployed by the government to aid in stopping the spread of a virus.'
95,54,CANNOTANSWER///ttf/
95,62,"I was just going to say this: I don't think it's a joke because I'm not the one that thinks it's a joke. It sounds like he's in a very bad mood, but the government is doing this because it's a joke that's meant to be funny, because the idea that the idea of a joke is funny is unhelpful. And the government can't have it done to stop it. They just need to stop it and take the right steps and just take the right things into context. And that's just "
95,64,">I don’t see how the govt is going to do that, because they are just making excuses to continue."
95,76,"IANAL is making fun of the U.S. government. ''There is a lot of sexist, irrational and anti-semitic language in the US and Canada."
95,81,Yes it is a joke. They are making fun of the U.S. government.
98,95,"I don't like the joke, I don't care about him, but it's not funny."
101,95,"Wearing masks does not help in stopping the virus, it's useless and I hate it."
95,1,"I'm not sure what this is, but it sounds like the US government is trying to get rid of the AIDS epidemic."
95,2,"I'm sure many horoscopes can be used to make the person understand that the joke is a joke, that it can't be used as an excuse to tell a petty joke."
95,14,"I think this is just a jarring line between a joke and a joke. Whether it is a joke or not, if you have a clear understanding of what the joke is referencing, the only thing that makes sense to me is that it isn't a joke. It's not funny, because the joke isn't funny."
95,29,"IANAL: ""The only way we can stop the spread of a virus is to put a shield on all the people that want to try to prevent it. And the mask is supposed to protect his head from the air, and helps prevent a terrorist attack on him. It's not a sex act."", ""I love how people use the idiom because it is funny."
95,31,"In one of the more common jokes from the past, and especially from the modern day, it's 'If you wear a mask outside or in your car alone your gullible and submissive not traits you want to project ', 'The only way to stop a virus is to put a shield on all the people that want to try to prevent it''. This is kind of a joke because in this case he's talking about the 'I want to see if he '' is the same type of joke.'', '"
95,33,IANAL is making fun of the government.
95,43,A cloak is very offensive in a joke like this. But it isn't.
95,45,"[... I think we're just focusing on a few points here, namely, how you can stop the spread of a virus if you are a sick and ill person."","
95,50,It's a joke.
95,54,">(https://www.neah.gov.ca/neah/)(https://www.neah.gov.ca/neah/). I'm a man and a good worker. I'm a man and a good worker. I'm a man and a good worker. I'm a man and a good worker."","
95,62,"""The idea that they are able to stop the spread of a virus is very a joke that's meant to be funny."""
95,64,I think the issue here is that the government isn't willing to admit their behavior is wrong or a good thing.
95,76,"I think if you wear a mask outside or in your car alone, it helps stop the spread of the virus. It also helps prevent the spread of the virus, and will help stop the spread of a virus if they can't stop it."
95,81,"I am a Canadian and wear a mask outside of the car, because I've been there to hear a lot of things about them. If you wear a mask outside or in your car alone, I will think of a funny joke:"
98,95,The joke in the movie is actually a joke. It's a joke about an American woman who was born in an American family. It makes it so that a lot of people who aren't white don't become white. That's exactly why it's a joke.
101,95,"Wearing masks does not help in stopping the virus, it's useless and I hate it."
95,1,I'm a guy and a good worker. I am a man and a good worker.
95,2,>The other two are called cynical and they aren't really common in the United States.
95,14,"You sound like you don't have a very good understanding of the subject. You just need to know how to use the idiom, not try to be too clear with your words. You don't have the skill or motivation to use a joke."
95,29,"IANAL: ""Women are commanded to wear a mask outside or in their car alone, because they do not believe the dangers are present. We should be able to prevent them from spreading."
95,31,This is a jarring line between a joke and a joke.
95,33,"I am a man and a good worker. I like people a lot, and the world knows exactly what they want to be. I don't really understand how they have a clue how they feel. They are just a bunch of idiots."
95,43,"The idea of ""infective"" is just a joke. The 'feeting' word that the government use to refer to the government is not a 'good thing'. It's a 'good joke'."
95,45,"""Is wearing a mask outside or in your car alone your gullible and submissive not traits you want to project',"
95,50,This is a joke. This is the joke of the day.
95,54,I'm a man and a good worker. I'm a man and a good worker. I'm a man and a good worker.
95,62,"I can see where the joke comes from, but I also can't really tell why they would say 'a joke' in the context of a joke?"
95,64,"It's not funny because it doesn't actually happen. It's just like saying a 'Hmm, I don't think I'm going to be as nice to you as I am to you. I don't think I'll be as good as the guy I was with.''"
95,76,"The whole point of the joke is to keep them from feeling a little silly by saying that ""ask me if I'm a scumbag, I'll go have a try"" to show that the idea of someone wearing a mask outside or in their car alone is the right thing to do."
95,81,I'd wear a mask and think of the funniest thing I've heard of the virus.
98,95,... because the government is trying to stop the spread of a virus.
101,95,"Wearing masks does not help in stopping the virus, it's useless and I hate it."
95,1,"IANAL: I'm a fan of the ""Wearing a mask outside or in my car alone"" comment."
95,2,"IANAL: ""Women are commanded to wear a mask outside or in their car alone, because they do not believe the dangers are present. We should be able to prevent the spread of a virus."
95,14,I think the point is that the joke is to make a joke. I don't see how it's possible to actually make one joke in a real sense.
95,29,"So I've written about this before. If it makes you feel better, maybe you should also consider what the 'happiness' is: a lot of the people describing 'infectious' people can equate to what the person was infected with and it has nothing to do with the virus, but with the threat of something. Then there's the 'happiness' of not wanting to be infected, and with a willingness to be a part of a group. But I do not know how they are doing that. 'Haha"
95,31,"They are very often trying to make a joke of something that doesn't actually happen. There are jokes in the movies about how they're just not real. The idea isn't to make a joke about that, but to make it a joke about that. I'm not saying that they're funny, but they do want to say that."
95,33,"It's a joke, as in a joke, about how a doctor wants to make sure that he doesn't get a shit job and you can't get a job or even a job. It's not even necessary to be a doctor to be able to find a job or work."
95,43,"The first of those would be a joke, the first to be a 'cowardly joke'"
95,45,"""Wow, a lot of the government's behavior is aimed at me..](https://www.neah.gov.ca/neah/)."","
95,50,"I’m not a fan of this, I know a lot of people who don’t understand what a joke is. I just like to say that the most popular part of the post is ""[The idiom] (https://www.neah.gov.ca/neah/)(https://www.neah.gov.ca/neah/)(https://www.neah.gov.ca/neah/)(https://www.neah.gov/ne"
95,54,I've been on the subject for several years and it sounds like it's the only thing we ever really have.
95,62,"The way you read it is that when we wear a mask outside or in our car alone our gullible and submissive not traits you want to project', ""The way I see it is that when we wear a mask outside or in our car alone our gullible and submissive not traits you want to project if we wear a mask outside or in our car alone your gullible and submissive not traits you want to project if we wear a mask outside or in our car alone your rat"
95,64,I think you are missing the part where I read the joke [and the fact that people who don't know what virus is](https://www.neah.gov.ca/neah/):
95,76,"Yes, I can only speak from experience, but I'd tell you it's a very simple joke."
95,81,"You're right it is a joke but it isn't actually a joke, as you're saying. The 'good thing' is ""you do not want to get into a situation"" and ""the government does not want to."""
98,95,">Himmy's hat"": ""I don't care if people die. I don't care if people die. What about a doctor who made the movie, and said to him, ""I don't care if people die. What about a doctor who made the movie, and said to him, ""I want a doctor to be in there to get me. It's like they are taking a very big hit on me."""
101,95,"Wearing masks does not help in stopping the virus, it's useless and I hate it."
95,1,I don't think there's anything wrong with using the word virus. There are more signs of a virus being transmitted from a certain area of the United States than it does from a person to person in one place and from the person in another.
95,2,[Vet. gov.](http://www.neah.gov.ca/neah/)(https://www.neah.gov.ca/neah/)(https://www.neah.gov/neah/)(https://www.neah.gov/neah/)(https://www.neah.gov.ca/neah/)(https://www.neah
95,14,I can't be too sure. I don't really think any joke would really make sense to me.
95,29,"If you want to get in, don't wear a mask."
95,31,"> ""[There is a lot of sexist, irrational and anti-semitic language in the US and Canada."
95,33,I am not a fan of this.
95,43,"IANAL: I’m from the US and I’m a fan of the ""Wearing a mask in my car alone"" comment."
95,45,"Wearing a mask outside or in your car alone isn't a good idea, but it's a good idea."
95,50,CANNOTANSWER](https://www.neah.gov.ca/neah/)(https://www.neah.gov.ca/neah/)(https://www.neah.gov.ca/neah/)(https://www.neah.gov.ca/neah/)(https://www.neah.gov.ca/neah/)(https://www.neah.gov/ne
95,54,I'm in a very difficult position in life. I can't imagine anything worse than having a sick person who has the virus in your car.
95,62,I’m a man.
95,64,"IANAL: ""We have a lot of people who don't even know what the word virus is."
95,76,"You can't make a joke without being a scumbag, and that's where it's at."
95,81,>(https://www.neah.gov.ca/neah/)(https://www.neah.gov.ca/neah/)(https://www.neah.gov.ca/neah/).
98,95,"""I don't care if people die. I don't care if people die. What about a doctor who made the movie, and said to him, ""I want a doctor to be in there to get me. It's like they are taking a very big hit on me."""
101,95,"Wearing masks does not help in stopping the virus, it's useless and I hate it."
95,1,I'm a man and a good worker.
95,2,"A lot of the comments you have to say 'We should be able to prevent the spread of a virus' and 'You have to wear a mask outside or in your car alone isn't a joke' seem really mean spirited and naive and are only a little vague compared to a lot of the jokes you have written above and beyond this and other things that we might see as ""fucking funny"" are pretty funny."
95,14,"I mean, there's the joke and you're saying it's a joke, right? It's funny because you don't know what the meaning is, but you just don't know what the meaning is. So I assume it's a joke."
95,29,"A lot of people have been infected with a virus, they're still sick."
95,31,"I don't see how the govt is going to do that, because they are just making excuses to continue."""
95,33,I have one or two comments about the whole thing that made me sick in one place.
95,43,"""I am not a fan of the joke, but I just don’t think it’s a good idea."""
95,45,I'm sure we've had a lot of times when you tell a joke you don't want to tell.
95,50,The fact that I am in a very difficult position in life. I can’t imagine anything worse than having a sick person who has the virus in my car. I’m a man.
95,54,I don't think the government is going to stop the spread of a virus. I think it's time to talk about the effects of this on society.
95,62,I can’t - that’s too stupid of me. I’m the only man. I’m the only woman.
95,64,I'm sorry that this is being downvoted.
95,76,CANNOTANSWER](http://www.reddit.com/r/raisedbysmart) Wearing a mask outside or in your car alone is part of the measures deployed by the government to aid in stopping the spread of a virus.
95,81,"You said it, but I've been there too."
98,95,"This is a joke. It is a joke. The movie is not a joke. The movie isn't a joke. The movie is a joke. Almost all of the time people are making fun of the government. Those are all blatantly offensive statements, and there is more to it than that."
101,95,"Wearing masks does not help in stopping the virus, it's useless and I hate it."
95,1,"- ""It’s a joke. You don’t care if people die. I don’t care if people die. What about a doctor who made the movie, and said to him, “I’ve got that one coming.””"
95,2,The first jokes on a podcast about the government are the most common of them.
95,14,"It's called ""A joke. It's just a joke."""
95,29,> The only way we can stop the spread of a virus is to put a mask on all the people that want to try to prevent it.
95,31,So the other jokes were just the jokes of the people in the movie.
95,33,"I like that humor. It's the joke that makes people laugh, but makes people laugh. It is the joke that makes people laugh, and that's the joke. It's not the joke that makes people laugh, it's the joke that makes people laugh. It makes people laugh, it makes people laugh, it makes people laugh, it makes people laugh, it makes people laugh, it makes people laugh, it makes people laugh, it makes people laugh, it makes people laugh, it makes people laugh. It's the joke, and it's the joke."
95,43,The government is not interested in preventing a virus. It is not interested in preventing the spread of a virus.
95,45,There's also a video on TV that shows the government trying to make a joke about how a doctor or doctor's car should have a hood that hides it when a person he is sick and who wants to get away.
95,50,"You're not really a fan of this. This is a joke. It's a joke, and it's a joke. This is a joke. The joke."
95,54,"I’ve had some pretty nice people do it to me, but I’ve also been very lucky that I was not in that situation."
95,62,"So, what? I’m in a serious state, and a little bit jaded about it."
95,64,"'""You don't know what the word virus means?"""
95,76,I'm not sure I would have a laugh in the same situation if I were you.
95,81,Is there any reason that the government doesn't want to change this? It's not like they want to.
98,95,The movie isn't a joke. The movie is a joke.
101,95,"Wearing masks does not help in stopping the virus, it's useless and I hate it."
95,1,"""A lot of the government's behavior is aimed at me."
95,2,"I would be in the hospital today trying to check on a friend who has had to wear a mask outside or in a car. It is a joke, if I was you I would just be crying. The jokes are all funny. I have no reason to be upset about them."
95,14,"This is actually more than just a joke. The first thing you see in the movie is a movie where someone says a very hysterical joke about the government. A movie is a joke about the government. 'The government isn't interested in stopping the spread of a virus. Those are all blatantly offensive statements, and there is more to it than that. The movie is a joke. The movie is a joke. The movie is a joke."
95,29,"I don’t think that a cynical, anti-Semitic, anti-Semitic person would be surprised by that he had a chance to get infected with a virus while being infected with it."
95,31,"I have been there before, and it was quite painful. It’s a very difficult joke, it’s such a pain to have to be able to handle it and I just don’t get it."
95,33,[Nevada: [http://www.neah.gov.ca/neah/](https://www.neah.gov.ca/neah/)(https://www.neah.gov.ca/neah/)(https://www.neah.gov.ca/neah/)(https://www.neah.gov.ca/neah/)(https://www.neah.gov.
95,43,"A lot of people have the same definition of virus as ""virus."" This may be an idiomatic error, but it's in the context of a joke, and the language of the joke may also be more relevant than the definition itself."
95,45,There is a joke on the internet about the government.
95,50,"'At this point, I know nothing about how to fix the virus', and I know the answer."
95,54,"I have no idea if the snarky stuff has to do with how people act, but what about the man who made that movie about the government putting a mask on a sick person... and who isn't in the government and who is sick, too?"
95,62,"It's a joke. People say ""this isn't a joke""."
95,64,"... And because of that, I think this is just a joke."
95,76,"> It is a joke. It’s a joke. It’s the joke that makes people laugh. It’s the joke that makes people laugh, but it makes people laugh, it makes people laugh, it makes people laugh, it makes people laugh, it makes people laugh, it makes people laugh, it makes people laugh, it makes people laugh, it makes people laugh, it makes people laugh, it makes people laugh, it makes people laugh, it makes people laugh, it makes people laugh, it makes people laugh, it makes people laugh,"
95,81,"It's called the ""I feel so gullible about a situation and just hate it. I know a lot of people who don't know about this stuff and are a bit saddened by it. """
98,95,"""If he was a President he could have a hat and the virus would not be present."""
101,95,"Wearing masks does not help in stopping the virus, it's useless and I hate it."
95,1,"CANNOTANSWER: ""I don't know what the word virus"" comes from the word virus, which comes from the word 'virus'."
95,2,"The first joke is about the government. ""The movie isn't a joke. The movie is a joke."
95,14,"What you see in the movie is the joke about the government. If the government does not want to prevent the spread of a virus, the joke is a joke."
95,29,"The movie is about the people who are infected with a virus, and I don't know about how to stop the spread."
95,31,"The only 'humor' in a joke is that the 'fun' is not the joke, and that is not what it is, but the 'humor' that is based on the 'humor' is it isn't really a joke, it's just an idea."
95,33,The movie is a joke. It's the joke that makes people laugh.
95,43,I just want to say something like:
95,45,"In the world of people with health issues, no joke. It's not just about the government."
95,50,That's what you have to say if you think a joke isn't a joke.
95,54,"'The first thing you see in the movie is a movie where someone says a very hysterical joke about the government. 'The movie is a joke. 'The only way we can stop the spread of a virus. Those are all blatantly offensive statements, and there is more to it than that."
95,62,You've got the problem of it getting lost and not going to get any answers.
95,64,"I can't remember the names of anyone else who was able to do it (McDavid, J.C., etc.) in the context of this discussion. It's a joke that's so common that it's almost impossible to describe a joke in words with a sentence so broad and complex that even though it is a very big piece of nonsense, it's pretty much a whole lot of fun to read."
95,76,"Then that's the end of this, ""if a guy in the US had a hat on I wouldn't wear one."""
95,81,"The joke isn’t really about what happens at the office, but rather that someone wants to make fun of them."
98,95,"IANAL, but that's about the only thing you're supposed to want."
101,95,"Wearing masks does not help in stopping the virus, it's useless and I hate it."
95,1,"In order to be fair, that's a joke. I don't think that the joke is about the government. The joke is about the government. I think that's a great joke, and I think it is a joke about people who don't know a lot about it."
95,2,"The article states that the word 'virus' is used in a joke. ""Vet. gov."" is a word that is used for the purpose of preventing the spread of a virus."
95,14,A lot of these terms have a difference.
95,29,"CANNOTANSWER: ''When you put the mask on, it's going to prevent a virus from spreading.'', 'If a guy in the US had a hat and the virus would not be present.""', 'If a guy in the US had a hat and the virus would not be present.'', 'If a guy in the US had a hat on I wouldn't wear one.''"
95,31,"You say you want to be a part of the government, right? That's the joke."
95,33,I want to make a point about the difference between a joke and a joke.
95,43,"I'm assuming the question ""Is wearing a mask part of the measures deployed by the government to aid in stopping the spread of a virus?""."
95,45,"It doesn't say 'I don't want to get into the military, but I can get to the doctor's face' but he can still be in the air while you are sick and have to wear a mask. If you want to keep yourself at bay you can wear a shield. If you want to take yourself to the doctor's seat but your head is on the air, then you should wear a mask, and only then can you stand by while you are sick? That's really a joke and not a joke. I don't know why people haven"
95,50,"""If you wear a mask outside or in your car alone is part of the measures deployed by the government to aid in stopping the spread of a virus."""
95,54,"The movie is about the government doing it, because it's a joke. It isn't a joke. It isn't the only thing the government is trying to do. It's a joke about the government. It's called the ""I feel so gullible about a situation and just hate it."""
95,62,I think it's funny because people are a little bit more confident in how they're perceived by a stranger.
95,64,"The joke isn't about the government, it's about a virus that gets spread."
95,76,"So, if you wear a mask outside or in your car alone, you are only putting a mask on so if you wear it, you might ejaculate?"
95,81,What you are actually talking about is the fact that the government is putting on a mask and the 'infection of a virus' is a joke and a joke is not a joke.
98,95,It's a joke.
101,95,"Wearing masks does not help in stopping the virus, it's useless and I hate it."
95,1,It's a joke that's kinda creepy but still funny enough.
95,2,"""Cannoanwer: """
95,14,"I've had this situation. I feel like I'm going to have to sit through a very long, hard conversation over a few hours and just sit in silence and be honest with myself, I think a whole bunch of people are just like I've been through a lot of trouble."
95,29,What about how many people I know are sick after reading the article?
95,31,"''When you put the mask on, it's going to prevent a virus from spreading.''"
95,33,"It is a joke. It is about preventing a virus, it is not a joke. I'm sure a lot of people think that they can keep a mask, but it's a joke."
95,43,I think it's also a joke because the joke is about a government-like state. I know it's funny but I'm unsure about how it can go. I think it has to do with the idiom.
95,45,CANNOTANSWER:
95,50,This is an idiom.
95,54,"I think this is a lot of troll stuff, but what's a joke about? That's all snarky and a joke about the government. It's about the government doing it, because it's a joke about the government. It's called ""the only thing we ever really have."""
95,62,"CANNOTANSWER: ''When you put the mask on, it's going to prevent a virus from spreading.''"
95,64,''You don't know what the word virus means?
95,76,I think the only reason it is a joke is because it's about the government. It's the only way to prevent a virus.
95,81,"I've read a lot of stuff about people who do not like the government, but not who actually care about the government. The government is trying to prevent the spread of a virus. The film is about it because it focuses on the government. It's a joke and a joke isn't a joke. The movie is about the government doing it because it's a joke and a joke isn't a joke. The movie is about the government doing it, because it's a joke, and the film isn't a joke."
98,95,"I think that this video was really nice. I read the title and thought it was funny, but it's so sad. It is really funny, and I think this is a funny joke."
101,95,"Wearing masks does not help in stopping the virus, it's useless and I hate it."
