sender,receiver,message
78,58,I think the idea that the ACA is a joke is a joke. The idea that people need to wear a mask is a joke. But it's a joke. It's a joke.
91,58,The US government is trying to tame the health care system.
94,58,Vaccination is a joke because the government isn't responsible for preventing the spread of HIV/AIDS.
97,58,"So, where are all these comments?"
101,58,"Wearing masks does not help in stopping the virus, it's useless and I hate it."
58,52,What is the point of the joke?
59,58,"It doesn't sound like a real joke, but it's a joke if it's made."
61,58,If people don't want to go to the CDC to get vaccines and not get vaccinated by a doctor they are going to have to pay for a fucking bus trip for a fucking man who has to travel to a doctor. Having to pay for a fucking man to have a fucking narcissist is not going to help. You have no choice but to say this.
73,58,A lot of people are already talking about Obama in this thread.
78,58,CANNOTANSWER AND A HASHER OF A JOHN
91,58,That is why the NRA is suing the health care reform movement.
94,58,"I do not know much about this subject, but I would say that the CDC is attempting to get a job in helping the people on the list in 'i want to stop the spread of the virus'. Vaccination is what a doctor thinks is the best way to stop the spread of the virus. There is no reason a doctor should have to stop the spread of the virus. I would also suggest the US not be involved in such a thing (I don't think that anyone should be in that situation)."
97,58,"Its a joke, not a joke. There isn't a joke, it's a joke. The point is that you could be racist, but you don't have to be racist to be a racist. Its a joke."
101,58,"Wearing masks does not help in stopping the virus, it's useless and I hate it."
58,52,This isn't a joke. It's a joke.
59,58,CANNOTANSWER (https://www.ny.gov/research/articles/frank_doe_mom_advice_to_make_a_decision_to_fix_the_discrimination)](https://www.ny.gov/research/articles/frank_discrimination_discrimination))
61,58,The CDC and NRA aren't really responsible for the ACA.
73,58,"The guy's using a phrase 'fuck I don't want to feel this way' too much. It's a joke, if he is just trying to talk about how the EPA is trying to pass a law to prohibit the wearing of masks. The whole thing seems like a little sexist, but I don't think it's. The whole thing seems a little sexist, but I don't think it's. The whole thing seems a little sexist, but I'd like to go to talk about"
78,58,> I'm a huge fan of the ACA. The ACA was repealed because there was no medical exemption to AIDS.
91,58,The article is about how the US government is trying to help protect people from viruses. I'm just saying it's been two years since the article was published. [This isn't actually the headline for the article.
94,58,"I like this and I'm sorry that it's a joke. Vaccination is not a joke, it's a joke because it's the government's job to prevent the spread of the virus."
97,58,"It isn't racist to say ""What if the president made a joke about a man who looks a lot like a president? Is he racist?"" ((((((((((((((((((((((((((((((((((((((((((((((((((((((((((((((((((((((((((((((((((((((((("
101,58,"Wearing masks does not help in stopping the virus, it's useless and I hate it."
58,52,"If the person who wrote the article is doing their own research on the issue, and there aren't any other evidence that it's an issue, they should not be suing the CDC and NRA for it."
59,58,> The only reason the school put on the mask is because it doesn't make a difference is that the school would likely not have the money to get a hat on.
61,58,The ACA and the CDC are not responsible for the actual ACA repeal. They're not supposed to make a joke about any of the issues listed above.
73,58,The point is that it's a joke and not a joke.
78,58,It was a joke. And the ACA was repealed because there was no medical exemption to AIDS. The ACA is not a joke. It's just a joke. It's a joke. I can't even imagine how many people would not get a better job because of it.
91,58,CANNOTANSWER: 'We are suing the US government to help stop the spread of a virus.
94,58,The best I could think of that was a guy wearing a mask every day. What is he getting at by putting a mask in your face?
97,58,"He's an old man who's been living his life as a human being and has gone on to become a president. He's a pretty decent guy with some good wit and respect for his country. He does have a lot of good people and is a good ad man who was a good guy and a great person. He's a great guy and a good guy. He's a good person, he's a good guy, a good guy, and the one that doesn't have good advice."
101,58,"Wearing masks does not help in stopping the virus, it's useless and I hate it."
58,52,"The fact that this is on the front page of a newspaper makes it almost seem like the article was about a joke that was written by a doctor - not a scientist, who was doing research on a serious, serious issue. I'm not the only one who said that it was a joke."
59,58,The ACA is not an illegal thing. The mask would be illegal.
61,58,">""We have no laws against wearing a mask in the US, but there are measures that could stop the spread of the HIV epidemic."
73,58,This is a joke about the government and its ability to protect people from the virus. They need to stop wearing them.
78,58,"You're being a sarcastic, pathetic, ill-mannered twitch. You're a joke."
91,58,This article is misleading. It doesn't mention the EPA or NRA's authority to change the health care system. It does mention a similar article in the other sections as well.
94,58,"I read that in a couple of different places and then I thought of what it was about the thing that was a joke. That part is so weird and funny that it just seems to be one of those things where it's about people doing their own research. And if it's anything like that, I would be okay with it."
97,58,"i think he's an ad man and a good guy. he's a good guy and a great guy, but he's just a hat guy and he's going to get a great deal more respect than the rest of us. I think he has something to say to that effect, something he doesn't. he may be a hat guy but there's no excuse for him to be a hat guy."
101,58,"Wearing masks does not help in stopping the virus, it's useless and I hate it."
58,52,A lot of people in the US aren't doctors or scientists.
59,58,"The mask is an opportunity to try and protect public health and save money. The ACA isn't an illegal thing. The CDC is trying to make it illegal, they need to have a mandate to make it illegal."
61,58,"Yes. If you look at the wikipedia article and you are referring to the TWitchCon in general, that's an excellent way to summarize what it is."
73,58,The CDC and the EPA have nothing to do with it.
78,58,"''The joke is just a joke. The idea that people need to wear a mask is a joke. It's just a joke. The only thing you can say is ""I don't think that's a joke. The only thing you can say is ""I don't think that's a joke. The only thing you can say is ""I don't think that's a joke."" ""If they are trying to get people to wear a mask, they would not have passed the ACA."" ""I'm not an expert on"
91,58,[NAME] sarcasm is a bit of a word. I'm not sure why you were so skeptical of the article.
94,58,I think a good thing that you like this is to get a good laugh from it.
97,58,"The first joke is wacky, so I'm sorry to say it hasn't been re-invented but it's still a joke. It doesn't change the fact that I'm from Georgia, so it doesn't have much to do with the entire series, it does have a lot to do with that."
101,58,"Wearing masks does not help in stopping the virus, it's useless and I hate it."
58,52,The government has no authority to make a hat a joke. It is a joke that is intended to give people the benefit of the doubt. It is not a joke. It is a joke.
59,58,“““(http://www.ny.gov/research/articles/frank_doe_mom_advice_to_make_a_decision_to_fix_the_discrimination](https://www.ny.gov/research/articles/frank_discrimination_discrimination_discrimination_discrimination_em)””””(https://www.ny.gov/research/articles/frank_discrimination_
61,58,>[NAME] [NAME] [NAME] [NAME] [NAME] [NAME] [NAME] [NAME] [NAME] [NAME] [NAME] [NAME] [NAME] [NAME] [NAME] [NAME] [NAME] [NAME] [NAME] [NAME] [NAME] [NAME] [NAME] [NAME] [NAME] [NAME] [NAME] [NAME] [NAME] [NAME]
73,58,The joke isn't about the EPA. It's about the EPA's ability to prevent the spread of the virus.
78,58,"> I don't know why they're not a joke. It's just a joke. It's a joke because it's a joke. The only thing you can say is ""I don't think that's a joke. The only thing you can say is ""I don't think that's a joke."" ""The only thing you can say is ""I don't think that's a joke. The only thing you can say is ""I don't think that's a joke."
91,58,[The NRA is suing the US government to stop the spread of a virus.
94,58,They say the masks are part of the measures deployed by the government to aid in stopping the spread of a virus.
97,58,“I love you. I love you.”
101,58,"Wearing masks does not help in stopping the virus, it's useless and I hate it."
58,52,>(https://www.ny.gov/research/articles/frank_discrimination_discrimination_discrimination_em)”””(https://www.ny.gov/research/articles/frank_discrimination_discrimination_discrimination_em)“(https://www.ny.gov/research/articles/frank_discrimination_discrimination_discrimination_discrimination_decrimination_dis
59,58,">It’s not a joke because it’s wrong, and it’s wrong. It’s also a good idea to make it a little more public. A lot of schools are swayed by the ACA."
61,58,"It's pretty obvious that the ACA is a joke. It's just one of those ridiculous things the CDC does and the NRA can't do. It is just a joke. It's just a joke, because this is a terrible one."
73,58,OP should probably go read a few more articles that the Obama administration is using as a joke in other posts. I have a favorite story. I’ve read one of the ones I love (as I did with that one) that tells this joke.
78,58,"The joke is about the ACA, the ACA isn't a joke, the joke is about why people are going to go on that vacation without wearing it."
91,58,Then the people of the world have a problem with your government.
94,58,Its a joke because of the CDC’s job to prevent the spread of AIDS and not because of their own research. They don’t have a job to prevent the spread of the virus. There’s a problem with it because they are not responsible for preventing the spread of the virus.
97,58,"r/poetry is a subreddit of white people from all backgrounds. I find the humor in that thread a little amusing, but very relatable."
101,58,"Wearing masks does not help in stopping the virus, it's useless and I hate it."
58,52,CANNOTANSWER: I think wearing a mask is a good idea to prevent the spread of a virus.
59,58,"CANNOTANSWER, who works as a psych specialist, believes that a joke is a joke because the government is a big corporation."
61,58,I really feel like this is the most important thing in my life.
73,58,I don't think this sub is funny at all because it's the most upvoted comment in the world.
78,58,"Yes, it's a joke. This is not a joke. It's a joke. It's a joke. It's not a joke. This is a joke."
91,58,"It's a good idea to get the EPA and NRA to work together to find a resolution to the health care system. Then again, '""Then the people of the world have a problem with your government."
94,58,"The word joke actually means that it's the most effective way to stop the spread of a virus. You know, the way I'm writing this is going to make my face look as if I was in the face of some sort of death threat."""
97,58,"I think r/poetry would get more attention in a positive light, as well as in a negative light."
101,58,"Wearing masks does not help in stopping the virus, it's useless and I hate it."
58,52,I'm a doctor. I'm going to a medical school soon.
59,58,"""I'm not defending the president's claim that he wore a mask to prevent the spread of a virus."
61,58,"""If I have to pay for a bus trip for a fucking man who has to travel to a doctor. Having to pay for a fucking man to have a narcissist is not going to help."","
73,58,I'm a lot more concerned about the political situation than the actual subject of the post.
78,58,It is a joke. A joke. A joke. A joke. A joke. A joke. A joke. A joke. A joke. A joke. A joke. A joke. A joke. A joke. A joke. A joke. A joke. A joke. A joke. A joke. A joke. A joke. A joke. A joke. A joke. A joke. A joke. A joke. A joke. A joke. A joke. A joke. A joke. A joke. A joke. A joke. A joke.
91,58,What is the point of the story?
94,58,A lot of people are just not comfortable being a doctor.
97,58,"""Is it racist to say this? I'm sorry but I can't take it."""
101,58,"Wearing masks does not help in stopping the virus, it's useless and I hate it."
58,52,"Those things are not a joke. They're a joke. They're a joke. They're a joke. And they don't actually have anything to do with that. It's a joke, like when someone is on the front page of a newspaper. And some people will write a funny joke about the government, or about any other problem. It's an art form."
59,58,"CANNOTANSWER: I feel like the only good thing about them is that they make people uncomfortable in their room, so it becomes like the ol''fucking shit....and I've always thought this is something that's a big deal."""
61,58,>the CDC and NRA aren't responsible for the ACA repeal.
73,58,He was clearly not a doctor and he never went into the EPA because of this. I wouldn't be surprised if the EPA did something like this.
78,58,You've been putting all of these points in your head too far. I don't think any of them are going to be retorts.
91,58,"CANNOTANSWER, aka ""[NAME]]"
94,58,"They're doing the right thing, it's a joke."
97,58,"""Hats and Masks"" is the most obvious joke on the internet to date."
101,58,"Wearing masks does not help in stopping the virus, it's useless and I hate it."
