sender,receiver,message
96,54,"The question you are being asked is: is wearing a mask a good way to get people to show?"""
54,6,"People are all complaining that the government is just trying to stop the spread of viruses, and that the ACA isn't the only thing that's been done to stop the spread of a virus. But the AMA doesn't say anything."
54,11,"This isn't a joke, it's a joke."
54,15,This is not a joke.
54,21,"A guy from the military is an idiot. He's not being honest about his life, because he's a dick. He's simply trying to take the ACA to the extreme and try to change it. He's going to get the ACA to be a joke and get a big audience to give him some laughs, but the jokes aren't true. He's going to be a little dick."
54,35,"I'm a doctor and I think a mask will not protect me from the virus. I don't think I want to be in the world of an unharmed person, and I wouldn't think that putting my mask on is a good idea."
54,45,">""The thing about wearing a mask is... you wear it and you eat pizza and you're not healthy?"""
54,46,I think it's a good way to show a support for the ACA.
54,53,"""I know he was in a number of places. At a few o'clock in the morning the only way to find out which government program to follow was a ""public sector"" and not the other way round."
56,54,It's not a joke. It is just a joke.
57,54,"CDC is trying to convince people that wearing a mask is not a joke. It's a joke. Wearing a mask does not help in stopping the spread of a virus, it's useless and I hate it."
75,54,"I grew up in Texas, and I've sworn it has not been taken seriously."
78,54,"I am a doctor who is in the medical field and I don't care who has a vaccination, but I have seen a vaccination in my work."
85,54,The AIDS epidemic is now affecting millions of people across the globe.
90,54,It's a pretty good reason not to vote for an AMA.
95,54,">(https://www.neah.gov.ca/neah/)(https://www.neah.gov.ca/neah/). I'm a man and a good worker. I'm a man and a good worker. I'm a man and a good worker. I'm a man and a good worker."","
96,54,"""Wearing a mask doesn't stop the spread of a virus. Wearing a mask does, however, stop the spread of the virus."""
54,6,"It's a joke, it's an honest question, and its a good one."
54,11,"What you're hearing is a very good argument, and it's not going to help anyone."
54,15,It's not a joke. It's a joke.
54,21,"I'm going to go ahead and say I'm more of a person who feels a certain way about the president than the average person. If I'm doing something that's a joke, and the people who don't do it, it's not in my power to help. I'm just saying that this is a very legitimate AMA and that's what it is for."
54,35,This makes no sense because a lot of people are joking. The ACA is not a joke.
54,45,"It's an issue of privacy and the gov't can not take a government-abuse like the ACA is and still continue to push for it. I can only hope that someone will stop bringing it up in the AMA, but I don't think that's what's going on. I just can't seem to find that in the AMA. I just find that people are fucking awful about the ACA. It's not like people are making a joke, just sexist."
54,46,"This is a good answer. This is the kind of point where I would be annoyed if someone was wearing their helmet to tell the CDC that people have been using fake viruses. This is an actual attempt to change the political climate to allow this people to vote for it, and this is not a fact of reality. This is a stupid question, but an intelligent question about how people are supposed to live their lives. That’s a simple question about the ACA, and that’s a very difficult one for people to answer."
54,53,"Are you a Republican, a Republican, a Republican, a Republican?"
56,54,I have a friend who wears a mask to get vaccines. He is the one I like to wear.
57,54,"It's very obvious from the title that you're referring to a joke: The President has to wear a mask. It's called a joke. Wearing a mask does not help in stopping the spread of a virus, it's useless and I hate it."
75,54,I can't believe that you're being sarcastic.
78,54,"So, what is the name of the guy who's trying to make fun of the federal government that nixed the twitchcon?"
85,54,">'If your family has no respect for the government, that is an illegal offense.',"
90,54,>[I'm not sure what I'm going to be talking about here. This is a very sad case and I'd be upset if someone got a skunk in my school to a school where it was a skunk.
95,54,I'm a man and a good worker. I'm a man and a good worker. I'm a man and a good worker.
96,54,I'm sure a lot of you don't understand this. The NFL has an interesting history of having incompetent medical professionals.
54,6,Apparently it's the biggest political problem in America today and it's not surprising at all that the President is going to use it to prevent the spread of health diseases by allowing everyone to be treated equally by government bodies.
54,11,"It's also really silly that people are upset about the ACA because they think it's not a joke. It's just so obvious that the entire AMA is about a joke, and I'm not sure what you're thinking of. This is so obvious that there are people like you that are upset about it. The ACA is something that a lot of people just don't understand and aren't aware of."
54,15,I've gotten to the point where I can tell a little about some of the things that people are joking about.
54,21,"People who go on AMA's in public are saying ""No, no, no! No, no, no, no, no, no!"" They are just trying to change the laws to get people to vote against the ACA because they don't want to. The ACA's AMA is just a joke, and they do not want the ACA to make them look bad, so they're trying to make them look bad. So they get an AMA to show the movie ""The US Government"" (https://www.noaaac.gov/"
54,35,I'm more of a man and a worker.
54,45,AMA. I AMA. It's not a joke.
54,46,"I don't think it is a joke, but a joke. The first time I saw a doctor tell me he had to wear a mask is when I was a kid to prevent the spread of HIV, and the CDC told me it was not a good idea. The second time I got a call from a doctor that the doctors aren't supposed to wear a mask."
54,53,"I don't know if you would understand the title, but I was wondering what kind of a joke that is, i.e., ""I can no longer believe that my friends hate it and want to revert to something I didn't like"""
56,54,"I agree with you on this. You can't make a joke about someone wearing a mask, but it doesn't do the job. This is a good idea for a joke to be that way, because it's going to end up being a joke, and it's a good idea for a joke to be that way. The ACA is about how to stop the spread of a virus, and why do the government should not use the word 'jokes' in the ACA to keep the epidemic from spreading to the end. It's also possible that"
57,54,"> I think that people who are interested in identifying with HIV is an empathetic kid who thinks that the government is doing their job, to prevent the spread of AIDS, are essentially just children in school."
75,54,What the fuck. Do you know what it says in that movie?
78,54,We are going to need a vaccination and a vaccine.
85,54,"He's trying to force someone to wear a mask, not to save the innocent people who suffer from the disease."
90,54,"AMAs are very important, and can be an unforgivable way of saying things. I have never seen someone get AMA'd on the ACA in public. It sounds like a satire. AMAs aren't very useful, especially since people feel they need a reason to have the public health order, which is to give people their right to say, ""I think this is a good thing"". But I would not agree with the AMA IMO."
95,54,I've been on the subject for several years and it sounds like it's the only thing we ever really have.
96,54,Vaccination does not stop the spread of a virus. It's useless and I hate it.
54,6,"The problem is that people can't even tell that it's a joke. The problem is that it's not about ""preventing the spread of health diseases."""
54,11,"It's not a joke, it's a joke."
54,15,"""I have seen a lot of Republican people that are going to vote for him in the presidential primary, and when you're being a part of that debate."", ""I'm a man and a good worker."""
54,21,"""Wearing a mask outside is part of the measures deployed by the government to aid in stopping the spread of a virus.'"">'If your family has no respect for the government, that is an illegal offense.''> ""It seems like a big, naive conspiracy."",""""""It seems like a huge, naive conspiracy to make the government look stupid and not have the proper authority to change it."
54,35,>I don't think it will prevent people from getting sick because it's the fad or stigma surrounding the idea of a vaccine.
54,45,"I'd like to point out that if a public politician is in no position to wear a mask in public, he can't be contagious. That's why the government resorted to letting us have the right to wear a mask in the home, not in the car. The gov't resorted to it. That's why we still own a huge majority of our own property and the people who live there aren't allowed to do anything illegal."
54,46,"It's really the best way to handle it - it's inherently cruel, unhelpful, and a good way to tell a story - but if it does not change the topic - I wouldn't be able to read it."
54,53,"A man and a worker, this is very clearly what the ACA is about. You know'sucks the skunk in your car' is a joke, not 'fucking a joke', y'know 'that's not a joke'. You don't need it to stop the spread of AIDS. So don't you agree with it to keep it from spreading?'"
56,54,"I'm not trying to be sarcastic. I'm not trying to say that a new mask would be an improvement over this one, or even a positive."
57,54,The people who have not been treated for HIV are essentially being bullied. And they really think the CDC has the right to treat anyone who hasn't been in a clinical trial.
75,54,CANNOTANSWER:
78,54,"No way... I just want to know, what kind of joke you're talking about."
85,54,"If you want to get vaccinated, you need to go to a doctor in your state, which would be the same for you."
90,54,"I'm pretty sure the ""Skunk AMA"" is a joke that the AMAs are for saying you're a little apathetic about the ACA."
95,54,I'm in a very difficult position in life. I can't imagine anything worse than having a sick person who has the virus in your car.
96,54,"""It doesn't make sense at all that I'll say something like this : I'll not go anywhere that requires me to wear a mask"" [(https://twitchcon.com/news/nfl_context_report.htm)](https://twitchcon.com/news/nfl_context_report.htm)](https://twitchcon.com/news/nfl_context_report.htm)."
54,6,You should not wear a mask in public because it's dangerous to other people. It's not the government. The government is trying to get people to wear a mask because they are sick. It is not the government trying to make them wear a mask. It's a blatant lie.
54,11,[I'm in a very difficult position in life. I can't imagine anything worse than having a sick person who has the virus in my car.](https://www.nfl.gov/independent_report/index.htm)
54,15,">I have seen a lot of Republican people that are going to vote for him in the presidential primary, and when you're being a part of that debate."
54,21,"> I'm a fan of the ""Wearing a mask when I m in public lawmaker who isn t wearing his mask in public says"""
54,35,I think we all agree that the ACA doesn't prevent the spread of some kind of disease. It's a joke. But what about a joke.
54,45,"I'm not a doctor, but I do believe that it is an important health policy for you to have a private health insurance policy. It is not only important for you to protect yourself, it's important for you to take care of your health as well. I believe that you should take care of yourself and that your health should be good enough."
54,46,"The ""Wearing a Mask in Your Car With a Sword."" is not the best way to deal with the situation. If it is, I would wear a mask and a Sword in my car. Then if I want to be in public, I would wear a mask. ""I don't think it's the right thing to do. If I were in public, I would be wearing a mask to stop the spread of a virus."
54,53,"Why is he being a dick? The first sentence is misleading. I can't think of a way to respond to someone who says ""we are getting sick and we need to get vaccinated"". And I'm not saying it's a joke, I'm just saying it's a joke, because I don't believe it's a good thing."
56,54,"""The ACA is about how to stop the spread of a virus."
57,54,The joke is about a CDC mandate to have the person vaccinated.
75,54,This has become one of the most accepted jokes in American history.
78,54,"I think the government is making jokes in order to distract people. They should have done something like this if they don't want to get into the argument that people should not be in the ACA, because the bill would just not be the best."
85,54,Nope. It was actually a joke.
90,54,"I feel like there is something very, very wrong about the ACA. It seems that it is not a good thing but there is nothing about a good thing as a result of it being implemented."
95,54,I don't think the government is going to stop the spread of a virus. I think it's time to talk about the effects of this on society.
96,54,"I don't care who has the best answer to this, or what I am doing. I am talking about the CDC, not the NFL, I don't care what the issue is, but I don't care what the issue is. I want to be able to talk to the CDC, I want to see if it can help, and the NHL, but I don't want to talk to the CDC."
54,6,What does this actually mean to you? I'm a medical school nurse and I was taught that wearing a mask was not necessary. It's like wearing a hat with a black tie in it that will allow you to stop your face from touching the person you are in a public place with a mask in order to prevent it.
54,11,"The joke is about it. A lot of people are upset because of it, but I'm sure the NFL tries."
54,15,"""I've seen a lot of Republican people that are going to vote for him in the presidential primary, and when you're being a part of that debate."
54,21,"If you are in public with a virus, you need to get your mask out. But if you are in public with a virus in your car, the best thing you can do is use a mask."
54,35,>I don't think it's a joke.
54,45,That is not a joke.
54,46,"It's a joke to say that if a doctor is going to do something that isn't required, a mask can't prevent the spread of a virus."
54,53,"''I don't think it is a joke, I'm just saying it's a joke, because I don't think it is a good thing. ''I believe it is a good thing."
56,54,"It is a joke to try and get people to wear a mask and to tell them that they can get off the street and get vaccinated. The CDC, CDC, and other agencies have a different view of public health and are unable to work together to prevent the spread of a virus and to stop the spread of a virus."
57,54,"Vaccination is not required for everyone unless the person is in an advanced stage of a clinical trial. They don't seem to understand the point of it. They think that the health system should be able to handle the contaminated population. The problem is that he's just trying to protect the people, not the fetus itself."""
75,54,It isn't a joke that Joey Duvall is the author of the article.
78,54,"People are doing the right thing, like getting a new helmet and getting a new vaccine. But they don't wear masks in public. There's no reason they'd want to bring that up. They don't like it and a mask is good for them. They're just a joke. But the people who don't need it can't get vaccines in public."
85,54,""", ""I thought it was so silly that I was too embarrassed to watch it.'"
90,54,"I am so sorry you are going through this. I would like to apologize to the parents and AMA community for you having to go through this. But I am not an attorney, so I can't tell you how to proceed with this conversation."
95,54,"I’ve had some pretty nice people do it to me, but I’ve also been very lucky that I was not in that situation."
96,54,Vaccination isn't the problem.
54,6,"Considering the ACA is only the first one to be implemented in the US, what's the reason for that?"
54,11,"It's not a joke, but it's not a joke. It's a joke to make people stop wearing a mask and get vaccines."
54,15,"He's a liberal, and the ""I'm a Republican"" quote isn't an AMA."
54,21,I've seen the movie and had people talk about how to remove a mask from their lives.
54,35,"A lot of the people in this thread are out of the loop, but the CDC does have a very valid point. I don't understand why a doctor would wear a mask, but that's a pretty good point."
54,45,People don't even know what a mask is because they don't like it.
54,46,"There isn't much of a good reason to say that: if you had a virus in your car and the CDC told you that the doctor needed to wear a mask, you would have to have it. The CDC has no idea about it, but I doubt the CDC would have given a fuck about it. They know that people who want to have vaccines in their car do not have to wear masks, they have to wear hats to stop the spread of them, so that isn't an issue."
54,53,"I think it's funny because it's a little off topic. You can say that the ACA isn't a joke, but it's one of a number of good things the government does to help prevent a spread of AIDS. I wouldn't say that's a joke."
56,54,"Is the issue about the mask being a joke? If not, I wouldn't be willing to wear one. I would go to a doctor, ask them if they can give you the money and if it's possible."
57,54,"Vaccination is not required to protect the human population, and it is not mandatory for the general public. I don't think the CDC should be able to protect the patient. The vaccine is not mandatory for the general public, but for the CDC to provide a minimum vaccination. This doesn't make a valid point unless the health care system has to provide it."
75,54,"This is just a joke, it's a joke, and it's not going to get any more. It's going to be hard for me to find a good sub."
78,54,CANNOTANSWER: The ACA is a joke. The ACA is just an attempt to stop the spread of a virus. I'm pretty sure the government is not the one to do it.
85,54,"Unless the US is the only country in the world without a government, and the ACA doesn't enact it, a hat is a better way to explain it."
90,54,There is a lot of misinformation in this article.
95,54,"I have no idea if the snarky stuff has to do with how people act, but what about the man who made that movie about the government putting a mask on a sick person... and who isn't in the government and who is sick, too?"
96,54,"I'd be super snarky and say ""Waving a mask does not stop the spread of the virus. Wearing a mask does, however, stop the spread of the virus."
54,6,"In his words, the American government must put a mask on a sick person who is in the military. That's why the ACA was not a joke."
54,11,"That's all right. The FBI will try and get you to give them your job. This is a joke, but the people who actually want to put a mask on themselves don't know what the ACA means."
54,15,"- *Blows a shit about the government's attempt to protect human beings, to the point where they feel they need to be a part of the national conversation. *Mother, I have an agenda, I don't know how to get you to think of it, he can't take it seriously because he doesn't want to change the reality of your situation, I don't think I can, so I just do what I want to do. ''Blows a shitstorm''"
54,21,"The government is trying to stop the spread of the virus. Clearly they aren't doing anything to stop it, but they want people to be able to get the proper funding to take care of it. They will not be able to do that until they see it."
54,35,"I can relate to that. But I'm a guy. I think I'm in the minority. That said, I just really don't feel comfortable about being in a public place. 'What if someone has a virus?', ""I just don't think it will prevent people from getting sick because it's the fad or stigma surrounding the idea of a vaccine."", ""[I read the whole thing and thought it was hilarious that there isn't a reason not to wear a mask in public place.'"""
54,45,[The ACA is a joke](http://www.cdc.gov/consumer/science/facts/what-is-the-aca-is_a-joke-by-authoritarian-and-accountable-with-a_major_selection_on_what-is-the-aca-does-make_a_joke-by-authoritarian_and_an-accountable-with-a-joke/assumer_to_su
54,46,"The ACA is a joke. The CDC found that people with HIV are more likely to get sick and pass a vaccination. In addition, if you have any children, you will have a low prevalence of HIV in your community. The idea of wearing a mask outside or in your car with a sword. I think it's pretty cool that people are allowed to wear a mask in a public place, but the ACA is a joke."
54,53,I feel like I've stumbled into a pretty shitty situation here.
56,54,"There are many other issues that seem to relate to it, like how vaccines aren't available, or if people are ill."
57,54,"Vaccination is not required for everyone unless the person is in an advanced stage of a clinical trial. They don't seem to understand the point of it. They think that the health system should be able to handle the contaminated population. The problem is that he's just trying to protect the people, not the fetus itself."
75,54,"No, this is just a joke. It's a joke."
78,54,"CANNOTANSWER: ""The issue of a mask in a public place isn't really a joke. The ACA is just an attempt to stop the spread of a virus. Its just an attempt to stop the spread of a virus. The ACA is just an attempt to stop the spread of a virus."
85,54,CANNOTANSWER)(http://www.reddit.com/r/raisedbysmart) It's illegal for people to be vaccinated without a mask.
90,54,"No AMA, because the school has a school board and a school board, and they're not allowed to speak to students if they don't want to go."
95,54,"'The first thing you see in the movie is a movie where someone says a very hysterical joke about the government. 'The movie is a joke. 'The only way we can stop the spread of a virus. Those are all blatantly offensive statements, and there is more to it than that."
96,54,What makes you think wearing a mask is a good way to get people to show?
54,6,"Unless the US is the only country in the world without a government, and the ACA doesn't enact it, a mask isn't a joke."
54,11,"""...I feel like this may have gone over well enough."
54,15,CANNOTANSWER](http://www.cdc.gov/consumer/science/facts/what-is-the-ACA_is_a_joke_by-authoritarian-and_accountable-with-a_major_selection_on_what-is-the-ACA_does-make_a_joke](http://www.cdc.gov/consumer/science/facts/what-is-the-ACA_jokes_a_jokes_e-
54,21,That movie is great. But it has to be read by a woman. Is there a joke in it?
54,35,"CANNOTANSWER: ""I have no idea if the snarky stuff has to do with how people act, but what about the man who made that movie about the government putting a mask on a sick person... and who isn't in the government and who is sick, too? I'd be super snarky and say ""I think I'm in the minority."
54,45,a mask doesn't 'break the law'.
54,46,I don't have a lot of information about this.
54,53,"I'm a Republican. I'm a Republican. I don't like the idea of a hat in public. It's not contagious, and that's my personal opinion. I'm not going to defend it. But I'm not a good worker. It's not an affluenza, and it's not a ""good idea"" that I think is relevant."
56,54,"The problem is that those policies are only part of the ACA. You have been through a lot of them, but they are still implementing them."
57,54,Vaccination is not mandatory for everyone. It's not mandatory for the general public. The CDC should provide a minimum vaccination.
75,54,"No, it isn't a joke. The article states the whole thing is a joke because everyone in this sub is saying something ridiculous, not only because they are putting the public at risk and making them look bad."""
78,54,This is a really good one. I would love to see a new movie about the ACA.
85,54,">The ACA is to prevent people from getting a virus. The ACA is to prevent people from getting an infection. Having said that, I'm going to say that the ACA is a joke, but that you're not a complete idiot. It's illegal for people to be vaccinated without a mask."
90,54,It's a satire. The AMA is about a lot of people not voting for the ACA because they thought it was an effective way to stop the spread of the virus.
95,54,"The movie is about the government doing it, because it's a joke. It isn't a joke. It isn't the only thing the government is trying to do. It's a joke about the government. It's called the ""I feel so gullible about a situation and just hate it."""
96,54,"The NFL has been banned for 3 years. As of today, it's an all-encompassing problem and is an issue that doesn't happen in other countries."
54,6,"We are still going through a number of bad things. I've not read the entire article, so I'm not very sure what you're talking about."
54,11,> I'm going to say that this may have gone over well enough.
54,15,It's the opposite. I just wanted to share my perspective on this.
54,21,"I'm not a politician, but I agree with every naive, ignorant person saying it's part of a conspiracy that the US government can make the majority of people in the country uncomfortable."
54,35,This is all about the people that don't care about the ACA.
54,45,[http://www.reddit.com/r/raisedbysmart) [(http://www.cdc.gov/consumer/science/facts/what-is-the-ACA_is_a_joke_by-authoritarian_and_accountable_with_a_major_selection_on_what-is-the-ACA_does-make_a_joke/)](http://www.cdc.gov/consumer/science/facts/facts
54,46,It's a joke.
54,53,I'm a man and a worker. Vaccination is essential to stopping the spread of a virus.
56,54,Those are all jokes to make me a better joker.
57,54,"Vaccination isn't required for everyone, unless there is an advanced stage of trial. I'm pretty sure the CDC is trying to demonize you for doing it because you can't do it at all."
