sender,receiver,message
56,44,"I think the point of the ACA is that you are a narcissist and in that case if you're not in the public eye, then you don't have any legitimate basis for being a narcissist."
60,44,"The story goes from what I've heard from the AMA, to the fact that the NRA is trying to make a new AMA for the president."
68,44,"It's the same issue as sexist jokes, it's just a joke."
93,44,"A nutjob joke is not a joke. It is a joke, it is a joke. I think it is better to just say no jokes."
97,44,/r/politics /advice/WomenAlwaysLikeMichaelHadniahNiahNiahNiahNiahNiahNiahNiahNiahNiahNiahNiahNiahNiahNiahNiahNiahNiahNiahNiahNiahNiahNiahN
44,27,">Hi, I just don't think the story is funny because it's a joke."
44,38,CANNOTANSWER](http://www.wikipedia.org/wiki/NamNiahNiahNiahNiahNiahNiahNiahNiahNiahNiahNiahNiahNiahNiahNiahNiahNiahNiahNiahNiahNiahNiahNiahNiah
56,44,"""Well, if you don't have a mask on, you can get a ticket to get vaccinated and get a ticket to not wearing a mask."""
60,44,>Is a mask part of the measures deployed by the government to aid in stopping the spread of a virus.
68,44,It's pretty much a joke. It’s about a common misconception that people who believe that wearing a mask is only a joke are using that as a cliche.
93,44,That's a very different way to describe the joke.
97,44,I don't care who makes the joke about the president. I'm blaming it on him.
44,27,"A guy with a virus on, but not a white male, has a mask to protect himself from all his friends with a virus."
44,38,[(http://www.wikipedia.org/wiki/NamNiahNiahNiahNiahNiahNiahNiahNiahNiahNiahNiahNiahNiahNiahNiahNiahNiahNiahNiahNiahNiahNiahNiahNiahNiah
56,44,Vaccination is not an insurance issue.
60,44,i think its a pretty funny thing for the nasa to have a joke about a vaccine?
68,44,"It's not a joke because people are using the phrase cliche, it's a joke."
93,44,What happened to the movie? How is that possible?
97,44,"In my mind, it was a joke."
44,27,It was about an ad to not have the disease.
44,38,[...is this the joke that they are trying to make a new AMA for the president.
56,44,I have a feeling that he is a jerk. I think the joke is that people can’t be in control of their health and have more protection when in danger.
60,44,"The whole AMA is a joke. The author is a journalist, and the AMA is not his sanity."
68,44,The article isn't funny. The article isn't funny because it's not funny. It's a joke because the article isn't funny.
93,44,I don't want to talk about the joke in this thread. I think you need to make a joke about the humor of the joke that he wears. I'm gonna start with you just saying that.
97,44,"""We have a right to have the choice of wearing a hat because it can be a nice way to hide. When they come to a doctor or hospital they have to tell them that it will help you protect yourself, because it will reduce your chance of becoming a victim. I think the whole joke is a hoax. HAHAHAHAHA..........."
44,27,"People like to call the joke racist and racist, but it's still a joke."
44,38,This is the first time I've ever thought about putting on a mask.
56,44,"They're talking about the ACA as a joke, not a joke. The CDC is a joke and the ACA is a joke."
60,44,I believe it is a prank. But I think they are just going to have to use it as an excuse for their inhumane behavior.
68,44,The article isn't funny because it's a joke. It's not funny because it's not funny. It's not funny because it's not funny. The article isn't funny because it's a joke.
93,44,This is the only thing that is true about the nutjob joke.
97,44,What’s the joke? Then what’s the point of a joke? It’s a joke.
44,27,A hat has nothing to do with the joke that a person has to wear in order to not have a virus.
44,38,"I'm not going to argue against this, but it seems like the NRA is being pretty anti-government. The whole article isn't funny because it's not funny."
56,44,I don't think they have done this.
60,44,A prank on the NRA is a joke. It's not just that it's a joke. It's that it's a joke.
68,44,[Meanwhile I am a federal employee. I am in the military and I do not work. I do not work.
93,44,A good idea? Do you know what a joke is?
97,44,ahh I mean uh-huh
44,27,What do you mean a joke?
44,38,This was a joke. I think I'm being facetious.
56,44,The CDC doesn't have any authority on the law of that country's health care. They aren't doing anything.
60,44,It's a joke. It is a joke. It is a joke. It is a joke. The joke isn't even funny because of the fact that it is a joke.
68,44,I've got to look up the joke. I want the best movie to be the only one that's funny.
93,44,"I’m a bit of a conservative, and I’ve always been a nutjob, but I really think that a nutjob joke is a very valid idea. But for this particular issue, I’m not sure it’s any more of a joke, that there are no such things as a nutjob joke."
97,44,"[The OP needs a lot of context to explain why he has a funny and not funny joke. The OP needs to explain why he is the hat guy and why he has a funny joke to say, because it does not help in stopping the spread of a virus."
44,27,'I don't think this is a joke. It's a joke.
44,38,"""They would think it would make people nervous when a virus gets raped by a government official."
56,44,"I don't get it, but there's one thing he said to me that I would actually read about the government's policy on preventing people from having a virus."
60,44,The only part of the article that doesn't get used is the fact that the article is about a joke about the government.
68,44,AMA with [Scott] C. A. Johnson is a very good piece.
93,44,Is 'Nutjob' a joke?
97,44,"As a guy, I understand that you can't take a joke that's racist, but I don't think you can take a joke that's not racist."
44,27,The article is a joke. It’s a joke.
44,38,"No, I don't think he's being facetious. Whether it's racist or not is a debate for a fact, not a specific opinion."
56,44,"“In other words, it sounds like the government is using that in a very big way.”"
60,44,Why are people trying to stop the government from making a joke about the government?
68,44,So... it's not a joke that the person who is trying to use it is being racist. Is the mask part of the mask that stops the spread of a virus?
93,44,There are no nutjobs. They are nutjobs.
97,44,CANNOTANSWER](http://www.wikipedia.org/wiki/NamNiahNiahNiahNiahNiahNiahNiahNiahNiahNiahNiahNiahNiahNiahNiahNiahNiahNiahNiahNiahNiahNiahNiahNiahNiahNiahN
44,27,'Nutjob' is a joke because it's a joke. It's a joke.
44,38,"I've seen the movies 'Men Who Shall Be - Black and His Family', 'We've seen a lot of movies starring Black and His Family', 'We've seen a lot of movies featuring Black and His Family'. A couple of them were made during the 90s. This movie had a lot of good stuff. I've seen a lot of good things, but the fact that the book was released before the 'Nutjob' movie (I'm an activist) really wasn't bad."
56,44,He's being funny. The President of the US has a good idea. He's clearly an idiot.
60,44,The AMA is not about the government. It is about the NRA and their AMA with C. A. Johnson.
68,44,"I'm not sure how the joke is relevant, but this is just the first of a bunch of sexist jokes."
93,44,"""I think it's better to say no jokes."
97,44,I think you should read some of the other posts here as well. I think you are assuming the people in this thread aren't going to read them.
44,27,It’s not a joke.
44,38,I just thought a few other comments would be good.
56,44,"> I sounded a little sore from it. I'm sure a few years of that show won't help. I would love to see a movie with a picture of the man who is a liar in the room, but he seems like a real jerk, because he's so uninterested."
60,44,"I think they've really got something wrong with it, it's just that it's a joke and it's not funny because they want to stop spreading a virus"
68,44,"AMA with [C.A. Johnson]: '""I don't think it's funny because it's a joke. I'm not sure what's the difference in the AMA?"
93,44,"I don't want to make it a joke, because there's a joke about a guy who's getting the virus, and then we know what it is."
97,44,"""'I'm a guy that wears a mask to protect him, so this isn't a joke."""
44,27,A lot of this is about the government's policy on a health policy and how it makes a nutjob a joke. I am not sure how I would feel if I were the president of the United States.
44,38,The NRA is just doing shit to get out the people who do it. And it's still a joke IMO.
56,44,CANNOTANSWER. The ACA is a joke.
60,44,They are a bunch of pricks trying to be funny.
68,44,"AMA is the next chapter in ""The President of America, AMA."""
93,44,"A lot of people will say it's a joke, but it's just a joke because it isn't a joke."
97,44,[a](http://www.wikipedia.org/wiki/NamNiahNiahNiahNiahNiahNiahNiahNiahNiahNiahNiahNiahNiahNiahNiahNiahNiahNiahNiahNiahNiahNiahNiahNiahNiahNiahNia
44,27,"""It's a joke."
44,38,"I've heard of a bunch of people who want to wear masks, and it's kind of hard to tell how they feel about 'it's a joke.'"
56,44,"The ACA has a lot to do with that. They are ineffective in getting everyone to wear the mask. It is ineffective at keeping people from having HIV. It's a joke that was blown into the ground by the public's attention, and it's not going to be the best tool to stop a virus. It was a prank in the 80's, not just a joke."
60,44,I don't believe the AMA has a point about the CDC. It's about what is a joke and what is not.
68,44,"""[I'm sorry but I don't think it's funny. I'm just saying the fact that he said it's funny that he said it's funny that he is wearing a mask to protect himself would have a negative impact on the health of the person who's wearing the mask."""
93,44,"""If you want to be a republican, you just need to be a republican."""
97,44,The fact that he would tell that is the best way to show that he was on to a hat.
44,27,'Welcome to the US and we will be here for you. Please.
44,38,I feel like some people are just making a joke.
56,44,"I wouldn't be upset if I didn't wear a mask, but then I'd just get off my bike and go to the doctor."
60,44,"[This guy is a joke. The point of the article isn't that it's funny, but that it's a joke. The point of the article isn't that it's funny, but that it's a joke. The point of the article isn't that it's funny, but that it's a joke. The point of the article isn't that it's funny, but that it's a joke."
68,44,"As a lawyer, I have a lot of questions about what the President is doing for the first time:"
93,44,"No, I don’t want to say a joke about the joke, but I do want to say that the joke is a joke. That’s not even an ad hominem."
97,44,slam dunk.
44,27,"This is an issue of sarcasm, because sarcasm is a matter of opinion."
44,38,"A few of the points I’m making are still valid, and I think you’ve got a point. The entire point of the article is that it’s a joke. The point of the article isn’t that it’s funny, but that it’s a joke. The point of the article isn’t that it’s funny, but that it’s a joke. The point of the article isn’t that it’s funny, but that it’s a joke. The point of the article is that it’s just a joke. The"
56,44,"The CDC and the government do nothing about it, just don't act in the name of protecting people who don't wear a mask."
60,44,I think the AMA's are really interesting to me. It's also interesting to me that a lot of medical professionals are very uncomfortable about the concept of a mask in public. Some of those people have been trying to keep the government from letting it bother them for years. The only reason the article was written was because people are not joking around in front of people. I think this article is pretty funny. I think the story is really interesting and I think the article has the most credibility and relevance among medical professionals. It's also very interesting to learn some of the authors who work with people
68,44,The article isn't funny because it's a joke. It's funny because it's about the fact that the guy in the mask isn't wearing a mask to protect himself. It's not funny because it's not funny because it's a joke.
93,44,"I like to think of that one a bit, I think you’re right and you’re not a bit ad hominem."
97,44,"... ""[...I don’t understand why people like being a joke..."","
44,27,I’ve read this article twice in one day. It had some very interesting stuff.
44,38,You may be wondering what that one is about. But it doesn’t actually seem like an actual joke in the AMA.
56,44,"...and if you wear a mask outside or in your car alone it does not help in stopping the spread of a virus,"
60,44,"The most interesting part of the article is the fact that it's a joke, and the reason the AMA has a positive image is that it's funny because the AMA is about the government's goal to prevent the spread of viruses."
68,44,"I love these people, they're all pretty good. They’re all very interesting, funny, funny, funny, funny."
93,44,It sounds like the joke is going to get rid of the joke.
97,44,... and you're assuming that the people in this thread aren't going to read them.
44,27,AMA..and if you don't see it now. It's a joke if it doesn't happen.
44,38,"They need to get rid of that and get out of it. I think they're being facetious. Regardless, it sounds like they're just being a joke. I think the article is pretty funny, but I'm just saying it's not funny because it's a joke."
56,44,This is why there are so many people in the US that don't wear masks when they are sick. And what we need is something about a mask.
60,44,It's not a joke to make fun of. It's a joke.
68,44,"They are in the minority, it's a joke, and they're not the minority."
93,44,“We need to put some of the sexist jokes on for people to wear... And we need to make sure people are wearing them because the other guy isn’t wearing them.”
97,44,"""I'm going to take one hat for the president, and one for himself, and I will make a joke about it."","
44,27,I don't think a joke is funny because it is about how the government treats people.
44,38,"[...I'm not a nutjob, I am an activist. I am an activist. I am a nutjob. The truth is that a lot of things I have seen to be sexist are sexist."
56,44,"It's a joke. Because it's a joke. If it's an actual joke, it is a joke."
60,44,No one was making fun of the Obama AMA. No one was joking about it.
68,44,"It's not just a joke, it's a joke that's actually going on and will likely happen in the future."
93,44,"CANNOTANSWER - ""A good idea? Do you know what a joke is?', ""I think it’s better to say no jokes.'"", ""No, I don’t want to say a joke about the joke, but I do want to say that the joke is a joke because it’s wrong. It’s a joke because it’s wrong. It’s a joke because it’s wrong. It’s a joke because it’s wrong."
97,44,"****, [(http://www.wikipedia.org/wiki/NamNiahNiahNiahNiahNiahNiahNiahNiahNiahNiahNiahNiahNiahNiahNiahNiahNiahNiahNiahNiahNiahNiahNiahNiahNiahNiahN"
44,27,I think the article is a joke because it's a joke.
44,38,"I'm trying to tell you that these things aren't about sex, they're about not having people make a joke about the NRA, which is a joke."
56,44,"i have been trying to get the CDC to do something about it, but i’m still not sure how to proceed"
60,44,"It's just one part of the whole thing. It is so much more than just the ACA, and it's the only part of that that it makes it seem to be a joke."
68,44,"The problem with this is that it's not being funny, a joke, and it's being funny."
93,44,"As a former Republican, I'd say it's more like saying ""no, but I don't want to make it a joke because it's wrong."""
97,44,"It's the same joke we know isn't funny. But I think it's funny because it's the same joke as when it's just a joke, and makes people feel silly."
44,27,"a nutjob is a joke because he is a joke, and because he has a problem with sex and not just about the government he doesn't know how to do it"
44,38,The whole article is a joke.
56,44,I think the joke is being made by the CDC. It doesn't make any sense.
60,44,"A lot of the comments seem to be talking about the AMA as a joke. The ones about the NRA seem to be about the AMA, and that's where you get most of the humor."
68,44,"The article isn't funny, because it's about the fact that the guy in the mask isn't wearing a mask to protect himself."
93,44,I'd say no jokes because it makes the joke more real. I'd say it's better to just say no jokes.
97,44,I just learned how to say no.
44,27,What do you mean by joke? Because the article is being made by the CDC. It is an article about how the government treats people.
44,38,The entire article is a joke.
56,44,ACA is a joke.
60,44,"""The first part of the article is that this is the joke."
68,44,I'm going to put that one in the title but I don't know how it's going to go in any context.
93,44,">The whole thing isn't a joke, and it makes it a joke."
97,44,I haven't been in a long time with anyone who says I hate it.
44,27,"'A guy with a virus on, but not a white male, has a mask to protect himself from all his friends with a virus.'"
44,38,">I don't think it's funny. It’s funny because it’s the same joke as when it’s just a joke, and makes people feel silly."
56,44,"“Oh, if you wear a mask outside or in your car alone is part of the measures deployed by the government to aid in stopping the spread of a virus.’”"
60,44,That's not a joke. It's a joke. The joke is a joke.
68,44,I don't understand what they are trying to say.
93,44,"I mean, I know ''Nutjob joke'' is a joke. It's a joke because it's wrong. It's a joke because it's wrong."
97,44,I'm actually quite confused by that one.
44,27,The whole joke is about how the government treats people.
44,38,"I don't see how people think of it as a joke. The point is that it's a joke, but it's the point of the joke."
56,44,Vaccination is not an insurance issue. It is a joke.
60,44,I don't care what a joke is.
68,44,I don't like the comment about it or any of the other other comments.
93,44,"I’m trying to think of a reason why they would be able to 'come off as a nutjob' and a joke about what it means to be a republican, but that’s not what it means."
97,44,"I can understand what people feel about the joke because it is about racism, but I don't like the way it sounds. It's a joke, I don't even care what it's about."
44,27,''Something about a joke'' is a joke.
44,38,People are just making a joke. They have to get a lot of people to wear masks if they want to stop it.
56,44,"As a Republican who thinks a mask is a joke, I am going to say that I think that 'I think a mask is a joke' is a joke because it is a joke and the government is acting in a very sane way to help protect people from getting a virus."
60,44,"I've been going to a party with a lot of people who don't think a joke is funny. But I'm not a doctor, and I don't care what a joke is. I've been trying to get the idea down because of the media."
68,44,"[NAME] has told a very good story about a movie about a young woman with a mask who wanted to be vaccinated to protect herself, that was not funny, but it's a satire."
93,44,"A lot of people like to call a joke a joke, but that's not the joke that actually counts."
97,44,"It's a joke about the person putting on the mask, that he hates the idea of wearing a mask, because he thinks it's stupid. But he hates the notion of being in a position to use the word ""joke"" as an adjective, and that makes it less offensive."
