sender,receiver,message
59,58,I'm a psychosurgeon who studies the role of the brain as a factor in preventing health problems. So this is a joke in the light of it.
61,58,What would the people who went to TWitchCon like to do if they had the opportunity?
73,58,"They're not really a joke, they are just making fun of Obama."
78,58,">How does the mask make his breath come out of the back of his head?', 'The other one is based off a joke. OP, I wonder how many people in the United States wear masks at work.', 'The other one is based off a joke. '"
91,58,"It sounds like a really good AMA, the NRA is really just trying to make people think of the dangers of having to wear a mask."
94,58,It's a joke. We're all in the military.
97,58,"I feel as if the jokes and the other stuff are the same. The problem isn't the jokes, it's the fact that they are the same thing."
101,58,"Wearing masks does not help in stopping the virus, it's useless and I hate it."
58,52,"As a person who was in the military, I can tell you they are going to wear a mask in order to help stop the spread of a virus."
59,58,I'm from California and I don't think it's fair for the CDC to make this joke because a lot of them are a big problem and a lot of people think it's hilarious.
61,58,I’m going to say that I don’t think I could get a vaccinated person to go to a TWitchCon and wear a mask.
73,58,I think the EPA is doing a good job of getting people to get vaccinated. The CDC is putting out a series of fake news about people having trouble breathing because of the 'complimentary illness' that has spread recently.
78,58,ACA doesn't prevent the spread of AIDS. ACA is an attempt to prevent it.
91,58,"No ad hominem has ever referred to the NRA as a terrorist organization. The NRA is one of the main lobbies to end the government's funding of drug use and education in the US. It is trying to make it clear the NRA is the terrorist organization. They are trying to change the health care system, a tame the government. ""But that’s probably why it’s a big problem."
94,58,"Yes, you're doing the right thing. It seems that if you're going to let it get in your head that it can't be done to stop the spread of the virus, it doesn't matter if it's really a joke or a joke, it just isn't."
97,58,"It's called a ""jay joke"". If it's any consolation it's always that guy who says ""The President is not racist"" and makes a joke."
101,58,"Wearing masks does not help in stopping the virus, it's useless and I hate it."
58,52,"CANNOTANSWER [NAME] in the military is talking about a joke in the military. He wants people to come in to talk about it, and he says it's a joke and they just don't want to be funny. He's gonna need a mask to stop his virus."
59,58,"> ""I feel like the only good thing about them is that they make people uncomfortable in their room, so it becomes like the ol''fucking shit....and I've always thought this is something that's a fucking joke."""
61,58,I don't really understand why people think that's the way it is.
73,58,This is the first time I have ever heard of a president who fucks with people. I'm going to say it:
78,58,Then you know a lot about what they're trying to get people to wear a mask. You can wear a mask and get it.
91,58,"The article says that the NRA is suing the health care reform movement and that this is a ""problem"" and not a ""problem."""
94,58,"So, the people that are wearing the mask and the people who are not wearing them are not the only ones who wear them?"
97,58,I feel like the one that makes the most sense for us would say something similar to the one I hear most of the time in r/poetry
101,58,"Wearing masks does not help in stopping the virus, it's useless and I hate it."
58,52,"Why do people say ""I'm wearing a mask to stop the spread of a virus""?"
59,58,In the article it says that the government isn't doing anything right by snooping on the problem with the public 'assholes' because it's not something that everyone is allowed to do. It is an effective measure of anti-vaccine in Texas. Wearing a mask isn't going to help combat the spread. They're not going to help combat the spread.
61,58,"It's the worst, the most hilarious, the best, and the worst joke I've ever seen."
73,58,You haven't heard of the joke. The article states that the EPA wants to shut down the EPA and stop people from wearing masks.
78,58,"In America, no matter where you live, people have the right to choose. It's a joke and not a joke."
91,58,CANNOTANSWER: I think the whole point of this is to make it very clear that the NRA is a terrorist organization.
94,58,I'm sure the people who wear a mask are more of the people that don't want to wear it.
97,58,I'm so tired of being joked and depressed over how the president is so clearly white.
101,58,"Wearing masks does not help in stopping the virus, it's useless and I hate it."
58,52,I think there are plenty of other articles of this sort.
59,58,I've seen all these bogus articles. I'd take it as evidence of a joke that's been made about the use of a mask in healthcare. This guy can't even get away with being in the news and the lack of a mask is probably the biggest red flag he's had.
61,58,"The ACA would have nothing to do with them allowing people to get to go to TWitchCon without their vaccinations. That said, it is important to consider that these types of restrictions are being used as a means of preventing this from happening. That isn't something that we should be talking about, and it doesn't have to be something that our own citizens or our government can't afford."
73,58,"if i were you, i'd stop writing this, just to have a chuckle"
78,58,What exactly does this joke really mean? It seems like it's a joke.
91,58,[Refused](http://www.fred.gov/fda/)
94,58,Vaccination is not a joke.
97,58,"This is not a joke. I'm just gonna make an important point about this: it's not going to make you feel good, it's going to make you look bad."
101,58,"Wearing masks does not help in stopping the virus, it's useless and I hate it."
58,52,I was in the military and this came up during my graduation party. I asked a question. She said her favorite part of it was that her husband and I had to be seated over the bald man so that he wouldn't talk about the health of her bald pal and make an honest conversation and try not to eat his bald pal because he was really tired of getting jokes. She told me that he thought the bald man might just have been a good r/police guy. I don't know how they would go about it. I didn't think
59,58,"I know that's not a good idea, but this is a joke that isn't in fact being made. This is just a joke that is a real lie."
61,58,"A lot of the problems mentioned in the article are 'I'm an affluent person who lives in the US' and not ""cannot have any kind of control over them. I don't think they can do it effectively'."
73,58,What's a joke?
78,58,Yes. The ACA was passed as a joke.
91,58,"""We are suing the US government to help stop the spread of a virus. The only way to make it work is to say I'm against the virus. But that I am not going to put up with the fact that the NRA hasn't made a good decision to sabotage the health care system."""
94,58,So there isn't a problem with this as much as there is with people who have been in the military.
97,58,"I had been trying to tell you what I've been told, but I did not get anything. I'm not sure what the joke was about. I'm just gonna give you the same answer."
101,58,"Wearing masks does not help in stopping the virus, it's useless and I hate it."
58,52,The first three parts have to be :
59,58,"I was going to ask why the state should be required to wear a mask in order to combat the spread of a virus. But it says that if you put it on, the public will be sick of it."
61,58,"The issue is that the CDC is not required to give birth at home and prevent them from having access to a healthy, HIV positive population. That's why they are doing it at TWitchcon."
73,58,I have a favorite story that's been on Netflix for a while.
78,58,CANNOTANSWER:... I think it's a joke because I'm a fan of the ACA and I am a fan of the ACA.
91,58,"It's a good idea to get the EPA and NRA to work together to find a resolution to a health care issue so that they can not incompetently impose the medical regulations that they use to combat HIV/AIDS, such as smoking, to prevent the spread of a serious disease."
94,58,"I am a doctor and I wear a mask almost every day, and I do not believe this guy is going to stop the spread of a virus. He is a prick."
97,58,"I feel like I'm going to have to tell you what I heard at the beginning of the video, but I can't really tell you what to think."
101,58,"Wearing masks does not help in stopping the virus, it's useless and I hate it."
58,52,CANNOTANSWER: I thought wearing a mask would stop the spread of a virus.
59,58,"I'd like to be clear and state that this is a joke, and that it isn't one."
61,58,You've said it before.
73,58,">I think that the Obama administration is a horrible person. What is the joke? Because ""the hat joke is about the guy who can't see, and is afraid of being raped."""
78,58,The ACA is just a joke. It's a joke.
91,58,"The NRA is trying to tame the US health care system. It's not a problem, it's a problem. The article isn't a joke."
94,58,I don't care if it's a joke. I'm sorry but the CDC doesn't have a 'career' to save me. They say a mask to prevent a 'risk' of a disease that doesn't have a specific effect on you that has no impact on your health. They're not going to have a 'comfortable' policy. Is there a reason why the NHL doesn't have a helmet?
97,58,This is all just a bunch of wacky jokes.
101,58,"Wearing masks does not help in stopping the virus, it's useless and I hate it."
58,52,I think it's a joke.
59,58,I'm a psychosurgeon. I've been in a similar situation. I went to a university and it was a good time to talk about my own health. The whole thing was a big deal and I'd never wanted to hear about it.
61,58,"No, I'm not going to go to TWitchCon without my vaccinated face on, I'm going to EMAX it."
73,58,>I think that the EPA is a horrible person.
78,58,"[I'm surprised it's actually a joke, given that I've never actually seen the movie](http://www.reddit.com/r/theadvice/context/dc/)"
91,58,I really don't understand why you have to read the article.
94,58,"What if I don't do anything oozing out? I don't need a mask. I don't have a helmet. I don't wear them, I wear them."
97,58,"It is a good idea to have the jokes and the funny jokes, not the people who are blatantly racist. But there are plenty of those jokes in this thread. You can't make a joke about anything. And they are all about what's wrong with the president. It's not about what's wrong with the president, but about what's not a joke."
101,58,"Wearing masks does not help in stopping the virus, it's useless and I hate it."
58,52,CANNOTANSWER is a doctor.
59,58,This isn't an AMA or a joke.
61,58,[NAME] [NAME] [NAME] [NAME] [NAME] [NAME] [NAME] [NAME] [NAME] [NAME] [NAME] [NAME] [NAME] [NAME] [NAME] [NAME] [NAME] [NAME] [NAME] [NAME] [NAME] [NAME] I think the point is that the CDC can and should be harmed and they're not responsible for it.
73,58,"The government is not the one that gets to decide who is safe, that is, the government is a troll. The government pranks on a lot of people, the whole purpose of the joke is to distract the people from the fact that there's a lot of stuff that actually matters. Getting sick isn't a joke."
78,58,"This is a troll post about something you probably want to avoid on the news. The guy at the news said it was a joke, he's a twitch and he would have no idea why you'd be so pissed if the ACA weren't passed. The guy he's talking to isn't sarcastic he's just pointing out that this isn't a joke."
91,58,"People can't get out of being friends with the NRA, because they have no rights whatsoever in their respective AMAs, the ones that show that they're not trying to help people, or the ones who have no responsibility. Then again, [the AMA is about how the government is trying to help the health care system, because the federal government isn't willing to help their patients and the people who don't want to get the help they need], '...It is a scumbag movie about how the government is trying to help people with a virus."
94,58,"Vaccination is not a joke. The CDC doesn't have a ""career"" to stop the spread of a virus. The government isn't responsible for preventing and cure the spread of a virus."
97,58,I don't think it is the whole point of the story. What a hoax. What a joke. I cant stand the jokes that they made about the president.
101,58,"Wearing masks does not help in stopping the virus, it's useless and I hate it."
58,52,"[Although this was an article on the issue that I posted about yesterday, it doesn't appear to be a joke.](http://www.reddit.com/r/theadvice/context/dc/)"
59,58,"I don't know if it's a joke. This is a good piece of information, and the AMA makes it sound like it's a really good joke."
61,58,This doesn't sound a joke. I've only seen people in that position say the government hasn't brought it up.
73,58,I just want to point out the problem with the ad - I know the joke isn't about the government.
78,58,"The one on one a doctor's first job is to prevent and prevent disease, but it also requires an occupational health certificate."
91,58,It sounds like the NRA and FDR have been in a very good relationship.
94,58,"> The thing is, the jokes are about people doing their own research. Vaccination is NOT mandatory. It's a joke that the government isn't responsible for preventing and cure the spread of a virus."
97,58,"I've written a pretty long book called ""How to prevent people from becoming a virus. Wearing a mask does not help in stopping the spread of a virus. Wearing a mask does not help in stopping the virus, it's useless and I hate it."
101,58,"Wearing masks does not help in stopping the virus, it's useless and I hate it."
58,52,"The idea of a mask and people using it as a disguise is not very appealing to the public. As for the CDC, I don't think they have anything to do with it and it isn't really relevant to a joke."
59,58,> ''The EPA isn't doing anything right by snooping on the problem with the public 'assholes' because it's not something that everyone is allowed to do.
61,58,"I'm not saying the government isn't responsible for the disease, but I don't think there is a single solution to this problem. The fact is, the mask was worn at the end of the conference, and I don't think there is a way for the CDC to do so, as a precaution, causing the government to violate its own rules by doing it on the CDC."
73,58,"“Hey, Obama. The EPA is not going to help us in the fight. And that is going to be an extremely racist joke. We’re going to go with this guy. We’ll just ban him from wearing it,”"
78,58,People in the US will wear masks all the time but the government isn't. That's how we learn. People who don't read the books don't understand the ACA.
91,58,"In order to avoid the public bringing up that the US government does not have authority to change the health care system, the article says that the NRA is trying to tame the US health care system. It is a ""problem"" and not a ""problem."""
94,58,"Vaccination is a joke. It's not a joke, but it's a joke because it's not supposed to work. I'm a doctor and I wear a mask every day, and it stops the spread of a virus."
97,58,Why the fuck does a white man need a hat? He's already done so.
101,58,"Wearing masks does not help in stopping the virus, it's useless and I hate it."
58,52,"> The thing is, the jokes are about people doing their own research. Vaccination is NOT mandatory. It's a joke that the government isn't responsible for preventing and cure the spread of a virus."
59,58,A mask to stop spreading a virus is no joke unless the government has a plan to stop the spread of it.
61,58,a lil tai tai.
73,58,It isn't a joke. It's a joke. It's a joke.
78,58,"I wouldn't worry about it, because it's going to be hard to get rid of it in this context. If this is a joke, i doubt there will ever be any controversy around it. I'm sure it will be an interesting one."
91,58,It sounds like the NRA is trying to tame the health care system.
94,58,I was a doctor once. I was able to stop the spread of a virus. I was the most effective way to prevent it. I was an expert in preventing a virus. I was in the same position for three years at the time.
97,58,"""The problem isn't the jokes, it's the fact that they are the same."""
101,58,"Wearing masks does not help in stopping the virus, it's useless and I hate it."
58,52,"I am not a doctor, and I also have no reason to say ""I thought wearing a mask would stop the spread of a virus."", ""What you said is what they said. "", ""Why do people say ""I think wearing a mask would stop the spread of a virus."" """
59,58,No one wants to wear a mask if there isn't a CDC AMA about it.
61,58,"""Well, I think we should be letting the government get involved with it, not 'doing something that is a joke'."""
73,58,"Yes, that is a joke."
78,58,''The idea that people need to wear a mask is a joke. The idea that people need to wear a mask is a joke.
91,58,The NRA is one of the main lobbies to end the government's funding of drug use and education. The NRA is one of the main lobbies to end the government's funding of drug use and education in the US.
94,58,Vaccination is a joke and not a joke.
97,58,"""I think a hat is a good idea to prevent people from becoming a virus"""
101,58,"Wearing masks does not help in stopping the virus, it's useless and I hate it."
58,52,"The fact that people use the term ""hi-hat"" in their post is actually quite ironic. As a doctor, I've heard the same thing and can tell you, ""The idea of a mask is not very appealing to the public."
59,58,CANNOTANSWER:
61,58,"If you go to the CDC, I wouldn't like to go to any of them without the vaccinating vaccine. I wouldn't mind the govt trying to ban it."
73,58,There isn't a joke here that makes a joke. It's a joke. It's a joke. It's a joke.
78,58,"I'm a big fan of the ACA, and I don't understand why the ACA wasn't repealed. That's why I don't know why I'm not an expert on it. It's an essentially insanity, but in the long run it's not a joke. It's not like there's anything they can do to make it work. It doesn't sound like the ACA is a joke. It's a joke."
91,58,"CANNOTANSWER: If people are bringing it up in a racially sensitive or biased way, they should make it known that the issue isn't the issue."
94,58,"In my case, the joke is about what is actually required to stop the spread of a virus."
97,58,So what if the president made a joke about a man who looks a lot like a president? Is he racist?
101,58,"Wearing masks does not help in stopping the virus, it's useless and I hate it."
58,52,CANNOTANSWER:
59,58,CANNOTANSWER:
61,58,The ACA is a joke. The CDC has zero control over the health care system.
73,58,"... I'm going to do this, too, at the EPA. It's a joke, but it's the joke of the day."
78,58,The whole movie is a joke. There are actually lots of people in the US that are not a fan of it.
91,58,The article doesn't say that a hat is no longer the most effective protection against a virus. The article says that wearing a mask is no longer the most effective protection against a virus.
94,58,"I've gotten a few flu shots so I don't need to be on my medical school or medical school. I do, though, have a sleeve in my mouth which covers up my clenched stomach, so I don't look like I'm going to have a virus. So I wear a mask every day in the case of a virus."
97,58,You are too young to really believe this
101,58,"Wearing masks does not help in stopping the virus, it's useless and I hate it."
58,52,This is why I don't think it's a joke. It's a joke. It's just a joke.
59,58,">I feel like the only good thing about them is that they make people uncomfortable in their room, so it becomes like the ol''fucking shit....and I've always thought this is something that's a fucking joke."""
61,58,It is a joke that the NRA is in no way responsible for the government promoting the vaccine.
73,58,I would be offended to hear the joke. The whole point of the joke is to show how sexist the Obama administration is.
78,58,[How does the mask make his breath come out of the back of his head.'](http://www.twitchcon.org/)
91,58,I'm not a lawyer but I'm going to disagree.
94,58,"What? There's no reason to go on the list of stupidities that the government does. It's not a joke, a joke, it's a joke."
97,58,I don't think it's racist. I'm not a racist. The joke is just a joke.
101,58,"Wearing masks does not help in stopping the virus, it's useless and I hate it."
58,52,"It has nothing to do with what's happening in the US, and it doesn't support any of the reasons the president has for using it for his own health."
59,58,So this is a joke. I'm saying it's a joke.
61,58,This is one of the reasons people like to make jokes about the government in their own country. People don't have to make fun of the govt.
73,58,"It's a joke, but it is a joke."
78,58,"It's ridiculous. If you don't know what it means to be a twitch, then I don't think you get it."
91,58,The guy is asking the right question: is the NRA a terrorist organization?
94,58,I thought it was just a joke. Vaccination is a joke because it's not a necessary thing. Vaccination is not a joke. It's a joke because it's a joke because it's the government's job to prevent the spread of a virus.
97,58,What is the point of a joke? It's just a joke.
101,58,"Wearing masks does not help in stopping the virus, it's useless and I hate it."
58,52,It is one of the reasons people like to make jokes about the government in their own country. People don't have to make fun of the govt.
59,58,[Nyc government](http://www.ny.gov/research/articles/frank_doe_mom_advice_to_make_a_decision_to_fix_the_discrimination](https://www.ny.gov/research/articles/frank_discrimination_discrimination)
61,58,Nope. A mask is not a joke because the government is promoting the disease.
73,58,People have already written up what you're talking about:
78,58,It's been so long that I'm not sure what this new trend would be about.
91,58,The article's a good one and I think a lot of the comments on it are a bit too specific and are not even relevant to the topic.
94,58,"If the CDC isn't responsible for preventing the spread of HIV/AIDS, then they aren't supposed to be responsible for it."
97,58,Is it racist to say the following:
101,58,"Wearing masks does not help in stopping the virus, it's useless and I hate it."
58,52,It's a joke. It's racist.
59,58,CANNOTANSWER ((https://www.ny.gov/research/articles/frank_doe_mom_advice_to_make_a_decision_to_fix_the_discrimination)](https://www.ny.gov/research/articles/frank_discrimination_discrimination))
61,58,There is also the fact that the CDC and NRA have no authority over the health care system. They have absolutely no authority to stop people from getting HIV positive if they want to.
73,58,"What's more interesting is that the EPA has been doing a series of snooping over it, which has led to a very bad reputation among the population. It's probably to help educate the people to avoid being snooped on, and it's to get them to stop being a joke."
78,58,This is a very common misunderstanding. People would do the same thing when they have no idea what they're talking about. People who don't really understand the ACA.
91,58,People are going to see it if they can understand what they're saying.
94,58,Vaccination is the joke.
97,58,The guy who wrote this joke is a racist.
101,58,"Wearing masks does not help in stopping the virus, it's useless and I hate it."
58,52,It's a joke. It's not just about the threat of HIV. It's about the fact that it's not even going to stop the spread of a virus.
59,58,>I'm not defending the president's claim that he wore a mask to prevent the spread of a virus.
61,58,i would also suggest going to a TWitchCon with a mask.
73,58,"There is a difference between ""Fake noodle"" and ""Fake-noodle""."
78,58,"This joke is in a satire of ""How does it make his breath come out of the back of his head""?"
91,58,I think the issue of the article is that the government is trying to tame the US health care system.
94,58,"It's not a joke because it's the government's job to prevent the spread of a virus, it's a joke because the government isn't responsible for preventing and treating the spread of a virus."
97,58,"The ""Hats and Masks"" are the new ones. They are also about a person who is not racist or has no sense of humor and has no sense of humor and does not think it would be racist to say something like: ""This isn't how crazy the President made the United States of America. It's not how crazy the President made the United States of America. It's not how crazy he made the United States of America. It's not about what's wrong with the President."
101,58,"Wearing masks does not help in stopping the virus, it's useless and I hate it."
58,52,"That's a really good one, I wouldn't say a lot of people are aware of that. There are a lot of things going on that people need to stop a viral infection."
59,58,"The only good thing about a mask is that it makes a lot of people uncomfortable in their room, so it becomes like the ol''fucking shit....and I've always thought this is something that's a big deal for sure."
61,58,I don't think any of the other 'pranks' people are making with that article are as serious as the original / /r/politics. I think a lot of the ones I'm reading are really fucked up / /r/politics. Especially since there are a lot of things I can't do to get the 'job done' //r/politics //r/politics and/or /r/politics/ or/r/politics //politics I'm writing about
73,58,CANNOTANSWER. Getting sick isn't a joke. It's a joke. The joke is not about the government. It's about the government.
