sender,receiver,message
75,54,I think the question is: does anyone have a joke about it?
78,54,"This is a really good one. I would love to see a new movie about the ACA. ''We all eve a mask at least once a year in our country, and a big part of it is the protection we give our children."
85,54,It's illegal for people to be vaccinated without a mask. It's illegal for people to be vaccinated without a mask.
90,54,>I am so sorry you are going through this.
95,54,"I think this is a lot of troll stuff, but what's a joke about? That's all snarky and a joke about the government. It's about the government doing it, because it's a joke about the government. It's called ""the only thing we ever really have."""
96,54,"I was not in the medical field at the time. I went there once for a 'Maze', and there are people out there who want to wear a mask for a game."
54,6,"Those are the comments that made the jokes so much better than the actual jokes. I've just said: 'I'm so sorry you are going through this. I think this is a lot of troll stuff, but what's a joke about? That's all snarky and a joke about the government. It's called ""the only thing we ever really have."""
54,11,"'We all eve a mask at least once a year in our country, and a big part of it is the protection we give our children. It's illegal for people to be vaccinated without a mask. It's illegal for people to be vaccinated without a mask."
54,15,This is what I wrote in order to get my perspective.
54,21,People get scared of the government that they can't make it out to the public. They can't make it out to the public. They can't make it out to the public.
54,35,"A lot of this is just an exaggeration from the ACA: 'I'm not stupid enough to think that wearing a mask in public places is a good idea, but I still don't think it will prevent people from getting sick, because it's the fad or stigma surrounding the idea of a vaccine.'"
54,45,"I'd like to point out that if a public politician is in no position to wear a mask in public, he can't be contagious. Because if the public does not like it, it's not contagious. Because if the public does not like it, it's not contagious."
54,46,I agree with you that wearing a mask is a joke. In fact I think I am quite aware that the ACA is a joke that people want to do so. The fact that people can't wear a mask on a day-to-day basis is an indication that some people are not really aware of the ACA.
54,53,"I don't think this is a joke. This is the one that really gets you off. The question is if you believe that the government is trying to get you off and if the government is doing anything other than ""reduce"" the government?"
56,54,"The whole thing comes down to ""Way to Get a Vaccination and get the ACA repealed?"" :)"
57,54,What if you go to college for a while and ask a doctor about the facts and try to explain the facts to him?
75,54,- The EPA is attempting to make it illegal for doctors to wear a mask.
78,54,I can't think of any jokes that seem more reasonable to the reader.
85,54,"It's a joke if people don't have a health insurance plan and if the president is in a mask, he's going to need a hat."
90,54,"I have to say the most important thing here is to understand that some of the things you write here are not true. If the AMA is about skunks then I think it is a satire, and I think it is really good."
95,54,The movie is about a joke that's about the government doing it.
96,54,"Vaccination is important for the spread of viruses, and not for the overall health of the country at large."
54,6,"'The Government is trying to get people to wear a mask because they are sick. It is not the government trying to make them wear a mask', 'The fact that a public politician is in no position to wear a mask in public, he can't be contagious. Because if the public does not like it, it's not contagious."
54,11,...The only way to stop it is to stop it.
54,15,((http://www.cdc.gov/consumer/science/facts/what-is-the-ACA_is_a_joke_by-authoritarian_and_accountable_with_a_major_selection_on_what-is_the-ACA_does_make_a_joke](http://www.cdc.gov/consumer/science/facts/what-is_the_ACA_does-a-jokes_report_s
54,21,"In my opinion, the ACA has always been about people being able to stop spreading the virus and have it spread, and in some ways it has not been a joke, and that is why it is now a joke, that a lot of people are already aware of, but don't want to get stomped on. Besides, I don't see how that is a big enough problem to be an issue if people don't actually know it is a joke, and that if they try to take it to a serious AMA's, they get one"
54,35,"It was a joke, but that's what I think it's a joke about."
54,45,"As someone who is in the medical field, I think that ""[Stanford's] is a really interesting read, and that the ""Measuring people have health coverage that's both preventable and contagious"" joke is the best way to get people to take their health care. Rather than being an ""abuse of the government"" thing, it's basically a ""measuring the people of the future"" joke, not an ""act of the government."""
54,46,"The ""It is just a joke that people want to do""."
54,53,What you're saying isn't a joke - you're a joke and the word you are using isn't a joke.
56,54,What the heck is going on with that one?
57,54,"Vaccination is not a joke, it is a necessity for the health care system to not cover the general population in its full potential."
75,54,"""The President and I are very serious about the importance of public health."""
78,54,"As someone who's been to TWitchCon, the first thing that came to my mind was the ""We don't know who who or how I'm going to get sick if my face is ripped open by the government."" /r/advice-disposition-disa"
85,54,"“If you want to get vaccinated, you need to go to a doctor in your state, which would be the same for you.’”"
90,54,I don't think we are talking about a conspiracy to make the government look stupid. I think a bit of the AMA is about the NRA trying to get the government to do everything they can to make sure the law is in place.
95,54,"I'm not a fan of the movie, but I'd like to..."
96,54,"Then you read the article as: ""The NHL has never been able to impose rules in the medical field, and every single organization in the US has ever been allowed to enforce these rules."
54,6,"I would think that the joke - and the AMA, i. e. the question of whether people like skunks and that ""You don't want to get stomped on"" are all a lot of people that are not a part of it."
54,11,The ACA was not a joke unless you actually read it.
54,15,"No. It's not a joke. It's a problem. ',"
54,21,"This is a joke for the Obama administration - but not for the ACA. It is a joke for the Obama administration, not for the ACA."
54,35,Having a skunk on your face is the worst joke in the history of the world.
54,45,"""...If a public politician is in no position to wear a mask in public, he can't be contagious. Because if the public does not like it, it's not contagious. Because if the public does not like it, it's not contagious. The only way to stop it is to stop it. """
54,46,It was the worst joke in the movie IMO. It has an interesting message.
54,53,My husband and I just went to the nhl convention. We were talking about vaccines. That is a really good idea.
56,54,"This is a troll. No, it isn't. This isn't just a joke."
57,54,What a joke. There isn't really much I could do but I do understand that it makes the general population feel better.
75,54,"Vaccination is a serious health issue, and it's not required by the government. They are trying to make it illegal. The article states the whole thing is a joke because everyone in this sub is saying something ridiculous, not only because they are putting the public at risk and making them look bad."
78,54,"I want to see the movie where Dr. White tells his friend, the guy with a face mask and he goes around wearing a mask is probably going to ask his friends to wear a mask if it's in public."
85,54,It was funny and kind of ironic.
90,54,"I do agree that it's a bad idea. It's a bad idea to tell people to ignore them, but what it means is that if they don't want to, they don't like it."
95,54,">[The reason that people are joking about the government is because it focuses on the government. You're doing a good job, not a bad job. You've been on the wrong side of the issue."
96,54,"You know, a lot of people who didn't know about vaccines aren't going to take a hit at the CDC and that is a crime. I don't really see what it is like to have a doctor's opinion, but a good question to ask."
54,6,You're a joke. There's no way to make a joke. I'm a joke. And that's a joke. The whole point of the ACA is to protect the public and help prevent the spread of a disease. It isn't a joke.
54,11,This was the best joke in the book.
54,15,Is that what the president did to try to prevent a virus spreading to people he doesn't know?
54,21,"I just watched the movie on Netflix once. The episode where he recites the question ""Why don't we just wear our masks? Because it's like we're pretending we're a bunch of idiots?""."
54,35,"I do agree that this isn't a joke, it's a joke. It was made to make the general population feel better."
54,45,"I'd be more concerned about the health insurance system, and that the government, specifically the Obama administration, is trying to push for the repeal of the ACA."
54,46,:) and the ACA is not illegal.
54,53,"I think there's a lot of confusion, it doesn't seem to be a joke. The title makes you feel smug. ""If you like that he doesn't think of what he wanted to do for the ACA, the EPA is attempting to do a better job."" ""But I don't think it's a joke, because I don't think it's a joke."""
56,54,"> The whole thing comes down to ""Way to Get a Vaccination and get the ACA repealed?"""
57,54,">What if you go to college for a while and ask a doctor about the facts and try to explain the facts to him?',"
75,54,"They haven't done anything about it yet, but they do want to get it to be a joke."
78,54,I'm not sure how a doctor would feel if a government mandated that them to wear a mask in public would help prevent the spread of a virus?
85,54,"The question is whether he is trying to convince anyone that a mask is stupid, but the notion of a mask is not true."
90,54,"""...the AMA isn't about the ACA. They are trying to get the government to do everything they can to make sure the law is in place."
95,54,"So in the US if we are in a situation where we don't know what is happening, I think we are a good job?"
96,54,That's exactly what we would do when we were players.
54,6,“Wearing a mask in my car alone”
54,11,"I'm sorry, I'm not even in your position. I'm going to say that this may have gone over well enough."
54,15,I don't understand what you mean /r/AskNJibs?
54,21,The president is trying to make people think that the ACA was a joke. The fact that the government wants to help a few people is a big part of the joke.
54,35,[See also: [NAME].
54,45,"A lot of things get confused, but when you take it from one person to another, you make the first statement, I'd say ""Fake, stupid, crazy"" and ""The whole thing comes down to ""Was the ACA a fad? It wasn't what the federal government wanted."""
54,46,I think this is just a joke he made.
54,53,Vaccination is essential to stopping the spread of a virus.
56,54,I don't see a problem with you saying 'I don't think it's a good idea' because it's a joke.
57,54,People should be ashamed of it. I think people should think about a CDC mandate and the other reasons people can't afford to get the vaccination.
75,54,"The article states the whole thing is a joke because everyone in this sub is saying something ridiculous, not only because they are putting the public at risk and making them look bad."
78,54,"So, I don't even get this remark."
85,54,"In the context of ''desperation for health care'', I think the ACA is not a joke."
90,54,"A very large group of people is involved with the NRA. It's a very good group, but we all disagree."
95,54,"IANAL: ""I love the movie, but this isn't the end of the world. It's a hush-hush hush. I'm a man and a good worker. I'm a man and a good worker."""
96,54,Vaccination is not a crime. It's a crime because some people have a virus but don't have access to vaccines.
54,6,The president is trying to make people think that the ACA was a joke. The CDC and the Obamacare administration are all in on this.
54,11,">I feel like this may have gone over well enough. I'm going to say that this may have gone over well enough. I don't even get this remark. In the context of ''desperation for health care'', I think the ACA is not a joke. The fact that the government wants to help a few people is a big part of the joke."
54,15,I would suggest rethinking that.
54,21,">What if you are in public with a virus in your car, the best thing you can do is use a mask."
54,35,"The problem with this is that the people in this thread are both snarky and do not understand the meaning of the word ""fad."""
54,45,"I'm a nurse and have heard of the phrase ""I wear a mask when I'm in public lawmaker who isn't wearing his mask in public says"" (''I've always heard the phrase. ""I wear a mask when I'm in public lawmaker who isn't wearing his mask in public says"")"
54,46,I am very confused. I don't get why people are asking if it's a joke. The person just told me that he did the right thing and that he wouldn't be able to do anything if they were doing anything.
54,53,"I mean, he said the ACA didn't help prevent the spread of HIV. I'd say he was trying to convince people that he was being a dick, but the idea of having to wear a mask while he was in the public sector was a bad one. So he got that admonished in that context?"
56,54,The problem is that the CDC is trying to do nothing about the problem of HIV/AIDS.
57,54,People say things like this in these subs.
75,54,"I sat down and read a bit and thought, I don't think you have ever been in a conversation about something that's not a joke. That's the point of the question: I'm going to take the question and take it to court."
78,54,That's an excellent line:
85,54,It's an attempt at being fair to other people. It's a joke.
90,54,I don't understand why the NRA has the power to put it in place. AMAs aren't meant to fix a problem.
95,54,"We've learned that we can't change the language to do so. We can change the language to make people aware of what the word ""virus"" is."
96,54,[What is the case with the NFL as an employer?](http://www.nfl.org/infra-concept): A helmet prevents the spread of a virus.
54,6,I'm not sure what the point of the joke is but to say that it's not a joke.
54,11,"A lot of people are upset about the ACA. A lot of people are not aware that the ACA was a joke. The government has nothing to do with the ACA. They aren't trying to be objective and there is no such thing as a joke. The government can't really change that, and isn't supposed to do something."
54,15,"I think it is a joke because they want to protect people. The issue isn't that a public health issue isn't a joke. It's that people don't have access to all the health care in the US, which in a large amount of cases, isn't. The problem is that the government doesn't want to protect people."
54,21,It's not a joke. It is a naive conspiracy theory. The government is trying to help people and is trying to make the ACA a joke. But you're probably not the only one who can see how it would go over well.
54,35,"There is a difference between a 'joke' and a ""joke"". It does not necessarily mean that it is a joke, but the opposite is a joke."
54,45,"""I don't understand why the NRA has the power to put it in place."
54,46,>If I were in the public eye I would be wearing a mask and a sword in my car.
54,53,The title is misleading. I've heard a lot of things about this issue.
56,54,"This is a good prank. The ACA is about how to prevent the spread of a virus. The CDC, CDC, and other agencies have a different view of public health and are unable to work together to prevent the spread of a virus."
57,54,"I don't want to insult anyone and the whole thing is an attempt to make me hate the whole thing, but it's worth noting that in the US, having to wear a mask for protection isn't a joke."
75,54,"Vaccination is a serious health issue, and it's not required by the government."
78,54,"The ACA is not a joke, but is a joke."
85,54,[PhD dissertation] [PhD dissertation] [PhD dissertation] (http://www.phd.noaaac.gov/wiki/RapCrypt.jpg) (http://www.noaaac.gov/wiki/RapCrypt.jpg) (http://www.noaaac.gov/wiki/RapCrypt.jpg) (http://www.noaaac.gov/pdf/RapCrypt.jpg]
90,54,"I would like to get the AMA on the ACA, but I don't want to get any comments from people about it."
95,54,"The hat is a joke, and the hat isn't a joke. It's a joke. That's why people think the government is a joke, but they are a little too snarky about it."
96,54,I don't really understand the point of the comment.
54,6,"[Sorry, I was on the internet for a long time, but that part still made my day](http://www.recoveryjournal.com/department/finance-infra/). I know where you are coming from and I am very familiar with the subject and it's my favorite."
54,11,"No. if you get sick, you do not have to wear a mask. It is more important than it is a joke."
54,15,"[Neah.gov/neah/](http://www.neah.gov/neah/)(http://www.neah.gov/neah/)(http://www.neah.gov/neah/)(http://www.neah.gov/neah/).', ""I don't understand why the NRA has the power to put it in place. AMAs aren't meant to"
54,21,: [http://www.noaaac.gov/wiki/RapCrypt.jpg] (http://www.noaaac.gov/wiki/RapCrypt.jpg) (http://www.noaaac.gov/wiki/RapCrypt.jpg)
54,35,"I'm pretty sure that you're making a joke, or at least trying to be fair, about the word ""vaccine"""
54,45,"I have seen these jokes before, but I just think that it's a joke."
54,46,"I was able to get a free test on a Sunday and it lasted the entire day. We had to wear masks. And the people that I knew were afraid to go to the hospital and got them were terrified to do it. Honestly, it was a joke, but I'm not sure why people don't want to know, just that I didn't understand."
54,53,CANNOTANSWER](https://www.noaaac.gov/infra-concept): A helmet prevents the spread of a virus.
56,54,"It’s probably not a joke at all, but it is a big joke about the fact that the government is unable to regulate the HIV/AIDS epidemic in some areas because they are afraid of being caught with the viruses."
57,54,> I'm really trying to get rid of that nonsense.
75,54,[The CDC is trying to make it illegal for doctors to wear a mask.](https://www.cdc.gov/health/st/cdc/cdc/index.html)
78,54,It's been 2 years since we've had a national joke!
85,54,It's a joke.
90,54,AMAs aren't intended to fix a problem. The AMA is just a bit of satire. The NRA is trying to get the government to do everything they can to make sure the law is in place.
95,54,The meme is just one of many jokes that are aimed at people that haven't heard it before.
96,54,"The NFL is a big business, and they have a great record for educating and training people about preventing spreading viruses."
54,6,"There are so many questions that people need to understand. One that might not be well-researched, but it's going to get worse, and will not get better. I have no idea what this is. I can't say for sure, but it's a joke."
54,11,A hat prevents the spread of a virus.
54,15,[Cannon](https://www.naaac.gov/neah/)(https://www.naaaac.gov/neah/)(https://www.naaac.gov/neah/)(http://www.naaac.gov/neah/)(http://www.naaac.gov/neah/)(http://www.naaac.gov/)(https://www.naa
54,21,The AMA is being directed by Senators who are attempting to change the US government's policies. The AMA is being directed at Senators who are trying to make a change to the US government's policy.
54,35,You said it in the wrong sub.
54,45,"I don't think people understand the meaning of the ACA - the term is actually used more as a means of spreading health information than it is to prevent spread of other diseases. As I understand it, this is an attempt to protect people from the risk of developing HIV/Asthma as the government tries to restrict it. I know the ACA doesn't apply to my state, but that was the first issue that came to my mind, because it's not what it is. It was not an attempt to control the spread of a viral infection."
54,46,In order to avoid an outbreak of HIV/AIDS you would need a mask. I personally feel that a mask is a better idea than one I would wear to combat a disease that is too dangerous to survive.
54,53,CANNOTANSWER](http://www.neaaac.gov/infra-concept): A helmet prevents the spread of a virus.
56,54,"I know it's not exactly a joke, but there is a lot of ambiguity about what that is, which is why it's a joke. The CDC doesn't want to be in the fight, and the CDC isn't. The ACA has been around since 2004."
57,54,"""We should make the kids wear a mask instead of a mask because the game is gonna be boring a lot more."""
75,54,It doesn't need to be a joke. It's a joke.
78,54,You're a joke. A joke is a joke. A joke is a joke. It's a joke. It's a joke. It's a joke. It's a joke.
85,54,[There's a broader conspiracy in the US which has been fueled by that idea].
90,54,"The AMA has been made about skunks, and the article says that it is ""not a bad idea"" because of people being outraged with the ACA."
95,54,I'm a fan of the 'If you're a guy and a good worker' comment.
96,54,"The NFL needs to implement rules to stop the spread of viruses that it is trying to get against the CDC. They are not going to be able to enforce any more rules, and the NHL doesn't have the money to enforce them."
54,6,"""I like the idea of wearing a mask in my car, but I really don't like how it fits my face. I can't say why it's a joke. It's a joke. The government needs to stop this problem. This is not a joke."
54,11,It isn't a joke.
54,15,"I see a lot of people in the comments who don't understand what a ""fucking"" joke is. That's what the AMA is all about."
54,21,"The movie is a joke, and I'm just saying that it sounds like it's going to get more attention, but it's going to come out on a lot of people."
54,35,"What's this? That is one of those ridiculously broad examples. A hat prevents the spread of viruses, a sick person can't eat shit in the body without being in public, a doctor can't even put his head out in the open. A hat helps prevent people from getting sick. There's more to the ACA than just a good idea."
54,45,a mask doesn't 'break the law'
54,46,It’s a joke and it isn’t a joke.
54,53,>'I don't think this is a joke''
56,54,- 'Bad idea'
57,54,The most common way to get a joke that is just a dick is to be the one that isn't the dick's gf.
75,54,[[Reddit](https://www.reddit.com/r/r/raisedbysmart) - the subreddit has over 8 million comments / subreddits that are purely based off the 'raisedbysmart' subreddit. It's an easy way to find the appropriate subreddits that are going to be able to answer all of them.
78,54,> I want to see a new movie about the ACA.
85,54,i agree that the problem isnt with the ACA.
90,54,The NRA needs to work on this and it won't work for everybody.
95,54,"A guy who can't speak the language of the word 'virus' or 'virus infection' can't do it. And a guy who can't be the same person can't be a pig, so he can't be a joke."
96,54,"Vaccination is a crime, and a crime, because it is illegal for the US to ban vaccination."
54,6,"I don't think this is a good idea. We are in the same boat, and the only problem is the CDC."
54,11,"If you're sick - I recommend your doctor to wear a mask to get your vaccine. It can help prevent the spread of viruses in people who don't get it. And if the vaccine won't help you with your health problems, the doctor may just be able to provide it to others without the mask."
54,15,This is a joke. It's not a joke.
54,21,So you're going to put a hat in your face?
54,35,"""I don't think this is a joke. I think it is a joke, but that's what I think it's a joke."""
54,45,"In this context, I don't think that a lot of the people in this subreddit have seen it."
54,46,> The most common way to get a joke that is just a dick is to be the one that isn't the dick's gf.
54,53,... I don't really get why he's not trying to do something right.
56,54,"[The government has done a lot of nonsense in order to keep the HIV epidemic from spreading, I'm going to say it's not a joke. Is it a joke? Then I think I'm being over-the-top. Is it a joke, and the CDC wants to repeal the ACA?"
57,54,A lot of people have told me that this is the worst fucking joke that's ever happened to the US.
75,54,CANNOTANSWER: [(https://www.reddit.com/r/raisedbysmart)](https://www.reddit.com/r/raisedbysmart) It says that Obamacare has a massive risk to the lives of people who are not in the system. It's basically just a joke because it's the government's job to stop the spread of a virus. It's not really a joke. They're not in the system to stop the spread of a virus.
78,54,A doctor who is in the medical field whose job it is to stop the spread of a virus is not a joke because he doesn't want to take it to the government or a government.
85,54,"The President is an idiot. The CDC found that people with an infection are more likely to get sick and pass a vaccination. In addition, if you have any children, you will have a low prevalence of HIV in your community. The idea of wearing a mask in a public place is a stupid but completely legitimate issue."
90,54,"There is a lot of misinformation in this article, but the whole thing seems to be just ""to make people feel like they are in a good place."""
95,54,"""I've listened to the movies a few times, and I haven't really been able to get over them in a long time. I know they're a little off. Mostly because I love to think about people, but I have to say the movies a little bit about how I'm a guy and a good worker."""
96,54,[(https://www.nhl.org/infra-concept):
