sender,receiver,message
95,1,if you wear a mask outside or in your car alone your gullible and submissive not traits you want to project
95,2,if you wear a mask outside or in your car alone your gullible and submissive not traits you want to project
95,14,if you wear a mask outside or in your car alone your gullible and submissive not traits you want to project
95,29,if you wear a mask outside or in your car alone your gullible and submissive not traits you want to project
95,31,if you wear a mask outside or in your car alone your gullible and submissive not traits you want to project
95,33,if you wear a mask outside or in your car alone your gullible and submissive not traits you want to project
95,43,if you wear a mask outside or in your car alone your gullible and submissive not traits you want to project
95,45,if you wear a mask outside or in your car alone your gullible and submissive not traits you want to project
95,50,if you wear a mask outside or in your car alone your gullible and submissive not traits you want to project
95,54,if you wear a mask outside or in your car alone your gullible and submissive not traits you want to project
95,62,if you wear a mask outside or in your car alone your gullible and submissive not traits you want to project
95,64,if you wear a mask outside or in your car alone your gullible and submissive not traits you want to project
95,76,if you wear a mask outside or in your car alone your gullible and submissive not traits you want to project
95,81,if you wear a mask outside or in your car alone your gullible and submissive not traits you want to project
98,95,see this is how crazy trump s made the united states of america if you want order in america president donald j trump must take off his mask and turn himself in oh and every day he doesn t people will die starting tonight i m a man of my word covid
101,95,"Wearing masks does not help in stopping the virus, it's useless and I hate it."
95,1,Wearing a mask outside or in your car alone is part of the measures deployed by the government to aid in stopping the spread of a virus.
95,2,"Nope, nope. The only way we can stop the spread of a virus is to put a shield on all the people that want to try to prevent it."
95,14,Wearing a mask outside or in your car alone your gullible and submissive not traits you want to project if you wear a mask outside or in your car alone your gullible and submissive not traits you want to project if you wear a mask outside or in your car alone your gullible and submissive not traits you want to project if you wear a mask outside or in your car alone your gullible and submissive not traits you want to project
95,29,Wearing a mask outside or in your car alone is part of the measures deployed by the government to aid in stopping the spread of a virus.
95,31,Wearing a mask outside or in your car alone your gullible and submissive not traits you want to project if you wear a mask outside or in your car alone your gullible and submissive not traits you want to project if you wear a mask outside or in your car alone your gullible and submissive not traits you want to project if you wear a mask outside or in your car alone your gullible and submissive not traits you want to project if you wear a mask outside or in your car alone your gull
95,33,Wearing a mask is part of the measures deployed by the government to aid in stopping the spread of a virus. If you wear a mask outside or in your car alone your gullible and submissive not traits you want to project if you wear a mask outside or in your car alone your gullible and submissive not traits you want to project if you wear a mask outside or in your car alone your gullible and submissive not traits you want to project if you wear a mask outside or in your car alone your gullible and
95,43,Wearing a mask is part of the measures deployed by the government to aid in stopping the spread of a virus.
95,45,I was really disappointed when I read this
95,50,Wearing a mask outside or in your car alone your gullible and submissive not traits you want to project if you wear a mask outside or in your car alone your gullible and submissive not traits you want to project if you wear a mask outside or in your car alone your gullible and submissive not traits you want to project if you wear a mask outside or in your car alone your gullible and submissive not traits you want to project if you wear a mask outside or in your car alone your gull
95,54,wear a mask outside or in your car alone your gullible and submissive not traits you want to project if you wear a mask outside or in your car alone your gullible and submissive not traits you want to project if you wear a mask outside or in your car alone your gullible and submissive not traits you want to project
95,62,"The way I see it is that when we wear a mask, we look like we're out there talking if the virus spreads."
95,64,Is wearing a mask part of the measures deployed by the government to aid in stopping the spread of a virus?
95,76,"i've read a little bit about this guy, and you may also like him."
95,81,Wearing a mask is part of the measures deployed by the government to aid in stopping the spread of a virus.
98,95,"I mean, if you want a country where people can't get the job, the government would have to go and remove your mask, a lot of people will get sick from that kind of stuff. Besides, if the president can get sick, he must go and get it off, and there are other options besides that."
101,95,"Wearing masks does not help in stopping the virus, it's useless and I hate it."
95,1,Wearing a mask is part of the measures deployed by the government to aid in stopping the spread of a virus.
95,2,I know a lot of people who don't know about this stuff and are a bit saddened by it. It's just a big part of the reason we haven't done anything to fix it.
95,14,"This is one of those stupidest petty and ridiculous facts of the year. If you have any idea how much that is a lie, ask to see it, just look it up. This is one of those things that we will all die from, but if you don't know it, then you don't know it."
95,29,Wearing a mask outside or in your car alone your gullible and submissive not traits you want to project if you wear a mask outside or in your car alone your gullible and submissive not traits you want to project if you wear a mask outside or in your car alone your gullible and submissive not traits you want to project if you wear a mask outside or in your car alone your gullible and submissive not traits you want to project if you wear a mask outside or in your car alone your gull
95,31,The only way to stop a virus is to put a shield on all the people that want to try to prevent it.
95,33,I'd like to project the statement Wearing a mask outside or in your car alone your gullible and submissive not traits you want to project if you wear a mask outside or in your car alone your gullible and submissive not traits you want to project if you wear a mask outside or in your car alone your gullible and submissive not traits you want to project
95,43,"The word for a virus is the idea of hiding, and we don't use it unless it's a virus. That's not a virus. It's the definition of being ""infective."""
95,45,Is wearing a mask part of the measures deployed by the government to aid in stopping the spread of a virus?
95,50,oh yeah that's a nice name and there are a lot of fucking ridiculous memes about it.
95,54,Wearing a mask outside or in your car alone your gullible and submissive not traits you want to project if you wear a mask outside or in your car alone your gullible and submissive not traits you want to project if you wear a mask outside or in your car alone your gullible and submissive not traits you want to project if you wear a mask outside or in your car alone your gullible and submissive not traits you want to project
95,62,Wearing a mask outside or in your car alone your gullible and submissive not traits you want to project if you wear a mask outside or in your car alone your gullible and submissive not traits you want to project
95,64,i read it in a different language than this one and it just sounds like this is going to be a lot more serious if it gets read.
95,76,Wearing a mask outside or in your car alone your gullible and submissive not traits you want to project if you wear a mask outside or in your car alone your gullible and submissive not traits you want to project if you wear a mask outside or in your car alone your gullible and submissive not traits you want to project if you wear a mask outside or in your car alone your gullible and submissive not traits you want to project if you wear a mask outside or in your car alone your gull
95,81,The only way we can stop the spread of a virus is to put a shield on all the people that want to try to prevent it.
98,95,"And the mask would be part of a sex act. The mask is supposed to protect his head from the air, and helps prevent a terrorist attack on him. It's not a sex act."
101,95,"Wearing masks does not help in stopping the virus, it's useless and I hate it."
95,1,"The article states that it is part of the measures deployed by the government to aid in stopping the spread of a virus. Besides, if the president can get sick, he must go and get it off, and there are other options besides that."
95,2,Wearing a mask in your car alone is not a crime.
95,14,This is why we are afraid to ask the other guy to come to us to try to fix it.
95,29,wearing a mask outside or in your car alone your gullible and submissive not traits you want to project if you wear a mask outside or in your car alone your gullible and submissive not traits you want to project
95,31,if you wear a mask outside or in your car alone your gullible and submissive not traits you want to project if you wear a mask outside or in your car alone your gullible and submissive not traits you want to project if you wear a mask outside or in your car alone your gullible and submissive not traits you want to project if you wear a mask outside or in your car alone your gullible and submissive not traits you want to project if you wear a mask outside or in your car alone your 
95,33,"Getting a job and not a mask is one of the key to being a successful worker. The best way to help you get a job is to be a good worker. You know, at the most basic level."
95,43,"The best part is that the definition of ""infective"" comes from the word ""feeting"", which is that it's part of a sex act."
95,45,"In order for people to get sick, they must wear a mask. In this context, he should wear a mask outside or in his car, where a doctor is on duty for a day. He should always put one on the driver's seat so the doctor can see the person."
95,50,>Is wearing a mask part of the measures deployed by the government to aid in stopping the spread of a virus.
95,54,"I read the whole thing and thought it was hilarious that there isn't a reason not to wear a mask outside or in your car unless you are a terrorist. I don't think they think it is the same as not wearing a mask outside or in your car, it's not the same thing as putting a mask on a person."
95,62,I read the title from a text book and I got like one shit-up-on-textbook a few years ago... I was really shocked when it came out! I couldn't really imagine how different I would have to be if the idea was that I was in the car but my boyfriend had a rat in his car that we'd keep looking at when we were on a road trip. He wanted to see if the road was a road trip and I wasn't convinced we were being a rat in the middle of the highway. We didn't
95,64,"Wearing a mask outside or in your car alone is a really dangerous thing. And I think you're right, there are some people out there that don't have a sense of humor. But, the government is not willing to admit that their behavior is wrong or a good thing."
95,76,"So what if the man on the street was not the only person that needed a mask in order to avoid getting sick, and the guy had a sex act with the other guys, that's what a fake mask is for. That's just a joke."
95,81,a big part of the reason we haven't done anything to fix it.
98,95,"As a young woman, I thought it was hilarious."
101,95,"Wearing masks does not help in stopping the virus, it's useless and I hate it."
95,1,No. We should just stop wearing the mask outside when it's not needed and then use it to block out people in the vehicle from getting sick.
95,2,"You have to wear a mask to prevent a virus from getting in your car. I don't think that's a crime, that's just a joke."
95,14,The wiki article states that it is part of the measures deployed by the government to aid in stopping the spread of a virus. Wearing a mask outside or in your car alone your gullible and submissive not traits you want to project if you wear a mask outside or in your car alone your gullible and submissive not traits you want to project if you wear a mask outside or in your car alone your gullible and submissive not traits you want to project if you wear a mask outside or in your car alone your gullible
95,29,"The only way we can stop the spread of a virus is to put a shield on all the people that want to try to prevent it. And the mask is supposed to protect his head from the air, and helps prevent a terrorist attack on him. It's not a sex act."
95,31,"OP, you need to get a job."
95,33,I see a lot of humor in this article.
95,43,[The government is not willing to admit that their behavior is wrong or a good thing].
95,45,"The only way we can stop the spread of a virus is to put a shield on all the people that want to try to prevent it. And the mask is supposed to protect his head from the air, and helps prevent a terrorist attack on him. It's not a sex act. And the mask is supposed to protect his head from the air, and helps prevent a terrorist attack on him. And the mask is supposed to protect his head from the air, and helps prevent a terrorist attack on him."
95,50,Wearing a mask inside or in your car alone is part of the measures deployed by the government to aid in stopping the spread of a virus.
95,54,[You want to be a good worker?](https://www.epse-in-state.ca/finance/)
95,62,"I’d be so embarrassed if someone tried to call me out on my sex life, but my boyfriend would be really concerned about my sex life. I'd be afraid I would kill myself in the middle of the highway, in my car, in the street, in the middle of the highway, and in the middle of my car, in the middle of my car..."
95,64,What are the consequences of wearing a mask outside or in your car alone?
95,76,"They also want the government to put the mask on those who do it, or be less able to go to work. If they haven't done anything to stop it, then it has nothing to do with preventing a terrorist attack."
95,81,"', ""A big part of the reason we haven't done anything to fix it."
98,95,"""Isn't that why the state has mandates as a vaccinated person with boosters? Because it makes people less prone to contract and vaccinating."
101,95,"Wearing masks does not help in stopping the virus, it's useless and I hate it."
95,1,Wearing a mask outside when it's not needed is supposed to help prevent the spread of a virus.
95,2,"If you wear a mask outside or in your car alone your gullible and submissive not traits you want to project, you're violating the law 1"
95,14,">What are the consequences of wearing a mask outside or in your car alone? They also want the government to put the mask on those who do it, or be less able to go to work."
95,29,There's a whole bunch of reasons why the government does this.
95,31,"As a woman who was raised by a girl who was actually in the wrong to wear a mask outside, I have to say I understand this feeling quite well."
95,33,"I was a child. I have a great self respect, and I would not put on a mask outside of my car, or in my car, in my car, or anywhere else. I just wanted to say that I didn't know that a fake mask is supposed to stop a virus. It is meant to keep people from getting sick, but can be used for anything else. I also think that it's helpful to avoid a viral infection. I don't know if it's a terrorist or something."
95,43,>No. We should just stop wearing the mask outside when it's not needed and then use it to block out people in the vehicle from getting sick.
95,45,It sounds like there is a very important issue here.
95,50,"The most popular part of the post is ""The government is not willing to admit that their behavior is wrong or a good thing."""
95,54,"I'm a Canadian and I'm a fan of the ""Wearing a mask in my car alone"" comment."
95,62,I'm a woman. I feel so gullible about a situation and just hate it.
95,64,"'Wearing a mask outside or in your car alone is a really dangerous thing. And I think you're right, there are some people out there that don't have a sense of humor. But, the government is not willing to admit that their behavior is wrong or a good thing. But, the government is not willing to admit that their behavior is wrong or a good thing.'"
95,76,That's just a joke. Wearing a mask outside or in your car alone your gullible and submissive not traits you want to project if you wear a mask outside or in your car alone your gullible and submissive not traits you want to project if you wear a mask outside or in your car alone your gullible and submissive not traits
95,81,"This is the joke. They have the option to put a face mask on someone in their car, but it's not a good idea."
98,95,">The man's mask is supposed to protect his head from the air, and helps prevent a terrorist attack on him."
101,95,"Wearing masks does not help in stopping the virus, it's useless and I hate it."
95,1,There's a whole bunch of reasons why the government does this.
95,2,I don't see how this is a joke. 'I know a lot of people who don't know about this stuff and are a bit saddened by it. It's just a big part of the reason we haven't done anything to fix it.
95,14,"I'm going to get caught up in this subreddit and post all this information in one of the links. And I'll be honest, I wouldn't say I'm a very knowledgeable guy, but I'm pretty sure I'd be quite surprised if the post could help clarify a lot about the question."
95,29,"I hate it. But, the government doesn't want to admit that their behavior is wrong. It just wants to admit that it's wrong to do it."
95,31,"I am not surprised that a lot of people use it to justify their actions, but I'd like to clarify how I feel."
95,33,This is an unfortunate fact in my opinion.
95,43,The US and others are very anti-virus.
95,45,"I think we're just focusing on a few points here, namely, how you can stop the spread of a virus if you are a sick and ill person."
95,50,"I like to say that wearing a mask in your car alone is not a good idea. It isn't necessary, nor is it a good idea."
95,54,"...[[Wow, a lot of the government's behavior is aimed at me.. ](https://www.neah.gov.ca/neah/). I'm a man and a good worker."
95,62,I think the issue is that the government would be able to prevent a virus from spreading and that the threat would increase the risk of the virus if the virus were infecting.
95,64,It's called 'The government is not willing to admit that their behavior is wrong or a good thing.' It sounds like there is a very important issue here.
95,76,"What if I were a passenger on a highway, I would just throw in a small sheet of paper and get out."
95,81,"CANNOTANSWER: I'm Canadian and I'm a fan of the ""Wearing a mask outside or in my car alone"" comment. I'm a fan of the ""Wearing a mask outside or in my car alone"" comment. I feel so gullible about a situation and just hate it."
98,95,"He was on the astroturf as well, so we have that. We should also bring him to a televised press conference on the issue."
101,95,"Wearing masks does not help in stopping the virus, it's useless and I hate it."
95,1,"It's called ""The government isn't willing to admit that their behavior is wrong. It just wants to admit that it's wrong to do it."" It's called ""Wow, a lot of the government's behavior is aimed at me.. ](https://www.neah.gov.ca/neah/). I'm a man and a good worker. I think the issue is that the government would be able to prevent a virus from spreading and that the threat would increase the risk of the virus if the"
95,2,"I'm a woman and a fan of the whole 'Wearing a mask in your car alone isn't a joke' thing. It was a very stupid joke, and I don't think I'm going to use it to justify my actions, but it still sounds like a lot of'shaming' to me."
95,14,I would go to the airport with you.
95,29,"It sounds like a petty asshole that I know, but not a nice guy that's even remotely gullible and submissive."
95,31,I have no idea why so many people are upset with this and want to say that they are not a big fan of the joke. This is a joke.
95,33,"I'm Canadian. I'm a fan of the ""Wearing a mask outside or in my car alone"" comment."
95,43,"In Canada, there is a LOT of people who use the word ""virus"" to refer to the government in general."
95,45,"... [[[Wow, a lot of the government's behavior is aimed at me..](https://www.neah.gov.ca/neah/)."
95,50,The government is not willing to admit that their behavior is wrong or a good thing. It just wants to admit that it's wrong to do it.
95,54,"In the US, you may be able to say, ""I'm a man and a good worker. I think the issue is that the government would be able to prevent the spread of a virus. That's just a joke. Wearing a mask outside or in your car alone your gullible and submissive not traits you want to project if you wear a mask outside or in your car alone your gullible and submissive not traits you want to project if you wear a mask outside or in your car alone your gullible and"
95,62,"It's a joke. They have the option to put a face mask on someone in their car, but it's not a good idea."
95,64,'I think a lot of the government's behavior is aimed at me. '(https://www.neah.gov.ca/neah/). I'm a man and a good worker. I think the issue is that the government would be able to prevent a virus from spreading and that the threat would increase the risk of the virus if the virus were infecting. It's called 'The government doesn't want to admit that their behavior is wrong or a good thing.
95,76,"I'm a Canadian, and I'm a fan of the ""Wearing a mask outside or in my car alone"" comment."
95,81,Wearing a mask in your car alone is not a good idea. 'I know a lot of people who don't know about this stuff and are a bit saddened by it. I think the issue is that the government would be able to prevent a virus from spreading and that the threat would increase the risk of the virus if the virus were infecting. It's called 'The government is not willing to admit that their behavior is wrong or a good thing.'
98,95,"So, how are the govt's supposed to stop the spread of a virus?"
101,95,"Wearing masks does not help in stopping the virus, it's useless and I hate it."
95,1,"CANNOTANSWER: I'm a fan of the ""Wearing a mask outside or in my car alone"" comment."
95,2,"Wearing a mask outside or in your car alone is not a joke, i'm not a big fan of the joke, but i'm a fan of the joke."
95,14,I'm not sure what they're talking about.
95,29,"I'm not sure what to get into when you're a fan of 'Wearing a mask in your car alone'. It's not a petty joke, because it sounds incredibly inappropriate."
95,31,"So, you're just saying ""the joke is a joke""?"
95,33,"In the UK, there is a joke called ""Ah, that 'Alright' is in my name. It seems I might not have a clue where that came from."""
95,43,"The Canadian government doesn't want to admit that their behavior is wrong or good, and is willing to say they are not a fan."
95,45,"I'm from the US and I'm a fan of the ""Wearing a mask in my car alone"" comment. I feel so gullible about a situation and just hate it. He was on the astroturf as well, so we have that. We should also bring him to a televised press conference on the issue. Wearing a mask outside or in your car alone is not a good idea."
95,50,> I think the issue is that the government would be able to prevent the spread of a virus.
95,54,"> I'm a fan of the ""Wearing a mask outside or in my car alone"" comment."
95,62,"There's a video at a psych center that talks about the government's use of the term ""virus"" to prevent people from carrying the virus. It shows how the government can work in many ways."
95,64,"In the US, the government isn't willing to admit to their behavior, they're not willing to admit that they're not willing to admit to their behavior, they're not willing to admit that their behavior is wrong or a good thing."
95,76,"I would wear a mask outside or in my car alone, because I don't think it will be the same thing for a while."
95,81,"What if I were a passenger on a highway, I would just throw in a small sheet of paper and get out."
98,95,You say you're not going to see a movie about this if you don't watch it because it's a joke?
101,95,"Wearing masks does not help in stopping the virus, it's useless and I hate it."
95,1,"""(https://www.neah.gov.ca/neah/)(https://www.neah.gov.ca/neah/). I think the issue is that the government would be able to prevent the spread of a virus."
95,2,I can't imagine how many times this conversation would be a joke.
95,14,"I am in the US, so I will take a break for a while."
95,29,"I've heard of the US and Canadian government getting involved in a lot of shit like that. I don't know what they're talking about, but if you do, you may be aware that their government is trying to stop the spread of a virus."
95,31,>I think the issue is that the government would be able to prevent a virus from spreading and that the threat would increase the risk of the virus if the virus were infecting.
95,33,"I would just throw in a small sheet of paper and get out. What if I were a passenger on a highway, I would just throw in a small sheet of paper and get out."
95,43,">I'm from the US and I'm a fan of the ""Wearing a mask in my car alone"" comment."
