sender,receiver,message
54,6,i wear my mask when i m in public lawmaker who isn t wearing his mask in public says
54,11,i wear my mask when i m in public lawmaker who isn t wearing his mask in public says
54,15,i wear my mask when i m in public lawmaker who isn t wearing his mask in public says
54,21,i wear my mask when i m in public lawmaker who isn t wearing his mask in public says
54,35,i wear my mask when i m in public lawmaker who isn t wearing his mask in public says
54,45,i wear my mask when i m in public lawmaker who isn t wearing his mask in public says
54,46,i wear my mask when i m in public lawmaker who isn t wearing his mask in public says
54,53,i wear my mask when i m in public lawmaker who isn t wearing his mask in public says
56,54,if you wear a mask outside or in your car alone your gullible and submissive not traits you want to project
57,54,i love coaching however if one official or admin address me about our players not wearing a mask or wearing it properly under a helmet i will resign and not coach until this nonsense stops
75,54,putting on a mask to walk ten feet through a restaraunt and then taking it off when i get to my table is one of the dumbest things things i ve ever done in my entire life and i ve done a lot of dumb things
78,54,how does the mask make his breath come out of the back of his head
85,54,see this is how crazy trump s made the united states of america if you want order in america president donald j trump must take off his mask and turn himself in oh and every day he doesn t people will die starting tonight i m a man of my word covid
90,54,two tri county health dept board members from douglas county voted against the mask public health order and one did not vote due to affiliation to a school
95,54,if you wear a mask outside or in your car alone your gullible and submissive not traits you want to project
96,54,i love coaching however if one official or admin address me about our players not wearing a mask or wearing it properly under a helmet i will resign and not coach until this nonsense stops
54,6,"This is why Obama has no face at all : wearing a mask, and a public health order is just a ridiculous dick move."
54,11,wearing a mask outside or in your car alone your gullible and submissive not traits you want to project i love coaching however if one official or admin address me about our players not wearing a mask or wearing it properly under a helmet i will resign and not coach until this nonsense stops
54,15,"What? The president is a total moron, it s the government, you don t have to be in his shoes, if you are putting on a mask, you are not in the wrong place."
54,21,i hate when people think i wear my mask when i m in public lawmaker who isn t wearing his mask in public says i wear my mask when i m in public
54,35,> wear my mask when i m in public lawmaker who isn t wearing his mask in public says
54,45,He got it from the govt. for his face
54,46,"It is illegal to wear a mask outside of a public place, but not a federal office."
54,53,"I've always heard the phrase. ""I wear my mask when I m in public lawmaker who isn t wearing his mask in public says"""
56,54,Wearing a mask is part of the measures deployed by the government to aid in stopping the spread of a virus.
57,54,"I am a coach in a national team that wears a mask for the players, that is what I'm saying."
75,54,And putting on a mask to walk ten feet through a restaraunt and then taking it off when i get to my table is one of the dumbest things things i ve done in my entire life and i ve done a lot of dumb things putting on a mask to walk ten feet through a restaraunt and then taking it off when i get to my table is one of the dumbest things things i ve done in my entire life and i ve done a lot of dumb things putting on a mask to walk
78,54,My husband wears his mask when I am out for the first time in years.
85,54,i agree. what i would have done differently is if i wore a mask to work
90,54,The only reason why they voted against the mask public health order is because they've been exposed to the virus and wanted to use it on their child.
95,54,wear a mask outside or in your car alone your gullible and submissive not traits you want to project if you wear a mask outside or in your car alone your gullible and submissive not traits you want to project if you wear a mask outside or in your car alone your gullible and submissive not traits you want to project
96,54,I feel like I have a lot of friends who hate the idea of being told to wear a mask while they play.
54,6,"My husband is wearing a mask at work. Besides, we know they have a ton of stuff to cover the neck when he leaves work, and he's not trying to protect us. He's wearing a mask to keep the air out while he's in the car, which is part of the reason he doesn't wear a mask, so he does."
54,11,You can do that by wearing a mask (or in a vehicle)
54,15,i do not understand how some people get irrational reactions when they see a public health order vs the reality that their team is at war with the senate
54,21,You got the right idea. Wearing a mask outside or in your car is part of the measures deployed by the government to aid in stopping the spread of a virus.
54,35,That s a bit more obvious than you think.
54,45,"I've always heard the phrase. ""I wear my mask when I m in public lawmaker who isn't wearing his mask in public says"" Wearing a mask outside of a public place, but not a federal office is just a ridiculous dick move."
54,46,"I don't think you understand the importance of a mask and that, if you were to wear one when you were a kid, you would lose your license."
54,53,I feel like I've got a lot of friends who hate the idea of being told to wear a mask while they play.
56,54,The best thing about a mask is the fact that it is not contagious.
57,54,"Are you kidding me? I am a coach in a national team that wears a mask for the players, that is what I'm saying."
75,54,I am a guy with a mask.
78,54,Is this a joke? I haven't seen this comment in a while.
85,54,"Yes, this is a very good quote about a guy in a mask with a sword."
90,54,"I don't care how many school districts they represent, I just think it's not a bad idea."
95,54,Wearing a mask outside or in your car alone your gullible and submissive not traits you want to project if you wear a mask outside or in your car alone your gullible and submissive not traits you want to project if you wear a mask outside or in your car alone your gullible and submissive not traits you want to project if you wear a mask outside or in your car alone your gullible and submissive not traits you want to project
96,54,"Wearing a mask doesn't stop the spread of the virus. Wearing a mask does, however, stop the spread of the virus."
54,6,"Wearing a mask doesn't stop the spread of a virus. Wearing a mask does, however, stop the spread of the virus."
54,11,"Wearing a mask outside or in a car would also help prevent the spread of a virus, as it can prevent other types of illnesses from spreading."
54,15,"People wear masks in general to protect the environment, but people do not put on a mask to protect the environment. This is a joke."
54,21,">[We have always heard the phrase. ""I wear my mask when I m in public lawmaker who isn t wearing his mask in public says"""
54,35,Wearing a mask outside or in your car is part of the measures deployed by the government to aid in stopping the spread of a virus.i agree. what i would have done differently is if i wore a mask to work The only reason why they voted against the mask public health order is because they've been exposed to the virus and wanted to use it on their child.
54,45,I was a guy who was wearing a mask at the office for a friend. The best thing about a mask is the fact that it is not contagious. Are you kidding me?
54,46,[Try... wear a mask in your car with a sword. I can't be bothered with wearing one. I think it's pretty cool that people are allowed to wear the helmet that's just meant to stop the spread of a virus.
54,53,"The first sentence is misleading. I don't care how many people you know who are in the public sector that are saying the words ""Making a mask in your car is not contagious. Wearing a mask doesn't stop the spread of the virus. Wearing a mask does, however, stop the spread of the virus."
56,54,">The issue with wearing a mask isn't the fact that the government is in fact trying to stop the spread of the virus, it's the fact that it's just a temporary mask, and you can't actually wear it anymore because of that. Why would anyone want to go to that place? I love that you're a fucking Republican who wears a mask, and they don't believe in it. They have a lot of good ideas."
57,54,He wants to get a helmet but he can't. He doesn't wear a helmet. He wants a helmet. He is a coach but he wants to be able to go on his own. And he wants to go on his own because he wears a mask.
75,54,Is this a video game or a movie?
78,54,I wonder how many people in the US wear masks at work?
85,54,"I think this is the correct answer for a very specific point, but I'm not implying that a specific person who is wearing a mask has a legitimate reason to wear it. You are being sarcastic."
90,54,I don't think it was a bad idea to wear a mask in public places. I'm surprised that the only reason for those who didn't vote against the ACA were people who didn't vote for the one that was in a community of people who support their choice.
95,54,"I read the whole thing and thought it was hilarious that there isn't a reason not to wear a mask outside or in your car unless you are a terrorist. I don't think they think it is the same as not wearing a mask outside or in your car, it's not the same thing as putting a mask on a person."
96,54,What if someone has a virus?
54,6,"Unless they want to use it, they can't."
54,11,I'd wear it every day to go to school.
54,15,"Despite the fact that you're not a fan of the ACA, it isn't something to support and it can't be used to defend those who don't have it."
54,21,"The problem with wearing a mask isn't the fact that the government is in fact trying to stop the spread of the virus, it's the fact that it's just a temporary mask, and you can't actually wear it anymore because of that."
54,35,"I read the whole thing and thought it was hilarious that there isn't a reason not to wear a mask outside or in your car unless you are a terrorist. I don't think they think it is the same as not wearing a mask outside or in your car, it's not the same thing as putting a mask on a person. What if someone has a virus? Is this a video game or a movie? Is this a video game or a movie?"
54,45,"''I've always heard the phrase. ""I wear my mask when I'm in public lawmaker who isn't wearing his mask in public says""''"
54,46,"That's the idea. The thing that I don't understand is the fact that you've said the following. ""I wear a mask outside or in my car with a sword. I can't be bothered with wearing one. I think it's pretty cool that people are allowed to wear the helmet that's just meant to stop the spread of a virus."
54,53,"I'm not being facetious. I mean, I've heard a lot of things about it. And that's an awfully broad definition of contagious. That's why I think it's a big deal. I was in a position where a person wanted to wear a mask in public, and a person who did not believe that a person could wear a mask in public would not, because it would make a bad point. I don't like the idea of having to wear a mask outside or in your car and a sword are two words"
56,54,"I think there are good ideas about how to change a politician's policy, but I don't think that's the correct answer. If you think the person in charge of the virus is just going to get the virus and that the person that isn't at risk of getting it is simply not ready for it to develop, then you're doing the right thing. It's also possible that in a time when you don't have a political party, you might see some signs of people getting the virus."
57,54,> I love coaching however if one official or admin address me about our players not wearing a mask or wearing it properly under a helmet i will resign and not coach until this nonsense stops.
75,54,The EPA is also the only agency to use this. The one that did it for was in the 1930's.
78,54,"I'm a very experienced, irrational person. But what if we can't be bothered to make fun of this? We're just not allowed to wear our hats in public."
85,54,"[The movie](http://www.noaaac.gov/wiki/RapCrypt.jpg): The ""U.S. Government"" is trying to tell you to stop wearing a mask, or not. The thing about wearing a mask is... you wear it and you eat pizza and you're not healthy? ""...I think the guy is an incompetent idiot who can eat a sandwich for his meal. He is also a degenerate who can eat pizza."
90,54,"It's a great reminder to support the right to choose when and where you go. If you don't want to go, you can go to any school where there isn't a mask. It's great to see what your neighbors think. I love that it's good to have a community that support the right to have a mask. I don't think there's much you can do to make the community feel like you are in a good place."
95,54,[You want to be a good worker?](https://www.epse-in-state.ca/finance/)
96,54,Vaccination does not prevent the spread of a virus. Vaccination does not prevent the spread of a virus.
54,6,>the thing about wearing a mask is... you wear it and you eat pizza and you're not healthy?
54,11,"As far as I know, most of the information in this thread refers to a mask in public - and if it was a mask in the car, it was a mask. I think it's important that the mask is visible in the public, but I also think that it has to be very comfortable. That's why we're allowed to wear hats in public."
54,15,What you're doing is just making fun of people whose life they have a mask in.
54,21,I feel like a guy who grew up in the 1960s is just an incompetent dick.
54,35,"You are not stupid enough to think that wearing a mask in public places is a good idea, and you have no reason to think that it will prevent the spread of a virus."
54,45,"I'd like to point out that if a public politician is in no position to wear a mask in public, he can't be contagious. So he can't wear a mask in a government environment because he has a fear of being in a public place. Because if the public does not like it, it's not contagious and thus should be treated as such. I'd even go to a community where it's not contagious. Because that is why the government acts on a false rumours, a"
54,46,Wearing a mask is part of the measures deployed by the government to aid in stopping the spread of a virus.
54,53,I love people who are in the public sector. I'm surprised that the only reason for those who didn't vote against the ACA were people who didn't vote for the one that was in a community of people who support their choice.
56,54,"I don't think the government needs to wring its own hair out, unless a mask will not help a person."
57,54,"That's not why a lot of the players at my school are not wearing the floppy masks, and they just wear the masks because it gives them a sense of security."
75,54,"Well, in a way, you should have a bit more time for this."
78,54,> I think that the one-handed government policy that is implementing in the US is to allow people to have a helmet in public.
85,54,> wearing a mask is part of the measures deployed by the government to aid in stopping the spread of a virus.
90,54,> It seems like this is some kind of conspiracy to make the government look stupid and not have the proper authority to change it.
95,54,"I'm a Canadian and I'm a fan of the ""Wearing a mask in my car alone"" comment."
96,54,"Wearing a mask is part of the measures deployed by the government to aid in stopping the spread of a virus.It doesn't make sense at all that I'll say something like this : I'll not go anywhere that requires me to wear a mask Wearing masks does not help in stopping the spread of the virus, it's useless and I hate it. If you don't want to go anywhere that requires me to wear a mask Wearing masks does not help in stopping the spread of a virus, it's a good way to get people to show"
54,6,"The movie ""The U.S. Government"" (http://www.noaaac.gov/wiki/RapCrypt.jpg): The ""U.S. Government"" is trying to tell you to stop wearing a mask, or not. The thing about wearing a mask is... you wear it and you eat pizza and you're not healthy? ""...I think the guy is an incompetent idiot who can eat a sandwich for his meal. He is also a degenerate who can eat pizza. I love that it"
54,11,"[The movie](http://www.noaaac.gov/wiki/RapCrypt.jpg): The ""U.S. Government"" is trying to tell you to stop wearing a mask, or not. The thing about wearing a mask is... you wear it and you eat pizza and you're not healthy? ""...I think the guy is an incompetent idiot who can eat a sandwich for his meal. He is also a degenerate who can eat pizza."
54,15,"I'm a Democrat and this is a big red flag, not a joke."
54,21,It seems like this is some kind of conspiracy to make the government look stupid and not have the proper authority to change it.
54,35,"I'd like to point out that if a public politician is in no position to wear a mask in public, he can't be contagious. So he can't wear a mask in a public place because if the public does not like it, it's useless and I hate it."
54,45,It seems like this is some kind of conspiracy to make the government look stupid and not have the proper authority to change it.
54,46,'Wearing a mask is part of the measures deployed by the government to aid in stopping the spread of a virus.'
54,53,"I don't know if that's what you mean. If there is a public sector, there are probably only a couple of reasons for this."
56,54,"This is actually a pretty common issue in the US: The CDC, and the CDC are all not even close to working together in one department. This is a very big concern in many states as well as the people who are in the system. I'd be concerned that a federal program would be so badly badly done that it would be hard for the people in charge to do so, even if they had a 'common sense' if they were going to rename it to something else. I know it's not the gov's job to prevent this problem,"
57,54,"This is what people should be ashamed of, because if you don't get a mask you are being bullied."
75,54,It sounds like the sexist joke is about to become the most accepted joke in American history.
78,54,"I don't think any of these are stupid comments at all. Unless you think that the ACA is a huge disaster, then they are terribly cliche and silly."
85,54,"Are you aware that the government is invading an entire nation? I'd also say that because the CDC has found a very good source to make that up, he's a real sarcastic skeptic, so he is trying to make the point that the mask is a sign that the government is invading the people."
90,54,"It's very interesting that the ACA is in place, but I am in the USA. What the ACA is saying is, you can only wear one if the other is not allowed."
95,54,"...[[Wow, a lot of the government's behavior is aimed at me.. ](https://www.neah.gov.ca/neah/). I'm a man and a good worker."
96,54,"It's called ""the mandates that are mandatory."""
54,6,scummy as fuck. I've always thought the problem is the govt not treating the public as equals to the private sector.
54,11,I don't understand why people are getting so angry at me and then the government does their best to do what they want.
54,15,"It's not a joke, but you can still use the word ""fucking"" to make a joke."
54,21,"It's a good way to get people to show The movie ""The U.S. Government"" (http://www.noaaac.gov/wiki/RapCrypt.jpg): ""I'm a fan of the ""Wearing a mask in my car alone"" comment."
54,35,You gonna get all the jokes you want in this post.
54,45,So you like to wear a mask? That's a good idea.
54,46,Try... wearing a mask in your car with a sword. I can't be bothered with wearing one. 
54,53,"My personal experience as a government employee has been to a number of places. At a few o'clock in the morning the only way to find out which government program to follow was a ""public sector"" and not the other way around. The reason is they do not know what the government is doing in the private sector."
56,54,I'm not trying to be a sarcastic commenter but I don't think it is a good thing or a good idea to put a mask on or on the person who isn't in the health care system. There are some nice comments in this thread based on an article that was originally published in 2004.
57,54,I don't know how you could possibly be so hyperbolic that you want to get into a conversation with a person who hasn't had a vaccination.
75,54,"""The only way to stop a spread of a virus is to put on a mask."""
78,54,I'm not sure that the government will go against the grain of the ACA and the current ACA is going to be the least irrational thing you can do if your face is ripped open by the government.
85,54,"> The CDC has found that people with an infection are more likely to get sick and will pass a vaccination. In addition, if you have any children, you will have a low prevalence of HIV in your community. The idea of wearing a mask in a public place is a stupid but completely legitimate issue."
90,54,I don't think it's a conspiracy either. It's just an odd choice.
95,54,"In the US, you may be able to say, ""I'm a man and a good worker. I think the issue is that the government would be able to prevent the spread of a virus. That's just a joke. Wearing a mask outside or in your car alone your gullible and submissive not traits you want to project if you wear a mask outside or in your car alone your gullible and submissive not traits you want to project if you wear a mask outside or in your car alone your gullible and"
96,54,"The NFL has never been able to impose rules in the medical field, and every single organization in the US has ever been allowed to enforce these rules."
54,6,"The idea of wearing a mask in a public place is a stupid but completely legitimate issue. It's a good way to get people to show The movie ""The U.S. Government"" (http://www.noaaac.gov/wiki/RapCrypt.jpg): ""Wearing a mask in my car alone"" comment."
54,11,"The ""The U.S. Government"" is a joke."
54,15,People have different definitions of their mask. You are saying it's more effective to show your face to your boss? Or even your employer?
54,21,"I don't think it's a good thing to wear a mask outside, because you can't get sick without it."
54,35,"I'm a man. And I think I'm in the minority. That said, I just really don't feel comfortable about being in a public place."
54,45,"My husband and I were married for three years, and we were living on a farm. The gov't resorted to letting us have the right to wear a mask and our private property on the property they are on our property with. We had the right to wear a mask in the home, not in the car. The gov't resorted to it. That's why we still own a huge majority of our own property and the people who live there aren't allowed to do anything illegal."
54,46,"Apparently the government is invading this nation, and it's not possible to stop the spread of a virus, as a result of this mandate."
54,53,"In my opinion, not really. This is actually what I'm saying. It's not the law that's making the issue of the issue more prominent, but the ACA is a good one."
56,54,"The government is not implementing a policy allowing people to be on the road when they don't have a doctor, but they are attempting to do so."
57,54,CANNOTANSWER: Vaccination is not required for everyone unless the person is in an advanced stage of a clinical trial. Isn't that why the state has mandates as a vaccinated person with boosters? Because it makes people less prone to contract and vaccinating.
75,54,It is a joke. You are a narcissistic troll and a racist. You don't t make fun of someone or give an excuse.
78,54,">We all eve a mask at least once a year in our country, and a big part of it is the protection we give our children. I'm pretty sure the idea of a vaccination in the US is not really a joke because there isn't much they can do in that regard."
85,54,"The CDC has found that people with an infection are more likely to get sick and will pass a vaccination. In addition, if you have any children, you will have a low prevalence of HIV in your community. The idea of wearing a mask in a public place is a stupid but completely legitimate issue."
90,54,The school should go to a county school board and get an AMA for a new skunk in their school.
95,54,"> I'm a fan of the ""Wearing a mask outside or in my car alone"" comment."
96,54,I'm a lawyer.
54,6,I think you're thinking of how people can get a virus to spread while in the car.
54,11,I feel like this may have gone over well enough.
54,15,So what exactly does that have to do with a medical emergency?
54,21,"A person's disability is the reason he or she was diagnosed. I mean, how do people know he was actually a member of the government? And what's the craziness of his parents? He has never been able to make it clear to a doctor he does not have the right to have a physical disability?"
54,35,They don't have a specific set of rules about what a public health order is for or what an organization needs to be concerned about. They just do what they want.
54,45,"It's not the government's job to prevent a virus, it's the people. It isn't just the government allowing it. It's the government's job to keep people safe - that's why it's invading our country. It's the people who need to be safe."
54,46,"[In my opinion, not really. This is actually what I'm saying. It's not the law that's making the issue more prominent, but the ACA is a good one."
54,53,What is the question here? How is a vaccine effective?
