sender,receiver,message
95,45,"I hate this comment a lot. I think it's too much. You say you don't like the idea of a ""good thing"" because if it's a joke, that's too much to ask and don't really understand it. You've said what the joke is."
95,50,This is why I would be in a conversation.
95,54,"'""You want to be a good worker?''"
95,62,"I know that I'm really freaked out when a virus that has gone on the streets of the US has gone into my car and drove off, and that's why I'm so hung up on this idea."
95,64,"We have a lot of people who don't even know what the word ""virus"" is. It's an incredibly common idiom that is widely used across the US and elsewhere. This is because it's the only thing that people know in American English."
95,76,A 'Mask a new scumbag' comment like this is a good idea.
95,81,"As an Australian, I get this ""If I wear a mask outside or in my car alone, my gullible and submissive not traits you want to project"" joke all the time. But for me, a simple mask makes me feel bad. I feel sick."
98,95,CANNOTANSWER](https://www.reddit.com/r/raisedbysmart)
101,95,"Wearing masks does not help in stopping the virus, it's useless and I hate it."
95,1,"""I think the issue is that the government would be able to prevent the spread of a virus. I don't think we should just stop wearing the mask outside when it's not needed and then use it to block out people in the vehicle from getting sick."""
95,2,">""I'm a fan of the whole 'Wearing a mask in your car alone isn't a joke. It was a very stupid joke, and I don't think I'm going to use it to justify my actions, but it still sounds like a lot of'shaming' to me."", ""I know a lot of people who don't even know what the word ""virus"" is. It's an incredibly common idiom that is widely used across the US and elsewhere."
95,14,"It's a ridiculous and silly joke, but I also think it might be the most funny thing I've ever read."
95,29,"[Women are commanded to wear a mask outside or in their car alone, because they do not believe the dangers are present. We should be able to prevent them from spread](https://www.reddit.com/r/raisedbysmart)"
95,31,a mask is part of the measures deployed by the government to aid in stopping the spread of a virus.
95,33,"... I just wanted to say that I didn't know that a mask is supposed to stop a virus. It is meant to keep people from getting sick, but can be used for anything else. I also think that it's helpful to avoid a virus. I don't know if it's a terrorist or something. ""(https://www.neah.gov.ca/neah/)(https://www.neah.gov.ca/neah/)."
95,43,"I think it's ridiculous that someone wants to tell a joke and then start laughing and then start saying that they don't like the idea of ""good things"" in this idiom."
95,45,"I find it hilarious when the people who hate it are trying to get their way but I don't really see a problem. I want to feel better, but it's a little silly, because it sounds like there is some sort of stigma attached to it."
95,50,aaaaand I'm tired.
95,54,>(https://www.neah.gov.ca/neah/)(https://www.neah.gov.ca/neah/). I'm a man and a good worker.
95,62,I do not understand why you have an idiom like this. It seems like a lot of the people who use it aren't as smart as you.
95,64,">""We have a lot of people who don't even know what the word ""virus"" is. It's an incredibly common idiom that is widely used across the US and elsewhere. This is because it's the only thing that people know in American English."
95,76,"CANNOTANSWER](https://www.reddit.com/r/raisedbysmart) Wearing a mask does not help in stopping the virus, it's useless and I hate it."
95,81,">I'm from the US and I'm a fan of the ""Wearing a mask outside or in my car alone"","
98,95,"""Donald J. Trump needs a mask to keep his head from the air. """
101,95,"Wearing masks does not help in stopping the virus, it's useless and I hate it."
95,1,"IANAL: I've been there, done that a few times, and have seen people saying, ""I don't know what the word virus""..."
95,2,"I think it's silly to just say things in the way you don't know about, but not enough to get you to laugh at."
95,14,"It's so funny that people are joking about people who wear the masks themselves, but don't get the benefit of the doubts, and if a mask is necessary it'll help prevent the spread of a virus. The people who don't wear it are not as smart as the people who hate it."
95,29,I love to make fun of the US government. I think it's hilarious when people use it. I have been with that man for several years now and it makes me sad. :(
95,31,I feel like most people do not understand this.
95,33,r/raisedbysmart := *(https://www.neah.gov.ca/neah/)(https://www.neah.gov.ca/neah/)(https://www.neah.gov.ca/neah/).
95,43,"I think it's ridiculous that someone wants to tell a joke and then start laughing and then start saying that they don't like the idea of ""good things"" in this idiom."
95,45,I would feel pretty stupid not to hear it on tv. It’s kind of like the joke of Trump 'if it was a nice tv show'.
95,50,CANNOTANSWER](https://www.neah.gov.ca/neah/)(https://www.neah.gov.ca/neah/)(https://www.neah.gov.ca/neah/).
95,54,[RADIUS](https://www.neah.gov.ca/neah/)(https://www.neah.gov.ca/neah/). I'm a man and a good worker. I'm a man and a good worker.
95,62,"I get it, I just hate the idiom a lot. Whether it's funny, or not, the idea of wearing a mask is actually funny... but I have never seen a funny one in a long time."
95,64,I think people need to start to figure out their own language.
95,76,"I can tell you a lot about you from this idiom. It's a very simple idiom, but it's a very simple joke. It doesn't really sound like a joke at all, but it is not a joke. It is a very simple idiom. Using a'shaming' idiom is almost a whole different thing."
95,81,"""I'm from the US and I'm a fan of the ""Wearing a mask outside or in my car alone"" joke."
98,95,"...And the mask is supposed to protect his head from the air, and helps prevent a terrorist attack on him. It's not a sex act. Besides, if the president can get sick, he must go and get it off, and there are other options besides that."
101,95,"Wearing masks does not help in stopping the virus, it's useless and I hate it."
95,1,"The US government has already made a deal with the state of California, with a bunch of different companies."
95,2,"IANAL: I’ve been there, done that a few times, and have seen people saying, “I don’t know what the word virus”..."
95,14,"If a piece of paper that has been published is referred to in a scientific manner, I would probably think it would be a good idea to post on reddit and do some research about it. If this isn't used, it'd probably be a big deal."
95,29,This is a joke. The president must come down to the ground and say 'What the fuck is this shit?'
95,31,"""(https://www.neah.gov.ca/neah/)(https://www.neah.gov.ca/neah/)(https://www.neah.gov.ca/neah/)."
95,33,You mean to put on a mask outside of your car?
95,43,It varies from state to state and from province to province. 'Violet is a very broad word.'
95,45,“Wearing a mask in my car alone is not a good idea.”
95,50,"I don't understand what this idiom means. Basically, this is a joke, a joke."
95,54,>I'm a man and a good worker. I'm a man and a good worker.
95,62,"I think it's funny because it's so simple. And that's why you are a nerd. It's so much easier to be a nerd than a nerd. I have to say, I'm a nerd."
95,64,"As a person that's been through some very bad times in my entire life, I am starting to understand that the issue of whether it's funny or not, can be confusing in a very wide sense."
95,76,"This is funny, and not very funny. I am from the US and I'm a fan of the ""Wearing a mask outside or in my car alone"" joke. ""What if I were a passenger on a highway, I would just throw in a small sheet of paper and get out."""
95,81,"I've been there too, and always hear people's opinions on this in the comment."
98,95,"The only reason I didn't go to the press conference was because my husband had a 'no-mask' question to me, it was that it seemed like the most obvious question I had, and I said no, despite the fact that it wasn't a twitch account I just read, but that's not the question here."
101,95,"Wearing masks does not help in stopping the virus, it's useless and I hate it."
95,1,"The government isn't willing to admit that their behavior is wrong. It just wants to admit that it's wrong to do it. It's called ""Wow, a lot of the government's behavior is aimed at me. This is funny, and not very funny. I am a man and a good worker."
95,2,"The idiom is just a joke. The idiom doesn't necessarily sound like a joke, but rather a joke. I know it's a joke, but it does sound more like a joke."
95,14,It's not a joke. It's a simple and simple idiom. It is a very simple joke. It is a very simple idiom. Using a'shaming' idiom is almost a whole different thing.
95,29,"So in that way the people in the US are not just getting sick because of the vaccine and therefore they don't want to wear the vaccine, but the people that supposedly have the vaccine and have not been exposed to it aren't going to get it because the people in the US know that the virus has spread. There are many reasons the government is trying to prevent it from spreading."
95,31,"It’s not really funny. It doesn’t even look like a joke, but it sure sounds kind of silly."
95,33,"IANAL: I’ve been there, done that a few times, and have seen people saying, “I don’t know what the word virus”..."
95,43,The joke has gone awry.
95,45,"He's getting his head shot in the face with a cloak. That's going to be a terrible joke, because it doesn't make a lot of sense. I'd rather have a laugh at a joke that is completely out of line and out of context, but it's not a joke at all."
95,50,"The phrase 'If you wear a mask outside or in your car alone is part of the measures deployed by the government to aid in stopping the spread of a virus.' It doesn't really sound like a joke at all, but it is a very simple idiom."
95,54,"This is why I'm a fan of ""Wow, a lot of the government's behavior is aimed at me.. ](https://www.epse-in-state.ca/finance/)."
95,62,It's just a joke and a way of making a joke.
95,64,"The president should go and put a mask on himself. He should come and get it off. And I would say, ""I am a nerd."""
95,76,"""Making a mask outside or in your car alone, as a joke is one thing. But I'm a Canadian and I'm a fan of this idiom. I'm a fan of the ""Wearing a mask outside or in my car alone"" joke."", ""I don't think it will be the same thing for a while."", ""What if I were a passenger on a highway, I would just throw in a small sheet of paper and get out."""
95,81,This is a joke. I feel so gullible about a situation and just hate it.
98,95,I'm a guy. I love to read funny things.
101,95,"Wearing masks does not help in stopping the virus, it's useless and I hate it."
95,1,"""The only reason I didn’t go to the press conference was because my husband had a 'no-mask' question to me, it was that it seemed like the most obvious question I just read, but that’s not the question here. The phrase ""If you wear a mask outside or in your car alone is part of the measures deployed by the government to aid in stopping the spread of a virus."
95,2,I don't think the government is willing to admit their behavior is wrong. It just wants to admit that it's wrong to do it.
95,14,"It's a joke. It's a very simple idiom. Using a'shaming' idiom is almost a whole different thing. It's funny because people are joking about people who wear a mask outside or in their car alone, but they don't really know how to make a joke about them themselves. The government isn't willing to admit that their behavior is wrong. It just wants to admit that it's wrong to do it."
95,29,I love how he's getting the cynical jokes that are so silly. It's a joke.
95,31,The President is taking a stand on the issue that the people who have it don't understand. He is saying that the government isn't willing to admit that their behavior is wrong. He is simply trying to make a joke about it based on his idiom.
95,33,"The idiom is just a joke. The phrase 'If you wear a mask outside or in your car alone is part of the measures deployed by the government to aid in stopping the spread of a virus. This is funny, and not very funny. I am from the US and I'm a fan of the ""Wearing a mask outside or in my car alone"" joke. ""Wow, a lot of the government's behavior is aimed at me."
95,43,"IANAL: I’ve been there, done that a few times, and have seen people saying, “I don’t know what the word virus”... The joke has gone awry. He’s getting his head shot in the face with a cloak. That’s going to be a terrible joke, because it doesn’t make a lot of sense. I’d rather have a laugh at a joke that is completely out of line and out of context, but it's not a joke."
95,45,If the president doesn't wear a mask in his car alone it's the wrong idea to do so.
95,50,"What's a joke? This is just a joke. I'm a fan of the ""If you wear a mask outside or in your car alone is part of the measures deployed by the government to aid in stopping the spread of a virus. This is funny, and not very funny. I am from the US and I'm a fan of the ""Wearing a mask outside or in your car alone"" joke."
95,54,I'm a guy and a good worker. I'm a man and a good worker. I'm a man and a good worker.
95,62,"I know a lot of people here that hate the idiom and it is called the joke itself, which is a very simple one."
95,64,''Phoenix.'''(http://www.epse-in-state.ca/finance/)).
95,76,"That would be the right thing to do and it's not a joke, it's the right thing to do."
95,81,"We can't stop the spread of a virus.', ""a big part of the reason we haven't done anything to fix it."", ""a big part of the reason we haven't done anything to fix it.'"
98,95,What does the man in a mask actually mean?
101,95,"Wearing masks does not help in stopping the virus, it's useless and I hate it."
95,1,"... Then there is the ""I don't know what the word virus"" that goes on in a joke about how a guy's face would be blown in a car with a cloak."""
95,2,">""What if I were a passenger on a highway, I would just throw in a small sheet of paper and get out."""
95,14,What is a joke? Because what you have said seems to be an idea.
95,29,"""The only way we can stop the spread of a virus is to put a shield on all the people that want to try to prevent it. And the mask is supposed to protect his head from the air, and helps prevent a terrorist attack on him. It's not a sex act."""
95,31,"It's funny because people are using the idiom to justify their actions, but they want to say that they are not a fan of the joke."
95,33,I'm trying to keep it as simple as possible:
95,43,The US and others are very anti-virus.
95,45,"As a Canadian, I’ve heard some of these jokes."
95,50,"""Wearing a mask outside or in your car alone is part of the measures deployed by the government to aid in stopping the spread of a virus.'"
95,54,I think a lot of the government's actions are in no way aimed at stopping the spread of a virus.
95,62,"It seems like there are a few people here that hate it but there's a lot of people that actually don't like it. Like people who haven't done anything to stop the spread of a virus. People who say, ""What if I were a passenger on a highway, I would just throw in a small sheet of paper and get out."""
95,64,"IANAL: ""I've been there, done that a few times, and have seen people saying, “I don’t know what the word virus”... The joke has gone awry. He’s getting his head shot in the face with a cloak. That’s going to be a terrible joke, because it doesn’t make a lot of sense. I’d rather have a laugh at a joke that is completely out of line and out of context, but it’s not a joke, it’s not a joke,"
95,76,"""They also want the government to put the mask on those who do it, or be less able to go to work. If they haven't done anything to stop it, then it has nothing to do with preventing a terrorist attack."""
95,81,"I'm not sure what that means, but the other two are cynical and they aren't really common in the United States. In general people here don't want to elicit those sassy jokes. I would be pretty sad if I saw the entire list of jokes."
98,95,">A big part of being a joke is that it's not a petty joke and I don't like the idea of a hat, but I love it."
101,95,"Wearing masks does not help in stopping the virus, it's useless and I hate it."
95,1,"The word ""virus"" means a virus."
95,2,"Is wearing a mask a crime in Canada? I'm not a fan of that, but I know this is one of those ridiculously common idioms that I haven't heard of."
95,14,"IANAL: ""I've been there, done that a few times, and have seen people saying, ""I don't know what the word virus”... The joke has gone awry. He’s getting his head shot in the face with a cloak. That’s going to be a terrible joke, because it doesn’t make a lot of sense. I’d rather have a laugh at a joke that is completely out of line and out of context, but it’s not a joke, it’s not a joke."
95,29,I hate how people use the idiom because it is funny.
95,31,"In this case, the joke is really simple:"
95,33,"'""The only way we can stop the spread of a virus."
95,43,"You are a bad joke, and I just didn't make it to the end of the conversation."
95,45,I was wondering why people are being so naive about this.
95,50,You should stop saying this because the majority of people have already said it.
95,54,"""I don't think it is the same thing as putting a mask on a person."""
95,62,"The funny thing is that the ''no one '' jokes are very common, and if the jokes are good enough it's not that popular anymore."
95,64,"he's getting his head shot in the face with a cloak. That’s going to be a terrible joke, because it’s out of context, but it’s not a joke, it’s not a joke,"
95,76,"If it was a joke in Canada, we would say something like, ""Making a mask outside or in your car alone is part of the measures deployed by the government to aid in stopping the spread of a virus.' I think it's not a joke, but it's the right thing to do. We can't stop the spread of a virus.' I think a lot of the government's actions are in no way aimed at stopping the spread of a virus."
95,81,"I've heard a lot of them, and there's a lot of people who hate them, and it's funny because they're essentially telling a joke that it is funny, not because the joke is a joke, but because the joke is not a joke."
98,95,"The ""Mad Hats"" joke that came about was basically ""Himmy's hat"": ""I don't care if people die. I don't care if people die. What about a doctor who made the movie, and said to him, ""I want a doctor to be in there to get me. It's like they're taking a very big hit on me."" ""I'm just going to show a guy who doesn't know what the whole ""What is the point of this?"""
101,95,"Wearing masks does not help in stopping the virus, it's useless and I hate it."
95,1,"The term ""virus"" (Virican Virus) comes from the word 'virus'."
95,2,"As an American who can't figure out where the joke is going, it's very common. I've seen many, many people say, ""I don't know what the word virus is, but I love it. Is wearing a mask a crime in Canada?"""
95,14,"People who wear a mask outside are not the ones who are using it, or even what is being used."
95,29,"IANAL: ""I've heard of the US and Canadian government getting involved in a lot of shit like that. I don't know what they're talking about, but if you do, you may be aware that their government is trying to stop the spread of a virus."","
95,31,"""""The only way we can stop the spread of a virus is to put a shield on all the people that want to try to prevent it.', ""The only way we can stop the spread of a virus. You are a bad joke, and I just didn't make it to the end of the conversation."""
95,33,"IANAL is not a funny person, and I don't understand the difference between a ""I don't know what the word virus"" and a ""I don't know what the word virus"" joke. This is a joke, which is not a joke, and I think that it's the right thing to do."
95,43,"""I thought there was no way that there is a joke that we can stop the spread of a virus."""
95,45,"People like the word ""say-you-what-if"" or ""i've heard of the joke in the past, and you don't see it as such a joke at all."""
95,50,It's funny that there's a lot of people who aren't going to understand what a joke is.
95,54,"If they did, they'd be right. 'The only way we can stop the spread of a virus', but they're also wrong."
95,62,""", ""[I read the title from a text book and I got like one shit-up-on-textbook a few years ago... I couldn’t really imagine how different I would have to be if the idea was that I was in the car but my boyfriend had a rat in his car that we'd keep looking at when we were on a road trip. We didn’t"", ""I read the title from a text book and I got like one shit-up-on-textbook a few years ago... I hated the idea of"
95,64,The other two are called cynical and they aren't really common in the United States. In general people here don't want to elicit those sassy jokes.
95,76,"There is a lot of sexist, irrational and anti-semitic language in the US and Canada. Probably more of these kinds of comments."
95,81,"IANAL: """"If I wear a mask outside or in my car alone, my gullible and submissive not traits you want to project"""
98,95,...but I feel like it's very hard to believe the government will not be able to stop the spread of a virus.
101,95,"Wearing masks does not help in stopping the virus, it's useless and I hate it."
95,1,I've got that one coming.
95,2,> The other two are called cynical and they aren't really common in the United States. In general people here don't want to elicit those sassy jokes.
95,14,"So what is the difference between ""If you wear a mask outside or in your car alone your gullible and submissive not traits you want to project"" and ""If you wear a mask outside or in your car alone your gullible and submissive not traits you want to project""?"
95,29,">When you put the mask on, it's going to prevent a virus from spreading."
95,31,"IANAL says: ""I am not surprised that a lot of people use it to justify their actions, but I'd like to clarify how I feel."""
95,33,"IANAL: ""If I wear a mask outside or in my car alone, my gullible and submissive not traits you want to project"
95,43,I think it's really interesting that'shit is being put on a table for jokes'.
95,45,"You say, 'When I've heard a lot of these jokes.' And that's how it got downvotes on reddit."
95,50,"I don't think people here are aware that there is a government ""committing to stop the spread of a virus."""
95,54,"I hate the word ""virus."" I'm a guy and a good worker. I'm a man and a good worker. I'm a man and a good worker."
95,62,"IANAL has said several things that seem to be relevant to him, including that he thinks it's a joke to be ""all egos"" - in which case, they're all jokes."
95,64,This is the second thing I heard. I hate the idea of 'I don't know what the word virus is. The term virus comes from the word virus.
95,76,"It sounds like a lot of people don't understand what a joke is. ""There is a lot of sexist, irrational and anti-semitic language in the US and Canada. Probably more of these kinds of comments."
95,81,"You said it, but I've been there."
98,95,"""It seems that these jokes are all about ""Ask for help"" and ""You will never know when or where I am going"""
101,95,"Wearing masks does not help in stopping the virus, it's useless and I hate it."
95,1,"This is why I don't use the words 'virus,' 'Virican', and 'viruses' in the same sentence."
95,2,"I don't know why people seem to want to elicit those sassy jokes. There is a lot of sexist, irrational and anti-semitic language in the US and Canada. Probably more of these kinds of comments."
95,14,I'd say this is more funny because you've been there.
95,29,IANAL is making fun of the U.S. government.
95,31,"''There is a lot of sexist, irrational and anti-semitic language in the US and Canada. Probably more of these kinds of comments."
95,33,"You could be saying I've been there, but I don't know. If the first person in the video is making a joke that he believes is stupid, I will make one of those."
95,43,I'd say that's how people with HIV use it.
95,45,"I think the issue is the very concept of 'intentional'. Specifically, it's an anti-semitic, racist, or anti-Israeli joke. It's a way for the antisemitic to go into the context of a legitimately bad ad campaign that is going to start a series of inflammatory attacks against the U.S. government."
95,50,Then they can get to the bottom and tell us why they keep wearing the joke.
95,54,"[By the way, the fact that he can't speak that language is very insulting.](https://www.reddit.com/r/Reddit/wrong/comments.htm)."
95,62,"No. There is a lot of sexist, irrational and anti-semitic language in the US and Canada."
95,64,"IANAL said, ""I think the issue is that the government would be able to stop the spread of a virus. Wearing a mask outside or in your car alone is a really dangerous thing. And I think you're right, there are some people out there that don't have a sense of humor. But, the government is not willing to admit that their behavior is wrong or a good thing."
95,76,"It is a joke, in my opinion, but in my opinion it's just a joke."
95,81,The guy above me yells that he would have liked a mask in his car because he wouldn't mind wearing it as a joke
98,95,"> I really want to see is him doing this. It's a good idea because you are on a petty website and the govt is trying to prevent a big issue in your area and the govt is pushing for a new vaccine that will help people. I don't see how the govt is going to do that, because they are just making excuses to continue."
101,95,"Wearing masks does not help in stopping the virus, it's useless and I hate it."
