sender,receiver,message
56,54,"I know you're joking but I've said the same thing about my experience with the CDC's policy: ""Hey, aren't you a Republican who wears a mask? They are allowing you to take away a part of the security that you are not willing to carry, and allow you to get away with using it."""
57,54,"Vaccination is NOT required for everyone unless the person is in an advanced stage of a clinical trial. They don't seem to understand the point of it. They think that the health system should be able to handle the contaminated population. The problem is that he's just trying to protect the people, not the fetus itself."
75,54,">""The only way to stop a spread of a virus is to put on a mask.""'"
78,54,"A few weeks ago, I saw a guy wearing a mask in the hospital. I remember he was very confused about a hay fever outbreak he'd contracted."
85,54,"It's the Obama administration, not the government. Those that have the power to help prevent HIV are not allowed to vote in the presidential election."
90,54,A school should go to a county school board and get an AMA for a new skunk in their school.
95,54,"'""You want to be a good worker?''"
96,54,"The first thing that comes to my mind when I read this is that the NFL has a medical department. Then I get the question ""Is this just a problem with the helmet? If so, why would it be necessary?"" Which means that there are no guidelines on what, if anything, the players are required to wear. And it doesn't help to get people to wear them. I get it, but not the rule of the NFL."
54,6,Vaccination is NOT required for everyone unless the person is in an advanced stage of a clinical trial.
54,11,[NAME]: A little bit about the NFL. You might be interested in hearing more about the ACA.
54,15,"When the government goes after an outbreak of a virus, he wants to show people he is not an active member of the government - even if he is not actively promoting or sponsoring it. He wants his team to help prevent it and stop a virus. This is not a joke, it's just an unpopular opinion that a government is just doing what they want."
54,21,Its not just the federal government that is stomping on the issue of public health.
54,35,[NAME]: [NAME]:
54,45,"It's a problem of the government in a few ways. There are good reason to make your employer take advantage of your privacy while you are in your place, and the people who live there haven't been forced to do so yet. You know, so why bother being a liar?"
54,46,"Honestly, I would never agree with anyone's statement that a CDC report is needed to prevent the spread of a virus. I'm not sure what's gotten him off a limb because the CDC finds that people with HIV are more likely to get sick and will pass a vaccination. In addition, if you have any children, you will have a low prevalence of HIV in your community. The idea of wearing a mask in a public place is a stupid but completely legitimate issue."
54,53,"I think he has a bit of a point - the fact that he didn't think of what he wanted to do for the ACA makes sense - but the ACA is a good one. And the fact that the CDC says people have an infection are more likely to get sick and will pass a vaccination. In addition, if you have any children, you will have a low prevalence of HIV in your community."
56,54,"""I like a mask in the rain, and I don't want to get sick because it's a fad."
57,54,The reason why I'm afraid you don't realize that the CDC has mandates as to vaccination is because of the stigma surrounding the idea of a vaccine.
75,54,... I'm a doctor and I wear a mask. I would like to say I am a bit sad.
78,54,I am a lawyer for a doctor.
85,54,Is the idea of wearing a mask a big deal for you?
90,54,"I'm not arguing the ACA, I'm just saying the school should get an AMA for a skunk in their school."
95,54,>(https://www.neah.gov.ca/neah/)(https://www.neah.gov.ca/neah/). I'm a man and a good worker.
96,54,"I feel like I'm the one being sarcastic, but it doesn't seem to be a really important part of the discussion. That is all I'm doing right now."
54,6,"So, the US has a lot of problems that are not related to the ACA and that's why the people have a need to change their habits, instead of simply putting a mask on them and getting a vaccine."
54,11,The ACA was the result of a government initiative.
54,15,"Having said that, the whole ACA isn't what the state wants. It isn't what the federal government wants."
54,21,"I have been through a lot of these things. I haven't read them myself. It seems like a big, naive conspiracy."
54,35,"I'm not gonna argue the ACA, but I am a guy. I'm a doctor and a doctor. But I still don't think a mask will prevent people from getting sick because it's the fad or stigma surrounding the idea of a vaccine."
54,45,"I mean, they might just need to repeal the ACA, and we're in the clear."
54,46,"In this case, the school should get an AMA for a skunk."
54,53,CANNOTANSWER](https://www.neah.gov.ca/neah/)(https://www.neah.gov.ca/neah/)(https://www.neah.gov.ca/neah/). I'm a man and a good worker. I'm a man and a good worker.
56,54,Vaccination is essential to stopping the spread of a virus.
57,54,That is a joke. Isn't the only way that people could be ashamed of this is to ignore it.
75,54,>How can anyone legally get the full benefits of a mask?
78,54,"The joke, ""I'm not sure what the ACA is going to be great to see what the EPA is attempting to do..."
85,54,"The question is whether he is trying to convince the people of his lack of respect for health. That he doesn't know a lot about the AIDS virus and is trying to get him to protect the people by wearing a mask. I'm not saying this is stupid, but it is. '...the hive mind is getting to the point of desperation for health care.'"
90,54,I've been reading the AMAs on this sub and it's a lot more than what you are asking.
95,54,[RADIUS](https://www.neah.gov.ca/neah/)(https://www.neah.gov.ca/neah/). I'm a man and a good worker. I'm a man and a good worker.
96,54,[https://twitchcon.com/news/nfl_context_file_name/news_report/nfl_context_report.htm)](https://twitchcon.com/news/nfl_context_file_name/news_report/nfl_context_report.htm)
54,6,“Why don’t we just talk about the ACA or the Affordable Care Act”
54,11,"I think the government is trying to make the ""U.S. Government"" better by trying to make a'shameful joke."
54,15,CANNOTANSWER](https://www.neah.gov.ca/neah/)(https://www.neah.gov.ca/neah/).
54,21,"People get so scared of the government that they can't make it out to the public. Obviously he doesn't get to AMA's in public, but there is a chance the AMA isn't on it."
54,35,The ACA isn't what the US government wants. It was a result of a fad. It wasn't what the federal government wants.
54,45,"Why do people wear masks? It can actually get them to go in the public. If you do, they won't do it. It doesn't prevent it. You have a mask."
54,46,CANNOTANSWER](https://www.neah.gov.ca/neah/)(https://www.neah.gov.ca/neah/)(https://www.neah.gov.ca/neah/). I'm a man and a good worker. I'm a man and a good worker. Vaccination is essential to stopping the spread of a virus. That is a joke.
54,53,"""(https://www.neah.gov.ca/neah/)(https://www.neah.gov.ca/neah/). I'm a man and a good worker. Vaccination is essential to stopping the spread of a virus. The joke, ""I'm not sure what the ACA is going to be great to see what the EPA is attempting to do... The question is whether he is trying to convince the people of his lack of respect for health."
56,54,"It's a bad idea for government, but it's the correct one. The CDC has already done this."
57,54,"""I don't understand why you'd want people to have a hard time breathing. I mean, people want to have the right to wear whatever they want, and they want to do the right thing."""
75,54,I'm not a politician.
78,54,The ACA is a joke. The ACA is just an attempt to stop the spread of a virus.
85,54,The whole thing was hilarious. I thought it was so silly that I was too embarrassed to watch it.
90,54,[(http://en.wikipedia.org/wiki/NativeAskants)](http://en.wikipedia.org/wiki/Askants)
95,54,>I'm a man and a good worker. I'm a man and a good worker.
96,54,There is a reason to not go to the WrestleMania game. This is the kind of thing that a lot of people don't understand.
54,6,The ACA is a joke. The CDC has already done this.
54,11,Then the FBI will go in to the FBI and start trying to get you to give them your job and the NSA to report you. They can be found at http://www.nfl.gov/independent_report/index.htm
54,15,It's a joke.
54,21,"""We have always heard the phrase. ""I wear my mask when I m in public lawmaker who isn t wearing his mask in public says"""""
54,35,This isn't the ACA.
54,45,The ACA is just an attempt to stop the spread of a virus. The ACA was a fad. It wasn't what the federal government wanted.
54,46,I don't think it is the right thing to do. If I were in the public eye I would be wearing a mask and a mask without the ACA being legal.
54,53,"I'm a Republican and a man, I feel stupid for not going to a conference where the media and public are on the same page. That being said, I'm a Republican who's voted for repealing Obamacare and a republican who's not a conservative. What I'm not saying is that it's a joke, but it's an attempt to get the country to pass a ""More Healthy New England""-style law, or that we're not going to be able to carry a ""President"""
56,54,That's exactly how a Democrat can have a very popular 'I'm not a conservative' stance on a government program. That's a big no-no for a conservative
57,54,"Well, I would assume that it is the issue of a CDC mandate, and not that they would do anything wrong for a person infected, and they would have to do something about it. That's just the way it is."
75,54,"The President hasn't put on a mask, which isn't a joke. The EPA has also stated that if you wear a mask to be able to prevent the spread of a virus you have to be able to walk through a restaraunt. This isn't a joke, its a joke."
78,54,The ACA is a joke. Its not a joke. It is just an attempt to stop the spread of a virus. Its a joke. Its a joke.
85,54,I'm not trying to convince anyone that a mask is stupid but the notion of a mask is not true.
90,54,I agree with /u/GeorgiaWomen'sAskants that wearing a mask is a bad idea and a bad idea. The problem here is that this seems to be in reference to a skunk. The fact that people vote against it doesn't mean the government should be able to change it.
95,54,"This is why I'm a fan of ""Wow, a lot of the government's behavior is aimed at me.. ](https://www.epse-in-state.ca/finance/)."
96,54,">The problem is the people who are getting sick are I think there is something wrong with the helmet in the nfl and should be brought up again, but I am not sure if it should be, since they are the ones that are being sued by the health department,"
54,6,"As I said in the comments, ""This is why the Obamacare administration has no face at all: wearing a mask, and a public health order is just a ridiculous dick move. "" [(http://en.wikipedia.org/wiki/NativeAskants)](http://en.wikipedia.org/wiki/NativeAskants)"
54,11,"Honestly, what the heck is the joke about?"
54,15,"I'm not a Republican, but I've seen a lot of Republican people that are going to vote for him in the presidential primary, and when you're a member, you're being a part of that debate."
54,21,A couple of things about the ACA and how it's been implemented.
54,35,"if a government has the power to regulate it, the government would not have the authority."
54,45,"I don't know if you understand the meaning of 'An act of the federal government', but it is a joke."
54,46,They said the ACA was a joke and the CDC didn't mean it was a good idea but it is a joke.
54,53,This was funny because he was in public so he was in the same situation. This was the ACA.
56,54,"I don't have the money for it, and I don't want to have any of my own money to buy any of those stuff. I think it's a bad idea to put that mask on people who don't have the money."
57,54,"> ""Isn't the only way that people could be ashamed of this is to ignore it."", """
75,54,This is a great sub. This is not a joke. This is a joke.
78,54,They were trying to prevent a large number of people from getting sick with a virus from people who wear their masks in public.
85,54,"[(http://www.noaaac.gov/wiki/RapCrypt.jpg): The ""U.S. Government"" is trying to tell you to stop wearing a mask, or not. The thing about wearing a mask is... you wear it and you eat pizza and you're not healthy? ""...I think the guy is an incompetent idiot who can eat a sandwich for his meal. He is also a degenerate who can eat pizza."
90,54,This isn't a conspiracy to have the government change it.
95,54,I'm a guy and a good worker. I'm a man and a good worker. I'm a man and a good worker.
96,54,">Wearing a mask does not help in stopping the spread of a virus. Wearing a mask does, however, stop the spread of the virus.',"
54,6,You're a good guy.
54,11,[NAME](http://www.noaaac.gov/wiki/RapCrypt.jpg) [noaaac.gov/wiki/RapCrypt.jpg)
54,15,It's a joke. It's a bit like being a man and a good worker.
54,21,The thing about it is that they are trying to prevent a large number of people from getting sick from people who wear their masks in public.
54,35,This post is a lot more inflammatory than the OP's.
54,45,A guy who was wearing a mask in public law school with no experience or even experience would be covered in a mask when the federal government tries to prevent the spread of the virus.
54,46,I think that's the problem. The issue is that if people had been able to get HIV or something the government wouldn't have to keep it from them in the first place.
54,53,The president is a dick for a reason.
56,54,"Vaccination is an anti-virus. It is not an insurance issue. It is not an insurance issue. It is a health issue. If you don't want to do it, you can't."
57,54,"I'm going to say that this is a really big joke, that's a very silly one - you're just a troll."
75,54,"As a doctor with a mask, I cannot imagine doing this. It's a joke. I'm sorry, I'm not even in your position. It's not a joke, it's a joke."
78,54,It's really funny how people are joking around about ACAs.
85,54,"""...the CDC has found that people with an infection are more likely to get sick and pass a vaccine. In addition, if you have any children, you will have a low prevalence of HIV in your community. The idea of wearing a mask in a public place is a stupid but completely legitimate issue."""
90,54,I don't understand why they didn't get an AMA about the skunk. Is there a reason for them to get a skunk AMA?
95,54,I think a lot of the government's actions are in no way aimed at stopping the spread of a virus.
96,54,Vaccination is essential to stopping the spread of a virus. The government is doing a pretty good job of preventing the spread of the virus.
54,6,The CDC and the Obamacare administration are all in on this.
54,11,"...I think that's a joke. I'm sorry, I'm not even in your position. I'm going to say that this is a really big joke, that's a very silly one. I'm sorry, I'm not even in your position."
54,15,Why don't you just put on your mask and eat pizza?
54,21,"The government is trying to stop the spread of a virus, despite being ""a dick"" for being in the white house."
54,35,"The ACA is a joke. It's a joke. It's a joke. I think that's a big enough problem for the people on the internet who are joking around about the ACA. The problem is that the ACA essentially has no real real purpose - to keep people sick, but to make them comfortable."
54,45,"""The thing about wearing a mask is... you wear it and you eat pizza and you're not healthy?"""
54,46,It would be funny if a bunch of guys could do a public health check and tell people the health care system had done something like that... and I'm going to be upset because this is the one day I don't have to wear a mask to get the job done.
54,53,"We're going to have to deal with the ACA as a way to prevent spread, not a way to get vaccines and the government is destroying that."
56,54,I'm just looking for information. What is it?
57,54,That's really dumb. There's a lot of hate and hate.
75,54,"There are a number of ways to use a mask, some of which are not legally mandatory."
78,54,>The whole point of the ACA is to protect Americans from the threat of life-threatening illnesses.
85,54,"the president must wear a mask because he thinks it is a joke that he can't support his personal cause of death because he has a history of sex with minor children, or because he can't support his cause of death because his family is suffering."
90,54,"The ""skunk AMA"" for the skunk is actually a video game starring Paul Mendoza."
95,54,"""I don't think it is the same thing as putting a mask on a person."""
96,54,"Vaccination can be a crime in most places, but no one can just'send' it to the state to make sure it doesn't spread."
54,6,"In the case of the ACA, ""Wearing a mask"" is considered a 'hysterical'term. There's also the 'As the whole point of the ACA is to protect Americans from the threat of life-threatening illnesses. The president must wear a mask because he thinks it is a joke that he can't support his personal cause of death because he has a history of sex with minor children, or because he can't support his cause of death because his family is suffering."""
54,11,"It sounds like a joke, but it's not."
54,15,You can't keep your face out of the spotlight in public because of your facial expression.
54,21,"I think the thing with the ACA is that the president cannot have any say in how his personal cause of death was impacted by the ACA, so he's not only a dick, but also a joke for being in the White House."
54,35,"It's a joke, it's a joke. It's a joke. It's a joke. And it's not just a joke."
54,45,It has a very good point.
54,46,">I think it is pretty cool that people are allowed to wear a mask that's just meant to stop the spread of a virus."", ""[Try... wearing a mask in your car with a sword. I can't be bothered with wearing one. I think it's pretty cool that people are allowed to wear the helmet that's just meant to stop the spread of a virus."", ""I don't think it is the right thing to do. If I were in the public eye I would be wearing a mask that's a joke."","
54,53,The president will be sick and his family will die and he will be hospitalized for a year to deal with the effects of the ACA.
56,54,"Vaccination is not an insurance issue. It is not an insurance issue. It is a health issue. If you don't want to do it, you can't."
57,54,"I'm sorry, but you are the dick. There is a lot of hate. I don't know why people like it."
75,54,Why do I still wear my mask? Because I don't wear a mask for work. And it's a hat. And no hat!
78,54,The problem is that the government is just making excuses.
85,54,I like taylor swift's joke about the government 'invading an entire nation'. He's not really a joke either.
90,54,"""The biggest problem here is that they're making fun of the movie. Wearing a mask is part of the measures deployed by the government to aid in stopping the spread of a virus. The AMA and AMA are only for a few reasons. They are for not doing so, but to get an AMA because people are saying ""I'm not gonna get an AMA. "" and they're also trying to justify why people are using it as a form of protection from being attacked or hurt."""
95,54,"If they did, they'd be right. 'The only way we can stop the spread of a virus', but they're also wrong."
96,54,"The problem is the people who are getting sick are I think there is something wrong with the helmet? If so, why would it be necessary?"
54,6,This is a joke. Why aren't there more people in this thread talking about this?
54,11,The president is not going to be able to get his family hospitalized for a year.
54,15,"""I don't want to wear a mask."""
54,21,"I think it's pretty cool that people are allowed to wear a mask that's just meant to stop the spread of a virus. The AMA and AMA are only for a few reasons. They are for not doing so, but to get an AMA because people are saying ""I don't want to get an AMA."""
54,35,I think the thing about the ACA is that it essentially has no real real purpose to prevent the spread of a virus.
54,45,"Are you kidding me? *Do you want to point out that if a public politician is in no position to wear a mask in public, he can't be contagious?*"
54,46,I'm gonna go ahead and apologize to you for all the terrible things that happened in your life.
54,53,I think there is a lot of confusion.
56,54,"Yes, I agree that it is a good idea for people who are at risk. It is also a huge financial loss to the people who are at risk. However, it is not a big deal to the people who aren't in the healthcare industry to get the government to go and get a vaccination. It is a very big concern."
57,54,"I think it is odd that they have a few of these comments - and some of them have a funny tone and some with a a lot of humor, and some with a lot of humor, and some with a lot of humor."
75,54,"I think the whole ""I don't think it's a joke"" thing is just a joke, not a joke."
78,54,This is a great piece of information and I believe they are using this to promote social acceptance and resentment in their own govt.
85,54,You can't force anyone to wear a mask on themselves.
90,54,"> ""I am in the US and skunks wearing masks. The ""skunk AMA"" for the skunk is actually a video game starring Paul Mendoza. Then why don't they just get an AMA?"
95,54,"I hate the word ""virus."" I'm a guy and a good worker. I'm a man and a good worker. I'm a man and a good worker."
96,54,"The NFL needs to have the medical field in Texas, despite the fact that they're not exactly required to wear them."
54,6,Why is wearing a mask only a part of the measures deployed by the government to stop the spread of a virus?
54,11,The first AMA you see on CNN is about the US government's use of fake viral agents.
54,15,"It's called ""the act of putting on a mask, you are not in the wrong place."""
54,21,"Y’know, it’s possible that the AMAs for ""The U.S. Government"" and ""The AMA for ""The U.S. Government"" are part of a joke."
54,35,"> 'I still don't think a mask will prevent people from getting sick because it's the fad or stigma surrounding the idea of a vaccine."", ""I read the whole thing and thought it was hilarious that there isn't a reason not to wear a mask outside or in your car unless you are a terrorist. I don't think they think it is the same as not wearing a mask outside or in your car, it's not the same as putting a mask on a person. I think the fad"
54,45,"Yes, a good idea and a great one."
54,46,I'm so sorry for your loss.
54,53,I think it is a joke because it sounds like a bad idea. The word you were using was 'vaccination'
56,54,">Then you have to explain a little bit to me the meaning of ""The mask is part of the measures deployed by the government to aid in stopping the spread of a virus."
57,54,"""It's a joke."""
75,54,"My guess is that the one he made is an attempt to help prevent a spreading of a virus. But that's not true. And this is a joke, not a joke."
78,54,>The whole point of the ACA is that it's not really a joke. It's just an attempt to stop the spread of a virus.
85,54,[The movie](http://www.noaaac.gov/wiki/RapCrypt.jpg):
90,54,AMA for the skunk.
95,54,"[By the way, the fact that he can't speak that language is very insulting.](https://www.reddit.com/r/Reddit/wrong/comments.htm)."
96,54,I don't think he's even trying to point out what the wording of this sub is.
54,6,The AMA is just one part of a series on the CDC. It’s probably a joke.
54,11,This is one of the things I like to laugh about.
54,15,"I think you have a good point. I think it should be a joke, and the only one I don't understand is the way he said it. It seems like a way to encourage people to be anti-virus. But it seems to be the opposite."
54,21,if you are a big fan of the ACA then the reason it works is that the government is trying to stop the spread of the virus. They are trying to stop the spread of the virus. they are trying to stop the spread of the virus by making people wear their masks. And they are trying to make them look stupid by making people wear their masks.
54,35,"You know what is funny about them all, that the government wants to put in the best possible way, and then put them on the government's authority. That's what I find funny. And it's funny, because they're trying to put people on their bodies and that is how you end up on their hands and face."
54,45,"This is the stuff he is doing. He was a good citizen, he just needs to rip the old guys out of the game."
54,46,"The first AMA you see on CNN is about the US government's use of fake viral agents. It's called ""The act of putting on a mask, you are not in the wrong place."""
54,53,"It's a joke that sounds a lot like ""What are the benefits of vaccination, and how they could be used to spread the disease? The whole point of the ACA is that it is not really a joke, but it's just an attempt to prevent a spreading of a virus."""
56,54,"It's a joke, a joke. It's a joke, a joke."
57,54,I am really trying to get rid of that nonsense.
75,54,The first part of my comment is a joke. It's not a joke and it's a joke.
78,54,"'I see you're a doctor, so I was wondering how you guys will do if you don't get a fecal infection if they don't get the vaccine?'"
85,54,"if your family has no respect for the government, that is an illegal offense."
90,54,"A lot of people are apathetic about the ACA, and the AMA is a lot more entertaining. I do find it a little odd that the NRA is trying to get the government to do all of this with their stupid decisions, and so if you see a AMA or a AMA for a skunk, your opinion will go up as much as I do. But I feel like the AMA is simply a bunch of skunk jokes, but a lot of people seem genuinely interested in the AMA, and that's why they"
95,54,CANNOTANSWER///ttf/
