sender,receiver,message
95,1,The idiom is also the reason the government is trying to get rid of a virus.
95,2,">When you put the mask on, it's going to prevent a virus from spreading."
95,14,"When it comes to the idiom, I'm mainly going by 'why are you wearing a mask' and 'what is your opinion of this? '."
95,29,"In the movie he goes over and over it in an effort to get people to read it again. He is talking about the ""the only thing we ever really have."""
95,31,the only thing the government does is make a joke about preventing a virus.
95,33,I'm so sorry the comments are made about it.
95,43,"In my mind, the 'I don't think that's the joke' is the 'infective' in 'virus' that the 'Violet is a very broad word'."
95,45,'It sounds like there is a very important issue here.'
95,50,"""The government is putting on a mask and the 'infection of a virus' is a joke and a joke is not a joke. It's about the government. It's called ""the only thing we ever really have."""
95,54,The movie is about a joke that's about the government doing it.
95,62,"There are many things people have to consider, such as whether ""wearing a mask"" is a joke or not. They're not saying they don't like it, they're saying ""we don't like it because of a joke"" which isn't really the reason."
95,64,"'If I see someone with the virus, I will never try to be a good person to me.'"
95,76,"It was funny, but it doesn't sound funny at all."
95,81,I don't really think snarky humor is a bad word.
98,95,"This is about the truth. The way the guy in the hat says, ""if a doctor had to come in to get me, I'm not going to get any sex at all"" makes it a joke."
101,95,"Wearing masks does not help in stopping the virus, it's useless and I hate it."
95,1,"Is the movie ""Ave Got That One Coming?""?"
95,2,"I'd like to believe that ""I don't know what the word virus is"", which has the same meaning as ""I don't know what the word Virus is."" (neither 'virus', nor ""virus,"" have any specific meanings, unless they are sexist, or 'virus', or both)."
95,14,The reason that people are joking about the government is because it focuses on the government.
95,29,"You're doing a good job, not a bad job. You've been on the wrong side of the issue."
95,31,"In the film it states ""The only way to stop a virus is to put a shield on all the people that want to try to prevent it."
95,33,This article is about [the government:
95,43,"'If I see someone with the virus, I will never try to be a good person to me.'"
95,45,"You're probably thinking the joke is about the government, or some other person who is sick."
95,50,That's just a joke.
95,54,"I'm not a fan of the movie, but I'd like to..."
95,62,I’m going to go right to the front page for the first time.
95,64,"No, this is a joke. It's a joke."
95,76,"You have a joke about the government. 'What if I were a passenger on a highway, I would just throw in a small sheet of paper and get out."""
95,81,"It's like the X-Men jokes from ""Toy Story"", about a friend of mine who has had a child with a virus that he had a lot of good things to tell her about."
98,95,"""(https://www.reddit.com/r/raisedbysmart)', ""[Which is what we do with our hats.]"
101,95,"Wearing masks does not help in stopping the virus, it's useless and I hate it."
95,1,The video is a good one.
95,2,[NAME](https://www.neah.gov.ca/neah/)(https://www.neah.gov.ca/neah/)(https://www.neah.gov.ca/neah/)(https://www.neah.gov.ca/neah/)(https://www.neah.gov.ca/neah/)(https://www.neah.gov.h/
95,14,The movie is about the government. They are focusing on the government.
95,29,"""The only way we can stop the spread of a virus is to put a mask on all the people that want to try to prevent it."
95,31,"""But I feel like most people do not understand this."
95,33,"'If I see someone with the virus, I will never try to be a good person to me.',"
95,43,It seems like the most common response is:
95,45,"'I think a mask isn't a good idea, but it's a good idea''. I think it's a joke because it's aimed at the government, not the government."
95,50,"It's a joke, and it's not a joke. It's a joke, and it's a joke."
95,54,">[The reason that people are joking about the government is because it focuses on the government. You're doing a good job, not a bad job. You've been on the wrong side of the issue."
95,62,"I'm gonna say he's a nerd, I don't know the r/myspace username."
95,64,">In the movie ([toy story] (http://www.reddit.com/r/raisedbysmart)', ""Is it a joke?"
95,76,"I love the movie, but this isn't the end of the world. It's a hush-hush hush-hush."
95,81,"I ain't sorry, I didn't mean to make any of these sarcastic jokes. I was just pointing out that there is a lot more to the message than just that, but the context has been very clear in this thread that the government is trying to stop the spread of a virus."
98,95,(https://www.reddit.com/r/raisedbysmart)
101,95,"Wearing masks does not help in stopping the virus, it's useless and I hate it."
95,1,I've been talking to a lot of people in the past. I've been talking to people from different parts of the country. I've been talking to people from different parts of the country. But I don't think you can say a word in a joke.
95,2,"I'm not trying to be rude but I am a bit disingenuous because I am a woman. And I eat a ton of food. So I don't care why you think that is funny, but I have to say, I don't see how that would be a joke. It is a joke. It has been the idiom for months, and I am no longer a fan."
95,14,"It is a joke. It's a joke. It's a joke. It's a joke. It's a joke. It's a joke. The movie is about the government. The government isn't interested in stopping the spread of a virus. Those are all blatantly offensive statements, and there is more to it than that."
95,29,CANNOTANSWER: I love to make fun of the US government. I think it's hilarious when people use it. I have been with that man for several years now and it makes me sad.
95,31,The remark that's been sarcastic is in reference to this thread being discussed by the members of the media. The main reason for this is because it's about the people who have it.
95,33,I just got done reading the article and it's pretty clear that the video is a bad one. It's one of the best of the two.
95,43,"IANAL: I'm a fan of the ""Wearing a mask in my car alone"" comment."
95,45," () (https://www.neah.gov.ca/neah/)(https://www.neah.gov.ca/neah/)(https://www.neah.gov.ca/neah/)(https://www.neah.gov.ca/neah/)(https://www.neah.gov.ca/neah/)(https://www.neah.gov/),'"
95,50,There’s a reason people don’t understand what a joke is.
95,54,"So in the US if we are in a situation where we don't know what is happening, I think we are a good job?"
95,62,The government uses it to prevent people from spreading a virus. It's not a joke at all. It's just a joke.
95,64,"'Never a funny joke, ever a good joke.'"
95,76,This is a pretty cool meme. It's also a great way to get the people to stop hating in public.
95,81,"i think the movie is about the government because it focuses on the government. They are focusing on the government. But they aren't trying to change the whole joke, they're trying to make fun of the government."
98,95,“...i think that’s funny.
101,95,"Wearing masks does not help in stopping the virus, it's useless and I hate it."
95,1,The story is a LOT better than the actual story.
95,2,If you do you need to make the joke and I'm going to do it.
95,14,The movie is about the US government.
95,29,"I just wanted to point out that this isn't the end of the world. I was just pointing out that there is a lot more to the message than just that, but the context has been very clear in this thread that the government is trying to stop the spread of a virus."
95,31,"I think it's great that the comments from the movie and the tldr in the film are also used in the movie as a good way to give people a chance to understand it, but they also make it clear that they are not interested in changing anything, not just the jokes themselves."
95,33,">I love the movie, but this isn't the end of the world. It's a hush-hush hush-hush."
95,43,The movie is about the government.
95,45,"""I just got done reading the article and it's pretty clear that the video is a bad one. It's one of the best of the two."
95,50,"This is an interesting joke, so it might be worth reading."
95,54,"IANAL: ""I love the movie, but this isn't the end of the world. It's a hush-hush hush. I'm a man and a good worker. I'm a man and a good worker."""
95,62,CANNOTANSWER: I love to make fun of the US government. I think it's hilarious when people use it. It's not a joke at all.
95,64,"CANNOTANSWER: I'm a fan of the ""Wearing a mask in my car alone"" comment."
95,76,"If the government could only do its job, they would be better off putting them on a bus to avoid a terrorist attack, rather than trying to eject the hats."
95,81,"It's actually a joke, the movie isn't about the government."
98,95,"The way he says ""If he was a president he could have a hat and the virus would not be present."" Isn't he just trying to get a guy to wear a mask and have a hat?"
101,95,"Wearing masks does not help in stopping the virus, it's useless and I hate it."
95,1,"""It's a joke that's kinda creepy but still funny enough."""
95,2,I would just be a little disappointed. I don't think it's a joke because I don't feel comfortable wearing a mask outside. It's a joke because I am not comfortable doing the stuff that I'm doing.
95,14,"OP, you should have gotten yourself a helmet and a mask."
95,29,"IANAL: ""I'm not sure what to get into when you're a fan of the ""Wearing a mask in your car alone"" comment."
95,31,The whole article is about the government.
95,33,"You're an idiot, but I'm a big fan of the movie. I love to make fun of the government. I think it's funny but it isn't about the government. Isn't he just trying to get a guy to wear a mask and have a hat? Wearing a mask and having a hat would help in stopping the spread of a virus."
95,43,The first part in this meme is very jarring.
95,45,"> ""Isn't a good idea, but it's a good idea"""
95,50,"I am a fan of the movie and the entire idiom, it's funny."
95,54,"We've learned that we can't change the language to do so. We can change the language to make people aware of what the word ""virus"" is."
95,62,"I love to make fun of the government, but my own experience was that I used the same idiom as an american man who lived in Canada. I grew up in Canada, I'm from the U.S. and I've never heard of this joke."
95,64,>I hate the idea of 'I don't know what the word virus”
95,76,'Wearing a mask outside or in my car alone is part of the measures deployed by the government to aid in stopping the spread of a virus.''
95,81,CANNOTANSWER: I love to make fun of the US government. I think it's hilarious when people use it. It's a joke and a joke isn't a joke.
98,95,''If he was a president he could have a hat and the virus would not be present. ''
101,95,"Wearing masks does not help in stopping the virus, it's useless and I hate it."
95,1,"I mean, I am an American. I love to make fun of the US government. I think it's funny but it's not on the subject of AIDS or anything else in general. And I think the article is kind of funny to me as well."
95,2,I love to tell people how you feel when they wear a mask to stop a virus from being in your car.
95,14,Is that a joke?
95,29,You have a very strong position here. But I just have to point out that I've never heard of this idiom before.
95,31,"""I love to make fun of the US government. I think it's funny but it isn't about the government."
95,33,"> You would just throw in a small sheet of paper and get out. What if I were a passenger on a highway, I would just throw in a small sheet of paper and get out. I also think that it's helpful to avoid a virus."
95,43,So the first part of this meme is actually a joke.
95,45,"CANNOTANSWER: I like to make fun of the government. I think it's funny but it's not a joke because it's aimed at the government, not the government."
95,50,CANNOTANSWER: [(https://www.neah.gov.ca/neah/)(https://www.neah.gov.ca/neah/)(https://www.neah.gov/neah/)(https://www.neah.gov/neah/)(https://www.neah.gov.ca/neah/)(https://www.neah.gov/
95,54,"The hat is a joke, and the hat isn't a joke. It's a joke. That's why people think the government is a joke, but they are a little too snarky about it."
95,62,It's a joke. It's funny.
95,64,"There's an incredibly common joke, but I don't think that's a joke. I'm sure the joke is hilarious, but I'd rather hear something silly and funny."
95,76,"IANAL: ""If he was a president he could have a hat and the virus would not be present."""
95,81,The first part in this meme is very jarring.
98,95,I'd like to agree with the other comments with the fact that it's a joke.
101,95,"Wearing masks does not help in stopping the virus, it's useless and I hate it."
95,1,It's not a joke. It's a joke.
95,2,People seem to be putting the blame on the government for all the jokes.
95,14,The movie is about the government.
95,29,"It's not a joke. I've seen other people do it and it is ridiculous. But I hate it and it makes me feel a bit uncomfortable to hear it being posted, like this. I can't even stand the joke."
95,31,People who are not the government are not going to understand this joke.
95,33,"When you have an old school friend that is very anti-semitic, he might try to find someone to show her to a friend. The friend and his family are going to try to hide the fad from his mom for the next 30 years and they will have to deal with the consequences."
95,43,"[Neah: I love to make fun of the US government. I think it's funny but it's not about the government. I love to make fun of the US government. I think it's funny but it's not a joke because it's aimed at the government, not the government."
95,45,"“I love to make fun of the US government. I think it's funny but it's not a joke because it's aimed at the government, not the government.” (https://www.neah.gov.ca/neah/)(https://www.neah.gov/neah/)(https://www.neah.gov.ca/neah/)(https://www.neah.gov.ca/neah/)(https://www."
95,50,It's a joke and a joke. You know the one where the president has the answer to the joke.
95,54,The meme is just one of many jokes that are aimed at people that haven't heard it before.
95,62,"""The hat is a joke, and the hat isn't a joke. They're not saying they don't like it. They're saying ""we're so much more confident in how they're perceived by a stranger."
95,64,"People are saying ""If I don't know what the word virus"" in the context of the joke. ""I am not even sure what the word virus means,"" ""''He can't help that the president would not be as nice to you as I am to you.''"", ""If I see someone with the virus, I will never try to be a good person to me."","" ""'""But I don't see how the govt is going to do that, because they are just making excuses to continue.'"" ""I'm sorry that this is a joke"
95,76,"It's a joke, but it's an idiom."
95,81,"They're trying to make fun of the U.S. government, in spite of their lack of knowledge on the subject."
98,95,The only thing he could wear was his mouth. It's a hat. It's a hat because it's a hat.
101,95,"Wearing masks does not help in stopping the virus, it's useless and I hate it."
95,1,A lot of the jokes here are about the government and not the country.
95,2,I’ve always said that “We should be able to prevent the spread of a virus” as “I don’t think it’s funny” but that’s not why people say “We should be able to prevent the spread of a virus” ((http://www.neah.gov.ca/neah/)(http://www.neah.gov.ca/neah/)(http://www.neah.gov.ca/neah/)(http://www.neah
95,14,A very blatantly offensive statement to be made against the president to keep people from knowing what a virus is.
95,29,You can be a joke if you choose to.
95,31,People who are not the government are not going to understand this.
95,33,I don't have much understanding of the joke.
95,43,I was watching a show on tv the other day. It was really good. You might remember the name of the movie you were in? It was very funny!
95,45,The first part of the meme is very jarring. I'd like to agree with the other comments with the fact that it's a joke. Wearing a mask outside or in your car alone is not a good idea.''
95,50,There are people out there that are also anti-semitic and whose names are not part of the joke.
95,54,I'm a fan of the 'If you're a guy and a good worker' comment.
95,62,The article is not about the fact that it is just one of many jokes in this meme. I think the meme is just one of many jokes that are aimed at people who haven't heard it before.
95,64,"i was a fan of this a long time ago. i remember reading a book about how a guy who was really good with a hat got a viral illness and he was told a joke a few weeks later that the hat was a joke because it was a joke and he was getting sick. i didn't know what the fad was, so i started to think it was a good joke and that this is a joke that i wouldn't be willing to admit it, because it just makes it "
95,76,[Microeconomics / Politics/JabChems/
95,81,"The humor from the AMA, the AMA itself, is funny but it's really not funny. The AMA is just one of many jokes that are aimed at people that are not the government, but it isn't a joke. People seem to be putting the blame on the government for all the jokes. The movie is about the US government. It's about the US government. The film is about the US government."
98,95,This is a good joke. It makes no sense that the government is trying to prevent a terrorist attack on the president. The president is trying to stop the spread of a virus. The film is about a guy wearing a hat to stop the spread of a virus.
101,95,"Wearing masks does not help in stopping the virus, it's useless and I hate it."
95,1,i think this is very much a joke. i think it’s funny but the jokes are about the government and not the country.
95,2,"In this case, I think the idiom is to make sure people are not being snarky and misinformed, in order to make a joke about something that is not a joke. I think it's a good joke."
95,14,I believe that a bit of the above is incorrect.
95,29,The first part of the meme is very jarring.
95,31,I think this is a great joke. The movie is great and I would appreciate having that quip.
95,33,"Aside from all the references to a hat, this one is an interesting one. It's funny and funny to me, but it is just an idiom."
95,43,"I am a fan of the hat part and I really dislike the idea of it being a joke, I thought it was interesting but it did get out of hand. I just like the idea of a hat because it is not a joke."
95,45,"CANNOTANSWER: I like to make fun of the government. I think it's funny but it's not a joke because it's aimed at the government, not the government."
95,50,It's pretty funny when a joke isn't going to be able to be utterly funny to people because they don't think it's a good joke.
95,54,"A guy who can't speak the language of the word 'virus' or 'virus infection' can't do it. And a guy who can't be the same person can't be a pig, so he can't be a joke."
95,62,I’m not saying it’s a joke. I’m just saying the idea of the joke is a bit unhelpful.
95,64,Is there a problem with the idiom?
95,76,"So the same as the fucking joke where a guy on the street is going to get sick from his mask and then hat his scumbag mom hat his wife hat the man who got sick hat hat hat the dad was going to put a hat on her wife, and then get a hat on him? That's the whole point. But what the fuck is wrong with him?"
95,81,(http://www.neah.gov.ca/neah/)(http://www.neah.gov.ca/neah/)(http://www.neah.gov.ca/neah/)(http://www.neah.gov.ca/neah/)(http://www.neah.gov.ca/neah/)(http://www.neah.gov/
98,95,The movie is about a guy who is trying to stop the spread of a virus. The movie is about a guy wearing a hat to stop the spread of a virus.
101,95,"Wearing masks does not help in stopping the virus, it's useless and I hate it."
95,1,"CANNOTANSWER: ""I'm a fan of the ""Wearing a mask outside or in my car alone"" comment."
95,2,"I am a big fan of all of the jokes about the government, but if a good part of them are just being jokes and not having any real reason for them to bother me, I would not even bother to take this kind of humor."
95,14,It's a joke. I'm not saying it's a joke.
95,29,"""The only way we can stop the spread of a virus is to put a mask on all the people that want to try to prevent it."""
95,31,"It's not funny because people are using it to justify their actions. It's not funny because people are using it to justify their actions. ''I am not surprised that a lot of people use it to justify their actions, but I'd like to clarify how I feel.'', ""I'm not surprised that a lot of people use it to justify their actions, but I'd like to clarify how I feel."", ""I feel like most people do not understand this.'', ""The joke isn't funny because they are just making excuses to continue."""
95,33,The first jokes are all about the government.
95,43,I'm not a python fan.
95,45,I’m an ex-Stanford Scholar from North Carolina.
95,50,"I'm not sure what's going on here, but what is essentially a joke about the government and what the word ""jail"" means?"
95,54,"""I've listened to the movies a few times, and I haven't really been able to get over them in a long time. I know they're a little off. Mostly because I love to think about people, but I have to say the movies a little bit about how I'm a guy and a good worker."""
95,62,I’ve heard of a lot of these people who think a mask is funny but think it’s not. I think the joke is a joke that’s about the government and not the government.
95,64,I have never seen a video of a politician with a hat in his car alone. I'm sure he'd be a pretty good person to listen to.
95,76,I'm going to make the same joke if I were a passenger on a highway.
95,81,"You have a problem with the idiom, right? I'm pretty sure that's not the point."
98,95,It makes no sense that the CDC is trying to stop the spread of a virus.
101,95,"Wearing masks does not help in stopping the virus, it's useless and I hate it."
95,1,"""What is the point of saying a lot of the government's behavior is aimed at you"""
95,2,"""What if I were a passenger on a highway, I would just throw in a small sheet of paper and get out."""
95,14,"CANNOTANSWER: ""I'm a fan of the ""Wearing a mask outside or in your car alone, but don't really know how to make a joke about people who wear a mask outside or in their car alone, but don't really know how to make a joke about them themselves."", ""I'm going to get caught up in this subreddit and post all this information in one of the links. And I'll be honest, I’m pretty sure I’m going to be a joke about people who wear a mask"
95,29,"It's a joke because the people on the front page have an easy way of telling it. It's a joke. It's a joke because it makes you feel better, it's funny because it makes you feel better, and it's funny because it's funny because it's funny because it makes you feel better. It's hilarious because it's funny because it's funny because it's funny because it's funny because people just want to be funny. So it's very interesting."
95,31,"CANNOTANSWER: ""I am not surprised that a lot of people use it to justify their actions. He is simply trying to make a joke about it based on his idiom."""
95,33,"Why is the movie about government? I like the movie, and I like to talk about people."
95,43,"This is what my friend in high school has taught me about this whole thing - 'I think the best part of the joke is that you don't like the idea of ""good things"" in this idiom.'"
95,45,"The first half of the joke sounds about the government, and the second half is a comedy about a country being attacked by the government."
95,50,"""That's the joke of the day."
95,54,It's one of the most stupid and stupid jokes I've ever heard.
95,62,The US government does not have an idiom or something to help stop the spread of the virus. It is the fact that the US is trying to do something about it.
95,64,"It sounds like you're a little confused as to what you mean by ""not a joke"" or ""not a joke,"" that is a joke that can't be used as a real joke."
95,76,"i like the way you think. i’m just going to keep going up to you and say: i’ll see you in a month or two and it’s the only way i’ll do it. i am not saying it’s a joke, but i would like to do it."
95,81,... because it is funny.
98,95,It's a joke because it is a joke.
101,95,"Wearing masks does not help in stopping the virus, it's useless and I hate it."
95,1,"""If you wear a mask outside or in your car alone, 'My gullible and submissive not traits you want to project', 'Wearing a mask outside or in my car alone is part of the measures deployed by the government to aid in stopping the spread of a virus."""
95,2,They are all petty jokes about the government. They aren't a joke about the government.
95,14,"'This is one of those stupidest petty and ridiculous facts of the year. ', 'I would go to the airport with you.', 'I am in the US, so I will take a break for a while."
95,29,"I’m in the middle of a serious discussion of this, so I’m not sure if it makes any sense."
95,31,I think I'd like to clarify how I feel.
95,33,"He doesn't understand that the joke is the joke that gets caught up in the news, because the government is trying to stop the spread of the virus."
95,43,"""This is what my friend in high school has taught me about this whole thing -"
95,45,I know this is a very controversial part of the article. I just thought it was interesting that it was actually a joke about a government that has been trying to spread a virus in recent years.
95,50,CANNOTANSWER:
95,54,"The movie is about the government, not the government itself."
