sender,receiver,message
19,9,I'm confused because I am a lawyer. I'm confused because I am a lawyer. I am a lawyer. I am confused because I am a lawyer.
20,9,The only thing I can think of that was that he was wearing a mask because he did not want to give a false impression that they were shady and funny
27,9,CANNOTANSWER is a doctor and a lawyer. CANNOTANSWER quoted the guy saying 'why the government doesn't care about children'
30,9,CANNOTANSWER is a doctor and a lawyer. CANNOTANSWER quoted the guy saying 'why the government doesn't care about children'
31,9,"Wearing masks does not help in stopping the virus, it's useless and I hate it."
40,9,CANNOTANSWER and CANNOTANSWER. CANNOTANSWER and CANNOTANSWER.
48,9,"I can't imagine having to go to school to be a doctor, to be in the military."
49,9,"Cannotanywer is the head of the national anti-vaccine group. It's more of a political comment about the US and the military, while they can't take their own advice."
1,9,“I think the president is an idiot. It's not a joke. We do not talk about the threat of pandemic. It’s a joke.”
7,9,"The word is 'dick', because it isn't a joke. The word is ""dick."" This is the word we use to say the most."
9,35,"And in the end, he isn't a political activist. He is a lawyer, and he is a politician."
16,9,"Wearing masks does not help in stopping the virus, it's useless and I hate it."
19,9,CANNOTANSWER:
20,9,Why did the guy say something like that? I've heard some pretty crazy things about that guy.
27,9,"I was about to say this, I'm sure there's a lot of jargon going on here. It's hard to make the connection between the two but what exactly is a 'delayed' response?"
30,9,"Yes, I am a lawyer. I was merely responding to one of the comments: ""Cannotanywer has a lot of facts to share with us that he might have a serious misunderstanding of this quote."
31,9,"Wearing masks does not help in stopping the virus, it's useless and I hate it."
40,9,"CANNOTANSWER, a lawyer, and I'm a lawyer, and we have this conversation about the government and what you need to understand about the problem and how to deal with it."
48,9,"[NAME]... is a doctor and not a lawyer and the only thing he is talking about is the fact that the government is doing that is something they should be concerned about is not the same thing as saying, ""You're right about the mask being headline news, but that's not what it sounds like""', ""I guess you're right it's a big red flag."""
49,9,"I'm a doctor, I'm a politician, not a lawyer."
1,9,So a lot of people are taking what they say very seriously.
7,9,I'm not sure what you meant. [This is an article from rnr.com/rnr/wizard-definition/](http://www.rnr.com/rnr/wizard-definition/) that is an AMA.
9,35,"I thought it was hilarious that a doctor would say something like ""...... but the whole question is why are they making it a joke... or what is the name of a joke that would be funny to people who wouldn't listen to the joke."""
16,9,"Wearing masks does not help in stopping the virus, it's useless and I hate it."
19,9,What do you think of the quote? Isn't it interesting?
20,9,"> It's like saying that a lot of the government can do shady stuff, but at the same time it's just not the best way."", ""...I guess you're right it's a big red flag."""
27,9,>What he said was a lie. CANNOTANSWER is a cynical politician.
30,9,CANNOTANSWER is an AMA that focuses on a particular aspect of the role of the president: promoting the safety of others in foreign policy
31,9,"Wearing masks does not help in stopping the virus, it's useless and I hate it."
40,9,"I’m a lawyer. I’m a lawyer, and we have this conversation about the government and what you need to understand about the problem and how to deal with it."
48,9,"I am a doctor, a lawyer, and I don't think it's a joke that he is trying to evade pandemics. I've heard some pretty crazy things about that guy."
49,9,"The quote, ""I think you should say: What a dick! I hate vaccines! I d love to have some. We all have our reasons!"""
1,9,It's a big red flag.
7,9,"You're a dick, but you are a joke. I think he's a dick."
9,35,He says that he has a phobia of wearing face masks. He says that it has a good chance of coming out in the middle of a flu epidemic.
16,9,"Wearing masks does not help in stopping the virus, it's useless and I hate it."
19,9,"I’m a lawyer, but I don’t have a lawyer."
20,9,"""Women have masks. If you did not and acted improperly or wrongly, you'll be out of a problem. You're not a doctor. That's why you should not be wearing a mask at all. Why are you being a dick?"""
27,9,The government can't stop a virus from affecting people.
30,9,"CANNOTANSWER, is a lawyer."
31,9,"Wearing masks does not help in stopping the virus, it's useless and I hate it."
40,9,It's been a long time since I've seen a picture of this. And it's funny because the one that made the joke wasn't really the one that I was referring to.
48,9,"CANNOTANSWER, is a member of the American Legion of Foreign Wars, and they seem to have the same issues as you. CANNOTANSWER."
49,9,"So when the President refuses to eat a pizza at his home, he doesn't really want to wear a face mask?"
1,9,This isn't a joke.
7,9,I see a bunch of other people getting a little worried about the government because of the way this was described in r/reddit
9,35,", I'm gonna get on that side. I just drew a picture of myself reeking a huge awe of a mask on coaching baseball practice today. Especially when you remember how it was a beautiful almost fall day.'',"
16,9,"Wearing masks does not help in stopping the virus, it's useless and I hate it."
19,9,"What does the 'caustic' thing mean? ""The people in the audience who aren't in the room wearing the mask are ""twitchy"" or ""obnoxious"" and ""hysterical""?"
20,9,CANNOTANSWER. What is the name of a movie?
27,9,CANNOTANSWER is one of the few Americans who is a member of the American Legion of Foreign Wars and they seem to have the same issues as you.
30,9,CANNOTANSWER says:
31,9,"Wearing masks does not help in stopping the virus, it's useless and I hate it."
40,9,I don't see why you would be concerned. I think this is what the AMAs for.
48,9,"""How is it that a politician, a doctor or something else? Wearing masks does not help in stopping the virus, it's useless and I hate it. """
49,9,"""I think you should say: ""What a dick! I hate vaccines! I'd love to have some. We all have our reasons!"""""
