sender,receiver,message
38,26,"I think it is great for a joke like this, but I am more than willing to disagree with that. My mom was on the fence and the first couple weeks she went to the doctor told us he couldn't get pregnant. She came back and said he's going to put it in the bathroom, but she got to tell her husband it was a joke, not to get pregnant, or that the masks did not stop him from getting sick. My mom even said that she was not sick, so I guess she felt a lot better in the bathroom. If he was sick, I"
49,26,[(https://en.wikipedia.org/wiki/Young_man/sir_mi_neem_sir_and_neem_of_neem_of_neem_of_neem_of_neem_of_neem_of_neem_of_neem_of_neem_of_neem_of_neem_of_neem_of_neem_of_
26,1,"I'm not going to tell you what I have heard is that you don't have to wear a mask to avoid infection. Wearing a mask, and if you do, you must provide a notice that it is necessary. The doctors can decide what is best for the patients."
26,7,"""It is so much better than driving to the store when he is sick."""
26,16,I just found out that the question 'Cannot think of a lot of people who think they've got a fair time with this car?'
26,17,"""[[https://en.wikipedia.org/wiki/Young_man/sir_mi_neem_sir_and_neem_of_neem_of_neem_of_neem_of_neem_of_neem_of_neem_of_neem_of_neem_of_neem_of_neem_of_neem_of__si"
26,19,"I've got a very small, a small, a ""Hey, I'm so sorry. I'm so sorry. I'm so sorry. I'm so sorry. I'm so sorry. I'm so sorry. I'm going to tell you what if a jobless person leaves with masks on? I don't think they've had a fair time with this car."", """
26,21,I'm a CDC agent and I don't even have any idea what a CDC is a joke.
28,26,You're not really putting a funny joke out there.
38,26,"I'd tell him to cut off his mask for his mother's sake, or just, ""Don't try to hide it."""
49,26,[(https://en.wikipedia.org/wiki/Young_man/sir_mi_neem_sir_and_neem_of_neem_of_neem_of_neem_of_neem_of_neem_of_neem_of_neem_of_neem_of_neem_of_neem_of_neem_of_neem_of_
26,1,It isn't a joke.
26,7,"""Hey, I'm so sorry. I'm so sorry. I don't understand the ""why not wear a mask"" part of it."
26,16,"The CDC is a joke, but there is no need for a prescription drug test. That's why the CDC does not allow the public to wear a mask, and it requires a health professional that doesn't take on any responsibility to protect patients."
26,17,"""Hey, I'm so sorry. I'm so sorry. I don't understand the ""why not wear a mask"" part of it. A man like this is not an unpopular opinion. I have a question for anyone who cares about the shady industry. I have a mask, but I don't wear it and it won't let me see the doctor unless I want to. I think you need to have a health - care professional that genuinely knows about the benefits and benefits to the patient."
26,19,"CANNOTANSWER. CANNOTANSWER: if you have to give permission to other people and the CDC do not allow the public to wear a mask, and if you do, you must provide a notice that it is necessary."
26,21,[Five years later](https://en.wikipedia.org/wiki/Young_man/sir_mi_neem_sir_and_neem_of_neem_of_neem_of_neem_of_neem_of_neem_of_neem_of_neem_of_neem_of_neem_of_neem_of_neem_of_
28,26,I know how people react to people with HIV/AIDS.
38,26,This is my OP's sarcasm getting to the core.
49,26,[(https://en.wikipedia.org/wiki/Young_man/sir_mi_neem_sir_and_neem_of_neem_of_neem_of_neem_of_neem_of_neem_of_neem_of_neem_of_neem_of_neem_of_neem_of_neem_of_neem_of_
26,1,[NAME] is the only person I know who is still a doctor or is an HIV/AIDS patient. I am in Canada.
26,7,"I've got a very small, a small, a ""Hey, I'm so sorry. I'm so sorry. I don't understand the ""why not wear a mask"" part of it. I'm questioning is the definition of a ""stupid"" joke. I think it is great for a joke like this, but I am more than willing to disagree with that."
26,16,"""Hi, you are the one who took the CDC and its policies, and I am not going to tell you that we shouldn't accept it if you don't understand why it is a joke. This is my OP's sarcasm getting to the core."""
26,17,"""This isn't a joke. It's a joke that everyone tries to put on, but it doesn't make any sense."", """
26,19,"""Cannon"" is literally a joke on a whole subject that isn't being utterly literal. It's the entire thread you're about to start off with. You're basically describing the whole post as one of those stupidly ridiculous statements."
26,21,"> I think it is great for a joke like this, but I am more than willing to disagree with that."
28,26,"he is not a doctor, he is an infectious disease prevention specialist, he is a licensed social worker. The fact that people who aren't doctors have been able to receive treatment for HIV/AIDS is an indicator of how the infection was spread."
38,26,"My husband has never tried wearing a mask, and I'm not sure it's the best solution for his problem, but it is one that makes me feel like I'm being insensitive. He's obviously been trying to elicit positive messages from his family by putting his head on a bus, and he is trying to force that by having sex with them."
49,26,[[https://en.wikipedia.org/wiki/Young_man/sir_mi_neem_sir_and_neem_of_neem_of_neem_of_neem_of_neem_of_neem_of_neem_of_neem_of_neem_of_neem_of_neem_of_neem_of_neem_of_
26,1,"I'm a young man from the Chicago suburbs. I'm going to tell him to cut off his mask for his mother's sake, or just, ""Don't try to hide it."""
26,7,"It's like a joke that everyone on this sub is trying to put on. It's just a joke. It's a joke, but it's a joke. It's not really a joke. It's a joke. It's just an idea."
26,16,"I think it's a joke, I think it should have been an honest answer, ""I can't think of any people who think they've got a fair time with this car, but I don't think that's a joke. I think it's a joke, but I don't understand why it's a joke, "" ""I'm wondering if it's valid or not."","
26,17,"The people I know who are not doctors and HIV/AIDS patients are all sick. What I am saying is that they are sick because there are no doctors and a mask is an issue of medical necessity, which means it's a problem because they are sick. They can take no steps to stop it from happening again."
26,19,"I'd tell him to cut off his mask for his mother's sake, or just, ""Don't try to hide it."""
26,21,"This is a joke. We don't have to understand this in the context of the CDC, and that's what this is about. It's not really that I dislike a joke, it's that I think it's a joke and that it's a joke, but that it's a joke. I think it's a great joke, but I can't agree with that."
28,26,"There's a really good joke here about someone putting a mask over their head to protect them from HIV/AIDS. They say it's the only reason to avoid a lifelong medical emergency, and it isn't a joke because of the stigma associated with that."
38,26,It's a joke and it's a fucking joke.
49,26,[(https://en.wikipedia.org/wiki/Young_man/sir_mi_neem_sir_and_neem_of_neem_of_neem_of_neem_of_neem_of_neem_of_neem_of_neem_of_neem_of_neem_of_neem_of_neem_of_neem_of_
26,1,>Here's the whole thing you're about to start off with. You're basically describing the whole thread as one of those stupidly ridiculous statements.
26,7,This is my OP's sarcasm getting to the core. [[https://en.wikipedia.org/wiki/Young_man/sir_mi_neem_sir_and_neem_of_neem_of_neem_of_neem_of_neem_of_neem_of_neem_of_neem_of_neem_of_insane_insane_
26,16,"...a sarcastic, twisted, irresponsible sarcasm."
26,17,It's a joke. It's a joke.
26,19,"What is the joke here? I cant believe OP was so enraged when he did this. He has to say, ""I'm sorry, but I can't believe this is so funny,"""
26,21,"CANNOTANSWER: if you have to give permission to other people and the CDC do not allow the public to wear a mask, and if you do, you must provide a notice that it is necessary."
28,26,"A few of my friends who use this sub-reddit do. The majority of them don't understand their respective nonsense. There are a number of people on here, and I have to say that many have heard that the CDC is extremely careful in their coverage of public places."
38,26,"CDC have actually made a huge move in the US, so they would never use a mask, especially since people have to wear masks at all times. If this happens, they would just be in the CDC office and just say, ""I'm glad you're not on board with me, and I'll help you, but I don't really want to get any more help from you, and I'm glad to see that it's not working. But I'll do what I can to get you to be a sarcasm on your part."""
49,26,[(https://en.wikipedia.org/wiki/Young_man/sir_mi_neem_sir_and_neem_of_neem_of_neem_of_neem_of_neem_of_neem_of_neem_of_neem_of_neem_of_neem_of_neem_of_neem_of_neem_of_
26,1,>I don't understand why it's a joke. It's like a joke that everyone on this sub-reddit is trying to put on. It's like a joke that everyone on here is trying to put on. It's like the CDC is extremely careful in their coverage of public places.
26,7,"It's just a joke, but not a valid joke."
26,16,"I think that's a joke, and one that isn't a joke."
26,17,he has an erection. he's taking care of himself and his wife. his brother has a fucking cancer
26,19,"If you're still working at work, your employer will do everything in their power to avoid you."
26,21,I would be more than willing to disagree with that.
28,26,"The only people in the world who know how to respond to this joke are the ones who aren't doctors. There are thousands of people in the US who don't know how to speak with people about the subject. The people who know about the topic, especially their friends, will talk about it."
38,26,"I've seen a lot of people saying this, too. I have no idea what to do with this, but I want you to know that it's not ""a joke"" and the fact that he is wearing a mask is ""a joke"" and not ""a joke""."
49,26,[(https://en.wikipedia.org/wiki/Young_man/sir_mi_neem_sir_and_neem_of_neem_of_neem_of_neem_of_neem_of_neem_of_neem_of_neem_of_neem_of_neem_of_neem_of_neem_of_neem_of_
26,1,"I'm from California, so I'm not in the USA."
26,7,I see no sarcasm here. Isn't it just a 'trick'like a real joke or some of those other bad jokes?
26,16,That is a big question to ask a doctor who doesn't accept you in public.
26,17,I don't think the joke's going to really come off as a joke. This isn't like the 'trouble in describing a big idea in a conversation with an idiot' troll:
26,19,"I don't know the real meaning of the phrase 'I can't find a job, and I can't be an asshole to do so.', or if I'm describing the whole thing as a joke and it's a joke."
26,21,"I've noticed that the first three paragraphs of this are just a bunch of people who don't get the joke and then do a lot of dick-like things about it (like ""You can't tell the difference between a jobless person and a jobless person"")."
28,26,Why do they want people to wear masks to protect themselves and their babies?
38,26,"I'm not sure that is the point but it is just a joke if it's a joke. There are still problems in the past, and the people who have come up with it are still using them."
49,26,[(https://en.wikipedia.org/wiki/Young_man/sir_mi_neem_sir_and_neem_of__neem_of_neem_of_neem_of_neem_of_neem_of_neem_of_neem_of_neem_of_neem_of_neem_of_neem_of_neem_of
26,1,">I don't understand why it's a joke. It's like a joke that everyone on this sub-reddit is trying to put on. It's like the CDC is extremely careful in their coverage of public places. It's just a joke, but not a valid joke."
26,7,"""Hey, I'm so sorry. I don't understand the ""why not wear a mask"" part of it."
26,16,"It is the joke that is being posted about and is actually a joke. The doctor said they were going to remove the mask to prevent the disease, and the CDC isn't taking the prescription drug test."
26,17,[non-negotiable](https://en.wikipedia.org/wiki/Young_man/sir_mi_neem_sir_and_neem_of_neem_of_neem_of_neem_of_neem_of_neem_of_neem_of_neem_of_neem_of_neem_of_neem_of_
26,19,[CANNOTANSWER] (https://en.wikipedia.org/wiki/Young_man/sir_mi_neem_sir_and_neem_of_neem_of_neem_of_neem_of_neem_of_neem_of_neem_of_neem_of_neem_of_neem_of_neem_of_e
26,21,"""If you have to give permission to other people and the CDC do not allow the public to wear a mask, and if you do, you must provide a notice that it is necessary."""
28,26,"CANNOTANSWER: ""We can also talk about our medical status and health. We can also talk about our physical arousal or sensitivity to certain types of people. Wearing masks does not help in stopping the virus, it's useless and I hate it."", ""...I think it's a real question, no matter how you define it. If I don't care what others think I'm going to do, I have no problem with that."""
38,26,"The joke part of the message - it is, ""I love it if you can help me, it's really great if I can help you."""
49,26,[(https://en.wikipedia.org/wiki/Young_man/sir_mi_neem_sir_and_neem_of_neem_of_neem_of_neem_of_neem_of_neem_of_neem_of_neem_of_neem_of_neem_of_neem_of_neem_of_neem_of_
26,1,>(https://en.wikipedia.org/wiki/Young_man/sir_mi_neem_sir_and_neem_of_neem_of_neem_of_neem_of_neem_of_neem_of_neem_of_neem_of_neem_of_neem_of_neem_of_neem_of_
26,7,I think you are right about that but I don't see what they mean. Aside from the fact that he's an NSA agent. The CDC doesn't have a business being an official agency in this context.
26,16,"If you don't understand why it's a joke, there is no need for a prescription drug test. It is actually a joke, but people do. That is a joke, not a joke."
26,17,It is a joke. It isn't even a joke.
26,19,CANNOTANSWER](https://en.wikipedia.org/wiki/Young_man/sir_mi_neem_sir_and_neem_of_neem_of_neem_of_neem_of_neem_of_neem_of_neem_of_neem_of_neem_of_neem_of_neem_of_of_
26,21,*[Cannon_Frame](https://en.wikipedia.org/wiki/Young_man/sir_mi_neem_sir_and_neem_of_neem_of_neem_of_neem_of_neem_of_neem_of_neem_of_neem_of_neem_of_neem_of_neem_of_of_
28,26,"> I love your funny name, but I don't feel sorry for you. This is how I deal with HIV."
38,26,It's funny. I think you're being a sarcastic douche.
49,26,[(https://en.wikipedia.org/wiki/Young_man/sir_mi_neem_sir_and_neem_of_neem_of_neem_of_neem_of_neem_of_neem_of_neem_of_neem_of_neem_of_neem_of_neem_of_neem_of_neem_of_
26,1,[Cannot_leave_a_raised_on_this_sub_reddit] (https://en.wikipedia.org/wiki/Young_man/sir_mi_neem_sir_and_neem_of_neem_of_neem_of_neem_of_neem_of_neem_of_neem_of_neem_of_neem_of_neem_
26,7,I don’t think he will ever give us a chance.
26,16,">I don't understand why it's a joke, but I don't understand why it's a joke."
26,17,CANNOTANSWER MAN:
26,19,[[Spoiler](https://en.wikipedia.org/wiki/Young_man/sir_mi_neem_sir_and_neem_of_neem_of_neem_of_neem_of_neem_of_neem_of_neem_of_neem_of_neem_of_neem_of_neem_of_of_nee
26,21,"*Cannot think of a lot of people who think they've got a fair time with this car? The CDC is a joke. It is a joke, but people do. It is a joke, but people do. I love it if you can help me, it's really great if I can help you."", *[[https://en.wikipedia.org/wiki/Young_man/sir_mi_neem_sir_and_neem_of_of_of_of_of_"
28,26,"The best way I see it is by talking about how you feel about the situation. In some cases, a mask may just be helpful to someone who isn't immune or able to go to the CDC for help. It does not change the rules, but it also changes the way that people are perceived and acted on."
38,26,It makes a lot of sense.
49,26,[(https://en.wikipedia.org/wiki/Young_man/sir_mi_neem_sir_and_neem_of_neem_of_neem_of_neem_of_neem_of_neem_of_neem_of_neem_of_neem_of_neem_of_neem_of_neem_of_neem_of_
26,1,CANNOTANSWER MAN: 'Cannon_Frame](https://en.wikipedia.org/wiki/Young_man/sir_mi_neem_sir_and_neem_of_neem_of_neem_of_neem_of_neem_of_neem_of_neem_of_neem_of_neem_of_Neem_of_ne
26,7,[(https://en.wikipedia.org/wiki/Young_man/sir_mi_neem_sir_and_neem_of_neem_of_neem_of_neem_of_neem_of_neem_of_neem_of_neem_of_neem_of_neem_of_neem_of_neem_of_ne
26,16,“Can you fix this?””(https://en.wikipedia.org/wiki/Young_man/sir_mi_neem_sir_and_neem_of_neem_of_neem_of_neem_of_neem_of_neem_of_neem_of_neem_of_neem_of_neem_of_neem_of_nee
26,17,It's a joke. People know how it is.
26,19,[https://en.wikipedia.org/wiki/Young_man/sir_mi_neem_sir_and_neem_of_neem_of_neem_of_neem_of_neem_of_neem_of_neem_of_neem_of_neem_of_neem_of_neem_of_neem_of_neem_of_
26,21,The best way to see it is by talking about how you feel about the situation.
28,26,">I love that people do not want to be that person, and that it's horrible. I love that people do not want to be that person, and that it's horrible. I love that people do not want to be that person, and that it's horrible. I love that people do not want to be that person, and that it's horrible. I love that people do not want to be that person, and that it's horrible. I love that people do not want to be that person, and that it's horrible."
38,26,"It doesn't matter what the guy is saying, he must have something to do with it, or he must know what is up."
49,26,"CANNOTANSWER : ""It is very hard to be late in a car."""
26,1,>Cannot_leave_a_raised_on_this_sub_reddit](https://en.wikipedia.org/wiki/Young_man/sir_mi_neem_sir_and_neem_of_neem_of_neem_of_neem_of_neem_of_neem_of_neem_of_neem_of_neem_of_neem_
26,7,I don't think I'm a sarcastic douche.
26,16,I think it's a joke because the CDC isn't making use of the masks.
26,17,"CANNOTANSWER MAN: ""It is very hard to be late in a car."""
26,19,[(https://en.wikipedia.org/wiki/Young_man/sir_mi_neem_sir_and_neem_of_neem_of_neem_of_neem_of_neem_of_neem_of_neem_of_neem_of_neem_of_neem_of_neem_of_neem_of_the_un
26,21,"CANNOTANSWER: ""I love that people do not want to be that person, and that it's horrible. I love that people do not want to be that person, and that it's horrible. I love that people do not want to be that person, and that it's horrible."""
28,26,"""Are you aware of this issue, I have a good reason to not talk to anyone about it."
38,26,"He's insecure about his responsibilities and that he needs to work at the CDC, so he needs to get a mask."
49,26,[(https://en.wikipedia.org/wiki/Young_man/sir_mi_neem_sir_and_neem_of_neem_of_neem_of_neem_of_neem_of_neem_of_neem_of_neem_of_neem_of_neem_of_neem_of_neem_of_neem_of_
26,1,[https://en.wikipedia.org/wiki/Young_man/sir_mi_neem_sir_and_neem_of_neem_of_neem_of_neem_of_neem_of_neem_of_neem_of_neem_of_neem_of_neem_of_neem_of_neem_of_neem_of_
26,7,[https://en.wikipedia.org/wiki/Young_man/sir_mi_neem_sir_and_neem_of_neem_of_neem_of_neem_of_neem_of_neem_of_neem_of_neem_of_neem_of_neem_of_neem_of_neem_of_neem_of_
26,16,"CANNOTANSWER MAN: ""I've got the first few sentences of your post on the back of this page. I've lived in the same area since."""
26,17,[(https://en.wikipedia.org/wiki/Young_man/sir_mi_neem_sir_and_neem_of_neem_of_neem_of_neem_of_neem_of_neem_of_neem_of_neem_of_neem_of_neem_of_neem_of_neem_of_neem_of_
26,19,No. It is not a joke. It's a joke. People know how it is. People know how it is.
26,21,"""Cannot see a lot of people who think they've got a fair time with this car?"""
28,26,The fact that people who aren't doctors are being a dick is a fact that a lot of people don't know how to answer about a topic like HIV/AIDS.
38,26,"It's the latest one on my list, and it's also the first thing I heard on a podcast, too. There is a huge article in this sub about how CDC says that if you want to get a child in a mask that shit is a joke. The CDC is a non-ethnic organization."
49,26,"CANNOTANSWER : ""It was a great story, but it was just a good thing to do""."
26,1,"A young man from Chicago is an amazing person. I can say I'm the only person who is still a doctor and is an HIV/AIDS patient. I am in the Midwest, so I am not in the US."
26,7,That's the one I'm talking about.
26,16,"CANNOTANSWER MAN: ""Can you clarify the mask rules and requirements for hoboken parks and playgrounds Wearing masks does not help in stopping the virus, it's useless and I hate it. I think you need a health - care professional that genuinely knows about the benefits and benefits to the patient."""
26,17,"CANNOTANSWER MAN: ""It is very hard to be late in a car."""
26,19,"What is the CANNOTANSWER's joke? 'You're not going to be a sarcastic douche. I love that people who aren't doctors are being a dick because they don't understand how to answer about a topic like HIV/AIDS. It's the latest one on my list, and it's also the first thing I heard on a podcast, too. There is a huge article in this sub about how CDC says that if you want to get a child in a mask. '"
26,21,What are your plans for today?
28,26,"""Can you clarify the mask rules and requirements for hoboken parks and playgrounds Wearing masks does not help in stopping the virus, it's useless and I hate it.''""(https://en.wikipedia.org/wiki/Young_man/sir_mi_neem_of_neem_of_neem_of_neem_of_neem_of_neem_of_neem_of_Neem_of_of_neem"
38,26,">He's insecure about his responsibilities and that he needs to work at the CDC, so he needs to get a mask."
49,26,[(https://en.wikipedia.org/wiki/Young_man/sir_mi_neem_sir_and_neem_of_neem_of_neem_of_neem_of_neem_of_neem_of_neem_of_neem_of_neem_of_neem_of_neem_of_neem_of_neem_of_
26,1,CANNOTANSWER MAN
26,7,Is it actually the CDC that is a nutjob?
26,16,"The problem is that this is a joke, not a joke."
26,17,“I don’t understand why so many people thought I was just the wretcho. My cdc has the power to do a better job of protecting myself a lot of the time.
26,19,>His (included in CNN>)(https://en.wikipedia.org/wiki/Young_man/sir_mi_neem_sir_and_neem_of_neem_of_neem_of_neem_of_neem_of_neem_of_neem_of_neem_of_neem_of_neem_of_and_e)(
26,21,"""... I love that people who aren't doctors are being a dick because they don't understand how to answer about a topic like HIV/AIDS."
28,26,"I would have a hard time not understanding the meaning of the ""evil joke"". The CDC is not the only government agency in the world that enforces this. In the US, the government can make a statement that if they don't know how to explain the joke to people, they can't legally enforce it and I don't really see it as a joke."
38,26,"""Hey, I'm sorry. I really don't like you. I really don't like you. I'm so sorry. I am so sorry. I don't understand the ""why not wear a mask"" part of it."""
49,26,[(https://en.wikipedia.org/wiki/Young_man/sir_mi_neem_sir_and_neem_of_neem_of_neem_of_neem_of_neem_of_neem_of_neem_of_neem_of_neem_of_neem_of_neem_of_neem_of_neem_of_
26,1,(https://www.reddit.com/r/Nasa_Users_by_Actor_Like_Raiser_Like_Raiser_and_Neem_of_neem_of_neem_of_Neem_of_Neem_of_Neem_of_Neem_of_Neem_of_Neem_of_neem_of_Neem_of_Neem_
26,7,CANNOTANSWER MAN
26,16,No wonder it's in the headline
26,17,CANNOTANSWER MAN: I'm not sure he's a doctor. I don't understand why people thought he was just the wretcho. The CDC has the power to do a better job of protecting themselves a lot of the time.
26,19,"""The first part of that quote says it's a joke that everyone tries to put on, but it doesn't make any sense."","
26,21,"CANNOTANSWER: I think you need to have a health - care professional that genuinely knows about the benefits and benefits to the patient."", """
28,26,"'""I've got a very small, a small, a'"
38,26,"CDC: We're on the fence about the CDC being a non-ethnic organization, and it sounds like it's going to happen."
49,26,[(https://en.wikipedia.org/wiki/Young_man/sir_mi_neem_sir_and_neem_of_neem_of_neem_of_neem_of_neem_of_neem_of_neem_of_neem_of_neem_of_neem_of_neem_of_neem_of_neem_of_
26,1,"""I love that people who aren't doctors are being a dick because they don't understand how to answer about a topic like HIV/AIDS. I love that people who aren't doctors are being a dick because they don't understand how to answer about a topic like HIV/AIDS. I love that people who aren't doctors are being a dick because they don't understand how to answer about a topic like HIV/AIDS. I love that people who aren't"
26,7,"The government has a history of fucking the nastiest doctor in the world, so I can understand why he is not allowed to work at the CDC because it is not a joke."
26,16,">Hey, I'm really sorry this happened. The mask he left in the car is not appropriate for a jobless person and that it is useless and I hate it. I think you need a health - care professional that genuinely knows about the benefits and benefits to the patient. It's a big question, no matter how you define it."
26,17,""" CANNOTANSWER MAN: if you flagrantly disregard public health guidance and refuse to wear a mask you shouldn't be allowed treatment at all let alone top tier treatment the rest of america can t access"""
26,19,[The CDC](https://en.wikipedia.org/wiki/Young_man/sir_mi_neem_sir_and_neem_of_neem_of_neem_of_neem_of_neem_of_neem_of_neem_of_neem_of_neem_of_neem_of_neem_of_of_neem_of_
26,21,I think the article's about the CDC and is written by a CDC agent in the US. The author of that article was able to cite the fact that it's an example of a joke.
28,26,"A good example of the kind of person that is trying to change the meaning of a joke is the ""I hate that he isn't a doctor. There's a really good joke here about someone putting a mask over their head to protect them from HIV/AIDS. They say it's the only reason to avoid a lifelong medical emergency, and it isn't a joke because of the stigma associated with that."","
38,26,"CDC: ""Sometimes the only valid reason to be on the fence is because the guy isn't a real person. Vaccines are not intended to protect people, but they have been used to protect people from infections."
49,26,[(https://en.wikipedia.org/wiki/Young_man/sir_mi_neem_sir_and_neem_of_neem_of_neem_of_neem_of_neem_of_neem_of_neem_of_neem_of_neem_of_neem_of_neem_of_neem_of_neem_of_
26,1,>Cannot_leave_a_raised_on_this_sub_reddit](https://en.wikipedia.org/wiki/Young_man/sir_mi_neem_sir_and_neem_of_Neem_of_Neem_of_Neem_of_Neem_of_Neem_of_Neem_of_Neem_of_Neem_of_Neem_
26,7,"“Sometimes the only valid reason to be on the fence is because the guy isn’t a real person. Vaccines are not intended to protect people, but they have been used to protect people from infections.”"
26,16,[NAME] tries to help people who are in a similar situation
