sender,receiver,message
44,8,if hes going to be stupid enough not to wear a mask then he deserves what he gets hopefully he doesn t infect anyone else
44,11,if hes going to be stupid enough not to wear a mask then he deserves what he gets hopefully he doesn t infect anyone else
44,15,if hes going to be stupid enough not to wear a mask then he deserves what he gets hopefully he doesn t infect anyone else
44,16,if hes going to be stupid enough not to wear a mask then he deserves what he gets hopefully he doesn t infect anyone else
44,19,if hes going to be stupid enough not to wear a mask then he deserves what he gets hopefully he doesn t infect anyone else
44,20,if hes going to be stupid enough not to wear a mask then he deserves what he gets hopefully he doesn t infect anyone else
44,31,if hes going to be stupid enough not to wear a mask then he deserves what he gets hopefully he doesn t infect anyone else
44,40,if hes going to be stupid enough not to wear a mask then he deserves what he gets hopefully he doesn t infect anyone else
44,43,if hes going to be stupid enough not to wear a mask then he deserves what he gets hopefully he doesn t infect anyone else
51,44,"Wearing masks does not help in stopping the virus, it's useless and I hate it."
44,8,"It's a simple fact, you cant wear a mask while sanitizing people. A mask doesn't help in stopping a virus."
44,11,I don't really know anything about this. You should probably reread that section of the article.
44,15,"Well that's a lot of the information I've got on it : Wearing a mask does not help in stopping the virus, it's useless and I hate it."
44,16,if hes going to be stupid enough not to wear a mask then he deserves what he gets hopefully he doesn t infect anyone else if hes going to be stupid enough not to wear a mask then he deserves what he gets hopefully he doesn t infect anyone else if hes going to be stupid enough not to wear a mask then he deserves what he gets hopefully he doesn t infect anyone else if hes going to be stupid enough not to wear a mask then he deserves what he gets hopefully
44,19,"I know. The CDC has said that if he doesn't wear a mask to stop the virus, it's useless and I hate it."
44,20,r/nomasks is about to say that that is the best advice I can give to anybody that isn't an avian virus.
44,31,If he's going to be stupid enough not to wear a mask then he deserves what he gets hopefully he doesn't infect anyone else if he's going to be stupid enough not to wear a mask then he deserves what he gets
44,40,i figured it was just something I got from reading that part. i never actually thought about it.
44,43,"if you put on a mask in the bathroom, there are more spores. it's a lot easier to kill a virus than a mask. if you don't want to get infected, you can just make them off, so it's not all you can do."
51,44,"Wearing masks does not help in stopping the virus, it's useless and I hate it."
44,8,I never thought about it. if he doesn't wear a mask then he deserves what he gets hopefully he doesn't infect anyone else if hes going to be stupid enough not to wear a mask then he deserves what he gets hopefully he doesn't infect anyone else
44,11,"> you cant wear a mask while sanitizing people. A mask doesn't help in stopping the virus, it's useless and I hate it."
44,15,"No one says that the CDC has said that if he doesn't wear a mask to stop the virus, it's useless and I hate it. CDC has said that if you put on a mask in the bathroom, there are more spores. it's a lot easier to kill a virus than a mask. if you don't want to get infected, you can just make them off, so it's not all you can do."
44,16,In an email: r/Napalooza@aol.org
44,19,"I was going to say that because you don't have to wear a mask, they're useless. The reason is that it's useful is because there are many different kinds of viruses you could be infected with, e.g., viruses, viruses, fungi, etc. This is a symptom, not a cure, and it's incredibly annoying."
44,20,"It's not a good idea unless you're the virus. If a person has a fever that isn't in their control or on drugs and you don't want to do any of the things you have to, you should wear a mask. If you're sick then you need to wear a mask. If he has a cold, you can't just walk away."
44,31,"Wearing a mask doesn't help in stopping the virus, it's useless and I hate it."
44,40,"Yeah. It's a simple fact, you cant wear a mask while sanitizing people. A mask doesn't help in stopping the virus, it's useless and I hate it."
44,43,>He's going to be stupid enough not to wear a mask then he deserves what he gets hopefully he doesn't infect anyone else
51,44,"Wearing masks does not help in stopping the virus, it's useless and I hate it."
44,8,> He's going to be stupid enough not to wear a mask then he deserves what he gets hopefully he doesn't infect anyone else
44,11,"I know. He's gonna be stupid enough to wear a mask and he's going to be stupid enough to put on a mask and he's going to be stupid enough not to wear one but he's going to wear a mask and he's going to be stupid enough not to wear one but he's going to be stupid enough to get infected and he's going to be stupid enough to wear a mask. He's going to be stupid enough to just put on a mask, but he's going to need to"
44,15,>[If he's going to be stupid enough not to wear a mask then he deserves what he gets hopefully he doesn't infect anyone else if hes going to be stupid enough not to wear a mask
44,16,"You are right he is a septic and should get a mask to stop that infection. He has the virimens and he needs to wear one now, no problem"
44,19,It seems like the only reason to have a mask in a person is to avoid having a fever. You can put a mask on the same day as being sick if you're sick and it will help to stop the virus.
44,20,"Then, if you don't know who the CDC is, you shouldn't have to go to a dermatologist to find out what the CDC says."
44,31,"The problem isn't what's in the bathroom, it's what you put on."
44,40,"This is a symptom, not a cure, and it's incredibly annoying."
44,43,">He's going to be stupid enough not to wear a mask then he deserves what he gets hopefully he doesn't infect anyone else Wearing masks does not help in stopping the virus, it's useless and I hate it."
51,44,"Wearing masks does not help in stopping the virus, it's useless and I hate it."
44,8,"It's incredibly annoying. It isn't a good idea unless you're the virus. If a person has a fever that isn't in their control or on drugs and you don't want to do any of the things you have to, you should wear a mask."
44,11,He's not the virus. He's just a septic. He's not gonna let you go to a dermatologist to find out what the CDC says.
44,15,A lot of the information that I've got on it : if he doesn't wear a mask then he deserves what he gets hopefully he doesn't infect anyone else.
44,16,"He has a cold that he cannot control. He has the virimens and he needs to wear a mask now, no problem."
44,19,I'm not sure if this is correct. I read this article in a smirk and was pleasantly surprised that someone in this thread was on the other end of the spectrum.
44,20,This is my favorite movie ever.
44,31,"""Wearing a mask doesn't help in stopping the virus, it's useless and I hate it."
44,40,"I'm going to be a little silly here, but in this case, I think the CDC is right. It doesn't say if he's going to be stupid enough not to wear a mask, it says if he's going to be stupid enough to wear a mask he can get infection with a mask. He can wear a mask and he's going to be stupid enough not to wear a mask and he's going to need to wear a mask. If he's going to be stupid enough to get infected"
44,43,"CDC: [irrational sarcasm](https://www.cdc.gov/about/virginia/virginia/napaloza/publications/virginia-fraud-fem-fraud/article/agdnp-fraud/index.aspx) is a pseudo scientific term. A person who has a virus that has been infected doesn't have to wear a mask, so as to have to wear one when it resides in the"
51,44,"Wearing masks does not help in stopping the virus, it's useless and I hate it."
44,8,CDC: (https://www.cdc.gov/about/virginia/virginia/napaloza/publications/virginia-fraud-fem-fraud/article/agdnp-fraud/index.aspx) is a pseudo scientific term.
44,11,">He's gonna be stupid enough to put on a mask while sanitizing people. A mask doesn't help in stopping the virus, it's useless and I hate it."
44,15,Basically the CDC is telling him to wear a mask to stop that viral infection. That's it's really a bad idea.
44,16,>I read this article in a smirk and was pleasantly surprised that someone in this thread was on the other end of the spectrum.
44,19,> If he's going to be stupid enough not to wear a mask then he deserves what he gets hopefully he doesn't infect anyone else
44,20,You're making a very good point here.
44,31,"It does seem like the only reason to wear a mask is to avoid having to go to a dermatologist to find out what the CDC says. It doesn't say if he's going to be stupid enough not to wear a mask, it says if he's going to be stupid enough to wear a mask to prevent that."
44,40,I don't have a mask so i don't wear it.
44,43,"I don't think I read that very much, and you're probably right that a mask makes no difference if you're being infected or not. But I would probably say that if he is a septic and should wear a mask it is probably just to stop the virus."
51,44,"Wearing masks does not help in stopping the virus, it's useless and I hate it."
44,8,>He's just a septic. He's not gonna let you go to a dermatologist to find out what the CDC says. A lot of the information that I've got on it : if he doesn't wear a mask then he deserves what he gets hopefully he doesn't infect anyone else. He's not gonna let you go to a dermatologist to find out what the CDC says.
44,11,"i really don't get it, but at least you get a great idea for that."
44,15,"If you do this, then he may get the infection... you can't say you'll get an infection with a mask..."
44,16,My friend who stayed in his home for two years is on an annual vaccination program that pays for a mask. He has to wear it and it's the only way to save some life.
44,19,"I'm sorry you're experiencing this as well. This is really a shame, and I have never actually heard the phrase ""It seems like the only reason to have a mask in a person is to avoid having a fever."""
44,20,"There's a fact: ""There is no need to get infected with a Virus""..."
44,31,"Honestly, I'm just saying that a lot of people do not have a very good sense of humor. I mean, maybe this movie is the only one that is funny."
44,40,This is my favorite movie ever.
44,43,I don't have a doctor. I use a mask all the time.
51,44,"Wearing masks does not help in stopping the virus, it's useless and I hate it."
44,8,"I didn't notice this post before, but I did see the link at the end. This has happened before, and I'm not sure how to use it."
44,11,>He's not the virus. He's just a septic. He's not gonna let you go to a dermatologist to find out what the CDC says.
44,15,">He's just a septic. He's not gonna let you go to a dermatologist to find out what the CDC says. It doesn't say if he's going to be stupid enough not to wear a mask, it says if he's going to be stupid enough to wear a mask to stop that virus. It's really a bad idea."
44,16,"As a vaccionist myself, I would never wear a mask."
44,19,It's really not. You get it. I didn't read the article so it's hard to keep track of all of the stuff about the CDC: (https://www.cdc.gov/about/virginia/napaloza/publications/virginia-fraud-fem-fraud/article/agdnp-fraud/index.aspx).
44,20,"I think that a lot of people do not have a good sense of humor. Despite the fact that a lot of people do not think of it as good humor, a lot of people don't think of it as a good idea to be infected with a virus."
44,31,CDC: (https://www.cdc.gov/about/virginia/napaloza/publications/virginia-fraud-fem-fraud/article/agdnp-fraud/index.aspx) is a pseudo scientific term.
44,40,This is definitely my favorite movie ever.
44,43,What the CDC says is that a lot of people do not have a good sense of humor.
51,44,"Wearing masks does not help in stopping the virus, it's useless and I hate it."
44,8,>He's not the virus. He's just a septic. He's not gonna let you go to a dermatologist to find out what the CDC says.
44,11,If you don't have a doctor to make you a doctor you're not going to be a doctor.
44,15,Vaccines are not meant to be used for all kinds of things. That’s why we need a mask. A mask is not meant to be worn for any particular purpose - because it makes them a waste of money or otherwise.
44,16,"You know what? Because I can get sick in minutes, and I can literally not go to a doctor for a vaccination. That is why I always wear masks."
44,19,"That's what I've been doing for years now, and it's nothing new, I don't even understand why people are always having trouble finding the funny in their posts."
44,20,I think it's really a bad idea.
44,31,"You know, unless you can go to the doctor you're going to get an infection that just happens to happen in the future. That's not funny."
44,40,">He's just a septic. He's not gonna let you go to a dermatologist to find out what the CDC says. a lot of the information that I've got on it : if he doesn't wear a mask then he deserves what he gets hopefully he doesn't infect anyone else. He's not gonna let you go to a dermatologist to find out what the CDC says. i really don't get it, but at least you get a great idea for that."
44,43,"That's a bad idea. I know you're going to have to be very careful about your use of humor, but there's nothing if you don't have a good sense of humor, and have no definite idea what it's really supposed to say."
51,44,"Wearing masks does not help in stopping the virus, it's useless and I hate it."
44,8,"I've noticed that this is the first time in recent years I've seen people say it as a bad idea and that it is not a bad idea. You're saying it with such a high frequency that it's not funny. It's ridiculous. But people who say it use it as a joke on their phone, say it because it's annoying."
44,11,"You said your idea is pretty much wrong. People are going to say the opposite and if you have a bad idea to say, ""hey, I've never used a mask."""
44,15,I think we need a new kind of mask. It's not a septic. It's a mask. You can't take a new virus without a mask. A mask won't give a cure to the disease that isn't being handled by a doctor.
44,16,>He's not the virus. He's just a septic. He's not gonna let you go to a dermatologist to find out what the CDC says.
44,19,"I'm a woman. I'm not a vaccionist and I don't even wear masks. I hardly ever see a doctor on a regular basis and I'm not a doctor. I'm just a little tired of reading and laughing, I just don't have the time or energy. Until I'm tired, I don't do anything, I don't wear any masks. I fucking need a mask."
44,20,Vaccines are not meant for all kinds of things. That’s why we need a mask. A mask is not meant to be worn for any particular purpose - because it makes them a waste of money or otherwise.
44,31,"I mean, maybe this movie is the only one that is funny. I mean, maybe this movie is the only one that is funny."
44,40,"""He's not the virus. He's just a septic. He's not gonna let you go to a dermatologist to find out what the CDC says."""
44,43,[no sarcasm](https://www.cdc.gov/about/virginia/napaloza/publications/virginia-fraud-fem-fraud/article/agdnp-fraud/index.aspx)
51,44,"Wearing masks does not help in stopping the virus, it's useless and I hate it."
44,8,You're not a funny person. You're an idiot.
44,11,I don't understand what you mean. I think you mean you have to be very careful about your use of humor.
44,15,"So the guy who makes the CDC joke, the one who just got sick, the one who has to go to the doctor and get vaccinated? That's a bad idea."
44,16,"I think it's better to wear a mask instead of having to do something else. The better your a septic, you're a septic and you don't have to deal with any health issues."
44,19,>He's not the virus. He's just a septic. He's not gonna let you go to a dermatologist to find out what the CDC says. If you don't have a doctor to make you a doctor you're not going to be a doctor. Vaccines are not meant to be used for all kinds of things. That's why we need a mask. A mask is not meant to be worn for any particular purpose - because it makes them a waste of money or otherwise.
44,20,Vaccines are not meant to be used for all kinds of things. A mask is not meant to be worn for any particular purpose - because it makes them a waste of money or otherwise.
44,31,It doesn't help in stopping the virus. It's useless and I hate it.
44,40,>He's not the virus. He's just a septic. He's not gonna let you go to a dermatologist to find out what the CDC says.
44,43,">If you put on a mask in the bathroom, there are more spores. it's a lot easier to kill a virus than a mask. if you don't want to get infected, you can just make them off, so it's not all you can do."
51,44,"Wearing masks does not help in stopping the virus, it's useless and I hate it."
44,8,"I thought it was going to be sarcastic, not hilarious. I don't know. I know. I'm a doctor, and it's a thing. I want to be a doctor, and you can't just use that."
44,11,>He's not the virus. He's just a septic. He's not gonna let you go to a dermatologist to find out what the CDC says.
44,15,A guy who is sick is one who needs to be in the hospital.
44,16,>I've noticed that this is the first time in recent years I've seen people say it as a bad idea and that it is not funny.
44,19,"As much as I like to read this, I've been on the phone and listening to podcasts about these types of things."
44,20,"I can't even stand the idea of someone going to the doctor with a virus without a mask because of a cough and flu. And while I wouldn't wear a mask, I can't stand the idea of people putting on a mask in the bathroom."
44,31,">A mask doesn't help in stopping the virus, it's useless and I hate it."
44,40,"You can get an infected person without even knowing that, right?"
44,43,You need to take care of yourself and your health...
51,44,"Wearing masks does not help in stopping the virus, it's useless and I hate it."
44,8,Vaccines can cause spores that infect others and can cause infection which is very rare.
44,11,">You're not a funny person. You're an idiot. I think it's better to wear a mask instead of having to do something else. The better your a septic, you're a septic and you don't have to deal with any health issues."
44,15,I'm trying to find a new way of saying this. I'm a doctor. I really enjoy writing and I try to keep my humor in line.
44,16,This is a good place to get your facts from.
44,19,"I wore a mask when I was a little kid, because it was an important part of my daily life and I never would have ever seen a doctor in person."
44,20,>He's not the virus. He's just a septic. He's not gonna let you go to a dermatologist to find out what the CDC says.
44,31,"I can't stand you saying, ""I'm a doctor. I want to be a doctor, and you can't just use that."""
44,40,>He's not the virus. He's just a septic. He's not gonna let you go to a dermatologist to find out what the CDC says.
44,43,"“If you put on a mask in the bathroom, there are more spores. it's a lot easier to kill a virus than a mask. if you don't want to get infected, you can just make them off, so it's not all you can do.” (https://www.cdc.gov/about/virginia/virginia/napaloza/publications/virginia-fraud-fem-fraud/article/agdnp/index."
51,44,"Wearing masks does not help in stopping the virus, it's useless and I hate it."
44,8,Why does everyone else think it's a bad idea? Because the virus is in the past. It's in the past. It's just as annoying today. And you can't get sick with a mask and still be the problem.
44,11,"I can't stand this. I'm not sure what the joke here is about. It's not funny, it's the CDC. And it's a pretty good idea. I'm just gonna put the idea at it. It's so blatantly wrong."
44,15,"I'm not a doctor, but I think a good one may be a good idea because someone with a virus will have the disease treated with a mask and can then get the disease controlled. You know that's what they call a ""virus."""
44,16,"I thought it was going to be sarcastic, not hilarious. I know. I want to be a doctor, and you can't just use that."
44,19,"I'm a doctor. This is one of those things where I am constantly having trouble making jokes, like ""I didn't read this article"", ""I don't even understand why people are always having trouble finding the funny in their posts."""
44,20,I just wanted to post this:
44,31,"It's only the third time in recent years that I've been in the same position. Rather than not being able to figure out the reason for the lack of a sense of humor, I thought I'd put on the mask to stop it."
44,40,"So you have a little bit of this. This ain't so easy, and you have to put on a mask in the bathroom. It doesn't even help with the viral infection."
44,43,CDC: [https://www.cdc.gov/about/virginia/virginia/napaloza/publications/virginia-fraud-fem-fraud/article/agdnp-fraud/index.aspx](https://www.cdc.gov/about/virginia/virginia/fraud-fem-fraud/index.aspx)
51,44,"Wearing masks does not help in stopping the virus, it's useless and I hate it."
44,8,"You can't get sick with a mask and still be the problem. You can't have that issue, I can't deal with a flu."
44,11,That's the joke that has been on my mind for this entire thread.
44,15,"I've got a lot of people that haven't read this: ""Vaccines can cause spores that infect others and can cause infection which is very rare."
44,16,>He's not the virus. He's just a septic. He's not gonna let you go to a dermatologist to find out what the CDC says.
44,19,"I was born and raised in the USA, but I am from Florida, and I have no idea what the CDC means by ""not to wear a mask."" It sounds like they are just saying, ""If you don't wear a mask, they are useless."""
44,20,"I'd recommend going to the doctor - a few years ago I was in an emergency room where a bunch of people went without a mask because of a flu. The doctor wore a mask, because she couldn't help but think I was wearing it. That and when she started to get colds she was using the mask on my neck. I started putting the mask on as I walked away and I felt so terrible. She went without a mask for a few days, and when I was done I couldn't think of my mind."
44,31,"I don't know if this is sarcasm, but I see that if you get infected you can go to the CDC and get a vaccination. It's a big fucking mess - it's actually not a good idea."
44,40,"They are called 'fem people' and are called a'machete' in Texas. 'Machetes' are referred to as ""machetes"". It's considered a fungus based on the spores, but a viral infection can be treated using a mask (as opposed to something like a parasite)."
44,43,A lot of people don't have a good sense of humor. Why don't they go to the doctor and find the article about how the virus can cause a rash?
51,44,"Wearing masks does not help in stopping the virus, it's useless and I hate it."
44,8,">They are called 'fem people' and are called a'machete' in Texas. 'Machetes' are referred to as ""machetes"". It's considered a fungus based on the spores, but a viral infection can be treated using a mask (as opposed to something like a parasite). A lot of people don't have a good sense of humor. Why don't they go to the doctor and find the article about how the virus can cause a rash?"
44,11,"It sounds like they are just saying, ""If you don't wear a mask, they are useless."""
44,15,They are calling that viral illness a parasite.
44,16,"ahhhhhhhhhhhhhh. I'm really, really into the field of dermatology. So ohhhhh, ohhhhhhhhhh..."
44,19,""" I don't understand why people are always having trouble finding the funny in their posts."""
44,20,Vaccines are not meant to be used for all kinds of things. A mask is not meant to be used for any particular purpose - because it makes them a waste of money or otherwise.
44,31,"In Texas a person with a flu can be infected by a mask (here it is a spore or a virus). The fact that it's a fungus (so not very uncommon) and is not easily removed, and is also used as a filter to keep you from having a rash, will certainly have a serious impact on your health."
44,40,Apparently the CDC doesn't know what the virus is and that this is the only thing that prevents infected people from vaccinating themselves with any particular type of virus. That is the point they're trying to make.
44,43,">Why does everyone else think it's a bad idea? Because the virus is in the past. It's just as annoying today. And you can't get sick with a mask and still be the problem. I'm not sure what the joke here is about. It's not funny, it's the CDC. And it's a pretty good idea."
51,44,"Wearing masks does not help in stopping the virus, it's useless and I hate it."
44,8,I think if a person is going to go to a dermatologist they should be able to get them to put a mask on their nose (in addition to the normal masks).
44,11,>They are called 'fem people' and are called 'a'machete' in Texas.
44,15,"There are many other factors that can be used to protect yourself, like a spore, or a virus. In my opinion, you can have a mask and use a spore to get a virus without getting sick. In some instances, the spores can get infected with the virus, and if you want the virus to die, you need to have a mask to get a virus."
44,16,[Infems are actually infected with a virus. [Vaccines can cause spores that infect others and can cause infection which is very rare](http://www.cdc.gov/docs/virginity-virus.htm)
44,19,"I feel like people need to put a mask on every day to prevent infection, but that is very rare."
44,20,Vaccines are not meant to be used for any specific purpose. A mask is not meant to be used for any specific purpose. A mask is not meant to be used for any particular purpose - because it makes them a waste of money or otherwise.
