sender,receiver,message
26,17,">Hey, I'm really sorry. I really don't like you. I really don't like you. I really don't like you. I really don't like you. I really don't understand why so many people thought I was just the wretcho. My cdc has the power to do a better job of protecting themselves a lot of the time."
26,19,CANNOTANSWER CANNOTANSWER CANNOTANSWER CANNOTANSWER CANNOTANSWER CANNOTANSWER CANNOTANSWER CANNOTANSWER CANNOTANSWER CANNOTANSWER CANNOTANSWER CANNOTANSWER CANNOTANSWER CANNOTANSWER CANNOTANSWER CANNOTANSWER CANNOTANSWER CANNOTANSWER CANNOTANSWER CANNOTANSWER CANNOTANSWER
26,21,"""Sometimes the only valid reason to be on the fence is because the guy isn't a real person. Vaccines are not intended to protect people, but they have been used to protect people from infections."","
28,26,I can't figure out how I'm going to tell you this.
38,26,"As a US citizen, I can assure you that this was a pretty nasty joke."
49,26,[(https://en.wikipedia.org/wiki/Young_man/sir_mi_neem_sir_and_neem_of_neem_of_neem_of_neem_of_neem_of_neem_of_neem_of_neem_of_neem_of_neem_of_neem_of_neem_of_neem_of_
26,1,"I read an article by a US doctor in the US, about a doctor who had HIV/AIDS and found out that some people are narcissists, and not a doctor."
26,7,"CDC: 'Sometimes the only valid reason to be on the fence is because the guy isn't a real person. Vaccines are not intended to protect people, but they have been used to protect people from infections. ',"
26,16,It is a joke. And it sounds like it's not a joke.
26,17,"CANNOTANSWER MAN: ""There is a really good joke here about someone putting a mask over their head to protect them from HIV/AIDS. They say it's the only reason to avoid a lifelong medical emergency, and they have been used to protect people from infections."
26,19,"I hate to say it, but a person can't do anything about it because they can't help themselves. I think it is a bit of a hoax to have a job."
26,21,That is the point of the article.
28,26,"CANNOTANSWER: ""I don't care what others think I'm going to do, I have no problem with that."""
38,26,"It’s a joke and a joke, isn’t it? A joke or not, is a joke? It’s just a joke, and it’s a joke."
49,26,"CANNOTANSWER : ""In all honesty, his story is pretty awful. The quote is in response to the question of if you didn't want to see a video of a drunk man driving his own car."""
26,1,I've been trying to figure out why these people who think their friends are being nice and encouraging them to be friends are going to be the bad guys who think that they're not as fucking funny as people who think they are.
26,7,"A CDC official is someone who is not a doctor, they are a health care institution, which is a pretty good thing to have in order to prevent any future problems for the nation."
26,16,It is a joke. It is a joke. The CDC is a joke.
26,17,"“Sometimes the only valid reason to be on the fence is because the guy isn’t a real person. Vaccines are not intended to protect people, but they have been used to protect people from infections.”"
26,19,"CANNOTANSWER: ""Sometimes the only valid reason to be on the fence is because the guy isn't a real person. Vaccines are not intended to protect people. Vaccines are not intended to protect people, but they have been used to protect people from infections. '"
26,21,CANNOTANSWER] (https://en.wikipedia.org/wiki/Young_man/sir_mi_neem_sir_and_neem_of_Neem_of_Neem_of_Neem_of_Neem_of_Neem_of_Neem_of_Neem_of_Neem_of_Neem_of_Neem_of_Neem
28,26,"I'm a doctor and I have been diagnosed with AIDS a lot, so I can understand why this joke exists - because it's about being able to deal with it without any hassle and it sounds to me like it has nothing to do with a doctor."
38,26,"He's putting a face on the bus, telling his family he's going to be in the bathroom and that he's putting it on. That's not good for him. He can't avert illness with the mask, he can't give advice if he wants to. He's probably taking a trip if he's going to stay in the house and do the work and work, and he's trying to get his friends to help him. I think it's ridiculous for the CDC."
49,26,Is he the man who drove the Mercedes?
26,1,CANNOTANSWER MAN: 'Cannon_Frame](https://en.wikipedia.org/wiki/Young_man/sir_mi_neem_sir_and_neem_of_Neem_of_Neem_of_Neem_of_Neem_of_Neem_of_Neem_of_Neem_of_Neem_of_M
26,7,"CANNOTANSWER MAN: ""Sometimes the only valid reason to be on the fence is because the guy isn't a real person. Vaccines are not intended to protect people. Vaccines are not intended to protect people. Vaccines are not intended to protect people. Vaccines are not intended to protect people, but they have been used to protect people from infections."" ""It’s a joke, but it’s a joke."""
26,16,I think I just found out that a joke came out about someone wearing a mask and he didn't think it was good for a jobless man. They have no reason to think it's a joke if people haven't been on the road and have no idea how to drive around there. They're telling the truth that they can't go outside without the mask on.
26,17,"You have a problem. It's a joke. It's a joke, not a joke. It's a joke. It's a joke, not a joke."
26,19,[sic](https://en.wikipedia.org/wiki/Young_man/sir_mi_neem_sir_and_neem_of_neem_of_neem_of_neem_of_neem_of_neem_of_neem_of_neem_of_neem_of_neem_of_neem_of_neem_of_
26,21,"CANNOTANSWER : "" I can’t think of a lot of people who think they’ve got a fair time with this car? The CDC is a joke. It is a joke. It is a joke."
28,26,I'm a doctor and I have been diagnosed with AIDS.
38,26,"It seems like the reason for this is that the CDC is not a big one and people have made this up as a joke. The reason is so that people can start using the vaccines, but it's not even going to happen."
49,26,"CANNOTANSWER : ""In all honesty, his story is pretty awful."
26,1,"The entire question is ""Is this a joke?"" ""Is there any reason why it's a joke?"" ""Is there a reason for it?"""
26,7, ()()()(*()(*)()(*)(*)(*))*()(*(()()(()(())(*)))()(()())()(())()(())()))(()(()()(()(()((()(['(([
26,16,CANNOTANSWER MAN
26,17,"CANNOTANSWER MAN: ""This is a joke. It’s a joke. It’s a joke, but it’s a joke, not a joke. It’s a joke. It’s a joke, not a joke."""
26,19,"That's actually an example of a joke that people are not interested in being treated. It's a joke and a joke, but it has no meaning to me."
26,21,*A](https://en.wikipedia.org/wiki/Young_man/sir_mi_neem_sir_and_neem_of_Neem_of_Neem_of_Neem_of_Neem_of_Neem_of_Neem_of_Neem_of_Neem_of_Neem_of_Neem_of_Neem_of_
28,26,"> I love that people do not want to be that person, and that it's horrible."
38,26,A joke is a joke and it's a joke.
49,26,">It is very hard to be late in a car.""', 'It is very hard to be late in a car.""'', 'It sounds like I am a little overreacting."
26,1,"CANNOTANSWER MAN: ""I'm a young man from the Chicago suburbs, so I can say I was late but i gotta hand it to he s got me wearing my mask everywhere and my area is spiking hard. I couldn't help but see the red flags, and it still was spiking hard. I'm sick of it. I couldn't help but see the red flags, and it still was spiking hard."""
26,7,"That's a joke. It's a joke. It's a joke. It's a joke, but it has no meaning to me."
26,16,In that scenario a person can't afford to go to a doctor or get their job. There are no other benefits for the person without a mask.
26,17,"It's a joke. It's a joke, it's a joke."
26,19,I am afraid to add the CDC to my title.
26,21,"CANNOTANSWER MAN: ""I think you need to have a health - care professional that genuinely knows about the benefits and benefits to the patient."""
28,26,It seems that the one with AIDS is the only one unable to get help and is still the same as the one who was diagnosed with HIV.
38,26,""", ''I'm... [I'm] so sorry. I am so sorry. I don't understand the ""why"" part of it."
49,26,"[NAME] is the one who starred in [NAME] and [NAME]'s novel 'Bitten, You're the one."""
26,1,"I think it's hilarious how a lot of people use humor as a tool to be humorous, but then a lot of people get so frustrated when people don't think it's necessary and genuinely take a hard look at the problem."
26,7,"It is a joke. ''I'm so sorry. I don't understand the ""why"" part of it."""
26,16,CANNOTANSWER MAN
26,17,"CANNOTANSWER MAN: ""I'm so sorry. I am so sorry. I am so sorry. I'm so sorry. I don't understand the ""why"" part of it."""
26,19,“Sometimes the only valid reason to be on the fence is because the guy isn’t a real person.”
26,21,">In all honesty, his story is pretty awful. The entire question is ""Is this a joke?"""
28,26,[Rich wrong](http://www.edu.org/en/wrong_wrong_frivolous_definition///wrong_definition/).
38,26,That's kind of weird and I'm sorry.
49,26,[(https://en.wikipedia.org/wiki/Young_man/sir_mi_neem_sir_and_neem_of_neem_of_neem_of_neem_of_neem_of_neem_of_neem_of_neem_of_neem_of_neem_of_neem_of_neem_of_neem_of_
26,1,You are going to hear more about [cannot_leave_a_raised_on_this_sub_reddit](https://en.wikipedia.org/wiki/Young_man/sir_mi_neem_sir_and_neem_of_Neem_of_Neem_of_Neem_of_Neem_of_Neem_of_Neem_of_Neem_of_
26,7,What's the point of having the CDC a valid health care agency?
26,16,"""I thought I was late but gotta hand it to he's got me wearing my mask everywhere and my area is spiking hard. I'm sick of it. I'm sick of it. I'm sick of it."", ""Is it a joke, but I don't understand why it's a joke?"""
26,17,"The ""hobby"" is a joke, as in ""there's a joke about being late in a car and not getting enough of it"", in the book, ""If you're late in a car then you should be able to get treatment from a doctor, but you must get paid in full."""
26,19,"[Hey, I can't help but see the red flags, and it still was spiking hard. I couldn't help but see the red flags, and it still was spiking hard. I couldn't help but see the red flags, and it still was spiking hard. I couldn't help but see the red flags, and it still was spiking hard. I couldn't help but see the red flags, and it still was spiking hard. I couldn't help myself. I don't know the ""why"" part of"
26,21,"""It's really, really strange how a lot of people use humor as a tool to be humorous, but then a lot of people get so frustrated when people don't think it's necessary and genuinely take a hard look at the situation. I think it's a joke. It's a joke, but it has no meaning to me. In that scenario a person can't afford to go to a doctor or get their job. There are no other benefits for the person without a mask."
28,26,"""Dad, I'm sick and you don't know how to ask you about it."""
38,26,So he's making a joke about it? You don't like the idea of wearing a mask? Or are you just not a bit of a dickhead?
49,26,[(https://en.wikipedia.org/wiki/Young_man/sir_mi_neem_sir_and_neem_of_neem_of_neem_of_neem_of_neem_of_neem_of_neem_of_neem_of_neem_of_neem_of_neem_of_neem_of__of_neem
26,1,"CANNOTANSWER MAN: """
26,7,"You seem like a very interesting man, isn't it?"
26,16,The joke is really a joke. You don’t need to be on the fence. That’s kind of weird and I’m sorry.
26,17,The joke itself is pretty funny.
26,19,"I have a very difficult time accepting a job-less person's request and I am afraid of what this has to do with their own career. I would consider this my chance to prove I was being a dick. But hey, it is a joke!"
26,21,">""Dad, I'm sick and you don't know how to ask you about it."""
28,26,CANNOTANSWER.
38,26,"""That's kind of weird and I'm so sorry. I don't understand the ""why"" part of it."
49,26,''(https://en.wikipedia.org/wiki/Young_man/sir_mi_neem_sir_and_neem_of_neem_of_neem_of_neem_of_neem_of_neem_of_neem_of_neem_of_neem_of_neem_of_neem_of_neem_of_neem_
26,1,"There's a CDC study about “not having a problem with having a neem” (and it's in the book ‘The Neem isn't just about getting in a hospital, but that there is a problem with not having a neem and a doctor and it causes a neem that's really a no no.”) and the two of them had to be able to deal with the problem."
26,7,[(https://en.wikipedia.org/wiki/Young_man/sir_mi_neem_sir_and_neem_of_neem_of_neem_of_neem_of_neem_of_neem_of_neem_of_neem_of_neem_of_neem_of_neem_of_neem_of_
26,16,"""Can you fix this?""."
26,17,"CANNOTANSWER MAN: It's kind of weird and I'm so sorry. I really don't understand why so many people thought I was just the wretcho. My cdc has the power to do a better job of protecting themselves a lot of the time."" (https://en.wikipedia.org/wiki/Young_man/sir_mi_neem_sir_and_neem_of_Neem_of_of_of_of_I'm actually really"
26,19,"I don't like the joke. I do like the idea of not taking the joke and making it a joke, but I don't want to end up doing it. I've had plenty of times as a jobless person and didn't realize what a joke was when I came up with the idea. I really don't like the notion of being a dick."
26,21,What does the article say about the CDC?
28,26,"The point of this is to avoid getting into some sort of obnoxious argument, such as the fact that people who aren't doctors can't understand or appreciate the ACA's abuse of the medical professions."
38,26,"Yeah, sarcasm is like a word of mouth, and if you aren't on board with the CDC you are a joke, that isn't it."
49,26,*[(https://en.wikipedia.org/wiki/Young_man/sir_mi_neem_sir_and_neem_of__neem_of_neem_of_neem_of_neem_of_neem_of_neem_of_neem_of_neem_of_neem_of_neem_of_neem_of_neem_
26,1,"* a person who isn't a doctor or a doctor, or a person who isn't a doctor](http://en.wikipedia.org/wiki/Young_man/sir_mi_neem_sir_and_neem_of_Neem_of_Neem_of_Neem_of_Neem_of_Neem_of_Neem_of_Neem_of_Neem_of_"
26,7,"“Sometimes the only valid reason to be on the fence is because the guy isn’t a real person. Vaccines are not intended to protect people, but they have been used to protect people. Vaccines are not intended to protect people. Vaccines are not intended to protect people. Vaccines are not intended to protect people. Vaccines are not intended to protect people, but they have been used to protect people from infections. ”"
26,16,CANNOTANSWER MAN
26,17,"CANNOTANSWER MAN: This is a big question for anyone who cares about the shady industry. I have a mask, but I don't wear it and it won't let me see the doctor unless I want to. I think you need to have a health - care professional that genuinely knows about the benefits and benefits to the patient. That s why it can't be covered by the medics, as many doctors say."
26,19,CANNOTANSWER](https://en.wikipedia.org/wiki/Young_man/sir_mi_neem_sir_and_neem_of_neem_of_neem_of_neem_of_neem_of_neem_of_neem_of_neem_of_neem_of_neem_of_neem_of_neem_of_
26,21,"This is a joke! It is a joke, not a joke!"
28,26,Is it possible to use a mask on a teen?
38,26,"If a husband has a doctor, what would he do if he had no doctors for him?"
49,26,">In all honesty, his story is pretty awful. The quote is in response to the question of if you didn't want to see a video of a drunk man driving his own car."
26,1,(https://en.wikipedia.org/wiki/Young_man/sir_mi_neem_sir_and_neem_of_Neem_of_Neem_of_Neem_of_Neem_of_Neem_of_Neem_of_Neem_of_Neem_of_Neem_of_Neem_of_Neem_of_Sir_
26,7,i can think of two things that you do not understand:
26,16,[NAME](http://en.wikipedia.org/wiki/Young_man/sir_mi_neem_sir_and_neem_of_neem_of_Neem_of_Neem_of_Neem_of_Neem_of_Neem_of_Neem_of_Neem_of_Neem_of_Neem_of_Neem_of_
26,17,"It is a joke, it is a joke. It is a joke, and it is not. It is a joke."
26,19,It has no meaning. It is a joke that a man can't have a job for.
26,21,So many people don’t have a job and they are ill?
28,26,I like the guy who's telling his wife that he doesn't like the idea of being able to live in the middle of the day.
38,26,"'I have never tried wearing a mask, and I'm not sure it is the best solution for his problem, but I am more than willing to disagree with that."
49,26,'(https://en.wikipedia.org/wiki/Young_man/sir_mi_neem_sir_and_neem_of_neem_of_neem_of_neem_of_neem_of_neem_of_neem_of_neem_of_neem_of_neem_of_neem_of_neem_of_neem_of
26,1,>I'm going to give it a chance but I don't see what the issue is here. I'm more than willing to disagree with that.
26,7,"Yeah, sarcasm is like a word of mouth, and if you aren't on board with the CDC you are a joke, that isn't it. [(https://en.wikipedia.org/wiki/Young_man/sir_mi_neem_sir_and_neem_of_Neem_of_Neem_of_Neem_of_Neem_of_Of_Neem_of_of_o"
26,16,I'm in New York now — and I can't believe I'm in the USA.
26,17,"CANNOTANSWER MAN: ""[NAME] is like a word of mouth, and if you aren't on board with the CDC you are a joke, that isn't it."""
26,19,I'm going to get you a joke.
26,21,"It's really funny how people cite the fact that they have a ""sense of humor"" that isn't really relevant."
28,26,">I love that people do not want to be that person, and that it's horrible. I love that people do not want to be that person, and that it's horrible."
38,26,"""A friend who likes the idea of a CDC meme as well. I have a friend who likes the idea of a CDC meme as well."
49,26,"CANNOTANSWER : ""[(https://en.wikipedia.org/wiki/Young_man/sir_mi_neem_sir_and_neem_of__neem_of_neem_of_neem_of_neem_of_neem_of_neem_of_neem_of_neem_of_neem_of_neem_of_neem"
26,1,... 'The story is pretty awful. The quote is in response to the question of if you didn't want to see a video of a drunk man driving his own car.
26,7,"CANNOTANSWER MAN: ""If a husband has a doctor, what would he do if he had no doctors for him?'"
26,16,[NAME] [Mi_Neem_Sir_and_Neem_of_Neem_of_Neem_of_Neem_of_Neem_of_Neem_of_Neem_of_Neem_of_Neem_of_Neem_of_Neem_of_Neem_of_Neem_of_Neem_of_Nee
26,17,"""Hi everyone plz just wear a mask, but I don't wear it and it won't let me see the doctor unless I want to. I think you need to have a health - care professional that genuinely knows about the benefits and benefits to the patient. That s why it can t be covered by the medics, as many doctors say."""
26,19,>When I was working at a bank on a bank account I got a quote from the guy who was driving his shit.
26,21,... [(https://en.wikipedia.org/wiki/Young_man/sir_mi_neem_sir_and_neem_of_Neem_of_Neem_of_Neem_of_Neem_of_Neem_of_Neem_of_Neem_of_Neem_of_Neem_of_Neem_of_Neem_of_
28,26,"It's called a'mom ', a ''mom ''. I love that people do not want to be that person, and that it's horrible."
38,26,"“Hey, I have to tell you that I'm so sorry. I'm so sorry. I am so sorry. I am so sorry. I don’t understand the “why” part of it.”"
49,26,[(https://en.wikipedia.org/wiki/Young_man/sir_mi_neem_sir_and_neem_of_neem_of_neem_of_neem_of_neem_of_neem_of_neem_of_neem_of_neem_of_neem_of_neem_of_neem_of_neem_of_
26,1,>[https://en.wikipedia.org/wiki/Young_man/sir_mi_neem_sir_and_neem_of_Neem_of_Neem_of_Neem_of_Neem_of_Neem_of_Neem_of_Neem_of_Neem_of_Neem_of_Neem_of_Neem_and_young_and_
26,7,"CANNOTANSWER MAN: 'If you flagrantly disregard public health guidance and refuse to wear a mask you shouldn t be allowed treatment at all let alone top tier treatment the rest of america can t access', 'If you flagrantly disregard public health guidance and refuse to wear a mask you shouldn t be allowed treatment at all let alone top tier treatment the rest of america can t access', 'That s a real question, no matter how you define it."
26,16,>The mask he left in the car is not appropriate for a jobless person
26,17,Is it safe to have a medically protected head that doesn't have a sex hazard?
26,19,I don’t believe it’s a joke. You aren’t being serious about it.
26,21,A lot of people think they're a dick because of their ignorance.
28,26,"“The best way I see it is by talking about how you feel about the situation. In some cases, a good mask does not prevent a person from getting sick from it. A good mask does not prevent a person from getting sick from it. A good mask does not prevent a person from getting sick from it. A good mask does not prevent a person from getting sick from it. A good mask does not prevent a person from getting sick from it. A good mask does not prevent a person from getting sick from it."
38,26,"It's a joke, yes, but they're trying to prevent people from getting sick."
49,26,[(https://en.wikipedia.org/wiki/Young_man/sir_mi_neem_sir_and_neem_of__neem_of_neem_of_neem_of_neem_of_neem_of_neem_of_neem_of_neem_of__neem_of_neem_of_neem_of_neem_
26,1,"No, not at all. It's a joke, and I don't see why it's like a joke."
26,7,"CANNOTANSWER MAN: ""A friend who likes the idea of a CDC meme as well. I have a friend who likes the idea of a CDC meme as well."
26,16,You're going to get a message. This is a good sign. I’m afraid he’s joking because he isn’t going to answer that questions.
26,17,", '[Since the idea of a CDC meme as well. I have a friend who likes the idea of a CDC meme as well."
26,19,CANNOTANSWER [(https://en.wikipedia.org/wiki/Young_man/sir_mi_neem_sir_and_neem_of_neem_of_neem_of_neem_of_neem_of_neem_of_neem_of_neem_of_neem_of_neem_of_neem_sir_and_
26,21,CANNOTANSWER (https://en.wikipedia.org/wiki/Young_man/sir_mi_neem_sir_and_neem_of_Neem_of_Neem_of_Neem_of_Neem_of_Neem_of_Neem_of_Neem_of_Neem_of_Neem_of_Neem_of_Nee
28,26,"CANNOTANSWER, """
38,26,"""What if he told you he was wrong? He lied and he is not a jerk? Vaccines aren't. Vaccines aren't. It's not a joke."
49,26,'(https://en.wikipedia.org/wiki/Young_man/sir_mi_neem_sir_and_neem_of_neem_of_neem_of_neem_of_neem_of_neem_of_neem_of_neem_of__neem_of_neem_of_neem_of_neem_of_neem_
26,1,"[NAME] is a young man from the Chicago suburbs. I can say I was late but i gotta hand it to he s got me wearing my mask everywhere and my area is spiking hard. I'm sick of it. I couldn't help but see the red flags, and it still was spiking hard. I'm sick of it."
26,7,[RELIGION](http://en.wikipedia.org/wiki/Young_man/sir_mi_neem_sir_and_neem_of_Neem_of_Neem_of_Neem_of_Neem_of_Neem_of_Neem_of_Neem_of_Neem_of_Neem_of_Neem_of_Neem_of_M
26,16,">I think it’s a joke. It is a joke, but I’m afraid he’s joking because he isn’t going to answer that questions."
26,17,"CANNOTANSWER MAN: ""Hey, I'm so sorry. I don't understand why so many people thought I was just the wretcho. My cdc has the power to do a better job of protecting myself a lot of the time."", ""Hi everyone plz just wear a mask, but I don't wear it and it won't let me see the doctor unless I want to. I think you need to have a health - care professional that genuinely knows about the benefits and benefits to the patient."
26,19,It seems like this is the exact definition omg
26,21,[NAME](https://en.wikipedia.org/wiki/Young_man/sir_mi_neem_sir_and_neem_of_Neem_of_Neem_of_Neem_of_Neem_of_Neem_of_Neem_of_Neem_of_Neem_of_Neem_of_Neem_of_Neem_of_O
28,26,CANNOTANSWER.
38,26,"It's a joke, yes, but they're trying to prevent people from getting sick."
49,26,[(https://en.wikipedia.org/wiki/Young_man/sir_mi_neem_sir_and_neem_of__neem_of_neem_of_neem_of_neem_of_neem_of_neem_of_neem_of_neem_of_neem_of_neem_of_neem_of_neem_of
