sender,receiver,message
44,8,Vaccines are used for a specific type of disease. Vaccines are not meant to be used for any specific type of disease. They are not meant to be used for a specific type of disease. They are not meant to be used for a specific type of disease. They are not meant to be used for any specific type of disease. They are not meant to be used for any specific type of disease. They are not meant to be used for any specific type of disease. They are not meant to be used for any specific type of infection. They are not meant to be used for any specific
44,11,They aren't meant to be used for any specific type of disease. They aren't meant to be used for any specific type of disease. They aren't meant to be used for any specific type of disease. They aren't meant to be used for any specific type of disease. They aren't meant to be used for any specific type of disease. They aren't meant to be used for any specific type of disease. They aren't meant to be used for any specific type of disease. They aren't meant to be used for any specific type of disease
44,15,"Vaccines are not meant to be used for any specific type of disease. They are not meant to be used for any specific type of disease. They are not meant to be used for a specific type of disease. They are not meant to be used for any specific type of disease, unless they can be used for a specific type of disease, like a virus, infect others, or a parasite. Vaccines are not meant to be used for any specific type of disease. They are not meant to be used for a specific type of disease."
44,16,"It sounds like a ridiculous joke, but I agree with everyone that it's not a joke, but it sounds like it's a joke."
44,19,"In the article, he says, 'he doesn't like it'. In the article, he said ""Hey, I love to read about this, but I didn't read the article. I love to read about the article. I just don't like the idea of him and I love him. It's not really a joke, but a good one. The CDC has to do a lot to protect people from infections."""
44,20,Vaccines are used for different things - that is why they have been created and are not meant for a specific purpose.
44,31,Because a doctor isn't a doctor. A doctor is a chemist who has been on the CDC's board for 10 years.
44,40,"You are being sarcastic because you are an idiot and do not want to be the shit man who says ""this is my favorite movie ever.'"""
44,43,"I am a doctor with a virus that isn’t a parasite. The CDC does have a number of different types of viruses. I’m a bit scared that you can’t have anything on your face. I’m afraid that you need to be patient in order to get an infection, I believe if you have any symptoms, you can’t get the infection in the first place. I would feel guilty too, and I’d be sad."
51,44,"Wearing masks does not help in stopping the virus, it's useless and I hate it."
44,8,"No, I don’t understand what you mean - it’s a 'fake joke' and an incredibly insulting joke. I want to see your point of view and understand the point of view you are trying to make, but I want to feel better than the person you are implying that you are being sarcastic and rude and insinuating that you are a joke to the point where you are asking for a joke?"
44,11,"No. I'm not an obnoxious or smart person. But I think if this person does go see a dermatologist, they may be able to do some research in order to get that information."
44,15,Vaccines are not meant to be used for any specific type of disease.
44,16,> I've read that people who are on the CDC's board for 10 years.
44,19,"In his post, he writes : ""I don’t like the joke, because I don’t want to get into a fight with people who don’t want to take the chance and want to get infected."
44,20,"Vaccines can be used to prevent infections if you're not vaccinated and you don't wear a mask, they're also a filter for other infections if you're not infected or just don't wear one."
44,31,"I have no idea what this is about, but I've been on the board of directors for a while."
44,40,"> If I put on a mask in the bathroom, there are more spores. it’s a lot easier to kill a virus and then get mutated into a person. If you don’t want to get infected then they will infect someone else. A virus is not infectable. They are not infectable."
44,43,"> ""I have no sense of humor."
51,44,"Wearing masks does not help in stopping the virus, it's useless and I hate it."
44,8,He said he's not gonna let people go to a dermatologist to find out what the CDC says. So you're not going to go to the doctor to find out what the CDC says. But you're not going to tell someone that this is a joke.
44,11,">He is not a joke. He's just a septic. He's not gonna let you go to a dermatologist to find out what the CDC says."""
44,15,"Vaccines are not meant to be used for any specific type of disease, unless they can be used for any specific type of disease, like a virus, infect others, or a parasite."
44,16,Vaccines aren't intended to protect people from other diseases. They aren't meant to be used for any specific type of disease.
44,19,I'm a woman with HIV/AIDS. I'm from the US. I'm from the Netherlands.
44,20,I'm a doctor and have been to a lot of doctors with this. I have no idea what the reason is.
44,31,This is the joke I was making.
44,40,"The one thing I’m worried about in this whole thread is that you have a lot of information on a variety of diseases. If you don’t have a particular type of virus, that doesn’t mean that the virus isn’t infectable, but that a virus isn’t a parasite."
44,43,"No, it's not meant to stop the spread of HIV, and I'm sorry, but I do think it's a good idea."
51,44,"Wearing masks does not help in stopping the virus, it's useless and I hate it."
44,8,"If it's a joke, you should stop using it. It's not intended to be a joke. It's just an opinion."
44,11,"The CDC's advice is to get your skin clean and sterilized before the test is even done. And for that reason, if you're going to go to a dermatologist, do not use any kind of mask."
44,15,"As you can see, many of these words are not intended to be used in the context of a joke. Some are too extreme. The phrase ""I'm not a doctor"" is a bit misleading and has been overused."
44,16,">I want to be a doctor so I can take the time to do it because it's a bit of a waste of my time, which is ok. I'm really, really into the field of dermatology. So ohhhhh, ohhhhhhh."
44,19,"Vaccines aren't meant to be used for any specific type of disease, unless they are specifically designed to protect against it. Vaccines aren't meant to be used for a specific type of infection. They aren't meant to be used for a specific type of disease."
44,20,I don't think you are the joke or the joke is the thing about the joke.
44,31,"Vaccines aren't meant to be used for any specific type of disease,"
44,40,I’m a cdc volunteer.
44,43,"You are not a doctor, and I am not a doctor, and I cannot do anything for you. I'm not a doctor, and I cannot do anything for you."
51,44,"Wearing masks does not help in stopping the virus, it's useless and I hate it."
44,8,"I've been to a few, mostly positive ones and a few bad ones that I was not sure about, and if you want to know more about the terminology, you can google that and then look up the Wikipedia article. It's a joke, not a joke, but a joke."
44,11,"He was not supposed to wear a mask when he was infected, he was supposed to wear one, and he ended up getting into a bunch of situations, and it wasn't his job to do so. I can't remember what that was, but I was just trying to be a little more thoughtful."
44,15,Vaccines are not meant to be used for a specific type of disease.
44,16,"It seems that a lot of the people who are on the CDC are inherently idiots and they can't be treated with a vaccine. They can't be treated with a vaccine, and that's a huge waste of money."
44,19,It sounds like they're overestimating how many people are infected with HIV.
44,20,It's not a joke. It's a joke.
44,31,"I think people aren't gonna think that vaccines are for viruses, but for any disease. If they can be used for other types of infections, they won't need a specific type of vaccine."
44,40,"It's just that there are people that don't know about viruses. It's not that the CDC is putting the CDC in a position to stop the spread of viruses. It's that people don't know that viruses and parasites aren't parasites. And that there is nothing wrong with shaming your friend for having a virus if you don't have any viruses. It's like saying: ""If you have a virus and do not want to get infected then you're not infected."""
44,43,"""It's not funny that the CDC, the U.S. Health Service, the US Department of Defense, the Department of Defense, and other organizations had a similar position. The CDC, the National Cancer Institute and the Department of Defense have a similar position."
51,44,"Wearing masks does not help in stopping the virus, it's useless and I hate it."
44,8,"People will inevitably end up in a lot of different situations. I'm a doctor, a CDC volunteer, so a CDC article can be of great assistance to you."
44,11,"I don't really have any specific information but I don't have any idea about any type of vaccines, and a CDC/Dir. who is involved is a CDC/Dir. in that regard."
44,15,"Vaccines are not meant to be used for any specific type of disease, unless they can be used for a specific type of disease. They are not meant to be used for any specific type of disease. They are not meant to be used for any specific type of disease. Vaccines are not meant to be used for any specific type of disease. They are not meant to be used for a specific type of disease, unless they can be used for any specific type of disease, like a virus, infect others, or a parasite."
44,16,"I think that is a big problem in this context and that there is a lot of disagreement between the two of them. The wording of the article is simply too insensitive, sexist, etc. I just think the whole thing seems a bit absurd. The joke itself isn't that 'it's a joke,' but rather, the fact that the joke is so arbitrary that it doesn't matter if it was just intended to be a joke."
44,19,You're being naive! They're trying to do things to benefit you.
44,20,You're not a doctor.
44,31,"I’m not a doctor, but I do not want to be a doctor. I want to do the things that will help me. I just have the courage to work through what I want to do."
44,40,"In Texas it's considered a parasite. A parasite, a fungus, and no more than a parasite. It's a parasite."
44,43,Vaccines aren't meant to be used for any specific type of disease. They aren't meant to be used for any specific type of disease.
51,44,"Wearing masks does not help in stopping the virus, it's useless and I hate it."
