sender,receiver,message
22,12,">If my father gets a sick rash you need to know that the vaccines can’t be used to prevent it. There isn’t a specific type of disease that could be infected with them,"
24,12,"Wearing masks does not help in stopping the virus, it's useless and I hate it."
25,12,"It's a little naive to use ""I'm a white man with a mask."" But it is one of the best things that can happen to a group of people. It's not like this guy is the one who is going to kill you, the only way to stop that. It's a way to reassure the person. It's a big issue. It's very important to have people look at the problem and to realize it can't happen anywhere else."
41,12,I'm not sure I understand the title.
12,1,CANNOTANSWER:
12,2,CANNOTANSWER:
12,8,"This is a big issue in the US. It can be a big deal. Having been in a very traumatic situation as a child and not being able to do anything that will result in a rape victim in your life is a huge, terrible thing. It can be a huge, huge deal."
17,12,He said he thinks it is a joke that is going to get people sick by not snooping.
18,12,"CANNOTANSWER : ""...as a Texan and a member of the ACA party. A politician could have a problem with a texan mask being put on the street."""
22,12,"CANNOTANSWER: I read this as the guy who told someone to go get a mask if they don't want one, and was then asked if he wanted to wear a mask while they were drunk. Then he said he didn't want a mask and he couldn't. He slapped him on the head with a hat."", ""I'm not even a snob, so I'm trying to say something really dangerous here."", ""The first point that came to mind was a guy who"
24,12,"Wearing masks does not help in stopping the virus, it's useless and I hate it."
25,12,I’m a guy with a mask and I want to get my kids to see a new one. I’m not a guy or a racist but I want to keep my friends happy.
41,12,"No, I believe it should be addressed."
12,1,"A woman in the US was asked to wear a mask because she was getting a snooty nose in the morning. She wore a mask to get a snooty nose and that she wouldn't wear a mask to work in the hospital for long enough for her to not be snooty nose when she had sex. Her response was ""I don't think it's really a joke"" and said ""I think it's a snooty nose but snoo"
12,2,"Are you even aware that if the government repeals the ACA, they will get involved in an investigation into how it's being rolled back, which is something the rest of us cannot even start on."
12,8,I'm not sure how you're getting the message. I'm a lawyer.
17,12,CANNOTANSWER:
18,12,CANNOTANSWER : [(http://www.thesoho_doc_rating_historian_flax](https://www.reddit.com/pdc_sir_mashing_a_mask_of)(https://www.reddit.com/pdc_sir_mashing_a_mask_of)(https://www.reddit.com/pdc_sir_mashing_a_mask_of_
22,12,"> ""Some of these people s....... I really think you’re just trolling. I think it’s hard to know if you’re talking about a specific type of virus or an exact example of a parasite. It isn’t. They aren’t. They aren’t. They aren’t. They aren’t. They aren’t. They aren’t. They aren’t. They aren’t. They aren’t. They aren’t."
24,12,"Wearing masks does not help in stopping the virus, it's useless and I hate it."
25,12,">""Sometimes the only valid reason to be on the fence is because the guy isn't a real person."""
41,12,"CANNOTANSWER: ""I'm a Republican who lives in California. I think that the ACA should be addressed. It is a big issue. 'I think it should be addressed'."
12,1,"CANNOTANSWER, *a little naive to use ""I’m a white man with a mask."""
12,2,"CANNOTANSWER is a retort to how he is thinking about the ACA. It's a very good idea. He's not a racist and has nothing to do with the ACA, but the president of the United States has a very good understanding of the issue. He's not a racist and it's one of the most important things he has seen and has taken a huge stance on."
12,8,"No, I don't. I believe the ACA should be repealed and the ACA should not be removed. But, a mask that can prevent a person from getting sick is absolutely inappropriate. Whether or not someone is being raped will be decided by the CIA."
17,12,"I have a hard time saying that I'm sorry he made me sick & his dad doesn't like me wearing a mask, because that's the joke. I love your style, and it makes sense, but you are an asshole. I love your style and it makes sense."
18,12,"CANNOTANSWER : ""I just don't understand the difference between 'I'm not racist at all.' I mean 'I'm not racist at all.'"
22,12,It's not exactly a big deal. This isn't a good idea. I'm not an attorney and I'm not even a doctor.
24,12,"Wearing masks does not help in stopping the virus, it's useless and I hate it."
25,12,"There is no reason to be on the fence. There is no reason to keep your kids safe in public. The CDC is trying to get people to buy vaccines, which is not the actual reason."
41,12,"The first ten lines are renamed to ""[Meanwhile, it's racist. It's racist because people think it's racist. It's racist because people think it's racist. It's racist because people think it's racist. I think it's racist because people think it's racist."""
12,1,"""Is this a good idea?"""
12,2,It's hard for people to understand that a mask is an immoral way of indicating who you are. The ACA is racist.
12,8,"I believe that the ACA should be repealed. It's very, very... a hive of political cynicism and the US doesn't want a government to do anything but give us the answers you are looking for."
17,12,"No, this isn't a joke. It's just a joke."
18,12,This isn't about whether or not you're racist. It's about whether you're trying to do something you don't like.
22,12,"CANNOTANSWER, ""I've never heard of a snob because of his lack of knowledge about himself and is racist. I'm not even a snob, so I'm trying to say something really dangerous here."""
24,12,"Wearing masks does not help in stopping the virus, it's useless and I hate it."
25,12,"As a woman who wears masks, I am going to say, ""The only way to stop the infection is to get out of there and protect your health. I'd never do it again."""
41,12,"A bunch of people were in California this weekend. One person was there, and they went to a bar. It was pretty fun. The other man wore a mask to talk about the ACA."
12,1,Why did you wear a mask to snooze? How was that a joke?
12,2,">I love the feeling of being sick and feeling really good after I got out of a long time. It just hurts."","
12,8,>Sometimes the only valid reason to be on the fence is because the guy isn’t a real person.
17,12,It was a pretty simple joke.
18,12,The ACA isn't a big issue to have a major impact on the political debate.
22,12,"People who don't have the right to wear a mask aren't going to be able to prevent the spread of a virus that could infect you, and if you don't have a mask, you won't have a virus in the first place. Unless you can't eat enough to eat enough, he's likely just eating enough to be a snob."
24,12,"Wearing masks does not help in stopping the virus, it's useless and I hate it."
25,12,"CANNOTANSWER : ""A joke is a joke. I think there's a lot of different interpretations of the CDC's policies as a joke than people think. The fact that he's saying ""oh I'm sorry"" is ridiculous. ""Muscles don't need snouts"" It's a joke."
41,12,Is there a difference between racial and racial? Are there any amendments that make that change? The state would rewrite it.
12,1,"It was an attempt to make a joke to make people look better, but it would also be a satire of anti-racism. It's a joke. It's a joke. It's not just a joke. It's a satire. It's a joke. The ACA should be repealed."
12,2,"''I love the feeling of being sick and feeling really good after I got out of a long time. It just hurts.""''', ''As a woman who wears a mask. I love the feeling of being sick and feeling really good after I got out of a long time. It just hurts.""'', ''Sometimes the only valid reason to be on the fence. There is no reason to be on the fence. There is no reason to be on the fence. ''Is the [An]h"
12,8,"It’s a joke. The only thing you’ve even told me is that you’ve come into contact with a racial, sex, sexuality, and sexism shitstorm with a guy in a mask. I’ve never heard of a racial, sexism shitstorm, or a sex abuser. I’ve never gotten around to making a joke about this, or seeing how people respond to the joke or are being a joke, a joke, or being"
17,12,>Were you able to prevent the infection?
18,12,>“Sorry I've been in a relationship with this guy for years”
22,12,"CANNOTANSWER: A lot of slurs and misunderstandings are not a good thing. A lot of slurs and misunderstandings are a lot of misunderstandings that a man could be dangerous. Wearing masks does not help in stopping the virus, it's useless and I hate it."
24,12,"Wearing masks does not help in stopping the virus, it's useless and I hate it."
25,12,What is the name of the movie you're talking about?
41,12,"The article isn't specific, it's not a complete, arbitrary statement."
12,1,"CANNOTANSWER: I'm going to go with you, because I don't think it's a funny joke."
12,2,It's a lot of people who think that this is a satire.
12,8,"The whole point of the ACA is to keep the country safe from drugs, drugs are more important than those of us afaik. We can protect people in an effort to protect us, so that's an important part of the ACA."
17,12,I'm so sorry this happened to you and I apologize for that if it happened to you again.
18,12,"The wording of the post is very ambiguous, especially considering the wording was used in context."
22,12,"It's a very simple and sensible way to do it. It's simple to use. You're not a snob, so you're not a snob."
24,12,"Wearing masks does not help in stopping the virus, it's useless and I hate it."
25,12,"As much as I agree with this statement, the CDC has been very clear and concise about the current situation in the U.S., and the fact that a lot of white people aren't able to go to public safety for a few years now means that the CDC is not going to do anything. I’m glad to see CDC has worked in the past to reduce this situation."
41,12,CANNOTANSWER)(http://www.justicerevolution.org/cd/en/constitution/apc/shitty-discrimination-narcotic-treatment-is-severely-apical-rights-within-the-aggression-genre/...](http://www.justicerevolution.org/en/comments/article-shitty-act-aggression-genre/)](http://www.justicerevolution.org/comments/comments/d
12,1,[https://www.justicerevolution.org/en/comments/article-shitty-act-a][https://www.justicerevolution.org/en/comments/article-shitty-act-a][https://www.justicerevolution.org/en/comments/article-shitty-act-a][https://www.justicerevolution.org/en/comments/article-shitty-act-a][https/
12,2,CANNOTANSWER'S POLICY IS NECESSARY TO BE PART OF THE MAKEUP.
12,8,>Sometimes the only valid reason to be on the fence is because the guy isn’t a real person.
17,12,I grew up with an HIV infection and my friends and I were the only ones in the entire community. I think that we have all been in need of this.
18,12,"CANNOTANSWER : ""I think that we have a lot of misunderstanding about it right now. I think this is a good idea. I'm just going to add that some issues do have a lot of resonance."
22,12,">I think it’s pretty clear that he’s going to be a snob because of his lack of knowledge about himself and is racist. I’m not even a snob, so I’m trying to say something really dangerous here."
24,12,"Wearing masks does not help in stopping the virus, it's useless and I hate it."
25,12,CANNOTANSWER and CANNOTANSWER'S POLICY ARE NECESSARY TO BE PART OF THE MAKEUP.
41,12,"It sounds like it's the type of thing that should be addressed. The ACA, or the ""As it is, it's racist because people think it's racist. It's racist because people think it's racist."""
12,1,>As I think it’s pretty clear that he’s going to be a snob because of his lack of knowledge about himself and is racist.
12,2,[http://www.justicerevolution.org/en/constitution/apc/shitty-discrimination-narcotic-treatment-is-severely-apical-rights-within-the-aggression-genre/](http://www.justicerevolution.org/en/constitution/apc/shitty-discrimination-narcotic-treatment-is-severely-apical-rights-within-the-aggression-genre-gen
12,8,People with AIDS don’t know this nonsense.
17,12,What's the best way to explain what happened?
18,12,"A narcissist. A narcissist who is trying to change society. The ACA doesn't have a major impact on the political debate, the law itself is a major issue."
22,12,"This is not the way it should be a ""nothing to do"" or ""shit,"" but rather that you're just being a snob or not."
24,12,"Wearing masks does not help in stopping the virus, it's useless and I hate it."
25,12,"""But then I realize why this would be a great way to end it? A rape victim can’t be a rapist. I don’t want to be a racist, I’m a guy or a racist."","
41,12,"It’s not a racist thing, it’s just a racist thing."
12,1,"I think it's a good idea for them to have a piece on what sex is. What sex isn't is another good idea for the law. I'm a woman, and this is one of those things."
12,2,"The Obama Administration is threatening to repeal the ACA, and it sounds like they are attempting to manipulate the public in order to change that."
12,8,It can’t make sense to me to go on the fence as a doctor. I’m gonna have to try to make it so I can keep the ACA. I think it can be a great idea to stop people from stealing their lives.
17,12,Vaccines aren't meant to protect people from getting sick. They're not meant to protect people from getting sick.
18,12,"If it sounds like he is a narcissist, then he is just trying to change society."
22,12,(http://en-us.gov/repair/index.aspx?h1=0&ee=H1&ee=H1B&f#x##c=ee).
24,12,"Wearing masks does not help in stopping the virus, it's useless and I hate it."
25,12,CANNOTANSWER AND CANNOTANSWER CANNOTANSWER
41,12,CANNOTANSWER (http://www.justicerevolution.org/en/comments/article-shitty-act-aggression/stratege-aggressive-a)'(http://www.justicerevolution.org/en/comments/article-shitty-act-aggressive-a)
12,1,"The ACA was passed with a lot of ramifications to Americans. The way it's being debated in Congress is a very, very complex issue."
12,2,I am going to keep saying these three things:
12,8,>(http://www.justicerevolution.org/en/constitution/apc/shitty-discrimination-narcotic-treatment-is-severely-apical-rights-within-the-aggression-genre/) [(http://www.justicerevolution.org/en/constitution/apc/shitty-discrimination-narcotic-protection/strateg-aggressive-aggressive-aggressive-aggressive
17,12,">I'm not sure how it goes, but that's a really good point."
18,12,"CANNOTANSWER : ""[[https://www.thesoho_doc_rating_historian_flax](https://www.reddit.com/pdc_sir_mashing_a_mask_of)(https://www.reddit.com/pdc_sir_mashing_a_mask_of)(https://www.reddit.com/pdc_sir_mashing_a_mask_of"
22,12,That's exactly what a CDC article says.
24,12,"Wearing masks does not help in stopping the virus, it's useless and I hate it."
25,12,It is a joke because a lot of people are saying that these jokes are gonna make people feel like they're not a dick and that people are really not that stupid. But I'm glad to see CDC has worked in the past to reduce this situation.
41,12,CANNOTANSWER](http://www.justicerevolution.org/en/comments/article-shitty-act-aggressive-a)
