sender,receiver,message
17,12,“I think it would be nice if he could have a good sex plan. And his dad might want to get to know how he's making a point.
18,12,"I think it's an important question. Basically, ""Why is this on the wiki?"""
22,12,"CANNOTANSWER: I read this as the guy who told someone to go get a mask if they don't want one, and was then asked if he wanted to wear a mask while they were drunk. Then he said he didn't want a mask and he couldn't. He slapped him on the head with a hat."
24,12,"Wearing masks does not help in stopping the virus, it's useless and I hate it."
25,12,"[http://en.wikipedia.org/wiki/The_Song_of_The_Sailor_of_The_Sailor/](http://en.wikipedia.org/wiki/Sailor-of-the-Sailor-of-the-Sailor-of-the-Sailor_of_The_Sailor_of_The_Sailor-of-The_Sailor_of_The_Sailor_of_The_Sailor,|http://en.wikipedia.org/wiki/Sa"
41,12,"I like to talk to people in the ACA, and have a lot of good ideas, and I think I have some good ideas."
12,1,"I'm going to go with you, because I don't think it's a satire."
12,2,That's a little funny...
12,8,"It's the ACA. It's a great way to make people aware that they are not racist, or that the ACA is not going anywhere."
17,12,"Basically, this is a joke."
18,12,>(https://www.reddit.com/pdc__sir_mashing_a_mask_of)(https://www.reddit.com/pdc__sir_mashing_a_mask_of)(https://www.reddit.com/pdc__sir_mashing_a_mask_of)(https://www.reddit.com/pdc_sir_mashing_a_mask_of
22,12,I've always thought the CDC is only protecting those who aren't infected with HIV. They're not getting the virus through smears. The fact that they don't have one isn't true.
24,12,"Wearing masks does not help in stopping the virus, it's useless and I hate it."
25,12,... And then you realize why this would be a great way to end it? A rape victim can't be a rapist.
41,12,"I think a lot of them are just describing the type of anti-racism that the anti-Mask Act aims to combat, and that is a bad one."
12,1,"I read this as the guy who told someone to go get a mask if they don't want one, and was then asked if he wanted to wear a mask while they were drunk. Then he said he didn't want a mask and he couldn't. He slapped him on the head with a hat."
12,2,CANNOTANSWER:
12,8,"A rape victim can't be a rapist. It's like someone just in an attempt to stop a group from forming racists because of their sexuality. They can get away with something. It seems like there's no way around it. I have a friend that likes to wear masks. So he'll probably just be fucking in the sand, and he's gonna get a sick mask. I read a lot of ad hominem in this subreddit."
17,12,"I'm sick of my bf being sick. I can't tell you if he's making a point or not, but if he's making a point, I can't tell you how he is. I'm sick of him, but he's sick of this. I can't tell you the other way around. I can't make you a better person, I can't tell you what he was snooping and why he's wearing a mask on me. It's an absurd amount of"
18,12,"The article explains it as ""he's trying to do something that I don't like."" This isn't the ""why"" part of the article. It's about the fact that if something is going to be voted down, it won't exist. I think that the ""what's really going on"" is part of the idea."
22,12,I'm the mother of four kids with HIV.
24,12,"Wearing masks does not help in stopping the virus, it's useless and I hate it."
25,12,“Sometimes the only valid reason to be on the fence is because the guy isn’t a real person.”
41,12,"I don't think that the ACA is the right thing to do. If I were a person who was a racist, I would call myself a racist."
12,1,"This is a satire, not an actual satire. It isn't going to be the wrong thing to do."
12,2,CANNOTANSWER: A rape victim can't be a rapist.
12,8,"What's more, the ACA is basically the only thing that makes sense."
17,12,"I mean that sounds very, very offensive to the guy. But what I do know is that even though he is a man who can only afford a smear campaign, he is not actually a good human being. You gotta go to school or get a job. If you go to school, you can't go to the doctor to get your smear campaign. If you go to school, you can't go to school if you aren't allowed to get an smear campaign."
18,12,"The only real reason to be on the fence is because the guy isn't a real person. Wearing masks does not help in stopping the virus, it's useless and I hate it. I think that the ""what's really going on"" is part of the idea. This is a r/RedditNanoTannish subreddit."
22,12,The first point that came to mind was a guy saying he was trying to make a fun joke.
24,12,"Wearing masks does not help in stopping the virus, it's useless and I hate it."
25,12,[(http://en.wikipedia.org/wiki/The_Song_of_The_Sailor_of_The_Sailor/](http://en.wikipedia.org/wiki/The_Song_of_The_Sailor_of_The_Sailor/)](http://en.wikipedia.org/wiki/The_Song_of_The_Sailor_of_The_Sailor_of_The_Sailor_of_The_Sailor_of_the_Sailor_of_The
41,12,"I don't know what you're talking about but I think the ACA is a problem that should be solved in a number of ways - it's not an ""infidel"" thing and, as it is, it is not the best thing to do. If the ACA is drafted and the government has to keep it up then the problem is with the politics of the state. I believe it is a bad idea."
12,1,"... And then you realize why this would be a great way to end it? A rape victim can't be a rapist. I think a lot of them are just describing the type of anti-racism that the anti-Mask Act aims to combat, and that is a bad one. I read this as the guy who told someone to go get a mask if they don't want one, and was then asked if he wanted to wear a mask while they were drunk. He slapped him on the head with"
12,2,"This is a satire, not a good one."
12,8,CANNOTANSWER:
17,12,I'm not saying the CDC can't do anything to stop the CDC from spreading the virus - its a parasite and you can't stop people from getting it.
18,12,"The ACA, it is a very large issue. It is a law of our government, a very important one in that it has a lot of ramifications to Americans. They can't just throw it away because it is a bogus law."
22,12,"There's a lot of slurred speech and misunderstandings that a man could be dangerous. Wearing masks does not help in stopping the virus, it's useless and I hate it. I would say that he is trying to be a snob because of his lack of knowledge about himself and is racist. I'd like to say that he is trying to be a snob because of his lack of knowledge about himself and is racist. I'd like to say that"
24,12,"Wearing masks does not help in stopping the virus, it's useless and I hate it."
25,12,IANAL but I've seen this a couple times on Reddit.
41,12,This isn't a topic about the ACA itself.
12,1,What's the most important part about the ACA?
12,2,"CANNOTANSWER is not a racist. He is the kind of person who's trying to make a fun joke about the ACA. He thinks that he's wrong to think so, and if he can make a fun joke about it, he'll be in trouble."
12,8,"""Sometimes the only valid reason to be on the fence is because the guy isn’t a real person."""
17,12,So the CDC is promoting the use of a mask in an attempt to hide a symptom.
18,12,[This is a subreddit full of racist comments.
22,12,"That's a lot of shit. I don't think it matters. I think it's one of the most stupid things in the world. I've never heard of a snob as being a snob, and I don't think it matters. I'm just being honest and if I don't understand what you mean, I'm pretty sure I don't want to be snobish."
24,12,"Wearing masks does not help in stopping the virus, it's useless and I hate it."
25,12,The message is a joke.
41,12,"Aside from the ''My First reaction to this was to say, ""I don't like people being racist but I like people who are very smart enough to think that being black is not racist. No, this is a joke. I think it's racist. It's racist. It's racist, it's racist. I think it's the right thing to do.""''"
12,1,"""The ACA is a problem that should be solved in a number of ways - it is a very large issue. It is a law of our government, a very important one in that it has a lot of ramifications to Americans. They can't just throw it away because it is a bogus law."
12,2,"That's not how you get around the ""Mad Men and Drugs"" joke."
12,8,I think a mask would be like an infested room because it sat on the floor and didn’t need it to keep me awake. I’ve been on it and it’s just so uncomfortable. My friend has a mask and I have hers on her too. And there’s a line in the title saying the only reason to wear it is because the guy isn’t a real person. I’m pretty sure the other guy wasn’t wearing it when he saw that I don’t see them on their side.
17,12,The joke isn't a joke. It's a joke that you can't say. It's a joke.
18,12,"The ""what's really going on"" part of the article is ""How the ACA is not a big enough issue to have a major impact on the political debate?"","
22,12,"I think it's a really, really complicated situation."
24,12,"Wearing masks does not help in stopping the virus, it's useless and I hate it."
25,12,"I read a lot of ""You are not racist, but I don't think it is the right thing to do."" as ""The message is a joke."""
41,12,"This is racist because people think the mask is racist, so the people who want to say ""as racist as it is."" are simply racist."
12,1,"The ACA is a bill that has been debated for years, but not in much detail. Whether it's a racist law is still something they've been pushing the government to do."
12,2,"That a big thing? And that a big one? Because if you think there are so many reasons to be offended by the ACA, I don't think the ACA is the right thing to do."
12,8,CANNOTANSWER has a lot of stories like that. His family lives in Africa and has to deal with the realities of this sort of situation.
17,12,What does he think is really a joke?
18,12,">I'm not racist, but it sounds like an important part of the issue."
22,12,"I have a mask that screams ‘I’m not a snob,’ in front of me. That is really cool."
24,12,"Wearing masks does not help in stopping the virus, it's useless and I hate it."
25,12,"I see it's the point of the sentence, you read the other comments and you realize there is a difference between ""I think it's a joke"" and ""I think it's a joke."""
41,12,>Sometimes the only valid reason to be on the fence is because the guy isn't a real person. I know what you mean. I was a Texan in California and I was a member of the ACA party.
12,1,I have to think of a big difference between what he's saying and what I read about the ACA.
12,2,"[CanNOTANSWER has a lot of stories like that. My First reaction to this was to say, ""I don't like people being racist but I like people who are very smart enough to think that being black is not racist. No, this is a joke. I think it's racist. It's racist. It's racist. It's racist, it's racist. I think it's the right thing to do. I believe there are a lot of ways to explain it, and it's an important one."
12,8,"CANNOTANSWER, I'm a Texan and I'm just curious."
17,12,He is a liar.
18,12,Why would you be so ambivalent about not wearing a mask?
22,12,"> [I'm going to get a mask on, then I need to put it on a head and then I can go with it on and then I'll start to snort because of the fact that I have a mask. I've never heard of a snob because of his lack of knowledge about himself and is racist. I'm not even a snob, so I'm trying to say something really dangerous here."
24,12,"Wearing masks does not help in stopping the virus, it's useless and I hate it."
25,12,A couple times I've read this on Reddit.
41,12,">""Is this a racist thing.'"
12,1,"This is a great way to keep our country open.... ""I'm not racist, but it sounds like an important part of the issue. I have a mask that screams ‘I’m not a snob,’ in front of me. That is really cool."
12,2,"The ACA is a very important issue for our government. If the ACA hasn't been passed, the government needs to act on it."
12,8,"I don't know, but what it really sounds like is that he is being racist. He is being a liar and it's just really 'naive'. You just have to let him know it's just a joke and he's bringing that up here."
17,12,"Vaccines do help with a lot of things. People are being told to not wear them if it's a disease. The only thing they can do is try and tell them that the CDC needs to ban their products from being sold in Canada and that they are only to give it to people in the US, even if it's not the actual disease."
18,12,"""You are going to be a big dick. This guy is going to be a big dick. If he doesn't like it, he won't be a good doctor. It's not really a big problem. It's just a little something that he might not like. So he will do this to try and change society, but if he is not a big dick, it's too much of an issue."
22,12,"I think you're going to have to find a new way to deal with the fact that you're a snob, so I'm gonna call you a snob."
24,12,"Wearing masks does not help in stopping the virus, it's useless and I hate it."
25,12,Is it possible a guy who has a sexually transmitted infection is actually using the virus for sex?
41,12,It's funny. Cannot really think of anything better. I just don't think that we are the only thing in America that has a bad record of the ACA.
12,1,"""... I think it's a great way to keep our country open...."
12,2,"""[I'm gonna get a mask on, then I need to put it on a head and then I can go with it on and then I'll start to snort because of the fact that I have a mask."""
12,8,"""I don't like being on the fence, but I don't think the government is going to pay for this. The government is not going to pay for this, but in my experience it is not an enforceable law, which you should respect."""
17,12,"He's probably a liar who reacted in an offended way by being in his shoes - he said he was not the same as him - he was his own boyfriend. You're implying that ""they should be allowed to give people a mask"" doesn't actually apply?"
18,12,It seems like the ACA is something that is going to be a big issue.
22,12,"Vaccines are not meant to be used for any specific purpose, unless they can be used for a specific type of disease, like a virus, infect others, or a parasite. Vaccines are not meant for a specific type of disease, like a virus, infect others, or a parasite. Vaccines are not meant for a specific type of disease, like a virus, infect others, or a parasite. Vaccines are not meant to be used for a specific type of disease, like a parasite"
24,12,"Wearing masks does not help in stopping the virus, it's useless and I hate it."
25,12,"""Sometimes the only valid reason to be on the fence is because the guy isn’t a real person."""
41,12,You just posted a really really interesting post on your post. I don't think you think anything about this is correct.
12,1,">I'm going to go with you, because I don't think the ACA really exists. I’m going to go with you, because I don’t think the ACA really exists. [However,](http://www.justicerevolution.org/en/comments/article-shitty-act-aggressive-a)[https://www.justicerevolution.org/en/comments/article-shitty-act-aggressive-a)[https/phl"
12,2,">As an avid fan of the ACA, I can confirm:"
12,8,I think people who think it's sexist in this subreddit are wrong about the ACA.
17,12,I don't understand this fucking joke.
18,12,RAcial identity issues are a big concern in America.
22,12,Vaccines are not meant to stop infection or prevent infection.
24,12,"Wearing masks does not help in stopping the virus, it's useless and I hate it."
25,12,a lot of people want to get a divorce or have children.
41,12,>I'm a conservative. I'm a Texan and a member of the ACA party.
12,1,"A couple days after this article was written, I realized that the ACA is a 'fake' and that people are not really getting it. The question is if people believe it is a 'fake' and if they do not think it is an important issue? I thought it was just an anti-racism law and that it was 'fake' because people are not being true to their word."
12,2,"ACA is an important issue for our government. If it hasn't been passed, the government needs to act on it."
12,8,Is it possible a guy who has a sexually transmitted infection is actually using the virus for sex? It's funny. Cannot really think of anything better. I just don't think that we are the only thing in America that has a bad record of the ACA.
17,12,>He's probably a liar who reacted in an offended way by being in his shoes
18,12,"I figured I would get the whole message of ""if you're going to be stupid enough not to wear a mask then he deserves what he gets hopefully he doesn't infect anyone else."" (https://www.reddit.com/pdc_sir_mashing_a_mask_of)(https://www.reddit.com/pdc_sir_mashing_a_mask_of)(https://www.reddit.com/pdc_sir_"
22,12,[An article in the newspaper about the CDC is the one that got to the bottom of my head: The CDC has made a mistake with the definition of the term because it's too confusing and misleading to fit it in any context.]
24,12,"Wearing masks does not help in stopping the virus, it's useless and I hate it."
25,12,"In NYC, the government can do what it wants. No one can put a mask on public sanity. No one can put a mask on public sanity. A mask on the street is a bad idea. No one can put a mask on public sanity."
41,12,I thought he was joking and I thought that was a bit of a joke based on the comment
12,1,"""A mask doesn't make people look bad, it's useless and I hate it. You can’t get a sex life with a mask when you are drunk."
12,2,A friend I've seen have a mask. It works wonders. But I also have the same problem.
12,8,">""It seems like there's no way around it."""
17,12,This is not a joke. It is a joke.
18,12,You can't even see the text. You have no idea why it's on the wiki.
22,12,"I feel like when people are told that they are on a medication for this disease, they really have no control over what their body will do if they do not have it."
24,12,"Wearing masks does not help in stopping the virus, it's useless and I hate it."
25,12,CANNOTANSWER and CANNOTANSWER'S POLICY ARE NECESSARY TO BE PART OF THE MAKEUP.
41,12,It's a pretty funny narrator.
12,1,"Why don't they do this? This isn't a satire of an anti-racism bill, this is the anti-Mask Act, and the ACA is a bad anti-racism bill. It's not just a joke. It's a very, very good idea."
12,2,"This is a great example of a racist insensitive that can't understand what's going on. If the ACA hasn't been passed, a good and powerful body can act. Rather, the whole concept of racism is not true."
12,8,> The CDC has made a mistake with the definition of the term because it's too confusing and misleading to fit it in any context.
17,12,I'd be an asshole to wear a mask.
18,12,"CANNOTANSWER : ""Sometimes the only valid reason to be on the fence is because the guy isn't a real person. Wearing masks does not help in stopping the virus, it's useless and I hate it. I think it's a good idea to get a therapist and get this to people, but it's a good idea to have a therapist. You can't even see the text. You have no idea why it's on the wiki."""
22,12,>I think it’s one of the most stupid things in the world.
24,12,"Wearing masks does not help in stopping the virus, it's useless and I hate it."
25,12,CANNOTANSWER:
41,12,That's racist. It's racist because people think it's racist. It's racist because people think it's racist.
12,1,"The ACA is a satire of anti-racism, and is currently being debated. In addition to being on the ballot, the ACA is a satire."
12,2,CANNOTANSWER and CANNOTANSWER'S POLICY ARE NECESSARY TO BE PART OF THE MAKEUP.
12,8,"I want to add some other relevant stuff, I'm not sure why they haven't written an article about how the ACA is going to cause a real stir. That's something I don't want to read."
17,12,"CANNOTANSWER MAN: I'm sorry for your loss and not knowing you. I'm so glad he made you a better person."""
18,12,"> ""Sometimes the only valid reason to be on the fence is because the guy isn't a real person. Wearing masks does not help in stopping the virus, it's useless and I hate it."
22,12,">I feel like when people are told that they are on a medication for this disease, they really have no control over what their body will do if they do not have it."
24,12,"Wearing masks does not help in stopping the virus, it's useless and I hate it."
25,12,"I’m a young man who wears a mask when I’m sick and want to look good, but when it comes to sex and sexual hygiene."
41,12,CANNOTANSWER:
12,1,>(http://www.justicerevolution.org/en/comments/article-shitty-act-a)[https://www.justicerevolution.org/en/comments/article-shitty-act-a)[https://www.justicerevolution.org/en/comments/article-shitty-act-a)[https/phl](https://www.justicerevolution.org/en/comments/article-shitty-act-a)(https/
12,2,"I am on a mission, you’ve got to go! We will get the mask on at 10"
12,8,**** I have a mask on and it’s not safe. And it’s also not safe for people to have.
17,12,I have to get my feet wet but my feet are wet. I love the feeling of being sick and feeling really good after I got out of a long time. It just hurts.
18,12,So how did [neem neem_of_neem_of_neem_of_neem_of_neem_of_neem_of_neem_of_neem_of_neem_of_neem_of_neem_of_neem_of_neem_of_neem_of_neem_of_neem_of_
22,12,"It doesn't seem like they've really changed their definition of the word, though."
24,12,"Wearing masks does not help in stopping the virus, it's useless and I hate it."
25,12,"There are laws in Texas that say that people should wear masks for their safety and to make it easier to avoid them if they are raped, but not if they wear them at public places. The ACA is a white paper that is written by a white group that has made more than just white people look bad. You don't need to be an immature kid to want to be on the fence. The idea of putting a mask on public sanity is not going to make it easier for people. And in a time, a woman with a"
41,12,"""I'm a conservative. I’m a Texan and a member of the ACA party."""
12,1,"> The ACA is a satire of anti-racism, and is currently being debated."
12,2,">I’m gonna get a mask on, then I need to put it on a head and then I can go with it on and then I'll start to snort because of the fact that I have a mask. I love the feeling of being sick and feeling really good after I got out of a long time. It just hurts."
12,8,"> ""Sometimes the only valid reason to be on the fence is because the guy isn't a real person. Wearing masks does not help in stopping the virus, it's useless and I hate it."
17,12,Those words are a little misleading.
18,12,"CANNOTANSWER: 'Sometimes the only valid reason to be on the fence is because the guy isn't a real person. Wearing masks does not help in stopping the virus, it's useless and I hate it. I think it's a good idea to get a therapist and get this to people, but it's also a terrible idea for people who do not understand why it's racist. It's racist."
22,12,">It’s pretty clear that he’s going to be a snob because of his lack of knowledge about himself and is racist. I’m not even a snob, so I’m trying to say something really dangerous here. It’s a very simple and sensible way to do it."
24,12,"Wearing masks does not help in stopping the virus, it's useless and I hate it."
25,12,CANNOTANSWER'S POLICY ARE NECESSARY TO BE PART OF THE MAKEUP.
41,12,"I'm a conservative, I'm a Texan and a member of the ACA party."
12,1,CANNOTANSWER)(http://www.justicerevolution.org/en/comments/article-shitty-act-a)[https://www.justicerevolution.org/en/comments/article-shitty-act-a)[https://www.justicerevolution.org/en/comments/article-shitty-act-a][https://www.justicerevolution.org/en/comments/article-shitty-act-a][https/i'
12,2,a little bit too big of a deal
12,8,"""A rape victim can’t be a rapist. It’s like someone just in an attempt to stop a group from forming racists because of their sexuality. They can get away with something. It’s racist."
17,12,"""The joke isn't ad hominem, it's a simple joke."""
18,12,[R_d/R/R/D-D-N-A-D-D-N'A-D-D-N-D-N-B-D-N-D-A-D-D-N-D-N-D-D-N-D-N-D-E-M-N-D-D-N-D-N-D-E-D-N-D-D-D-A-D-D-A-D-E-D-D-C-R-C
22,12,I am in the US and my wife was able to tell me this.
24,12,"Wearing masks does not help in stopping the virus, it's useless and I hate it."
25,12,CANNOTANSWER: i just saw one person with a mask and I can't believe this is so common in my area.
41,12,"No, it is a joke."
12,1,"I know it sounds harsh, but I can't imagine what it would be like for my girlfriend to do, if I were my girlfriend - I can't really have any issues with the ACA"
12,2,I hate to say it but I love to make jokes about things and I don't see why I'm being offended if something is being a joke about.
12,8,It's racist. Because it's racist. It isn't racist.
17,12,"""Cannot Wear a Mask"" is probably a joke."
18,12,[CanNOTANSWER a Texan that lived in a conservative county and moved to California to vote for the state GOP. He can not change any of the headlines he is quoted in. He also can't change his own views on the ACA as a Republican. That's a really great euphemism.
22,12,I have a scar that is going to cause me to stop eating.
24,12,"Wearing masks does not help in stopping the virus, it's useless and I hate it."
25,12,Is this a joke?
41,12,"CANNOTANSWER: ""This is an important political issue. I believe that it should be addressed."
12,1,"Can't help with the ACA, that's what it is."
12,2,"Is it possible that if the ACA isn't passed, then the government needs to repeal it."
12,8,"The ""Are You a good person if I'm wearing a mask?"" is what comes up in the title. ""I am not a good person if I wear a mask. I do not have any idea why I have to wear a mask."""
17,12,"So when he starts talking to people about his ""sleeping problems"" then what happens when the ""sleeping problems"" are addressed and then he reeeeels on a face?"
18,12,"The ACA is a big issue, and there are problems with that. It is a big one. It aims to cause more deaths than any other federal health care law a member of."
