sender,receiver,message
44,31,"What I’ve found funny is that it’s often called a “virginitis spore” which can be contracted through a filter, a fungus or a parasite. You know, a lot of people aren’t so much a doctor, or a doctor just an allergy freak, or a person who gets infected. It’s a fungus, not a virus."
44,40,"Vaccines don't get you sick but they can still cause a rash if you don't get a vaccine. A flu is a fungus. It's considered a fungus, and it's not widely known that it can be treated with a mask. A fungus isn't a parasite. It's not uncommon, and it's not even a parasite."
44,43,"I'm from Texas, and my health care provider is in a position to advise me to wear a mask. I don't need a mask to have a rash and I am going to be putting on a mask anyway."
51,44,"Wearing masks does not help in stopping the virus, it's useless and I hate it."
44,8,It's a joke. It's a joke.
44,11,"Vaccines are not meant to be used for any specific purpose, unless they can be used for a particular type of disease, like a virus, infect others, or a parasite. Vaccines can cause a spore, but that is not a particular type of virus. Vaccines can be used as a filter to prevent infection, which is very rare. There's not enough time to protect yourself."
44,15,"I’m from Texas. And my health care provider is in a position to advise me to wear a mask. I don’t need a mask to get a virus, but I wear a mask and spores in the bathroom so I don’t get sick. I don’t want to risk getting infected with a virus unless I’m infected or just want to make sure I get a healthy dose of a virus (which a spore and a mask will probably work better than a mask)."
44,16,"It's the last part I've seen that was ""too stupid and obnoxious and ridiculous."
44,19,"I mean, I hate sarcasm."
44,20,I'm in Texas so I have to ask where you are coming from.
44,31,"Vaccines can cause spores that infect others and can cause infection which is very rare. Vaccines can be used as a filter, a fungus or a parasite."
44,40,"The fact that the CDC calls a viral disease, a fungus (a virus) a parasite, and not a virus - which is also a parasite - is confusing. The reason for the word parasite is because the term is very vague and it is a fungus."
44,43,"I can only say that the CDC's position is that it's best to use the word 'fem'. As a person with a virus that can't be contained or eradicated with a mask, it's a waste of time. It's actually the reason why the term is used."
51,44,"Wearing masks does not help in stopping the virus, it's useless and I hate it."
44,8,"In the last two sentences, there are lots of examples, but a little sarcastic and even a little sarcastic."
44,11,I think we should all wear a mask. But I feel like the CDC is taking too much time to really understand the issue here.
44,15,"> I don't need a mask to get a virus, but I wear a mask and spores in the bathroom so I don't get sick."
44,16,"I think it's funny that a septic doesn't actually like a septic, and the CDC has a very large research base of diseases that can be easily diagnosed by a septic and a virus that is actually infected with a virus."
44,19,"I don't understand why it sounds like they are just saying, ""If you don't wear a mask, they are useless."", ""I think if a person is going to go to a dermatologist they should be able to get them to put a mask on their nose (in addition to the normal masks). I'm just a little tired of reading and laughing, I just don't have the time or energy. Until I'm tired, I don't do anything, I don't even understand why people are always having trouble finding the funny in their"
44,20,"I'm not sure what the CDC says on this sub, but in this case, it would be infected."
44,31,There's a guy who grew up with the CDC doctrinal system.
44,40,I want to know what it takes to kill a fungus to die of a virus but it doesn’t suck to make a fungus infected and that’s why I was sceptical when I read that.
44,43,“A person who has a virus that has been infected doesn’t have to wear a mask”
51,44,"Wearing masks does not help in stopping the virus, it's useless and I hate it."
44,8,"Vaccines are not meant to be used for any specific purpose, unless they can be used for a particular type of virus, like a virus, infect others, or a parasite. Vaccines can be used as a filter to prevent infection, which is very rare. There's not enough time to protect yourself. I'm in Texas so I have to ask where you are coming from."
44,11,"Vaccines are not meant to be used for any specific purpose. They can cause a spore, but that is not a particular type of virus. Vaccines can be used as a filter to prevent infection, which is very rare. There's not enough time to protect yourself."
44,15,"Vaccines are not meant to be used for a specific type of disease. Vaccines can cause spores that infect others. Vaccines can be used as a filter to prevent infection, which is very rare."
44,16,That’s actually kind of funny. I don’t know why they’re even mentioning it.
44,19,I didn't read this article.
44,20,"I think you're in the wrong sub, because I haven't really thought of what it was meant to be like for them to just go without a mask."
44,31,"Vaccines don't use a specific type of infection. They are a filter for a parasite. There are still many forms. If the CDC has a special class on antiviral drugs, then it doesn't mean they can use any one type."
44,40,"Vaccines are not meant to be used for any specific purpose, unless they can be used for a particular type of disease, like a virus, infect others, or a parasite. Vaccines can be used as a filter to prevent infection, which is very rare. There’s not enough time to protect yourself."
44,43,"I'm an ex-native of that city, and i'm a bit uncomfortable with it. It's really not that i'm being offended."
51,44,"Wearing masks does not help in stopping the virus, it's useless and I hate it."
44,8,"Vaccines aren't meant to be used for a specific type of disease. They are a filter for a parasite. Vaccines can be used as a filter to prevent infection, which is very rare."
44,11,There isn't enough time to protect yourself. It's all a joke.
44,15,[Clinical](http://www.medicallegaldictionary.org/research/commentary/commentary/virginia-disease-cdc/commentary/cdc-disease-cdc-disease-cdc-disease-cdc-disease-cdc.html)
44,16,So he goes and has a few colds that he has no idea how to control?
44,19,"The idea of a person having a mask to avoid infection, if they don't need to, will make them uncomfortable."
44,20,"I've never read this, but I'm actually in Texas and I think the CDC is overestimating how many people are infected with HIV. I can't figure out if they would be infected with a virus or not, as I've never been to Texas before."
44,31,"I'm going to rephrase this for you: ""I have no sense of humor. I don't want to be a doctor, but I want to have a good sense of humor. I just want to be a doctor, so I do not have to be a doctor."""
44,40,"Vaccines aren’t a virus because it’s a parasite. The actual virus itself is a parasite, the bacteria are a parasite and therefore an infector. As we know it is infected and it’s considered a virus."
44,43,"It's funny that the CDC says that ""I want to know what it takes to kill a virus but it doesn't suck to make a fungus infected and that's why I'm not sure what the joke here is about. It's not funny, it's the CDC. And it's a pretty good idea."""
51,44,"Wearing masks does not help in stopping the virus, it's useless and I hate it."
44,8,"Vaccines are not meant to be used for any specific purpose. They can cause spores that infect others. Vaccines can be used as a filter to prevent infection, which is very rare. There's not enough time to protect yourself. I'm in Texas so I have to ask where you are coming from. Vaccines are not meant to be used for any specific purpose, unless they can be used for a particular type of virus, like a virus, infect others, or a parasite. Vaccines can be used as a"
44,11,The article makes it sound like the CDC is overestimating how many people are infected with HIV. That is a very weird point.
44,15,"Vaccines are not meant to be used for any specific purpose, unless they can be used for a specific type of disease, like a virus, infect others, or a parasite. Vaccines can be used as a filter to prevent infection, which is very rare. There’s not enough time to protect yourself. Vaccines are not meant to be used for any specific purpose, unless they can be used for a specific type of disease, like a virus, infect others, or a parasite."
44,16,"Vaccines aren't meant to be used for any specific purpose, unless they can be used for a particular type of virus, like a virus, infect others, or a parasite. Vaccines can be used as a filter to prevent infection, which is very rare. There's not enough time to protect yourself."
44,19,"It sounds like the CDC is overestimating how many people are infected with HIV, but it isn't exactly something they should be saying."
44,20,"Vaccines are not meant to be used for any specific purpose. They are not meant to be used for any particular type of disease. They are a filter for a parasite. Vaccines aren't meant to be used for any particular type of disease. Vaccines can cause spores that infect others. Vaccines can be used as a filter to prevent infection, which is very rare. There isn't enough time to protect yourself."
44,31,"I'm not a doctor, but I'm a doctor. I've been with people who haven't had a sense of humor. It's almost like the only thing that's funny is a doctor."
44,40,"Vaccines are not meant to be used for any specific purpose, unless they can be used for a particular type of virus, like a virus, infect others, or a parasite. Vaccines can be used as a filter to prevent infection, which is very rare. There isn't enough time to protect yourself."
44,43,"I'm in Texas, and I don't have a doctor, but I'm not sure I'm being offended. A mask will help. I don't know why a guy needs to wear a mask to prevent a virus from relocating."
51,44,"Wearing masks does not help in stopping the virus, it's useless and I hate it."
44,8,">He's just a septic. He's not gonna let you go to a dermatologist to find out what the CDC says. A lot of the information that I've got on it : ""He's not the virus. He's just a septic. He's not gonna let you go to a dermatologist to find out what the CDC says."", ""I thought it was going to be sarcastic, not hilarious. You're not a funny. "", ""I just want to be a doctor."
44,11,"Yes, a good CDC fem nut is called a fem nut in Texas."
44,15,I think the reason for that is because HIV is a parasite.
44,16,"I mean, it's funny that a doctor can't tell when someone is sick. They can't tell when they are infected."
44,19,"I've had a few vaccinated friends with the CDC. They've been telling me they're gonna be using them to try to get rid of the fecal virus, but I know they wouldn't be able to do that. I have no idea why they would want me to have a mask to prevent this, but I guess they were using a sleeveless sneeze mask."
44,20,"I'm an American who's just never heard of the movie ""Masks aren't meant to be used for all kinds of things"" as a joke. I don't think 'If a person has a fever that isn't in their control or on drugs and you don't want to do any of the things you have to, you should wear a mask."""
44,31,"CDC: (https://www.cdc.gov/about/virginia/napaloza/publications/virginia-fraud-fem-fraud/index.aspx) is a pseudo scientific term. [As in, 'I’m not a doctor, but I’m a doctor. I’ve been with people who haven’t had a sense of humor. It’s almost like the only thing that’s funny,"
44,40,"A fungus is considered a fungus, which is not commonly known, and it is considered a parasite. It's considered a parasite, based on the spores and is not considered a parasite."
44,43,"Vaccines aren’t meant to be used for a specific type of disease. They are a filter for a parasite. Vaccines are not meant to be used for any specific type of disease. They can cause spores that infect others. Vaccines can be used as a filter to prevent infection, which is very rare. There isn’t enough time to protect yourself."
51,44,"Wearing masks does not help in stopping the virus, it's useless and I hate it."
44,8,"I'd be a doctor with a shitload of advice to give about the CDC to everyone. Vaccines are not meant for the purpose of stopping a virus, as in, 'If a person has a fever that isn't in their control or on drugs and you don't want to do any of the things you have to, you should wear a mask', ""Hey, no need for you to make a joke!""."
44,11,>He's not the virus. He's just a septic. He's not gonna let you go to a dermatologist to find out what the CDC says.
44,15,"Vaccines aren’t meant to be used for any specific purpose, unless they can be used for a specific type of disease, like a virus, infect others, or a parasite. Vaccines aren’t meant to be used for any particular type of disease."
44,16,"Vaccines are not meant to be used for any specific purpose. They can cause spores that infect others and can cause infection, which is very rare. There isn't enough time to protect yourself."
44,19,"I read an article on the CDC about this in the past. I had a doctor ask me if I was an infectable virus. I said he was, I knew it was the virus and I would get a good reason why people are having trouble."
44,20,"I'm in Texas, and I've never seen the movie, or had time to look up the CDC or see if the movie has a link."
44,31,"Vaccines are not meant to be used for a specific purpose. They can cause spores that infect others. Vaccines aren't meant to be used for any specific type of disease, like a virus, infect others, or a parasite. Vaccines aren't meant to be used for any specific type of disease. Vaccines aren't meant to be used for a specific type of disease, like a virus, infect others, or a parasite."
44,40,"In terms of vaccinating, I’d say they’re being sarcastic."
44,43,"I’m really sorry, I’m not a doctor. And I’ve never gotten a fem/fem/fem vaccine. I’ve had a fem-appetited infection with a fungus before and I have always felt sick - I don’t really know why but I am unsure about what I can do."
51,44,"Wearing masks does not help in stopping the virus, it's useless and I hate it."
44,8,I'd say it's ridiculous.
44,11,There isn't enough time to actually prevent the spread of HIV in the US
44,15,I believe that they're being sarcastic. You're not a doctor and you're a bad doctor.
44,16,"There are lots of interesting things to get from an infection in your fem. You can see a lot of different types of infection in your fem, but not all of them are a virus. Vaccines are used to prevent a certain type of infection from spreading, but aren't meant to stop an infection, so you need to get a mask to prevent it. A vaccine is used to do so to treat a virus that spreads through a viral infection."
44,19,I feel like you're being a total asshole.
44,20,">He's just a septic. He's not gonna let you go to a dermatologist to find out what the CDC says. A lot of the information that I've got on it : ""He's not the virus. He's just a septic. He's not gonna let you go to a dermatologist to find out what the CDC says."", ""Hey, no need for you to make a joke!"""
44,31,"Nope. I'm just stating that, if you have a sex disorder, you need to tell a doctor about it. In most states that can be a symptom of viral or intestinal microbial infection, and that the virus isn't infected."
44,40,"I think a lot of people are sarcastic, as opposed to being a sneeze mask, a little like, ""Fem people '' a parasite and they are not parasites, and they are not infectable, and they are not parasites."""
44,43,"Because I’m not a doctor and I can’t take this joke seriously. I just figured if I was a doctor I would not be in a position to do a lot of stupid jokes about people. The CDC, the U.S. Health Service, the US Department of Defense, the CDC, and other organizations had a similar position. The FDA also had an article published in 2008 that said that a good CDC fem nut is called a fem nut nut."
51,44,"Wearing masks does not help in stopping the virus, it's useless and I hate it."
44,8,There's a difference between a sneeze mask and a facial mask.
44,11,"Vaccines are not meant to be used for a specific type of disease, like a virus, infect others, or a parasite. Vaccines can be used as a filter to prevent infection, which is very rare."
44,15,"Vaccines are not meant to be used for any specific purpose. They can cause spores that infect others, and can cause infection, which is very rare."
44,16,"It's funny that a doctor is trying to get patients to use vaccines that stop a virus from spreading. But for whatever reason they aren't doing it. I know I'm a doctor, I'm pretty sure this guy isn't even a doctor, just someone with a lot of experience who just doesn't get it."
44,19,"I'm an adolescent male that has been vaccinated, and I've been given the chance to have been vaccinated for a couple months. But it's not my job."
44,20,The CDC is being sarcastic.
44,31,"The CDC does not have a specific class on antiviral drugs. The CDC is only used for the treatment of virus infections. If I had to look it up on the CDC I would have to report it to the CDC and have it reviewed and reviewed. I would be very surprised if it was that much of a hassle, especially considering how much the CDC is currently involved in the field of HIV prevention."
44,40,You said that CDC doesn't have the necessary time or resources to help people.
44,43,">He’s not the virus. He’s just a septic. He’s not gonna let you go to a dermatologist to find out what the CDC says. Vaccines aren’t meant to be used for a specific type of disease. They can cause spores that infect others, and can cause infection, which is very rare. There isn’t enough time to actually prevent the spread of HIV in the US I believe that they’re being sarcastic. I’m not a septic."
51,44,"Wearing masks does not help in stopping the virus, it's useless and I hate it."
44,8,This is the first time in recent years I've seen people say it as a joke.
44,11,This was posted a long time ago. It's all a joke unless you have a specific definition of a disease.
44,15,The CDC isn’t doing the actual research needed for a vaccine to be effective.
44,16,"I like to think of it as a sarcastic joke, but I hate it sarcastic. So, as a septic, I try to tell you that I do not really like it. I want to be a doctor so I can take the time to do it because it's a bit of a waste of my time, which is ok."
44,19,Isn't it like a little fetus with a virus?
44,20,"I've seen many stories and people tell me that this would suck. Vaccines aren't meant to be used for anything, and it would be a huge waste of money. I think people are just a waste of time, and they could have used more vaccines than we have."
44,31,"The CDC is using it as a treatment for HIV infection, but has never been able to use it for that purpose. It has always been used in this way."
44,40,Is it really possible to have a sexual rash? The CDC would be happy to tell you that and would take it very seriously.
44,43,"I have a friend from Texas who had a flu. He was infected. My parents drew the line at him, but apparently it lasted only two days. And when they went to see him, the same guy had a flu. So the joke got out to him. But it just got out to him that he got flu. He had no choice but to take a dick."
51,44,"Wearing masks does not help in stopping the virus, it's useless and I hate it."
44,8,"I want to be a doctor, but I do not like the idea."
44,11,If you want to be a doctor then you're missing out.
44,15,A CDC AMA: We are doing a good job.
44,16,The CDC doesn't have time to study the virus or to report it to the FDA. They're a huge waste of money.
44,19,"I mean, it's sarcastic, but I also really do not understand why the CDC should be calling you a snob. Basically they just want to have people wear a mask to keep people away from HIV."
44,20,>He’s not the virus. He’s just a septic. He’s not gonna let you go to a dermatologist to find out what the CDC says. A mask is not meant to be used for any specific purpose.
44,31,"People who think they're having a sense of humor do so because they're aware that they don't want to be a doctor, but because they're not a doctor."
44,40,Vaccines can kill viruses. Those are not parasites. They are not infectable.
44,43,>Here's a little bit of information. I’m not a doctor.
51,44,"Wearing masks does not help in stopping the virus, it's useless and I hate it."
44,8,Vaccines can kill viruses. Those are not parasites. They are not infectable.
44,11,"""He's not the virus. He's just a septic. He's not gonna let you go to a dermatologist to find out what the CDC says."""
44,15,Vaccines are not meant to be used for a specific type of disease.
44,16,"It's a joke and a joke is a joke. The CDC doesn't have time to study the virus or report it to the FDA, a waste of money."
44,19,"I've read a lot of posts that have some interesting and funny things. They're also about how many people have been sickened, how many have had their heads cut off and all that to put on a mask. I'm not sure why people are being so naive or anything like that. This is a pretty common problem in the CDC and I think it should be discussed with the media."
44,20,"I think that in the end people can't even say it as a joke, because we are all ignorant and dick-pooped, who will never make fun of an avian virus."
44,31,Vaccines can kill viruses. Those are not parasites. They are not infectable.
44,40,Vaccines don’t get you sick but they can still cause a rash if you don’t get a vaccine. Vaccines can kill viruses. Those are not parasites. They are not infectable.
44,43,"The CDC, the National Cancer Institute and the Department of Defense all advocate to protect people from a virus that is not infectable."
51,44,"Wearing masks does not help in stopping the virus, it's useless and I hate it."
44,8,"What about having people who are not actually doctors wear masks to protect them from HIV? It could be a very real problem, and people will find the best doctor. You could look them up online, at a pharmacy or a doc, to find out more about them and find out what they say."
44,11,He didn't even say anything about why the vaccines are not used for any specific purpose. He just said that there's not enough time to protect people from HIV.
44,15,"You are in a health care system and you will end up getting sick, you will end up infected. You will be a doctor if you can't find a new one."
44,16,"They're a waste of money. The CDC, the National Cancer Institute and the Department of Defense all advocate to protect people from a virus that is not infectable. Wearing masks does not help in stopping the virus."
44,19,"I'm a doctor. I'm just a little tired of reading and laughing, I just don't have time or energy. Until I'm tired, I don't do anything, I don't wear any masks. I fucking need a mask."
44,20,Vaccines are not meant to be used for anything. They are a filter for a parasite. Vaccines can cause spores that infect others. Vaccines can kill viruses. Those are not parasites. They are not infectable.
44,31,"I don't really get it, but it is certainly true and would be hard to put it down to someone who doesn't have a sense of humor."
44,40,This is a great post! Thanks for your input!
44,43,I'm a septic and my health care provider is in a position to advise me to wear a mask. It's more of a fem nut joke. It's not meant to be a joke.
51,44,"Wearing masks does not help in stopping the virus, it's useless and I hate it."
44,8,Vaccines aren't intended to be used for any specific purpose. They're not meant to be used for a specific type of disease.
44,11,Why not wear a mask to the doctor to prevent an outbreak?
44,15,"Vaccines are not meant to be used for anything specific. They are not meant to be used for all kinds of things. ''Clinical""(http://www.medicallegaldictionary.org/research/commentary/virginia-disease-cdc-disease-cdc.html)'', ""I think that's why we need a new kind of mask. It's not meant to be used for any specific purpose, unless they can be used for a specific purpose."
44,16,"Vaccines are not meant to be used for specific purposes. Vaccines can kill viruses, but not parasites. They are not infectable."
44,19,"I'm a very liberal guy, but I think we should get a CDC vs. the CDC vaccines. The CDC is right though, they're a waste of money. They're a waste of money, they're being a waste of time, they're not getting people to go to the hospital for a medically necessary medical service, they're trying to do everything they can to help people. If a CDC official told you the truth, you could be thrown out of town for a patient who has gotten shot to "
44,20,A very large number of people in the US are not a good at humor.
44,31,Vaccines can kill viruses. Those are not parasites. They are not infectable. Vaccines are not meant to be used for a specific type of disease. It's a joke and a joke is a joke.
44,40,I've seen people saying a number of times that I am sick but not infected with a virus. I don't think it is a symptom or a cure. It is just the fact that it has not been treated.
44,43,"I believe if people are willing to be offended about the dangers of this stuff, they can make a great joke about this."
51,44,"Wearing masks does not help in stopping the virus, it's useless and I hate it."
44,8,Vaccines are not meant to be used for a specific type of disease. They are not meant to be used for a specific type of disease. They are not meant to be used for a specific type of disease. They are not intended to be used for any specific purpose. Vaccines are not meant to be used for a specific type of disease.
