sender,receiver,message
12,1,hi everyone plz just wear a mask i don t wanna be unemployed again
12,2,hi everyone plz just wear a mask i don t wanna be unemployed again
12,8,hi everyone plz just wear a mask i don t wanna be unemployed again
17,12,thanks ctl stay safe friends and wear mask if need to go out
18,12,if hes going to be stupid enough not to wear a mask then he deserves what he gets hopefully he doesn t infect anyone else
22,12,those who want to protect themselves from getting sick have every right to masks keep you more safe than no mask in tight settings everyone has the right to do whatever they want now at their discretion
24,12,"Wearing masks does not help in stopping the virus, it's useless and I hate it."
25,12,i was downtown dallas yesterday and i only saw one person with a mask it s just a crying shame
41,12,as someone who was there this weekend who lives in a conservative county in california the residents of texas where kind respectful and upheld mask ordinance better than mins of being back in california please let s not turn our backs on people who need help
12,1,"I like to make people shit up, because people are able to do so much. I'm from dallas."
12,2,I can relate to the feeling of being a scumbag if I have to go out with you.
12,8,"No... No. No. The government is not going to pay for this, it's going to be the government doing it for them. I'm not sure if it is worth it, but in my experience it is not an enforceable law, which you should respect. It does have a bit of a moral compass to it."
17,12,This is an interesting concept. The masks are not necessary if you want to take out the virus.
18,12,"I agree with the other comments, but if the only way to prevent a pandemic is to use a mask, you don't have to wear a mask."
22,12,"The masks are for those who are wearing hoods and head masks, not the other way around."
24,12,"Wearing masks does not help in stopping the virus, it's useless and I hate it."
25,12,Why don't you wear a mask?
41,12,as someone who was there this weekend who lives in a conservative county in california the residents of texas where kind respectful and upheld mask ordinance better than mins of being back in california please let s not turn our backs on people who need help
12,1,"I can relate to the feeling of being a scumbag if I have to go out with you. No... No. No. The government is not going to pay for this, it's going to be the government doing it for them."
12,2,"Yes, I know, it's a bit harsh, but the govt would need to see your employer and provide your safety to anyone in that situation."
12,8,''Here's the deal with a person who wants to keep people sick because they can't afford it.'''
17,12,A lot of people wear masks at a certain point in their lives.
18,12,I haven't even heard of this a sex life.
22,12,You want a mask that doesn't make you look bad?
24,12,"Wearing masks does not help in stopping the virus, it's useless and I hate it."
25,12,"Why do you think that's the most relevant answer, but I think the most relevant answer is that there are some laws to make it a lot easier for people to wear masks. Then it becomes easier to explain to the person why it's necessary."
41,12,"No, we don't. The ACA is a constitutional amendment for putting masks in the ballot."
12,1,">Why don't you wear a mask? Because why do you think that's the most relevant answer, but I think the most relevant answer is that there are some laws to make it a lot easier for people to wear masks. Then it becomes easier to explain to the person why it's necessary. No, we don't. The ACA is a constitutional amendment for putting masks in the ballot."
12,2,Isn't the idea that people should wear masks if they can't afford it.
12,8,"I thought the ""fake"" question was, ""What's the biggest issue with wearing a mask?"""
17,12,>I think a statewide mask mandate is a really illogical and bad idea.
18,12,"...and this is what happened to me last year. The only problem is the lack of airflow - it's almost unnoticeable, and I'm not sure how much we should have put a mask on in the first place."
22,12,"Are you saying that he's being a snob? Because you're causing him to be a snob? I mean really? I'm not even a snob, so I'm trying to say something really dangerous here."
24,12,"Wearing masks does not help in stopping the virus, it's useless and I hate it."
25,12,">Can you clarify the mask rules and requirements for hoboken parks and playgrounds Wearing masks does not help in stopping the virus, it's useless and I hate it. I mean I was a kid and this one isn't about what to wear but you can't tell me what's on your face. That's more about what's on your face. I know that this one isn't going to be in a public place, and I have no idea if I could wear a mask if it's like this"
41,12,Are there any amendments that make that change?
12,1,"So you are saying ""This mask doesn't make people look bad, it's useless and I hate it."" You can't get a sex life with a mask and you aren't going to be able to be able to wear one? That's not like a good mask, is it?"
12,2,This was in a Republican county. I'd be happy to see him out of the town of San Diego who lives in a conservative county in a conservative county.
12,8,"Well, the person that brought this up had an interesting issue. I think I'm going to go with him and say, ""Well, then why don't you just go on your own?"""
17,12,"He doesn't want to make you sick because you have no health insurance. And even if he does, he has no right to do so. That's not a good idea. I'm so glad he made you a better person."
18,12,It is not a smart decision to me.
22,12,"It's pretty clear that he's going to be a snobbish or not. It's a very simple and sensible way to do it. It's ridiculous to say something like, ""i don't really get the virus if you don't wear a mask. You can wear a mask on your face if you can, and if you can't, you're fine with that."""
24,12,"Wearing masks does not help in stopping the virus, it's useless and I hate it."
25,12,"If you are a kid in Texas and only saw one person with a mask, you should be able to tell the police how to stop them."
41,12,"The current law is not working, and should be changed. The state would rewrite it."
12,1,It's not a law to keep it from being implemented.
12,2,"The word ""mamma"" does not apply to this post. Unless you're talking about the ACA that is being passed, it's a state law and you can't have an amendment that makes a law not working."
12,8,Yes he does. Apparently he's got an infection in his head that could easily be treated by a different type of mask that isn't actually safe for you.
17,12,What's the point of having a mask?
18,12,Why don't you go and tell him the truth. It is not a smart decision to me.
22,12,"> It's pretty clear that he's going to be a snobbish or not. It's a very simple and sensible way to do it. It's ridiculous to say something like, ""I don't really get the virus if you don't wear a mask. You can wear a mask on your face if you can, and if you can't, you're fine with that."""
24,12,"Wearing masks does not help in stopping the virus, it's useless and I hate it."
25,12,"I'm just going to say, what a poor guy this is."
41,12,This is what I'm thinking of.
12,1,"I'm going to go with you, because I don't think the ACA really exists. If he doesn't want to, I would. If he doesn't want to, then I would tell him. But I don't think I'll take that seriously."
12,2,">Can you clarify the mask rules and requirements for hoboken parks and playgrounds Wearing masks does not help in stopping the virus, it's useless and I hate it."
12,8,I have a a feeling this is the first time I've heard something about that. What if I'm wearing a mask? How would I know that you're putting on a mask?
17,12,"There is a story where he was infiltrating police departments with a mask on him for the first 4 weeks to cover up his ""snooping"". The first ep had the first name of a shady guy I've met."
18,12,>Why don't you go and tell him the truth. It is not a smart decision to me.
22,12,I feel like I was getting some false information as to why he's not the snob. But he's being a snob because he is causing the snob to be a snob.
24,12,"Wearing masks does not help in stopping the virus, it's useless and I hate it."
25,12,"OP is just an 'emotional person' and it isn't a racist statement. He's just saying that there is a need for a proper response to a blatant lack of respect for the human being, because it is inappropriate for people to wear a mask or to be raped by someone else."
41,12,"So if you think you're not racist because you didn't know who he was, you shouldn't have been involved? Why do you think it's racist?"
12,1,"This sounds like a good plan to me. You're doing the right thing, but you're being a snob."
12,2,"Is there a reason this was posted to reddit? I don't even remember the date, but they are not racists. They aren't racists in the sense they are stupid."
12,8,"OP is a bit different in my experience. As a father of 3 kids who still wear masks, I would say that he really does not need to know why he's doing this and therefore needs to tell the police the truth."
17,12,"""He is wearing a mask everywhere and my area is spiking hard. I'm sick of it. I couldn't help but see the red flags, and it still was spiking hard. I'm sick of it. I'm sick of it. I'm late but i gotta hand it to he's got me wearing my mask everywhere and my area is spiking hard. I'm sick of it. I couldn't help but see the red flags, and it still was spiking hard."
18,12,It's not a smart decision to me. [(http://www.reddit.com/r/reddit/2013/06/r/reddit/)
22,12,"I think it’s hilarious that they tried to make people think of him as a snob because the guy wants to make a fun joke. This is a really weird way to describe how a snob can be snobby, but he tries to make people think he is."
24,12,"Wearing masks does not help in stopping the virus, it's useless and I hate it."
25,12,This is one of the most interesting things I've read today in the last 30 years.
41,12,"""As a man with a mask, it's not so bad."" It's racist. It's racist, it's racist. It's racist."
12,1,"Yes, a snob. It’s a big problem to me because I have a bad relationship with that guy."
12,2,"If you're using the term racism to describe racism and that's what he said, then the meaning of racism would be, ""Well, I'm pretty much the most ignorant person in the world, so I'm going to go with you to think the ACA really exists, but I'm afraid it's wrong to say so."""
12,8,"OP just goes along with this comment, that I think is ridiculous. What are the details of this?"
17,12,"The joke isn't ad hominem, it's a simple joke."
18,12,"It's not about the lack of airflow, it's about your sensitivity to certain types of people."
22,12, He's like the dick of old people: I was a girl who liked women and wanted to have a bit of fun while she was driving.
24,12,"Wearing masks does not help in stopping the virus, it's useless and I hate it."
25,12,I would like to know if it is ok to say something about the issue but I don't think it is the right thing to do.
41,12,[It's] [https://www.justicerevolution.org/cd/en/constitution/apc/shitty-discrimination-narcotic-treatment-is-severely-apical-rights-within-the-aggression-genre/...][http://www.justicerevolution.org/en/comments/article-shitty-act-aggression-narcotic-protection/stratege-aggressive-aggressive-a
12,1,"It's like a joke, I'm going to go tell you about it. What's a joke? I can see the repercussions. Is the joke correct?"
12,2,"As an avid fan of the ACA, I can confirm:"
12,8,> It's [http://www.justicerevolution.org/cd/en/constitution/apc/shitty-discrimination-narcotic-treatment-is-severely-apical-rights-within-the-aggression-genre/...][http://www.justicerevolution.org/en/comments/article-shitty-act-aggression-narcotic-protection/stratege-aggressive-aggressive-aggressive
17,12,"I like your style and it makes sense, but you are an asshole, which is why i don't say it."
18,12,Why is this on the wiki?
22,12,">I know, I get sick from wearing masks. But if the problem isn't the virus, I won't be able to do anything about it, even if it makes me sick."
24,12,"Wearing masks does not help in stopping the virus, it's useless and I hate it."
25,12,"The point is that masks are the easiest way to get in a situation that you can't get out, even if it's just for sex, and are not for people who are being raped. Those are not the most common kinds of masks, they are the most common kinds of masks that are used for sex."
41,12,"Yes, this is a racist thing. It’s a dangerous thing to be in on, a bad thing to get in on."
12,1,"The ACA was passed as an initiative to increase the effectiveness of sex therapy for people who are being raped, but..."
12,2,"I think if I were in the army I'd probably have a bunch of friends like you, who wouldn't be at a party, that would be a big deal and I'd have a lot of friends."
12,8,"As a doctor that specializes in the treatment of drug addiction, this isn't the type of treatment that I would choose to put on my mask. The only thing that's been proven safe is to do that and not be in a situation where it's not legal. This is more about a doctor and not a victim."
17,12,It is a fucking bad idea.
18,12,"I am not a racist but it sounds like an important part of the issue. I think your post may have been meant to say: ""Another post I haven't seen that makes me feel really stupid is going to cause you problems."""
22,12,I have a mask on.
24,12,"Wearing masks does not help in stopping the virus, it's useless and I hate it."
25,12,This is a big issue. And this is the first time I've ever seen people wearing masks.
41,12,CANNOTANSWER)(http://www.justicerevolution.org/en/comments/article-shitty-act-aggression-narcotic-protection/stratege-aggressive-a)
12,1,CANNOTANSWER)(http://www.justicerevolution.org/en/comments/article-shitty-act-aggression-narcotic-protection/strateg-aggressive-aggressive-a
12,2,(http://www.justicerevolution.org/cd/en/constitution/apc/shitty-discrimination-narcotic-treatment-is-severely-apical-rights-within-the-aggression-genre/...][http://www.justicerevolution.org/en/comments/article-shitty-act-aggressive-narcotic-protection/stratege-aggressive-aggressive-aggressive-
12,8,I can't imagine what a sexist or anti-aggressive thing that would be like to rape a woman is doing to her.
17,12,"[NAME] said ""if you flagrantly disregard public health guidance and refuse to wear a mask you shouldn't be allowed treatment at all let alone top tier treatment the rest of america can t access."" (http://www.reddit.com/r/reddit/2013/06/r/reddit/)"
18,12,It's about sensitivity to certain types of people.
22,12,"I'm not a doctor, but i would tell him if he is doing the right thing he can do in the first place, if there is anything he can do about it, he should not go to the doctor because he is being a snob."
24,12,"Wearing masks does not help in stopping the virus, it's useless and I hate it."
25,12,"oh yeah the kids were really in shock, they have a rash of stuff. they're not even wearing masks for sex and so it seems like they are wearing masks."
41,12,IANAL but you can see the ACA is not going anywhere.
12,1,This is about sensitivity to certain types of people.
12,2,">Can you clarify the mask rules and requirements for hoboken parks and playgrounds Wearing masks does not help in stopping the virus, it's useless and I hate it."
12,8,So what's the point of ACA?
17,12,">I love your style and it makes sense, but you are an asshole, which is why i don't say it."", ""I love your style and it makes sense, but you are an asshole, which is why I don't say it."","
18,12,"> ""I don't think this quote is about being late, but it is about being a good thing to do"". I think a good one."
22,12,"i'm a little sick, and it sounds like someone who wants to wear a mask to protect myself from getting sick hasn't had their cdmi upheld. It's more than likely to damage your skin and make you ill. You can't wear a mask to prevent infection if you haven't already. You can't wear a mask to prevent infection if you haven't already. You can't wear a mask to prevent infection if you haven't already."
24,12,"Wearing masks does not help in stopping the virus, it's useless and I hate it."
25,12,"""I think that 'I'll do it again' may be a little unfair and demeaning to some people, but I know I didn't know who he was. Wearing masks does not help in stopping the virus, it's useless and I hate it. I was in a minority in a locality. It's not racist. But it is racist."
41,12,"I mean, he was being really racist. He was making fun of you. Honestly, the entire thing was just a jerk. He used a mask to put a sleeve on public street. People got angry and it wasn't their fault. I think his behaviour would be more reminiscent of how he was being racist."
12,1,CANNOTANSWER)(http://www.justicerevolution.org/en/comments/article-shitty-act-aggressive-narcotic-protection/strateg-aggressive-a) CANNOTANSWER)(http://www.justicerevolution.org/en/comments/article-shitty-act-aggressive-a)
12,2,That's an issue that is going on for a long time. It's really unfortunate that we live in a country where the government and medical establishments aren't doing anything good for the public or society at large.
12,8,"""I am sorry to hear that you have to make an illegal move on my narcotics. I hope you see the future with your mask."""
17,12,You're not doing the right thing.
18,12,I think it's not racist at all. Its just the fact that people think it is racist.
22,12,"A lot of people like being able to tell your face and not being able to tell who you are, and not just how you are and how you aren't. A mask is not required to remove virus symptoms from someone whose skin is still damaged or weakened. It's more than likely to damage your skin and make you ill. You can't wear a mask to prevent infection if you haven't already. You can't wear a mask to prevent infection if you haven't already."
24,12,"Wearing masks does not help in stopping the virus, it's useless and I hate it."
25,12,"CANNOTANSWER: I'm sure if you were a guy you'd feel like a dick and if you had the ability to avoid anything like that, the guy you married could be treated much better with a mask - no wonder it seems so ungrateful and unnecessarily narcissistic and immature. This is why it's important to look for ways to address it."
41,12,CANNOTANSWER CANNOTANSWER CANNOTANSWER CANNOTANSWER CANNOTANSWER CANNOTANSWER
12,1,A mask is an immoral way to tell who you're.
12,2,"I've been a major activist for many years. I am very passionate about the ACA and I hope that there is a lot of work going on. It's a very important issue for our government. If it hasn't already, then maybe the ACA will have to be revised and implemented. I do think this is the most important part of a political campaign."
12,8,">I love your style and it makes sense, but you are an asshole, which is why i don't say it."
17,12,"Honestly, if he doesn't have any medical reason to wear a mask in the bathroom, he's an asshole. I don't think this is the right thing to do. This is one of those things that we have to avoid."
18,12,">'Why are these on the wiki?', 'Why is this on the wiki?', ""I am not a racist but it sounds like an important part of the issue. I think your post may have been meant to say: ""Another post I haven't seen that makes me feel really stupid is going to cause you problems.""', ""Why is this on the wiki?', ""Why is this on the wiki?', ""Why is this on the wiki?', """"("
22,12,No snob's need to know why he is a snob because he doesn't know why they can't do it. It's because snobs have to have a good reason.
24,12,"Wearing masks does not help in stopping the virus, it's useless and I hate it."
25,12,[nothing](http://t.reddit.com/r/reddit/context/cdc/comments/37867flbs/comments/562ftbsgffbsgfffff/r/sdbsgffssgffffffffffffff /r/Cdc/Cdc/comments/578fffffffffffffffff
41,12,"You're an American. Is this an American? My first reaction to this was to say, ""Is this a racist thing."
12,1,A mask doesn't prevent you from getting raped or raped or anything. It's an immoral way of indicating who you're.
12,2,"""The guy you married could be treated much better with a mask - no wonder it seems so ungrateful and unnecessarily narcissistic and immature. I think this is the right thing to do."
12,8,"[Boy, do you love you?](http://www.justicerevolution.org/en/comments/article-shitty-act-aggressive-narcotic-protection/strateg-aggressive-a)"
17,12,"The joke isn't ad hominem, it's a simple joke."
18,12,I think the point of the wiki article is that the ACA is not a big enough issue to have a major impact on the political debate? It does not seem like a huge enough issue to be a major issue for many of us.
22,12,The first thing that comes to mind when you read this /r/thedrugsinthesunpost is that it's a way to describe how it's a different thing from the /r/AIDSposts/
24,12,"Wearing masks does not help in stopping the virus, it's useless and I hate it."
25,12,''Sometimes the only valid reason to be on the fence is because the guy isn't a real person.
41,12,[Was it a question about how much they lied to you (what they thought was a lie) and the nature of the question: what was the meaning of this conversation and why you didn't follow it?
12,1,CANNOTANSWER:
12,2,“Is this a racist thing. A mask doesn't prevent you from getting raped or raped or anything. It's an immoral way of indicating who you are.” (
12,8,"I mean I don't mean anything else in that way. I just want to bring up a recurring topic about what happens when people in a room wear masks to work and how they feel when they do it. I just wanted to make sure the guy is comfortable and a healthy person. I wanted to see how the whole ""fuck it, tv isn't good enough for you."" kinda thing happens everytime, just like with drugs."
17,12,"It's a joke, but not a joke."
18,12,"CANNOTANSWER : ""Sometimes the only valid reason to be on the fence is because the guy isn't a real person. Wearing masks does not help in stopping the virus, it's useless and I hate it. My boyfriend is an empathetic narcissist who is trying to change society."
22,12,"""We should ask if there's any kind of exemption in the state in which people can wear a mask? If not, we should ask if they can get them to change it."""
24,12,"Wearing masks does not help in stopping the virus, it's useless and I hate it."
25,12,"“Meat” has a big social stigma in a few cities, including Chicago and New York. There are a lot of people in the neighborhood who don’t wear masks and don’t want to go to public safety. I swore I would go to public safety, but there were no warning signs. This has led to a lot of people not being aware of their environment. This has led to an increase in the prevalence of HIV/AIDS, which is a problem in our society and we have a lot of people who don’t wear them at home. :)"
41,12,The ACA is not going anywhere.
12,1,It’s not an immoral way of indicating who you are. It’s an immoral way of indicating who you are.
12,2,"What's that 'fuck it, tv isn't good enough for you.'"
12,8,"The first thing that comes to mind when you read this /r/thedrugsinthesunpost is that it's a way to describe how it's a different thing from the /r/AIDSposts/ The joke isn't ad hominem, it's a simple joke."
17,12,I don't think I could believe this is anything but a joke.
18,12,"The first sentence of the article is ""the ACA is not a big enough issue to have a major impact on the political debate?"""
22,12,This is not how to act.
24,12,"Wearing masks does not help in stopping the virus, it's useless and I hate it."
25,12,"It's an unproven truth, it's not a good way to tell a person you are being racist, or what you want to call yourself. You do not want to be racist, you want to be a racist."
41,12,The ACA is not going anywhere.
12,1,"When people talk about politics, and not the ACA itself, they're talking about the fact that it is a way to get people to wear masks and then to see their environment. This isn't a good way to make people aware of themselves."
12,2,"I can understand this, but it's also pretty hard to explain. I think some things have to be done, especially if the guy doesn't like wearing it and he's on his own - like, a few hours from work. A lot of people feel this way, because of how much he is lied to about. But, the idea is not just racist. It's a big issue. I believe there are a lot of ways to explain it, and this is why it's so hard for people to say it, and to explain that he would be"
12,8,">""Sometimes the only valid reason to be on the fence is because the guy isn't a real person."
17,12,"""Cannot Wear a Mask"""
18,12,"I'm not a racist, but I find that a lot of the people I know on this subreddit don't understand a bit of what ''what's really going on'' means."
22,12,"I read this as the guy who told someone to go get a mask if they don't want one, and was then asked if he wanted to wear a mask while they were drunk. Then he said he didn't want a mask and he couldn't. He slapped him on the head with a hat."
24,12,"Wearing masks does not help in stopping the virus, it's useless and I hate it."
25,12,A rape victim can't be a rapist.
41,12,It's like someone just in an attempt to stop a group from forming racists because of their sexuality. They can get away with something.
12,1,It seems like there's no way around it.
12,2,"I have a friend that likes to wear masks. So he'll probably just be fucking in the sand, and he's gonna get a sick mask."
12,8,"I read a lot of ad hominem in this subreddit, not only is this sexist, but I'm pretty much sure it's a satire of racism. I'm a feminist, but I haven't heard this in a while and I've been looking for some answers - the stuff I'm trying to put up with all the time is not satire at all. I find this more ironic than satire - but it's a big piece of sexism in the same way and"
