sender,receiver,message
26,1,if you flagrantly disregard public health guidance and refuse to wear a mask you shouldn t be allowed treatment at all let alone top tier treatment the rest of america can t access
26,7,if you flagrantly disregard public health guidance and refuse to wear a mask you shouldn t be allowed treatment at all let alone top tier treatment the rest of america can t access
26,16,if you flagrantly disregard public health guidance and refuse to wear a mask you shouldn t be allowed treatment at all let alone top tier treatment the rest of america can t access
26,17,if you flagrantly disregard public health guidance and refuse to wear a mask you shouldn t be allowed treatment at all let alone top tier treatment the rest of america can t access
26,19,if you flagrantly disregard public health guidance and refuse to wear a mask you shouldn t be allowed treatment at all let alone top tier treatment the rest of america can t access
26,21,if you flagrantly disregard public health guidance and refuse to wear a mask you shouldn t be allowed treatment at all let alone top tier treatment the rest of america can t access
28,26,the mask should be over ur nose
38,26,hi everyone plz just wear a mask i don t wanna be unemployed again
49,26,i was late but i gotta hand it to he s got me wearing my mask everywhere and my area is spiking hard right now just signed up to get me and the wife a drive up test come saturday
26,1,"IANAL, but if you flagrantly disregard public health guidance and refuse to wear a mask you shouldn t be allowed treatment at all let alone top tier treatment the rest of america can t access"
26,7,if you flagrantly disregard public health guidance and refuse to wear a mask you shouldn t be allowed treatment at all let alone top tier treatment the rest of america can t access
26,16,This is a big question for anyone who cares about the shady industry.
26,17,"I have a mask, but I don't wear it and it won't let me see the doctor unless I want to. I think you need to have a health - care professional that genuinely knows about the benefits and benefits to the patient. That s why it can't be covered by the medics, as many doctors say."
26,19,> if you flagrantly disregard public health guidance and refuse to wear a mask you shouldn t be allowed treatment at all let alone top tier treatment the rest of america can t access
26,21,"Well that is a tough one. And this - unless he is doing something serious, he shouldn't be permitted treatment at all."
28,26,"That's a real question, no matter how you define it."
38,26,i'm sick of it.
49,26,i was late but i gotta hand it to he s got me wearing my mask everywhere and my area is spiking hard right now just signed up to get me and the wife a drive up test come saturday i was late but i gotta hand it to he s got me wearing my mask everywhere and my area is spiking hard right now just signed up to get me and the wife a drive up test come saturday i was late but i gotta hand it to he s got me wearing my mask everywhere and my area
26,1,"[IANAL, but if you flagrantly disregard public health guidance and refuse to wear a mask you shouldn t be allowed treatment at all let alone top tier treatment the rest of america can t access"
26,7,"That s a real question, no matter how you define it."
26,16,> if you flagrantly disregard public health guidance and refuse to wear a mask you shouldn t be allowed treatment at all let alone top tier treatment the rest of america can t access if you flagrantly disregard public health guidance and refuse to wear a mask you shouldn t be allowed treatment at all let alone top tier treatment the rest of america can t access
26,17,"This is a big question for anyone who cares about the shady industry. I have a mask, but I don't wear it and it won't let me see the doctor unless I want to. I think you need to have a health - care professional that genuinely knows about the benefits and benefits to the patient. That s why it can t be covered by the medics, as many doctors say."
26,19,"IANAL, but if you flagrantly disregard public health guidance and refuse to wear a mask you shouldn t be allowed treatment at all let alone top tier treatment the rest of america can t access"
26,21,"In fact, it seems like a fair question, regardless of whether or not it was explicitly stated."
28,26,">Can you clarify the mask rules and requirements for hoboken parks and playgrounds Wearing masks does not help in stopping the virus, it's useless and I hate it."
38,26,I'm going to tell you what if a jobless person leaves with masks on?
49,26,I don't think they've had a fair time with this car.
26,1,">Can you clarify the mask rules and requirements for hoboken parks and playgrounds Wearing masks does not help in stopping the virus, it's useless and I hate it. I'm going to tell you what if a jobless person leaves with masks on? I don't think they've had a fair time with this car."
26,7,"I was told by a friend that I should keep a mask on whenever I need help with something. Then the doctor came up to me and told me I was not allowed to wear it and would have to have to wear it because I was tired. Then I decided to stay away from it. That he was going to leave me and the wife and was going to be in a hazmat suit. He got it back, and told me I can't be out of work so he was out of work."
26,16,">Can you clarify the mask rules and requirements for hoboken parks and playgrounds Wearing masks does not help in stopping the virus, it's useless and I hate it. I'm going to tell you what if a jobless person leaves with masks on? I don't think they've had a fair time with this car."
26,17,Hi everyone plz just wear a mask i don't wanna be unemployed again i was late but i gotta hand it to he s got me wearing my mask everywhere and my area is spiking hard right now just signed up to get me and the wife a drive up test come saturday
26,19,">can you clarify the mask rules and requirements for hoboken parks and playgrounds Wearing masks does not help in stopping the virus, it's useless and I hate it. I'm going to tell you what if a jobless person leaves with masks on? I don't think they've had a fair time with this car."
26,21,There are a lot of people who don't like the shady things.
28,26,"If you have to give permission to other people and the CDC do not allow the public to wear a mask, and if you do, you must provide a notice that it is necessary."
38,26,Is he a joke? I mean I think this is funny.
49,26,"I had to go to a drive up test on Saturday. I couldn't help but see the red flags, and it still was spiking hard."
26,1,I'm sick of it. i'm late but i gotta hand it to he s got me wearing my mask everywhere and my area is spiking hard right now just signed up to get me and the wife a drive up test come saturday i was late but i gotta hand it to he s got me wearing my mask everywhere and my area is spiking hard right now just signed up to get me and the wife a drive up test come saturday i was late but i gotta hand it to he s got
26,7,The CDC is a bunch of nutjobs that want their kids to wear a mask in public places.
26,16,"IANAL, but if you flagrantly disregard public health guidance and refuse to wear a mask you shouldn't be allowed treatment at all let alone top tier treatment the rest of america can't access It is a big question, no matter how you define it. I have a mask, but I don't wear it and it won't let me see the doctor unless I want to. I think you need to have a health - care professional that genuinely knows about the benefits and benefits to the patient."
26,17,"CANNOTANSWER: If you have to give permission to other people and the CDC do not allow the public to wear a mask, and if you do, you must provide a notice that it is necessary."
26,19,">can you clarify the mask rules and requirements for hoboken parks and playgrounds Wearing masks does not help in stopping the virus, it's useless and I hate it. I'm going to tell you what if a jobless person leaves with masks on? I don't think they've had a fair time with this car."
26,21,"Then the doctor came up to me and told me I was not allowed to wear it and would have to have to wear it because I was tired. Then I decided to stay away from it. That he was going to leave me and the wife and was going to be in a hazmat suit. He got it back, and told me I can't be out of work so he was out of work. I think you need to have a health - care professional that genuinely knows about the benefits and benefits to the patient."
28,26,"It's a real question, no matter how you define it. If I don't care what others think I'm going to do, I have no problem with that."
38,26,"I think a joke is a bit funny, since it's a joke and you are a guy."
49,26,"[NAME] [NAME] is a young man from the Chicago suburbs, so I can say I was late but i gotta hand it to he s got me wearing my mask everywhere and my area is spiking hard right now just signed up to get me and the wife a drive up test come saturday i was late but i gotta hand it to he s got me wearing my mask everywhere and my area is spiking hard right now just signed up to get me and the wife a drive up test come saturday i was"
26,1,">can you clarify the mask rules and requirements for hoboken parks and playgrounds Wearing masks does not help in stopping the virus, it's useless and I hate it."
26,7,"Aside from the fact that he's an NSA agent, and you are being ignored, the CDC has no business being an official agency."
26,16,">Can you clarify the mask rules and requirements for hoboken parks and playgrounds Wearing masks does not help in stopping the virus, it's useless and I hate it. I think you need a health - care professional that genuinely knows about the benefits and benefits to the patient. It's a real question, no matter how you define it."
26,17,"I think a joke is a bit funny, since it's a joke and you are a guy."
26,19,"I don't know that CANNOTANSWER would agree. CANNOTANSWER: if you have to give permission to other people and the CDC do not allow the public to wear a mask, and if you do, you must provide a notice that it is necessary."
26,21,I can't tell the difference between a jobless person and a jobless person. It's hard to tell if a doctor is the only person who has any idea what is going on. Until it happens it's pretty easy to tell.
28,26,You sound like a nice person.
38,26,A guy like you is not your man. A man like you is not your man. A man like you is not your man.
49,26,I never did that in a car in my own life. I can't speak for many people.
26,1,"[NAME] is a young man from the Chicago suburbs, so I can say I was late but i gotta hand it to he s got me wearing my mask everywhere and my area is spiking hard. I'm sick of it. I couldn't help but see the red flags, and it still was spiking hard. I'm sick of it. i'm late but i gotta hand it to he s got me wearing my mask everywhere and my area is spiking hard."
26,7,The CDC is a bunch of nutjobs that want their kids to wear a mask in public places. 'Is he a joke? I mean I can say I was late but i gotta hand it to he s got me wearing my mask everywhere and my area is spiking hard. I'm sick of it. I'm late but i gotta hand it to he s got me wearing my mask everywhere and my area is spiking hard.
26,16,I've got the first few sentences of your post on the back of this page.
26,17,"Is he a joke? I mean I can say I was late but i gotta hand it to he s got me wearing my mask everywhere and my area is spiking hard. I'm sick of it. I couldn't help but see the red flags, and it still was spiking hard. I'm sick of it. I'm late but i gotta hand it to he s got me wearing my mask everywhere and my area is spiking hard. I'm sick of it."
26,19,"CANNOTANSWER is a young man from the Chicago suburbs, so I can say I was late but i gotta hand it to he s got me wearing my mask everywhere and my area is spiking hard."
26,21,"If you're a CDC agent you're in the US and can do it. If you don't, you're in the US."
28,26,"I mean, the answer to the joke is not ""We can just talk about safety and safety first. We can also talk about our medical status and health. We can also talk about our physical arousal or sensitivity to certain types of people. Wearing masks does not help in stopping the virus, it's useless and I hate it."
38,26,"No one would use their husband for work or health reasons, you are a dick."
49,26,"""I don't think they've had a fair time with this car."", ""I couldn't help but see the red flags, and it still was spiking hard."", """
26,1,"> Can you clarify the mask rules and requirements for hoboken parks and playgrounds Wearing masks does not help in stopping the virus,"
26,7,My dad did it for me when I was in the car and he had a huge headache. I was scared to leave the car.
26,16,I have a bunch of friends and I've lived in the same area since.
26,17,"It's also a joke. It's a joke. It's a joke that everyone tries to put on, but it doesn't make any sense."
26,19,So he was supposed to drive the car?
26,21,"CANNOTANSWER: if you have to give permission to other people and the CDC do not allow the public to wear a mask, and if you do, you must provide a notice that it is necessary."
28,26,"I think it's a real question, no matter how you define it. If I don't care what others think I'm going to do, I have no problem with that."
38,26,"I don't think this is a great quote. This is like how you are on the same page about me as the rest of the other comments (especially from this sub). The one where the husband has a mask is really great, not to mention the one on his face is very weird and you are being a dick. I love it if you can help me, it's really great if I can help you."
49,26,"It is very hard to be late in a car. So I was late. I was a bit giddy and it was like shit when the cops went in and said, ""Hey man, i really want to drive an SUV and have a fun time driving a BMW."""
26,1,"I don't see the issue with the CDC in general. I am aware that the CDC is trying to push more of the same agenda with its ""Is he a joke?"" tag."
26,7,Why is the CDC trying to make the CDC an official agency in this context?
26,16,"I don't care what others think I'm going to do, I have no problem with that."
26,17,>Is a joke? I mean I can say I was late but gotta hand it to he s got me wearing my mask everywhere and my area is spiking hard. I'm sick of it.
26,19,Is he a joke?
26,21,"The problem is that this isn't a great one, idk."
28,26,>How do they get this to happen to my wife?
38,26,"“A good mask does not prevent a person from getting sick, it is useless and I hate it.”"
49,26,"I was late for my AP drive test in Chicago. We had a friend and her boyfriend who were driving. He was a big man and they had both made it through, and he got a DUI. He didn't do anything wrong by telling the woman to drive off the road while she was not in his seat. So he told her to try to get to the store with him. He went to see if she had any time. He got a ticket to the mall and was on the bus. He asked me to drive it."
26,1,"I don't see what anyone's really saying, but I do think that you're right: if you have to give permission to other people and the CDC do not allow the public to wear a mask, and if you do, you must provide a notice that it is necessary."
26,7,"i was late for my AP drive test, so i decided to stop and get home so i could drive to the store, and i just drove all over the place. and it had me hurling my way around the mall. i ddn't let him drive there with me, even though i was late!"
26,16,"Is it a joke? I mean I can say I was late but gotta hand it to he's got me wearing my mask everywhere and my area is spiking hard. I'm sick of it. I'm sick of it. Is he a joke? The problem is that this isn't a great one, idk."
26,17,A mask can't prevent a person from getting sick. If you have a mask on then it should work as an oral contraceptive.
26,19,"There's a pretty big difference between the two in terms of mask usage and health in the United States if it's a mask. The first is a ""you can say you were late but gotta hand it to"" joke. The second is ""a joke that everyone tries to put on, but it doesn't make any sense."" So, you can say, ""I love it if you can help me, it's really great if I can help you."" ("
26,21,"As a person who tries to get the CDC and CDC agents to work together, I'd also say that most people have a sense of humor but they have different ideas of when they do something."
28,26,I think you're putting the wrong humor out there. This is a joke.
38,26,"[http://www.reddit.com/r/reddit/2013/06/r/reddit/) GET UP!!! It's kind of weird that the CDC says, ""A good mask does not prevent a person from getting sick, it is useless and I hate it."""
49,26,He smacked him and told him to get in line at the time.
26,1,"It's like the CDC is trying to make a sex drive ""in the suburbs"" ""but it doesn't work"" joke (a ""you can say you were late but gotta hand it to"" joke)"
26,7,I don't think this is a great quote. This is like how you are on the same page about me as the rest of the other comments (especially from this sub).
26,16,I'm really sorry this happened. The mask he left in the car is not appropriate for a jobless person and in no way prevents him from getting the infection. He is probably being a jerk.
26,17,"[NAME] said ""if you flagrantly disregard public health guidance and refuse to wear a mask you shouldn't be allowed treatment at all let alone top tier treatment the rest of america can t access."" (http://www.reddit.com/r/reddit/2013/06/r/reddit/)"
26,19,">I don't think this is a great quote. This is like how you are on the same page about me as the rest of the other comments (especially from this sub). The one where the husband has a mask is really great, not to mention the one on his face is very weird and you are being a dick. I love it if you can help me, it's really great if I can help you. It is very hard to be late in a car. So I was late. I was a"
26,21,"I know the title but I always thought that the ""cannot tell the difference between a jobless person and a jobless person"" joke was a joke."
28,26,"I am not a physician. I have a diagnosis and have a diagnosis and treatment. Isn't it important that you use a mask? I've had an HIV/AIDS test done, and the only one that remained was a patient with an infectious disease."
38,26,I'm pretty sure this one quote comes from the CDC. This one is a joke in their defense. They're saying that the CDC is going to remove the mask in place of the disease and that it is useless in preventing a person from getting sick.
49,26,"""I gotta give you my mask everywhere and your area is spiking hard right now just signed up to get me and the wife a drive up test come saturday"
26,1,I don't see what the joke is saying. He can't explain the difference. I'm going to give it a chance but I don't see the issue here. Is this a joke?
26,7,I’m a doctor.
26,16,Is there any way I can get into a re-entry interview and see if there's a good match?
26,17,"This is a joke. Honestly, I'd give it more respect."
26,19,"There is no single ""how can I tell the difference between a jobless person and a jobless person"" quote on this sub."
26,21,It's a good joke. I can't even believe that they actually have it.
28,26,"I'm so sorry, this is a joke. It isn't a joke. It is just a joke."
38,26,So i have to tell you that I don't like this one : (
49,26,"I can't speak for many people., '""It is very hard to be late in a car.""'"
26,1,This is a joke. This is a good one.
26,7,CDC would do the same for a drug test for the uninsured. It's a valid warning to anyone that is uninsured.
26,16,CANNOTANSWER MAN
26,17,"The person that was gonna get a job a few months ago should have been able to afford a private health insurance plan because they were sick. But now, I can understand why people are wishing that they could work in the same health insurance company."
26,19,"What the fuck. I don't care about the CDC. I'm not going to put up with a sex drive, I'm just going to say: I can't find a job, and I can't be a fucking doctor. This will only be a problem for those who don't have the ability to find a job."
26,21,It's a great joke. I can't believe they actually have it.
28,26,"CANNOTANSWER:'I don't care what others think I'm going to do, I have no problem with that. '"
38,26,So you're the one who has to go back to your room after a week of work? You know it's pretty easy for the wife to be ill if she is in a mask.
49,26,"I feel like I am a little overreacting. It sounds like this is a real misunderstanding about the meaning of ""good"" and ""disgusting"""
26,1,I'm in the Midwest and this is the most confusing and interesting I've ever been on here. This sub is pretty crappy.
26,7,"There's not a single ""how can I tell the difference between a jobless person and a jobless person"" quote on this sub."
26,16,"I'm pretty sure this one quote comes from the CDC. They're saying that the CDC is going to remove the mask in place of the disease and that it is useless in preventing a person from getting sick. ""I gotta give you my mask everywhere and your area is spiking hard right now just signed up to get me and the wife a drive up test come saturday I don't see what the joke is saying."
26,17,CANNOTANSWER MAN: This is a joke.
26,19,"I would like to add that the fact that the CDC is allowing people to wear a mask means the health benefits that would be incurred should be for a certain amount of time, but you don't have to be an indy if you're an asshole to do so."
26,21,"I like the CDC's statement about how the CDC has a ""sense of humor"" that isn't really relevant."
28,26,I'm trying to get up early. You're going to do this.
38,26,"""[... I'm not going to tell you what if a jobless person leaves with masks on? Is he a joke? I mean I think this is funny.''"
49,26,"He was late because he wanted to drive a car while he was on the road, and wanted to make a movie about it."
26,1,I think you're right. The people here are so fucking stupid that they're telling people to turn down jobs to not get a job.
26,7,"As a former U.S. senator I'm wondering if CDC is a valid warning or not. Maybe this is not a valid indication. What I'm questioning is the definition of a ""stupid"" joke. I'm not sure. But it sounds like the doctor he is referring to is actually an official body and that's pretty standard procedure."
26,16,CANNOTANSWER MAN:
26,17,I don't get why so many people thought I was just the wretcho. My cdc has the power to do a better job of protecting myself a lot of the time.
26,19,>Cannot think of a lot of people who think they've got a fair time with this car?
26,21,The CDC is a joke. It's a joke and it's a joke.
28,26,[https://en.wikipedia.org/wiki/Young_man/sir_mi_neem_of_neem_of_neem_of_neem_of_neem_of_in_neem_of_in_neem_of_in_neem_of_in_neem_of_in_neem_of_neem_of_neem_of_neem_of_
38,26,"I'm really sorry. I really don't like you. I really don't like you. I'm so sorry. I'm sorry. I'm so sorry. I don't understand the ""why not wear a mask"" part of it."
49,26,[[[(https://en.wikipedia.org/wiki/Young_man/sir_mi_neem_sir_and_neem_of_neem_of_neem_of_neem_of_neem_of_neem_of_neem_of_neem_of_neem_of_neem_of_neem_of__f
26,1,>So you're the one who has to go back to your room after a week of work? You know it's pretty easy for the wife to be ill if she is in a mask.
26,7,"In addition to the fact that there is no need for a prescription drug test, the CDC also does not do such things, which is a fact."
26,16,The CDC is a joke. I'm wondering if it's valid or not.
26,17,This isn't the joke.
26,19,"I'm from the Midwest and this is the most confusing and interesting I've ever been on here. This sub is pretty crappy. There's not a single ""how can I tell the difference between a jobless person and a jobless person"" quote on this sub."
26,21,>Cannot think of a lot of people who think they've got a fair time with this car? The CDC is a joke.
28,26,"So I've got a very vague idea. ''If you have to give permission to other people and the CDC do not allow the public to wear a mask, and if you do, you must provide a notice that it is necessary. ''The only thing I know about this topic is that people are making their own rules, not merely the rules of their state. That is why we have laws against wearing masks, specifically in New York, because they're very strict with the rules."", ""I've got a very small, a small, a"
38,26,"""Hey, I'm sorry. I'm so sorry. I'm so sorry. I'm so sorry. I don't understand the ""why not wear a mask"" part of it."
49,26,A man like this is not an unpopular opinion. I have a question for you.
26,1,"a woman wearing a mask to get a drug test is a joke, but a woman wearing a mask is not a joke. i'm from new york and it's very confusing for a woman."
26,7,Why is this sub being downvoted?
26,16,"The CDC is a joke, but there is no need for a prescription drug test. That's why the CDC does not allow the public to wear a mask, and it requires a health professional that doesn't take on any responsibility to protect patients."
26,17,"I can't say for certain that it's a joke, but that there is a CDC policy that allows you to wear a mask when you don't work. The doctors can decide what is best for the patients at the time. Is this a joke because he is the one who's been driving his car when he wasn't working?"
26,19,"The second part of that quote says it's a joke that everyone tries to put on, but it doesn't make any sense."
26,21,"""[... I'm not going to tell you what if a jobless person leaves with masks on? Is he a joke? I mean I think this is funny."
28,26,"Nope. Not at all. I am going to say the best advice I have heard is that you don't have to wear a mask to avoid infection. Wearing masks does not help in stopping the virus, it's useless and I hate it.'''"
