sender,receiver,message
31,2,i like the part when he got covid but still had events with people and how he won t enforce a statewide mask mandate oh and the part where he cut education funding wow so great
31,3,i like the part when he got covid but still had events with people and how he won t enforce a statewide mask mandate oh and the part where he cut education funding wow so great
31,4,i like the part when he got covid but still had events with people and how he won t enforce a statewide mask mandate oh and the part where he cut education funding wow so great
31,6,i like the part when he got covid but still had events with people and how he won t enforce a statewide mask mandate oh and the part where he cut education funding wow so great
31,7,i like the part when he got covid but still had events with people and how he won t enforce a statewide mask mandate oh and the part where he cut education funding wow so great
31,16,i like the part when he got covid but still had events with people and how he won t enforce a statewide mask mandate oh and the part where he cut education funding wow so great
31,17,i like the part when he got covid but still had events with people and how he won t enforce a statewide mask mandate oh and the part where he cut education funding wow so great
43,31,thanks ctl stay safe friends and wear mask if need to go out
44,31,if hes going to be stupid enough not to wear a mask then he deserves what he gets hopefully he doesn t infect anyone else
51,31,"Wearing masks does not help in stopping the virus, it's useless and I hate it."
31,2,i like the part when he got covid but still had events with people and how he won t enforce a statewide mask mandate oh and the part where he cut education funding wow so great i like the part when he got covid but still had events with people and how he won t enforce a statewide mask mandate oh and the part where he cut education funding wow so great i like the part when he got covid but still had events with people and how he won t enforce a statewide mask
31,3,That's because he did it for people and he got elected. I think the guy got his own agenda...
31,4,"I feel like he's a dick asshole who shits his own ass, not trying to convince you to wear a mask because he can get an impotent opportunist mask to keep you from recognizing him. I think his problem with masks is that he's a liar who just doesn't care about making money."
31,6,You must not think about this as a real life issue. What does it really mean?
31,7,i like the part when he got covid but still had events with people and how he won t enforce a statewide mask mandate oh and the part where he cut education funding wow so great i like the part when he got covid but still had events with people and how he won t enforce a statewide mask mandate oh and the part where he cut education funding wow so great i like the part when he got covid but still had events with people and how he won t enforce a statewide mask
31,16,yea i m going to go out and go to a party and get my mask on my hat i will go go.
31,17,What part of the state is he coveting?
43,31,"He deserves it, but you need to do it, and do it well, you're going to be in a horrible situation."
44,31,If he's going to be stupid enough not to wear a mask then he deserves what he gets hopefully he doesn't infect anyone else if he's going to be stupid enough not to wear a mask then he deserves what he gets
51,31,"Wearing masks does not help in stopping the virus, it's useless and I hate it."
31,2,"Basically, the reason for the mask mandate was because the law doesn't apply to him. It is not a law and it was actually signed by a governor in the past. So they went ahead with it."
31,3,"I don't think the man is smart, he is trying to make a living. He could be looking for money but doesn't have the will to actually do anything."
31,4,"In the long run, he's trying to keep the GOP from going out of their way to stop the statewide mask mandate. He's trying to justify a mandate by giving the GOP a power grab and not a fight."
31,6,"""I'm going to go out and go to a party and get my mask on my hat i will go."""
31,7,i like the part when he got covid but still had events with people and how he won t enforce a statewide mask mandate oh and the part where he cut education funding wow so great
31,16,"If you want to know, go to a party and get your mask on your hat."
31,17,I think a statewide mask mandate is a really illogical and bad idea.
43,31,Thanks to - thank you!
44,31,"Wearing a mask doesn't help in stopping the virus, it's useless and I hate it."
51,31,"Wearing masks does not help in stopping the virus, it's useless and I hate it."
31,2,"I love the part where the guy has a mask on. You know, I don't have any respect for his right to do what I want, but I do have a problem with it."
31,3,I like the part when he got covid but still had events with people and how he did it for people and he got elected. I think the guy got his own agenda...
31,4,I think that they don't really have any other options. That's why they don't put together an article on how to enforce a statewide mask mandate.
31,6,"I'm not saying the guy can't do that, I'm just saying that he can't. It's an impotent opportunist mask that you wear to a party. You do that, not a mask. He can do that but he has to go to a party. This isn't a mask."
31,7,"> Basically, the reason for the mask mandate was because the law doesn't apply to him. It is not a law and it was actually signed by a governor in the past. So they went ahead with it."
31,16,"There are two parties that want to get rid of them and if the mask mandate doesn't work, then it's not a good idea."
31,17,I think this is a really bad idea.
43,31,>thanks - thank you! I'm glad you asked. I'm also glad you know how to make this video.
44,31,"The problem isn't what's in the bathroom, it's what you put on."
51,31,"Wearing masks does not help in stopping the virus, it's useless and I hate it."
31,2,"> What do you mean ""shade""?"
31,3,"It's an impotent opportunist mask that you wear to a party. You do that, not a mask. Wearing masks does not help in stopping the virus, it's useless and I hate it."
31,4,I hate that this isn't an article.
31,6,"> the mask mandate was because the law doesn't apply to him. It is not a law and it was actually signed by a governor in the past. So they went ahead with it. I don't think the man is smart, he is trying to make a living. He could be looking for money but doesn't have the will to actually do anything."
31,7,"I think it is a really bad idea. You're right, the mask mandate is illogical."
31,16,"Yeah - the other two parties are a bluff, and in some cases the party was a good idea."
31,17,"I'd like to add that ""We do not like the government to let other people see our masks and go to them on the street."" Does that make the other parties more resentful of the man if he doesn't act like a racist, but is also not racist? Or would that make him a racist?"
43,31,"I know that this is a huge red flag, but I'm a medical professional and I'm a real doctor. I am not sure if it's because of my health, but I just can't stand the thought of me having to do something if I don't have a mask."
44,31,"""Wearing a mask doesn't help in stopping the virus, it's useless and I hate it."
51,31,"Wearing masks does not help in stopping the virus, it's useless and I hate it."
31,2,Are you sure he was a doctor?
31,3,>the mask mandate is illogical.
31,4,"Essentially, the reason for the mask mandate was because the law doesn't apply to him. It is not a law and it was actually signed by a governor in the past. So they went ahead with it."
31,6,"This has a lot to do with the fact that the gov't wants to implement the mask mandate in the future, and not just how he's treating it now."
31,7,> I'm also glad you know how to make this video.
31,16,The mask mandate is a 'good idea'. That's what the article says.
31,17,"The reason for the mask mandate was because the law doesn't apply to him. It is not a law and it was actually signed by a governor in the past. So they went ahead with it. The mask mandate was because the law doesn't apply to him. It is not a law and it was actually signed by a governor in the past. So they went ahead with it. Basically, the reason for the mask mandate was because the law doesn't apply to him. It is not a law and it was actually signed by a governor in the past. So they went ahead with"
43,31,i would rather wear a hat.
44,31,"It does seem like the only reason to wear a mask is to avoid having to go to a dermatologist to find out what the CDC says. It doesn't say if he's going to be stupid enough not to wear a mask, it says if he's going to be stupid enough to wear a mask to prevent that."
51,31,"Wearing masks does not help in stopping the virus, it's useless and I hate it."
31,2,"It's called ""Current and Proposal of the Act."" It's an act of ""Disagreement"" that's really not a mandate."
31,3,">What do you mean ""shade""? It's an impotent opportunist mask that you wear to a party. You do that, not a mask. Wearing masks does not help in stopping the virus, it's useless and I hate it. I hate that this isn't an article."
31,4,">what do you mean ""shade""? It's an impotent opportunist mask that you wear to a party. You do that, not a mask. Wearing masks does not help in stopping the virus, it's useless and I hate it. I hate that this isn't an article."
31,6,"> what do you mean ""shade""? It's an impotent opportunist mask that you wear to a party. You do that, not a mask. Wearing masks does not help in stopping the virus, it's useless and I hate it. I hate that this isn't an article."
31,7,>The mask mandate is a good idea'. That's what the article says. It does seem like the only reason to wear a mask is to avoid having to go to a dermatologist to find out what the CDC says.
31,16,"""I don't think the man is smart, he is trying to make a living. He could be looking for money but doesn't have the will to actually do anything. I think it is a really bad idea."""
31,17,">What do you mean ""shade""? It's an impotent opportunist mask that you wear to a party. You do that, not a mask. Wearing masks does not help in stopping the virus, it's useless and I hate it. I hate that this isn't an article."
43,31,"A good mask does not prevent a person from getting sick, it is useless and I hate it."
44,31,"Honestly, I'm just saying that a lot of people do not have a very good sense of humor. I mean, maybe this movie is the only one that is funny."
51,31,"Wearing masks does not help in stopping the virus, it's useless and I hate it."
31,2,I've been through several episodes of this movie and it's so revealing that people who are more than a bit repressed and smug are a bit more apathetic than other guys. My first reaction was that I wasn't really aware of how stupid the guy was. Then I remembered the fact that the guy stayed out of his mind and got a mask in his face instead of just going to the dentist. I felt as if I was in the wrong place. I just didn't know how stupid a doctor was.
31,3,"I'm sure you are, but do you mean it isn't an article? Because I'm sure you could have used it in some way to counter a lot of your points about what's going on. You can also try not to use a mask to stop the virus."
31,4,"If you aren't sure what you're saying, you're not making a valid point. The article's subtitles are misleading. Are you sure that the gov't wanted to enforce a statewide mask mandate? >the mask mandate is illogical. It is not a law and it was actually signed by a governor in the past. So they went ahead with it."
31,6,I hate to say it but I hate that this is a bad idea.
31,7,">I don't think the man is smart, he is trying to make a living. He could be looking for money but doesn't have the will to actually do anything. I think it is a really bad idea. I hate that this isn't an article."
31,16,I don't think you understand the meaning of the title.
31,17,">A good mask does not prevent a person from getting sick, it is useless and I hate it."
43,31,">> I think 'I can't bear to have to wear a hat and a hat, but I can't bear to wear a mask when I'm in danger of getting sick.''"
44,31,CDC: (https://www.cdc.gov/about/virginia/napaloza/publications/virginia-fraud-fem-fraud/article/agdnp-fraud/index.aspx) is a pseudo scientific term.
51,31,"Wearing masks does not help in stopping the virus, it's useless and I hate it."
31,2,"I like that it's not even a movie, it's a fictitious and unnecessary piece of nonsense."
31,3,He sounds like an idiot. That's his opinion. I like him.
31,4,I hate to say it but I hate that this isn't an article.
31,6,"It's called ""Current and Proposal of the Act."" It's an act of ""Disagreement"" that's really not a mandate."
31,7,"I think a lot of people don't have a very good sense of humor. I mean, maybe this movie is the only one that is funny. Wearing a mask does not prevent a person from getting sick, it is useless and I hate it."
31,16,"It's called ""Current and Proposal of the Act."" It's an act of ""Disagreement"" that's really not a mandate. It's a good idea. That's what the article says. It does seem like the only reason to wear a mask is to avoid having to go to a dermatologist to find out what the CDC says."
31,17,I think the issue is that when they say the fact that people are more than a bit repressed and smug is a great sign to avoid that type of conversation.
43,31,"CANNOTANSWER (https://www.cdc.gov/about/virginia/napaloza/publications/virginia-fraud-fem-fraud/article/agdnp-fraud/index.aspx) is a pseudo scientific term. A person who has a virus that has been infected doesn't have to wear a mask, so as to have to wear a mask when it resides in the area."
44,31,"You know, unless you can go to the doctor you're going to get an infection that just happens to happen in the future. That's not funny."
51,31,"Wearing masks does not help in stopping the virus, it's useless and I hate it."
31,2,"It's not the least bit funny, because it is not an article, but it does seem like the only reason to wear a mask is to avoid having to go to a dermatologist to find out what the CDC says."
31,3,I don't understand why people would even bother wearing a mask. That's not a good reason.
31,4,I haven't seen this movie. Is the article even on its own?
31,6,I like how the subtitles are misleading. Are you sure that the gov't wanted to implement the mask mandate?
31,7,">The reason for the mask mandate was because the law doesn't apply to him. It is not a law and it was actually signed by a governor in the past. So they went ahead with it. I'm sure you are, but do you mean it isn't an article? Because I'm sure you are, but do you mean it isn't an article? Because I'm sure you are, but do you mean it isn't an article? Because I'm sure you are, but do you mean it is a good idea."
31,16,"CANNOTANSWER (https://www.cdc.gov/about/virginia/napaloza/publications/virginia-fraud-fem-fraud/article/agdnp-fraud/index.aspx) is a pseudo scientific term. A person who has a virus that has been infected doesn't have to wear a mask, so as to have to wear a mask when it resides in the area."
31,17,"They're trying to be sarcastic here, so I'm asking what other people in the comments think. You said something like the article's subtitles are misleading. Are you sure that the gov't wanted to enforce a statewide mask mandate? Because the law doesn't apply to him."
43,31,"CANNOTANSWER : ""It was a great story, but I was late but it was just a good thing to do""(https://www.cdc.gov/about/virginia/napaloza/publications/virginia-fraud-fem-fraud/article/agdnp-fraud/index.aspx) is a pseudo scientific term. A person who has a virus that has been infected doesn't have to wear a mask, so he"
44,31,"I mean, maybe this movie is the only one that is funny. I mean, maybe this movie is the only one that is funny."
51,31,"Wearing masks does not help in stopping the virus, it's useless and I hate it."
31,2,... that's the thing...
31,3,">They're trying to be sarcastic here, so I'm asking what other people in the comments think. You said something like the article's subtitles are misleading. Are you sure that the gov't wanted to implement the mask mandate? Because the law doesn't apply to him."
31,4,I hate it when I'm in the middle of a movie.
31,6,That's a great argument. But... I don't think the article is going to have the CDC and the CDC as the lead counsel for the law. They don't want to enact it. They don't want to change anything. They want to keep it from spreading and being used against people. That's a great argument.
31,7,"""I want to enact a statewide mask mandate,"" is a great title for a post apology AMA."
31,16,"CANNOTANSWER, I like that it's not even a movie, it's a fictitious and unnecessary piece of nonsense. He sounds like an idiot. That's his opinion. I like him. I hate that it's not even an article. It's called ""Current and Proposal of the Act."" It's an act of ""Disagreement"" that's really not a mandate. I think a lot of people don't have a good idea."
31,17,">I hate that it's called ""Current and Proposal of the Act."" It's called ""Current and Proposal of the Act."" It's an act of ""Disagreement"" that's really not a mandate."
43,31,It is one of the most ridiculously well-known things in the world.
44,31,It doesn't help in stopping the virus. It's useless and I hate it.
51,31,"Wearing masks does not help in stopping the virus, it's useless and I hate it."
31,2,I mean I'm sure he was a doctor.
31,3,"""I don't understand why people would even bother wearing a mask."""
31,4,"I like how there's a wikipedia article about it, but it's only a bit misleading."
31,6,"I like that the movie was really good, but it's not that great. I think that it's too extreme, because that's what I hate most about this guy."
31,7,"It’s about people who think that a statewide mask mandate is something that can prevent a virus from spreading and being used against people, because it does not protect the people who do it."
31,16,Nope. That's just me. But I really like this guy.
31,17,[Movie Title](https://www.cdc.gov/about/virginia/napaloza/publications/virginia-fraud-fem-fraud/article/agdnp-fraud/index.aspx) [https://www.cdc.gov/about/virginia/fraud-fem-fraud/index.aspx) is a pseudo scientific term. A person who has been infected is a pseudoscientific
43,31,">If you put on a mask in the bathroom, there are more spores. it's a lot easier to kill a virus than a mask."
44,31,">A mask doesn't help in stopping the virus, it's useless and I hate it."
51,31,"Wearing masks does not help in stopping the virus, it's useless and I hate it."
31,2,[State](http://www.state.ny.us/resources/Fem/PubMed/PubMed-Theme-Rides-City-Mask-Them-Proposal.pdf)
31,3,[NAME] is an ex-Fda member.
31,4,"It's a fucking myth, but you need to go and make a film about that."
31,6,I’ve never seen a virus. I really wanted to see that because it’s so virulent that people don’t have to wear masks every time I go to a party. It’s really not that I hate it.
31,7,"""Hey, the person who made a comment, the article sounds like a liar."""
31,16,"That’s a good idea, but I don’t really see the point in swiping a mask. I know a lot of people who are in the same boat, and the CDC is probably more involved in them being involved in a scam or something."
31,17,">If you put on a mask in the bathroom, there are more spores. it's a lot easier to kill a virus than a mask."
43,31,They don't have a doctor that teaches or is trained to do that. I don't think the person who does it has any medical experience.
44,31,"I can't stand you saying, ""I'm a doctor. I want to be a doctor, and you can't just use that."""
51,31,"Wearing masks does not help in stopping the virus, it's useless and I hate it."
31,2,"""It’s not even a movie, it’s a fictitious and unnecessary piece of nonsense."", ""... that's the thing..."", ""I mean I’m sure he was a doctor."","
31,3,I do not like his stuff.
31,4,There are two very important points in the article.
31,6,He's not being intelligent. He's trying to become a doctor. And the CDC can't really make that choice.
31,7,"I think the article sounds like a liar. ""Hey, the person who made a comment, the article sounds like a liar."""
31,16,"The man who wants to make a movie about a statewide mask mandate has no experience. He doesn't have a doctor, and I think he has no experience."
31,17,It is a good idea.
43,31,"I think it's really good that this guy will continue to wear a mask, especially if it's not to protect him."
44,31,"It's only the third time in recent years that I've been in the same position. Rather than not being able to figure out the reason for the lack of a sense of humor, I thought I'd put on the mask to stop it."
51,31,"Wearing masks does not help in stopping the virus, it's useless and I hate it."
31,2,"Then he went to the dentist because his skin was too swollen, which is why he got the mask on. This guy is an ex-fda member. It's a fucking myth, but you need to go and make a film about that. I’ve never seen a virus. I really wanted to see that because it’s so virulent that people don’t have to wear masks every time I go to a party. It’s really not that I hate his stuff."
31,3,"It's a movie. If a party goes too late and people show up, he might have been the only one with a mask."
31,4,"I just don't feel like it's a good idea. I don't feel like a good person would want to put on a mask for anything but to protect someone. They don't think they can, and I think they're trying to force the party to stick with the idea that if they had to stick with a mask it'd be a good idea."
31,6,"That is a little of a naivety. I know this guy has a lot of good ideas, but this is a problem that needs to be addressed."
31,7,"The article is really nice, and I think a lot of people might like it. But then again, most of us don't like the fact that the article is in fact a joke. So I think I might be missing something here."
31,16,I don't understand why people have to buy a mask in order to get a job. It's more to protect themselves and to keep your hands off a virus.
31,17,"I’m gonna have to be on a phone with the guy in question, so I can’t do it."
43,31,"CANNOTANSWER : ""I would rather wear a hat. Whenever i get sick, i don't wear a mask. If you put on a mask in the bathroom, there are more spores. it's a lot easier to kill a virus than a mask. They don't have a doctor that teaches or is trained to do that. I don't think the person who does it has any medical experience."""
44,31,"I don't know if this is sarcasm, but I see that if you get infected you can go to the CDC and get a vaccination. It's a big fucking mess - it's actually not a good idea."
51,31,"Wearing masks does not help in stopping the virus, it's useless and I hate it."
31,2,"I don't understand how you can think of it as a ""good idea""?"
31,3,"CANNOTANSWER : ""I would rather wear a hat. Whenever i get sick, i don't wear a mask. If you put on a hat in the bathroom, there are more spores. it's a lot easier to kill a virus than a mask. They don't have a doctor that teaches or is trained to do that. I don't think the person who does it has any medical experience."", ""I just don't feel like it's a good idea."", ""I think"
31,4,>I've never seen a virus. I really wanted to see that because it’s so virulent that people don’t have to wear a mask every time I go to a party. I’ve never seen a virus.
31,6,I don't understand what you're implying.
31,7,"It's pretty clear that if he had an ex-fda member, the law wouldn't have been in his favor, and he's trying to evade the doctor."
31,16,"I don't know why you think that's sarcasm, but I see that if you're infected by a virus it's possible you're infected by a vaccine and don't have the same health insurance. That's not what it's called."
31,17,"In my opinion, you need to stop using the term ""shade"" and start by trying to avoid the word ""shade"" and you need to think about the other terms like ""a good mask does not prevent a person from getting sick, it is useless and I hate it."""
43,31,">I think it's really good that this guy will continue to wear a mask, especially if it's not to protect him."""
44,31,"In Texas a person with a flu can be infected by a mask (here it is a spore or a virus). The fact that it's a fungus (so not very uncommon) and is not easily removed, and is also used as a filter to keep you from having a rash, will certainly have a serious impact on your health."
51,31,"Wearing masks does not help in stopping the virus, it's useless and I hate it."
31,2,"I know what you mean, but I don't think you understand why this is a bad idea?"
31,3,I just realized this was a rebuttal to what I said and got downvoted a few times.
31,4,If I were a doctor who could use the mask I would probably be able to get a vaccine.
31,6,"The fact that a person with a virus can be infected by a mask (here it is a fungus, so not very uncommon) and is not easily removed, and is also used as a filter to keep you from having a rash, will certainly have a serious impact on your health. Wearing a mask doesn't help in stopping the virus, it's useless and I hate it."
31,7,"What if the CDC gave him a mask to try and protect him, or gave him a vaccine?"
31,16,"It is a fictitious and unnecessary piece of nonsense. It's a joke, in my opinion. It's not a good idea."
31,17,I know a bit of people in my state who have been infected with a virus and have been treated with something called the 'fuki virus' and it's not even considered an illness.
43,31,"""I just can't stand the thought of me having to do something if I don't have a mask."" (https://www.cdc.ca/cyber/article/fr/ip_fr_af_neem_of_neem_of_Neem_of_Neem_of_Neem_of_Neem_of_Neem_of_Neem_of_Neem_of_Neem_of_n"
