sender,receiver,message
46,2,mask protect other people he only cares about himself
46,7,mask protect other people he only cares about himself
46,13,mask protect other people he only cares about himself
46,20,mask protect other people he only cares about himself
46,32,mask protect other people he only cares about himself
46,37,mask protect other people he only cares about himself
51,46,"Wearing masks does not help in stopping the virus, it's useless and I hate it."
46,2,Mask protect other people he only cares about himself Mask protect other people he only cares about himself
46,7,I'd like to get a mask that doesn't let you out of the room. Then try to get out of the room.
46,13,I just remember wearing masks in the 70s and 80s and still remember that day.
46,20,What is the mask mask protecting?
46,32,Mask protect other people he only cares about himself
46,37,Mask protect other people he only cares about himself mask protect other people he only cares about himself
51,46,"Wearing masks does not help in stopping the virus, it's useless and I hate it."
46,2,Mask protect other people he only cares about himself Mask protect other people he only cares about himself Mask protect other people he only cares about himself
46,7,"I'm gonna try the ""mask protect other people he only cares about himself"" one. That's just like saying ""What is the mask mask protecting?"". This is how I've heard this word used."
46,13,So we'll have the next episode:
46,20,The fact that mask protect other people he only cares about himself can make the virus not work is something that doesn't mean I can stop it.
46,32,Mask protect other people he only cares about himself mask protect other people he only cares about himself mask protect other people he only cares about himself
46,37,"I've seen the entire article - from the first time I put it on, it was a picture of a guy that's been wearing a mask for 4 years and he was wearing one for a year after that. I found it to be a little uncomfortable but I still remember the feeling when he wore a mask to protect other people he only cared about himself and was never able to tell."
51,46,"Wearing masks does not help in stopping the virus, it's useless and I hate it."
46,2,This is not about the mask.
46,7,"My friend and I wore a mask that came with the first one, one year after she died of an allergic reaction. We didn't realize she was using it to protect other people, but they just said it's just a silly way of thinking about it."
46,13,I still remember the feeling when he wore a mask to protect other people he only cared about himself and was never able to tell.
46,20,What a jerk!
46,32,This is just a common misconception.
46,37,"What was it like when it happened? Because I knew the name of my friend and he didn't want to see me wearing a mask, he was the one who started a virus. He did that because he loved her so much, she wanted her life back and he was all grown up. That guy has no clue what is going on or who is going to be on the Internet, he's been wearing masks for 4 years and I still still love him."
51,46,"Wearing masks does not help in stopping the virus, it's useless and I hate it."
46,2,Thats not a good idea. Thats why you get a mask that doesnt let you out of the room. Then try to get out of the room. I'd like to get a mask that doesn't let you out of the room. I just remember wearing masks in the 70s and 80s and still remember that day. What is the mask mask protecting?
46,7,I'm not gonna get any further than this.... and I'm not sure if this has much to do with the fact that people do not know what their health is?
46,13,"I read this in one of the episodes of Doctor Who where I was given a mask for a special occasion. I had no idea this happened, and it did sound like it was a joke. It’s basically saying a guy who is wearing a mask was ""the one who started a virus."" I know this sounds harsh, but I don’t think this is something to be ashamed of."
46,20,"That's not the issue here, but rather that you are saying you were wearing a mask because of this virus."
46,32,How about the fact that masks help stop the spread of the virus?
46,37,"I'm gonna try the ""mask protect other people he only cares about himself"" one. That's just like saying ""What is the mask mask protecting?""."
51,46,"Wearing masks does not help in stopping the virus, it's useless and I hate it."
46,2,It's hard to tell if the fact that someone could be exposed to this virus because of the lack of masks does actually change the fact that people actually want to know about the virus. It just doesn't make them that able to be exposed.
46,7,"You know what, that's called [a jerk.](http://www.dc.org/wiki/Hass_Hass_Hass_Hass_Hass_Has_Has_Head) that essentially says that masks do not prevent any sort of transmission of the virus. I'm not sure I'd even believe that if I knew, I'd be able to tell."
46,13,"I'm in a funk and I've been wearing masks for my entire life. My parents got me a mask to hide my sclera in case I had a cold or flu. They thought I was wearing one of those too. I wore a mask in a panic attack, but didn't want to wear one. They wore a mask because the other person's sclera was a very dangerous part of their life, and I had to go to a doctor to remove it for a couple of months. After one of them"
46,20,So your friend got the one from Doctor Who where he didn't think he was the one who started a virus?
46,32,I'm going to try to put this into context. It's an obvious lie that he's wrong to wear a mask because he's not sure what to do with the virus. This means that he's wrong. But I can't tell him that he's a doctor or something. So I'm not going to tell you that you've already told a lie that is true. You're right he did that to protect other people and he did so to make his own choices on his own.
46,37,"This isn't a joke, this is a joke."
51,46,"Wearing masks does not help in stopping the virus, it's useless and I hate it."
46,2,"You're right. He's wrong. It's wrong to wear a mask, or that it's not what he is used for, but he's right."
46,7,"The article just stated that ""We are trying to change the way we act. What are you going to do if you aren't sure how to behave?"""
46,13,OP! There is an article in the Guardian about a guy whose mask he was given to protect others is a joke and you should not talk about this shit.
46,20,Thats an obvious lie that he's wrong to wear a mask because he's not sure what to do with the virus.
46,32,"I'm just glad you were able to tell my story, you know I haven't spoken to them."
46,37,"i'm not sure if it's because of dc but you're right he was wrong, and this isn't something to be ashamed of."
51,46,"Wearing masks does not help in stopping the virus, it's useless and I hate it."
46,2,"You're right. It's wrong to wear a mask, or that it's not what he is used for, but he's right."
46,7,> I don't think this is something to be ashamed of.
46,13,"I don't think you're wrong with the idea of someone who has a mask, it isn't something they should be ashamed of. I'm not sure if this has anything to do with how people aren't aware of their health or how it works."
46,20,"OP, I am a pretty much the only doctor I know that can say anything about the medical field of vaccines."
46,32,It was a joke if you like...
46,37,">I'm not sure if it's because of dc but you're right he was wrong, and this isn't something to be ashamed of."
51,46,"Wearing masks does not help in stopping the virus, it's useless and I hate it."
46,2,"You know what, that's called [a jerk.](http://www.dc.org/wiki/Hass_Hass_Has_Head) that essentially says that masks do not prevent any sort of transmission of the virus. I'm not sure I'd even believe that if I knew, I'd be able to tell. I'm in a funk and I've been wearing masks for my entire life. My parents got me a mask in the 70s and 80s and still remember."
46,7,"That's a lot of BS, I bet you're right..."
46,13,"> You know what, that's called [a jerk.](http://www.dc.org/wiki/Hass_Hass_Has_Head) that essentially says that masks do not prevent any sort of transmission of the virus. I'm not sure I'd even believe that if I knew, I'd be able to tell."
46,20,"I don't think this is a joke either. The article says that ""I'm not sure if it's because of dc but you're right he was wrong, and this isn't something to be ashamed of. I'm just glad you were able to tell my story, you know I haven't spoken to them. I'm not sure if it's because of dc but you're right he was wrong, and this isn't something to be ashamed of."
46,32,"A friend who got a mask for himself for a few months after she got the cold got a virus. She told him that he was afraid of the cold and went to a doctor to see if he was safe. She said she was sure he would die. It's not like she was going to make a big deal about it, though."
46,37,"He is a big jerk. He could have done worse, I could have been like ""Would I let him wear my mask?"" he can have a problem with the virus, and if he was going to be a jerk, then he wouldn't even be going to do a doctor-manipulation."
51,46,"Wearing masks does not help in stopping the virus, it's useless and I hate it."
46,2,"[Hmm, I think I'll get a mask. My parents gave me a mask for the cold and she was very scared, so she's been wearing a mask that she didn't use. It doesn't seem like that was the case here]."
46,7,"The article just stated that ""We are trying to change the way we act. What are you going to do if you aren't sure how to behave?"""
46,13,"- ""The article just stated that ""We are trying to change the way we act. What are you going to do if you aren't sure how to behave?"""
46,20,"I can only imagine the anger of a lot of people who are actually able to stop the disease on their own, if it wasn't for dc."
46,32,"I... ugh... and this is the same story that a man who got a mask for his own health to protect himself... i.e. he didn't go to a doctor, went to a doctor to see if he was safe, was actually in a funk and still remembered the story. I didn't even ask him if it was a joke."
46,37,"""He is a big jerk. He could have done worse, I could have been like ""Would I let him wear my mask?"" he can have a problem with the virus, and if he was going to be a jerk, then he wouldn't even be going to do a doctor-manipulation."
51,46,"Wearing masks does not help in stopping the virus, it's useless and I hate it."
46,2,"I just want to share that we can only do this if we all agree that the fact that someone has been exposed to a virus is because of the mask, and it makes us afraid. But you gotta be careful. Is it still a joke? Is it really about the dc?"
46,7,"I know a little bit about people, but I've never heard of people who wore masks when they were kids. My fiance does. My cousin got sick and wanted to use one to shield himself - I thought it was a great idea. We ended up with a few weeks of shit, and it is not a joke. I got too mad, but I'm going to go back to bed tonight. I know that it is a joke, but we were unable to keep them from my parents - who are so ashamed to be able to say anything about"
46,13,"I've seen the article, and I don't think it says anything about it. Just saying that it was an important story. It is a joke."
46,20,"> ""I... ugh... and this is the same story that a man who got a mask for his own health to protect himself... i.e. he didn't go to a doctor, went to a doctor to see if he was safe, was actually in a funk and still remembered the story. I... ugh... and this is the same story that a man who got a mask for himself for a few months after she got the cold got a virus. She told him that she was very scared, so she was wearing a mask"
46,32,"> ""He's a big jerk. He could have done worse, I could have been like ""Would I let him wear my mask?"""
46,37,op and his mom have been using a mask for the last four years
51,46,"Wearing masks does not help in stopping the virus, it's useless and I hate it."
46,2,"It is just an example of how people react to it. That's very strange and depressing, and in the same sentence it is about how the doctor said a friend was a big jerk for wearing a mask."
46,7,It's a joke.
46,13,"I know what, that's called [a jerk.](http://www.dc.org/wiki/Hass_Has_Head) that essentially says that masks do not prevent any sort of transmission of the virus. I'm not sure I'd even believe that if I knew, I'd be able to tell. I don't think this is something to be ashamed of."
46,20,"A friend of mine got a mask because of the virus, and we didn't want to talk about how her mom was so scared and wore one. She's wearing a mask to get it away, because she thinks it's the only way to stop the virus."
46,32,I'm the first person to post this.
46,37,"It was just a joke... it's like 'He is not sure if it's because of dc, but you're right he was wrong'"
51,46,"Wearing masks does not help in stopping the virus, it's useless and I hate it."
46,2,"""How was the friend a jerk for wearing a mask?"""
46,7,I don't think this has much to do with the fact that people do not know what their health is?
46,13,"Probably because there are so many people in 'The Daily Show' who think masks don't prevent infection, as in they just masks themselves. But hey, the Daily Show is about preventing the spread of the virus. It's the same as when the guy was in a funk and you had a virus, so you got a fucking scare. He was in a panic attack and then forgot about it until he went to the doctor. Now he's getting it in a fucking joke to keep things in his head when you"
46,20,"This was so funny! I had this idea to keep a friend of mine and my doctor's at a place where he had to get away with it. I used a mask to protect him while his mother was there, despite him getting it away. The doctor then took it off and gave it to the hospital and it worked perfectly. It didn't work, he never really had any problems getting out of it, he just did it and told his mom to fuck it out."
46,32,Probably more of the jokes from the article. I'm going to go back to bed tonight.
46,37,"Unless he was infected with D.C., he was essentially immune to the virus. I think he should put a mask on in case he gets into a funk."
51,46,"Wearing masks does not help in stopping the virus, it's useless and I hate it."
46,2,"It seems to be a bit odd that you're assuming that it's a joke. You're not right, and there's no way to know for sure."
46,7,"""How was the friend a jerk for wearing a mask?"""
46,13,"I've always thought it was a joke, but I've been told I did it because it was a joke and I could find some kind of humour about it. It was a joke. But that doesn't mean the doctor was right."
46,20,"I was also told that it was a joke, but I had never heard of that before. You have this whole notion that wearing a mask and hiding the virus from everyone you know is a joke. If he can't stop it on his own, it is a jerk."
46,32,"I mean, you have to start by telling them that you are the first person to post this."
46,37,"I am going to tell you this: When I was in school, I would put on a mask to protect my friend from the virus. It was a joke, but it was a joke and I didn't think I could be embarrassed. He had a problem with the virus, and didn't seem to be able to talk to anyone who would notice. And when I walked away from the doctor, he had just come off. That was the first thing I did. He had to explain it to me for a few minutes, and the Doctor is all gone. This isn'"
51,46,"Wearing masks does not help in stopping the virus, it's useless and I hate it."
46,2,"It's a joke. I know what, that's called [a jerk.](http://www.dc.org/wiki/Hass_Has_Head) that essentially says that masks do not prevent any sort of transmission of the virus. I'm not sure I'd even believe that if I knew, I'd be able to tell."
46,7,">You know what, that's called a jerk.](http://www.dc.org/wiki/Hass_Hass_Head) that essentially says that masks do not prevent any sort of transmission of the virus. I'm not sure I'd even believe that if I knew, I'd be able to tell. I don't think this is something to be ashamed of."
46,13,"""We are trying to change the way we act. What are you going to do if you aren't sure how to behave?"""
46,20,If I know how to think of an episode of the Daily Show you can find some humour and also listen to a bit of Doctor Who and I've heard of some of the other stories.
46,32,"""Hi, I got a cold from wearing a mask. My first thought was, I didn't have a scare. You're doing it to be funny. I have no idea what I am doing. I'm worried about getting the virus."""
46,37,You can go back and read the other comments here to find a better explanation.
51,46,"Wearing masks does not help in stopping the virus, it's useless and I hate it."
46,2,"OP: if you want to be funny and funny, I'd like to be honest with you."
46,7,"Unless the doctor didn't know who he was, and he told his mom about the possibility of a virus that would come into contact with him, that's pretty much what is considered a petty joke."
46,13,Obviously not a joke. Just saying.
46,20,"It's a joke. It's like saying we're a good friend to ourselves but we can't pretend we aren't, because we're not in a funk, or because we're afraid of doing something that will not go anywhere and if you are a nice guy, and you aren't in a funk, and then you get an itch, and you feel like the joke. The joke itself is just silly but I think it's funny because it makes you feel like you're just trying to be funny."
46,32,">Hi, I got a cold from wearing a mask. My first thought was, I didn't have a scare. You're doing it to be funny. I have no idea what I am doing. I'm worried about getting the virus."""
46,37,"The fact that his mother is still getting an infection is more evidence that he was a jerk about it, and a joke."
51,46,"Wearing masks does not help in stopping the virus, it's useless and I hate it."
46,2,"[Like - : a jerk? [What is it about?](http://www.dc.org/wiki/Hass_Has_Head) that essentially says that masks do not prevent any sort of transmission of the virus. I'm not sure I'd even believe that if I knew, I'd be able to tell."
46,7,This is the stuff of a dick.
46,13,"This is really pretty common. I’m not sure what’s wrong with it, but if I read it and was told that it was a joke, that would be it. My wife always thought it was a joke, I never ever actually did it. It is a joke. And I am not sure I’m going to tell her what I said and she’s getting all of the humour I need to learn about how it’s a joke, and I honestly don’t think I can explain it at all, but to say it is a joke and you aren"
46,20,"... ""We are trying to change the way we act. What are you going to do if you aren't sure how to behave?"""
46,32,"Yes, this is a joke. I'd say it's better to try to explain and not make any assumptions about what he's doing."
46,37,"""The fact that his mother is still getting an infection is more evidence that he was a jerk about it, and a joke."
51,46,"Wearing masks does not help in stopping the virus, it's useless and I hate it."
46,2,I'd go ahead and tell my wife but I'm in a funk.
46,7,"It’s called a joke (what’s not a joke) and the word itself isn’t in a word, so it can’t be interpreted as a joke. It could be a joke, but not a joke."
46,13,"A joke is not a joke. It's just a funny joke. I don't think it should be called a joke if it's just a joke, it's just a joke. I don't think it should be called a joke, unless you know what it means, just a joke. Is it just about the same story and that's it? Or is it about the same thing but the same joke?"
46,20,*I don't think that a mask is a joke**.
46,32,"I have a feeling that this is an obvious lie. If I was a guy I would have a mask and a scare, but the doctor told me it was for his own health and he doesn't know what to do with the virus. My partner and I have a few years together."
46,37,"i mean, I think it's hilarious that a doctor could find out the truth about a cold so i would put on a mask and tell him that he had a virus so i don't get into a funk."
51,46,"Wearing masks does not help in stopping the virus, it's useless and I hate it."
46,2,I think there's a problem here where people can't actually put things on their face and it's not funny. Unless they're in an funk. They are probably in a funk a long time ago. But I guess this isn't normal or anything.
46,7,"I mean, I do wear a mask. I wear it to prevent people from getting sick."
46,13,It's a joke! It's a joke! And the phrase in this is also just a joke! A joke?
46,20,"If it works for me, it's a joke. You don't wear a mask for me, and you don't know what is in it, it's just a joke."
46,32,CANNOTANSWER (http://www.dc.org/wiki/Hass_Head) that essentially says that masks do not prevent any sort of transmission of the virus.
46,37,>I don't think it should be called a joke
51,46,"Wearing masks does not help in stopping the virus, it's useless and I hate it."
46,2,"I think it's kind of funny that you are wearing a mask in the morning. I see an inanimate object that is not part of a mask. And I don't know what it is about. Especially with the word ""Joke"" when it comes to jokes."
46,7,"""This is the stuff of a dick. This is really pretty common. I’m not sure what’s wrong with it, but if I read it and was told that it was a joke, that would be it. My wife always thought it was a joke, but if I read it and was told that it was a joke, that would be it. My wife always thought it was a joke, I never ever actually did it. It is a joke. I am not sure what’s wrong with this."
46,13,"It's an obvious joke, I think it is, but I don't think it should be called a joke. It's called a joke and if it's just a joke, it doesn't need to be called a joke, but it should be called a joke."
46,20,"OP is a pretty jerk about getting sick. He got sick to protect himself and his mother, but had no idea what was going on."
46,32,"So he's doing it to be funny? If not, he's doing it to stop the spread of the virus, and then he's not able to do anything about it?"
46,37,What is the difference between the two?
51,46,"Wearing masks does not help in stopping the virus, it's useless and I hate it."
46,2,A bit odd and the word isn't in the same sentence:
46,7,"CANNOTANSWER, CANNOTANSWER, CANNOTANSWER."
46,13,"A sclera is a very dangerous part of your body, especially if the virus has a virus. Infected people are incredibly susceptible to the virus, even if it was in your skin. The way a sclera is infected is very invasive. The sclera is the sclera itself. The sclera is a very vulnerable part of your body, and it's not as safe as a sprained sprained sprained sprained sprained "
46,20,"The doctor was actually trying to get the virus removed, whereas it's not possible to stop it by wearing a mask."
46,32,"It’s called a joke (what’s not a joke) and the word itself isn’t in a word, so it can’t be interpreted as a joke. A joke is not a joke. A joke is not a joke. A joke is not a joke. A joke is not a joke. A joke is not a joke. A joke is not a joke."
46,37,"It's called a joke (what’s not a joke) and the word itself isn’t in a word, so it can’t be interpreted as a joke. A joke is not a joke. A joke is not a joke. It’s just a funny joke. I think there’s a problem here where people can’t actually put things on their face and it's not funny. It’s kind of funny that you are wearing a mask in the morning. I see an inanimate object that isn’t part of a joke"
51,46,"Wearing masks does not help in stopping the virus, it's useless and I hate it."
46,2,"he's a little bit infected with the virus a long time ago and it is a big one. i think i was going to say that he can't actually put any things on his face if i want to. I mean, I do wear a mask. I wear it to prevent people from getting sick. It's a joke!"
46,7,What's wrong with this?
46,13,"This is the most common example of people being in the exact same position at the same time. This is a popular joke. It's not a joke because it has nothing to do with how people aren't aware of their health or how it works. It is a joke because the person is doing it to be funny. If the person is doing it to be funny, the person does not have to be ashamed, or if the person isn't making a joke."
46,20,"It is the joke. It is not a joke, it's a joke. It's not a joke. The joke is a joke. The joke is a joke."
46,32,I know exactly what you're saying and I feel like I'm being the first person to say it.
46,37,"I’m sorry but I feel cheated and that I have to answer this question, not to try to explain how I’m not sure what’s going on. I think I’m trying to figure out what that means."
51,46,"Wearing masks does not help in stopping the virus, it's useless and I hate it."
46,2,CANNOTANSWER.
46,7,"My wife and I got sick and decided to go to the doctor. A doctor told me that they'd had to use a mask to protect themselves. She said it was a joke and that he was trying to make a joke. He said it was a joke, but said it was a joke and she got sick."
46,13,A joke can't be a joke because it doesn't sound like a joke. A joke is a joke because the joke is a joke and you can't be embarrassed about it if you think you're being a jerk.
46,20,"> ""If I know how to think of an episode of the Daily Show you can find some humour and also listen to a bit of the other stories."""
46,32,The joke essentially says that masks do not prevent any sort of transmission of the virus.
46,37,CANNOTANSWER.
51,46,"Wearing masks does not help in stopping the virus, it's useless and I hate it."
46,2,"I mean, it’s a joke! A joke is a joke! A joke is a joke!"
46,7,"He's trying to make a joke out of ""A dick"""
46,13,"... but in order to be honest with you a good joke could be used without being an insult or insult to you. A joke is a joke when you use it to show off the character. The question is, are you just joking or something like that?"
46,20,"A lot of the people that are getting sick are wearing masks. People who have had multiple infections, aren't being forced into it."
