sender,receiver,message
44,31,"What I’ve found funny is that it’s often called a “virginitis spore” which can be contracted through a filter, a fungus or a parasite. You know, a lot of people aren’t so much a doctor, or a doctor just an allergy freak, or a person who gets infected. It’s a fungus, not a virus."
51,31,"Wearing masks does not help in stopping the virus, it's useless and I hate it."
31,2,"This is a fucking pathetic article, it's the only way to get the word of mouth to your audience."
31,3,I'd rather get a flu shot than wear a mask
31,4,I am a big a hat hat person and I have never seen one that I haven’t worn in months. I am also not sure what you mean by a mask.
31,6,"It’s pretty clear that if he had an ex-fda member, the law wouldn’t have been in his favor, and he’s trying to evade the doctor."
31,7,"CANNOTANSWER: ""I would rather wear a hat. If you put on a hat in the bathroom, there are more spores. it's a lot easier to kill a virus than a mask. They don't have a doctor that teaches or is trained to do that. I don't think the person who does it has any medical experience."", ""I think it's really good that this guy will continue to wear a mask, especially if it's not to protect him."", ""What"
31,16,It's not a good idea. It's a blatant piece of shit. You are insensitive.
31,17,"""What if the CDC gave him a mask to try and protect him, or gave him a vaccine? It is a fictitious and unnecessary piece of nonsense. It’s not a good idea. What I’ve found funny is that it’s often called a “virginitis spore” which can be contracted through a filter, a fungus or a parasite."
43,31,"It's actually pretty cool that in Texas you can wear a mask to be safe. That way, the CDC can impose rules that aren't actually necessary."
44,31,"Vaccines can cause spores that infect others and can cause infection which is very rare. Vaccines can be used as a filter, a fungus or a parasite."
51,31,"Wearing masks does not help in stopping the virus, it's useless and I hate it."
31,2,"CANNOTANSWER: ""I would rather wear a hat. If you put on a hat in the bathroom, there are more spores. it's a lot easier to kill a virus than a mask. They don't have a doctor that teaches or is trained to do that. I don't think the person who does it has any medical experience."", ""..."
31,3,"CANNOTANSWER: ""I am a big a hat person and I have never seen one that I haven’t worn in months. I am also not sure what you mean by ""I just don't feel like it's a good idea."", ""What I am sure you are, but do you mean it isn't an article?"", ""I think that this article"" is a ploy to put some kind of rebuttal in front of the public."
31,4,"I am just not sure why you're on this sub, so what is the point of trying to go for the facts, just to make sure you know what's the point of your post?"
31,6,"I don't know what the law is about, but it would be much worse for him than it would be for anyone in Texas."
31,7,"In Texas, a lot of people aren't even doctors. There are no vaccines."
31,16,"The mask mandate isn’t a requirement, but it was a joke. It’s a mandate."
31,17,"[How To Get a Free Fake Fever Card](http://www.cdc.gov/about/virginia/fraud-fem-fraud/article/agdnp-fraud/index.aspx) is a pseudo scientific term. A person who has been infected with a virus and have been treated with something called the ""fuki virus"" and it's not even considered an illness."
43,31,"[Current) Texas law requires that people wear a mask in cases of an HIV virus, and there is no reason to wear a mask. It means that there is a way to keep people from getting sick from a virus. So it would only be appropriate for a patient to wear a mask. This would make it worse for him."
44,31,There's a guy who grew up with the CDC doctrinal system.
51,31,"Wearing masks does not help in stopping the virus, it's useless and I hate it."
31,2,"""Mask Them."""
31,3,"“In Texas, a lot of people aren’t even doctors. There are no vaccines. The mask mandate isn’t a requirement, but it was a joke. It’s a ploy to put some kind of rebuttal in front of the public."
31,4,"A lot of people don't think it's a good idea, but I can't say I've seen it, so I think I know it's a good idea."
31,6,"I don't see any way the guy is making money by implementing it. I've been to a party with someone that does. It's a funny joke, but the CDC doesn't really want to change it."
31,7,It sounds like the law didn't work out for him and he is not a'real' defender. There are people who could be squishy about it. This isn't an article.
31,16,I think it's a little hard to explain /r/hugpolitics
31,17,"I'm in an extremely close relationship with my bf. I am not a big fan of the CDC. I like the CDC and they have a dissenting opinion on the state's HIV/AIDS system, especially with this guy being infected. The fact that we have no fem vaccination programs shows the lack of knowledge on this topic. We are going to have to wait a few more months for the CDC to approve this legislation."
43,31,""" I'm really sorry, I'm late, but I'll just go with the right one if i need to. I'll just go with the right one if i need to."""
44,31,"Vaccines don't use a specific type of infection. They are a filter for a parasite. There are still many forms. If the CDC has a special class on antiviral drugs, then it doesn't mean they can use any one type."
51,31,"Wearing masks does not help in stopping the virus, it's useless and I hate it."
31,2,You have been tasked with being a scumbag for so long and the article is a ploy to make it seem like this is a good idea.
31,3,"The point of the article isn't to make a joke, it's to make a point about what the law is about."
31,4,"It's all pretty gross and is a great way to explain the CDC and to get their dick out of their ass. That said, I really wish they would change a law to keep the state from taking a position on what to do with the mandate."
31,6,"In all fairness, I’m pretty sure I am pretty sure the CDC wants the ""mah-mah-mah-mah-mah"" to be a requirement for a fem vaccination program, not just a prescription one. If they are actually going to be doing this, I could see them actually having a conversation about the matter."
31,7,"CANNOTANSWER: ""I would rather wear a hat. If you put on a hat in the bathroom, there are more spores. it's a lot easier to kill a virus than a mask. They don't have a doctor that teaches or is trained to do that. I don't think the person who does it has any medical experience."", ""..."
31,16,I feel like my point is that you're insensitive and I don't understand what the title says.
31,17,I have to say this guy is a 'true' scumbag.
43,31,I would rather wear a hat - I 'd rather wear a mask - and I 'd rather be with a hat if that's not necessary.'
44,31,"I'm going to rephrase this for you: ""I have no sense of humor. I don't want to be a doctor, but I want to have a good sense of humor. I just want to be a doctor, so I do not have to be a doctor."""
51,31,"Wearing masks does not help in stopping the virus, it's useless and I hate it."
31,2,"> I am pretty sure I am pretty sure the person who does it has any medical experience."""
31,3,:) This isn't an article.
31,4,"I think that's the part of the article where they're trying to put a joke on the CDC. They're going to have to go back and get some actual information about the vaccine, so they're going to make a movie about it."
31,6,"What about the whole ""Mask the Man,"" which is a joke and is supposed to be a part of a law that has nothing to do with the state's HIV/AIDS system, but instead is about how this guy is trying to get rid of the vaccine?"
31,7,If the federal government is allowed to prescribe antiviral drugs to people in need it is a terrible idea. This is not a question of health care.
31,16,"This was written by a CDC worker, not a senator. He did nothing to end it, he didn't speak about it, and had no experience with the legislation. The only way he was able to do so is to get his insurance to cover some of the symptoms. He also doesn't vehemently support that he could be an agent of a fraud. He's not going to put up with it."
31,17,"""...I feel like my point is that you're insensitive and I don't understand what the title says. I have to say this guy is a 'true' scumbag."""
43,31,"It's not funny, it's the CDC. So yeah, that would make a lot of sense, right? I'd rather be with the right one if I needed to."
44,31,"I'm not a doctor, but I'm a doctor. I've been with people who haven't had a sense of humor. It's almost like the only thing that's funny is a doctor."
51,31,"Wearing masks does not help in stopping the virus, it's useless and I hate it."
31,2,I'm a doctor and I get so excited to see a movie about it. I'm kind of confused about what to do now and then and I can't figure out a way to explain it to you.
31,3,"They are trying to get a doctor to prescribe the vaccine. And what is more important, is that it's the CDC who has a record of doing 'Mask the Man' which is a joke."
31,4,"> [i think his problem with masks is that he's a liar who just doesn't care about making money."""
31,6,"CANNOTANSWER: ""I would rather wear a hat, if you put on a hat in the bathroom, there are more spores. It's a lot easier to kill a virus than a mask. They don't have a doctor that teaches or is trained to do that. I don't think the person who does it has any medical experience."""
31,7,"A guy with a mask, a mask, and no hat will get you sick for life. What you described isn't actually a joke."
31,16,I don't think it is a good idea. I just think it's a bad idea. I don't think the CDC can make a good plan about it for the future.
31,17,It sounds like this is a really hot topic. Why does the CDC apologise to him or sabotage him?
43,31,"I am a professional, so I was on a medical plane to be able to help. I don't know if I could get sick by myself because my health sucks, but I could handle the discomfort of the idea of going to the doctor. I am sorry but I just can't do it because I can't."
44,31,"CDC: (https://www.cdc.gov/about/virginia/napaloza/publications/virginia-fraud-fem-fraud/index.aspx) is a pseudo scientific term. [As in, 'I’m not a doctor, but I’m a doctor. I’ve been with people who haven’t had a sense of humor. It’s almost like the only thing that’s funny,"
51,31,"Wearing masks does not help in stopping the virus, it's useless and I hate it."
31,2,"“As in, 'I’m not a doctor, but I’m a doctor. I’ve been with people who haven’t had a sense of humor."
31,3,"The joke would have to be to get a sex test, which would be done by the state doctor."
31,4,>(https://www.cdc.gov/about/virginia/napaloza/publications/virginia-fraud-fem-fraud/index.aspx) is a pseudo scientific term.
31,6,That's exactly what I'm trying to say.
31,7,"I can understand that if the CDC would have been able to prescribe a vaccine and not the doctor, they would have gotten sick."
31,16,"> They’re going to have to go back and get some actual information about the vaccine, so they’re going to make a movie about it. What about the whole ""Mask the Man,"" which is supposed to be a part of a law that has nothing to do with the state’s HIV/AIDS system, but instead is about how this guy is trying to get rid of the vaccine? If the federal government is allowed to prescribe antiviral drugs to people in need it is a terrible idea."
31,17,It's really not a topic. It's about the people trying to be a liar and making a joke. It's not a very good idea. It's a pretty good thing they're trying to get him to become a doctor. But it isn't that they're being sarcastic.
43,31,I've never heard of a woman wearing a mask because her hair has a tiny little bump on it.
44,31,"Vaccines are not meant to be used for a specific purpose. They can cause spores that infect others. Vaccines aren't meant to be used for any specific type of disease, like a virus, infect others, or a parasite. Vaccines aren't meant to be used for any specific type of disease. Vaccines aren't meant to be used for a specific type of disease, like a virus, infect others, or a parasite."
51,31,"Wearing masks does not help in stopping the virus, it's useless and I hate it."
31,2,"''Sometimes I think it's pretty funny'', but I've never had any time to see it, so I don't want to see it, and I'm not sure how I feel about it, so I don't want to censor it's just that I think the CDC isn't going to go ahead with it because I'm a medical professional, and I'm not sure how the CDC can do anything if there is an article about the mask mandate or not, but to put it to the film and explain it to me"
31,3,What's the difference between a mask and a hat?
31,4,>(https://www.cdc.gov/about/virginia/napaloza/publications/virginia-fraud-fem-fraud/index.aspx) is a pseudo scientific term.
31,6,He's trying to do something with an ex-fda member. The thing is that the state doesn't have any medical training. The mask mandate is to stop people from getting sick. Vaccines aren't meant for that exact purpose. They're meant for the purpose of prevention.
31,7,I really don't think it's good to go back and try to explain it.
31,16,"As long as it’s in a public place with public health, it would be a lot of work."
31,17,> I get so excited to see a movie about it. I'm kind of confused about what to do now and then and I can't figure out a way to explain it to you.
43,31,"No, a person who doesn't have a mask will have to wear a mask unless they have a mask, but that's not a legitimate reason to wear a mask. If you don't have a mask, why do you wear a mask in the bathroom?"
44,31,"Nope. I'm just stating that, if you have a sex disorder, you need to tell a doctor about it. In most states that can be a symptom of viral or intestinal microbial infection, and that the virus isn't infected."
51,31,"Wearing masks does not help in stopping the virus, it's useless and I hate it."
31,2,"A lot of people do not realize the point of a mask, compared to a hat."
31,3,That's my personal favorite.
31,4,The CDC is trying to get the state to adopt a vaccine and to keep the people in need of the vaccine from getting sick.
31,6,a lot of the people who are trying to avoid the law will be ignoring it in a lot of ways.
31,7,"I think he sat down and said, ""Well, I'm so sorry about that, but I can't help it."
31,16,It’s like a good thing because it makes it seem like the best choice to protect yourself. You can’t protect yourself from the world without the mask. That’s not a good idea.
31,17,"I have some very interesting advice. The person who is trying to get rid of the mask mandate, not the guy, has been wrong. The person is wrong about this, so I don't understand how he is trying to get rid of a statewide mandate."
43,31,It's a joke. I think it's a joke.
44,31,"The CDC does not have a specific class on antiviral drugs. The CDC is only used for the treatment of virus infections. If I had to look it up on the CDC I would have to report it to the CDC and have it reviewed and reviewed. I would be very surprised if it was that much of a hassle, especially considering how much the CDC is currently involved in the field of HIV prevention."
51,31,"Wearing masks does not help in stopping the virus, it's useless and I hate it."
31,2,Why does a doctor have to wear a hat to prevent the CDC from trying to find an excuse?
31,3,The movie is a joke and a joke is a joke.
31,4,I've seen the article but don't think it's a great way to explain it to people. They're simply trying to justify a mandate by giving the GOP a power grab and not a fight.
31,6,I'm not sure I'm sure you're wrong. I'm not sure you're right.
31,7,I think it's a joke to make him wear a mask in the bathroom.
31,16,"There are other people that are mentioning it on here, but it's still one of those things I'm imagining in this movie."
31,17,"This is a lot like saying you need to suck a smear at the end of a song. You've gone through it and its not just the mask smear, it's the wording. And you've listened to the lyrics, you should read them."
43,31,I think you need to tell this to my boyfriend
44,31,"The CDC is using it as a treatment for HIV infection, but has never been able to use it for that purpose. It has always been used in this way."
51,31,"Wearing masks does not help in stopping the virus, it's useless and I hate it."
31,2,"They are not obligated to implement the ""Current and Proposal"" of the Act or a ""Mask Them"" to prevent a CDC mandate to implement a federally mandated HIV vaccine. That's not a ""Mask them""."
31,3,"I don't think the article is a ploy to explain the law, but I don't think any of the comments in this post are misleading. There are other articles on this topic that may have a better title. It's called Making the Man.'' It's a joke because it's the one article on the CDC which gets a lot of downvotes."
31,4,"You are right, but you are being a dick. It sounds like a lot of people don't realize the point of a mask. That's my personal favorite. The CDC is trying to get the state to adopt a vaccine and to keep the people in need of the vaccine from getting sick. A lot of the people who are trying to avoid the law will be ignoring it in a lot of ways. I think he sat down and said, ""Well, I'm so sorry about that, but I'm not sure what you mean by a mask"
31,6,"What a bad joke. I'm just pointing out that I like this movie, but I don't really think it's a very good example of a joke."
31,7,The article is in the wrong context. It's not about making a joke. The article is simply trying to justify a mandate by giving the GOP a power grab.
31,16,It's an idea that will fuck with the GOP in the future. This is the most controversial and dangerous topic in the history of the United States.
31,17,"""""I'm in an extremely close relationship with my bf. I am not a big fan of the CDC."""","""
43,31,Vaccines aren't intended to protect someone. They're not intended for them. It is a type of vaccine that's been found to be effective against an infection. And it is not meant to prevent a specific type of disease.
44,31,"People who think they're having a sense of humor do so because they're aware that they don't want to be a doctor, but because they're not a doctor."
51,31,"Wearing masks does not help in stopping the virus, it's useless and I hate it."
31,2,I would rather just go to a party and watch this movie and read it.
31,3,"I don't think it's wrong to just say ""I like the part when he got covid but still had events with people and how he did it for people and he got elected. I think the guy got his own agenda...', ""I like the part when he got covid but still had events with people and how he did it for people and he got elected. I think the guy got his own agenda...', ""I think the guy got his own agenda...', ""I think the guy got his own agenda...'"
31,4,Why does a doctor have to wear a hat to prevent the CDC from trying to find an excuse? The article is in the wrong context. It's in the wrong context.
31,6,"It's not like the title is ""Jake for the day"" because it was a joke."
31,7,A lot of people aren't even doctors. There are no vaccines and the government isn't mandated to prescribe them. They have to find one that works for the people they don't know. It has no meaning.
31,16,"You need to tell the Senators, as well as the governor and senators what to do with the health care bill this isn't a joke at all."
31,17,You're trying to make a joke about this movie. You're trying to make a joke about the fact that people are trying to get a vaccine that they know nothing about. It is just a joke.
43,31,I think it is very good that he's going to have a friend go to the CDC and have him wear a mask.
44,31,Vaccines can kill viruses. Those are not parasites. They are not infectable.
51,31,"Wearing masks does not help in stopping the virus, it's useless and I hate it."
31,2,> I would rather just go to a party and watch this movie and read it. I would rather just go to a party and watch this movie and read it.
31,3,There's a premise:
31,4,"I don't know why you are being a dick, but I can relate to this story better."
31,6,I think the title is inappropriate because of the subtext of the post.
31,7,This is a good piece of information.
31,16,If he was not sick he could have done his job without a mask because there are no insurance plans that cover that.
31,17,> It’s a pretty good thing they’re trying to get rid of a statewide mask mandate.
43,31,"""CanNOTANSWER : ""...A person who has a virus that has been infected doesn't have to wear a mask, so as to have to wear a mask when it resides in the area."""
44,31,"I don't really get it, but it is certainly true and would be hard to put it down to someone who doesn't have a sense of humor."
51,31,"Wearing masks does not help in stopping the virus, it's useless and I hate it."
31,2,"The ""Disagreement"" Act was passed by the governor, so this is what they want to do."
31,3,CANNOTANSWER.
31,4,"""I really wanted to see that because it’s so virulent that people don’t have to wear a mask every time I go to a party. I’ve never seen a virus."""
31,6,"Is this the ""A lot of people aren't even doctors."""
31,7,"That is probably not a good idea, but I also don't know how you're not going to like the premise of the article. The premise is very vague, and the subtext of the post is irrelevant. Is this what you're talking about?"
31,16,It is a fictitious and unnecessary piece of nonsense. It's a bad idea.
31,17,Is there a political affiliation in this matter?
43,31,"A new CDC study suggests that the health care worker is the type to make a mask for the risk of getting infected by HIV and therefore need to have a mask for a while. If the virus is spread and he is wearing a mask, and he doesn't get infected, it could be a way to stop he's getting infected if he has the right mask if he does wear a mask."
44,31,Vaccines can kill viruses. Those are not parasites. They are not infectable. Vaccines are not meant to be used for a specific type of disease. It's a joke and a joke is a joke.
51,31,"Wearing masks does not help in stopping the virus, it's useless and I hate it."
31,2,"I see a lot of people with HIV, especially in the US, who don't have the skill or experience to put on a mask in a public place or to carry around it."
31,3,I'd rather see the movie than the article
31,4,"""It sounds like a lot of people don't think it's a good idea. Is it a good idea, but I don't know how you are not making a valid point. The article's subtitles are misleading. Are you sure that the CDC wanted to force the state to adopt a statewide mask mandate?"", ""The article's subtitles are misleading. Are you sure that the CDC wanted to force the state to adopt a statewide mask mandate?"", ""Is it a good idea, but"
31,6,I think this is pretty cool.
31,7,"""This is a good piece of information."
31,16,"Is this what you're talking about? The CDC isn't trying to change the law, and it's not like people are trying to change it. They are trying to change it."
31,17,CANNOTANSWER.
43,31,This is a very unhelpful and stupid question. It's a joke that it's a joke. It's not meant to protect anyone. They're not meant to protect anyone. They're not intended to protect a specific type of disease. Vaccines aren't intended for people with a specific type of disease. Vaccines aren't intended to prevent a specific type of disease.
44,31,"I can't even think of anything to explain to you what a CDC statement is. I just want to let you know, I know, I don't want to be in the future and I'm not sure if there is an alternative but I'm sure the government is gonna do a good job of bringing this up and hopefully to fix it."
51,31,"Wearing masks does not help in stopping the virus, it's useless and I hate it."
31,2,"It sounds like this was just a joke, it could have been a joke, or that they just wanted a new mandate for HIV. Then there was a debate about whether he needed a mask on because he was afraid of putting a mask on."
31,3,"It's very good to know that the people 'know' about it are actually talking about it - not some kind of 'informed' idea. The article's subtitles are misleading, and are misleading because it doesn't appear to mention anything about the actual situation. There are a lot of things that are actually related to that. It's more like how ""I'm just curious"" I've heard in the past, but that's it. What it says is that the CDC can't mandate statewide. 'Mask the Man'."
31,4,a mask mandate has a negative connotation.
31,6,"I think the ""Mask the Man"" joke in the movie was funny because it shows what a joke it is. But the movie itself isn't. That's not a joke."
31,7,"""I just want to let you know, I know, I don't want to be in the future and I'm not sure if there is an alternative but I'm sure the government is gonna do a good job of bringing this up and hopefully to fix it."""
31,16,"I read an article about this and the CDC is denying the mandate. They do not give the mandate to people based on their experience. If they do, the mask mandate would be a bad idea if they had the experience. You can't ask the doctor for a mask if he does not have an experience in the health care field."
31,17,CANNOTANSWER.
43,31,It is a joke. It is a joke. A joke.
44,31,There is a great bit of history of doctors not being able to get the vaccines used correctly.
51,31,"Wearing masks does not help in stopping the virus, it's useless and I hate it."
31,2,"I'm glad it got to the point. I am pretty sure that I understand the CDC is not going to let it go to the state, and that the idea is what's happening, not that it's really going to happen in the future."
31,3,“Can you help me read this?”
31,4,"""I just want to let you know, I know, I don't want to be in the future and I'm not sure if there is an alternative but I'm sure the government is gonna do a good job of bringing this up and hopefully to fix it."""
31,6,"No, I'm not an expert, but it's a good reference."
