sender,receiver,message
31,7,That's because the CDC is not mandated to prescribe antiviral drugs. They don't prescribe the drugs based on the patient's health. Those types of drugs are not safe.
31,16,CANNOTANSWER. This is a very unhelpful and stupid question. It's a joke that it's meant to protect anyone. They're not meant to protect anyone. Vaccines aren't intended for people with a specific type of disease. Vaccines aren't intended to prevent a specific type of disease. Vaccines aren't intended to prevent a specific type of disease. Vaccines aren't intended to protect anybody. Vaccines aren't intended to prevent infection.
31,17,This is a pretty good thing.
43,31,I'd rather have a hat with a mask.
44,31,A doctor who goes to the doctor that carries the vaccines and who uses them for a particular type of disease is not going to get it.
51,31,"Wearing masks does not help in stopping the virus, it's useless and I hate it."
31,2,> Having a mask in the bathroom is a very dangerous way of killing someone. The vaccines aren't meant to prevent someone with HIV/AIDS/Asthma. Vaccines aren't intended to protect anybody. Vaccines aren't intended to prevent any type of disease. Vaccines aren't intended to protect anybody. Vaccines aren't intended to protect anyone.
31,3,The point of the article is that they do not give the mandate to people based on experience.
31,4,"""I just want to let you know, I know, I don't want to be in the future and I'm not sure if there is an alternative but I'm sure the government is gonna do a good job of bringing this up and hopefully to fix it."""
31,6,"""It sounds like this was just a joke, it could have been a joke, or that they just wanted a new mandate for HIV. Then there was a debate about whether he needed a mask on because he was afraid of putting a mask on."""
31,7,"You're not a doctor, you're not a doctor. They need to have an expert in vaccination, and the CDC has to prescribe a certain amount of antivirals based on that, but what the CDC does doesn't have."
31,16,"i know what I'm talking about. i can understand how you're not going to understand what I want you to say, but there is no other way you are going to understand what I'm talking about. but I don't know what is sarcasm. it's a joke. it's a joke."
31,17,"CANNOTANSWER. It sounds like this was just a joke, it could have been a joke, or that they just wanted a new mandate for HIV. Then there was a debate about whether he needed a mask on. Then there was a debate about whether he needed a mask on. Then there was a debate about whether he needed a mask on."
43,31,Vaccines aren't intended to prevent people. They're not intended to prevent someone with an infection. Vaccines aren't intended to prevent people with a specific type of disease.
44,31,"So you are describing a situation of people getting infected, but you are referring to a medical condition which is a combination of infections from various types."
51,31,"Wearing masks does not help in stopping the virus, it's useless and I hate it."
31,2,"I think the problem with this movie is that people who are so indifferent are not able to 'get a hat'. The CDC wants a mandate and it's really not an actual solution, so it's hard to say what would have happened if it was passed and if it would have worked. But it's a pretty good movie, and it's a great example of how if the government did want to get an antiviral mandate, they should just change the rules and ban him. It's not going to work if he's"
31,3,>A hat person who goes to the doctor that carries the vaccines and who uses them for a particular type of disease is not going to get it. Vaccines aren't intended to prevent people. Vaccines aren't intended to prevent people with a specific type of disease. Vaccines aren't intended to prevent someone with a specific type of disease. Vaccines aren't intended to prevent anyone with a specific type of disease. Vaccines aren't intended to prevent
31,4,>He's trying to justify a mandate by giving the GOP a power grab and not a fight.
31,6,A hat and masks aren't a bad idea. They're not intended to prevent people from getting sick. They're meant to prevent people from getting sick from them. And they're not designed to prevent people from getting sick from someone.
31,7,">A lot of people aren't even doctors. There are no vaccines. They don't have a doctor that teaches or is trained to do that. I don't think the person who does it has any medical experience."""
31,16,So what does this article say?
31,17,"If you can't get rid of the mask mandate, it will just start with the mask being put on the person you've gotten sick by being infected."
43,31,"In the context of this article, the CDC says that in some states, the CDC's guidelines for removing a mask for a patient are fairly stringent."
44,31,They say that a CDC-approved fungus vaccine isn't meant to be used in general as it can be used for any type of infection if that's the case. It may or may not be a very good idea for your health.
51,31,"Wearing masks does not help in stopping the virus, it's useless and I hate it."
31,2,CANNOTANSWER. > Having a mask in the bathroom is a very dangerous way of killing someone.
31,3,This is the first of a series of articles that will go a long way to explaining how to protect your body when a person gets infected.
31,4,"I think it's very unlikely that the CDC will take the issue at face value. However, if the idea of the mask mandate is actually being considered in Congress, that's unlikely, especially since we are talking about the federal government's stance on HIV/AIDS."
31,6,"""I don't want to be a doctor. And I don't think the person who does it has any medical experience. They don't have any medical experience. They don't have any medical training. Vaccines aren't intended to prevent people from getting sick from them. They're not designed to prevent people from getting sick from them."""
31,7,>[Landlord of the Rings](http://www.noasc.gov//r/PhD/hhs-nld/) is the first and only written opinion that can be backed up without a citation on their part.
31,16,"Yes, it's a joke that can help people with HIV, HIV/AIDS. I don't think there is an option for the right. It's a joke. You could have used a mask that was just a joke."
31,17,"If it was just a joke that has nothing to do with any kind of infection that could potentially have an effect on your health, it's a terrible joke."
43,31,>The joke itself is not a joke. It is about a joke. It is about a joke.
44,31,Vaccines don't work well as a treatment for any type of infection. They can be used as a filter for a parasite. The fact that it's not infectable and isn't infectable. They aren't infectable.
51,31,"Wearing masks does not help in stopping the virus, it's useless and I hate it."
31,2,"I think the problem with this movie is that people who are so indifferent are not able to 'get a hat'. The CDC wants a mandate and it's really not an actual solution, so it's hard to say what would have happened if it was passed and if it would have worked."
31,3,"If you don't like it, just wear it."
31,4,"I'm just trying to figure out how they got the word ""shade"". ""Why isn't a mask supposed to help someone? """
31,6,[NAME] was the lead counsel for a bill that mandated people to wear a mask and have it removed from the fem vaccine program. It is being introduced to those who need to be in a mask to prevent people from getting sick. Is this an example of a joke that goes beyond just having a mask? [NAME] is a doctor.
31,7,"I love the movie a lot, but this is very different."
31,16,It's not a joke. The idea is to put people in a mask. This isn't about infecting others. This is about how to spread the virus from the government to whoever is in need.
31,17,[NAME] is a young conservative who was raised in a conservative home. He's a big fan of the government.
43,31,"""I'm a good doctor, but I just can't bear to have to wear a hat when I'm in danger of getting sick.'"""
44,31,I don't get it. The CDC is claiming that 'every virus is not infectable' as a general word to be used in a doctor-approved form.
51,31,"Wearing masks does not help in stopping the virus, it's useless and I hate it."
31,2,I feel a lot more comfortable with that quote.
31,3,"[Two new categories for this,](http://www.noasc.gov/r/PhD/hhs-nld/)"
31,4,">the mask mandate is illogical. It is not a law and it was actually signed by a governor in the past. So they went ahead with it."""
31,6,>How do you know what the idea of the 'Mask the Man' is about?'
31,7,CANNOTANSWER. CANNOTANSWER
31,16,It is one of the most controversial and deadly topics ever debated on reddit and the topic of a presidential campaign.
31,17,"No, I don't understand why that is. It sounds like a joke that isn't actually a joke. And if I are making it, the title is a good place to start."
43,31,"I would rather wear a hat, especially if it's not necessary. It's not about a joke."
44,31,Vaccines aren't meant to be used for any specific type of infection. They aren't meant to be used for any specific type of infection.
51,31,"Wearing masks does not help in stopping the virus, it's useless and I hate it."
31,2,I see a lot of people who don't have a sense of humor.
31,3,CANNOTANSWER. This is one of the most controversial and deadly topics ever debated on reddit and the topic of a presidential campaign.
31,4,">What do you mean ""shade""? It’s an impotent opportunist mask that you wear to a party. You do that, not a mask. Wearing masks does not help in stopping the virus, it’s useless and I hate it. I hate that this isn’t an article."
31,6,"What are the major areas of the CDC's interest? I hate that a joke like this would be called ""'How do you know what the idea of the 'Mask the Man' is about?''"
31,7,CANNOTANSWER (president)
31,16,"That's a really good idea. I can see that you think the idea of going to a party with the mask mandate is a joke, but I feel like this sucks, especially if you're not a conservative. You're not a fan of the CDC and you're more of a Republican."
31,17,CANNOTANSWER: CANNOTANSWER.
43,31,Why does the guy have to wear a mask?
44,31,It’s the worst joke I’ve ever heard. I’m actually glad someone has a sense of humor.
51,31,"Wearing masks does not help in stopping the virus, it's useless and I hate it."
31,2,I agree that people who want to protect the public should have an awareness campaign about this. But the message to people with HIV and AIDS that this is going to happen is incredibly distasteful and makes a lot of people question what to do.
31,3,CANNOTANSWER. (I'm actually glad someone has a sense of humor. Vaccines aren't intended to prevent people.
31,4,It's a statewide mask mandate because of a CDC policy.
31,6,i feel a lot more comfortable with that quote. [https://www.noasc.gov/r/PhD/hhs-nld/)
31,7,"There is nothing wrong with a hat. There are no vaccinations. There are vaccines that are based on the patient's health. Vaccines have been proven to kill over 1000 different types of diseases, not to mention they are much more dangerous."
31,16,"Because I'm going to use the word ""shade"" to express my opinions to the people who say this. The one thing I know that I know of is how many people who have sworn out HIV/AIDS to be infected. What's more, I can't get any of those people to do anything. I just want the guy to know I can't do anything. I have a point. I think it's a very funny line to be used for."
31,17,I'm a Republican. But I'm not a Republican. I am a republican.
43,31,This is not an idiocy. It's a joke. It's a joke....
44,31,">What I've found funny is that it’s often called a “virginitis spore” which can be contracted through a filter, a fungus or a parasite."
51,31,"Wearing masks does not help in stopping the virus, it's useless and I hate it."
31,2,"Then the party gets dragged around, the CDC can decide if it's safe to show a few photos, or if it is worth going to a party."
31,3,"It's a joke to not apply the mask mandate to the health care industry. They can't mandate a mask because it's too much of a joke. I'd rather have a hat, if not a hat."
31,4,"I don't want to call a man with HIV a dick, because I can't even put on a mask."
31,6,It's really not funny because of that. It's actually quite funny.
31,7,"""We have an expert in vaccination. They don't have a doctor that teaches or is trained to do that. I don't think the person who does it has any medical experience."""
31,16,"What's your point? The only good idea for me is to go with someone who's not a conservative and thinks it's bad idea for them to be able to do their job. I'm a big fan of their work, and I'm willing to take the lead in this."
31,17,"He is trying to get rid of the mask mandate, but he cannot vouch for it."
43,31,"'. ""Well, because you are a dick, but I don't understand the ""why not wear a mask"" part of it."""
44,31,It's been said that these pseudoscientists are putting themselves in a situation where they know how much they need to be in a certain type of situation and then going to a doctor in a specific field to diagnose and treat a virus. So...
51,31,"Wearing masks does not help in stopping the virus, it's useless and I hate it."
31,2,"They aren't allowed to mandate the CDC to administer any vaccines. They can't. It is, and it is, a ploy to do so."
31,3,"What's a joke, the article says, is about the mask mandate, not the health care industry."
31,4,"i hate people who are trying to get sick, but they have not seen any symptoms."
31,6,As a guy who has a great sense of humor and is a liberal I don't know what to say to you.
31,7,So this guy can't do anything.
31,16,They can't mandate a mask on a hat unless they want to but that's a completely different story. I don't think I will ever wear a mask because I know it wouldn't prevent a virus and if I could I'd be able to tell you something better about how it works. I'm not saying you should wear a mask for your infection but that the whole idea of wearing a mask is ridiculous. It's a joke.
31,17,Are you a fan of him? 'I don't even want to know who you are.
43,31,"I think it's more a joke that people don't like, because it can't be used for other things."
44,31,Vaccines are a type of antiviral drug and thus not infectable. They can be used for any type of disease.
51,31,"Wearing masks does not help in stopping the virus, it's useless and I hate it."
31,2,A hat would be more suitable to do than a face mask. Those are not hats for me.
31,3,"I would say that the guy is the reason why we should not go to a party, which I really don't see why anyone would wear a mask. I'm surprised that that isn't the case in Texas - just the fact that that person seems to have a lot of dicks on the hands - as long as it has a doctor and you are willing to let him wear a mask because he has been doing it for a long time. Basically, why would he wear a mask for a public to see if there were enough people"
31,4,"I think he was trying to justify a mandate that wouldn't apply to a state, but he had a point."
31,6,"I think the headline is more of a joke that says ""I like the movie, but I don't like this movie"". ""I like the movie, but it's not that great. I think it's really good. I'm just pointing out that I'm not a fan of this guy's work, and I'm willing to take the lead in this."""
31,7,"You have to give the guy a little context: If a mask mandate were passed in the past, he wouldn't have to be a physician, or a doctor, or even a doctor. So, a mask mandate is a joke. I don't know how much of it is written in English."
31,16,I can't get you to vote for it because I'm against having this nonsense.
31,17,"I've been bitten by two different viruses, but I can tell you this is not the same thing."
43,31,"If you wear a hat, the CDC will send you to a doctor that can perform an EST test and you'll be able to tell who a good doctor is, who an EST test and what not. I don't have a lot of information about the EST test, but I know that it is about a particular type of infection. It's a joke because it is meant to protect people from getting a viral infection, and that's it."
44,31,">It’s just like the only thing that’s funny is a doctor. I’m not so much a doctor, but I’m a doctor. I’ve been with people who haven’t had a very good sense of humor."
51,31,"Wearing masks does not help in stopping the virus, it's useless and I hate it."
31,2,"I think the question that you're asking is what's going to work, and what it's going to cause. And the question that you're asking is what's going to work, because it doesn't need to be a political problem."
31,3,"ah, my bad."
31,4,"This isn't a good article, it's a joke."
31,6,I don't think you understand how the joke isn't a joke at all. It's a joke to use in a joke.
31,7,"""State legislatures have been doing a lot of stupid things, but if we're going to pass a law about something else, we're going to have to pay for it"" (http://www.gov.tx.gov/r/PhD/hhs-nld/)."
31,16,"It doesn’t look like that would be a good idea, but it’s a good idea."
31,17,It’s not a joke. It’s a joke. It’s just like saying you can’t do a good job of protecting yourself from HIV and getting sick. Viruses can be used for all sorts of things. They don’t need to be on your hands and have spores or staph on your hands. If you don’t want to be on your hands you can’t.
43,31,It's about a joke.
44,31,Is there a reason to wear a mask to stop an infection? The CDC says so.
51,31,"Wearing masks does not help in stopping the virus, it's useless and I hate it."
31,2,"The movie is about this guy, his experience with HIV. That hat is funny, but the CDC is not going to enforce it unless it was passed by the governor he is trying to get through the Congressional body that was requesting it."
31,3,I like the part when he got covid but still had events with people and how he did it for people and he got elected. (http://www.noasc.gov/r/PhD/hhs-nld/)
31,4,"""What do you mean? It’s an impotent opportunist mask that you wear to a party. You do that, not a mask. Wearing masks does not help in stopping the virus, it’s useless and I hate it. I hate that this isn’t an article."""
31,6,"A lot of people don't like the joke, but there are a lot of people who do, and I'm sure aren't. It's been really good, and even I don't think it's a joke."
31,7,"I am not sure which one you are calling it. But the fact is, you are using the'slasher' for the first few lines:"
31,16,There is no “good” or “bad” idea here. There is “good” or “bad” in the definition of “good” or “good” which would be the term that we would use to describe a medical condition as a health condition and not just a disease in that particular region.
31,17,"I just want to thank a bunch of people who have been infected with HIV for sharing their stories, and especially in the past few years that they've had to give me a second chance to get their information, and they have a lot of insight into HIV/AIDS."
43,31,I am a bit confused and curious.
44,31,Because a doctor isn't a doctor. A doctor is a chemist who has been on the CDC's board for 10 years.
51,31,"Wearing masks does not help in stopping the virus, it's useless and I hate it."
31,2,"I read this and I have a friend who is HIV positive who has a hat on. The part with the mask in the bathroom is ""so, yeah, it's a good idea."" He is a doctor, I know it's a good idea to wear a hat, but I am also a medical professional and the guy who is the best person to know how to do it. It seems like a joke, but I'm still really confused as to why I'm so baffled at the idea. I'm the kind of guy who's"
31,3,"“If you can’t use a mask, you can’t.”"
31,4,"I'm not sure what you're trying to say. I'm not sure what you're trying to do. If you mean ""I like this movie but I'm not sure what you mean by it?"""
31,6,It is a joke because I'm gonna point it out. You don't even have to know what a joke is. You don't know anything about how a CDC commie thinks you should put on a mask if you want to be a doctor. You don't have to tell me something or do anything for fun. It's not a joke. It's a joke. It's a joke.
31,7,"I don't know if it's a joke. The implication for the paragraph is ""I don't think it's a good idea, but I don't think it's a joke"""
31,16,"The CDC and the Republican Party both seem to have made it clear that they aren't interested in what the new bill would be about. In fact, it's a joke."
31,17,I'd call his mask infesting a tin foil. I would also call the mask infesting a smear.
43,31,">I think it's pretty cool that in Texas you can wear a mask in cases of an HIV virus, and there is no reason to wear a mask, especially if it's not to protect him."","
44,31,"I have no idea what this is about, but I've been on the board of directors for a while."
51,31,"Wearing masks does not help in stopping the virus, it's useless and I hate it."
31,2,"Vaccines aren't designed to protect anyone, unless it's to protect your partner or family member."
31,3,I think the article is misleading and misleading.
31,4,"There is no need for a dick to hat, not a hat, no matter what it is."
31,6,It sounds like he's a fucking idiot.
31,7,----------------------------------------------------------------------------------------------------------------------------------------------------------------------------------------------------------------------------------------------------------------------------------------------------------------------------------------------------
31,16,"In the current system, a mask is no longer needed."
31,17,"So, let's call it a joke."
43,31,I'm gonna say that a lot of my friends are sick of it. I've seen the people who have the virus in their face. I just don't think it is funny and it is actually funny.
44,31,This is the joke I was making.
51,31,"Wearing masks does not help in stopping the virus, it's useless and I hate it."
31,2,A lot of people have the issue with the state being able to get through their elected representatives and then get caught on camera with them?
31,3,"The CDC also tries to revert some of its stances to ""not a joke"". This is also a joke in the context of ""I hate the law and I can't keep myself from saying that it's wrong"" which is why they would be trying to make a joke."
31,4,I think the guy is trying to make a joke of something that can be used by someone who is also a medical professional. It doesn't make sense that a hat would be used by someone who has HIV but that would be a legitimate reason to put it on.
31,6,This is what I was gonna say.
31,7,">In Texas, a lot of people aren't even doctors. There are no vaccines. They don't have a doctor that teaches or is trained to do that. I don't think the person who does it has any medical experience."""
31,16,I think a lot of people are just misinterpreting the text. The headline seems to be misleading and I'm just being polite and honest.
31,17,I really dislike what people make of him because I believe the CDC and a lot of people who support him do not know about AIDS.
43,31,"A lot of people are on the wrong side of the coin. The idea of a mask is a bit ridiculous, it's actually been around for years, there is no medical knowledge of it, but it seems like a good idea."
44,31,"Vaccines aren't meant to be used for any specific type of disease,"
51,31,"Wearing masks does not help in stopping the virus, it's useless and I hate it."
31,2,"Why are they trying to say this to you, that this guy has been sick since he has been diagnosed?"
31,3,It's a joke.
31,4,">the idea of a mask is a bit ridiculous, it's actually been around for years, there is no medical knowledge of it, but it seems like a good idea. Vaccines aren't designed to protect anyone, unless it's to protect your partner or family member. I think the article is misleading and misleading. There is no need for a dick to hat, not a hat, no matter what it is. It sounds like he's a fucking idiot."
31,6,">I think it's pretty clear that if he had an ex-fda member, the law wouldn't have been in his favor, and he's trying to become a doctor. And the CDC can't really make that choice."
31,7,"If you ask me, I know exactly how many states a mask mandate is. I have been to one state. I can't even imagine this man doing a single thing, it's ridiculous. ::"
31,16,The first two parts of the article are misleading. There's no such thing as a mandate.
31,17,"The phrase is ""In my opinion, you need to stop using the term ""shade"" and start by trying to avoid the word ""shade"" and you need to think about the other terms like ""a good mask does not prevent a person from getting sick, it is useless and I hate it."" (https://www.cdc.gov/about/virginia/fraud-fem-fraud/article/agdnp-fraud/index.aspx)"
43,31,"CANNOTANSWER : ""... Vaccines aren’t meant to prevent people from getting sick, it isn’t meant to prevent people with a specific type of disease. Vaccines aren’t intended to prevent a specific type of disease. Vaccines aren’t meant to prevent a specific type of disease. Vaccines aren’t meant to prevent a specific type of disease. Vaccines aren’t meant to prevent infection. Vaccines aren’t meant to prevent people with a specific type"
44,31,"I think people aren't gonna think that vaccines are for viruses, but for any disease. If they can be used for other types of infections, they won't need a specific type of vaccine."
51,31,"Wearing masks does not help in stopping the virus, it's useless and I hate it."
31,2,You're using an assumption that the CDC actually has any statutory right to enforce the mandate. I would argue that the CDC is a bad idea. You're ignoring this whole thing as you are ignoring it.
31,3,The CDC doesn't have a mandate. This is an advertisement for something that isn't being funded by the government. It's only a means to encourage an effort to educate and educate people to get in and out of those situations and not just be a joke.
