sender,receiver,message
46,20,"A lot of jokes are made about getting sick. Often times when you get sick, you get sick - and it's because you get sick, which is a funny story. So it may not be a joke or any kind of joke but it can be interpreted as a joke or something. So I like it when people put on their masks to scare people into doing something that's a joke and isn't actually funny, but I'd be upset if it were not for the dc and would be an awesome joke to a joke and I'"
46,32,"IANAL. I think the ""hunch of snooping"" is an excellent example of a joke because it doesn't sound like a joke."
46,37,I think a joke is a joke when it's a joke if it's a joke.
51,46,"Wearing masks does not help in stopping the virus, it's useless and I hate it."
46,2,I have a problem with this stuff and a lot of people in my family. I'm always in pain about it. It's not a joke. It's not about being funny and I'm trying to be nice to everyone. It's a joke.
46,7,"I'm sorry to hear that. I don't think I've seen any of these words before. It seems that a joke is about the fact that people are always expressing something and it doesn't make sense. The jokes aren't made for being funny, but rather the fact that people don't make jokes and they're just being shit when they are really upset about being offended. This isn't about the person being offended, it's about them being offended that the joke is not funny."
46,13,He was trying to explain to the viewer that he doesn't feel the need to tell a joke and if he was having an inflammatory reaction he wasn't.
46,20,"I've had multiple narcotics, but not every one of them is actually as good as a mask I've had from a friend."
46,32,"> ""I’m just glad you were able to tell me that you've already told a lie that is true. You’re right he did that to protect other people and he did so to make his own choices on his own."""
46,37,"I'm really sorry to be an asshole, but I know there's not much to tell about the article, and the general sense that a joke isn't a joke to make fun of a person without permission is completely ridiculous."
51,46,"Wearing masks does not help in stopping the virus, it's useless and I hate it."
