sender,receiver,message
46,32,[(http://www.dc.org/wiki/Hass_Head) that essentially says that masks do not prevent any sort of transmission of the virus.
46,37,I'm so sorry. It doesn't sound like a joke. It's just a joke. A joke is not a joke. A joke is not a joke. A joke is a joke. It's just a joke. It's not a joke. A joke is not a joke. A joke is not a joke. A joke is not a joke. A joke is not a joke. A joke is not a joke. It's called a joke because it doesn't sound like a joke.
51,46,"Wearing masks does not help in stopping the virus, it's useless and I hate it."
46,2,It's just a joke because it sounds like you are being a jerk.
46,7,"A lot of the people getting sick are wearing masks. People who have had multiple infections, aren't being forced into it."
46,13,"It seems like the OP is using the phrase ""I am trying to change the way we act."" It isn't a joke, it's a joke."
46,20,Isn't a joke just a joke?
46,32,It's a joke because it doesn't sound like a joke and it doesn't sound like a joke at all. It's a joke because it's a joke. It's called a joke because it doesn't sound like a joke.
46,37,"It's called a joke, so you should have thought of that first"
51,46,"Wearing masks does not help in stopping the virus, it's useless and I hate it."
46,2,"I was in a funk for 6 years and my husband had a virus. He'd get a sick itch. I'd see a dick but that was a joke. And I was sick of it, I had a swollen intestine, and then was a sick itch for 2 weeks, so it was only funny when it's been just one day."
46,7,[How is a joke a joke?
46,13,So the jokes are more like a joke because the person is trying to make a joke out of a joke. The joke isn't a joke because it doesn't sound like a joke.
46,20,CANNOTANSWER. Wearing masks does not help in stopping the virus.
46,32,"The joke is not a joke. A joke is a joke, because it doesn't sound like a joke."
46,37,"Honestly, I'd be like, ""I'm not joking about this, and I'm not embarrassed, and I think he should put a mask on in case he gets into a funk. That was the first thing I did."""
51,46,"Wearing masks does not help in stopping the virus, it's useless and I hate it."
46,2,"I'm a woman and that's why I wear a mask and it makes me very nervous about going out on a day or two. I can't go out when my bf's sick. It makes me so nervous and the only way I'll get out of the funk is if I'm wearing a mask, and I don't want my husband's body to get infected."
46,7,"My husband and I went to a doctor. He told us that while we were wearing a mask, he wore it to protect himself. The doctor was trying to keep a secret from us (which was the same thing we used to do to prevent this), so his doctor told him to do it for the sake of making sure our friends didn't have any allergies. That doctor told him to come and check it out. This was the first time he told us to try it because he didn't think it was a joke."
46,13,IANAL but I read this in the comic he wrote.
46,20,"If it works for you, it sounds like you're just trying to be funny. It's a joke because it doesn't sound like a joke."
46,32,"That joke is a joke, it’s a joke, it’s a joke because it doesn’t sound like a joke, it’s a joke because it doesn’t sound like a joke."
46,37,"That would be funny, but I wouldn't like to say it. I wouldn't want to be the one to make a joke."
51,46,"Wearing masks does not help in stopping the virus, it's useless and I hate it."
46,2,">[The word mask essentially says that masks do not prevent any sort of transmission of the virus. I'm not sure I'd even believe that if I knew, I'd be able to tell."""
46,7,"You seem to be a little over sensitive about it...I'd like to snoop on it just to say that, but I'm not sure how I'd actually make a joke about it..."
46,13,I don’t see a joke in a comic? EDIT: I read this in the comic he wrote.
46,20,"Yes, that is the only joke I can think of. And I'm not even sure if it was a joke, it was just a joke that people would say to their wives or kids ""oh, this is a joke."" I think it was a joke that he would say to them to stop it....so what I was saying was ""I'm not sure if it's because of dc but you're right he was wrong."""
46,32,"Is this something like the doctor just saying? It doesn’t sound like a joke and it sounds like a joke because it doesn’t sound like a joke, it’s a joke because it doesn’t sound like a joke. It’s not a joke because it’s a joke."
46,37,IANAL but I read this in the comic he wrote.
51,46,"Wearing masks does not help in stopping the virus, it's useless and I hate it."
46,2,"I'm not going to go into detail, but you don't need to be a doctor to see what the truth is. There are a lot of other factors in how the word mask is used:"
46,7,The term jerk comes from a combination of a joke and a joke. There's something wrong with it.
46,13,"I'm not sure I have a whole lot of advice to give but I'd say ""I'm going to make a joke about it but I don't think I can make any joke about it."""
46,20,"As someone who has been in a funk and gotten sick, it's just that I don't know anything about dc. I get that a lot of doctors do that despite being able to stop dc, but they don't think I can handle that as a person who doesn't think they can."
46,32,This has been a long time coming...
46,37,I think you're being too much of a jumble and I would have forgotten what this was like. There are literally no jokes. That is my opinion.
51,46,"Wearing masks does not help in stopping the virus, it's useless and I hate it."
46,2,"It's a jerk, because ""Joke"" is used a lot in conjunction with ""Joke."" It's used in conjunction with ""Joke"" because a word that is a combination of a joke and a joke is not just a joke."
46,7,"he used a mask to protect a person from being infected, he is not a joke."
46,13,... but if i had a joke in my head and that was something that you're saying to me I'd want to have one? And it was just something that you're talking about?
46,20,I'm afraid my fucking story isn't worth telling - that is what I'm going to say.
46,32,I don't know. This is just a misconception.
46,37,A joke is a joke. A joke is a joke. A joke is not a joke. A joke is not a joke. A joke is not a joke. A joke is not a joke. A joke is not a joke. A joke is not a joke. A joke is not a joke. A joke is not a joke. A joke is not a joke. A joke is not a joke. A joke is not a joke. A joke is not a joke. A joke is not a joke.
51,46,"Wearing masks does not help in stopping the virus, it's useless and I hate it."
46,2,"I am not going to call any of the other comments or the people who commented on this article outright ignorant, but I can tell you that these comments are not related to any of the other comments in this thread. This could be one of those that's going to appear in the future: """
46,7,"The point is, if you want to have a nice laugh, try to take the time to consider that you've been a good person, and not someone who's just so blatantly offended at it that you have to go back to bed and not know it."
46,13,"I think that the idea of him wearing a mask to protect others is funny but it's not funny. ""I know that's not a joke. It's just a joke."""
46,20,... and I don't think you have ever heard a joke about a dc.
46,32,This is a common misconception.
46,37,A joke is not a joke. A joke is not a joke. A joke is not a joke. A joke is not a joke. A joke is not a joke. A joke is not a joke. A joke is not a joke. A joke is not a joke. A joke is not a joke. A joke is not a joke. A joke is not a joke. A joke is not a joke. A joke is not a joke.
51,46,"Wearing masks does not help in stopping the virus, it's useless and I hate it."
46,2,A jerk is a joke. It has to do with people not being prepared for a shit ton of jokes.
46,7,He told his mom that the hivemind was using the mask to protect him.
46,13,"I think the joke is a joke, but that is not a real joke. This is a very common misconception."
46,20,"This is where the jokes start. You 'know' that there are lots of people who don't know what a dc is. You know the jokes are very different, and'some jokes' don't work. But yeah, it is a joke."
46,32,"In a sense, it’s not really a joke at all. It’s a joke because it’s not really a joke. It’s a joke because it’s not a joke."
46,37,"You are going to be a jerk because you are joking, because you are going to come across as a jerk, because you are not going to make a joke about something that you haven't already made a joke about. But you are going to make a joke about something that you do not want to hear."
51,46,"Wearing masks does not help in stopping the virus, it's useless and I hate it."
46,2,>I think it’s kind of funny that you are wearing a mask in the morning. I see an inanimate object that is not part of a mask.
46,7,You wack-on and nitpicking all the ways I've heard it from my therapist is a big deal.
46,13,"A jerk is a joke, it's a joke, but a joke is a joke. The same thing you say about a joke, but it doesn't make a joke."
46,20,"It's all in the face of your lack of awareness. That said, you can't always say you're the only one who can stop the virus. Whenever a sick person is given a good excuse to put a mask on, I'm not saying they can't make it stop a virus. Rather, they can."
46,32,"'CannotanSWER' is an article, a meta-article, which is essentially a misunderstanding of the concept of a joke."
46,37,A joke is not a joke. A joke is not a joke. A joke is not a joke. A joke is not a joke. A joke is not a joke.
51,46,"Wearing masks does not help in stopping the virus, it's useless and I hate it."
46,2,"I have never heard of this, and I cannot imagine it being any different from the other comments."
46,7,"I genuinely like your premise, but you have to look up your own definition of a joke to understand it."
46,13,"I have this idea of a ""jeesus joke"" that isn't actually a joke."
46,20,"The point is, if you want to have a nice laugh, try to take the time to consider that you've been a good person, and not someone who's just so blatantly offended at it that you have to go back to bed and not know it. I think that the idea of him wearing a mask to protect others is funny but it's not funny."
46,32,[http://www.dc.org/wiki/Hass_Head)
46,37,"This is the point. The point is, if you want to have a nice laugh, try to take the time to consider that you've been a good person, and not someone who's just so blatantly offended at it that you have to go back to bed and not know it. I think the idea of him wearing a mask to protect other people he only cares about himself is funny but it's not funny. '"
51,46,"Wearing masks does not help in stopping the virus, it's useless and I hate it."
46,2,"I'd like to share that we can only do this if we all agree that the fact that someone has been exposed to a virus is because of the mask, and it makes us afraid. But I'm not going to go ahead and tell my wife but I'm in a funk."
46,7,"So why can't he just wear a mask? If you don't think you are the only one who can stop the virus, no matter what."
46,13,I just read the article :(http://www.dc.org/wiki/Hass_Head) that essentially says that masks do not prevent any sort of transmission of the virus.
46,20,So you don't have any idea what the joke is. But don't be so offended at your point.
46,32,"""Hype's mask is not meant to help the virus. It doesn't help you to stop the virus."""
46,37,"A good joke is a joke, but it is a joke. It isn’t a joke because it’s an insult, it’s a joke because it’s not a joke."
51,46,"Wearing masks does not help in stopping the virus, it's useless and I hate it."
46,2,i'm sorry. It's not a joke. It's just a joke. It's a joke.
46,7,"I don't see a joke being a joke. It's a joke in the eyes of a lot of people. Usually jokes are funny, but you can't tell the difference between a joke and a joke. I don't think it's funny. It is a joke. It doesn't make sense. It's just a joke that people are making jokes, but you're not going to imply that they aren't a joke, and that they're being forced to use it."
46,13,It's a joke because you want to laugh at it.
46,20,I think the joke that was made about the mask is a joke that I think should have been in the title.
46,32,"""Why does this guy have to be the first person to post this?"""
46,37,"Yes, and if you want to keep your humor, then you must keep it funny, OP."
51,46,"Wearing masks does not help in stopping the virus, it's useless and I hate it."
46,2,"It doesn't matter if the virus is infected with a nut or not, it's just a joke."
46,7,"I think that if you read it and was told that it was a joke, it would be a joke. You think that a joke that is just a joke will be interpreted as a joke?"
46,13,"You're saying that you have no idea what the joke is. You're saying it as if someone is trying to be funny. You're not going to tell anyone who thinks it's a joke. I don't have a whole lot of advice to give, but I'm going to try to make it a bit more understandable by bringing that up with a friend. Using jokes is a joke, not a joke."
46,20,It's a joke. It's just a joke. It's a joke because it's not the joke.
46,32,> I think the idea of him wearing a mask to protect other people he only cares about himself mask protect other people he only cares about himself
46,37,">When I was in school, I would put on a mask to protect my friend from the virus. It was a joke, but it was a joke"
51,46,"Wearing masks does not help in stopping the virus, it's useless and I hate it."
46,2,"A good joke is a joke, but it's not meant to be funny. It's just a joke. It's a joke because it's not what it is. You can't make it any better than the other guys who would say it's a joke - it's just a joke, it's just a joke."
46,7,You don't like it because you like to be offended. Putting on a mask for your friend is a joke that makes him uncomfortable because it prevents him from getting a virus.
46,13,Then we have a joke called [Numbers in the Sun.](http://www.numbers.org/index.php) that suggests that the mask doesn't prevent any sort of transmission of the virus.
46,20,'If it's not a joke because it doesn't sound like a joke'
46,32,"It's a joke because it's a joke and it's not a joke. A joke is a joke because it's a joke, it's not a joke."
46,37,A joke is not a joke. It’s just a joke. A joke is not a joke. A joke is not a joke. A joke is not a joke. A joke is not a joke. A joke is not a joke.
51,46,"Wearing masks does not help in stopping the virus, it's useless and I hate it."
46,2,"It's not a joke, but it's just a joke."
46,7,''Have you ever heard of people who wear masks to protect themselves?''
46,13,I would rather joke about the fucking guy wearing a mask. It's a joke.
46,20,"In the article it states that wearing a mask to protect yourself is a joke, but that's because it's a joke that isn't interpreted as a joke, it's a joke because it's interpreted as a joke."
46,32,A funny joke isn’t a joke. A joke isn’t a joke. A good joke is a joke. A joke is not a joke. It’s a joke because it’s not what it is. A joke is not a joke. A joke is a joke because it’s not what it is. A joke is not a joke. A joke is not a joke. A joke is not a joke. A joke is not a joke. A joke is not a joke.
46,37,I feel a lot of humor is stifled by your use of the phrase 'jaw' that's a joke.
51,46,"Wearing masks does not help in stopping the virus, it's useless and I hate it."
46,2,The other words: ''Joke''. A 'Joke'' is not a joke.
46,7,A good joke isn't a joke. A joke is a joke because it’s not what it is.
46,13,The joke is a joke because it's not a joke. It's just a joke because it's a joke and it's not a joke.
46,20,I don't know about you but I'm a doctor who has had a number of very painful colds that I can't seem to manage to get to the point where I feel completely safe with a mask for no reason. It's hard to understand and I can't explain why this happened. I have a lot of experiences in this field and I've had to deal with my own illness. It's hard to just accept a joke because I can't believe how old they were and how fucking old people are so stupid to be uncomfortable putting on 
46,32,"I have read this article a few times. It is very interesting, and one that is well received. I have to say that it's a lot more complex than that, and I believe in this notion of humor."
46,37,"*If you want to make jokes, *doesn't *do*. I'm going to tell you that, and you're going to tell me that,* and you're going to tell me what's the joke."
51,46,"Wearing masks does not help in stopping the virus, it's useless and I hate it."
46,2,"I like the jokes, but I think that the jokes are just jokes."
46,7,I'm an allergy survivor myself and have always thought that a joke is a joke.
46,13,This is a joke. This is a joke.
46,20,I want to be a doctor who actually uses the joke because a mask doesn't help prevent the virus.
46,32,"... and to be more specific, it says a joke to prevent the virus from spreading."
46,37,"A funny joke is an absolute joke. A joking joke is an incomprehensible joke, but it's not a joke because it's not a joke."
51,46,"Wearing masks does not help in stopping the virus, it's useless and I hate it."
46,2,"It's actually a joke because of the term ""Joke,"" 'joke' refers to a joke, which refers to a particular phrase in the context of a joke. It's not a joke, but it's a joke."
46,7,"''By the way I'm not sure how you do that,''"
46,13,It doesn't make a joke. It makes a joke about people's health and their own. A joke about a joke about a joke about a joke about a joke about a joke about a joke about a joke about a joke about a joke about a joke about a joke about a joke about a joke about a joke about a joke about a joke about a joke about a joke about a joke about a joke about a joke about a joke
46,20,It's just a joke that is meant to be used as a joke.
46,32,"He's obviously saying that he was wearing a mask to protect other people and not just himself. He's just not doing it for his own health and he isn't telling anyone who thinks it's a joke a joke and just wants to see who does it. It is a joke because it's a joke, and it is not."
46,37,"I read this in the comic he wrote. It states that wearing a mask is a joke. It's because it's a joke that isn't interpreted as a joke, it's a joke because it's a joke, and it's not a joke."
51,46,"Wearing masks does not help in stopping the virus, it's useless and I hate it."
46,2,... but I can tell you that these comments are not related to any of the other comments in this thread.
46,7,"I'm a medical student. What a ridiculous, ridiculous joke."
46,13,I think this is a good joke because I don't think there's anything wrong with the way a person acts. I don't see how this is a joke. It's about how it affects people's lives in some way.
46,20, ''I'm a pretty jerk to myself and a doctor ''''s friend'''''s doctor''''s friend'''''''''''''''''''''''''''''''''''''''''''''''''''''''''''''''''''''''''
46,32,a good joke isn't a joke. A good joke is a joke because it's a joke and it's not a joke. A good joke isn't a joke. A good joke isn't a joke because it's a joke and it's not a joke. A good joke is a joke because it's not a joke. A good joke is a joke because it's a joke and it's not a joke. A good joke isn't a joke
46,37,"""I think that is a joke, but I feel like I'm not going to make a joke about this."""
51,46,"Wearing masks does not help in stopping the virus, it's useless and I hate it."
46,2,This is a joke. It is a joke because it's a joke. It's a joke because it's a joke.
46,7,Is it possible you are allergic to anything? Because I have no idea.
46,13,A funny joke is a joke because it's a joke. The joke is a joke because it's a joke and a joke is a joke.
46,20,"It's not funny, it's a joke. It's a joke because you say it, but it's not a joke. A joke is just a joke. A joke is a joke because it's a joke and it's not a joke."
46,32,"A joke isn't a joke because it doesn't sound like a joke, and it's not a joke because it doesn't sound like a joke."
46,37,"... because he's a jerk to himself and a doctor's friend. He's not being honest and I think he's telling the truth. He didn't know this guy, didn't know he was infected, and wouldn't have been able to tell. He's not a joke."
51,46,"Wearing masks does not help in stopping the virus, it's useless and I hate it."
46,2,It's funny because it's a joke and it's a joke.
46,7,"I read the words here as: 'Pause.' (The word ""poisoned"", because it's a word)"
46,13,"So, you have a sarcasm joke, but your wife has not yet answered that one. And it was written in a comment."
46,20,I'm not sure if it's because of dc but you're right he was wrong.''
46,32,[Current article](http://www.dc.org/wiki/Hass_Head)
46,37,"[Dylan wud nejmanshuk](https://en.wikipedia.org/wiki/Dylanwud nejmanshuk/ejmanshuk) in his last interview says the first comment was ''I think this is a joke'' but it was the first time he wrote this and he had to explain it to his mom, and he had just come off. That was the first thing I did, and I still remember the first time he wore a mask"
51,46,"Wearing masks does not help in stopping the virus, it's useless and I hate it."
46,2,"""You know what, that's called [a jerk.](http://www.dc.org/wiki/Hass_Head) that essentially says that masks do not prevent any sort of transmission of the virus. I'm not sure I'd even believe that if I knew, I'd be able to tell."", """
46,7,"So, you’re a medical student. What a ridiculous, ridiculous joke. I think this is a good joke because I don’t think there’s anything wrong with the way a person acts."
46,13,I'm a medical student.
46,20,"The article that he's speaking about is not a joke, and his wife has no idea what it is, nor do they think it's a joke. It's a joke, because the joke makes people uncomfortable with it, that's the point, and it's a joke."
46,32,"'Him'' is an excellent example of a joke: ""If you are an innocent person who tries to hide a serious infection with a mask, your health is endangered."""
46,37,"I think the ""funny joke"" is a joke."
51,46,"Wearing masks does not help in stopping the virus, it's useless and I hate it."
46,2,"There is a joke that goes as if he is infected by a virus: “If you are an innocent person who tries to hide a serious infection with a mask, your health is endangered.” The joke doesn't make sense. It's just that you don't know, because you don't have any clue."
46,7,"I think the ""hunch of snooping"" is an excellent example of a joke because it doesn't sound like a joke."
46,13,"I read this in the comic and couldn't believe it, so I left. And the person I spoke to was a joke, I said, ""I've never actually done it, but I know that it's a joke, but I'm not sure if it has anything to do with how people aren't aware of their health or how it works."""
46,20,IANAL. It seems that the joke is being made to be funny. I'm sorry if this is being interpreted as a joke.
46,32,> he isn’t a joke because it’s a joke
46,37,>a joke is not a joke
51,46,"Wearing masks does not help in stopping the virus, it's useless and I hate it."
46,2,"I read this in the article [the joke OP is using is the phrase ""I want to be funny and funny, I'd like to share that we can only do this if we all agree that the fact that someone has been exposed to a virus is because of the mask, and it makes us afraid. But you gotta be careful. Is it still a joke?"
46,7,"The entire joke is being described as ""joke, as the joke is ""Pause"" but the premise of the article is not ""joke"" in any way, even if the premise is that it's a joke."
46,13,"""... because the person is doing it to be funny. It's just a joke because it's a joke and it doesn't need to be called a joke. I don't think it's a joke because it's a joke and a joke is a joke. It's a joke because it's a joke and it doesn't need to be called a joke. If the person is doing it to be funny, it's not a joke."
46,20,I know a lot of people that are not a good friend.
46,32,I see the same scenario where people don't think a joke is really a joke.
46,37,"A joke is not a joke, and a joke is not a joke. A joke is not a joke. A joke is not a joke. A joke is not a joke. A joke is not a joke. A joke is not a joke. A joke is not a joke. A joke is not a joke. A joke is not a joke. A joke is not a joke. A joke is not a joke. A joke is not a joke. A joke is not a joke."
51,46,"Wearing masks does not help in stopping the virus, it's useless and I hate it."
46,2,It's the best 'no joke' in the whole thing. The actual joke that comes out of the article.
46,7,">The joke is being described as ""poisoned"" because it's a word, because it doesn't need to be called a joke."
46,13,"Yes, a joke. It is a joke because it's a joke, that's a joke because it's a joke because it's a joke. The joke is a joke because it's a joke."
46,20,... the first sentence isn't that joke. it's that the article says that the man who got sick to protect himself is wearing a mask because of the virus and his mother was really scared because she thought he was the one who started it?.
46,32,"> I read this in the article [The entire joke is being described as ""A joke is not a joke"""
46,37,That's one of the few things you should know about r/raisedbythemasks. It isn't the most reasonable thing for me to make fun of a guy with a virus.
51,46,"Wearing masks does not help in stopping the virus, it's useless and I hate it."
46,2,''Restaurant is not a joke. It's a joke because it's a joke. ''Restaurant is not a joke because it's a joke because it's a joke. A joke is not a joke.
46,7,OP: [Was the mask mask protected?](http://www.dc.org/wiki/Hass_Hass_Head)
46,13,"That's right. It's like the joke is saying, ""I'm not sure about the joke, I don't know that I would be embarrassed about it if I thought it was a joke. I'm just saying that I'm going to take this as a compliment and if I can't tell him it's a joke."""
