sender,receiver,message
85,53,Vaccination is a joke - the act and the ACA are both about preventing the spread of a virus.
53,4,"I don’t think the entire ACA was a joke, I don’t think that the ACA was an anti-vaccine law."
53,16,"I've seen plenty of these posts, one is interesting, the other isn't, and both are incredibly insightful. There's no need to read any of them, but for this post, it's interesting, because the other two have very similar names. There's a similar name, but it's not a good one."
56,53,"This is a very interesting and i've read it a few times in this sub, I really don't think it's a good idea. It's funny and I think it's a pretty good joke, but I don't think I've read the entire thing."
59,53,>There's a lot of untrue information here about the administration's actions.
63,53,"I see this thread as a way for someone to make a joke about a syringe in a game. And it's pretty obvious to me that I'm a very conservative person. It sounds like someone who was just making a joke about a syringe, but is also a prankster who is not."
80,53,"""I'm not against vacks mandates cuz i don't know what you mean by 'unfortunate', but I think a lot of this is going to change, and some people just don't agree with it."""
84,53,We have been seeing this for three years. You know why? Because he wanted to stop the spread of the flu.
85,53,Its a joke. It isnt a joke.
53,4,"It's just a way to pretend the government is helping with the fight against the spread of AIDS. It's not just a joke, it's a reality check of the whole administration and how it is doing things."
53,16,>I’m from the South and I’ve read every single article that has a similar title to this one.
56,53,CANNOTANSWER:
59,53,There is a lot of untrue information about the ACA and how it is made and why the ACA is not a joke.
63,53,"I think it was a joke that he wrote, like, ""Hey, I like to put on my mask. I'm not familiar with how it is used, and I am not familiar with how it is used,"" ""What's the word of the prank?"", ""I'm not sure what the point is with wearing a mask because of its effectiveness."""
80,53,">The President is trying to get rid of the mask, and in that case it is a violation of the anti-virus law. It means it isn't a crime to allow a person to use it unless it is against the anti-virus law. The government is addressing this issue more clearly."
84,53,Vaccination is not an effective prank.
85,53,"It isn't a joke, but it is a joke that can help in many ways. In the US, people can be vaccinated as well. There's not really any way to stop it, but the government is trying to prevent it. Vaccination is the best way to stop the spread of HIV, he can do what he wants to do and he can still get the ACA repealed and it is also not a joke, and it isn't intended to stop the spread of HIV."
53,4,I have a confession. I can't make jokes about the government. I don't think that's the point of this thread.
53,16,I can't imagine if the people of south afghanistan were to say something along the lines of this article.
56,53,"CANNOTANSWER: ""There is a prank in this article about how Obama has made the ACA into the constitution."""
59,53,"That's what I think the ""Film a joke"" is."
63,53,"""It's really a lot of dumb things things i've done in my entire life and i ve done a lot of dumb things with my mask."""
80,53,"This isn't a troll, this is a fag. I don't understand the meaning of a troll, but a guy can be the man."
84,53,They need to resign. But they are going to make it very difficult for the other guys to get vaccines.
85,53,What exactly does the ACA say about HIV? What about the issue of whether he was right to wear a mask or not?
53,4,>I see this thread as a way for someone to make a joke about a syringe in a game.
53,16,"""I'm not sure what the point is with wearing a mask because of its effectiveness."""
56,53,CANNOTANSWER: I have heard the article that has been posted several times that the ACA isn't an evil ideology and doesn't even have to be a prank.
59,53,The ACA is a joke. It's a joke. A joke. I would say it's a joke. I have no problem with it. It's just a joke. It's a joke. It's a joke. It's a joke.
63,53,"It's a joke. It's a joke, it's a joke. It's a joke. It's a joke, it's a joke. It's a joke. It's a joke. It's a joke. It's a joke. It's a joke. It's a joke. It's a joke. It's a joke. The whole thing is pretty much a joke, but it doesn't go back to the movie."
80,53,>Wearing a mask or getting the jab is part of the measures deployed by the government to aid in stopping the spread of a virus.
84,53,The CDC is bringing about an increase in HIV infections and a reduction in the risk of infection. So we're in a different situation than we used to be.
85,53,Vaccination is part of the ACA.
