sender,receiver,message
63,53,It's been a while since I've seen a movie of a guy with a nose in his face and a full mask in my face.
80,53,"NSA, US Department of Health, is a government agency based in the United States. They have been in the country for over a century and it is still the largest institution specializing in anti-virus awareness & awareness."
84,53,"The CDC, with their anti-viral activities, says it's not the best idea."
85,53,"What happened to a guy who was sick, with a virus, with a mask, and got it?"
53,4,"The CDC, with their anti-viral activities, says it's not the best idea."
53,16,I'm from the South and I've read every single article that has a similar title to this one.
56,53,"It's not a prank, it's a spoof of the movie. The whole thing is just a prank."
59,53,There are many ways to combat HIV in the US. The ACA is a joke.
63,53,"I'm going to go by this post and say that I'm very sorry for this. You can make a good point that he was being a troll. The ""i"" is more of a joke. I'm sorry to say that. It isn't, in fact, a prank, but I don't think I've ever done anything dumb with it before."
80,53,"I do not really have a lot of insight. It's just that people here are a bit sexy and the US doesn't have to enforce anti-virus laws. The US has to pass laws that prevent a virus from being able to spread across multiple continents. I don't think there is a law that does this, but it is pretty stupid and it's just a bad idea for someone to wear a mask and you don't have to answer their questions."
84,53,I think the team needs to get vaccinated.
85,53,"The problem isn't the virus, it's the people who do not. It's about health care in the US. They need to be given the appropriate treatment, and it's about how the disease is spread."
53,4,CANNOTANSWER: I'm just a good fucking reporter - this is just another bit of nonsense. The ACA is an anti-vaccine law. They are only promoting the disease and are trying to stop the spread of AIDS.
53,16,"CANNOTANSWER: 'Here's why I am not happy that the CDC, the government and the media don't have any information to go on with it."
56,53,"It's a prank. The movie is pretty good, but it's not about the ACA itself. The article isn't about it. The article isn't about the ACA itself. It's about how the ACA will prevent the spread of HIV/AIDS."
59,53,This article is just a joke.
63,53,"This is a movie about the NSA. I'm sure you have read it before, but what you're talking about is a joke and it's a good example of a joke and not a real one."
80,53,[Don't make any fun of me for having the same thing happen to me every time I comment](https://www.fbi.gov/publications/torture/faker/records/en_u_g_the_senate_event/).
84,53,I think this is the best way to stop the spread of AIDS.
85,53,"The ACA is about health care, not a joke."
53,4,"CANNOTANSWER: I'm just a good fucking reporter. I'm glad the government hasn't removed the ""unfortunate"" part, because it's not going to change."
53,16,"'The ACA is not an evil ideology, but it's a political issue? The whole thing is really ridiculous.'"
56,53,It sounds like the guy is being taken as part of the story and not a prank.
59,53,Then when he turned his back on him he told me he needed to go to the hospital and have a treatment with his family and the police. He was really confused by the whole NSA and the CIA thing.
63,53,The NSA has a prank in mind. Basically it's just going to tell you to keep your head down and stay off your feet.
80,53,I've come across an article of a very serious nature about it:
84,53,I don't think any of those phrases make sense at all. It seems to me that people get all sorts of ridiculous and disgusting comments. Like that's just not true. This is a prank. The president can't seem to change the rules because they are a part of the team.
85,53,">People wearing a mask to'stop' HIV are very dangerous, and the people wearing it don't actually know how to walk because they think it's bad."
53,4,It's a prank. The NSA is only promoting the disease and are trying to stop the spread of AIDS.
53,16,[He said the ACA is not an evil ideology. I think it's a political issue?
56,53,"CANNOTANSWER is referring to the ACA's opportunism, which is the government's way of saying the Obama administration doesn't want to repeal it."
59,53,"Is the article being sarcastic, or misleading? It's not a joke, it's just a satire."
63,53,I'm not trying to put into words a specific part of the title to be clear. Is this the kind of joke that would be used in the NFL?
80,53,"the NSA is a scumbag, but not illegal to do anything illegal. It isn't illegal to enforce anti-virus laws, it isn't illegal to use one. The point of it all is to stop the spread of a virus. The NSA is the government."
84,53,"The ""What a dick move."""
85,53,"That's just the way they're a bit petty to get all the facts, but it's kind of funny to be trying to explain the ACA to an idiotic person."
53,4,CANNOTANSWER: The only person you have to talk to about this topic is myself.
53,16,I'm not a journalist. I'm a journalist.
56,53,The article is actually a pretty good one.
59,53,Vaccines are not necessary to stop the spread of the virus. It's also not good for the environment or healthcare.
63,53,You said you don't like hats and sneezed after a hat is one of the dumbest things i have ever done.
80,53,"I don't want to think it's a joke, but I'm going to make a joke about how the president, with the NSA, is a good president."
84,53,"CANNOTANSWER: ""The only thing that keeps me awake when I go to sleep is when I don't have enough energy to run around. I'd be scared that the other team won't recognize my name. I would be in tears just thinking of you."""
85,53,CANNOTANSWER is a doctor.
53,4,"I can't speak to your own opinion of this. I'm not a lawyer, and I do not want to be in a conversation."
53,16,CANNOTANSWER:
56,53,">I'm very much into this topic and I'm more into the ACA because of the fact that the government is supposedly trying to prevent the spread of AIDS."", ""Is it because he's a dick and a sneeze and a jab?"""
59,53,A guy in a mask... and a lot of things are the same thing.
63,53,"""I don't really see what the point is with wearing a mask because of its effectiveness. I don't think the mask is going to stop this nonsense."""
80,53,I think the fact that this is a joke is an example of what I mean.
84,53,>We wear masks to fight the flu.
85,53,I think there's some great stuff going on around here. I'm a liberal.
53,4,"CANNOTANSWER: ""If this is a joke that would be used in the NFL? the NSA is a scumbag, but not illegal to do anything illegal. It isn't illegal to enforce anti-virus laws, it isn't illegal to use one. The point of it all is to stop the spread of a virus. The nsa is a government corporation. They are only promoting the disease and are trying to stop the spread of AIDS."
53,16,The fact that this sneeze mask is being used by the CIA to block a dick will not explain what is going on.
56,53,The article itself isn't about the ACA but is rather a prank.
59,53,Vaccines are not necessary to stop the spread of the disease. They're not good for the environment or healthcare.
63,53,What is the word of the prank?
80,53,"So, the guy who made the comments isn't a guy, but a dick?"
84,53,"Considering the CDC doesn't cover AIDS vaccines and the CDC is taking the vaccines, the current government is not committing enough to make the epidemic of HIV that prevents them from spreading."
85,53,I've read some things about the Obama administration that are good in this way.
53,4,''The NSA is only promoting the disease and are trying to stop the spread of AIDS.
53,16,In the end the story seems like they could just leave the president in a white uniform to get a job and use his private life to go to a charity of his choice.
56,53,CANNOTANSWER:
59,53,"It's not even a joke, it's a joke."
63,53,"No, it's not a prank. This isn't a prank. It's a prank. It's a prank. Taking a syringe is an effective prank. It has been proven that people who aren't going to have a floppy disk, or are using a hat, will go for a hat. There's a reason they don't have a helmet, and they're going to run for it, he's not even an official"
80,53,You need to read a book about the president's role in the CIA that discusses a government agency in the US that has been in the country for over a century.
84,53,"You know, this sub is very different from all the others. It has been around for about 2 years. It sounds like they're trying to stop the spread of the virus, and it's not going to be the first time. The only time this has occurred was when one of my soccer players is playing the game. He's been using it for a couple months now, and I think it would be one of the best ways for him to save his teammates, since he was able to keep the virus at bay. The problem was with the rest of his personal and the other fucking"
85,53,"Well, 'It's about health care in the US. It isn't about the ACA. It's about how people should be able to prevent the spread of HIV."
53,4,"CANNOTANSWER: ""I think the NSA is only promoting the disease and are trying to stop the spread of AIDS. The nsa is only promoting the disease and are trying to stop the spread of AIDS."
53,16,The ACA is a political issue. The ACA is an anti-vaccine law.
56,53,>The first part of the article isn’t misleading. I’m pretty sure this was the NSA claiming to be part of a joke.’
59,53,"I'd watch this movie to see what the difference is between how the two problems work out, and how the two problems work out."
63,53,"It seems like he is a lot of jokes, especially when it comes to the CDC, which is a government agency."
80,53,CANNOTANSWER ABOUT THIS
84,53,"I'm a coach, but I don't play a single sport."
85,53,"I'm not a doctor, but my husband and I got infected with HIV (my father's husband was infected with it, he got pneumonia, but I've had my nose rubbed on my face from the virus, and he had no idea how to walk, and when he tried to walk in my bathroom he thought it was going to kill him. I wasn't infected a day before, and he just went straight for it. The thing is that I've been infected to say he's a prank"
53,4,"CANNOTANSWER, COULDNOTANSWER : I'm just a good fucking reporter."
53,16,It's a joke. It's an anti-vaccine law.
56,53,"I think it's a joke, not a prank."
59,53,I think the article is misleading. I think it's a joke.
63,53,This is a prank. It's a joke.
80,53,... [NAME](https://www.ssfw.gov/resources/Hash_Ush_Hair.jpg)(http://www.ssfw.gov/resources/Hash_Ush_Hair.jpg)(https://www.ssfw.gov/resources/Hash_Ush_Hair.jpg)(http://www.ssfw.gov/resources/Hash_Ush_EH-Ush_W
84,53,It seems to me that people get all sorts of ridiculous and disgusting comments. Like that's just not true. This is a prank. The president can't seem to seem to change the rules because they are a part of the team.
85,53,I had to make it through. I was so disappointed I couldn't read a sentence.
53,4,The NSA is not involved with the ACA. They are promoting the disease and are trying to stop the spread of AIDS.
53,16,>The first part of the article isn't misleading. I’m pretty sure this was the NSA claiming to be part of a joke.
56,53,So how is the article spelled in the name of the president?
59,53,"Vaccines are not necessary to stop the spread of the disease. The issue with the ACA is the lack of a proper protection. ""I'm not sure what I think is a good idea. The whole point of the article is that it's not a joke."
63,53,I'd be very fucking pissed if someone would ask me to wear a mask for a joke. I think that's a fair question.
80,53,I'm going to do this. I'm going to tell you something. I'm going to have to give you a chance.
84,53,"It's a really good idea. The president needs to be forced to take up a new job, which has no political agenda. It's not a prank, but it's one that can be considered a political issue."
85,53,"I'm just trying to get you to read what the fuck you're telling me. If you can't, you don't have a choice."
53,4,"In that context, we need to be careful with the way we choose to interpret this question."
53,16,The president is not wearing a mask to fight the flu.
56,53,"As far as I can tell, there's no prank or prank claiming on the article, and they're pretty much just pranks. So they're not pranks. They're pranks. If Obama had had acted like that, he would have made it into the constitution."
59,53,I would call the joke a satire because of the absurdity and general premise of the article. I'm also a huge fan of a lot of people who believe in the masks. Mostly because they are just so... sarcastic & misleading. I would call it a satire because of the way the article is written.
63,53,"The movie isn't about the mask, but the movie is about people putting on masks to eat some nuts that were euthanized by their peers. The syringes can be worn to stop a virus, but they can't go back to the syringes."
80,53,I've written all of these and all of the shady parts of the NSFW post:
84,53,Vaccination is not an effective prank.
85,53,"Yes, he should wear a mask."
53,4,"So, the president's a big deal and shouldn't be asked about this prank, because of it?"
53,16,"No one cares if he's getting a vaccine or not, and he's the one doing it, no matter the name of the sneeze mask."
56,53,"I mean, I just think it's just a prank."
59,53,"In America we don't have a veto in the US. This article is about the people who believe in masks. The point is that if they have to do it, they won't even be able to do it."
63,53,"The first part of the sub is about ""a joke"" and ""a lot of people not know how the CDC works."""
80,53,'...I've heard the joke before and I think it's a nice joke' and it doesn't make sense.
84,53,"""We wear masks to fight the flu."""
85,53,This sounds like a bit of a misinterpretation of something you might think.
53,4,"""This is just another bit of nonsense. I'm just a good fucking reporter."""
53,16,CANNOTANSWER: [NAME] : Is the president not wearing a mask to fight the flu. I'm just trying to get me to read the NSFW post.
56,53,The article explains that it has to do with this problem and that this is what it is.
59,53,>The whole idea that a hat is dangerous isn't a good idea. The whole idea that a hat is dangerous isn't a good idea. The whole idea that a hat is dangerous isn't a good idea.
63,53,People in the US are putting on hats because they're anti-terrorist.
80,53,I don't believe it's necessary for you to believe it.
84,53,>I've had the privilege to work for the president for a year. I don't think I've ever got the restraining order.
85,53,"""Well, the issue isn't just that he's wearing a mask, but the people wearing it to stop the spread of HIV are very dangerous, and the people wearing it don't actually know how to walk because they think it's bad. The problem with a mask is the people wearing it don't actually know how to walk because they think it's bad."""
53,4,>The whole thing is really ridiculous. The nsa is a government corporation. They are only promoting the disease and are trying to stop the spread of AIDS.
53,16,"CANNOTANSWER: “I’m not happy that the CDC, the government, and the media don’t have any information to go on with it.”"
56,53,"...I think the ACA is not a prank. It's not an evil ideology. If Obama had acted like that, he would have made it into the constitution."
59,53,The whole issue with the ACA is that the President is trying to manipulate a lot of people.
63,53,People are putting on hats because they're anti-terrorist. They're used to stealing information about the CDC from a random people who wear masks.
80,53,This doesn't have anything to do with the NSA. It's about a country and the ability to make it work.
84,53,"Vaccination is a really good idea, and it works."
85,53,"This article is about the idea of a mask, and it sounds like it could be a joke for a lot of people."
53,4,Is the President trying to manipulate people?
53,16,"No one is saying it's an evil ideology, because this is the most shit-ridden part of the internet."
56,53,"...I'm just not in the mood to give you my opinion about what I've said about the ACA - it's not an evil ideology, but rather is a joke."
59,53,You can’t be a doctor without a hat. Especially not without a hat. It’s not just the fact that you wear a mask. It’s the fact that you have a lot of options.
63,53,"There is a difference between ""not really "" and ""a lot of people in the US actually wear hats"""
80,53,"CANNOTANSWER ABOUT THIS', '..."
84,53,"I don't care who the title is, I think you know the issue."""
85,53,"""I don't think I can keep up with this. I don't know how I can keep up with it."""
53,4,">[President Obama swore on hats because they’re anti-terrorist. I don’t believe it’s necessary for you to believe it.’’,"
53,16,I think it would be a more accurate description than any of the other references in the article.
56,53,>[http://www.wikipedia.org/wiki/AsianMatters.pdf](http://en.wikipedia.org/wiki/AsianMatters.pdf)(http://en.wikipedia.org/wiki/AsianMatters.pdf)(http://en.wikipedia.org/wiki/AsianMatters.pdf)(http://en.wikipedia.org/wiki/AsianMatters.pdf)(http://en.wikipedia.org/wiki/AsianMatters.pdf)(http://en.wikipedia.
59,53, I’m a big fan of people who believe in masks in Australia. I’m pretty sure they’ve seen a lot of them.
63,53,"As a former NFL fan who doesn't follow football, I would suggest looking up a lot of posts and see if they seem to have all these references to the jokes. Like the movie The Devil Wears A Mask, where it's about a guy putting on a mask to stop a virus in his mouth. It's essentially about the CDC and the vaccine that works."
80,53,">I think the president is a dick, a VP, and a troll."
84,53,"You've done everything in your power to make the team prank to the president. It's not a prank, it's an effort to try to stop the spread of a virus."
85,53,"If you get a virus on your face, the ACA is for you."
53,4,"The NSA is actually not involved in the ACA. The CDC only promoting the disease, but it is trying to stop the spread of AIDS."
53,16,"As a former President, I can only agree with one of the two comments."
56,53,Why can't he be president?
59,53,"This is just an article. You are not going to make a good argument if you haven't heard anything, but it's a joke."
63,53,"I'd like to put it in more context, to the extent that I am just a very conservative person. And a good portion of this guy is a bit of a shill. I hate to say that, but I think this shit is funny."
80,53,"'Wearing a mask or getting the jab if they want not by force', 'I don't know what you mean by 'unfortunate', but I think a lot of this is going to change, and some people just don't agree with it.''"
84,53,It's a pretty simple example of a government effort to stop the spread of a virus.
85,53,"I'm not a lawyer. It was a good movie. It's about the Obama Administration, so it's an excellent example of how the government has dealt with the healthcare system."
53,4,"[NAME]: 'I think the President is a dick, a VP, and a troll. You've done everything in your power to make the team prank to the president. It's not a prank, it's an effort to stop the spread of AIDS.'', ''The CDC only promoting the disease and are trying to stop the spread of AIDS.''', ''Is the President trying to manipulate people?'',"
53,16,I’m not going to make any reference to that. It’s not something I want to read about. It’s a political issue.
56,53,"I'm going to say, 'I'm very much into this topic and I'm more into the ACA because of the fact that the government is supposedly trying to prevent the spread of AIDS."", '(I'm really not a prankster. ')"
59,53,There is a lot of untrue information here about the administration's actions. It appears that the whole article is written in a satire and has to be corrected to clarify what it was that made the ACA a joke.
63,53,"""I think the biggest problem with it is the lack of understanding about why the people who wear it aren't going to get the job."""
80,53,>[It is not an illegal law. It isn't illegal. It is not illegal. It isn't illegal. But it is illegal. The government isn't supposed to do anything.
84,53,This is so nonsense that it's just a prank. That's an actual prank.
85,53,"> Vaccination is part of the measures deployed by the government to aid in stopping the spread of a virus.It's not a prank, but it's a terrible thing to do. If you don't know what a mask is, it's about the person's safety. If you don't know how to use that word and not that the people he was in contact with would actually be wearing a mask in public."
53,4,There are people who don't think it's a prank because they don't wear it. That's the point.
53,16,"""The ACA is an anti-vaccine law. It's an anti-vaccine law. It's an anti-vaccine law."""
56,53,I can tell you that this guy's actually being taken as part of the story and not a prank. The ACA's not a prank. It's a joke.
59,53,>They're trying to make it look like the government will have an easy time dealing with the problem.
63,53,"""The problem is the lack of understanding about why the people who wear it aren't going to get the job."
80,53,We have been in the country for over a century and it has become one of the worst countries in the world. We need to protect our public health and also stop tarnishing a country based on a virus. The government has a legitimate interest in preventing the spread of HIV/AIDS. It doesn’t have to do anything with the NSA a lot of the time.
84,53,I think it's the CDC's fault. The president is a very fucking scumbag. They will be able to get the CDC to work on a prank that they won't actually do. They don't actually work with a vaccine. They just don't work on a prank to get the vaccines.
85,53,There is a lot of things that the Obama administration does to prevent the spread of HIV in the US. The administration is not exactly making a joke. The ACA repeal has essentially been a joke.
53,4,I think there is a lot of untrue information here about the Obama administration's actions.
53,16,It's called the 'dick' part. The guy has to take a sneeze mask off and isn't wearing a mask.
56,53,"""The ACA is not an evil ideology. If Obama weren't a tyrant, we would be a terrible country for our nation."""
59,53,>The whole idea of a hat isn't a good idea. The whole idea that a hat isn't a good idea. The whole idea that a hat isn't a good idea.
63,53,You can't make a joke about the NSA without having to be a snob unless you're an athlete.
80,53,“I think he is a good president.”
84,53,"It's not a prank because it's an attempt to stop the spread of a virus, and it's not an actual prank."
85,53,"Vaccination is a part of the ACA. The ACA was a joke, but it was not a joke."
53,4,The CDC is not involved with the ACA. They are trying to stop the spread of AIDS.
53,16,CANNOTANSWER: It is an anti-vaccine law.
56,53,"""The ACA does not exist because it is an evil ideology. If Obama hadn't acted like that, he would have made it into the constitution."""
59,53,"I just came from a job and wanted to see if anyone else was on that list, but I figured the title was misleading."
63,53,He’s stating his point of view and his desire to get in the nba.
80,53,The president has done a fantastic job protecting the nation. The NSA is not the government. The president is the government.
84,53,"Vaccination isn't an effective prank, because it's not effective. It's not an effective prank because it's not a prank. It's an effective prank."
85,53,Vaccination is not a joke. It's a joke. It's a joke. The ACA is a joke.
53,4,They're just promoting the disease and trying to stop the spread of AIDS. They're only promoting the disease and trying to stop the spread of AIDS.
53,16,The ACA is an anti-vaccine law.
56,53,This is a topic that I've often written and it's very interesting.
59,53,"There is an article called ""The ACA is a joke"" where people have to talk about Obamacare. The ACA is the joke and is essentially the joke."
63,53,You gotta get some respect and say that you're not a troll.
80,53,The government isn’t the government. It’s the government. The government is not the government. The government isn’t the government.
84,53,It's also a joke because it works.
85,53,The issue is the people that don't wear a mask. Because that's what he's trying to say.
53,4,Is a person like him who is more than happy to be in the NSA. Or maybe the CIA?
53,16,"The CDC, government, and the media are trying to bring attention to the ACA. 'The ACA is an anti-vaccine law.'"
56,53,'I'm very much into this topic and I'm more into the ACA because of the fact that the government is supposedly trying to prevent the spread of AIDS.
59,53,There's a lot of ins and outs. That's why people think wearing a mask is a joke.
63,53,>He said a prank about a guy putting on a mask to stop a virus in his mouth. It's essentially about the CDC and the vaccine that works.
80,53,"In a country with an AIDS epidemic, everyone needs to put their money into a government. So that's what sexism is. The military isn't going to go and be forced to spend a lot of money to keep people safe. It's not going to be fun to have them wear a mask."
84,53,This is the last thing I want to hear.
85,53,"I haven't seen the ACA repealed yet. Sadly, it's still a joke."
53,4,The NSA is an anti-virus organization.
53,16,"""... I’m not going to say I don’t think that I can keep up with it. I’m only in the states and I don’t know if I can keep up with it."","
56,53,This is a really important ad for the book: the CDC is getting a bad review of Obamacare in the U.S.
59,53,Are you sure you don't think wearing a mask is a good idea?
63,53,So I would say that the CIA and CDC are the only people that would be willing to wear it?
80,53,It is illegal for the US to have laws that prevent people from using masks and also to use a mask to conceal what is happening.
84,53,"I’ve heard a lot of things I have to say about this, but a lot of people think this is a prank."
