sender,receiver,message
53,4,how does the mask make his breath come out of the back of his head
53,16,how does the mask make his breath come out of the back of his head
56,53,says the woman that wears the mask to protect herself lmao well dear the gun works the mask doesn t
59,53,oh man you should come to georgia it s like people here think wearing a mask gives them covid there s so few
63,53,putting on a mask to walk ten feet through a restaraunt and then taking it off when i get to my table is one of the dumbest things things i ve ever done in my entire life and i ve done a lot of dumb things
80,53,i m not against vacks mandates cuz i don t think i ll catch the cough i already had it i m against them cuz they ruin the economy get people fired and people should be able to choose to wear a mask or get the jab if they want not by force
84,53,i love coaching however if one official or admin address me about our players not wearing a mask or wearing it properly under a helmet i will resign and not coach until this nonsense stops
85,53,oh man you should come to georgia it s like people here think wearing a mask gives them covid there s so few
53,4,Wearing a mask is part of the measures deployed by the government to aid in stopping the spread of a virus.How does the mask make his breath come out of the back of his head
53,16,The problem with your state is the lack of a proper mask.
56,53,"i think the whole article is an attempt to defend a government mandate, which is absurdly demeaning"
59,53,"I'm sorry, but your comment is in response to my recent post."
63,53,>If one official or admin address me about our players not wearing a mask or wearing it properly under a helmet i will resign and not coach until this nonsense stops
80,53,"I don't know what you mean by 'unfortunate', but I think a lot of this is going to change, and some people just don't agree with it."
84,53,I have some friends from high school who would go to college wearing a mask for their teammates to help prevent the spread of a virus.
85,53,And that's when you get infected with a virus
53,4,"OP, you say the government is trying to protect your breath, and what you see is not a good idea."
53,16,A mask isn't something a man should wear in his head. It's a protective covering. Wearing it under a helmet makes it easier to catch the virus.
56,53,"... So your name screams ""Lmao, dear the gun works the gun doesnt""? Is this a thing?"
59,53,"I’m a spokesman for the state of Georgia. I wear a mask to get vaccinated. I agree with you, putting on a mask gives them covid there s so few oh man you should come to Georgia."
63,53,"I've done a lot of dumb things with my mask. I've done a lot of dumb things with it and it's been a huge sneeze after it. I'm really a little bit sad that I got a full mask. I want my players to get in the game, so I'm not wearing anything else besides my helmet. I'm a football coach. I think that's one of the reasons I play football. I was just a student. I did a lot of dumb things like wearing my helmet and my helmet."
80,53,"Wearing a mask or getting the jab is part of the measures deployed by the government to aid in stopping the spread of a virus. I don't know what you mean by 'unfortunate', but I think a lot of this is going to change, and some people just don't agree with it."
84,53,I'm sorry but I think you have to keep your head down. You should do what you can. I'd be in tears just thinking of you.
85,53,I read the first two paragraphs of your post. You sound like a shady guy.
53,4,"OP, you say the government is trying to protect your breath, and what you see is not a good idea."
53,16,He is a shady guy.
56,53,"IANAL, but i know that in the UK I've never seen an article on a guy wearing a mask that gets a sneeze and gets a jab. Especially since he wears the mask a lot."
59,53,"I've heard a lot about these nitpicks in the past, but I don't remember what the ""advice"" was."
63,53,I love to put on my mask as well and it helps me see the point of my mask.
80,53,"... and in case there isn't a lot of this here, the issue is not that you are not a legitimate citizen, but that the government is not supposed to do anything. This is a state-wide issue, but a federal law isn't enough for it."
84,53,"I was one of my best coaches in college, and was asked to give a presentation on this one because he thought there was a problem with the national guard rules. I would wear my mask every game I had. I'm not gonna resign."
85,53,"I don't think the article is accurate at all, I think it's a very poor interpretation of the post. I think the author was trying to imply that the state is not allowed to have the disease control program, so they should try to make it very clear."
53,4,> if one official or admin address me about our players not wearing a mask or wearing it properly under a helmet i will resign and not coach until this nonsense stops
53,16,"So if you wear a mask and get a sneeze, isn't it worth putting a mask on?"
56,53,It's possible they were trying to help his health and he wasn't a good at it.
59,53,You guys have been getting too blatantly repressed.
63,53,I think the only thing that makes sense is that if they had to wear a mask and had a syringe and helmets on that day I'd be pretty fucking crazed.
80,53,"I have no idea if you're saying that, but the truth is, the government doesn't have to enforce anti-virus laws."
84,53,"CANNOTANSWER: ""This is a pretty simple example of a government effort to stop the spread of a virus. The only thing that keeps me awake when I go to sleep is when I don't have enough energy to run around."
85,53,I'm not a shady guy but I'm a bit agnostic. I'm not sure what to say about your post.
53,4,I'm assuming he meant that the national guard isn't allowed to enforce anti-virus laws?
53,16,"I've got to say I'm glad the government has not removed the ""unfortunate"" part, because it's not going to change. But you also need to be careful that your head is not in a position to absorb any potential harmful substances from your mouth - such as coughs or sneezes."
56,53,Is it because he's a sneeze and a jab?
59,53,"""The first person comments on the video are based on my knowledge of how the government is doing things in our country. What he's saying is... I don't think he can get vaccinated for HIV (because the government isn't going to fix it)"
63,53,I'd have to read the whole thing if I was an athlete.
80,53,I read a few sentences about the government's role in the government. They are very ineffective.
84,53,"It's not a political issue, and it's not a political issue at all. I mean if you want to change the rules for a team, and if they haven't, don't. This is not a presidential issue at all, but it's not something that the media is ever going to be about."
85,53,I think I'm a bit agnostic. I'm only in the states and I don't know if I can keep up with it.
53,4,"CANNOTANSWER: ""The first person comments on the video are based on my knowledge of how the government is doing things in our country. What he's saying is... I don't think he can get vaccinated for HIV (because the government isn't going to fix it) I've got to say I'm glad the government has not removed the ""unfortunate"" part, because it's not going to change."
53,16,I'm not going to say I don't think that I can keep up with it.
56,53,"I'm sorry to say it's been a while since I've been here, but I think it's time to move on."
59,53,"There is nothing we can do to fix the problem and we have no solution. If you go to the emergency room, it will be all over. The first couple days will be the hardest."
63,53,I didn't see a comment about the mask but I am not familiar with how it is used - I am talking about the head mask and a very common use.
80,53,So you said he was a fag.
84,53,I don't think there's enough information available to me about this.
85,53,Is there an ACA for that? Is it possible for the president to wear a mask?
53,4,I was in the medical field for 5 years.
53,16,"... that's not my position, the CDC, the government and the media don't have any information to go on with it. 'I'm not sure what to say about your post. I'm only in the states and I don't know if I can keep up with it."
56,53,"I thought you meant ""I'm the guy that thinks he's a dick and a sneeze and a jab."""
59,53,"IANAL. I'm a huge fan of people who believe in masks in Australia. And I'm pretty sure they've seen a lot of them. This is about the health care system. A person that wants to work, be forced to participate in work, etc. and then become an active member of the society, have a right to a job, not just to the government, and who should work. The only thing I really do is vote for someone who wants to work."
63,53,It's part of the measures deployed by the government to aid in stopping the spread of a virus.
80,53,"I think it's pretty obvious to be a fan of the government. The government is not trying to prevent the spread of AIDS. It's a crime for the NSA to impose a law that identifies as ""fag"" and also the government has no legitimate interest in preventing it."
84,53,I really think he means they're trying to try to get out the virus by 'putting them on a mask' :/ oh and then he has AIDS.
85,53,I want to see if I have a chance in this world to actually make a big statement to that effect.
53,4,I'm not sure if this is a real problem here but it's not an issue that the NSA doesn't have a legitimate interest in preventing.
53,16,The media is not trying to do anything about it. I'm trying to be more of a non-partisan. But I really don't think there's any real opportunity for the media to do anything about it. It would be a better idea for the NSA to do something about it to bring attention to the AIDS/HIV epidemic than to let the press try to hide it from the media.
56,53,"""Well dear the gun works the gun doesn't"""
59,53,"A mask – and a few other things – are part of the CIA, FDA, FDA and CDC's treatment of people with HIV. It's very important to know that the mask is against the CDC's protocols and does not prevent them from becoming vaccinated for the disease. It is an important part of how health care is done. That's why it's so important to know that the masks are used."
63,53,There is a lot of confusion in that sub and you're right. I don't know what to say.
80,53,"It is absolutely illegal. It is not illegal. It is not illegal. It is not illegal. But it is a crime. It is illegal. It is not illegal. It is illegal. The government is acting to protect the public, but it isn't going to stop the spreading of AIDS. I'm sorry, but I'm sorry that he isn't even going to be a presidential candidate."
84,53,What a dick move. I think the president needs to resign. I would hate to hear about someone that does this to my team. The president needs to show his disrespect to his staff. I would not want to be my coach. I would make the team do it because they have a problem with the National Guard defending players who don't wear masks to fight a virus that has already spread. I'd be scared that the other team won't recognize my name. I don't think we are all in a big deal about a man who is a guy
85,53,"Well, the ACA doesn't include HIV and it is a really stupid thing to wear, especially since there is a huge omission in their health care policy. That's not how the virus gets spread in the US. I mean if they're talking about vaccinating the US and giving them more of the options than the ACA does he have to be more hesitant to do so?"
53,4,">I'm glad the government has not removed the ""unfortunate"" part, because it's not going to change.',"
53,16,"CANNOTANSWER: 'He is a shady guy. ', 'He is a shady guy.', 'So if you wear a mask and get a sneeze, isn't it worth putting a mask on?"", 'I'm not going to say I don't think that I can keep up with it.'', 'I'm not going to say I don't think that I can keep up with it.', 'He is an important part of"
56,53,I think the government is a clone.
59,53,So... the president wants to get sick with a mask to protect his kids?
63,53,"I think you need to ask yourself this: ""Dad, I need a I'm not sure how many people in the US actually wear masks, just that they don't know much about the system and the facts. They're just trying to push the issue aside, but if I were to say I'd have done it all the time, would I."""
80,53,"I’m sorry, but I’m sorry that he isn’t even going to be a presidential candidate."
84,53,"CANNOTANSWER: ""We wear masks to fight the flu. I don't care who the title is, I think you know the issue."""
85,53,So we're thinking of this: Vaccination is part of the measures deployed by the government to aid in stopping the spread of a virus.
53,4,"'The first person comments on the video are based on my knowledge of how the government is doing things in our country. What he means is... I don't think he can get vaccinated for HIV (because the government isn't going to fix it) I'm glad the government has not removed the ""unfortunate"" part, because it's not going to change.',"
53,16,Is he getting a vaccine?
56,53,"The ACA does not exist because it is an evil ideology. If Obama weren't a tyrant, we would be a terrible country for our nation."
59,53,"A friend of mine did. He thought he had seen his brother, and wanted to take him to a public hospital to get vaccinated. He had seen an ape and said it was an awful infection. He thought the ape was a good guy and the government deserved better. Then when he turned his back on him he told me he needed to go to the hospital and have a treatment with his family and the police. He was really confused by the whole NSA and the CIA thing."
63,53,A prank. Especially when it comes to using a mask that's ineffective and that's not in a proper way. You're in a prank.
80,53,...The whole point of it all is to stop the spread of a virus.
84,53,>CannoTANSWER:
85,53,You're probably the one who got the idea. He wants you to get a mask.
53,4,>Wearing a mask is part of the measures deployed by the government to aid in stopping the spread of a virus.
53,16,The CIA has said that a person who doesn't wear a mask to fight an AIDS infection will likely have a greater chance of getting AIDS than a person who doesn't wear a mask.
56,53,"> the ACA does not exist because it is an evil ideology. If Obama weren't a tyrant, we would be a terrible country for our nation."
59,53,The title is misleading as well as misleading.
63,53,"It's called ""I've done a lot of dumb things with my mask. I've done a lot of dumb things with my mask and it's been a huge sneeze after it. I'm really a little bit sad that I got a full mask. I want my players to get in the game, so I'm not wearing anything else besides my helmet."" I'm really sorry, but the last sentence he was replying to was literally: ""...Is the head mask part of the measures deployed by the government to aid in"
80,53,"This is the first part of my comment in the whole thread. There is not much context here, but it's definitely an interesting thought that you're trying to provide. I don't see why they're doing anything wrong, and just don't want to see how it's gonna make the entire conversation much worse."
84,53,"Is it possible that Obama was wrong that the only thing that kept me awake when I go to sleep is when I don't have enough energy to run around? """
85,53,"It was a petty joke. It was a good movie, and I was about to say a lot:"
53,4,They're talking about a lot of the other things.
53,16,"As a person who grew up in a country where HIV/AIDS is a rare disease, you'd think if you were to have an actual infection you wouldn't be so bad in this era."
56,53,"So the president is a tyrant? Nope, nope, nope nope nope nope nope nope nope nope nope nope nope nope nope nope nope nope nope nope nope nope nope nope nope nope nope nope nope nope nope nope nope nope nope nope nope nope nope nope nope nope nope nope nope nope nope nope nope nope"
59,53,So the President has to go and have a treatment with his family and the police?
63,53,"If a film of a person is made about a group of people, it may have been referred to as a prank, but is still a prank? That is to say it's a prank that's going to end up in a movie."
80,53,You need to stop being in a war with the government and stop being a fan.
84,53,">We wear masks to fight the flu. I don't care who the title is, I think you know the issue."""
85,53,I am not sure what you're saying here.
53,4,"'I think you've got to say I'm glad the government has not removed the ""unfortunate"" part, because it's not going to change.', 'I was in the medical field for 5 years.', 'I'm not sure if this is a real problem here but it's not an issue that the NSA doesn't have a legitimate interest in preventing.'', 'The CIA has said that a person who doesn't wear a mask to fight the flu."
53,16,Is the president going to have a treatment?
56,53,"The ACA is not an evil ideology. It is a nonsense. If the president had acted like that, he would have made it into the constitution."
59,53,"I don't know if it's a joke but the title is misleading and misleading. Vaccines are not the right way to stop the spread of a disease. They're a way of fighting it. The fact that you can't find a doctor in time for work, and you don't have to visit the doctor is irrelevant."
63,53,Is there a definite answer? I can't even think of any.
80,53,I have never been asked to speak like that on a regular basis. I just don't understand how this is happening to this country.
84,53,"The best part is that all of this is the worst in the history of the world, and it's a very good thing the president's got the support of the people who are vilifying him for it. This makes a lot of sense."
85,53,I'd like to point out that the president is very petty and misogynistic and uncooperative. He should put on a mask and get vaccinated is the best way to stop the virus. Please wear masks.
53,4,"CANNOTANSWER: ""We wear masks to fight the flu. I don't care who the title is, I think you know the issue."""
53,16,"It is called the 'unfortunate' part because it is not the right way to stop the spread of a virus.It is called ""We wear masks to fight the flu. I don't care who the title is, I think you know the issue."""
56,53,"The only person you have to talk to about the ACA is yourself. I think people should have all this information as evidence of who they are, not just someone who is not the president, and has no interest in defending it. The ACA is not an evil ideology. It is a nonsense. If the president had acted like that, he would have made it into the constitution."
59,53,You don't have to go to the doctor. It's a ridiculous and inaccurate statement. The government's work has nothing to do with what it does.
63,53,I feel bad for the NSA. They're being such a shitty thing. There's a lot of misinformation in this sub. And it's still very confusing.
80,53,"The NSA is not a government agency, it is a government."
84,53,"Nope. I'm the president of the country, and it's not a presidential issue at all."
85,53,"People in Georgia are just getting sick and a mask, and it's more of a symptom of a lot of opportunistic policies. This is the only country I've heard of where someone who has a virus could have a mask on."
53,4,"The fact that there is no vaccine is indicative of what is happening. There are ways that could be used to prevent it, and this does not sound like a practical solution to the problem."
53,16,"The CDC, the government, and the media are just trying to cover their noses with their eyes."
56,53,I'm very much into this topic and I'm more into the ACA because of the fact that the government is supposedly trying to prevent the spread of AIDS.
59,53,I think people should realize that their opinions on this article are incorrect. This is how it is written.
63,53,This is why you have to wear your helmet. A mask is a joke. You should wear it. You should wear it.
80,53,What is not a government agency?
84,53,>We wear masks to fight the flu. I don't think it's a big deal.
85,53,"The Obama administration doesn't seem to have any utmost control over saddling the president with his ""moon phone."""
53,4,CANNOTANSWER: The only person you have to talk to about this topic is yourself.
53,16,Is there a problem with the government's work or is it a political issue?
56,53,he is trying to justify that it's an 'evil ideology' to protect the people and keep people out of prison for years
59,53,>[The article is](https://www.senate.gov/hiv/gov/hiv/do-all/html_a_post_to_the_gov/fda/msd/_a_post_to_the_gov/public-health_ass_do-a-story/dept/ffda/comments/public-health/)
63,53,"It sounds like he got a big message from the wiki article titled 'Hey, I don't understand the wiki', or that I would like you to look at this more clearly.' I have to say that he is a bit of a troll."
80,53,"It's a crime for the NSA to impose a law that identifies as ""fag"" and also the government has no legitimate interest in preventing it."
84,53,"No one seems to have much insight into what's actually going on. I'd love to hear it, but it's a hard one."
85,53,>The problem with a mask is the people wearing it don't actually know how to walk because they think it's bad. The problem with a mask is the people wearing it don't actually know how to walk because they think it's bad.
53,4,"""We wear masks to fight the flu. I don't care who the title is, I think you know the issue."""
53,16,The sneeze mask is a great way to cut off airborne viruses.
56,53,...And the other part of it I find to be funny is that you are quoting a prank. I’m pretty sure this was the NSA claiming to be part of a joke.
59,53,What exactly is an Obama campaign joke? I mean what exactly is a party line that says?
63,53,'Twas one of the dumbest things things I've ever done in my entire life and i've done a lot of dumb things with my mask'.
80,53,The President is actually making a statement about this to the NSA.
84,53,"He also said that he wanted to stop the spread of AIDS because he saw that there was a problem with the national guard rules. The president could have just sat on his helmet for the whole time and said, ""We don't know how to stop the epidemic."""
85,53,"People wearing a mask to'stop' HIV are very dangerous, and the people vaccinating themselves to prevent it are also very dangerous, because they don't think it would help. Vaccination is part of the ACA, so it doesn't have to be a bad idea for the President to do it. It's an anti-viral campaign, and not a big deal at all. Vaccination is part of the ACA, because it is an anti-viral campaign, and not just for that kind of people."
53,4,"""We wear masks to fight the flu. I don't care who the title is, I think you know the issue."""
53,16,"In order to spread HIV, you need a mask. You can get an ivy to block your breathing. You also have to make sure to get a mouthwash."
56,53,Is there a reason the Obama ACA isn’t an evil ideology? Then who is to rewrite it into law?
59,53,"CANNOTANSWER: The first time I ever sat on a computer reading this I thought it said ""yes the newest strain is soooooo contagious just bc they have a mask on their hands pics don't mean they re using it."" I don't understand why the article is a joke."
63,53,"I know that he said something about a prank he got a few times, and I guess he was referring to a joke or something?"
80,53,This guy got a nice guy.
84,53,Isn't it a dick move. I think the president needs to resign. I would make the team do it because they have a problem with the National Guard defending players who don't wear masks to fight the flu.
85,53,>the problem is the people in the U.S. who don't wear a mask.
53,4,The whole thing is really ridiculous. The nsa is a government corporation. They are only promoting the disease and are trying to stop the spread of AIDS.
53,16,Is there a problem with the government's work or is it a political issue?
56,53,"The ACA is not an evil ideology, but a prank."
59,53,/r/ObamaFacts is one of the major contributors to this discussion.
63,53,I don't know why I was fucking up all these comments for my job. I've just figured it's hilarious how the fuck you're responding to all of them.
80,53,"In general, the government is the largest organ in the U.S. that controls the government. Especially if it is the US."
84,53,He says the team's rules aren't working. They're too lazy to take care of the virus.
85,53,Vaccination is part of the ACA. So he should wear a mask and get vaccinated is the best way to stop the virus. Please wear masks.
53,4,>the problem is the people in the U.S. who don't wear a mask. The whole thing is really ridiculous. The nsa is a government corporation. They are only promoting the disease and are trying to stop the spread of AIDS. Is there a problem with the government's work or is it a political issue?
53,16,the ACA is a political issue? The whole thing is really ridiculous.
56,53,"The ACA is actually a prank, and if Obama is going to change it, this would be the first time it has ever happened. That said, there are a lot of things you can do to get a bit out of it."
59,53,I think the point of the article is to provide more information than just the words that come up.
63,53,That's why I don't get to talk about how I feel.
80,53,"I think he is doing good, but not as good as his rivals. I don't think he's a good President."
84,53,I wouldn't even care who the title is.
85,53,"The ACA is infected. No one should wear a mask. That is the problem, and the president is not being cooperative."
53,4,OP is just a good fucking reporter - this is just another bit of nonsense.
53,16,"The ACA is an anti-vaccine law. It's not a political issue. The ACA is not an evil ideology, but it's a political issue."
56,53,The fact that there is a prank in the movie that a lot of people have mixed up is just so odd.
59,53,"There are lots of other ways to combat HIV. What they do is to treat HIV, they do it, and they can do it without it."
