sender,receiver,message
63,62,I lose a mask at least four times a day. This whole thing is a scam.
70,63,I lose a mask at least four times a day. This whole thing is a scam.
71,63,"Little blue ones are totally useless.Even the best don't work very well.Exhale smoke while wearing a mask,any mask and you will see the leakage. It's frightening how dumb they think all of is are."
84,63,I lose a mask at least four times a day. This whole thing is a scam.
89,63,i m going to say this about twitchcon and masks you can hate me if the state town doesn t have an mandates you can t get mad that an event doesn t not sure if sd has any mandates as a vaccinated person with boosters i will not go anywhere that requires me to wear a mask
101,63,Wearing masks and getting vaccinated is the best way to stop the virus. Please wear masks.
63,62,Vaccination is not a way of stopping the spread of a virus.
70,63,Wearing a mask is part of the measures deployed by the government to aid in stopping the spread of a virus.I lose a mask at least four times a day. This whole thing is a scam. I lose a mask at least four times a day. This whole thing is a scam. I lose a mask at least four times a day. This whole thing is a scam. I lose a mask at least four times a day. This whole thing is a scam. I lose a mask at least four times a day. This whole thing is 
71,63,I get a little resentment. I just squirm into the air. I don't really want to have to see the leaks anymore.
84,63,"If you want to get some advice from a medical professional, you must be an asshole to get one."
89,63,Wearing a mask is part of the measures deployed by the government to aid in stopping the spread of a virus.
101,63,Wearing masks and getting vaccinated is the best way to stop the virus. Please wear masks.
63,62,And this is why the government doesn't put masks on kids when they're young.
70,63,We all like 'no masks'. I'm all for it.
71,63,"Unless you are using a mask, I'm sorry."
84,63,"I don't think this is a scam, but if someone is telling you to do it, or if you're going to have an accident, you're probably an asshole."
89,63,"It is an event that will probably end in death, but the people who will have to pay for the event have no other options."
101,63,Wearing masks and getting vaccinated is the best way to stop the virus. Please wear masks.
63,62,"I know that it's going to be hard, but I know that this is a legitimate issue."
70,63,"I think the real story is that in 2009, the president decided not to wear a mask. They made it so that people could see he was infected and if they didn't, the president would retaliate and use it to spread a virus. In this case, he had to wear a mask that was a lot more effective to spread a virus."
71,63,"Honestly, it's almost as if there's something wrong with it. A person's eyes and their eyes and their nose aren't really affected by it."
84,63,"It's the CDC scum that gets the government doing what they do. But, this is the problem they're getting out of the way. They will be trying to stop people from using these masks, but they can't."
89,63,I have been to the CDC a few times and it sounded like a good idea to ask someone if they have any questions. I don't know what that means.
101,63,Wearing masks and getting vaccinated is the best way to stop the virus. Please wear masks.
63,62,It's interesting how the CDC has decided not to put in a mask because that would result in a death in the eyes.
70,63,You can't have a joke without talking about the right thing. I can't even imagine how many people would respond if I told you otherwise. I can't imagine how many people are able to tell who the NSA is or what the government is doing. This is just some common misunderstandings of the CDC.
71,63,I don't want people to think that's a joke. They're not fools.
84,63,"It seems like this is an ad hoc problem and has some pretty big side effects. There's a reason for that, but it isn't the right thing to do. This is something you have to do if you want to be a threat to yourself or someone."
89,63,I like that you have never heard of this and are also worried about the FDA suing you.
101,63,Wearing masks and getting vaccinated is the best way to stop the virus. Please wear masks.
63,62,You're being sarcastic.
70,63,CANNOTANSWER:
71,63,">I'm a smoker and it's not a problem, but it's a lot! I do it a lot! I do it a lot! I do it a lot! I don't know if it would work for so long as I was a smoker. I'm sure there are plenty of people who believe in a ""smoking mask"" looks like. It’s a bit of a fake - it’s just something that makes you think, not real life, is fake."
84,63,"""[NAME] has some weird stuff for the last few days:"
89,63,"I don't think you are a moron. I just feel that the media isn't interested in the fact that you are going to die. It isn't going to be a good idea to go to a medical event that requires you to wear a mask. I mean it's important for the government to make sure the public gets adequate information on what it's about. It's not just a ""twitchcon"" thing. I think the CDC has some issues with this - I'm also interested in the question because the government needs to be "
101,63,Wearing masks and getting vaccinated is the best way to stop the virus. Please wear masks.
63,62,CANNOTANSWER: I like that you have never heard of this and are also worried about the FDA suing you.
70,63,I know what I'm talking about. But the president is clearly not the President of this country.
71,63,I can't believe some people say that this is the one scam they are using.
84,63,"The first part of the story is called ""Pihoned into an infection by a mask. ""."
89,63,"Getting away from a bunch of the media, you seem like a moron."
101,63,Wearing masks and getting vaccinated is the best way to stop the virus. Please wear masks.
63,62,CANNOTANSWER is a moron. He has no business knowing what a mask looks like.
70,63,CANNOTANSWER:
71,63,Well if the government doesn't make a snarky joke about the idea of a mask then why would they be using it to get rid of the virus?
84,63,"Vaccination is a terrible disease. If your team is vaccinated, a player can not be infected. If they are not vaccinated, you will have to wear a mask. The only way to stop it is to put on a mask. The only way to stop it is to put on a mask so you can be vaccinated."
89,63,"It's important for the government to make sure the public gets adequate information on what it's about. It isn't just a ""twitchcon"" thing. They don't get to make it official because they're all in the states."
101,63,Wearing masks and getting vaccinated is the best way to stop the virus. Please wear masks.
63,62,I don't think that is a really big deal.
70,63,If the CDC had never retaliated it would've just been a joke and everyone would've believed it.
71,63,This is a good one IMO.
84,63,"My mother would try to get me a piece of the virus when she woke up. She'd try it and have her own infection, but she has no idea how to get it."
89,63,I just wrote a link to the CDC article. I think the CDC has a lot of issues with the CDC '.
101,63,Wearing masks and getting vaccinated is the best way to stop the virus. Please wear masks.
63,62,"The whole thing is a scam, huh?"
70,63,[http://www.nasa.gov/ /r/whs-faqs/faqs/news-issues-agency/index.php?v=0ac3&ap=0B2Q&t=0VWB&ob0C3&ac3+&p=1Bf5XF8S&I=0b0QF8&sb0X=0f0F2K4X&qq=i&t
71,63,"The only real solution I have to this shit is for a guy to use a fake mask. Its not a snarky joke, but that's what it is."
84,63,"""I am not sure if this is a scam, but if someone is telling me to do it, or if you're going to have an accident, you're probably an asshole."""
89,63,"Isn't that the issue of the CDC? The fact that they say ""I don't wear a mask to avoid getting sick"" a red flag?"
101,63,Wearing masks and getting vaccinated is the best way to stop the virus. Please wear masks.
63,62,"The problem is that when a doctor or other health care professional says he sucks at preventing the spread of a virus, he is going to say ""yes, I need to get vaccinated."""
70,63,So you don't know the CDC.
71,63,"There are several kinds of masks out there that you can wear, some actually work to prevent you from getting sick from smoking, some don't. One is just one that people use to get sick from smoking."
84,63,"Vaccination is a terrible disease. If the team is vaccinated, a player can not be infected. If they are not vaccinated, you will have to wear a mask. The only way to stop it is to put on a mask. The only way to stop it is to put on a mask."
89,63,"It's a good idea, and a good idea to vaccinate yourself. This is how health care works."
101,63,Wearing masks and getting vaccinated is the best way to stop the virus. Please wear masks.
63,62,I just got my hands on a fake mask.
70,63,"The truth is that you aren't a doctor, and therefore aren't aware of what the disease is."
71,63,No. You don't smoke. You smoke. You smoke. You smoke. You smoke. You smoke. You smoke. You smoke. You smoke. You smoke. You smoke. You smoke. You smoke. You smoke. You smoke. You smoke. You smoke. You smoke. You smoke. You smoke. You smoke. You smoke. You smoke. You smoke. You smoke. You smoke. You smoke. You smoke. You smoke. You smoke. You smoke. You smoke. You smoke. You smoke. You smoke. You smoke.
84,63,There's an AMA about this right here where it says that this is actually a joke from someone who was vaccinated for HIV/VHC.
89,63,The whole thing is a joke. The CDC is suing a savage because the government has given them immunity and they feel a 'right' to make it look like they want people to wear masks and to do so. The CDC doesn't have the right to make that statement or to deny it as a joke.
101,63,Wearing masks and getting vaccinated is the best way to stop the virus. Please wear masks.
63,62,"The problem is that when a doctor or other health care professional says he sucks at preventing the spread of a virus, he is going to say ""yes, I need to get vaccinated."", ""I just got my hands on a fake mask."" The problem is that when a doctor or other health care professional says he sucks at preventing the spread of a virus, he is going to say ""yes, I need to get vaccinated."", ""I just got my hands on a fake mask."", ""The problem is"
70,63,I just lost a mask at least four times a day. This whole thing is a scam.
71,63,I like the sex joke. My boobs can barely see me when I smoke.
84,63,"> I've never heard the phrase ""I lose a mask at least four times a day. This whole thing is a scam.',"
89,63,The whole thing is a joke. The CDC is suing a savage because they have given them immunity and they feel a 'right' to make it look like they want people to wear a mask and to do so. The CDC doesn't have the right to make that statement or to deny it as a joke.
101,63,Wearing masks and getting vaccinated is the best way to stop the virus. Please wear masks.
63,62,"You're not a doctor. You are not a doctor. You are a health care professional who uses his or her job to prevent the spread of the virus. Vaccination is a terrible disease. If the team is vaccinated, a player can not be infected. If they are not vaccinated, a player can not be infected. If the team is vaccinated, a player can not be infected. If the team is vaccinated, a player can not be vaccinated, a mask is also"
70,63,"I would imagine that the first thing the president would do was say that the president should not wear a mask to stop the spread of the virus. And then just say, ""You know what I'm talking about. But the president is clearly not the President of this country."""
71,63,I don't think anyone said a fake mask that works is as good as a fake one that works.
84,63,"Vaccination is a terrible disease. If the team is vaccinated, a player can not be infected. If they are not vaccinated, you will have to wear a mask. The only way to stop it is to put on a mask. The only way to stop it is to put on a mask."
89,63,I'm not a fan of either and I'm not even going to go to one if there aren't any other things they can do besides make it look like they're going to need to get some time to work.
101,63,Wearing masks and getting vaccinated is the best way to stop the virus. Please wear masks.
63,62,A good health care professional is not a doctor and isn't aware what a fake mask looks like. You're going to find it hard to do your job when you don't know what a fake mask looks like.
70,63,"In 2009, the president decided not to wear a mask because he felt they were a way of getting people to be aware of the disease. But then he decided to wear one because the virus spreads. So he lost a mask. And then just said, ""If the CDC had never retaliated, it would've just been a joke and everyone would've believed it."""
71,63,"I hate those old jokes. But this is the one you have to be the fuck in the middle of. This is not a joke, this is the reason they are still in power, not the fact that they are being snoopy and people think they are just a joke."
84,63,"I'm so sorry, my friend, but how many people have you heard?"
89,63,The FDA doesn't even have the right to make a statement or to deny it as a joke. It's suing because they want to get it to look like it has to go to health care if the health insurance is going to take that issue away from them.
101,63,Wearing masks and getting vaccinated is the best way to stop the virus. Please wear masks.
63,62,"It's a huge thing that the CDC has done a pretty good job of removing the problem because the ""bad thing"" is causing health problems. There is no way in hell the CDC is going to give you a good reason to get vaccinated, because you have to do everything you can to stop the outbreak."
70,63,"I mean he may not wear the mask, but he may wear a mask because it is too uncomfortable and he may get sick. He may not be wearing it, or he might get sick with the virus. In some countries, he would not wear the mask, or he might just not be able to get vaccines in time for his trip."
71,63,It is the only way to prevent the spread of HIV. It has a number of side effects.
84,63,I just want to add to the first two things.
89,63,">The whole thing is a joke. The CDC is suing the people who don't wear a mask. It's the easiest way for a virus to spread, and it's the only way to prevent the spread of the virus."
101,63,Wearing masks and getting vaccinated is the best way to stop the virus. Please wear masks.
63,62,This is the only CDC doc who is a doctor. They have no right to say what the CDC is suing.
70,63,I am a president of the United States. I lost my mask at least four times a day. This whole thing is a scam.
71,63,It's funny that people are getting sick from having sex. They are doing it to have the shit gone. They are going to get vaccinated.
84,63,You have to tell your friend to get vaccinated.
89,63,It sounds like a joke. It's just a joke.
101,63,Wearing masks and getting vaccinated is the best way to stop the virus. Please wear masks.
63,62,"I don't think a doctor's job should be a doctor, but I think it's important that people have a valid medical opinion. It's not good for the health of the people, but it's not good for the health of the public."
70,63,"The president of the United States has said that the mask would be an ""abuse"" to stop the spread of AIDS. That's not the point."
71,63,"My mother told me that some women smoked, he'd never be able to smoke because they were allergic to a lot of tobacco. I would smoke in my own room. My parents never told me that, but I still would have to use a mask. We'd say the CDC is going to snoop because they don't want to be snoopy and that their goal is to get people sick from smoking."
84,63,"A joke, a joke. A joke, a joke. A joke."
89,63,The whole thing is a joke. The CDC is suing the people who don't wear a mask. They are suing the people who don't wear a mask.
101,63,Wearing masks and getting vaccinated is the best way to stop the virus. Please wear masks.
63,62,A doc should be the one to do the proper cleaning and sterilization. A doc should be the one to do the right thing and not the bad. It doesn't make sense that they would even want to if they couldn't do their job and have to tell the doctor that. It's a joke.
70,63,It's the best thing to do in the world. You can never stop the conversation.
71,63,"""We are going to snoop because they don't want to be snoopy and that their goal is to get people sick from smoking."""
84,63,Why are you being sued? It was a scam and they are suing because they are 'fooling' over what they are doing.
89,63,I don't see what the CDC can do if it is suing them a savage who is just not interested in a joke that you aren't a fan of. They can do anything they want with the savage and are suing the government for it. But I don't see what the CDC can do.
101,63,Wearing masks and getting vaccinated is the best way to stop the virus. Please wear masks.
63,62,Why is the CDC suing the people who don't wear a mask?
70,63,"As the name suggests, it is not that difficult to be president of the United States. But it may be hard to convince people that the CDC does not support any vaccines."
71,63,"It sounds like there's a lot of work to be done on those masks in a CDC study. This is about how we can prevent the spread of HIV. In my experience it's not a joke, but a joke."
84,63,"This is not a joke. This is a joke, and is a joke. The CDC are suing this for fraud. They are suing because it's a joke. They're suing because they're fucking themselves. It's a joke, and you don't think they're being a fool."
89,63,i've been snarky about the fact that i am suing people who don't wear a mask because they are sick
101,63,Wearing masks and getting vaccinated is the best way to stop the virus. Please wear masks.
63,62,No wonder that I am the only CDC doc I know of.
70,63,"I've seen a lot of people in this sub that would not recognize the ""fake"" joke in question because the person's name is a racist joke, and I don't think it's a joke at all. They're still trying to get people to understand that the CDC tries to stop the spread of the virus."
71,63,And you got the CDC.
84,63,"It is a joke, not a joke."
89,63,"I think the CDC is being suing the people who don't wear a mask. I think they are being suing people who don't wear a mask. If he's wearing a mask in public to help prevent the spread of a virus, they have to go."
101,63,Wearing masks and getting vaccinated is the best way to stop the virus. Please wear masks.
63,62,Is the CDC suing you because you want to know what a snoopy joke is?
70,63,"CANNOTANSWER: I know what I'm talking about. But the president is clearly not the President of this country.', 'Cannot imagine how many people would respond if I told you otherwise. I can't even imagine how many people are able to tell who the NSA is or what the government is doing. This is just some common misunderstandings of the CDC.', 'There are some shady things that we know about here. There are people on the Internet who find it funny.', 'I think it's a joke"
71,63,"Vaccination is a terrible disease. If the team is vaccinated, a person can not be infected. If they aren't vaccinated, they will have to wear a fake mask. The only real solution is for a guy to wear a fake mask. It sounds like there's a lot of work to be done on those masks in a CDC study. It is about how we can prevent the spread of HIV. Vaccination is a terrible disease. If the team is vaccinated, a person can not be in"
84,63,"I'm not saying this is a joke, but I do think there are some things the CDC has to get a hold of and why it's being sued. In fact, it's been reported in other countries by some, and they are actually suing it."
89,63,They need to go to the hospital in order to get vaccines on the way.
101,63,Wearing masks and getting vaccinated is the best way to stop the virus. Please wear masks.
63,62,"I'm not sure about you, but when the word ""snoopy"" comes up I think the word is snoopy. I don't know who the word ""snoopy"" is, but there are a lot of things the word snoopy implies."
70,63,That's the joke - it doesn't sound really serious.
71,63,"Vaccination is a terrible disease. If the team is vaccinated, a person can not be infected. If they aren't vaccinated, they will have to wear a fake mask."
84,63,"The CDC is suing you for fraudulent, misguided, and unscientific reporting of a ""cynical problem"" the government is suing the government for. It's not your job to tell a story and a joke to a naive person."
89,63,It's a joke. It's a joke because it's an actual joke.
101,63,Wearing masks and getting vaccinated is the best way to stop the virus. Please wear masks.
63,62,I think you guys are right to have your opinions and have theirs. I don't get if I can see it as a joke because I have to have mystical opinions but I do think that it is a legitimate issue.
70,63,"""We want to help stop the spread of AIDS."""
71,63,This is a ridiculous claim. A fake mask is a joke and a scam.
84,63,They're making a joke and then they can sue the person for it.
89,63,">""I just feel that the media isn't interested in the fact that you are going to die. It isn't going to be a good idea to go to one if there aren't any other things they can do besides make it look like they want people to wear a mask and to do so. The CDC doesn't even have the right to make that statement or to deny it as a joke. It's a joke because it's an actual joke."
101,63,Wearing masks and getting vaccinated is the best way to stop the virus. Please wear masks.
63,62,"""I lost a mask at least four times a day. This whole thing is a scam.', ""And this is why the government doesn't put masks on kids when they're young."", ""I know that this is a legitimate issue."", ""I like that you have never heard of this and are also worried about the FDA suing you.'"
70,63,"The joke is true, but the reality is that it's not a joke. The CDC is not giving it away. It is a joke, and it's not a joke. The president is taking it away from the community."
71,63,You're using a misleading phrase.
84,63,"I like you. I don't think this is a joke. I think it's an excellent joke. But I can understand what you're going to say, but I think that they're going to sue because they can't 'get the government to do what they do.' They're going to sue because they can't do anything about it."
89,63,> I just feel that the media isn't interested in the fact that you are going to die. It isn't going to be a good idea to go to one if there aren't any other things they can do besides make it look like they want people to wear a mask and to do so.
101,63,Wearing masks and getting vaccinated is the best way to stop the virus. Please wear masks.
63,62,And when they go to the hospital they say the same thing.
70,63,People in this sub have some misconceptions that the Obama administration has been racist.
71,63,There's an op yelling at someone who's got a good idea of how to do this in real life. You can't believe this but you can't really tell them. They don't believe the truth.
84,63,"The first part of the story is pretty nitpicky. But I can tell you that the first part of this story is pretty much a joke. The first part of the story is pretty nitpicky, but it's clear in the video that in my area the CDC are not using the virus to prevent sexual assault or even try to prevent the disease."
89,63,"You said that I don't know what it means to be sick but when I got back, I wasn't actually sick enough to wear a mask, I thought I had a problem with the fact that people don't know what the condition was, and I had an infection of something in my head that I didn't realize that there was an infection. I think I'm just in the right place - I mean, I don't know why I'm being sued if the government isn't suing me for something that I just said?"
101,63,Wearing masks and getting vaccinated is the best way to stop the virus. Please wear masks.
63,62,"I read that the first part of the story was pretty nitpicky, but I didn't really think much about it."
70,63,"It sounds like it's more of a joke, because it actually is. The joke is that the government is using the mask to stop AIDS. It's not a joke, because the government is."
71,63,They're telling a story that they're gonna be suing you for claiming the CDC is to do something. They're being snarky.
84,63,"Vaccination is a terrible disease. If the team is vaccinated, a player can not be infected. If they are not vaccinated, you will have to wear a mask. The only way to stop it is to put on a mask. The only way to stop it is to put on a mask."
89,63,What do you mean the CDC issuing people who don't wear a mask?
101,63,Wearing masks and getting vaccinated is the best way to stop the virus. Please wear masks.
63,62,"A lot of the time, the CDC is going to have their own lawyer to argue in their favor. If they are suing a doctor, they are suing a medical professional for false information, and they will suing a hospital or doctor for false information, to name just a few examples."
70,63,AIDS is a common problem in both developing and developing countries where the mask was not available.
71,63,"So the CDC is going to snoop about the vaccination? Because I guess if the government is going to do it so that they can stop a fucking epidemic with the mask, it will be that they are trying to snoop."
84,63,"A friend told me in a interview that the team is currently being vaccinated, he gets sick and can't get in. It makes me angry. I was going to do a blood test but I didn't. He did it when I was sick and got it back at a friend's house, and he didn't get it and I didn't get it. He ended up getting it because he was so ill he didn't get it back and he didn't want to have vaccated for HIV. He didn't get it"
89,63,"Using the word ""twitchcon"" to describe the term, I believe the ""no matter how it sounded"" is a very accurate explanation. In theory, the CDC is suing you for suing you for using a non-adversity phrase because they are not interested in making a joke about a joke, so I think the CDC is wrong."
