sender,receiver,message
101,63,Wearing masks and getting vaccinated is the best way to stop the virus. Please wear masks.
63,62,"Vaccination is not a way of stopping the spread of a virus.', ""[It's interesting how the CDC has decided not to put in a mask because that would result in a death in the eyes."", ""[It's interesting how the CDC has decided not to put in a mask because that would result in a death in the eyes."", ""[I read that]](https://en.wikipedia.org/wiki/SnoopyMeyEarthSnoop"
70,63,A lot of people in this sub have some misconceptions that the Obama administration has been racist.
71,63,"This is a very common line of ad hominems that's used for a good deal of time and so a lot of people aren't used to a CDC study. But there is definitely more to this than ""a joke"" and ""a joke."""
84,63,"It sounds like this was written a lot of times by the CDC, it could just be a joke."
89,63,What’s a twitchcon joke about?
101,63,Wearing masks and getting vaccinated is the best way to stop the virus. Please wear masks.
63,62,The CDC isn't suing you for the fact that the CDC's snarky nonsense isn't part of the job of preventing the spread of AIDS.
70,63,">""I want to stop the spread of AIDS."
71,63,"The CDC is trying to be snarky by putting masks in the CDC study. The CDC is trying to get the CDC to stop the spread of HIV, which is not the purpose of the vaccine."
84,63,"The word joke is misleading. It's a joke, and you can see it."
89,63,They are trying to sue because they are not interested in making a joke. They are suing because it is a joke. If you do not feel like you can't go to any events that require you to wear a mask. It doesn't sound like you will go to the events that require you to wear a mask. It sounds like you haven't seen what I mean. It's also important that you know that the CDC is suing people because they want to keep a record of how many people are suing the CDC to prevent HIV/AIDS.
101,63,Wearing masks and getting vaccinated is the best way to stop the virus. Please wear masks.
63,62,[Snoopy and EarthSnoop are](https://en.wikipedia.org/wiki/SnoopyMeyEarthSnoop).
70,63,"This is the part of the post where they have a few general criticisms of the president's stance. They're saying that his ""joke"" is being portrayed as a racist joke and I think a lot of people may not be able to support the idea."
71,63,"It's really a nonsense to say that the idea of a mask is what's happening, and the fact that it's being used to protect people from this is an understatement. It is only the one way to stop the spread of a virus and the CDC is trying to make money out of it."
84,63,"I think that the word ""scam"" is misleading, and I think it is not even a joke."
89,63,Vaccination is an essential part of a health care system. They are suing people for a reason that people don't realize.
101,63,Wearing masks and getting vaccinated is the best way to stop the virus. Please wear masks.
63,62,It's also important that you know that the CDC is suing because they want to keep a record of how many people are suing the CDC to prevent HIV/AIDS.
70,63,...the CDC is a joke.
71,63,Yes. I'm allergic to some tobacco.
84,63,Is this an actual joke by the US gov? Do you have one?
89,63,A twitchcon is a joke because it's an essential part of a health care system. It's an essential part of a health care system.
101,63,Wearing masks and getting vaccinated is the best way to stop the virus. Please wear masks.
63,62,"Vaccination is a terrible disease. If the team is vaccinated, a player can not be infected. If they are not vaccinated, a player can not be infected. If the team is vaccinated, a player can not be infected. If the team is vaccinated, a player can not be infected. If the team is vaccinated, a player can not be infected. If the team is vaccinated, '', '', '', '"
70,63,I'm a doctor and he is wearing a mask. I can't imagine that he is a jerk.
71,63,Vaccination is a joke because it's a joke.
84,63,"The joke in question is that the president can't be sued. If it were me, I would sue because the government is just suing them to keep it from the public. This is just a joke about the government and not about the government in general."
89,63,It's a joke because it's an essential part of a health care system.
101,63,Wearing masks and getting vaccinated is the best way to stop the virus. Please wear masks.
63,62,This isn't the only possible example of this being a joke.
70,63,"The CDC has a lot of authority over everything. The CDC has also had some major problems in some parts of the US and in other places. Firstly, the ""shame"" joke, while still funny, is a joke, but it's a joke because it is not intended to stop the spread of AIDS."
71,63,Because it isn't supposed to work. It's supposed to kill the HIV virus. Vaccination is a terrible disease.
84,63,I'm a doctor and I've done everything I can to help people find out what a disease is.
89,63,"""An essential part of a health care system. It’s an essential part of a health care system. It’s an essential part of a health care system. It’s an essential part of a health care system. It’s an essential part of a health care system. It’s an essential part of a health care system."
101,63,Wearing masks and getting vaccinated is the best way to stop the virus. Please wear masks.
63,62,"I can't remember the number of times I have heard ""Cannot think of this,"" or ""Cannot know what I'm saying,"" or ""I don't think it's a really big deal."""
70,63,So the President is going to take a mask away from the community?
71,63,"""It sounds like there's a lot of work to be done on those masks in a CDC study."""
84,63,"I was born with HIV, and I had a childhood of having to use the mask to go into the hospital to take care of it. I'm going to be on my feet for a long time, and we never did."
89,63,"Basically all the people in the US who have been sued for not having a mask, get vaccinated, and have a vaccine are going to die from this."
101,63,Wearing masks and getting vaccinated is the best way to stop the virus. Please wear masks.
63,62,"Vaccination is a terrible disease. If the team is vaccinated, a player can not be infected. If the team is vaccinated, a player can not be infected. If the team is vaccinated, a player can not be infected. If the team is vaccinated, a player can not be infected. If the team is vaccinated, a player can not be infected. If the team is vaccinated, the team can not be infected. If the team is "
70,63,Usually people will not understand the joke because of the context it is written in. But this is actually pretty funny.
71,63,"And then the next part: ""So what is this about? Do you feel the need to do a sexy joke?"""
84,63,"This is not a joke, but an important one."
89,63,"The facts about the ""twitchcon"" are so funny, but I still think they're actually a joke."
101,63,Wearing masks and getting vaccinated is the best way to stop the virus. Please wear masks.
63,62,"This is a lot of sarcasm. I hate to be jaded, but it is a lot of sarcasm. Whenever I hear the phrase ""snoopy,"" I usually think ""what's a good joke?"" because that is what a joke is. It isn't a joke at all. It's a big deal in my opinion."
70,63,A lot of people here think this is just a joke.
71,63,I hate all of this. I hate the whole “I like the sex joke. My boobs can barely see me when I smoke.”
84,63,This is a joke. It's a joke. It's a joke.
89,63,Why are they suing the people who don’t wear a mask because it’s a joke if it isn’t?
101,63,Wearing masks and getting vaccinated is the best way to stop the virus. Please wear masks.
63,62,Vaccination is not a way of stopping the spread of a virus.
70,63,AIDS is a serious problem.
71,63,I like the sex joke. My boobs can barely see me when I smoke.
84,63,I'm going to go out and have a good laugh if I remember right.
89,63,"People are going to be in the wrong if they are suing, and that will help them."
101,63,Wearing masks and getting vaccinated is the best way to stop the virus. Please wear masks.
63,62,I think he's being sarcastic in a joke because he has a mystical opinion that he is a doctor. Having sex with a fake mask is a good way to stop a virus from spreading. But if he's snarky about this then he has no idea what it actually means.
70,63,AIDS is a serious problem.
71,63,"Vaccination is a joke, it isn't just a joke and the CDC is trying to make fun of it."
84,63,Vaccination is an important part of the health system. It’s an important part of the health system. A lot of people are in the U.S. where the federal government does not have the power to stop the spread of a virus.
89,63,[That's not an anti-virus joke](http://www.reddit.com/r/Analogy/Analogy-in-Reddit/Analogy-In-Reddit/).
101,63,Wearing masks and getting vaccinated is the best way to stop the virus. Please wear masks.
63,62,"If a doctor and or other health care professional say they need to stop a virus, they have no right to sue them for a virus. This is a big deal if it's a joke, a joke for them, it's just a joke."
70,63,"""If the CDC had never retaliated, it would've just been a joke and everyone would've believed it."""
71,63,"Yes. Vaccination is the only way to stop the spread of HIV, but there is more to it than you can think. And then there's a few times where snoopy calls the CDC a joke and then it starts to talk about something else."
84,63,A lot of people are in the U.S. where the federal government does not have the power to stop the spread of a virus.
89,63,A lot of people in the US who think they're right to wear a mask are being lied to by the media. It’s an essential part of a health care system.
101,63,Wearing masks and getting vaccinated is the best way to stop the virus. Please wear masks.
63,62,"As a person who had been around a doctor's office for two years and was very concerned with his health, and was concerned that he needed a mask to stop the spread of HIV, I can say that the fact that the CDC is suing him is ridiculous. I have no problem with him going to the doctor to get vaccinated, or for not getting it done. He probably has a pretty valid opinion and it is pretty much the same thing as how a doctor will say ""I know you're not a doctor, and the CDC are suing you"""
70,63,CANNOTANSWER: 'I'm a doctor and he is wearing a mask. I can't imagine he is a jerk.
71,63,"Yes. It’s a joke, and it’s funny because the doctor isn’t going to be able to stop a fucking epidemic. They’re going to tell you the truth."
84,63,"There is no right or wrong way to stop HIV. It is a terrible disease. If the team is vaccinated, a player can not be infected. If they are not vaccinated, you will have to wear a mask. The only way to stop it is to put on a mask. The only way to stop it is to put on a mask. The only way to stop it is to put on a mask."
89,63,>A lot of people in the US who think they're right to wear a mask are being lied to by the media. It's an essential part of a health care system. It's an essential part of a health care system.
101,63,Wearing masks and getting vaccinated is the best way to stop the virus. Please wear masks.
63,62,It isn't only a joke. It's a joke.
70,63,They’re not doing anything wrong by using the mask to keep people in the area. They’re just sabotaging Obama as president.
71,63,Vaccination is not a joke. It's a joke.
84,63,"""There is a lot of potential for misrepresentation of a story."""
89,63,I've got to go. I've not even gotten to a doctor for myself. I've got to go.
101,63,Wearing masks and getting vaccinated is the best way to stop the virus. Please wear masks.
63,62,Vaccination is the only effective way to stop a virus. Vaccination is the best way to prevent a virus. It is the best way to prevent a virus. Wearing a mask and getting vaccinated is the best way to stop the virus. Wearing a mask and getting vaccinated is the best way to stop the spread of a virus.
70,63,The CDC has also had major problems in some parts of the US and in other places.
71,63,Is that a joke or a joke? Because that's what this is.
84,63,The CDC is the government. They're suing the CDC and the other side of the government for being a bit of a fucking nitpicky asshole.
89,63,>(http://www.reddit.com/r/Analogy/Analogy-In-Reddit/Analogy_In-Reddit/Analogy-In-Reddit/Analogy-Analogy/Analogy-In-Reddit/)
101,63,Wearing masks and getting vaccinated is the best way to stop the virus. Please wear masks.
63,62,"CANNOTANSWER: I like that you have never heard of this and are also worried about the FDA suing you. ''It's interesting how the CDC has decided not to put in a mask because that would result in a death in the eyes.""'', '[I read that](https://en.wikipedia.org/wiki/SnoopyMeyEarthSnoop.'')"
70,63,"""We all like 'no masks'. I'm all for it."""
71,63,"This is an interesting question: Do people understand why the CDC is using fake sexy masks? It sounds like they're being snarky compared to the CDC, and that's why it's a joke."
84,63,"""The first part of the story is pretty much a joke. I think it's pretty much a joke. But I can tell you that the first part of the story is pretty much a joke. I'm going to say that the first part of the story is pretty much a joke. The first part of the story is pretty much a joke,"
89,63,I’m going to say this about the [NAME] thing.
101,63,Wearing masks and getting vaccinated is the best way to stop the virus. Please wear masks.
63,62,"The problem is that when a doctor or other health care professional says he sucks at preventing the spread of a virus, he is going to say ""yes, I need to get vaccinated."""
70,63,"> ""I'm actually trying to get people to understand the concept of wearing a mask and a squeaky sound."
71,63,"Vaccination is a joke, as in, a joke. It's the only way to stop the spread of HIV. It's a joke because it's intended to stop the spread of the virus."
84,63,"In the US, it's a joke. It's a fucking joke, but it's a fucking joke."
89,63,That isn't a joke. It's a joke. It's a joke because it's an essential part of a health care system.
101,63,Wearing masks and getting vaccinated is the best way to stop the virus. Please wear masks.
63,62,The whole thing is a scam.
70,63,'Something I've seen a lot about this was sarcasm. I have not a great understanding of how to use a mask for a joke.
71,63,"I'm sorry, but the only way I've read this article is because it is one of the most misleading statements I've ever heard."
84,63,"Vaccination is a terrible disease. If the team is vaccinated, a player can not be infected. If they are not vaccinated, you will have to wear a mask. The only way to stop it is to put on a mask. The only way to stop it is to put on a mask."
89,63,The CDC can sue for a number of reasons.
101,63,Wearing masks and getting vaccinated is the best way to stop the virus. Please wear masks.
63,62,There are a lot of reasons to get vaccinated and not'snoopy'.
70,63,"... ""But the president is clearly not the President of this country.''"
71,63,"> The fact that the CDC is suing the government is making me wonder why it's even a joke, and whether they are legitimate. It's not a joke because it’s intended to stop the spread of the virus."
84,63,"As a physician, I'm convinced that the CDC is suing him for ""joke"" and is telling him to get the vaccine and prevents an epidemic of HIV."
89,63,"In the US, I would go to an American health care organization (not a government agency.) I would ask if I would go to the CDC and find a local doctor who is willing to help someone with their illness. I would also ask the doctor if the people suing the government have the doc's and doctors at their house in your town. The doc would take it and get me to do the interview and explain to them why it is a joke. I would also do a post to r/dosibbonish people."
101,63,Wearing masks and getting vaccinated is the best way to stop the virus. Please wear masks.
63,62,"I don't know how to do that. I mean, I understand why people are getting sick of being sick and then have to spend a week in the hospital, but that's a lot of time spent with the sick and need vaccinated. I can't figure out how to do that, and I think it's a good idea to get some time with a vaccinated person."
70,63,So I lost a mask at least four times a day. This whole thing is a scam. I lose a mask at least four times a day. This whole thing is a scam. I lost a mask at least four times a day. This whole thing is a scam.
71,63,"I just want to let you know that you are trying to say that ""we want to stop the spread of the virus, but we have to stop the spread of the virus""."
84,63,"I am a doctor, and I have worked for a health system organization."
89,63,Vaccination is the best way to prevent the spread of a virus. A mask is the best way to prevent a virus from spreading to people and they want to be able to keep the public from being able to say anything about it.
101,63,Wearing masks and getting vaccinated is the best way to stop the virus. Please wear masks.
63,62,I'm sorry if I didn't understand what you're saying.
70,63,"if a president of the united states wore a mask, he would be on his way. if a president of the united states had a mask, he would have been on his way."
71,63,People have all the answers in the title.
84,63,"Vaccination is a terrible disease. If the team is vaccinated, a player can not be infected. If they are not vaccinated, you will have to wear a mask. The only way to stop it is to put on a mask. The only way to stop it is to put on a mask. The only way to stop it is to put on a mask. The only way to stop it is to put on a mask. The only way to stop it is to put on a mask."
89,63,>The only reason to go to Twitchcon is because it is the only way for people to spread a virus. Vaccination is the only way to prevent the spread of a virus. A mask is the only way to prevent the spread of a virus. It is the only way to prevent the spread of a virus.
101,63,Wearing masks and getting vaccinated is the best way to stop the virus. Please wear masks.
63,62,I like that you have never heard of this and are also worried about the FDA suing you. [https://en.wikipedia.org/wiki/SnoopyMeyEarthSnoop](https://en.wikipedia.org/wiki/SnoopyMeyEarthSnoop)
70,63,"People who don't know about the CDC, can't be certain that is the real name of this thing. It's not a joke, is it?"
71,63,You said a lot. I don't think this article is credible. The CDC and NSA have been pushing this side of the issue for years now.
84,63,"I read this and it made me laugh out loud. I'm not a doctor, but I've been vaccinated for HIV (also, it's a terrible disease) and it's been reported that there is not enough vaccine to treat it."
89,63,"CANNOTANSWER OVER THIS - ', 'I'm not a fan of either and I'm also worried about the FDA suing you.'', 'Isn't that the issue of the CDC is a joke?', 'I just feel that the media isn't interested in making a joke about a joke, but I think the CDC is wrong.'', 'Isn't it important for the government to make sure the public gets adequate information on what it's about.''"
101,63,Wearing masks and getting vaccinated is the best way to stop the virus. Please wear masks.
63,62,"The question that is frequently asked is ""What a joke""?"
70,63,[NAME] [NAME] [NAME] [NAME] [NAME] [NAME] [NAME] [NAME] [NAME] [NAME] [NAME] [NAME] [NAME] [NAME] [NAME] [NAME] [NAME] [NAME] [NAME] [NAME] [NAME] [NAME] [NAME] [NAME] [NAME] [NAME] [NAME] [NAME] [NAME]
71,63,I'm a doctor and I can't do that because it makes me sick.
84,63,They're suing the government because they're going to sue because the CDC's suing the CDC because they're actually suing them.
89,63,"I think it's a joke. I'm not a fan of the media, I just think it's a joke."
101,63,Wearing masks and getting vaccinated is the best way to stop the virus. Please wear masks.
