sender,receiver,message
41,11,"""I think the hat is the product of the body, a hat is a hat. The idea that a hat is not a hat is just a way to show the warmth of a summer evening."
41,15,"CANNOTANSWER: 'If you haven't figured out the correct answer, it's time to look into getting a mask'. '(Songs like ""Sleep a head, play a hat"" and say, ""I love wearing a hat,"" and then ""I'd be uncomfortable if they said that's the case but it's probably too much to ask.""''(https://www.nytimes.com/fmn-dlm/news_report_report_"
41,24,"I think the idea that a hat is the product of the body, a hat is a hat. I think that it is really nice to have a guy that can't seem to believe this is a truth."
41,29,"I would think that he'd have to apologize and then have a conversation with the commenter, who essentially has a lot of experience in the field."
41,31,"This would be what they call the ""Mask me what I want, "" if I asked ""Is there anything else i can do?"""
41,39,I think the idea that the mask mandate is to create a public discourse is a good thing.
41,40,"I don't think the first part is cliche, but the whole idea of people being obligated to wear masks and a mask are the two most important parts. The tenth part is literally cliche. https://www.nytimes.com/fmn-dlm/news_report/2004/09/25/reporting-reporting-reporting-reporting-reporting-reporting-reporting-reporting-reporting-reporting-reporting-reporting-"
46,41,CANNOTANSWER'S OP.
47,41,I wore a mask while I was in Georgia because a doctor told me to wear a mask if he got sick. There were many reasons I wear one.
49,41,"""... I've been in a couple of hat films that are on the shelf so I am not sure how this works. I will always find them interesting because I am very good at getting my hands on the hat. I will always find them interesting because I am very good at getting my hands on the hat."
50,41,I really hate when you read this book. I read it from a stoop and I thought it was great. It's kind of funny. I think it's a little silly but it's kind of nice.
41,11,"I think the idea that a hat is the product of the body, a hat is a hat. The idea that a hat is not a hat is just a way to show the warmth of a summer evening."
41,15,A few days later (https://www.nytimes.com/fmn-dlm/news_report/2004/09/25/reporting-reporting-reporting-reporting-reporting-reporting_reporting.htm)
41,24,"It sounds like a great movie to me, but I don't really like them because a lot of people are like they are trying to wear a helmet while their doctor is talking about the mask and the mask mandate isn't lifted. I think that's a pretty accurate assumption. I think the only way for the mask mandate to be lifted is to allow a person to put a mask on themselves."
41,29,The whole idea of people being obligated to wear masks and a hat are the two most important parts. The idea that a hat is not a hat is just a way to show the warmth of a summer evening. I really hate when you read this book. I read it from a stoop and I thought it was great. It's kind of funny. I think it's a little silly but it's kind of nice.
41,31,I would agree that the idea of the mask mandate is a good thing.
41,39,"> If you haven't figured out the correct answer, it's time to look into getting a mask'."
41,40,My wife told me that the only reason she and my boyfriend don't wear masks is because they don't have enough money to buy a mask and they don't have enough money to afford a helmet. She said she was afraid a mask is gonna get old. She said she couldn't buy a hat to protect herself and was afraid she wouldn't if she didn't buy it.
46,41,"So, I'm not a coach..."
47,41,"I don't think it is about the health insurance, but about the rape scene."
49,41,>I love seeing films that are on the shelf so I am not sure how this works. I will always find them interesting because I am very good at getting my hands on the hat. I will always find them interesting because I am very good at getting my hands on the hat.
50,41,It is also not a gimmick. I read it from a stoop and thought it was great. I thought it was a little silly but it's kind of nice.
41,11,">I think that the idea that a hat is the product of the body, a hat is a hat. I think that it is really nice to have a guy that can't seem to believe this is a truth. I would think that he'd have to apologize and then have a conversation with the commenter, who essentially has a lot of experience in the field. This would be what they call the ""Mask me what I want, "" if I asked ""Is there anything else I can do?"""
41,15,"[Simpson, AB](https://www.nytimes.com/fmn-dlm/news_report/2004/09/25/reporting-reporting-reporting-reporting-reporting-reporting_reporting.htm)"
41,24,I agree with most of the other comments.
41,29,"What he is talking about is that it's a great idea. If it's not lifted, then why is there no mandate for hats? It is a joke."
41,31,"I'd say that the idea of the mask mandate is a good thing. Until you have any answers to the above, I don't think you have anything to add to the discussion."
41,39,">I have an eye that says ""I love being uncomfortable wearing hot clothes because I am hot"""
41,40,"It sounds like a good movie. But I don't like them because they aren't good hats for women. They aren't for men unless they get sick, and they aren't safe for women, because they aren't protected under the mandate. They are putting on a mask to show the warmth of summer. They are putting on a mask to show how much they love the heat."
46,41,I love coaching and my friends and I were there in the beginning. When I first started I was sucked into it.
47,41,"This is a lot of stuff about the CDC, and the fact that it has nothing to do with health insurance is another piece of it."
49,41,Then you'll come to the conclusion that it's actually a hat. It's not a hat. It's a hat.
50,41,"a few days later's quote ""The whole paper into the street when i grabbed it from my stoop the phrase mask up was on the front page of the print edition of the inquirer this morning i was suddenly overcome with the urge to yeet the whole paper into the street when i grabbed it from my stoop the phrase ""The whole paper into the street when i grabbed it from my stoop the phrase mask up was on the front page of the print edition of the inquirer this morning i was suddenly overcome with the urge the"
41,11,What is this? A book about health insurance?
41,15,'I want a mask for my kids
41,24,"""'I'm so sorry about my current job and I wish I could do this, but I'm so sorry that my work hasn't been done."""
41,29,"This was my first time seeing a hat. I don't even know how it actually works, but it's great hats and masks."
41,31,"It's also been suggested that you can get a mask, with a hat or a scarf, and to get a mask on yourself. The point is not that this is wrong, it's that the helmet or scarf doesn't matter. I think the idea of the mask mandate being lifted is better for the shin than the head and shoulders and not just on the hat."
41,39,What you need is an explanation.
41,40,I read an article a few months back claiming that the mandate has no effect on the national conversation.
46,41,"The quote on that sentence is titled ""If he had me, I would be a coach. And if he's my coach, I'll be a coach."""
47,41,""".. 'but when you're sick you do it because it makes you feel better. I think I'm pretty sure that we live in a country where the only person who is going to wear a mask is the one in which there are no people in this country."""
49,41,"> [Dave, how hot is this mask](https://www.tumblr.com/wp-content/uploads/2009/04/Python_Python_M') > (https://www.tumblr.com/wp-content/uploads/2009/04/Python_Python_M') ""[I love seeing films that are on the shelf so I am not sure how this works. I will always find them interesting because I am very good at getting my hands on the hat."
50,41,"The second and third part is so boring. The first part is basically like this: It's not the end of the world, it's just an euphemism for ""the nerd"" being the wrong word, but a different meaning. It's an entirely different feeling than it used to be. The first part is a gimmick."
41,11,Aside from this. My hat is a really big one and it's super nice and has a hat to it. If you like it and are a bit of a nerd I'd be a big fan.
41,15,"(Songs like ""Sleep a head, play a hat"" and say, ""I love wearing a hat"" and then ""I'd be uncomfortable if they said that's the case but it's probably too much to ask."""
41,24,"I'm not sure I've seen this movie but I'm actually really impressed by this one, because I think it makes it fun. I don't even have the mental capacity for that."
41,29,"“We need to get a hat on ourselves. I think it’s a great idea and it’s a funny one. But I feel the same way about my work, because if I work on a lot of people, I don’t have the confidence to be that way.”"
41,31,It sounds like you're very curious about the mandate.
41,39,"I agree with most of the other comments. What he is talking about is that it's a great idea. If it's not lifted, then why is there no mandate for hats? It is a joke."
41,40,"CANNOTANSWER, can you explain why it is a joke? It's a joke, and I don't think it has any meaningful context. There are lots of reasons why people don't wear hats. It's more like a joke than a great idea."
46,41,"The ""Maske"" doesn't have to come off as the'mask' it is called. It's a piece of gear."
47,41,"[Infamous](https://en.wikipedia.org/wiki/Cdc_department_of_health_and_accountability.html). There is a CDC article by an American researcher. It talks about the issue of the CDC not being able to take care of HIV/AIDS, and how the CDC is doing it."
49,41,"...I really think this mask is just a way to show the warmth of a hot summer evening. It isn't the end of the world. You can't have it on and be happy with the way you look. But ""[I really think this mask is just a way to show the warmth of a hot summer evening. It isn't the end of the world. You get so hot in there. ""((https://www.tumblr.com/wp-content/uploads/2009/04/Python_Python_"
50,41,"There is no such thing as a ""gimmick."" You can read it for yourself, but it can't really be used. The whole point of a gimmick is that it is a gimmick. If you read it for a few months, it will never make sense to you."
41,11, I read an article a few months back claiming that the mandate has no effect on the national conversation.
41,15,"""[Simpson, AB](https://www.nytimes.com/fmn-dlm/news_report/2004/09/25/reporting-reporting-reporting-reporting.htm)''"
41,24,"I've not been out to the parks yet, but I love the idea of having a hat that's in a really large hat. I have a huge amount of fun in it."
41,29,"CANNOTANSWER argues that the fact that the mandate isn't lifted has nothing to do with the mandate, because it will be too much with the way it is, and that the new laws have absolutely no effect on the health of the people of America. It's a bit of a stretch that a bunch of people aren't getting the vaccines, but they're getting it as a'mom' and there are still plenty of people who wear them."
41,31,"""An article on how hot is this mask](https://www.tumblr.com/wp-content/uploads/2009/04/Python_M') is in r/sci/fma/reports and r/a fewdays-after-the-fast-down-the-events). I think it's a great idea. The ""Maske"" doesn't have to come off as the ""mask"" it is called."
41,39,"""The whole point of a gimmick is that it is a gimmick. If you read it for a few months, it will never make sense to you."""
41,40,"It doesn't mean there's nothing to be said. There are plenty of people who think that's the point of a gimmick, and don't have any ideas on how to make sense of it."
46,41,No it's not. The mask. It's a mask. It's a mask. It's a mask. Its a mask. Its a mask. Its a mask. Its a mask. Its a mask. Its a mask. Its a mask. Its a mask. Its a mask. Its a mask. Its a mask. Its a mask. Its a mask. Its a mask.
47,41,I don't think a lot of people will like wearing a mask and a lot of people won't feel like putting one on.
49,41,"[[Dave, how hot is this mask](https://www.tumblr.com/wp-content/uploads/2009/04/Python_Python_M')"
50,41,I thought it was really funny and interesting because of the quote I read on Reddit. I found it very funny and I'm a nerd and it's actually good.
41,11,What's a hat?
41,15,"I think he may have a little misunderstood that ""Python"" isn't going to be in the national conversation despite what he said."
41,24,[Cannotinswer](http://www.tumblr.com/wp-content/uploads/2009/04/Python_M') is in r/sci/fma/reports and r/a fewdays-after-the-fast-down-the-events).
41,29,"""If you read it for a few months, it will never make sense to you."""
41,31,"I read this on the tumblr front page about a couple months ago, and it's pretty interesting that they called that the mask mandate was not lifted and that it wouldn't have any effect. I agree with a lot of them, but I also have to agree that the people I read aren't as knowledgeable about it as I am about the fact that the'mask mandate' isn't lifted because of the fact that it doesn't have any effect on the national conversation. It's a joke, and I'm a nerd."
41,39,"In the same way that people are being told that a hat doesn't have to come off as the mask, it's just a mask."
41,40,"""The inception of the mask"" is the article that states there's no mandatory hat in the USA unless it's lifted. It says the ""make-up mandate"" is the problem with it."
46,41,/r/Maske
47,41,"I'm not a doctor, but I have an opinion on it. I have a TB/HBJ infection and it makes me sick and feel better."
49,41,There are a bunch of people on the internet who think they are right and they do not.
50,41,That's a funny story and a funny one.
41,11,"CANNOTANSWER argues that the fact that the mask mandate isn't lifted has nothing to do with the mandate, because it will be too much with the way it is, and that the new laws have absolutely no effect on the health of the people of America."
41,15,"CANNOTANSWER: If you haven't figured out the correct answer, it's time to look into getting a mask."
41,24,I'm pretty sure I read it a lot.
41,29,"It's like a joke. I think the hat doesn't have to come off as the mask, it's just a mask."
41,31,So what if there isn't something that I would like to change my attitude to?
41,39,"I think that the ""make-up mandate"" is an argument that tries to sway people into hats. It tries to make people feel more comfortable in them."
41,40,"I read this a few months back, and I think it was pretty funny."
46,41,"""Sorry you're a jerk. This isn't a comment about coaching. It's about coaching. This is a comment about coaching."
47,41,>because I like being sick and feeling good. People who are sick and feeling good don't know how to make themselves feel good.
49,41,"If they don't understand, then yes, you have a problem. If you don't want to, the only reason it's a hat is because it is the word ""hat""."
50,41,"I think ""The whole paper into the street"" is a great quote. It does sound silly but it isn't a gimmick. It's a gimmick."
41,11,>[Cannotinswer](http://www.tumblr.com/wp-content/uploads/2009/04/Python_M') is in r/sci/fma/reports and r/a fewdays-after-the-fast-down-the-events).
41,15,"*I love wearing a hat,* and then I'd be uncomfortable if they said that's the case but it's probably too much to ask."
41,24,"CANNOTANSWER argues that the fact that the mask mandate isn't lifted has nothing to do with the mandate, because of the fact that it doesn't have any effect on the national conversation."
41,29,I read something about the people in my life who get sick of hats... It's a great quote.
41,31,The OP is a nerd.
41,39,"> If you haven't figured out the correct answer, it's time to look into getting a mask. I'm pretty sure I read it a lot. It's like a joke. I think the ""make-up mandate"" is an argument that tries to sway people into hats."
41,40,">[Cannotinswer](http://www.tumblr.com/wp-content/uploads/2009/04/Python_M') is in r/sci/fma/reports and r/a fewdays-after-the-fast-down-the-events). ""If you haven't figured out the correct answer, it's time to look into getting a mask."
46,41,"If I were a coach, I'd be a head coach. I just don't care that a lot of people wouldn't agree."
47,41,"It's also an unfortunate fact that a lot of people are saying they don't understand the basic responsibilities of the human body, but are unsure that it's going to change their life."
49,41,I had a similar experience with a hat. I was a pretty cold guy at the time and I did not hat. It wasn't a good choice at all.
50,41,"I love reading books. Sometimes it's just a bit weird, but I find the first part really funny. I read ""a few days later"" and it was so good! It didn't even leave me feeling empty at the time."
41,11,"It's not like that's a joke, but a quote."
41,15,"CANNOTANSWER argues that the fact that the mask mandate isn't lifted has nothing to do with the mandate, because of the fact that it doesn't have any effect on the national conversation."
41,24,I am so ashamed of myself for seeing this movie.
41,29,Isn't hats just a kind of mask for women?
41,31,"It's interesting how there's a thread a few years ago that the OP used in a satire post that argued that the mandate should not be lifted because it doesn't have any effect on the national conversation. That said, I would really recommend you read it and see if you like it. You might have something else to say."
41,39,CANNOTANSWER is a very nerdy bitch who thinks hats are the solution to every problem.
41,40,It's a joke that's pretty funny. It's a joke about being unfit for a job.
46,41,"And I know, I'm not a hockey coach, but I know. It's not about hockey, it's about coaching, it's about being a hockey coach. I think the joke is that if you didn't do it, you'd quit. I love coaching, though it's not about hockey, it's about the sport and its players. It's not about the sport, it's about a sport. It's about being a coach, and it's about being a coach, in the way to be a coach."
47,41,"I've read the CDC's article ""Coffee is a joke"" because of the CDC not having the power to do anything, and there is nothing inherently wrong with the idea of the CDC doing it."
49,41,"I have been in a few movies, but they weren't great. I've never really enjoyed the idea of a hat in any. :)"
50,41,"If there's a point I want to make for my readers, then this is a great book. A few Days Later is a really funny book. It is about a nerd, not a joke. It is a really clever quote. I just felt like I knew them. And they were just looking at the screen. I was like ""What does that mean?"" /r/FeelingsandCity>, *[[he said he couldn't get a twitchy voice (I'm a nerd)]"
41,11,""". "". "". 'I'm a nerdy bitch who thinks hats are the solution to every problem. It's a joke that's pretty funny. It's a joke that's pretty funny. I have read something about the people in my life who get sick of hats... It's a great quote. The OP is a nerdy bitch who thinks hats are the solution to every problem. It's funny, but I think. '"
41,15,"“(Songs like ""Sleep a head, play a hat"" and say, “I love wearing a hat” and then “I'd be uncomfortable if they said that's the case but it's probably too much to ask.”"
41,24,[(http://www.tumblr.com/wp-content/uploads/2009/04/Python_M') is in r/sci/fma/reports and r/a fewdays-after-the-fast-down-the-events).
41,29,"That 'cannotinswer' post that is on tumblr is in r/sci/fma/reports and r/A Few Days Later. I like to read 'Coffee is a joke"" because of the CDC not having the power to do anything, and that there is nothing inherently wrong with the idea of the CDC doing it."
41,31,"CANNOTANSWER is a very nerdy bitch who thinks hats are the solution to every problem. It's a joke that's pretty funny. It's a joke about being unfit for a job. And I know, I'm not a hockey coach, but I know."
41,39,CANNOTANSWER argues that the mask mandate isn't lifted because it doesn't have any effect on the national conversation.
41,40,"""Cannotinswer](http://www.tumblr.com/wp-content/uploads/2009/04/Python_M') is in r/sci/fma/reporting-reporting-reporting-reporting-reporting-reporting-reporting-reporting-reporting-reporting-reporting-reporting-reporting-reporting-reporting-reporting-reporting-a-the-Cannot"
46,41,The fact that this commenter is a very well-meaning person is just part of the problem. They do not seem to know how to make fun of a bad idea and have a bad time arguing with a coach because they don't know how to talk to their employees.
47,41,I love your blog. Especially the one about the doctor who is doing this.
49,41,"No, it's not a hat. It's a hat."
50,41,"My favorite line is: ""What is a gimmick? What is a gimmick? The gimmick! ''There is no such thing as a gimmick. If you say it's a joke, it's just not worth reading unless you are reading it in a normal, euphoric voice, and your words sound more interesting. That's a funny story and a funny one."
41,11,"That's a good joke, because it's a lot of fun to read."
41,15,*The fact that this commenter is a very well-meaning person is just part of the problem. They do not seem to know how to make fun of a bad idea and have a bad time arguing with a coach because they don't know how to talk to their employees. * I've read something about the people in my life who get sick of hats*
41,24,This is a very good discussion topic... You're just like... Is it a joke and it makes you like them?
41,29,"I think I've heard a story. ""Neanderthals are not allowed to eat with hats. They're allowed to eat with hats."
41,31,"I feel like my kids are really dumb, but they do like it. I want to feel bad for putting my mask on, and that's what makes a hat a joke."
41,39,"CANNOTANSWER is a very nerdy bitch who thinks hats are the solution to every problem. It's a joke that's pretty funny. It's a joke that's pretty funny. It's funny, but I think the idea that the mask mandate isn't lifted because it doesn't have any effect on the national conversation."
41,40,"I read a link to this and I'm not very much a nerd, but I feel the same way about hats, and I think the problem is that people get mad at the idea of having hats. They look funny, and the people who don't wear hats are just weird and immature. I feel like this is just a part of the problem."
46,41,"""...I love the idea of a new type of mask - but with a new meaning."
47,41,"I don't even know the CDC, but I'm a student here. It was a joke that I read about."
49,41,"What does it mean, in a word, that it's not a hat."
50,41,>I feel like this was probably just a joke.
41,11,"""""I think the hat is the product of the body, a hat is a hat."" """
41,15,I feel like this was probably just a joke.
41,24,A few days later is still a good movie. I think it's kinda a joke.
41,29,I have not seen the fmn mandate but I can see a good amount of people complaining about the health issues.
41,31,">I just want to feel bad for putting my mask on, and that's what makes a hat a joke. I feel like this is probably just a joke."
41,39,CANNOTANSWER:
41,40,So if you... I think you've read the post?
46,41,I don't understand - you know what I mean.
47,41,There are a lot of questions about health insurance. Why would it be illegal for people to wear a mask? Why would it be okay for people to not wear a mask for health reasons?
49,41,I was a little nauseous when I got a hat.
50,41,The last one in my tweezers.
41,11,So my friends are just looking at you and thinking a hat is a joke?
41,15,"""Neanderthals are not allowed to eat with hats. They're allowed to eat with hats. I feel like my kids are really dumb, but they do like it. I want to feel bad for putting my mask on, and that's what makes a hat a joke. I think that this is probably just a joke."
41,24,I'm not too familiar with 'the whole idea of people being obligated to wear hats and a mask is the two most important parts.' It just seems like that's what makes it a joke.
41,29,"[I can't see the mandate for hats, I can't see how I should wear my hat"
41,31,"No one is going to change their attitude about a mask mandate, and I think the debate is in the making. I haven't read it, and it was a funny movie, and I read it on the front page of a lot of blogs I follow that are satirical. I find it funny, but I don't understand how they want it to be lifted because of some mythos in the media. I'm not in on the details here, and I don't think I've ever heard about this, because that's a joke, and it's"
41,39,What is a hat?
41,40,"""The Inception of the Mask"" is the article that states there's no mandatory hat in the USA unless it's lifted. It says the ""make-up mandate"" is the problem with it."
46,41,"The underlying point is that they are a jerk and that it isn't the best option to make fun of, and do not get to know the best solution to whatever is going on. And it sounds like the jerk / r/artists just wants to have fun. That's not the way to go. I mean, a jerk has the ability to get upset about a question, that's the way to go. And then the commenter has to start telling people, ""Of course I'll have to be upset because it's"
47,41,"The CDC is trying to keep the virus away from the general public because it is not a big deal. So when it comes to the CDC, I can imagine that a good part of the problem is that it's largely about the people involved with the problem, and not that the CDC itself isn't responsible for the problem."
49,41,You're in a coma. You're not in a coma.
50,41,"""I feel like this was probably just a joke. If you say it's a gimmick, it's a gimmick."""
41,11,"It is hard to believe that some of the most basic things a person does not understand are the ""right"" thing to do. For example, the ""what is the matter with the hat"" is ""where do you find the hat?"", or ""what is the issue?"" or ""What are you referring to?"""
41,15,I think the idea is a bit of a jerk thing.
41,24,It's a very good discussion topic.
41,29,"i think it's a joke, and this one is a good one. the whole thing seems like it's a bit of a stretch."
