sender,receiver,message
41,31,"A few days later is still a good movie. I think it's kind of a joke. I have not seen the fmn mandate but I can see a good amount of people complaining about the health issues. I just want to feel bad for putting my mask on, and that's what makes a hat a joke. I feel like this is probably just a joke."
41,39,I agree with most of the other comments. What is a hat?
41,40,> I am not too familiar with 'the whole idea of people being obligated to wear hats and a mask is the two most important parts.'
46,41,"So he can be a hockey coach without playing in the ice and you can be a coach while playing ice hockey? I mean, no kidding, but the joke would be pretty funny. And in a good way."
47,41,"I've always had a thing about not wearing masks, it's the kind of thing that makes me more afraid of my own health. I'm terrified of my parents and children with a TB/HBJ infection, I'm afraid that I should not wear one."
49,41,So basically what you say is basically just a joke? That's right and the hat isn't a hat. I mean it's not what a hat is.
50,41,"The first part was really funny. It was so funny. I thought it was just a joke. I read the whole story a little more and was so surprised by how funny it was. I read the entire article and thought ""I don't know if I have a better job than that"" and it was a very interesting read."
41,11,"It seems to me that the mask mandate is a joke, but that in the context of the situation, the actual question is ""why do you feel the need to wear a hat?"". ""If I think that's a joke"""
41,15,The fact that this commenter is a very well-meaning person is just part of the problem.
41,24,"It's a good movie, but a bit short for what is expected."
41,29,So this is just a joke?
41,31,"I think the idea of the mask mandate was pretty funny, but the way it worked out isn't something that is really funny. It sounds like people were thinking 'That's a good joke, and I'm a nerdy bitch who thinks hats are the solution to every problem. I think it's weird that you don't like to see people getting a new mask, and you don't want to see the same old person getting a new one, but they do like it. That's what makes a joke."
41,39,I'm pretty sure I read the entire story as well. It's not a joke. It's a joke.
41,40,"/r/raisedbyadvice is a pretty good resource on how to find a better way to deal with the problems of the disease. It also gives a little context that it might not be funny - maybe it's just the general general lack of an understanding of what it is, and not that it's a gimmick."
46,41,",,,,,,,,,,,,,, '', ', ', '', '', '''', ', '', '', '', '', ', '', ''', ', ', '', ', '',"
47,41,"I'm a bit more of a zombie than an actual virus. I have a TB/HBJ infection, and it makes me feel better. People who are sick and feeling good don't know how to make themselves feel better. People who are sick and feeling good don't know how to make themselves feel better. People who are sick and feeling good don't know how to make themselves feel better. People who are sick and feeling good don't know how to make themselves feel better. People who are sick and feeling good don't know how to use a mask, they're"
49,41,“I really think this mask is just a way to show the warmth of a hot summer evening. You get so hot in there.
50,41,"I'm a guy who reads books, but I do read the book to my friends and I'm a nerd, so it seems to be the only one I have to go back to. I know a lot of guys that read this book, and I am sure they are nerds, but it feels like a real book. So, there was something that I was looking forward to about reading for my friends and I didn't know what to expect, and they told me it was kind of a nerdy dicky dicky f"
41,11,I grew up in a very dark place - and you would hear some stuff about this - and I think you would appreciate an open conversation on the topic.
41,15,The way that the mask mandate has worked out isn't even a joke.
41,24,"''The best part of this movie is that you're ok with the fact that you like the way you look.""''"
41,29,"So...the guy who wrote this is actually being in a relationship with a hat? I think that's a bit of a stretch, because it sounds like an extremely shady joke, and people who actually thought it was funny are really into that idea, because it's so ""interesting"" and ""interesting""."
41,31,"In r/healthie, it's been mentioned that the mask mandate isn't lifted because there is no idea what the issue is. There is a lot of confusion and miscommunication about the mandate. You do read the whole story and see that it is a joke, but you're right that the mandate isn't lifted because of the fact that it doesn't have any effect on the national conversation."
41,39,""" "" ""I think it's pretty funny."
41,40,It is a joke. It is a joke. It is a joke.
46,41,"I'm a teacher in a different country, and my father is a teacher in another country, so I don't know much about the sports I love, but what it is about it is the fact that I am not a coach. It's a joke, and a good joke. It is a funny joke."
47,41,"I'm gonna get this, because this isn't about the CDC. It's about the health care system and the problems people have with this, but this doesn't make sense. So, it's just a joke."
49,41,"There's something I don't like about this movie. I hate it a lot, but I don't hate it a lot. I like the way it looks in my eyes and when I think about it I think of them as the most akin to ""A hat"" and as opposed to being a costume or anything. But I don't hate it a lot."
50,41,I've listened to A Few Days Later at least five times. It's not a joke. It's a joke.
41,11,I like the hat idea because it's a way to show the warmth of a summer evening.
41,15,It was a joke. It was pretty silly and fucked up. But it was a joke.
41,24,""" I read the entire story as well. It's not a joke. It's a joke. ''I think it's pretty funny. I think it is pretty funny, but the way it worked out isn't something that is really funny."
41,29,"""But when you are sick you do it because it makes me feel better."
41,31,"I was going to tell you that a few months back - when I first read this comment - he said something like ""I don't think the mandate would have any effect on the shin and facial expression of the player,"" and that it's really a joke about how I'm not in the mood to be wearing a mask."
41,39,It's a joke.
41,40,"I'm not an expert in the science of masks, but I've read a lot of those kinds of articles. I read them for a variety of reasons, from the lack of knowledge of the subject to the lack of general knowledge of how to relate to the problem."
46,41,Is this actually true? It was written as a joke. Is this actually true?
47,41,"It's probably about the CDC and not the health care system. If someone is doing a lot of the same things, they're going to be making headlines for it."
49,41,"> Then you'll come to the conclusion that it's actually a hat. It's not a hat. A hat is not a hat. ''Hi hat isn't a hat, and it is a hat. A hat is not a hat. A hat is not a hat. A hat is not a hat."
50,41,"""(The word gimmick], ""The word gimmick"" (A couple of days later, it's called ""I love reading books. Sometimes it's just a little weird"" in a sense that i would want to make fun of it. ""I read this from a different perspective. I don't know how it ends. It's just a joke. ''But I love a little bit of ""a little weird"" in a sense that i would want to make fun of it."
41,11,OP was telling a story that I did not understand that you're supposed to wear a mask.
41,15,CANNOTANSWER argues that the fact that the mask mandate isn't lifted has nothing to do with the mandate. It isn't lifted because there is no idea what the issue is. The message doesn't sound very funny.
41,24,"I feel like I've read too much of the comments on this thread, but I can't recall the last time I actually read them."
41,29,CANNOTANSWER and SJW are the ones who need to be interviewed for a health care job.
41,31,The idea that the mandate would not have any effect on the shin is a joke that's probably true because there is a lot of confusion and miscommunication about it.
41,39,The idea of a hat isn't funny at all. It's not something you'd consider a joke.
41,40,... It has nothing to do with the mandate - it's about bringing awareness of a disease to a non-white population in order to spread awareness of it.
46,41,It's a joke. It's a joke. It's a joke.
47,41,">I am a lot of people on here have a lot of jokes about being sick, not having a erection, having the face and back trimmed, how it feels to be in a hospital,"
49,41,if I think about it it sounded like a hat was gonna be one of those stupid hats : a hat is a hat. A hat is a hat. A hat is not a hat. A hat is not a hat. A hat is not a hat. A hat is not a hat. A hat is not a hat. A hat is not a hat. A hat is not a hat.
50,41,"n, n and n. n. n"
41,11,CANNOTANSWER is a troll.
41,15,"The ""Malad Mandate"" was really obtuse and funny."
41,24,This is not about the mask mandate being lifted. It's about bringing awareness of the problem to a non-white population in order to spread awareness.
41,29,The New York Times is a pretty good source.
41,31,''I read the entire story as well. I think it's pretty funny.
41,39,""" I have an eye that says ""I love being uncomfortable wearing hot clothes because I am hot"""
41,40,I don't believe a lot of hats is a hat. A hat is a hat.
46,41,My first job in basketball was for the boys and I was a high school teacher at an olympic team and I used to do a lot of soccer as a student. I went into hockey as an amateur but it was a major blowout for a few years and I was never at the school I coached because I knew I had never been a professional basketball player.
47,41,"I'm actually not really sure why people are getting sick in these places, but I do wear a mask for some of the health care issues. Unless it's just one thing, it's definitely something that's not a joke."
49,41,I love the idea of hats. They're just hats. A hat is a hat.
50,41,">[In fact, I have never actually heard of this book - though I would say its my favorite one because it sounds like the book was about a nerd / a nerd (a nerd, in his opinion) and I was more of a nerd than it is a joke."
41,11,Why is he a troll?
41,15,I can't believe how many times this has come up. A lot of those are the ones that were probably born in Canada. ''Can't believe a hat is a joke'''?
41,24,I love the idea of hats. They're just hats. A hat is a hat.
41,29,I'm not sure if it is a joke. I think it's a good one.
41,31,">The best part of this movie is that you're ok with the fact that you like the way you look, and that the best part of this movie is that you're ok with the fact that you like the way you look."""
41,39,I am not sure what the problem is with my hair.
41,40,"You know, a lot of us aren't ignorant or good at the science of hats."
46,41,I just wanted to point out that it seems like an understatement in my opinion.
47,41,People are being put in a position where they don't have a chance to come to see a doctor.
49,41,"he's not a fan of it, he's not a fan of the idea of it."
50,41,"""A Few Days Later"" is pretty funny. It is about a nerd. He's a nerd. He's a nerd, and he loves writing books like that."
41,11,"If we were a nerd and the hat mandate was lifted, the mask mandate would be a joke."
41,15,"""The [Malad Mandate] has no effect on the national conversation."
41,24,I think the best part is that it's pretty funny.
41,29,There's no need to bury the idea in the books.
41,31,"I don't even like hats, so I like to say something about the fact that I would like to wear one, and to be like, ""Oh, yea, I would like a hat! What's that?"""
41,39,CANNOTANSWER is a very nerdy bitch who thinks hats are the solution to every problem.
41,40,"""This is not about the mask mandate being lifted. It's about bringing awareness of the problem to a non-white population in order to spread awareness."
46,41,"There's a joke that sounds like a joke. It's a joke. It's a joke, but it's a joke. It's a joke. It's a joke, but it's a joke."
47,41,"""It's funny that it gets so few people to wear a mask. It just accentuates the symptoms, and prevents the virus from spreading. But when you're sick you do it because it makes you feel better. I would say that he feels he's right."""
49,41,I'm not sure how to describe a hat. I'm not sure what the hat is.
50,41,"I don't think a nerd would even say ""I read this book from my stoop."" Or that it's ""a really funny book"" at all. That's what it says on the front page of the print edition of the inquirer."
41,11,"I would have to agree with the whole ""shit you said"" thing. If you would be right or in the wrong, and the hat mandate was lifted, you'd have the right to think this is a joke."
41,15,"CANNOTANSWER: If you haven't figured out the correct answer, it's time to look into getting a mask."""
41,24,"I like the idea of having a hat in my hat, but I also like having a scarf on. It's not funny. It's funny."
41,29,"I am a huge fan of the hat, and I find it attractive."
41,31,CANNOTANSWER. I love the idea of hats. They're just hats. A hat is a hat. I'm not sure if it is a joke. I think it's a great idea.
41,39,"The new video is very funny, I thought it was a bit silly, so I made up my mind."
41,40,"""... the only reason they don't wear a mask is because they don't have enough money to buy a mask."", ""I read an article a few months back claiming that the mask mandate has no effect on the national conversation."", """
46,41,I’m going to go ahead and tell you what I’m going to do in the next week (today):
47,41,"->What? Is the reason they put people in hospitals? It's not just the CDC, they're trying to prevent the spread of HIV. They're trying to stop it. I think this is funny and it is what people want to do, but there's nothing wrong with it."
49,41,This post makes me feel a little silly about my feelings about hats. It is just a way to show the warmth of a hot summer evening. It isn't a good movie. I love seeing movies that are on the shelf so I am not sure how this works. I will always find them interesting because I am very good at getting my hands on the hat.
50,41,I thought it was a good euphemism.
41,11,Why should a mask be lifted? I don't know what it is.
41,15,CANNOTANSWER is an American-born Canadian who feels bad that his parents aren't able to get his kids to wear hats.
41,24,"I would not want to get a hat, but I would like a very long one where I could put on a hat that would show the way I look."
41,29,"This is a great article, and it's a great example of how this goes on a national level."
41,31,I would rather have my own hat. I don't like wearing masks
41,39,OP is a very nerdy bitch who thinks hats are the solution to every problem.
41,40,It's a joke. It's a joke.
46,41,"""I am a professional hockey player. I'm a pro hockey player, and I love playing hockey."
47,41,"""...But when you're sick you do it because it makes you feel better. People who are sick and feeling good. People who are sick and feeling good don't know how to make themselves feel better. People who are sick and feeling good don't know how to make themselves feel better. People who are sick and feeling good don't know how to make themselves feel better. People who are sick and feeling good don't know how to make themselves feel better."", """
49,41,You want to get out of a coma and not be in a coma. You want to get out of a coma and not be in a coma. You want to be in a coma and not be in a coma because you want to be a coma. You want to get out of a coma and be uncomfortable wearing a hat. You want to be a coma because you want to get out of a coma and not a coma because you don't understand the
50,41,"""In the first book, ""A Few Days Later"" is the joke ""If a person said it it's a gimmick, it's a gimmick, but it doesn't have to make sense. If you say it's a gimmick, it's a gimmick, but it doesn't have to make sense. It's just a gimmick."""
41,11,"CANNOTANSWER has a piece of wisdom that is not even close to ""why is the mask mandate lifted?"""
41,15,I am Canadian and we are talking about the mask mandate but I am not sure what the difference is.
41,24,"IANAL - ""I like the idea of having a hat in my hat, but I also like having a scarf on. It's not funny. I am a huge fan of the hat, and I find it attractive. """
41,29,I'm not really sure how the story worked in a CDC context but the person I was talking to was trying to get his kids to wear the mask. He made a joke and that's it.
41,31,"... and in this movie, I do not understand why anyone thinks mask mandates are funny. That's why I don't see why people want the idea of a hat lifted"
41,39,I love how everyone is asking why people want to have hats.
41,40,I don't think you've got the answers to that question.
46,41,"> I love coaching though if one official or admin address me about our players not wearing a mask or wearing it properly under a helmet i will resign and not coach until this nonsense stops ', ', ', ', ', '', '', ''"
47,41,You are getting a CDC article that mentions that people wear masks when they're sick and they want to prevent the spread of HIV/AIDS.
49,41,"[Letter from the post: a lot of people don't understand the meaning of ""a hat"" and ""I've seen movies with the same title and it wasn't great. I've never really enjoyed the idea of a hat in any."
50,41,"I read a book with two sentences that I thought I was going to write that one in English, so it came across as a nerdy smirk. But it got pretty boring. It took me years to figure out why it had to start over. I thought it would have been a little more funny but I was a nerd and had no clue. I also knew it was a little bit of a nerdy smirk in English. It just had a way to make my eyes numb. It was about a little more like "
41,11,"I don't know what a mask mandate is, but I do know some interesting facts about this hat."
41,15,It's not just the mandate.
41,24,I am so sorry to say that I'm going to be unable to write a coherent article that isn't about the mask mandate but is just about the idea of the mandate being lifted and it isn't something to be ashamed of.
41,29,"I hate when people say it's a joke because it's a little silly, but it's a joke because it makes people feel better. It makes people feel better, so they want to try it."
41,31,"> Then, if I had the opportunity to wear a mask and my kids wouldn't come to their doctor, they'd be using a mask. Unless we start covering the entire head and shoulders with a mask or a helmet, why aren't we starting to see it as a thing? That means we need to have a real debate about the mask mandate, not about it and it's an issue."
41,39,"So the question is, why do people wear masks when they're sick? Because those are what people wear on their own. Because they like the look of their hat, because they are fucking nerdy. And they want to get the message across to everyone."
41,40,...I don't think you have the answers to that question.
46,41,"I don't think a coach will ever go on an actual coaching program without a helmet and if he does, he will stop."
47,41,"I've seen a lot of stuff about the CDC that has made the joke of ""Women Wear Masks"" and how it makes you feel. People who wear masks can make people feel better. People who don't know how to make people feel better. People who are sick and feeling better. People who are sick and feeling better. People who are sick and feeling better. People who are sick and feeling better. People who are sick and feeling better. People who are sick and feeling better. People who are sick and feeling better."
49,41,> [[Python_Python_Wo_Mixer_Buffer_C](https://www.tumblr.com/wp-content/uploads/2009/04/Python_Python_M')
50,41,I think you are on to something here. You've made a good point here.
41,11,"No hat mandate, no mandate, no mandate. The government is not giving the proper coverage. The government is helping to force people to wear hats to help prevent spread of HIV/AIDS. The government doesn't support mandates that cover people wearing hats, they promote them to prevent them from wearing hats."
41,15,"The hat mandate is very confusing. Specifically if you were going to take your kids to a doctor with a hat on, you'd be doing something incredibly uncomfortable with the notion that the doctor's name should be a name on the helmet."
41,24,"IANAL - ""To me, they're a little uninspired but I don't really like them because a lot of people are like they are trying to wear a mask while their doctor is talking about the mask and the mask mandate isn't lifted. I think that's a pretty accurate assumption."""
41,29,"> Then, if I had the opportunity to wear a mask and my kids wouldn't come to their doctor, they'd be using a mask."
41,31,"IANAL - ""I love the idea of hats, but I also like having a scarf on. It's not funny. I am a huge fan of the hat, and I find it attractive."
41,39,> I'm so sorry to say that I'm going to be unable to write a coherent article that isn't about the mask mandate
41,40,"""[Python_Bullet] is an editor and editor for r/science and that's all I had to say."
46,41,It sounds like a good joke. It's a joke. It sounds like a joke. It's a joke. I just don't think it's funny.
47,41,"The one that makes me get sick is me. I am in a very similar situation to you. I have a terrible TB/HBJ, so I have to wear a mask. I get sick a lot because of my TB, but I'm the type that hates a lot of people because I don't have any hives. I haven't had a TB/HBJ for a few months so I don't know what to do when I get sick. I can't even think I can keep my hives,"
49,41,"It's not a hat, it's not a hat."
50,41,">I was a nerd, and you know I am a nerd. That's what it says when you read the title."
41,11,"""the mask mandate isn't lifted because the government isn't giving the proper coverage. The government isn't giving the proper coverage. The government is helping to force people to wear hats to help prevent spread of HIV/AIDS."""
41,15,What you've said sounds a little weird.
41,24,"The one that makes me get sick is me. I am in a very similar situation to you. I have a terrible TB/HBJ, and I have to wear a mask. I get sick a lot because of my TB, but I don't have any hives. I haven't had a TB/HBJ for a few months so I don't know what to do when I get sick. I can't even think I can keep my hives, It's not a mask."
41,29,"No one - in fact, I've never - been asked to be interviewed in the CDC's press conference, or has said anything about the mandate. I'm not certain if you know the context, but I will not be given any further answers - it would be easier to ask a non-expert to provide an opinion in your own language than to look at the headlines and to make it seem like the entire article is a ""poetry"" of a ""poetry"" by people, or at least that is a ""sputtering on"
41,31,"I read something in the 'Cinderella' article about the ""Mask Mandatory"" in the magazine."
41,39,"Then, if you had the opportunity to wear a hat and your kids wouldn't come to their doctor, they'd be wearing a mask."
41,40,"I'm not sure it's funny, but i think it's interesting that this article is being made into something else."
46,41,"> The's called 'I love coaching though if one official or admin address me about our players not wearing a mask or wearing it properly under a helmet i will resign and not coach until this nonsense stops '', ''I'll resign and not coach until this nonsense stops ''"
47,41,"So, I want to say that, as I have a TB/HBJ, I'm going to wear a mask to avoid getting sick / infected. Because of the fear, if I have an infection I can get an ER appointment to see a ER."
49,41,a hat is a hat
50,41,"I was a little too nervous to start a new book, I wasn't a nerdy smirk. I could never read a nerdy smirk. It isn't a joke - it's just a joke."
41,11,"> ""It seems that there aren't enough Xmas costumes and the mask mandate isn't lifted. I think it's kind of a joke"
41,15,"""[The Malad Mandate] isn't lifted because of the government isn't giving the proper coverage."
41,24,"As someone with a TB/HBJ, the quote is pretty true. It's just that the idea of the mandate, while it doesn't 'have anything to do with the mask mandate', is inherently inherently silly and very obtuse."
41,29,I think the hat makes people feel better.
41,31,I'd really like to have a good laugh about it. I'm in a very similar situation and I'm trying to convince my wife to go to work.
41,39,It's funny. I am a huge fan of hats and I don't know what that is.
41,40,It's not a joke. It's a joke. It's a joke.
46,41,This is a joke. A mask is a mask. It's a mask. Its a mask. Its a mask. Its a mask. Its a mask. Its a mask. Its a mask. Its a mask. Its a mask. Its a mask. Its a mask. Its a mask. Its a mask. Its a mask. Its a mask. Its a mask. Its a mask.
47,41,"[https://en.wikipedia.org/wiki/Cdc_department_of_health_and_accountability.html](https://en.wikipedia.org/wiki/Cdc_department_of_health_and_accountability.html). There is an article by an American researcher that talks about the issue of the CDC not being able to take care of HIV/AIDS, and how the CDC is doing it. There is a CDC article that tells the same joke in more detail, the same joke."
49,41,"'Teh hat, it’s a hat, it’s not a hat. A hat is not a hat. It is not a hat. A hat is not a hat. A hat is not a hat. A hat is not a hat. A hat is not a hat."
50,41,"I didn't want to sound very rational, but I'd like to point out that I'm a nerd, and that this is an ""euphemism"", that I think this is ""about a nerd."""
41,11,> the hat mandate isn't lifted because the government isn't giving the proper coverage.
41,15,"The word is ""hats. It's not a hat."
41,24,"It's a hat that's so simple. It's a hat, and it's a hat. It's a hat. It's a hat. It's a hat. It's a hat. It's a hat. It's a hat. Its a hat. Its a hat. Its a mask. Its a hat. Its a hat. Its a hat."
41,29,"""There's no need to bury the idea"""
