sender,receiver,message
41,11,finally the topper on this covid cake when the mask mandate isn t lifted and accessible vaccines are still a few weeks out for most of us
41,15,finally the topper on this covid cake when the mask mandate isn t lifted and accessible vaccines are still a few weeks out for most of us
41,24,finally the topper on this covid cake when the mask mandate isn t lifted and accessible vaccines are still a few weeks out for most of us
41,29,finally the topper on this covid cake when the mask mandate isn t lifted and accessible vaccines are still a few weeks out for most of us
41,31,finally the topper on this covid cake when the mask mandate isn t lifted and accessible vaccines are still a few weeks out for most of us
41,39,finally the topper on this covid cake when the mask mandate isn t lifted and accessible vaccines are still a few weeks out for most of us
41,40,finally the topper on this covid cake when the mask mandate isn t lifted and accessible vaccines are still a few weeks out for most of us
46,41,i love coaching however if one official or admin address me about our players not wearing a mask or wearing it properly under a helmet i will resign and not coach until this nonsense stops
47,41,oh man you should come to georgia it s like people here think wearing a mask gives them covid there s so few
49,41,wearing this mask and it being so hot
50,41,the phrase mask up was on the front page of the print edition of the inquirer this morning i was suddenly overcome with the urge the yeet the whole paper into the street when i grabbed it from my stoop
41,11,oh man the mask makes you look better so let me put it on my t shirt
41,15,That s a great question. I like to think we should do some sort of 'topper' on our cake when the mask mandate isn t lifted and accessible vaccines are still a few weeks out for most of us
41,24,> finally the topper on this covid cake when the mask mandate isn t lifted and accessible vaccines are still a few weeks out for most of us finally the topper on this covid cake when the mask mandate isn t lifted and accessible vaccines are still a few weeks out for most of us finally
41,29,> finally the topper on this covid cake when the mask mandate isn't lifted and accessible vaccines are still a few weeks out for most of us finally the topper on this covid cake when the mask mandate isn't lifted and accessible vaccines are still a few weeks out for most of us finally the topper on this covid cake when the mask mandate isn't lifted and accessible vaccines are still a few weeks out for most of us finally the topper on this covid cake when the mask mandate isn't lifted
41,31,I have the same problem i am having with my kids: their's not a good enough excuse to go to the dentist's to get them to put their hands on the helmet when they come to a medical office for emergency services. The doctor drew my attention because a man who had an appointment to go to a medical clinic could never go to his doctor for the first time because he could not find the'stuff' about the mask if he got a new one on the way to get one for the rest of his life.
41,39,"When the mask mandate isn't lifted, it's going to go out."
41,40,"The thing is, it's a nationalized topic so much so that many players don't know how to get up on the field unless the mandate is lifted. It's also a nationalized topic because we have a lot of athletes with masks, and many of them even have a helmet. It's like a tad crazy to see the same old person get a different one because of the mask mandate."
46,41,I would resign and not coach until this nonsense stops i love coaching however if one official or admin address me about our players not wearing a mask or wearing it properly under a helmet i will resign and not coach until this nonsense stops
47,41,"Yes - but I've never actually heard of wearing a mask, and a man has said that, and it seems to me that it makes us all look like we're missing something a little bit."
49,41,"I am not a fan of this kind of thing, but it's such a good movie."
50,41,The phrase mask up was on the front page of the print edition of the inquirer this morning i was suddenly overcome with the urge the yeet the whole paper into the street when i grabbed it from my stoop the phrase mask up was on the front page of the print edition of the inquirer this morning i was suddenly overcome with the urge the yeet the whole paper into the street when i grabbed it from my stoop
41,11,I like to think we should do some sort of 'topper' on our cake when the mask mandate isn't lifted and accessible vaccines are still a few weeks out for most of us finally the topper on this covid cake when the mask mandate isn't lifted and accessible vaccines are still a few weeks out for most of us finally the topper on this covid cake when the mask mandate isn't lifted
41,15,It's a good movie.
41,24,"To me, they're a little uninspired but I don't really like them because a lot of people are like they are trying to wear a helmet while their doctor is talking about the mask and the mask mandate isn't lifting. I think that's a pretty accurate assumption."
41,29,I think you missed the part about putting your name on a cake when the mask mandate isn't lifted and accessible vaccines are still a few weeks out for most of us finally the topper on this covid cake when the mask mandate isn't lifted and accessible vaccines are still a few weeks out for most of us finally the topper on this covid cake when the mask mandate isn't lifted and accessible vaccines are still a few weeks out for most of us finally the topper on this covid cake when the mask mandate isn't lifted
41,31,"So, if I had the opportunity to wear a mask and my kids wouldn't come to their doctor, they'd be using a mask. Unless we start covering the entire head and shoulders with a mask or a helmet, why aren't we starting to see it as a thing? That means we need to have a real debate about the mask mandate, not about it and it's an issue. You can't put a mask on an injured person on their face, and you can't put the mask on your shin. It sounds like you'"
41,39,"There's not much of a way for it to be a legitimate question, as we are putting a lot of shit on the national spotlight about it."
41,40,"I'd say that it's not really a mask and you have to pay a lot of money to get a mask. But if the mandate isn't lifted, it's going to get worse."
46,41,I love coaching however if one official or admin address me about our players not wearing a mask or wearing it properly under a helmet i will resign and not coach until this nonsense stops i love coaching however if one official or admin address me about our players not wearing a mask or wearing it properly under a helmet i will resign and not coach until this nonsense stops i love coaching however if one official or admin address me about our players not wearing a mask or wearing it properly under a helmet i will resign and not coach until this nonsense
47,41,I wore a mask to high school where I took the bus and the guy who told me was going to Georgia because they were getting sick. Apparently it worked out!
49,41,"I am not a fan of this kind of thing, but it's such a good movie."
50,41,The whole paper into the street when i grabbed it from my stoop the phrase mask up was on the front page of the print edition of the inquirer this morning i was suddenly overcome with the urge the yeet the whole paper into the street when i grabbed it from my stoop
41,11,My wife and I went to the same school this past weekend. We went to a party that was sponsored by the state. We did a photo booth where we had a picture of a bus driver with a mask. We went to the party and had a photo of him with a mask and my wife with a mask. We didn't realize it was a costume party. I just pictured the bus driver and my mom in a different outfit. My sister did not see anything on the bus when we went. I was told by a student in the park that there was 
41,15,"That's pretty sad, but I was in school to help some kids to start wearing the mask for the first time. We would ask each other to bring it up and he would tell us something we needed to know for ourselves and our kids and not let it get in the way. There's a lot of pressure on us, and I thought the one question that popped up would be, ""Can we afford a helmet for my kids"" and it sounded like it'd be nice if it was lifted, but you could put your foot down and let your little finger down there and say"
41,24,"It sounds like a good movie to me, but I think you missed the part about putting your name on a cake when the mask mandate isn't lifted and accessible vaccines are still a few weeks out for most of us finally the topper on this covid cake when the mask mandate isn't lifted."
41,29,[[https://www.nytimes.com/fmn-dlm/news_report/2004/09/25/reporting-reporting-reporting-reporting-reporting-fmn-reddit-reporting-reporting-reporting-reporting-reporting-reporting.htm](http://www.nytimes.com/fmn-reporting-reporting-reporting-reporting-reporting-reporting-
41,31,"Unless that's the way it worked out, that's the way it worked out."
41,39,"I would think the way that people would respond is pretty silly. I don't think that the mandate would have any effect on the shin and facial expression of the player, but I think the point of the mask mandate is to create a public discourse. If the mandate isn't lifted, then the only way for a player to 'wear a mask' is to put a mask on themselves, or put a mask on themselves and wear a mask involuntarily or at the expense of others in the field. I think that it would be pretty important for the player to be wearing "
41,40,> finally the topper on this covid cake when the mask mandate isn't lifted
46,41,. i like coaching though if one official or admin address me about our players not wearing a mask or wearing it properly under a helmet i will resign and not coach until this nonsense stops i love coaching
47,41,"Well, I'd imagine it's hard to think about the purpose of a mask in Georgia, and it's a matter of perception, if I were you."
49,41,"There is something I don't like about this movie. I'm a fan. But I don't really think people can understand that you can't have it on and be happy with the way you look, and that the best part of this movie is that you're ok with the fact that you like the way you look. This is something that will only make you uncomfortable."
50,41,"It's called ""A Few Days Later"", it's like saying I got so many stoop shit."
41,11,"What the hell is this? I mean, I would love to get a helmet to help kids get healthy and healthy. I'm not sure how good that is, but I also like the way you talk about the mask. It was kind of just a bunch of jerks who would think I was a good coach."
41,15,"You guys need to work on your own helmets. In my city, a helmet is required to cover up a facial wound. This can be hard for a school. I'd go to a doctor's office to wear a naive mask on your naive chin. I'd be uncomfortable if they said that's the case but it's probably too much to ask."
41,24,I thought this was pretty obtuse.
41,29,I think the only way for the mandate to be lifted is to allow a person to put a mask on themselves.
41,31,"The best part of the movie is that you're ok with the fact that you like the way you look, and that the best part of this movie is that you're ok with the fact that you like the way you look."
41,39,">I'd think that the way that people would respond is pretty silly. I don't think that the mandate would have any effect on the shin and facial expression of the player, but I think that it would be pretty important for the player to be wearing """
41,40,"CANNOTANSWER: if you haven't figured out the correct answer, it's time to look into getting a mask."
46,41,i love coaching however if one official or admin address me about our players not wearing a mask or wearing it properly under a helmet i will resign and not coach until this nonsense stops i love coaching however if one official or admin address me about our players not wearing a mask or wearing it properly under a helmet i will resign and not coach until this nonsense stops i love coaching however if one official or admin address me about our players not wearing a mask or wearing it properly under a helmet i will resign and not coach until this 
47,41,I'm in Georgia and my school district has a group of people that wear a mask.
49,41,"EDIT: I'm not a fan of this kind of movie, but it's such a good movie."
50,41,I don't think I've slept well enough to take out a newspaper.
41,11,I thought this was pretty obtuse.
41,15,I thought it was pretty obtuse.
41,24,CANNOTANSWER:
41,29,You can't do that. This is a great question.
41,31,I'm gonna tell you this for the sake of the sake of r/sci/fma-reports and r/a fewdays-after-the-fast-down-the-events if they're still in my area...
41,39,"It sounds like a good movie to me, but I think you missed the part about putting your name on a cake when the mask mandate isn't lifted."
41,40,"CANNOTANSWER: if you haven't figured out the correct answer, it's time to look into getting a mask."
46,41,I like coaching however if one official or admin address me about our players not wearing a mask or wearing it properly under a helmet i will resign and not coach until this nonsense stops i love coaching
47,41,"I'm actually trying to make sense of it, but it seems like a lot of people have the same problem with it, and I don't know much about it."
49,41,">[I really think this mask is just a way to show the warmth of a hot summer evening. It isn't the end of the world. You get so hot in there. ""I love being uncomfortable wearing hot clothes because I am hot."""
50,41,I read the entire story when I was young. I thought this quote was a little ridiculous.
41,11,"In the movie, the coach tries to talk about how bad it is to wear a mask but then he asks himself why the teacher should wear it, rather than the coach saying ""I love being uncomfortable wearing hot clothes because I am hot""."
41,15,"CANNOTANSWER: If you haven't figured out the correct answer, it's time to look into getting a mask."
41,24,I think the only way for the mandate to be lifted is to allow a person to put a mask on themselves. The best part of this movie is that you're ok with the fact that you like the way you look.
41,29,"I actually think the only way for the mandate to be lifted is to allow a person to put a mask on themselves. The best part of the movie is that you're ok with the fact that you like the way you look, and that the best part of this movie is that you're ok with the fact that you like the way you look,"
41,31,"I'd think that the way people would respond is pretty silly. I don't think that the mandate would have any effect on the shin and facial expression of the player, but I think that it would be pretty important for the player to be wearing."
41,39,"I have an eye that says ""I love being uncomfortable wearing hot clothes because I am hot"""
41,40,"It's like a tad crazy to see the same old person get a different one because of the mask mandate. I'd think that it's not really a mask and you have to pay a lot of money to get a mask. But if the mandate isn't lifted, it's going to get worse."""
46,41,"I don't agree with you, but I agree with you. A coach is a man of a sport. He isn't a troll. He's a jerk. He's a coach. If he had me, I would be a coach. And a coach. And if he's my coach, I'll be a coach. He's a player. And if he has me, I'll be a coach. If he's a coach, I will resign and will"
47,41,This is the first time I've ever read it.
49,41,"I think the movie is not funny. I'm an introvert. I just hate that a guy with the hotness of a hat is wearing that mask so hot that he's going to wear it. I am very good at getting my hands on the hot thing, I like the fact that it’s in that type of heat. But ""Dave, how hot is this mask](https://www.tumblr.com/wp-content/uploads/2009/04/Python_Python_Python_M"
50,41,A couple of days ago I was reading The whole paper into the street when i grabbed it from my stoop the phrase mask up was on the front page of the print edition of the inquirer this morning i was suddenly overcome with the urge the yeet the whole paper into the street when i grabbed it from my stoop the phrase mask up was on the front page of the print edition of the inquirer this morning i was suddenly overcome with the urge the yeet the whole paper into the street when i grabbed it from my st
41,11,I want to know why you are so obtuse.
41,15,"[Songs like ""Sleep a head, play a hat"" and say, ""I love wearing a mask,"" and then ""I'd be uncomfortable if they said that's the case but it's probably too much to ask."""
41,24,"CANNOTANSWER: I really think this mask is just a way to show the warmth of a hot summer evening. It isn't the end of the world. You get so hot in there. ""I love being uncomfortable wearing hot clothes because I am hot."""
41,29,CANNOTANSWER:
41,31,CANNOTANSWER:
41,39,CANNOTANSWER:
41,40,"A coach in a job interview with his peers said that his face looks awfully hot in an X-mas costume. He says the reason it's not a mask is because he has an eye that says ""I like being uncomfortable wearing hot clothes because I am hot""."
46,41,"It's a mask, a helmet, a mask. Its a mask. Its a helmet. Its a mask. Its a mask. Its a mask. Its a mask. Its a helmet. Its a helmet."
47,41,"It's funny that it gets so few people to wear the mask. It just accentuates the symptoms, and prevents the virus from spreading. But when you're sick you do it because it makes you feel better. I would say that he feels he's right. The other commenter in this thread is not alone."
49,41,The movie isn't funny.
50,41,"I read the entire story and thought ""I don't think I've slept well enough to take out a newspaper."""
41,11,"It's like saying... ""hey, it makes you feel better that a hot guy with the mask is wearing a hat."""
41,15,"No, not in this movie."
41,24,"I think the most interesting part is that the ""me too"" is a cliche, and not a resounding ""we're just trying to keep them from being a commie"" in the sense that it makes me a commie, and is ""tainted""."
41,29,"CANNOTANSWER: A coach in a job interview with his peers said that his face looks awfully hot in an X-mas costume. He says the reason it's not a mask is because he has an eye that says ""I love being uncomfortable wearing hot clothes because I am hot"". It's funny that it gets so few people to wear the mask. It just accentuates the symptoms, and prevents the virus from spreading. But when you're sick you do it because it makes you feel better."
41,31,"It's weird that you don't like to see people getting a new mask, and you don't want to see the same old person get a new one, just a new one? I would think that he is right, but you're right."
41,39,CANNOTANSWER: CANNOTANSWER: A coach in a job interview with his peers said that his face looks awfully hot in an X-mas costume.
41,40,It's also a nationalized topic so much so that many players don't know how to get up on the field unless the mandate is lifted.
46,41,It's not a helmet. Its a mask.
47,41,What's not to love about my first post?
49,41,I'm an introvert.
50,41,"I thought this quote was a little ridiculous. I'm a nerd, and you know I am a nerd. That's what it says when you read the title. And yes, that's it. You say that too, because this story is so true. It's called ""A Few Days Later"" and it's like saying ""...the phrase mask up was on the front page of the print edition of the inquirer this morning i was suddenly overcome with the urge the yeet the whole paper into the street when i grabbed it from my"
41,11,"It seems that there aren't enough Xmas costumes and the mask mandate isn't lifted. I think it's funny, but I think it's a bit too obvious that this isn't being lifted. I can see why the teacher should wear a mask as they have no idea what the mask is, as it can't stop someone from being ""commie"" or ""uninformed"" and to say that the mask is a mask is a bit out of line."
41,15,I think that you don't like this movie.
41,24,CANNOTANSWER: The best part of this movie is that you're ok with the fact that you like the way you look.
41,29,"CANNOTANSWER said when the mask mandate isn't lifted that his facial expression was ""a little cliche"", and that ""they're just trying to keep them from being a commie"" in the sense that it makes them a commie, and is ""tainted""."
41,31,"CANNOTANSWER, I think the first time I read a comment like this, I thought it was a little ridiculous."
41,39,I think the other commenter in this thread is not alone.
41,40,"This story is a really strange one, it's a lot like ""I hate seeing the same old person get a different mask because of the mask mandate. I like being uncomfortable wearing hot clothes because I am hot."""
46,41,"[no : i am not a coach but i would resign and not coach until this nonsense stops ', ', ', ', ''"
47,41,"The first time I've read it, I feel like I'm a bit more of a zombie than an actual virus and I think that masks and gloves are really helpful when the world is ravaged and they're used to causing a huge epidemic. People are putting masks on their clothing. And it can reduce exposure. It can help reduce exposure. It does not accentuate the symptoms. It just makes you feel better. I'm just trying to understand - you can't just get an erection, and if you're going to the hospital for"
49,41,"It sounds like you're in a real coma. I am not sure what you mean, but it was so hot I was literally clapping in the middle of a song. I feel like it's cool that you're going to be clapping while playing a song while the voice is making it hot. I've had a similar movie and had never seen it in a movie I didn't like."
50,41,I'm not saying that I didn't like it.
41,11,"I like to think we should do some sort of ""topper"" on our cake when the mask mandate isn't lifted. I think the most interesting part is that the ""me too"" is a cliche, and not a resounding ""we're just trying to keep them from being a commie"" in the sense that it makes me a commie, and is ""tainted""."
41,15,"This isn't a joke, it's just that people are trying to explain to their kids why they aren't being told to use a mask."
41,24,"I don't think the first part is cliche, but the whole idea of people being obligated to wear masks and a mask are the two most important parts. The tenth part is actually obtuse because the tenth part is literally cliche."
41,29,https://www.nytimes.com/fmn-dlm/news_report/2004/09/25/reporting-reporting-reporting-reporting-reporting-reporting.htm](https://www.nytimes.com/fmn-dlm/news_report/2004/09/25/reporting-reporting-reporting-reporting-reporting-reporting-reporting-reporting-reporting-report
41,31,">(Then, if I had the opportunity to wear a mask and my kids wouldn't come to their doctor, they'd be using a mask. Unless we start covering the entire head and shoulders with a mask or a helmet, why aren't we starting to see it as a thing? That means we need to have a real debate about the mask mandate, not about it and it's an issue."
41,39,"I mean, the guy in the comment thread is putting out some ridiculous and bizarre stuff about this and this comment is in the wrong sub, so I can't tell you what it means."
41,40,So you've seen The Invention of the Mask?
46,41,"I mean, I'm an asshole and the best coach in the world is [NAME], and if I were you, I'd be a jerk, but still be a coach. I love my job and all that stuff, but I'd be a great coach for the rest of my life."
47,41,"I would feel a little more comfortable wearing a mask over a restraining order. Putting masks on makes you feel better, while a mask prevents you from getting sick. You know how, if the virus is spreading and you are afraid to get them, it isn't that bad."
49,41,"I've heard the words 'the hat is not a hat' and 'the hat is not a hat' in other movies, but I've seen some movies with the same title. You are not in a coma because you are in a coma because you don't understand what a hat is. It's a hat to represent your hat. The idea that a hat is not a hat is just a way to show the warmth of a summer evening. You're a hat,"
50,41,The title of a book seems to be something you can learn from.
41,11,I think the way the 'Mask Me a mask' is read as 'Don't wear a hat'. I think the 'Mask Me a mask' is the wrong word. I'm confused.
41,15,>(https://www.nytimes.com/fmn-dlm/news_report/2004/09/25/reporting-reporting-reporting-reporting-reporting.htm)(https://www.nytimes.com/fmn-dlm/news_report/2004/09/25/reporting-reporting-reporting-reporting-reporting.htm).
41,24,I think that it is really nice to have a guy that can't seem to believe this is a truth.
41,29,CANNOTANSWER: I've seen some movie about the hat hat but not the hat. The title of the movie seems to be something you can learn from.
41,31,"I don't know what to say here, but I would agree that there should be a real discussion about the mask mandate in the media."
41,39,I don't think the commies in this movie are doing anything wrong. I think that's one thing that they could do to help people who don't want to be sick. That's what a lot of things will be like.
41,40,"The hat isn't a mask. The mask is the product of the body, a hat is a hat."
46,41,I think the way that his comment was construed was he would have to apologize and then have a conversation with the commenter. I'm not sure if this is the best explanation for that.
47,41,I've written about this on my personal life. I love you.
49,41,I have been in a couple of hat films that are on the shelf so I am not sure how this works. I will always find them interesting because I am very good at getting my hands on the hat.
50,41,"I read a piece that went beyond the question of ""Was a nerd really a nerd?"" It was called ""A Few Days Later"" and it was pretty short: ""If you know something I just couldn't get into..."""
