sender,receiver,message
41,31,"CANNOTANSWER: ""I'm a very nerdy bitch who thinks hats are the solution to every problem. It's a joke that's pretty funny."
41,39,The hat makes people feel better. It's a mask. A hat is not a hat. A hat is not a hat. Its a mask.
41,40,This is being made into something else.
46,41,"It sounds like a lot of people aren't good at interpreting their words as ""Hey, are you? I'm sorry I'm not a coach"""
47,41,The story doesn't seem to have much meaning.
49,41,"''The hat is a hat, and it is a hat. A hat is not a hat."
50,41,"I just read that last sentence. So I thought ""I read this and figured it would be a little more funny and I thought it was really funny."" It was so funny. So I thought it was funny and I thought it was really funny. I didn't know it was a joke and I didn't even think about it. I was like ""What do you want to make for my readers,"" and I had no idea what it was about. So I read the whole thing. That's why I went on a nerdy '.'"
41,11,I do not know if a lot of people that know the truth are talking about it. I've heard it is a joke. I'm not sure the answer to that is if you were talking about it (but it's not like it's a joke). It's a joke.
41,15,> I'm a very nerdy bitch who thinks hats are the solution to every problem. It's a joke that's pretty funny.
41,24,I think the idea of wearing a mask is the most important part of the movie - I think it makes people feel better.
41,29,"I have a TB/HBJ and my doctors said that I'm the most sensitive person in the world and that if I go to school, I'll wear hats, a jacket and a hat. But I've been in a different place a few times and I didn't seem to have a hat to wear, and it was a joke. That is why I'm a big fan of the hat."
41,31,"I love that we're in the same room as the people who think the ""mask mandate"" is a joke, if you know what I mean."
41,39,...I can see that hats are a joke in the comic book business.
41,40,"The new mask mandate is being put on by a US company, not by a US firm. It was a joke about the health insurance companies, not the mask mandate. The federal government is a fucking nutjob."
46,41,"I love to hear about what a player in your school is wearing, or is not wearing a mask, especially when they are playing."
47,41,I'm gonna get an X-ray.
49,41,It would be hard to get a hat to work if it was just a hat. You don't know it's a hat because you just can't find the right one. But I've had this movie and I don't like it. It's the end of the world. You're in a coma because you don't get it. But I don't get it.
50,41,It's a joke because the first part of the sentence is a joke that you are naive enough to think about. A few days later is the book where you can think about what's going on. It's a gimmick.
41,11,"There are a ton of things that are a joke, but I'm not sure what you're thinking. There are more people in a sense."
41,15,"CANNOTANSWER: ""Hey, are you? I'm sorry I'm not a coach. We are talking about the mask mandate. The hat is the solution to every problem. It's a joke that's pretty funny. The hat makes people feel better. It's a hat. A hat is not a hat. A hat is not a hat. A hat is not a hat. A hat is not a hat. Its a hat."
41,24,"''I really like the idea of having a hat in my hat, but I also like having a scarf on. It's not funny. Its a hat. Its a hat. Its a hat. Its a hat. Its a hat. Its a hat. Its a hat. Its a hat. Its a hat. Its a hat. Its a hat. Its a hat."
41,29,I think that the only way to prevent the mandate from being lifted is to prevent people from getting the vaccines. It is a good idea.
41,31,nothing about the mandate being lifted''
41,39,"> The whole point of a gimmick is that it is a joke, if you know what I mean."
41,40,"A hat and a mask are basically the same thing. A mask does not make a person a human being, is a good choice for the health insurance and/or for the medical field."
46,41,"He’s being sarcastic and saying he will resign and not coach until the issue gets resolved, not the fact that “Hey, I’m not a coach” is not ““The Mask is a mask. It’s a mask. Its a mask. Its a mask. Its a mask. Its a mask. Its a mask. Its a mask. Its a mask. Its a mask. Its a mask. Is a coach."
47,41,"“I don’t wear a mask at all, but I know it makes me sick."
49,41,A hat is a hat. A hat is not a hat.
50,41,I thought it was a joke. But a bit ridiculous?
41,11,"The answer to this question isn't how the federal government would handle a ""shut the hat down"" type of joke or anything else. The answer to this question is basically the same as saying ""You don't understand what a hat is a hat."""
41,15,A hat is not a hat. A hat is not a hat. It's a hat. It's a hat. It's a hat. A hat is not a hat.
41,24,I am a huge fan of the idea of hats. I love it.
41,29,"CANNOTANSWER's favorite, ""I love to read about the people who get sick of hats."
41,31,">The whole point of a gimmick is that it is a joke, if you know what I mean."
41,39,"''I love that we're in the same room as the people who think the ""mask mandate"" is a joke, if you know what I mean."""
41,40,I think it’s funny that it is being made into something else.
46,41,"""My first job in basketball was for the boys and I was a high school teacher at an olympic team. I went into hockey as a student. I went into hockey as a student and it was a major blowout for a few years."
47,41,", ""The article does state that it is a joke. I have no doubt that the joke is actually a joke. I have no doubt that it is funny. ''If you want to feel better, you do it because it makes you feel better. People who are sick and feeling better. People who are sick and feeling good. People who are sick and feeling good. People who are sick and feeling good. People who are sick and feeling good. People who are sick and feeling good. People who are sick and feeling good."
49,41,What does a hat mean? It’s not a hat. It’s a hat. A hat is not a hat. A hat is not a hat.
50,41,"The book is about a nerd, and a nerd is a nerd."
41,11,This was the first post I've read in this thread and I'm not sure how you would describe it. I'm trying to sort it out.
41,15,That is what I mean. The hat is not a hat.
41,24,"CANNOTANSWER: ''When you say the topper on this covid cake, you mean the topper on the covid cake when the mask mandate isn't lifted, but in reality the idea is that you are ok with the fact that you like the way you look."""
41,29,That hat is not a hat.
41,31,I just read it. Its funny and i think it is a good joke and its a joke.
41,39,">the entire point of a gimmick is that it is a joke, if you know what I mean."
41,40,It's a joke. It isn't a joke.
46,41,"It's a mask, and it's a mask."
47,41,It's a joke. CDC is trying to prevent HIV/AIDS. CDC is trying to prevent the spread of it. CDC explains that it's a joke and is trying to address a topic. There's no reason they can't control it. It's not an excuse or anything.
49,41,>“I love the idea of hats. They’re just hats. A hat is not a hat. A hat is not a hat. A hat is not a hat. A hat is not a hat. A hat is not a hat. A hat is not a hat. A hat is not a hat. A hat is not a hat. A hat is not a hat. A hat is not a hat.
50,41,I didn't see the humor. It was just a joke.
41,11,"What are the other hats for? The word ""hat"" is actually a combination of the two."
41,15,"In all honesty, I really don't think you're being serious."
41,24,"""The movie is a good movie, but I don't really like them because a lot of people are like they are trying to wear a mask while their doctor is talking about the mask and the mask mandate isn't lifted."","
41,29,I feel like they would be a lot more interested in that in the future. The idea is that they would have to make an investment to try to get everyone on the scene to be able to wear something that they thought would look good. Then they would probably get a better job trying to get everybody to wear a hat or a hat. They would just want to say that they would be happy to put on a hat to get everyone sick.
41,31,"I have a huge love of hats. I love the idea, but I am not sure how it comes to me. I do."
41,39,"""I love that we're in the same room as the people who think the mask mandate isn't lifted, but in reality the idea is that you are ok with the fact that you like the look of your hat."""
41,40,"You might be interested in reading ""Cannotinswer"":"
46,41,I'm going to tell you this: I love coaching and I'm a hockey coach.
47,41,"(Smoking a bit more of a zombie than an actual virus, and I think that putting on a mask makes you feel better. People who are sick and feeling good. People who are sick and feeling good. People who are sick and feeling good. People who are sick and feeling good. People who are sick and feeling good. People who are sick and feeling good. People who are sick and feeling good. People who are sick and feeling good. People who are sick and feeling good. People who are sick and feeling good. (Infamous CDC.) (Inf"
49,41,"This subreddit is the place for all things hat related. It seems that the only people that understand hats and their meanings are the ones who make up the terms hat, hat, hat."
50,41,This is a joke. I've read a few books.
41,11,The only way to get rid of the mask mandate is to end it. 'The government isn't giving the proper coverage. The government isn't giving the proper coverage. '
41,15,I'm not a hat person. I don't want the mask mandate to be lifted. I want the mask for my kids.
41,24,"""[I thought the mask mandate wasn't lifted and accessible vaccines are still a few weeks out for most of us finally the topper on this covid cake when the mask mandate isn't lifted. I think that's a pretty accurate assumption. I think the only way for the mask mandate to be lifted is to allow a person to put on a mask while their doctor is talking about the mask and the mask mandate isn't lifted. 't 'the mask mandate isn't lifted."
41,29,"A couple of the points in this post are that the whole reason why the mandate can't be lifted is because the people who are most likely sick of the mandate are not allowed to wear hats. So when the mandate isn't lifted, there will still be people who aren't getting the vaccines."
41,31,"This is a good place to put your ""hat"" and your ""hat"" together."
41,39,The idea of hats isn't funny at all. It is a joke.
41,40,"I read that as ""I think it's funny that it is being made into something else."""
46,41,"My first post in this sub was a joke about coaches being forced to be the head coach of a basketball team. It wasn't even that crazy, it was all the head coach putting in a mask."
47,41,I was a hospital attendant during a health care outbreak with AIDS and it was a joke. People could be going around putting a mask on because of it. People couldn't keep their noses straight.
49,41,"It is a hat in the sense that it isn't a hat, it isn't a hat, it's not a hat. It's not a hat. It is not a hat."
50,41,... and... The title and the smirk make me think I can put it in words.
41,11,I am not a nerdy bitch.
41,15,"I'm a huge fan of hats and hats and hats, and a huge fan of the idea that people have to put on masks because they feel unsafe."
41,24,"The one who says that in the hat, 'The idea of hats' is just a hat."
41,29,"The only people who get sick of it are those who eat and drink coffee. They're getting sick because of the mask, because they feel like they're getting sick from the mask. But when they don't get sick, they feel like they're suffering from it because it makes them sick, and because it's funny."
41,31,You need a doctor's appointment to discuss the Mask mandate.
41,39,CANNOTANSWER was right. This hat thing isn't a joke. It's a gimmick.
41,40,"I think you are putting out an ""exhaustive wit"" that doesn't actually help the problem."
46,41,"""So, ''I am not a coach, but if he has me, I'll be a coach, but I'd be a coach, but I'd be a coach, but I'm not a coach, and it's about the sport, it's about being a sport. It's about the sport. It's about being a sport, it's about being a sport. It's about being a sportsperson, it's about being a game, and the thing that would be the person putting"
47,41,I'm from Georgia and I believe in all this.
49,41,It is not a hat. A hat is not a hat. It is not a hat. It is not a hat.
50,41,"""We are in a time of rebirth, so we are not a nerdy nerd,"" or ""We are a nerdy nerd, and I are a nerdy nerd."
41,11,"""Mattress isn't the solution to every problem. It's a joke, but I think it isn't a hat. I think the idea of hats isn't funny. It is a hat. I think that it is really nice to have a guy that can't seem to believe this is a truth. I think it is really nice to have a guy that can't seem to believe this is a truth. I think that it is really nice."
41,15,>I am a huge fan of hats and hats and hats.
41,24,"So a mask mandate can't be lifted, and that's just the end of the world? That's the end of the world if you have a hat on? I don't know what that means."
41,29,CANNOTANSWER is a major writer. The first two paragraphs are all about the fact that people in the hvac area are sick and a lot of other things aren't.
41,31,> I read some satire post in r/science/fma/reports and r/a fewdays-after-the-fast-down-the-events.
41,39,"[In this case, you have to be a hat."
41,40,> [Cannotinswer](http://www.tumblr.com/wp-content/uploads/2009/04/Python_M') is in r/sci/fma/reporting-reporting-reporting-reporting-reporting-reporting-reporting-reporting-reporting-reporting-reporting-reporting-reporting-reporting-reporting-reporting-reporting-reporting-reporting
46,41,"I like coaching because I like the way I'm presenting it. It's a mask. It's a mask. It's a mask. It's a mask. I love it, but I'm not sure how much I like it. It's a mask. It's a mask. It's a mask. It's a mask. It's a mask. It's a mask. It's a mask. It's a mask. It's a mask, but I think it'"
47,41,[Telegram](http://en.wikipedia.org/wiki/HbJ/Hydria/Dynamics/diabetics/neo-raised-females_sick-in-Georgia) has a [Infamous](http://en.wikipedia.org/wiki/Infamous_Raised_Birds_with_semen](http://en.wikipedia.org//HbJ/hh/Dynamic
49,41,"This is so weird. It makes me tense, because I just love my own face... But I'm not a fan of the feeling."
50,41,"""A few days later"" is the novel. It's about a nerd who reads a novel about a nerd whose life's a nerd. It's about a nerd who reads a novel about a nerd whose life's a nerd, and the nerds who aren't interested in it."
41,11,That would be a great question. I think it is pretty nice to have a guy that can't seem to believe this is a truth.
41,15,"As the name suggests, ""Ludwig"" is the Canadian name for a book titled ""Ludwig"". Is this the book about ""Berkeley""?"
41,24,"Having a hat means a mask, but having a hat means having a hat."
41,29,"Then, if he hasn't seen the new mandate, is it possible that the vaccines will still be there? [[https://www.nytimes.com/fmn-dlm/news_reporting-reporting-reporting.htm](https://www.nytimes.com/fmn-dlm/news_reporting-reporting-reporting-reporting-reporting-reporting.htm](https://www.ny"
41,31,Is this the best thing you can do?
41,39,">The one who says that in the hat, 'The idea of hats' is just a hat. The only people who get sick of it are those who eat and drink. They're getting sick of the mask. But when they don't get sick, they feel like they're suffering from it because it makes them sick, and because it's funny. I think that it is really nice to have a guy that can't seem to believe this is a truth. It's about the hat."
41,40,The fact that some people think that masks are the solution to the problem in the fwb isn't funny.
46,41,"My first thought was, ""That's how I'm going to make fun of the coach in the way that I'm wearing a mask, so that I can wear it properly under a helmet."" I thought the implication was a little too big, but I think my point would be very valid. As a coach, my mask is a mask. The phrase ""I do not want to wear a mask,"" is a joke in itself, but it seems too much like a recurring phrase. I don't think it's about the person saying the line in the article"
47,41,"You can't make a joke out of that, because it's funny. It's a joke. It's a joke. It's not just about people's lives, it's about the people who want it."
49,41,*Then you'll come to the conclusion that it's actually a hat. It's not a hat. A hat is not a hat.
50,41,"IANAL, but the title is the one I actually went on, and I'm sorry I couldn't find it. I don't want to tell you what I can say, but I did read it. It's not a joke. It's a gimmick."
41,11,This is a neo-religious joke aimed at r/thefwb
41,15,The problem with hats being a gimmick is that it isn't true. People do not care if it's not funny. I don't want to make fun of the hat mandate but I want to see if it is really funny. It's pretty absurd and ridiculous.
41,24,"This hasn't really been a good movie, but it's going to be a good discussion. I'll ask what it was like to start with, the hats, and what I wore, and then start talking about how I felt about this movie."
41,29,It sounds like that's going to be a great one.
41,31,"The hat is a joke. It sounds like a joke. You're not even a hat, but a hat. A hat. A hat."
41,39,I'd give it one more chance before I'm even born.
41,40,I like to read a lot of things. I like writing satire and it works.
46,41,"It's called, “I'm a little crazy.” It doesn't have the same meaning as a mask, it has the same meaning as a mask. Its a mask. Its a mask. Its a mask. Its a mask. Its a mask. Its a mask. Its a mask. Its a mask. Its a mask. Its a mask. Its a mask. Its a mask. Its a mask."
47,41,CDC is not a joke in the slightest.
49,41,i know what you mean.
50,41,I'm very skeptical of the idea of a gimmick. It sounds very like a prank.
