sender,receiver,message
14,11,"I've sunk to the point where I feel like we're in a nirvana, and we're going to go back to the past in order to get better treatment. It's a bad idea, but you're going to have to see a doctor before you can get one. You just have to go for a ride home, not go outside and let's all go to a different hospital if we're going to have a day off."
14,13,"I don't think the AMA is a joke. I think they were trying to take advantage of the public health system, to justify how they can't have an ""invisible"" person in the house or office."
16,14,"So a government government is supposed to be a joke. Is it an actual joke that the CDC is supposed to be trying to stop this from happening? Then Is it a joke that the CDC is supposed to be doing? Probably not, but not so much."
18,14,You have a legitimate problem with this comment. We've come a long way since we were banned from the CDC. We're trying to put the CDC in place. Now let's start with 'I'm so sorry' instead of 'I can't accept the fact that you're making it a joke.'
19,14,"It isn't a joke, it's a fact."
23,14,Isn't this just a joke. It's a joke. It's the same one as a joke.
27,14,> I think wearing a mask to prevent the spread of a virus is very effective.
39,14,People say that it's racist. But it's not. People say that it's racist.
47,14,The AMA is about the government's role in stopping the spread of a virus.It's a joke.
48,14,Well... it's an amazing idea and we don't need it to be silly.
53,14,The fact that they are putting it on so many people makes it not a joke. It's about the joke. It isn't funny.
61,14,"... Is there a medical term that identifies as a joke in a movie? Because it's a joke. Considering that this isn't the joke he was trying to get, he seems to be putting himself above the general public, even if it's just a joke."
63,14,"It's a retcon a few months ago. If you're interested in the discussion, you'll probably enjoy it. It was a great movie, but the joke is overshadowed by the fact that it's been viewed by a lot of people on multiple occasions."
68,14,The issue is a combination of political correctness and gender. One might say the joke is about a rape joke. The other might say the joke is about a politician in power vs. a government official.
73,14,"CANNOTANSWER: ""I like the part when he got covid but still had events with people and how he won't enforce a statewide mask mandate"
74,14,Vaccination is the medical miracle cure for HIV.
83,14,"Its legal to say what you want, but it is just like talking about what's going on around you and not being able to read."
14,1,"I am not the only one that thinks it is a joke. The thing is that in my experience, a person who is on the same page of a movie vs. a teen is always a joker."
14,8,"CANNOTANSWER: ""I think wearing a mask during a pandemic is very effective. People say that it's racist. But it's not. People say that it's racist."
14,11,"A rape joke? No, that isn't racist, it's the government's joke, it's a joke."
14,13,"A mask is a joke, and it's used in every movie, tv, magazine, etc. There are a couple people on there who have been able to take the joke to the extreme. Is that a joke, or just an insult?"
16,14,CANNOTANSWER: I read a lot of articles about the real reason why people make a joke. I read that the guy who wrote the book said it was a ripoff of the book.
18,14,"""Well the CDC has an obligation to keep everyone safe – not the children and the government itself. I don't believe they have any protection at all."""
19,14,You think a hsvm movie or any other medical show has a good joke to it? Or you think it's a funny movie?
23,14,">""We are not going to stop the spread of the disease, because it's an extremely bad idea."
27,14,"I have no problem with these kinds of jokes, but it's something they do.... So what's the point of wearing a mask?"
39,14,Vaccines are for life.
47,14,I just think that a large number of people should be doing the same things.
48,14,It's really a prank.
53,14,"Because I don't know what that means. Generally, I'd say that people who wear a mask because of their phobias are doing something that is funny and doesn't involve making fun of them."
61,14,"So, I guess someone is just putting themselves above the public and saying ""I don't think there is any reason not to have a vaccination campaign,"" to stop the spread of HIV?"
63,14,"I think this is a good movie, not a joke."
68,14,"Those AMAs sound a lot like the ones I read in the book, I've been following all of it for a few weeks now. Mostly because it's about the health problem and people trying to make their health care more important."
73,14,"Its not about what you wear. Its about what you do, whether you wear a mask or not. Its not about what the CDC is doing but it is what it is trying to do. That is something it isn't about the CDC. It is about the federal government's ability to stop the spread of HIV."
74,14,"The CDC wants to prevent spread of the virus because it's a joke, the government has done it before and it's done the exact same thing as a joke."
83,14,"This is the kind of thing that can make people sick. It's like they're trying to give you a fake mask and want to make people feel bad about their own health care, so they want to make people sick. They want you to think about how you feel if you don't. They don't want you to know a masked system works. They want you to think about how you feel in your own body and how that is harmful to your health. Unless you're really a fan of hats. You're not going to think about that."
14,1,"There is an article here with an AMA titled ""I think wearing a mask during a pandemic is very effective. People say that it's racist. But it's not. People say that it's racist. But it's a joke, it's a joke. People are joking. A joke. A joke."
14,8,The biggest issue I have with the government is: I don't think the government has a problem with the government's inability to stop the spread of a virus.
14,11,I'm a doctor. I want to make a joke about this and I need some insight as to what is wrong with it.
14,13,"""It's a joke. The article was meant as a joke but not to deflect an actual message. It is a joke. It is a joke. I don't see a big enough difference here between wearing a mask on a job and having a mask on a new home."""
16,14,"> he just isn't interested in a situation like that."", 'I just read the title and felt I was the only one to find this humorous."
18,14,"It's not like they aren't talking about something that's important to the health of people, it's about what's needed and what's not."
19,14,This is not about being a joke.
23,14,"If it is a joke to a lot of people, then no."
27,14,"The way the ACA mandate is implemented is to protect the population from the spread of the virus. That is the ad that's on, which is very much a joke."
39,14,"Vaccines are for life. Wearing a mask during a pandemic, because that's what they do in this country. That's awesome! I'm actually trying to get this post up. I'm in Florida, and i'm a little embarrassed to be doing this! What kind of food is there to eat, i know they're not all supersprupiaders but I"", ""I've seen it before. OP:"", ""(I'm pretty sure this is more about a joke)"
47,14,I don't think we can have a full-blown epidemic if we had a mandate to put it in place. The government essentially has a role to play.
48,14,"You could have been infected with an HIV virus. You could have got infected with one. You could have been infected with one. The AMA is about how to prevent the spread of a viral infection. This is the world we live in. The government is trying to cut a lot of people's lives and replace them with people who haven't been in the hospital. I think it's funny that Santa can be a big troll by talking about his medical bills, not his health insurance plans."", ""I'm not crazy at all about this"
53,14,Vaccines are not needed in the US. It has to do with pandemics.
61,14,"> ""If I'm not stupid, I'd wear a mask every day."""
63,14,"""""CannotanSWER A WINNY?"""
68,14,If you want to get in on this kind of conversation: I'm the president of the United States.
73,14,"A person who has a medical diagnosis for HIV, and the fact that they're wearing a mask in the states, is not a problem. It is a serious problem because it is dangerous to use it. It doesn't really matter that it is an infection that you cannot get. It's just part of the problem that you're being 'funny' and remorseful about that, because you're going to be dead by then."
74,14,"People who wear masks are often the ones that actually know what's going on. Those that don't realize they are wearing a mask, are so embarrassed by it."
83,14,It's funny. And it is a joke.
14,1,CANNOTANSWER A WINNY
14,8,I think it's a joke.
14,11,"[In our country, there are a lot of people with a hood and a mask that they can wear to stop HIV/AIDS.](http://www.doctors.org/articles/context_comments/editors_a_health_of_his_self_propaganda/sms_comment_of_this_evidence_of_the_gov_meeting_a_smash_out_of_the_gov_sm"
14,13,It's funny that the AMA was meant as a joke but didn't deflect a real message.
16,14,"There’s a reason if people aren’t interested in having kids, they shouldn’t do it."
18,14,It is a joke. And not necessarily to keep people safe.
19,14,"Its an absurd joke. You don't want to know what the movie is about, you just don't want to know what the story is about."
23,14,I think this is the perfect example of the joke that is going on in our society to be made out of. We are also aware that it is a joke that has been around since the 70's.
27,14,The government is trying to do a good job of putting in some effort.
39,14,I don't think the point of the AMA is that the government is trying to help protect children. That's a valid question.
47,14,"The AMA (and all the other questions I asked are related to government.) titled ""Wanting a mask to prevent the spread of a virus? """
48,14,"''Also, the AMA is a joke. The most common jokes in the AMA are about the CDC trying to get people to take up their own health care. That's why the government has to stop it. The AMA is a joke."
53,14,"I'm pretty sure the only problem I can see with the CDC is that they are putting the mask on so many people. I don't know why this subreddit is saturated with people telling jokes about sexist people, but a lot of people are being ripped off."
61,14,"Vaccines are dangerous, dangerous, dangerous. And they are legal.... the CDC is trying to stop the spread of a virus."
63,14,"""I like to think of my doctor as a doctor, but I see a lot of misunderstandings and just don't know what to do."
68,14,I'm confused by the whole 'How are we not getting a good chance at vaccination in America?' thing.
73,14,"I'm in the US, and I want to work in Texas."
74,14,"Yes, the government has done a lot of things to stop the spread of HIV."
83,14,You're not going to realize that a fucking joke is not a joke. That's an argument against the idea that you're a joke.
14,1,CANNOTANSWER A WINNY
14,8,There is a real joke.
14,11,>The AMA is a joke.
14,13,"The article is about people who wear the mask to ward off AIDS. I can't imagine the problem, but a person with a full head mask and an id of a sexy male who doesn't want to have a sexy man isn't going to be as ill as the guy on the cover."
16,14,"That's just an example of a ""no."" It's not a joke, it's an insult, it's an excuse."
18,14,"The CDC's attempt to make a joke is completely unfounded, and frankly the only thing it's making is a joke. The government's attempt to make a joke is almost a complete failure, and the fact that it was made with ""no"" in mind is an excuse to do something."
19,14,"A lot of people don't know what a virus is and don't wear a mask anymore. I mean, some people just don't care and that's about it. I'd buy a hat for myself. I don't want people to wear it. I'd be a big help to people who don't know what a virus is and how to do that. I'd spend my time helping people who need to be vaccinated, and I'd spend time helping them. This is about a joke and it's about the government,"
23,14,There are some things you'll notice when you wear a mask in public and they're not even there to stop it.
27,14,"The CDC, like every other agency in the US, is a huge piece of shit."
39,14,"The article has nothing to do with the AMA, but it is the topic of a discussion on the federal government's anti-spam program."
47,14,The issue is that I don't think they are bringing a big hit to the government.
48,14,I'd love to see more of these things.
53,14,I'm an ad man. I wear a mask every day.
61,14,I'm assuming that's just the general consensus among the Americans who wear them. They have the right to not wear any kind of mask when they get sick because it doesn't really affect them.
63,14,A little ironic at all. The AMA is really an example of how the CDC is using the CDC as a gimmick to minimize the risks of the virus. The movie is really an example of how the CDC is using the CDC as a gimmick to minimize the risks of the virus.
68,14,"No, not really. I had to go through it for a few months, and I still haven't seen anything in a few months."
73,14,This is the only thing that was supposed to change.
74,14,I don't think that the problem is in the lack of an irrational desire to stop the spread. I think that a lot of people in the medical community are just being silly.
83,14,My brother has a fever and has an infectious disease that is a good idea but not as bad as you might expect.
14,1,"""Wearing a mask is part of the measures deployed by the government to aid in stopping the spread of a virus. You're not going to realize that a fucking joke is not a joke. That's an argument against the idea that you're a joke."", """"I don't know much about how we do things, but I don't think it's the same as if the person is vaccinated or not. Its very obvious to me that they have to use a different mechanism."", ""I think it's"
14,8,What's the problem with all the AIDS jokes?
14,11,"""I don't think the AMA is a joke."""
14,13,''The article was meant as a joke but not to deflect a real message. It's a joke. It is a joke.
16,14,I'm sorry but I don't agree with what you're saying - this is a joke and the only reason I can think of that's because of the way you phrase it.
18,14,"I don't think this is going to become a full-blown joke. This is just an excuse to try and get people to do something about it, or to do something about it. Hopefully this isn't the result of your own inaction."
19,14,There's a lot going on there. It's just this one thing and it's pretty ridiculous.
23,14,"Yes, the vaccine is very dangerous."
27,14,"I'm a woman who hates wearing a mask. The CDC doesn't support it, it's the government."
39,14,"In all fairness, it is probably not a big deal. People who don't have that much confidence in the government can just go for it."
47,14,"[This sub is not about the AMA. It is about the government, CDC, and the world's population. What kind of joke is it?"
48,14,"There are a lot of things in the AMA about the masks, including ""It seems to me that the mascot is just a piece of shit to keep you more safe than no mask in tight settings."""
53,14,"A CDC AMA, where it's a joke, is not a joke. It's an AMA."
61,14,"[NAME] is a ""Have you had the virus?"""
63,14,"I'm actually interested in the movie but I amn't sure what to do. It sounds like it's a prank to me, and it is really a fucking shit joke."
68,14,"If they're just talking about protecting people, if they are avoiding any potential risks, and they're not, that's a joke."
73,14,""" ""Wearing a mask is part of the measures deployed by the government to aid in stopping the spread of a virus. This is the only thing that was supposed to change."""
74,14,"Vaccination isn't a joke, but a joke about how it's part of a government program."
83,14,Vaccines are not legally required in most countries because they are not mandated by the government.
14,1,"I think this is a joke, because it’s so misleading. It’s a joke about how we don’t have the same health care system. But I don’t know if this is a joke. I’m not saying this is a joke, but I am just trying to make it sound more obnoxious."
14,8,"In a short time, the CDC and CDC have decided that a ""job"" is a joke, and a ""masked person"" is the joke. The people who do not agree with what the joke says are also trying to get out."
14,11,"It's a joke, and is a joke."
14,13,"In my mind, there's nothing inherently'so funny' as saying, ""I don't have a mask on my job, but I don't believe in a mask."""
16,14,"> ''Wearing a mask does not help in stopping the spread of a virus. It's useless and I hate it.""''"
18,14,"A pedophile. I don't think anyone cares if he is having a pedo rash and getting sick, so I would have a pedo rash."
19,14,"I don't think it is a joke, I think it's a joke, not a fact."
23,14,"I'm a doctor, and I'm wearing a mask every day, and my mother doesn't wear it because of the AIDS epidemic."
27,14,"CANNOTANSWER: I'm a woman who hates wearing a mask. The CDC doesn't support it, it's the government. There is no reason to wear a mask. People have different opinions than you and I I I think that this post is very good and reflects my views on the issues in the US health care industry."
39,14,"> ''I am pretty sure this is more about preventing someone from getting sick, but also to prevent a potential vaccine causing people to get sicker because of a mask is in a bad position. It doesn't make sense to me.""'', ""[(I'm pretty sure this is more about preventing someone from getting sick, but also to prevent a potential vaccine causing people to get sicker because of a mask is in a bad position. It doesn't make sense to me."
47,14,It's a joke.
48,14,"So, ""How can you wear a mask while infected? Does that mean he's not going to need it?"""
53,14,"I've gotten a couple of AMAs from people in this subreddit, and when they do, I'm almost always downvoting them for things that don't relate to the topic, rather than the issue of people being ripped off."
61,14,Vaccines are not legally required to protect against all types of viruses. 'Vehicles are not legally required to protect against all types of viruses.'
63,14,"Honestly it sounds like a prank to me, and it's really a fucking shit joke. It's not like the CDC is overreacting. I know the movie is a good movie but I don't know what to do. I'm not the prankster. I'm the prankster."
68,14,The AMA in the AMA is actually a question about what we need. The question is why do you think the AMA is so popular?
73,14,They are not being skewed because they are being skewed because they do not know what to do to stop the spread of the virus.
74,14,"Vaccination isn't a joke, but it is a joke about how it is."
83,14,"I'm sure you'd want to see some frank conversation with someone about it, but this sounds like you're not comfortable with it."
14,1,I can't believe that a few of the first things people say about the government being a joke are saying.
14,8,"This article is very confusing. The first part of the article is basically a joke about the way the government treats people, but is more or less a ""job"" joke."
14,11,I was one of those people that said this at work.
14,13,AIDS isn't a joke. It's a joke. The joke itself is just not as funny.
16,14,"In the AMA it states that it's not ""a joke"", but it's a joke."
18,14,"It's not about the vaccine. It's about the vaccine, not the people who are being infected."
19,14,AMA isn't a joke.
23,14,"> ""I'm a doctor, and I'm wearing a mask every day, and my mother doesn't wear it because of the AIDS epidemic."""
27,14,I think you're right - the government should be trying to use the right of the people to stop the spread of a disease.
39,14,They are going to make the AMA out of what you've said. The AMA is an attempt to stop people from getting sick and making the jokes about the government. The AMA is about preventing the spread of a virus. The AMA is just a joke. The AMA is a joke. AMAs and AMAs for health are not jokes. They are part of the government's policy to combat viral infection. The AMA is based on facts.
47,14,"A large number of states have mandated public health for AIDS patients, and you can still wear a mask. I'm not sure if it's that much of a joke, but it sounds like a joke."
48,14,AMAs are not jokes. They are a way to get people to take up their own health care.
53,14,[(http://www.reddit.com/r/articles/2013/02/the-CDC-failure-to-troll-the-vaccine-vaccine-disease-complaint-reflection)
61,14,"They need to use the word ""joke"" to describe what a ""joke"" is. It's not like the government and the government are trying to stop the virus. It's just a joke that's not a joke and that's sexist."
63,14,CANNOTANSWER A WINNY is a movie about a prankster who explains how to wear a mask and that there is a CDC video for the viral spread. It's a joke
68,14,"You are right, and if you have any other questions about this, go to [http://www.amazon.com/www/subject/eph/what-i-know/infrastructure-and-protection-accreditation/""I feel like you're right."""
73,14,"A national guard member and he just said, ""I think it's a great idea. They can't take it down as a joke. They can't take it down as a joke. It's not funny. I can't think of any other way to respond."
74,14,That's the problem with a lot of jokes that make you think people should be more ashamed about getting vaccinated.
83,14,What does the CDC do?
14,1,"“Were you vaccinated? Were you vaccinated? If so, are you safe?”"
14,8,"CANNOTANSWER: ""I think wearing a mask during a pandemic is very effective. People say that it's racist. But it's not. People say that it's racist."
14,11,I have the same opinion about a narrator and I can say with certainty that his point is about being a joke.
14,13,"In the article it says a ""joke"" is a joke, which means it's a ""joke""."
16,14,"This is a pretty shit joke. I think it has more to do with a government, in general."
18,14,"''You have a legitimate problem with this comment. I think it's funny that you read the title, but I think it's funny. Because the government doesn't want to have the health of their family protected."""
19,14,I was a member of the NVP.
23,14,This is a very serious and very true issue. I have seen plenty of videos that showed that the vaccines are not going to stop it. They aren't even as dangerous as we think they are.
27,14,"So, as someone who is a member of the National Guard and a member of a very small country and they wear masks, if I could afford to take the time to read a full book, I'd just tell them to stop."
39,14,"a rebuttal: i've been vaccinated a few times now, I can confirm that it is a joke."
47,14,"A small, if any, government agency."
48,14,a lot of people are getting mad at the government and the government has to stop it.
53,14,"This is a really good idea. If the government wants to prevent the spread of the virus, they are not really allowed to do it."
61,14,This joke doesn't come across as a joke.
63,14,I think you're getting downvoted because you are taking a funny movie too seriously. This is one of those movies where it's just too stupid to get traction on a whole bunch of different topics. The AMA isn't a joke. It's just a prank.
68,14,"AMA: ""Hey, I want to rephrase this. I don't think this is going to come out here but I'm here defending rape and sexism. I think I will say it is going to. AMA: I don't think we need to re-address the issue. We need to defend the health of the public. And I'm also going to say it's a joke because I don't get it. AMA: I'm going to show off my"
73,14,It's not just about fecal viruses but about their spread.
74,14,I think the problem is a lack of irrational desire to stop the spread.
83,14,"There is a lot of disagreement about the legality of wearing a mask on a job. In the UK, the government would want to make everyone shit about the fact that wearing a mask on a job is illegal."
14,1,"> I know that the virus is not very common and it is a serious threat to people, if you don’t want to be in the ER. It’s also a big problem because there is a chance that you get to stay sick to a certain degree for an extended period of time because you are a hospital patient. I think wearing a mask during a pandemic is very effective. People say that it’s racist. But it’s not. People say that it’s racist. People say that it’s a joke."
14,8,"The government should not be forced to do any of the above, but they should be able to do it."
14,11,"As the AMA begins, ""How I know you're a racist, and I don't think I'm racist."
14,13,It's a joke.
16,14,"Well, this one. I think you are being a little wacky. And I'd like to add that you have more experience than that."
18,14,"People like to play the ""joke"". It's part of the government's job."
19,14,>What was the main difference between the masks and the sex hazard?
23,14,This has gotten so much sarcasm and I can't even begin to tell if that was the actual joke that prompted the movie.
27,14,The title says they are actually claiming to have invented the mask. So it isn't a joke.
39,14,The point is that the government is trying to make a joke that isn't racist. It's an attempt to make a joke that isn't racist.
47,14,"I'd say this is a joke. There are a lot of things you need to know about the AMA, but I really don't think it's a good idea."
48,14,[NAME] is an old and controversial book that has all these facts:
53,14,> I'm pretty sure the only problem I can see with the CDC is that they are putting the mask on so many people.
61,14,"I'm sorry, but it's not really funny. In the first place, it's funny."
63,14,"CANNOTANSWER is also not a doctor and hasn't seen any movie with the CDC in it, if you're interested."
68,14,"That's a bit of a sexist joke. I think you can't just ""stuff"" it up."
73,14,"Yes, I think wearing a mask is a problem of government incompetence."
