sender,receiver,message
14,1,can we developed a mask or helmet that will protect us from corona and that everyone would have to wear to go outside for a month or that would allow us to open up the economy again
14,8,can we developed a mask or helmet that will protect us from corona and that everyone would have to wear to go outside for a month or that would allow us to open up the economy again
14,11,can we developed a mask or helmet that will protect us from corona and that everyone would have to wear to go outside for a month or that would allow us to open up the economy again
14,13,can we developed a mask or helmet that will protect us from corona and that everyone would have to wear to go outside for a month or that would allow us to open up the economy again
16,14,please leep your mask on i don t want you to be taken out by a virus that is not gone
18,14,hey i just saw you are running miles across florida right now curious if you would share what is the route im in orlando and would love to come run with you even if just for a mile i d wear a mask and keep distance
19,14,open for public play saturdays and sundays pm pm practicing social distancing remember to wear your face mask playpaintball publicplay socialdistancing familytime paintball openforbusiness nvp sports park
23,14,we keep hearing about how most kids quickly recover from covid pretty hard to recover from this wear a mask and if you can get vaccinated
27,14,huge covid fail to have santa not wearing a mask in thanksgivingdayparade would have been so powerful and such an endorsement of healthcareheroes wearamask
39,14,don t go to a party with a house full of ppl not wasting mask during a pandemic
47,14,those who want to protect themselves from getting sick have every right to masks keep you more safe than no mask in tight settings everyone has the right to do whatever they want now at their discretion
48,14,i was late but i gotta hand it to he s got me wearing my mask everywhere and my area is spiking hard right now just signed up to get me and the wife a drive up test come saturday
53,14,i don t often have time to shave my face stubble in the morning luckily coronavirus is very accepting of mask culture so actually it s required
61,14,walking out of the grocery store in florida and i m taking my mask off as i just walk out some old lady walking in looks at me and goes thought this was a free country just laughed at her go get your groceries and be quiet lady
63,14,huge covid fail to have santa not wearing a mask in thanksgivingdayparade would have been so powerful and such an endorsement of healthcareheroes wearamask
68,14,was behind a guy at eleven who was wearing his welders mask he could have just said i forgot it when he didn t have a face mask but instead he put others first you know what you call a person like that a patriot
73,14,i like the part when he got covid but still had events with people and how he won t enforce a statewide mask mandate oh and the part where he cut education funding wow so great
74,14,this month i personally know people that have gotten covid one of them past away this week please wear a mask
83,14,those who want to protect themselves from getting sick have every right to masks keep you more safe than no mask in tight settings everyone has the right to do whatever they want now at their discretion
14,1,>We developed a mask or helmet that will protect us from corona and that everyone would have to wear to go outside for a month or that would allow us to open up the economy again
14,8,The article says that wearing a mask is part of the measures deployed by the government to aid in stopping the spread of a virus.
14,11,Wearing a mask is part of the measures deployed by the government to aid in stopping the spread of a virus.
14,13,Wearing a mask is part of the measures deployed by the government to aid in stopping the spread of a virus.
16,14,"You can sleeve a mask in a public spot in your neighborhood and get vaccinated if you want, and you have a sleeveless mask with you."
18,14,Well there are several types of vaccine that are designed to help combat this virus. They include the vaxxed and vaccines that prevent this kind of disease.
19,14,Wearing a mask is part of the measures deployed by the government to aid in stopping the spread of a virus.
23,14,It will be cool to see some things you don't like like wearing a mask in public.
27,14,I'm not that smart about it.
39,14,"Wearing a mask during a pandemic, because that's what they do in this country."
47,14,>If I don't want to protect myself from getting sick have every right to masks keep you more safe than no mask in tight settings everyone has the right to do whatever they want now at their discretion
48,14,You can not go outside without a helmet for any reason.
53,14,"Hey guys, this guy is the new face of a scam"
61,14,It s the cheapest thing I have ever had.
63,14,> Wearing a mask is part of the measures deployed by the government to aid in stopping the spread of a virus
68,14,They will give you some clue as to how to make a safe move if you don t do it right.
73,14,We must change our constitution to stop the spreading of the virus.
74,14,Wearing a mask is part of the measures deployed by the government to aid in stopping the spread of a virus. This month i personally know people that have gotten covid one of them past away this week please wear a mask this month i personally know people that have gotten covid one of them past away this week please wear a mask this month i personally know people that have gotten covid one of them past away this week please wear a mask this month i personally know people that have gotten covid one of them past away this week please wear a mask
83,14,"You should check out the wikipedia page about this a bit before you go. It tells you you have the oh no, you can do whatever you want when you go."
14,1,You're being a dick. There's no going back.
14,8,That's the biggest issue I have with the government: I don't think the government has a problem with the government's inability to stop the spread of a virus. I think it's time for the government to act and not force people to do things that they don't want to do.
14,11,"People can get vaccinated in small numbers. In fact, there are a number of vaccines to combat a Virus."
14,13,As the guy on this sub says it is:
16,14,"In general, the people in this thread are just as concerned about the government’s power to take control of their own health and to make sure that they don’t have any other personal responsibilities in their lives."
18,14,> Wearing a mask is part of the measures deployed by the government to aid in stopping the spread of a virus.
19,14,"As an avid outdoorsman, I've noticed that a lot of people don't wear a mask anymore, especially if they're getting a flu."
23,14,"The only time that I would wear a mask was during an interview with my mom, who says ""I'd prefer to be alone than in the hospital, where I just want to get me to go. I've never been to a hospital, or had to do anything to help them. I need help, a personal med, and I will be right there in front of the doctor!"" The question was: what did she expect? She'd like to know. You might be able to go to a doctor with a doctor."
27,14,"[No, we don't wear masks, they aren't necessary.](https://www.cdc.gov/resources/public-faculty/comments/2sc2ed3c5eds3e/) If he were elected to office, there would be a government oversight bill and you could make that bill work."
39,14,"Wearing a mask doesn't help with the spread of any virus. It's not a positive thing and it's not something I think is a positive thing. Wearing a mask during a pandemic, because that's what they do in this country. That's awesome! I'm actually trying to get this post up. I'm in Florida, and i'm a little embarrassed to be doing this! What kind of food is there to eat, i know they're not all supersprupiaders but I"
47,14,"I just read about wearing a mask. I was told by an official who worked in public health that wearing a mask is considered a form of protection, and that there are people in the public health field that can't afford it. I think I see it as something that a lot of people can actually do. The truth is that we're not talking about that, we're talking about the fact that there is a statewide mandate. That being said, I wouldn't worry about having a statewide mandate, as you are, so I wouldn't worry about that"
48,14,"Y'know, I've never seen that movie before. Do you remember it?"
53,14,"There's a lot of stuff about the mask that would not be covered. It doesn't mean that it doesn't exist or is a crime, it just means that it is a way to prevent people from getting the disease. And that's the one thing they haven't gotten - they want their citizens to wear a mask, and they don't want their citizens to wear a mask, because their public image is so poor and unhappiness is a real threat."
61,14,So you wear a mask to protect your eyes?
63,14,Yes he meant that he has been sent a message that they should wear the mask at their office and not a mask that they are wearing at their office.
68,14,"The government in Texas is a giant ""spy"" of the problem and there are many places in the nation with no mandate to do this."
73,14,He lied and made a troll post about it on r/legaladvice.
74,14,I'm sorry to break it to you but I still get a scar from my covi cleft palate that if I keep going out on my own is one of the biggest shit in the world.
83,14,"""I am a woman and I wear a mask on the run route in my car."
14,1,"A statewide mandate is a fucking thing. The problem is the country....and we aren't going to go to a fucking doctor. A lot of people will have to do what they want, and it will be much cheaper than a public health emergency. I would wear a mask to stop a virus and still avoid all contact."
14,8,"[(https://www.cdc.gov/resources/public-faculty/comments/2sc2ed3c5eds3e/) Wearing a mask during a pandemic,"
14,11,"There's a link at the top of this r/reddit article called ""Gods will not care."" It's also in the title."
14,13,If you want to get away from this problem I recommend it - and not just because you are in FL - but because you're from the west coast and you're afraid of getting caught in a pandemic.
16,14,We need to be able to stop this virus from spreading. That's why a bunch of states require people to get HIV/AIDS vaccinations. That doesn't mean that the government must prevent this from happening.
18,14,"We are not able to fight off viruses through physical contact, so we must not go through physical contact with the virus (what a bad thing that's)."
19,14,"I have to go to school now because I was too old to wear a mask. I wore a hat and a hat every day. Having no hat and no hat is going to make me a worse person. I've had a severe cold and still have a lot of fun going to school, and it hurts to get the hood up. I feel like I should have a shirt if I could get a new one for Halloween. I don't care how well I feel about it, I'm a man in a mask."
23,14,There are many people out there that haven't been vaccinated.
27,14,You don't know what a government oversight bill is. It's a nice idea to have a mask that's more than enough to get people to think about themselves and they're really the only people that could have done better.
39,14,I've seen it before. OP:
47,14,"""... if you haven't lived with a virus. I can tell you that it's just as dangerous as being shot or burned to death. I'm running a half mile in Florida right now! It's a really good idea. There is a large number of states and states requiring you to wear a mask. I just read about wearing a mask. I was told by an official who worked in public health that wearing a mask is considered a form of protection, and that there are people in the public health field that can't afford it. I"
48,14,"I don't know, but I think it's hilarious that Santa can be a big troll by talking about his medical bills, not his health insurance plans."
53,14,i've had my face shaved twice to stop the spread of my virus. my nose is still shaven from the time it was born
61,14,"I wear a mask to protect my eyes, but I'm embarrassed. It's the worst."
63,14,"You might find the movie more intriguing, but it doesn't get that much traction. The story line is similar and I think the reason people are so happy to see the movie is because the idea is so important, that's why people are blaming them. But there's also a lot of confusion, especially since it's on their head, in regards to the way they are doing it."
68,14,"""I'm wearing a mask outside while vaccinated because people like you are in my face why does it bother you to the point that you are asking random people why they are doing something that makes them feel safe please leep your mask on"
73,14,"The people of California do not want to take them. The people of Texas don't want to take them, they want to take care of the child that snuck into the world."
74,14,"If you get sick you have to be vaccinated and get your covi cleft palate removed. If you get sick and have a covi cleft palate removed you will have a scar and may not have a covi cleft. It sounds like you've been in the hospital before with a vaccinated friend, and you've been on a diet of colitis. You have a covi cleft palate and you do get the scar. Then they have to be vaccinated and not be vaccinated. I'm"
83,14,Honestly I don't see a big enough difference here between wearing a mask on a job and having a mask on a new home.
14,1,"I don't know much about how we do things, but I don't think it's the same as if the person is vaccinated or not. It's more like someone is not supposed to know where to get the shit out. It's a bit like what some people are talking about and not really a shit person who is not going to get the shit out."
14,8,I was raised on a statewide mandatory health care provider. He also told me that it was necessary to wear a mask to keep people from getting sick.
14,11,"In my town, there's a group of homeless and homeless people with a hood and a mask that they can wear to stop HIV/AIDS. There's some pretty common ones as well."
14,13,"'As the guy on this sub says it is:', ""If you want to get away from this problem I recommend it - and not just because you are in FL - but because you're from the west coast and you're afraid of getting caught in a pandemic. We need to be able to stop this virus from spreading."
16,14,A bunch of states require people to get HIV/AIDS vaccinations. That doesn't mean that the government must prevent this from happening. I'm a medical student and I am not familiar with the medical issues that are involved in this.
18,14,My brother and I were running together at the time and it blew up and he never got a ticket. He would suck my ass for not wearing a mask and he'd want to relive his days when he went to school.
19,14,I didn't realize this sub was talking about a virus. It's a little out of date. I'm also not sure why people are assuming it's just a joke.
23,14,Is it a secret? Can you come over and get a piece of advice from an AIDS expert to stop the spread of the virus?
27,14,What do you think about the CDC's decision to prevent spread of the deadly disease?
39,14,"This is a joke. They said something about that, not to be misinterpreted. It is part of the AMA that was a joke. They didn't even mention it."
47,14,"""(You don't have a right to an opinion and this is what makes you an elitist idiot."
48,14,I am glad you're getting this.
53,14,"It's not a joke, it's a joke."
61,14,"If you don't like it, you're a bad person. If you're uncomfortable, you're going to shit about yourself. I'm sure that you'll find people who are a little more experienced about the disease, but it's very hard to understand why this is going to be so successful."
63,14,"OP: I have a lot of work experience, and my best friend is in the same situation."
68,14,This is not a joke. The joke is that you don't have to wear a mask or have it on. This is an insult to the government and a way of thinking you don't care about it. You can have a mask on and make yourself feel better.
73,14,"I was born in the US but we were in Texas and it was still very scary to me at the time. We had to have a statewide mask mandate, but we would be able to have him go to the hospital and then we could go and do some shit there."
74,14,Is a covi cleft palate removed a permanent scar?
83,14,I believe in the masked system and the government will do a great job of making the public aware of it.
14,1,Wearing a mask and having a hood around you would probably have to be a very common occurrence among those living with HIV/AIDS in Texas. Its a very common thing to do at the hospital as it will make people feel better but in reality it is not a real problem.
14,8,> I don't see a big enough difference here between wearing a mask on a job and having a mask on a new home.
14,11,"Honestly, I think I read some stuff a bit and I'm going to omit some of the points you made."
14,13,"AIDS is a scary disease, and it's not a joke. You don't have to have a mask or have it on. There's no real way to stop it, and if you don't want to get it you can't, which is why you can't. The idea is to scar people and make them feel better, but that doesn't mean you can't make them feel better."
16,14,"I think I was the only one to find this humorous. The guy is not really a doctor, it is a lawyer, he just isn't interested in a situation like that."
18,14,"I'm so sorry, but I am a public health professional in a school. It is very hard to stop an HIV pandemic if you don't wear a mask. If you don't like the way you see it, I'd wear a mask. Sadly, I am so sick and I'd just not have a mask at all."
19,14,It's not a joke. It is a fact. This is not a joke.
23,14,Isn't the US government actually putting up with this issue?
27,14,I think you need to put out a whole shit load of words. I think wearing a mask to prevent the spread of a virus is very effective. I mean I've been using a mask for several years Why wouldn't you wear a mask if it helps prevent the spread of a virus? I think you can do it if you're a person.
39,14,"I think the point of the article was a joke and he was a jerk about it. ''I'm pretty sure this is more about preventing someone from getting sick, but also to prevent a potential vaccine causing people to get sicker because a mask is in a bad position. It doesn't make sense to me."
47,14,"That's right, but I think we all know that it is a misstep to put a mandate in place. I do believe that they are putting in place a policy that will prevent a lot of people from using it, but I think they can still protect themselves and their kids with it."
48,14,How can you wear a mask while infected? Does that mean he's not going to need it? Does the santa have to wear a mask to stop a virus spreading?
53,14,"""It's not a joke, it's a joke."""
61,14,"I feel like I'm not a doctor. I can talk about things like a mask, but I'm not an expert. I don't think people are 'fooling' about this, even though they know that they can get shot, but it's a joke and a real good idea. This is an actual joke. It sounds like some people are trying to get their own vaccine, because they think it's a bad idea to be wearing a mask while you walk by a grocery store. I'm not sure what the joke is about."
63,14,CANNOTANSWER A WINNY?
68,14,That's a joke. It's a sexist joke.
73,14,"If he wasn't a pedophile, then yes, a federal mask mandate would not actually protect against HIV. The statewide mask mandate does not apply to Texans in the US."
74,14,That's actually one of the big shit in the world.
83,14,[And you have a bit of a history of wearing a mask on a run route in your car](http://www.fwdr.fl.gov/comments/5/AssistantAssistantAssistantAssistantAssistantA Honestly I don't see a big enough difference here between wearing a mask on a job and having a mask on a new home.](http://www.fwdr.fl.gov/css/fwdr
14,1,"AIDS is a serious disease and it's a serious threat to people, if you don't want to be in the ER. It is also a big problem because there is a chance that you get to stay sick to a certain degree for an extended period of time because you are a hospital patient. I believe that a statewide mandate is a sexist joke and a sexist joke is a joke."
14,8,"Yes, it's a joke, it's a fact."
14,11,"Well, the headlines are not about a single story, but there's one in particular, where it's a really big deal."
14,13,It's not a joke. The article was meant as a joke but not to deflect an actual message. It's a joke. It is a joke. I don't see a big enough difference here between wearing a mask on a job and having a mask on a new home.
16,14,"In what way is this a joke, and what can the NSA say?"
18,14,I think you need to know a lot about the upcoming season of season 2.
19,14,"People are making movies about viruses for the wrong reasons, not for the wrong reasons."
23,14,"It's kind of hard to tell if the government really is trying to make the vaccines safe or not, given that we haven't seen a lot of the AIDS epidemic."
27,14,"I think you're just going to need to take some time to really read this one, but I do think it's very funny that you think it's a good idea to wear a mask."
39,14,Vaccines are for life.
47,14,">Wearing masks does not help in stopping the spread of a virus, it’s useless and I hate it. I don’t see how you could be trying to help a guy’s mother."
48,14,"It is funny that a fad exists. A prank has to be an attempt to inflict a death or even death on those who are not infected. If you were infected with a disease, a prank will happen. This is why a joke isn't funny. 'Winning a mask in a run is a joke' is a joke, the mascot is a joke."
53,14,">Wearing a mask, but when they don't, they don't seem to notice the need for them."
61,14,'What a joke'
63,14,>CannonanSWER A WINNY?
68,14,"AMA is the most popular media. It’s a form of public health, and it’s been around since the 90s, and has become popular in a number of other countries."
73,14,And he's not saying he wants to stop this?
74,14,">I think that in order to stop the spread of a virus, a mask is necessary. Vaccines are not what the government wants. Vaccines are not what the government wants."
83,14,"I agree with the other one. A lot of the time, it's just about being a joke."
14,1,"I'd wear a mask, even if you haven't seen it. You know how people say that if you were infected with HIV, that it would mean you're gonna get AIDS."
14,8,Afraid that the government doesn't want to have to take all those ad hominem hats on the street to get a real answer.
14,11,"It seems like the NSA is not trying to get something for it, but is more concerned with the safety of the vaccines and its use for being an innocent joke, like I've said before."
14,13,"What the article says is very relevant, for a political discussion about HIV/AIDS."
16,14,'I have a mask on and if that's all I want to wear to my doctor I'll have a bunch of people to show me'
18,14,I'm actually going to go ahead and post this in order to get you to do the first season of season 2.
19,14,"AMA is pretty bad. Its just a bunch of shit, and it doesn't make sense to say it's a joke."
23,14,I just got a second chance of making a joke about Obama and the mask mandate. Its kind of like a ripoff.
27,14,"""This guy is trying to discourage people from wearing masks for christmas What's the joke? If people were not blaming themselves that is a joke. The government is blaming themselves, but they just don't realize that they are blaming themselves. It's just a joke."
39,14,">If it was to stop the spread of a virus, I'd give a fuck. The guy who he was talking to was basically gonna have some naivete to say."
47,14,Why would I wear a mask if my wife was HIV positive?
48,14,So in this case the prank of Santa wearing a mask is a joke?
53,14,"CANNOTANSWER: I've had my face shaved twice to stop the spread of my virus. My nose is still shaven from the time it was born"", ""It's not a joke, it's a joke."""
61,14,People can get the flu but the government just wants to whack it away by not trying to protect their own health.
63,14,"I know the name, but I don't remember reading anything that actually mentions the word. I mean, you can wear a mask to stop spreading a virus. That's all a joke."
68,14,"I've always wondered if the government just put a lot of emphasis on the gov't's failure to protect children, as if it was a joke."
73,14,"statewide mask mandate, which would not be used to protect against HIV."
74,14,"I think you're just being silly. ""Winning a mask is part of the measures deployed by the government to aid in stopping the spread of a virus. I think a lot of people are just being silly. The whole concept of a medical mask is silly, but to a large extent it is silly. People who wear masks are often the ones that actually know what's going on. Those that don't realize they are wearing a mask, are so embarrassed by it. You can't just go off on a whim, you just want a good feeling"
83,14,Vaccines are legal. And they aren't required.
14,1,"It seems like the NSA is not trying to get something for it, but is more concerned with the safety of the vaccines and its use for being an innocent joke, like I've said before."
14,8,So basically I’m saying this: the government should be taking care of everyone else’s health while they’re working. That way they can protect themselves.
14,11,"I am not saying that you are not being silly. I am saying that the issue with the statewide mask mandate is a joke. I don't believe the AMA is about how much people want to wear masks in order to prevent people from getting HIV, and that the government doesn't have any say in what their vaccines will do."
14,13,It is a joke. It doesn't make sense to say it's a joke.
16,14,I just read the title and felt I was the only one to find this hilarious.
18,14,What a good guy he is! It sounds like he has a pedo rash and can't really live with it.
