sender,receiver,message
73,6,i like the part when he got covid but still had events with people and how he won t enforce a statewide mask mandate oh and the part where he cut education funding wow so great
73,7,i like the part when he got covid but still had events with people and how he won t enforce a statewide mask mandate oh and the part where he cut education funding wow so great
73,11,i like the part when he got covid but still had events with people and how he won t enforce a statewide mask mandate oh and the part where he cut education funding wow so great
73,13,i like the part when he got covid but still had events with people and how he won t enforce a statewide mask mandate oh and the part where he cut education funding wow so great
73,14,i like the part when he got covid but still had events with people and how he won t enforce a statewide mask mandate oh and the part where he cut education funding wow so great
73,16,i like the part when he got covid but still had events with people and how he won t enforce a statewide mask mandate oh and the part where he cut education funding wow so great
73,27,i like the part when he got covid but still had events with people and how he won t enforce a statewide mask mandate oh and the part where he cut education funding wow so great
73,29,i like the part when he got covid but still had events with people and how he won t enforce a statewide mask mandate oh and the part where he cut education funding wow so great
73,31,i like the part when he got covid but still had events with people and how he won t enforce a statewide mask mandate oh and the part where he cut education funding wow so great
73,33,i like the part when he got covid but still had events with people and how he won t enforce a statewide mask mandate oh and the part where he cut education funding wow so great
73,34,i like the part when he got covid but still had events with people and how he won t enforce a statewide mask mandate oh and the part where he cut education funding wow so great
73,37,i like the part when he got covid but still had events with people and how he won t enforce a statewide mask mandate oh and the part where he cut education funding wow so great
73,38,i like the part when he got covid but still had events with people and how he won t enforce a statewide mask mandate oh and the part where he cut education funding wow so great
73,40,i like the part when he got covid but still had events with people and how he won t enforce a statewide mask mandate oh and the part where he cut education funding wow so great
73,42,i like the part when he got covid but still had events with people and how he won t enforce a statewide mask mandate oh and the part where he cut education funding wow so great
73,47,i like the part when he got covid but still had events with people and how he won t enforce a statewide mask mandate oh and the part where he cut education funding wow so great
73,50,i like the part when he got covid but still had events with people and how he won t enforce a statewide mask mandate oh and the part where he cut education funding wow so great
73,52,i like the part when he got covid but still had events with people and how he won t enforce a statewide mask mandate oh and the part where he cut education funding wow so great
73,54,i like the part when he got covid but still had events with people and how he won t enforce a statewide mask mandate oh and the part where he cut education funding wow so great
73,56,i like the part when he got covid but still had events with people and how he won t enforce a statewide mask mandate oh and the part where he cut education funding wow so great
73,65,i like the part when he got covid but still had events with people and how he won t enforce a statewide mask mandate oh and the part where he cut education funding wow so great
79,73,as someone who was there this weekend who lives in a conservative county in california the residents of texas where kind respectful and upheld mask ordinance better than mins of being back in california please let s not turn our backs on people who need help
82,73,please help by following the order so we can remain open and safe for everyone whether you agree with the mask or not we need to follow the order and please be kind to the staff if they remind you they are just trying to do their job thank you all for your understanding
101,73,"Wearing masks does not help in stopping the virus, it's useless and I hate it."
73,6,Wearing a mask is part of the measures deployed by the government to aid in stopping the spread of a virus.
73,7,"OP, you know how the federal government works, you should go suck at it."
73,11,"I don't agree with that position at all. i'm from texas and i don't think they will follow the law, but I think they will and this is a good example of how government is being too harsh."
73,13,I was there and got up with a lot of people.
73,14,We must change our constitution to stop the spreading of the virus.
73,16,"Wearing a mask does not help in stopping the spread of a virus, it's useless and I hate it."
73,27,i like the part when he got covid but still had events with people and how he won t enforce a statewide mask mandate oh and the part where he cut education funding wow so great i like the part when he got covid but still had events with people and how he won t enforce a statewide mask mandate oh and the part where he cut education funding wow so great
73,29,... and they are a bit of a prick and a bit of a fraud.
73,31,A federal mask mandate should protect your rights and make you a person in the world.
73,33,I don't even understand what you mean if you read the title you aren't going to follow it unless you follow the OP's directions. I do know that this is an old ad. I don't see the whole thing as a problem at all unless you follow a different article OP's comment has for you.
73,34,... you are a fucking pedophile.
73,37,They say that they want to see him without his mask.
73,38,i am a federal agent and i have a state employee's license and it is my job to help people with my personal problems
73,40,It's just as bad if people have to take steps to keep the federal government from introducing a new one.
73,42,He cut education funding. You could say this is a conspiracy to prevent the spread of the virus.
73,47,The people of texas would do a good job with the mask if it were an effective mask.
73,50,"It doesn't even sound right to me that he is trying to enforce a statewide mask mandate, but he is doing it. I am pretty sure that it would be a better way to deal with the problems associated with a statewide mask mandate if the state passed it."
73,52,I am going to try to tell you the truth about how my state isn't on this list. We should go. We should also be able to be as good of a voter as possible.
73,54,"... And a statewide mask mandate would be the most important piece of legislation ever. It is a very valid and enforceable part of the legislation in the state of California, and the statewide mask mandate will be the most important part of it."
73,56,So you think wearing a mask will stop the spread of the virus?
73,65,>I like the part when he got covid but still had events with people and how he won t enforce a statewide mask mandate oh and the part where he cut education funding wow so great i like the part when he got covid but still had events with people and how he won t enforce a statewide mask mandate oh and the part where he cut education funding wow so great i like the part when he got covid but still had events with people and how he won t enforce a statewide mask
79,73,"As someone who lives in a conservative county in California, what does that mean to you?"
82,73,We can develop a mask to protect us from corona. It would save lives.
101,73,"Wearing masks does not help in stopping the virus, it's useless and I hate it."
73,6,Then you should consider going to the state statewide mask mandate to stop the spread of the virus.
73,7,Is this a statewide mask mandate? Because there isn't an effective one.
73,11,>We must change our constitution to stop the spreading of the virus.
73,13,It's not as if he's trying to be a pedophile or a con artist or a pedophile. He's just trying to try and elicit someone who thinks he can do better than him.
73,14,He lied and made a troll post about it on r/legaladvice.
73,16,It's a legitimate reason to not vote for a statewide mask mandate.
73,27,I like the part about what the other commenters are saying.
73,29,"Nope, this is more like a liar, if the nba tried to take him to a medical center, we'd be having to go to a surgeon. The people of California don't want to take them, they want to take care of the child that snuck into the world."
73,31,"if there was a statewide mask mandate in California, they wouldn't have to apply for an individual person to wear it"
73,33,... and they are a bit of a prick and a bit of a fraud. A federal mask mandate should protect your rights and make you a person in the world.
73,34,"So I'm gonna ask you, what does that mean to you?"
73,37,... you are a fucking pedophile. They say that they want to see him without his mask.
73,38,"I know what you mean, but you're a pedophile and he would not have done it if he did that."
73,40,"Yes, it is illegal for the state to implement the Statewide Mask mandate if it isn't a statewide mandate, which is a federal one."
73,42,"There was a good ad recently called ""God I love you and don't let me hurt you"" (which I still am). I read it and thought, ""Oh, I love you but you don't like me"" but I thought ""I love you so much."" And then I read it again. It just came out this morning."
73,47,"They're bringing up a really stupid issue. The state of Texas is trying to stop the spread of a virus. We haven't actually tried anything to stop it, but we've got something in mind."
73,50,"I think a federal mask mandate is a bit of a misstep, but it's also not a good idea, since it only affects those armed guards who have no real protection from the federal government."
73,52,"It is a very valid and enforceable part of the legislation in the state of California, and the statewide mask mandate would be the most important piece of legislation ever."
73,54,The state is bringing a new policy. I am not going to be the first person to say that.
73,56,"I think that this was just an ad with a lot of references to the president and the governor, so maybe a little too much of a bit of a prick if you want a better way to read it."
73,65,"""Wood - what did I do wrong, sir?"""
79,73,They need to bring in people in order to get the drive up test. In the UK we've got a public health system with this very same thing.
82,73,I am surprised that they haven't changed it in over a decade. They've been wearing masks in a couple of weeks. I'm so glad that the gov't has stepped up to help stop the spread of a virus. Wearing a mask is part of the measures deployed by the government to aid in stopping the spread of a virus. Wearing a mask is part of the measures deployed by the government to aid in stopping the spread of a virus.
101,73,"Wearing masks does not help in stopping the virus, it's useless and I hate it."
73,6,"I really hope he gets a job. It's nice to know that he's a real dad, and I just can't imagine that doing this right now would be as nice as someone wanting to be."
73,7,This is a great one. They must be really proud that you've never done this. It was such a big mistake to write your own story about it in the first place.
73,11,The government isn't going to change anything about the health care system or the state. This is a big issue.
73,13,"This is probably why it's so easy to say ""it doesn't matter what I do for the public health. I can do it for people in the world and I will not take anyone else in the world to do it."""
73,14,"The people of California do not want to take them. The people of Texas don't want to take them, they want to take care of the child that snuck into the world."
73,16,"""Wearing a mask does not help in stopping the spread of a virus, it's useless and I hate it."""
73,27,"I was in my 30s when I was young, and my parents were all dressed like that. :)"
73,29,"""They say that they want to see him without his mask. I know what you mean, but you're a pedophile and he would not have done it if he did that. """
73,31,They want to take him to a medical center. A federal mask mandate shouldn't have to do it.
73,33,A federal mask mandate should protect your rights and make you a person in the world.
73,34,"A federal mask mandate should protect your rights and make you a person in the world. So I'm gonna ask you, what does that mean to you?"
73,37,"No, I think it's a very valid and enforceable part of the legislation in the state of California. It's a very valid and enforceable part of the legislation in the state of California."
73,38,"This is a real problem. You know, in Texas. This is the only problem."
73,40,"I'm not going to change my life... I love the guy, but I don't have to. The way he talks about the federal government is just so bad, and I don't want to be the one who is the one who takes advantage of us."
73,42,[He had a statewide mask mandate.](http://www.nba.org/wp/wp/health/sah-govt-mask-mandate).
73,47,It's a really stupid issue. The state of Texas is trying to stop the spread of a virus.
73,50,I'm gonna go ahead and say that they are getting a mask mandate.
73,52,... the State is bringing a new policy. The state is bringing a new policy.
73,54,">They say that they want to see him without his mask. I know what you mean, but I'm a pedophile. They say that they want to see him without his mask."
73,56,A federal mask mandate would be a good idea.
73,65,a federal mask mandate is a misstep.
79,73,It's very easy to get caught with HIV.
82,73,">Hey, I'm trying to find a way to help people in my community with the first one and the second one, I'm going to ask you what the big issue is in the first place. They're saying that it would make a difference to get people to wear a mask for a month or two before you were able to do anything about it."
101,73,"Wearing masks does not help in stopping the virus, it's useless and I hate it."
73,6,"OP, you are correct that the law in Texas is against making your child a protected child."
73,7,"You're a kid, right?"
73,11,"That's what the big issue is. You like the guy, but you don't want to change your life. You don't want to change your life."
73,13,"In California, the government is responsible for the spread of HIV. He had a statewide mask mandate. The state is bringing a new policy. It's a really stupid issue."
73,14,"I was born in the US but we were in Texas and it was still very scary to me at the time. We had to have a statewide mask mandate, but we would be able to have him go to the hospital and then we could go and do some shit there."
73,16,It's very easy to get caught with HIV.
73,27,This is why I am here. I just need to take a break from it and fuck myself.
73,29,"It's not that he doesn't need a mask, it's that they are not allowing him to wear a mask - he's only getting the health care and other services he needs in the city. So he might as well take a federal mask and let them do it for him? Or maybe he's having more problems at the hospital now that they do it?"
73,31,He was a pedophile and would not have done it if he did that. I am still a little upset about that.
73,33,What does this say about his state? The federal mask mandate doesn't actually protect the rights of people who are caught with HIV.
73,34,"I can't help myself but hate it. I'm a very sensitive person, and I'm not a big fan of the government. But I don't care how they talk about the virus, I care about the health and safety of my own health. It's really not what they should be doing."
73,37,"The guy was clearly very misled and misled by the people, as you have shown. But I understand that the statewide mask mandate doesn't apply here in Texas. They're making it so that the government cannot infringe on their pedophilia."
73,38,"In fact, there is a real problem. A statewide mask mandate. You can see a boy on a plane without a mask, and if you're not wearing a mask, you're not a pedophile."
73,40,I just read something about this on the wiki page and I know that it was a good idea to do so.
73,42,Why are you getting upvoted?
73,47,"In his defense, he is absolutely right and it's a misstep that he is trying to do in Texas."
73,50,">Hey, I'm trying to find a way to help people in my community with the first one and the second one, I'm going to ask you what the big issue is in the first place. They're saying that it would make a difference to get people to wear a mask for a month or two before you were able to do anything about it. Wearing masks does not help in stopping the spread of a virus, it's useless and I hate it."
73,52,"If it doesn't help, we're going to be more afraid of that guy."
73,54,The guy's mom is on my watch list for the last couple of years.
73,56,I don't even know how a guy can say that.
73,65,Well he was still a pedophile so you have to take him to a medical center.
79,73,"It's probably a little scary, but I do not think it's any better for the health of people if they do something like this to help prevent the spread of a virus."
82,73,"a man who was in the US army. The fecal vaccine is one of the most harmful diseases in the world. It's not just the viruses, but the whole fecal thing."
101,73,"Wearing masks does not help in stopping the virus, it's useless and I hate it."
73,6,"a mask is something the government doesn't have to enforce. A statewide mask mandate is a way to stop people from getting caught with HIV. The government is ignoring that the problem, and its a good idea."
73,7,"It's a huge mistake to make, but it's a huge step towards keeping HIV patients safe. The government doesn't want to let HIV patients be on the plane without a mask, so you're getting an extremely difficult time."
73,11,This guy is a man. He is a dangerous person. I don't understand how he is claiming to have a statewide mask mandate.
73,13,There's a lot going on.
73,14,"If he wasn't a pedophile, then yes, a federal mask mandate would not actually protect against HIV. The statewide mask mandate does not apply to Texans in the US."
73,16,The problem in Texas is that there's no way to fuck out a federal mask mandate. A federal mask mandate does not prevent the spread of a virus.
73,27,"In the US, the government does not have a mandate that addresses the spread of HIV."
73,29,"he's not a pedophile. he was not a pedophile, he was a drug addict."
73,31,"Yeah, the guy was a pedophile and would not have done it if he did that. He was a pedophile and wouldn't have done it if he did that."
73,33,"> [I'm a very sensitive person, and I'm not a big fan of the government."
73,34,"> The guy was clearly very misled and misled by the people, as you have shown."
73,37,"He is saying that ""It's not about the pedophilia, it's about the fact that there is a problem in Texas with a mask. But I think it should be better."""
73,38,"""I can't understand why it's a real problem. You know, in Texas. This is the only problem."""
73,40,If the statewide mask mandate doesn't apply here in Texas it means the federal government isn't allowed to use that to stop the spread of a virus and this isn't an illegal option.
73,42,"Is that the same guy that was on a plane without a mask for at least a month after he got caught? It would be something that I can see the guy with and not just the pedophilia, I can see a man without a mask."
73,47,"I don't see how you could be trying to help a guy's mother. I can understand why she's in a lot of pain but is still a pedophile, so I'm sure she doesn't want to get a mask on her body. She's very fucking selfish."
73,50,The fact that the people in his city are on his watch list and that is why they need to abide by the law is beyond me.
73,52,"The ""Made in Texas"" policy."
73,54,This is the wrong place. The government is trying to prevent the spread of HIV in the US.
73,56,You're just being a dick. We're not here to tell the truth.
73,65,Is wearing a mask in this post a problem of 'government incompetence' in Texas? I think I'll give a couple of examples.
79,73,"I don't think I've ever understood why people can't put a mask on, especially in Texas. If they are on a daily basis and I'm not sick, I think a mask isn't a good idea."
82,73,"The mask isn't a health issue, the fecal vaccine is."
101,73,"Wearing masks does not help in stopping the virus, it's useless and I hate it."
73,6,It's not even an illegal option here. This is not the pedophile thing.
73,7,"I read this as ""I think the federal government should go suck at it."" (This is probably the best explanation for why he doesn't want to get a mask."
73,11,Is wearing a mask part of the measures deployed by the government to aid in stopping the spread of a virus? Is wearing a mask in this post a problem of 'government incompetence' in Texas?
73,13,It doesn't seem like he's trying to go through this to get his slap on the wrist. He's trying to get a federal mask that's not going to do much.
73,14,And he's not saying he wants to stop this?
73,16,This is not my favorite post in the thread. This is the top comment.
73,27,This guy is on a plane without a mask?
73,29,"""Is wearing a mask in this post a problem of 'government incompetence' in Texas?"
73,31,"Having a mask isn't a good idea, just a part of the government redistributing aid in the face of an HIV outbreak. Regardless, that's not a good idea."
73,33,"You are an idiot. Why wouldn't a man with HIV get a mask and not be sick and don't put a mask on? What do you want to do for a living? If I were the person that did that, I'd say I'd be fine with that."
73,34,"It's a problem that was not supposed to arise. There's a law that requires it to have a federal mask mandate, which will not be used to protect against HIV."
73,37,[Federal statewide mask mandates](http://www.texas.gov/stp/) [His name is Michael and I am a member of the government](http://www.txgov.gov/hltfb/tx-govt.tx/index.aspx)
73,38,"If he got infected in a private school where he's not even supposed to be in, then it's not about the mask. He's a pedophile."
73,40,"Wearing a mask is part of the measures deployed by the government to aid in stopping the spread of a virus. If he wasn't a pedophile, then yes, a federal mask mandate would not actually protect against HIV."
73,42,"""We're trying to stop the spread of a virus, i hate it."
73,47,"Wearing a mask is part of the measures deployed by the government to aid in stopping the spread of a virus.If he wasn't a pedophile, then yes, a federal mask mandate would not actually protect against HIV. The statewide mask mandate does not apply to Texans in the US."
73,50,"People who aren't aware that a mask doesn't help spread HIV can only be a problem in a community without the protection of the federal government. They are being lied to, as the government says in this case. The issue is more with the federal government than its own citizens."
73,52,A state that makes a new mandate is not as important as Texas's.
73,54,"> The ""Made in Texas"" policy."
73,56,"The fact that the people in his city are on his watch list and that is why they need to abide by the law is beyond me. The ""Made in Texas"" policy."
73,65,Is he even on the pedophile watch list?
79,73,You might be missing a tl;dr on a subject you are not familiar with.
82,73,"If this man was an anti-virus vaccine advocate, he would want to be a doctor and not a politician."
101,73,"Wearing masks does not help in stopping the virus, it's useless and I hate it."
73,6,"I'm sure that the guy in this thread can see this, and agree with everyone else. I would also go to an abortion shelter and ask for their help in finding out if anyone is trying to work in Texas."
73,7,It's just a federal mandate. They have no right to put HIV patients on planes without a mask. They just want to keep the health of their fellow citizens safe. This is a problem that has not been addressed in the public eye.
73,11,"It is important to note that I did not see that one of the federal mandates that he put on was in place. I know you do not read it, but I have to say this is pretty much the point of this subreddit."
73,13,Considering it's only a matter of time before the federal government changes his policy.
73,14,"statewide mask mandate, which would not be used to protect against HIV."
73,16,"I mean the federal government is not fucking with it. I'm not going to be a doctor, I'm going to get in trouble."
73,27,"[In the US, the government does not have a mandate that addresses the spread of HIV.'"
73,29,This guy is on a plane without a mask. He needs to have the federal mask he needs to wear.
73,31,"I don't like the fact that he's on a mask, but I just can't abide by it. The government doesn't get to decide if a person should wear it or not."
73,33,This is the only way to get to the bottom of the story.
73,34,This ad is coming from a Texan. It seems like the whole Texan thing is so big that it needs to be explained.
73,37,I'm a member of the national guard.
73,38,Unless you're from a state that has an irrational hatred of racial and religious feminism. This is the only solution available in the US.
73,40,"> The ""Made in Texas"" policy. The fact that the people in his city are on his watch list and that is why they need to abide by the law is beyond me."
73,42,The man is a pedophile. He's a pedophile. You're gonna have a bad time. This is a problem not an issue with the government.
73,47,"This guy is on a plane without a mask? ""Is wearing a mask in this post a problem of 'government incompetence' in Texas?"
73,50,The 'Made in Texas' policy. The fact that the people in his city are on his watch list and that is why they need to abide by the law is beyond me.
