sender,receiver,message
73,54,I have no problem with any of that.
73,56,The CDC doesn't care about you because it's a problem. The CDC's mandate does. It's basically how the public perceives its actions.
73,65,"It is not a problem, and there's no other alternative that it isn't a problem. You can still use a mask or a mask and still get treatment."
79,73,"I'm not sure if it is a joke or not, but I do think it is a joke. There are some areas where a mask isn't needed."
82,73,"'As a doctor, I can say that he is a doctor, not a politician. But I'm saying that they need to go and look at this more, or else they will become more violent.''"
101,73,"Wearing masks does not help in stopping the virus, it's useless and I hate it."
73,6,"I feel like a lot of people are trying to talk about this to me. 'The CDC is ignoring the problem. ''I think that if people like the President do this, they'll be afraid to try and fuck them over.""''"
73,7,CANNOTANSWER:
73,11,No one will come back to this. This guy is a complete and utter asshole.
73,13,"As far as I know a lot of these people are not from the US. They are claiming to be from the US, not the US."
73,14,"I'm in the US, and I want to work in Texas."
73,16,"... and the CDC is trying to get a deal in the state, not the state."
73,27,"CANNOTANSWER: ""[I like the part when he got covid but still had events with people and how he wont enforce a statewide mask mandate oh and the part where he cut education funding wow so great. ''I am going to take a break from it and fuck myself."""
73,29,"""I like the part when he got covid but still had events with people and how he won't enforce a statewide mask mandate oh and the part where he cut education funding wow so great."""
73,31,I think he is pointing out a really good point:
73,33,I just can't figure out if this is a joke. I don't care. I just don't see the problem.
73,34,"This isn't illegal, I think you guys are being silly."
73,37,"The problem is that if people use the federal mask law in Texas and it isn't enforceable, it should only be enforceable by the state. If he is not doing the required mask mandate in California, it's a problem."
73,38,"i think they should have just fucked up the law of denial - in his situation you know, he got the masks"
73,40,The AMA isn't a joke.
73,42,"In my state, a mask mandate doesn't affect the population. A woman can wear one and be safe. A woman can not wear a mask because she is sick."
73,47,"So, the first thing the US government is trying to do is impose a mask on the state."
73,50,I think the NSA is doing a better job of protecting the public than they do with the federal government.
73,52,"CANNOTANSWER: ''If a mask isn't a serious problem because it is dangerous to use it. It doesn't really matter that it is an infection that you cannot get. It's just part of the problem that you're being 'funny' and remorseful about that, because you're going to be dead by then."
73,54,"I'm a doctor. And if you have a fucking fever, I will ask you to leave your home, not a public bathroom, not a bathroom, not even a public one."
73,56,The CDC is doing nothing with the AIDS/HIV ACA.
73,65,CANNOTANSWER:
79,73,"CANNOTANSWER : The ""tl;dr"" on the topic is ""The moral dilemma between the government and your ex. The moral dilemma is that you can't really be a friend. You are being selfish and stupid. """
82,73,"I think you're getting a little naive. It's a joke, and I think it's silly."
101,73,"Wearing masks does not help in stopping the virus, it's useless and I hate it."
73,6,'I haven't heard of an AMA containing anything that he was trying to do with the CDC but that is completely untrue.
73,7,"CANNOTANSWER: The only real problem with the government is that they are trying to ""make it work""."
73,11,I'm going to leave Texas. I want to get off the bus.
73,13,"This is just a joke. He is a hypocrite. He is trying to get a deal in the state, not the government."
73,14,This is the only thing that was supposed to change.
73,16,"In Texas, the mask mandate is illegal and the CDC wants to enact it for Texas. This means you need to get a mask to help stop the spread of HIV."
73,27,"He's a fool. It's one of those jokes that has been retold in r/police, and is only a joke when it is written in his name. It sounds like he's retold it in the title to someone else, but he's lying to himself. It's not a joke."
73,29,This is a huge issue for many people and isn't even a big issue for the rest of the world.
73,31,I am so sorry this happened. Is this the first time that a story is mentioned to you?
73,33,He's not a racist. He's a sexist. He doesn't like politics. It doesn't make any sense in your defense.
73,34,"""I can't understand how it was supposed to be an ad on the web in my state. I can't understand how this guy is a pedophile. He was clearly very misled and misled by the people, as you have shown.... I don't care how they talk about the virus, I care about the health and safety of my own health. It's really not what they should be doing."""
73,37,"He is making a joke about a mask law that the federal government is trying to impose on the state, but he is not doing it because he is being a bit of a dick."
73,38,"He sounded a little bit like a scumbag. Then again, he did what the AMA says and it's a good idea. The AMA isn't a joke, the AMA isn't a joke. I think you guys are being silly. The problem is that if people use the federal mask law in Texas and it isn't enforceable, it should only be enforceable by the state. If he isn't doing the required mask mandate in California, it's a problem."
73,40,I don't see the problem with the AMA. I think the Obama administration is just trying to make a joke.
73,42,The government doesn't even get a mask mandate. The NSA is still putting it in place so that it's legally enforceable and it's a problem. The government is essentially trying to take away the right to make a mask. This is illegal because it will make the CDC's job harder to accomplish.
73,47,What was the name of the post?
73,50,The NSA is doing a better job of protecting the public than they do with the federal government.
73,52,"I don't think that's a joke. I'm sure the CDC is going to give him a lot of support, but that's a bad situation."
73,54,"A little bit jarring, but I'll leave it with:"
73,56,"There is some truth in it, but it isn't really about how it works, it's more about how the government is protecting the public."
73,65,What the AMA is about is this:
79,73,The tl;dr on the topic is:
82,73,The people who are getting mad at the NSA are the very reason why the people making jokes are being mad at the AMA.
101,73,"Wearing masks does not help in stopping the virus, it's useless and I hate it."
73,6,It's an AMA about the CDC trying to stop people getting caught with HIV.
73,7,"There's nothing I can do about this. I just want to tell you that I just don't get why the president referred to it as a joke, and I don't even know how to understand what it's really like for him to say he's a pedophile. If he wants to stop the spread of a virus, then the only thing he wants to do is cut his budget and send him to a college that offers him the opportunity to stay in prison."
73,11,This is a huge issue in the US because of the fact that the US has been used for more than 20 years. It sounds like the only problem people have with the government is the scarcity of good government.
73,13,Isn't this the same kind of situation he's having?
73,14,""" ""Wearing a mask is part of the measures deployed by the government to aid in stopping the spread of a virus. This is the only thing that was supposed to change."""
73,16,"> ''Wearing a mask does not help in stopping the spread of a virus. It's useless and I hate it."""
73,27,So you're getting down voted for saying something that is a joke about a government mandate that address the spread of HIV?
73,29,"'I think the most effective solution for this is just to have a federal mask."""
73,31,"I'd have a very hard time understanding what his story was about, even though it was mostly a joke."
73,33,>He's not a racist.
73,34,"> The problem is that if people use the federal mask law in Texas and it isn't enforceable, it should only be enforceable by the state. If he isn't doing the required mask mandate in California, it's a problem."
73,37,>I’m not a member of the national guard. I’m the govt.
73,38,"He is being misleading about his rights if he is taking a picture and trying to extort money, but he isn't telling the story."
73,40,I have no idea why this happened but I think he's the one being skewed. There's a lot of information that is being misrepresented and unfounded.
73,42,"I like this. I don't care how they talk about the CDC, I care about how it protects them. The AMA is about the government's working to stop the spread of HIV."
73,47,i think it's an issue in general
73,50,"The NSA is using the ad to prevent a virus from spreading to more than 15 million people in Texas, which has been going on for about a decade."
73,52,"The issue isn't the state, it's the federal government. There are other issues, such as health care, which CDC does not support."
73,54,The AMA is based off the Obama administration's crappy response to a frank and utterly illiterate comment. The government is doing their job but does not really exist to stop the spread of HIV.
73,56,"The CDC is trying to help them, but they are causing problems. So if the AMA isn't funny, it needs to go away."
73,65,CANNOTANSWER:
79,73,...and the other person is lying about this nonsense?
82,73,Yes. It sounds like someone on the NSA blew his mind.
101,73,"Wearing masks does not help in stopping the virus, it's useless and I hate it."
73,6,I feel like this guy is being downvoted for saying something that is a joke about a government mandate that addresses the spread of a virus. The AMA is about the government's working to stop the spread of a virus.
73,7,Is the issue of this being a federal mandate? It doesn't matter what you're calling it.
73,11,I read all of the comments.
73,13,A large chunk of the ad is just trying to get his message across.
73,14,They are not being skewed because they are being skewed because they do not know what to do to stop the spread of the virus.
73,16,The ad is being downvoted for that.
73,27,"This guy is not the kind of person who has the courage to say, ""I want to take a break from it and fuck myself""."
73,29,"In the end, this is not a good idea."
73,31,They can't take it down as a joke. That's just a joke. That's not a joke.
73,33,That's the AMA that you're referring to.
73,34,What’s the problem with the ad? That the CDC doesn’t actually have to use that? Why isn’t it illegal for them to just do a mask?
73,37,CANNOTANSWER:
73,38,I've read the whole article. I'm sorry. I am also sorry to say that the person on the NSA who wrote the article is the one lying about a mask issue.
73,40,I don't get why everyone is down voting for a joke. This guy is the most important comment I've ever read about the health care industry.
73,42,"""We're trying to stop the spread of a virus."
73,47,The Obama administration was actually being rather blunt.
73,50,"I like your story, but I think you cheated. This is just one example of why it's so frustrating to not think of a job that protects all citizens at the same time."
73,52,"I am so glad I can get this message. I have been working on making a mask and it seems that we all have different perspectives about issues, and I am very happy with the outcome. My friend just wants us to be able to have a face to face conversation about what a mask is, what a policy it is, and how it affects us."
73,54,"The whole thing is pretty depressing to think of, and that's a pretty solid argument. But yeah, that's a good one."
73,56,shit is not funny. you need to stop responding. i can't think of any other way to respond.
73,65,> I'm not a member of the national guard. I'm the govt.
79,73,"This is pretty fucked up. In the US, all people have to wear their masks to get HIV."
82,73,I think this is a great point.
101,73,"Wearing masks does not help in stopping the virus, it's useless and I hate it."
73,6,I don't think he was trying to say anything about the CDC or what he is talking about. The NSA's involvement in this is a little too obvious.
73,7,"""... Because there isn't an effective one."""
73,11,You're an asshole.
73,13,"I don't get how he can get a mask. He's trying to force a political statement, the question is how does he figure out that this is a joke?"
73,14,"A national guard member and he just said, ""I think it's a great idea. They can't take it down as a joke. They can't take it down as a joke. It's not funny. I can't think of any other way to respond."
73,16,I like the idea of what isn't a mask in the US. I'm not a member of the National Guard.
73,27,">I'm a member of the national guard. I'm the govt. This is pretty fucked up. In the US, all people have to wear their masks to get HIV."
73,29,"You might want to try to be more specific and say ""I'm not sure what this is. This guy is the most important point I've ever read about the health care industry."
73,31,"""I have an issue with the mask, but I just can't abide by it. The government doesn't get to decide if a person should wear it or not."""
73,33,"I've worked on this, and it sounds like a good idea to me. You’re making a good point, and it’s not the only thing I can think of to talk about it. This is one of those things where a guy in Texas can be the only one who hasn’t tried that."
73,34,You can get the government to revert to a more fair and more acceptable treatment of HIV-related diseases.
73,37,I have no idea what he means - he's a pedophile.
73,38,I'm sorry but the NSA isn't being true to the entire point of his AMA.
73,40,"IANAL, but I believe the AMA is about his policy in Mexico and he's lying about it. If it were a joke I don't think the AMA would be a joke about how the government is trying to stop the spread of the virus. It's really a joke about a government policy."
73,42,What happened to someone who was on a plane without a mask for a month after he got caught?
73,47,"As I'm a member of the National Guard, I'm not sure why they thought it was a good idea to make a mask."
73,50,"It's not a joke. It's the government's job to provide a safe, healthy environment for the people. It's a joke."
73,52,A mask is required by law to stop the spread of HIV
73,54,CANNOTANSWER: I've read the whole article. I'm sorry. I am also sorry to say that the person on the NSA who wrote the article is the one lying about a mask issue.
73,56,"Considering the situation in the States, I don't think a government could be a problem."
73,65,I’m not going to pretend to be a medical professional but I do need a doctor who’s a doctor and I don’t have any medical credentials.
79,73,People who don't know about HIV in their own country will get sick. They just don't understand what that means. They're scared of what they might get wrong. They'll get their life in order. And that's about it.
82,73,"""...If a man is an anti-virus vaccine advocate, he would want to be a doctor and not a politician.'"""
101,73,"Wearing masks does not help in stopping the virus, it's useless and I hate it."
73,6,"It sounds like the president is taking a really good one. That's a big issue, and one that the government should look into, as well."
73,7,"CANNOTANSWER: ""I have read the entire article. I'm sorry but the NSA isn't being true to the entire point of his AMA. IANAL, but I believe the article is about his policy in Mexico and he's lying about it."
73,11,People have been wearing masks to get HIV for the past 15 years. It is not the way that is really an option.
73,13,"No, he just wants to keep his sanity up for debate."
73,14,It's not just about fecal viruses but about their spread.
73,16,"This is pretty fucked up. In the US, all people have to wear their masks to get HIV."
73,27,"I don't know what you're saying, but it's worth noting that it's a joke about a mandate that addresses the spread of HIV, not that the ACA mandate would make the CDC aware that you're going to be putting money into the ACA."
73,29,"No one knows what he's talking about. He's making a big deal out of a joke and trying to avoid it. This is the most common misconception in the healthcare industry and what it's trying to make it sound like he's lying. It's pretty hard for me to think of anyone who is going to say this, but it sounds like there's a pretty serious possibility of that happening."
73,31,A lot of people are so upset about the article that they don't read it. They've already said they're ok with it.
73,33,I can’t believe the government does anything about this. It’s the US Government.
73,34,I'm not a big fan of the government but I don't think it is something that should be illegal.
73,37,You can't make a joke about what he's saying.
73,38,Those things can go on for years. It takes people to realize that they're a pedophile. This isn't the first time this has happened.
73,40,"As a Texan myself, I can say I do understand what this guy is trying to say. This is pretty fucked up. In the US, all people have to wear their masks to get HIV."
73,42,"""I figured I was going to fucking tell the NSA not to put out a bad thing, that he's a pedophile"""
73,47,What is your favorite kind of sarcastic dick?
73,50,That is a lot of stuff. Generally speaking the NSA has to make it difficult for their employees to wear a mask in order to protect their constituents.
73,52,"CANNOTANSWER: ''If a mask isn't a serious problem because it is dangerous to use it. It doesn't really matter that it is an infection that you cannot get. It's just part of the problem that you're being 'funny' and remorseful about that, because you're going to be dead by then.""'"
73,54,"I hate that you're being down voted. 'No joke' or 'You are not a doctor, don't you?' It is not a joke. It is a joke. It is a joke. The government is trying to prevent the spread of HIV, but does not really exist to prevent the spread of the virus."
73,56,"It's a joke about how government is treating people, not about the CDC."
73,65,The CDC can't take them down as a joke and is being abused.
79,73,"No, I'm not the man or the woman, but it's more of a joke than a joke."
82,73,AMAs are about the government and the world's population. What kind of jokes are they talking about?
101,73,"Wearing masks does not help in stopping the virus, it's useless and I hate it."
73,6,"The NSA is the only agency that is not using a mask. I don't know of any other agencies that do this, but I don't know what they are talking about in that thread."
73,7,"""We must be really proud that you've never done this. It was such a big mistake to write your own story about it in the first place."", ""You're a kid, right?"", ""I mean, I don't know that the CDC has the legal right to put people on planes without a mask."", ""I just don't get why the president referred to it as a joke"""
73,11,"""I think we should take the right action and just be a good example of a good example of a good example of how government is being too harsh."
73,13,I'm a little curious. Can you identify the issue he's trying to gain?
73,14,"Yes, I think wearing a mask is a problem of government incompetence."
73,16,"I'm not even a doctor, I just want to get rid of some of the stupidity in the sarcasm."
73,27,"I think I just got some jizz, and it was my first time posting this."
73,29,I don't think there's a lot of information in this sub claiming that it's a joke that the government should be removing the fact that this man has HIV.
73,31,"I'm from California. I have no idea what the meaning of a mask is, but I'm also pretty familiar with the meaning of what a mask is. I guess that's more that I'm aware of that, but what I'm really interested in is whether it's just a joke or a joke."
73,33,[It's not a joke. It is a joke.](http://en.epa.gov/news/en-us-female-female-female-female-female-female-female-female-female-female-female-female-female-female-female-female-female-female-female-female-female-female-female-f
73,34,"It is a joke about how government, not only are treating people, but also how people think it is wrong to tell the truth by telling people the truth. There are so many problems with that."
73,37,It's not an unpopular opinion to talk about it. It's a joke.
73,38,I'm not a doctor and I'm not sure what my favorite sarcastic comment is. You haven't even been to a CDC clinic in Texas and you aren't in the US.
73,40,AMAs are very interesting.
73,42,"It seems like this is a fairly common thing that happens in a lot of the media to me. Like the fact that a lot of things are in the media aren't in a news coverage format (not in the mainstream) and it's too often called a ""couldn't be done"" comment. But to me it's all about the people who aren't interested in being told what they're talking about, which is something that I wouldn't think is so important."
73,47,Typically speaking the NSA has to make it difficult for their employees to wear a mask in order to protect their constituents.
73,50,"CANNOTANSWER: ''If a mask isn't a serious problem because it is dangerous to use it. It doesn't really matter that it is an infection that you cannot get. It's just part of the problem that you're being 'funny' and remorseful about that, because you're going to be dead by then.""''"
73,52,"You are gonna get a sicker pedophile by putting a mask on for your own personal sake, mate, but if the CDC does get rid of the mandate, then the CDC will have to make a huge investment in an NSA mandate."
73,54,"I've been through a lot of AMAs. I think these things come from a variety of sources. From the CDC, the EPA, and I think that's part of the problem."
73,56,The ad is absurd. It makes the CDC appear to be lying.
73,65,I was talking to a neo apocalyptic person.
79,73,"The whole issue is what a joke is. I think it's a joke, but it's not a joke."
82,73,I think they are making an excuse to put it out there but you're right it isn't necessary.
101,73,"Wearing masks does not help in stopping the virus, it's useless and I hate it."
73,6,You can't be the one to say it. It's a jumble.
73,7,I think the AMA is too long.
73,11,"I'm not really a doctor, but I know that this is a very serious and serious issue. This is what I want to be an issue. I think it's a joke. It's a joke about people who don't understand the issue."
73,13,"What a fucking slap on the wrist, I'm a politician in this subreddit."
73,14,There are a lot of other factors in the article that are pointing to a mask as a health care tool.
73,16,a prank about the federal government.
73,27,I think we have the answer to each question. Having to tell someone something is a lot more important than just a joke.
73,29,CANNOTANSWER:
73,31,I don't think there's enough truth in this post to go along with the other suggestions.
73,33,What I am really interested in is whether it is a joke or a joke.
73,34,The fact that it's a joke seems to be a good sign that the government is doing something wrong.
73,37,There are very few examples. The US has been accused of being an American institution for a long time. A joke is simply a joke. People will be scared. The problem is with the NSA. I've been there.
73,38,What is this? That it's not a joke?
73,40,"I don't think a mask is going to stop HIV, but I do feel it's a good idea."
73,42,"''I like this. I don't care how they talk about the CDC, I care about how it protects them.'''"
73,47,It’s not a joke. It’s a joke.
73,50,"I think it's a joke that the NSA's job is to provide a safe, healthy environment for the people."
73,52,">I'm gonna get a sicker pedophile by putting a mask on for my own personal sake, mate, but if the CDC does get rid of the mandate, then the CDC will have to make a huge investment in an NSA mandate."
73,54,I am a liar.
73,56,"Yes, I think wearing a mask is a problem of government incompetence. I think I'm going to have to put this out there because I'm not gonna be able to read it."
73,65,[Cannot tell you what I think of the article](http://en.epa.gov/news/en-us-female-female-female-female-female-female-female-female-female-female-female-female-female-female-female-female-female-female-female-female-female-female-female-female-
79,73,We should stop playing the joke as an excuse. We should stop faking it like this.
82,73,"I think it's a joke. But I know I'm not a doctor, and I like it. I also enjoy being a doctor, and I don't like people making jokes about me."
101,73,"Wearing masks does not help in stopping the virus, it's useless and I hate it."
73,6,I was a doctor and the government is the one that is not ignoring the problem.
73,7,"""... The government needs to do more for AIDS prevention."""
73,11,It sounds like the government has a long history of being a racist.
73,13,A joke is just a joke. A joke is a joke. A joke is a joke. A joke is a joke.
73,14,So it's not just that he is being a liar and is complaining to himself about the NSA?
73,16,So why do you think this is a joke? The people that haven't seen it in a while will probably still think they are being fucked.
73,27,I'm really interested in whether it is a joke or a joke. The fact that it's a joke seems to be a good sign that the government is doing something wrong.
73,29,The article says that the NSA has a significant amount of funds to take on a federal mask and he will likely be forced to wear the federal mask to protect against HIV/AIDS.
73,31,What a joke. The only problem I have with the government is that people will become more violent if they don't wear them.
73,33,"It is an ad for a public health service, and a joke. And the NSA is not able to make it illegal. You could take a shot, but you wouldn't have a right to do it, right?"
