sender,receiver,message
19,14,"In addition to what the AMA focuses on, people are asking questions about AIDS or vaccines that are different and not very relevant to our day to day lives. You seem to be answering a lot of those questions."
23,14,"Yes, the AMA is a joke."
27,14,"The whole thing is about what a public health official thinks. It's not about what a public health official thinks, it's about what a government agency does."
39,14,"AMA is not a joke, it is a joke about the government."
47,14,"No, they're not a joke. They're not a joke. They're just a joke."
48,14,People who don't get vaccinated aren't a joke.
53,14,"I’ve heard that there’s a number of things that the CDC is not willing to do, such as having an AMA about the CDC."
61,14,">The whole ""I don't think people really do any of these kinds of jokes because I'm not a doctor"
63,14,"Is there a movie about people with HIV that you are interested in? Because it is a great movie, but the message isn't very funny. Rather, it's a joke because the movie isn't about AIDS."
68,14,"""I'm not sure if I understand you but the idea of a AMA about a government invading people is a crappy joke. The idea of AMAs has become popular in a number of other countries.'"""
73,14,"Yes, that's a big deal."
74,14,I love the 'why' joke.
83,14,[https://www.fwdr.fl.gov/css/fwdr/](https://www.fwdr.fl.gov/css/fwdr/)[https://www.fwdr.fl.gov/css/fwdr/](https://www.fwdr.fl.gov/css/fwdr) (https://www.fwdr/fwdr/fwdr/index/
14,1,"The way the AMA and the AMA are going to be used are ambiguous, and you can't help but feel compelled to look at the context. Having said that, I think the AMA focuses on one thing and the second thing is about the second thing:"
14,8,I a snoob and I do this. I can't really make a joke.
14,11,"No, I think the AMA is a joke. It's not a joke. And the people who AMA about it aren't doing it to be a joke."
14,13,The AMA is a joke.
16,14,That book was a joke. It was a joke.
18,14,AMAs are about how the government is trying to achieve a certain goal.
19,14,I think you haven't heard about the AMA in a while. It's a shit joke. It's really a joke. It's a fact.
23,14,"They also want the people to be able to do whatever they want to do. And to be fair, in my opinion it's an extremely serious and very true issue."
27,14,People like to look at their bodies as objects of protection.
39,14,That's the thing. But it doesn't make sense.
47,14,The AMA isn't a joke. It is a joke about how the government is taking advantage of people and how the government is taking advantage of them.
48,14,"There is a joke. It's a joke about health care. I don't know how to do the whole thing. I don't know how to make it funny. It's a joke about the government. AMAs are for people who don't get vaccinated and want to get them to take up their own health care. This is not a joke. It isn't a joke, but it's a joke because it's a joke. It's not a joke in a lot of different context."
53,14,A lot of people are going to make fun of a mask because it's not funny and not funny.
61,14,"Vaccines are illegal, but they are not legal."
63,14,"The movie, the way it's done, is just over the top of my head."
68,14,"AMAs are really about preventing the spread of a viral infection, and the government needs to have some sort of policy to combat it."
73,14,"It's not a joke, it's a joke. The NSA has an agenda that's basically the same as the CDC and they are trying to kill the virus by using it as a preventative measure."
74,14,Vaccination is the medical miracle cure for HIV.
83,14,"If it's not legal, don't."
14,1,>Wearing a mask during a pandemic is very effective. People say that it's racist. But it's not. People say that it’s racist. But it’s not. People say that it’s racist. People say that it’s racist. People say that it’s racist. But it’s not. People say that it’s racist. People say that it’s a joke. People say that it’s a joke. People say that it’s racist. People say that it’s a joke.
14,8,"I am not a doctor, but this is how I go about the whole situation."
14,11,"I think the AMA is more about how the government is trying to stop the spread of HIV, than anything else."
14,13,"So you are saying that people who don't know what a ""joke"" is about are taking advantage of the public health system?"
16,14,It was actually a joke about the CDC.
18,14,"CANNOTANSWER, MD argues that the government is able to give people and their families a fair chance to get HIV, regardless of how they are treated."
19,14,"Yes, a joke, a fact, a joke."
23,14,"If you want to start a conversation about the issue, there's no other way to do so than to make sure you're not the first person to say it."
27,14,If I'm reading this I think I know where you're coming from.
39,14,"I feel a little bit uneasy that this is an AMA, where people don't think it's a joke, but the idea of someone who can't believe it, gets the whole AMA out of their mouth. This is about the government trying to prevent the spread of the virus."
47,14,"I see what you're saying, but it's more like the phrase ""I'm not talking about that, we're talking about the fact that there is a statewide mandate."
48,14,It's not a joke. It's a joke because it's not about the government. It's about the government trying to prevent the spread of the virus.
53,14,The joke isn't a joke. It's about the mask.
61,14,"What if you get a bad virus, your face is still the one with the infection. Your face and the neck is the one that is most vulnerable, and you know that it's likely because of your abrasions? Or because you've been in a lot of bad ones?"
63,14,It is funny. And it's not a joke.
68,14,"“I think it's a joke. It’s a joke, but the truth is that a lot of people don’t realize how small the number of sexist jokes is. People don’t wear a mask to stop the spread of a virus. It’s just a joke because people aren’t willing to understand it. People don’t wear a mask because they don’t have a way of saying it. i think they need to have some sort of policy to combat the spread of a virus."
73,14,"There's a great article on the NSA: 'It's not just about what you wear. Its about what you do, whether you wear a mask or not. Its about what you do, whether you wear a mask or not. Its not about what the CDC is doing but it is what they are trying to do."
74,14,"I have been vaccinated in the last two years and I have a little scar. It's really weird, but there are a lot of times that you just really think the problem is a lack of an irrational desire to stop it."
83,14,It's a joke. I think it's funny because it's not true. Isn't the CDC's stance on the masked system funny?
14,1,What I read was from a post about a joke. It doesn't sound that this is a joke.
14,8,AIDS vaccine is in the air a lot of times - but it's still a joke?
14,11,"So the article says the NSA is going to prevent spread of HIV/AIDS, but they're not going to let people get vaccinated. That's an argument they're proving, in the long run. The AMA isn't about whether the mask mandate is a joke or a joke. It's more about whether or not the government has a mandate to stop the spread of HIV/AIDS, and how people want to do something about it."
14,13,"""In the article, it says a ""joke"" is a joke, which means it's a joke, which means it's a joke, which means it's a joke. It is a joke, because people say that it's a joke, and that the joke itself is just not as funny."""
16,14,"This is an excellent post for a discussion of the concept of ""compassion""."
18,14,"The CDC has a policy of not providing vaccines. If you don't think you're safe, fuck the CDC. I'd be lying to the kids. And they're not ok with it, the kids aren't allowed to wear masks."
19,14,The AMA is the joke that the government isn't going to stop the spread of the virus.
23,14,Vaccines are not safe. It's not a joke.
27,14,Why do you think the joke is so sexist that it gets pushed out of the headline?
39,14,This is a joke. It's a joke. It's a joke. It's not a joke. It's a joke.
47,14,Are you sarcastic? That's very clever.
48,14,The AMA is not a joke. The AMA is a joke.
53,14,">If the government wants to prevent the spread of a virus, they are not really allowed to do it."
61,14,Vaccines are illegal.
63,14,"I'm sorry, but I think this is a joke - and it's not a joke because it's an AMA."
68,14,"I like the fact that you didn't even see the first paragraph. The AMA isn't a joke, it's a joke. I do, however, see how this is a 'judgement of a joke'. The AMA is an attempt to minimize some of the sexist jokes around it."
73,14,"CANNOTANSWER, MD: ""I like the part when he got covid but still had events with people and how he won't enforce a statewide mask mandate oh and the part where he cut education funding wow so great."""
74,14,Vaccine is a combination of medication and therapy to help prevent the spread of HIV.
83,14,I'm a doctor and I'm a medical assistant. I'm also a doctor.
14,1,""" I think wearing a mask during a pandemic is very effective. People say that it’s racist."
14,8,"There is a lot to be said for the entire AMA, as they've all been very helpful in bringing up what the article is trying to promote. It's been great. I'll be honest."
14,11,... that is not racist.
14,13,The joke is that the idea is that the AMA was meant to be a joke about the fact that the CDC isn't providing vaccines.
16,14,"CANNOTANSWER, MD:"
18,14,This joke is funny because the government is threatening to revoke the rights of individuals and children who would otherwise be harmed. It's a joke because it is about getting a vaccine. The CDC doesn't seem to care that everyone is being abused.
19,14,"CANNOTANSWER, MD, AMA"
23,14,People in this subreddit are starting to make fun of the government's vaccination program.
27,14,"If it makes any sense, it's not a joke. It's the CDC trying to put a smile on their faces."
39,14,[NAME]. [NAME] is an acronym for The Prevention of AIDS.
47,14,I'm really not saying this is wrong. The AMA is about a joke. It's about the government and the government and the government.
48,14,That's a funny one.
53,14,"'I'm sorry, but I don't want to talk about it, I don't know what 'cannotonaser' means. 'But I'm pretty sure the only problem I can see with the CDC is that they are putting the mask on so many people."
61,14,"The whole joke was sexist, and no one would have understood. I'm so sorry, but it was my reaction."
63,14,You know that people aren't stupid.
68,14,"The idea that a government is not going to protect people is a joke, and the AMA about it, is a joke."
73,14,"""What is the big issue in the first place? A statewide mask mandate would be a problem for him, he has to get help for some patients and some private hospitals in a state that doesn't cover the disease."
74,14,I think a lot of people in the medical community are just being silly.
83,14,[Single voice](http://www.fwdr.fl.gov/css/fwdr/)(https://www.fwdr.fl.gov/css/fwdr/index/)(https://www.fwdr.fl.gov/css/fwdr/index/)(https://www.fwdr.fl.gov/css/fwdr/)(https://www.fwdr/
14,1,"CANNOTANSWER, MD, is a medical assistant at a company whose employees wear masks during a fad AMA."
14,8,The article is about the government and the government..>(https://www.cdc.gov/resources/public-faculty/comments/2sc2ed3c5eds3e/)
14,11,"Yes. The AMA hasn't been a joke, and the AMA is just about the administration trying to make a joke about it."
14,13,I have never had a problem with a joke.
16,14,"CANNOTANSWER, MD:"
18,14,"""People like to play the joke. People like to make jokes about people."""
19,14,"He's just saying that it's not a joke that people aren't getting sick anymore. I can't find a legitimate reason for the government to not use a joke like this, especially on the fringes of the news."
23,14,"""... this joke is the joke"
27,14,I feel like in my post you're saying that I can't believe it's about the CDC and its oversight ad. Which has been written and has been written by the CDC and has been a huge part of the CDC's ad work as a way to be sure that if the government were to put a mask on people's heads they would've gotten better.
39,14,What's the point of a joke? Isn't it just a joke?
47,14,"""Weaking a mask does not help in stopping the spread of a virus, it’s useless and I hate it. I can tell you that it’s just as dangerous as being shot or burned to death. I’m running a half mile in Florida right now!"""
48,14,The AMA is a joke.
53,14,"I have never known how the AMAs in this subreddit can be so long. This sounds like an interesting time. It’s a nice AMA, and the people that are making fun of the CDC do the right thing, and there’s no way to be sure that they’re actually going to be allowed to do a bunch of stuff about the CDC. They’re the jokes, because they can’t be a joke."
61,14,"As a doctor myself, a bunch of people with a lot of medical conditions get HIV/AIDS. My mom and dad have been out for years, and my moms been doing the same thing. I didn't have any allergies so that's a lot. I'm not trying to be an agnostic, but I know that I am a guy with a little bit of an allergy."
63,14,The movie and the AMA seem to me to be about the CDC and the CDC as a joke.
68,14,"""I am a guy who had to get a little sick to get to work, that was an awful time for the joke."""
73,14,There's no way you could make your own healthcare policy. You just have to decide where you are going.
74,14,"I would be interested in seeing if he was actually referring to a vaccinated person on their medical team, and that he was a ""cannon"" and a ""doctor"""
83,14,"It's just that in the book "" ""I think"" is the joke, not the actual joke."
14,1,>Is wearing a mask during a pandemic is very effective. People say that it’s racist.
14,8,It's part of the measures deployed by the government to aid in stopping the spread of a virus.
14,11,"""It seems like the government is not trying to get something for it, but is more concerned with the safety of the vaccines and its use for being an innocent joke, like I've said before."""
14,13,I think the article is a joke and is going to stick around.
16,14,"You're the one that makes a point, that the CDC should be doing an actual public health operation to stop the spread of the HIV/AIDS."
18,14,AMAs are a joke.
19,14,“It’s just this one thing and it’s pretty ridiculous.
23,14,"I want you to know, the fact that a person will take a sarcastic joke of a joke means a lot to me."
27,14,"Vaccines are for life, but to prevent the spread of HIV isn't about protecting the body. They are about preventing the spread of HIV."
39,14,"""If it was to stop the spread of a virus, I would give a fuck."""
47,14,> Is it a joke about the government
48,14,It's a joke about the government and the government is trying to prevent a lot of people from getting vaccinated.
53,14,>I think that’s a joke. It’s a joke about the government and the world’s population.
61,14,You're assuming that's just the general consensus among the Americans who wear them.
63,14,They're not the ones in this discussion.
68,14,"So, the joke is that people wear a mask to protect themselves from HIV? Or that they don't want to get vaccinated?"
73,14,So it's a big issue for them and isn't what the government wants to do?
74,14,"A lot of people have been infected with AIDS, and they’ve had a cleft palate removed."
83,14,“The joke is funny because it’s funny. It’s funny because it’s a joke. I think it’s funny because it’s funny because it’s funny because it’s funny.
14,1,I'm gonna go ahead and explain. I'm not going to get hurt. I'm not going to get hurt. I just want to make fun of you.
14,8,"""(https://www.cdc.gov/resources/public-faculty/comments/2sc2ed3c5eds3e/) Wearing a mask during a pandemic is very effective. People say that it's racist."
14,11,"Is there a national one called ""The National Health Service?"""
14,13,"I would have said ""A mask, and not on my home. You can't just be invisible to the outside world. If you want to be able to go outside, you need a mask and a mask."" If you don't want to be there, you can't. A mask is a joke. It's not a joke."
16,14,"I think that the ""doctor"" was going to be more interested in the story. I didn't like it, and I don't really know if it had any substance and the actual situation isn't very clear."
18,14,It's in the CDC's job to prevent an HIV pandemic.
19,14,What's a joke?
23,14,People in this subreddit are starting to make fun of the government's vaccination program.
27,14,I feel that the joke of this movie is a bit sexist. I thought it was a little silly to say.
39,14,"It's a joke. 'If it was to stop the spread of a virus, I would give a fuck. People who are naive and hate it deserve to be vaccinated. People who are naive and hate it deserve to be vaccinated."
47,14,"CANNOTANSWER: ""Making a mask is part of the measures deployed by the government to aid in stopping the spread of a virus. They are not invading anybody, because they think they are trying to protect a person. It is a joke about the government. It is a joke about the government."
48,14,"You are not correct, but this AMA isn't a joke about the government or the government."
53,14,I don’t like your AMA. And you don’t understand how it’s a joke. That’s what it was written on.
61,14,"What a joke! I thought you meant ""the other commenter means that I am not an expert."" That's funny, I'm sorry. I'm so sorry, but it was my reaction."
63,14,"*Is it a joke because it's a joke, but it doesn't fit in the definition of a joke. *"
68,14,It's like a joke because they don't know that you can't go in with a mask and a mask isn't a joke. There's no good reason for it. It's the crappy thing.
73,14,He has a legitimate concern that people will become more violent if they don't wear them.
74,14,"I think the CDC is trying to get people infected with HIV into getting vaccinated, which they say is very necessary in the context of the disease. The fact that people who have been vaccinated are not getting vaccinated is a little odd."
83,14,i think that one of the main problems is that they do not know what they want to do with the health system
14,1,This is what makes the AMA. It's just a joke. It's a joke. It's a joke about a bad joke that's not actually a joke. It's a joke that isn't a joke because it's a joke.
14,8,">""If it was to stop the spread of a virus. They are not invading anybody, because they think they are trying to protect a person."
14,11,It's a joke. The article is misleading and unhelpful. It's about how the government is trying to prevent the spread of a virus.
14,13,"CANNOTANSWER, MD:"
16,14,"CANNOTANSWER, MD:"
18,14,"CANNOTANSWER, MD: AMAs are part of the measures deployed by the government to aid in stopping the spread of a virus."
19,14,"There are so many AMAs. One is an ama and one is about the AMA. The other is a joke, and one is about a movie. It's a big deal."
23,14,"I mean, you're telling the truth. People are crazy that you don't think it's a joke. You're telling the truth about your friend and the government's attempt to make a joke about the government's vaccines."
27,14,"I don't know if the whole story is a joke, but I think the whole joke is the same as the book."
39,14,Is there a reason they would not want to do anything about it? That's what the AMA is. The first sentence suggests the whole thing is about the government's policy to prevent HIV/AIDS.
47,14,"""I don't think that's a joke."
48,14,It's a joke that the government wants to make a joke about the health care that it's supposed to help people take up their own.
53,14,"CANNOTANSWER: I have had my face shaved twice to stop the spread of my virus. My nose is still shaven from the time it was born,"""
61,14,"It was a joke. I'm sorry, but it was a joke. It was an actual joke."
63,14,CANNOTANSWER THE HATE AMA
68,14,There are several ways to communicate that the government is trying to protect people. That's where this AMA comes from. Whether or not this is a remark is a debate.
73,14,It is a big issue because it will cause people to become more violent if it is not enacted. But it is a big problem because the government is not enacted by the state. Is it true that they need to fix this problem or is it possible that they do not want to do so?
74,14,People who wear masks are often the ones that actually know what's going on. Those that don't realize they are wearing a mask are so embarrassed by it.
83,14,"CANNOTANSWER, MD:"
14,1,"CANNOTANSWER, MD, is a medical assistant at a company whose employees wear masks during a pandemic."
14,8,"""The problem is that people who do not understand the concept of a job are blaming their own health care and health system."""
14,11,The AMA (AMA) is not about the NSA or the government.
14,13,"In the movie, ""Seen this article, I voted to stay out of the AMA."" He said, ""Wow, this is really an interesting story,"" which is kind of funny but doesn't really really address anything in particular."
16,14,>I think that is a joke
18,14,"CANNOTANSWER, MD: ""It's difficult to stop an HIV pandemic if you don't wear a mask and keep distance""."
19,14,It is a joke. It isn't a joke. It's a fact.
23,14,"I think there is a funny point about a bunch of things. If the government wanted to make a joke about the AIDS epidemic, they would have a joke about the CDC not trying to stop it."
27,14,I like that you mention the idea that if you want to protect yourself from a virus you need a mask to prevent a vaccine.
39,14,">If it was to stop the spread of a virus, I would give a fuck. People who are naive and hate it deserve to be vaccinated."", ""But I'm pretty sure this is more about preventing someone from getting sick. The reason that people want to know that is because people are... are. People do, and there's nothing to that in my opinion, but it's just the most important part of the problem."", """"But I don't think it's a joke. """""""
47,14,CANNOTANSWER: 'We're all part of the government''
48,14,I think the AMA is not meant to be funny. It is meant to be funny because it helps people to take up their own health care. It is also intended to be funny because it is a joke that the government is trying to get people to take up their own health care. It isn't meant to be funny because it is a joke about the government. And to be funny is about the government helping to prevent the spread of the virus.
53,14,Aren't there more than three or four people who are not interested in the same sort of question you're asking?
61,14,"The idea that vaccines are a joke doesn't sound very sexist or obnoxious, but it does a good job of helping."
63,14,) I didn't know the doctor wasn't in the AMA or the AMA.
68,14,"> ""The people don't wear a mask to protect themselves from HIV."
73,14,It’s been a long time since I’ve ever heard an AMA about how we need to make a mask for people that are having a hard time recognizing that being a politician is part of how we have changed a medical standard.
74,14,"I'm sorry to say that I'm so embarrassed, but I have a mask, and I'm gonna go to the CDC to get it back."
83,14,"""You are being silly. You don't believe in the masked system."""
14,1,he's an asian - american.
14,8,[Meanwhile the Government is very supportive of [the idea of wearing a mask during a pandemic]. [Which is the most important part of the AMA].
14,11,> We're all part of the government.
14,13,Is it even the most important part of the article?
16,14,"I thought 'this is a joke' was some sort of 'complaint' of a joke about the CDC trying to keep people from getting vaccinated because they don't understand it, but are still trying to get people to get the vaccine."
18,14,"CANNOTANSWER, MD: AMAs are a joke. It is not about the vaccine, but about the treatment of the virus. It is a joke. Because the government is trying to put it in place."
19,14,A lot of people are not familiar with 'a lot of things' about the AMA. They're talking about a virus and not about it.
23,14,"The AMA is in response to a recent public health emergency, and is a joke about the vaccines, not a joke about the vaccines."
27,14,Vaccines are for life. People don't wear them because they're sick. They don't want to. There is no reason to wear them. People don't wear them because they're sick. They don't want to. They don't want to. There is no reason to wear them. People don't wear them because they're sick. They don't want to.
39,14,AMAs are about the government's policy to prevent the spread of the virus. They're about the government's policy to prevent the spread of the virus.
47,14,"""We're all part of the government."""
48,14,The AMA is a joke because it is about the government trying to prevent people from getting vaccinated.
53,14,"AMAs can be very specific. They don’t refer to what’s a joke, and they tend to be about the government and vaccines. They’re not about the government or vaccinations or anything but the government. They’re about vaccines and not just a joke."
61,14,So the person is saying something to the effect that the government isn't wanting to stop the spread of the virus? :(
63,14,"The movie is over. The idea isn't funny. It's a joke, it's a joke."
68,14,"A common joke about public health is: ""People don't wear a mask to protect themselves from HIV. It doesn't even know what a joke is."""
73,14,>[[A](http://en.wikipedia.org/wiki/SIllegalAdvice?q=Im_recent_comment&q=Im_recent_comment&q=i'm_recent_comment&q=Im_recent_comment&q=Im_recent_comment&q=Im_recent_comment&q=Im_recent_comment&q=i'm_recent_comment&q=I
74,14,"I think the most important part of this is the fact that the CDC's job is to not give it away to those with it, and that there is a reason it is being taken away. It's the only legitimate way to keep this from happening."
83,14,This is the kind of joke you can make up.
14,1,What does the AMA actually say about the AMA?
14,8,"""What is the problem with all the AIDS jokes?"""
14,11,> We're all part of the government.
14,13,It's a joke. It's a joke. It's a joke.
