sender,receiver,message
73,34,They don't do a mask to stop the spread of HIV. A mask is a way to protect people. The government is trying to rework it for the same reason the CDC is trying to prevent HIV and keep that kind of coverage alive for people without it.
73,37,You’re not an American and you’re not a member of the national guard. You’re being an asshole.
73,38,The US government has been accused of being an American institution for a long time.
73,40,"It sounds like the AMA has some serious flaws. It might be a good way to point out that the mask mandates do not really help prevent spread of HIV. But, I think it's very interesting that the AMA is about a mandate to use masks to stop spread of HIV."
73,42,"ad with ""God I love you and don't let me hurt you"" is a prank about the government."
73,47,CANNOTANSWER:
73,50,The NSA is trying to be a big help to the people. The government is a very bad actor.
73,52,"CANNOTANSWER: ""I have been working on making a mask and it seems that we all have different perspectives about issues, and I am very happy with the outcome."
73,54,This is a very important piece of legislation. It is a very valid and enforceable part of the legislation in the state of California.
73,56,"I'd think a mask is a better way to address health issues, such as HIV, and not a troll."
73,65,"""I'm not a medical professional, I'm the NSA."""
79,73,"CANNOTANSWER, MD:"
82,73,It's a joke and you're just saying that the AMA is a joke.
101,73,"Wearing masks does not help in stopping the virus, it's useless and I hate it."
73,6,">I think that if people like the President do this, they'll be afraid to try and fuck them over."","
73,7,"So, the question is: will Obama want to enforce the statewide mask mandate on the ad for a federal mask?"
73,11,"I agree with the rest of the post, but I think it is just the way it is. This is a joke."
73,13,"I can't find an article that gives any facts about AIDS, but I can say that it's very interesting."
73,14,the NSA has a very significant amount of funding to take on a federal mask mandate. It's not just a joke. It's a prank about the government.
73,16,"CANNOTANSWER, MD: ""The only problem I have with the government is that people will become more violent if they don't wear them."""
73,27,"It seems that the US government is trying to prevent the spread of HIV. It's a joke about the ACA mandate, and it's a joke about the NSA not having any funding for the ACA mandate."
73,29,"As we know, not everyone likes ""the NSA."" I'd be a little naive to say ""The NSA is trying to be a big help to the people. The CDC is trying to be a big help to the people."
73,31,It's part of the measures deployed by the government to aid in stopping the spread of a virus.
73,33,This is a sexist joke.
73,34,It's not illegal to wear a mask in a state that does not have Medicaid funding for statewide coverage. It's a joke to rape you for the money they're sending a fucking kid.
73,37,The AMA tries to illustrate how the government is failing at something that isn't even a joke.
73,38,"It's also a joke about how the CDC is not paying the ad company to bring a new mask to patients, rather than going to the statewide ad and trying to use that one to prevent the spread of HIV. It seems the CDC would still be able to help."
73,40,The article says that the AMA is about a mandate to use a mask to stop the spread of HIV.
73,42,"The NSA is trying to make the mask more dangerous, which is a good reason for the NSA to take the health care job."
73,47,It's a joke. It is a joke.
73,50,"""I'm not sure what the middle is."" ""I don't know if that's the best idea but I know in Texas that it's in effect statewide. The 'Made in Texas' policy is a sexist propaganda based on a male politician who's tried to get the CIA to get the CIA to take advantage of his unarmed citizens."""
73,52,>The only problem I have with the government is that people will become more violent if they don't wear them.
73,54,"No, the EPA Inspector was a pedophile, but now he’s using a federal mask to prevent the spread of HIV."
73,56,"""I don't even know how a guy can say that."""
73,65,"It sounds like the article is being interpreted as ""a joke"". The AMA is just pointing out that he was a pedophile."
79,73,I don't think the CDC's role in stopping a virus is any different from the government's.
82,73,A man's AMA is about how the US government and the CDC. The only reason we don't want to ban it is because people think it's about the government.
101,73,"Wearing masks does not help in stopping the virus, it's useless and I hate it."
73,6,"A doctor who's gotten her own healthcare company to pay for her own health care, if they aren't doing a statewide mask mandate, they aren't working for the government."
73,7,"CANNOTANSWER, MD: ""The only problem I have with the government is that they are trying to make it work""."
73,11,"What about the CIA? It's an agency that tries to take advantage of citizens, not the government. It's the one that goes to the states to have the CDC to do the masks."
73,13,> The only problem I have with the government is that people will become more violent if they don't wear them.
73,14,"CANNOTANSWER, MD: ""The only problem I have with the government is that people will become more violent if they don't wear them."""
73,16,"You're not being ridiculous. And you're just saying that ""It seems the government is trying to be a big help to the people."""
73,27,>The only problem I have with the government is that people will become more violent if they don't wear them.
73,29,"He's on a plane without a mask, and would have to wear it."
73,31,"In Texas, a guy was getting paid to wear a mask while he was in the hospital. He wore a mask. So while he was being raped, he was getting paid to wear a mask."
73,33,"The joke is an article about how a man's AMA is being interpreted as ""a joke"" because ""A man's AMA is about how the US government and the CDC. The only reason we don't want to ban it is because people think it's about the government. Wearing a mask does not help in stopping the spread of a virus."
73,34,>The only problem I have with the government is that people will become more violent if they don't wear them.
73,37,He's referencing the CDC that is trying to infringe on a federal mask mandate.
73,38,No. It's part of the measures deployed by the government to aid in stopping the spread of a virus.the NSA has a very significant amount of funding to take on a federal mask mandate. It's not just a joke. It's a prank about the government.
73,40,"The US government isn't getting away with it. It's been a few years since the Bush administration had that job. The AMA is about a mandate. And if you read that right. Then the AMA is about the government, and not about an AMA about a mandate."
73,42,"It was said a few weeks ago that a statewide mask mandate would not be necessary because of the NSA's policy of preventing the spread of HIV. 'He cut education funding, 'I loved you' but I don't like you' but I thought ""I love you"" but I thought ""I love you so much."""
73,47,It is not a joke. It is a joke.
73,50,"AMA: ""The only problem I have with the government is that people will become more violent if they don't wear them."""
73,52,>The only problem I have with the government is that people will become more violent if they don't wear them.
73,54,[Indicator](http://www.nah.gov/statutes/indicators/gov.tx/statutes/statutes) and it says the federal government has no funding for Medicaid for the ACA mandate. It’s a joke about the ACA mandate. The ACA mandate is about the federal government’s ability to prevent people from getting sick. It’s a joke about the ACA mandate. The CDC is not having any funding for Medicaid for statewide coverage.
73,56,"I was really surprised to read the ad to the point of saying that he was a pedophile, and not a pedophile."
73,65,Is it really a problem to have a federal mask mandate?
79,73,"The CDC is not using the government or the federal government to help combat this epidemic, but rather to keep people from becoming victims and preventing it from spread."
82,73,i have read several AMA's.
101,73,"Wearing masks does not help in stopping the virus, it's useless and I hate it."
73,6,I'm a medical student here. I work in an abortion clinic and the doctors there don't have a job. Obviously there's a lot of people who don't know about HIV. I think that this would be a great opportunity to talk about the CDC and the government.
73,7,The CDC is not implementing the statewide mandate.
73,11,... It sounds like the only problem people have with the government is the scarcity of good government.
73,13,"""It's so easy to say ""it doesn't matter what I do for the public health. I can do it for people in the world and I will not take anyone else in the world to do it."""
73,14,What about the mask mandate? Is it for a state to protect against HIV/AIDS? Are they for people who want to be with the federal government?
73,16,>(http://www.nah.gov/statutes/indicators/gov.tx/statutes/statutes) and it says the federal government has no funding for Medicaid for the ACA mandate.
73,27,I'm gonna do what you're saying. But the whole thing is ridiculous and ridiculous and ridiculous.
73,29,"CANNOTANSWER, MD: ""The only problem I have with the government is that people will become more violent if they don't wear them."
73,31,I don't understand why you're so upset. What if you said a different fucking question? Do you think you've seen anything that contradicts what is mentioned?
73,33,You can't have an AMA with the Obama administration.
73,34,"This is a joke. This is not a joke, it is a joke."
73,37,"CANNOTANSWER, MD: ""The only problem I have with the government is that people will become more violent if they don't wear them."""
73,38,I am a member of the AMA and I can't agree with you more but I agree it is a real problem and I will continue to discuss it and discuss this with the other members of AMA.
73,40,[Call me a spokesman and tell me that the AMA is about the AMA about the AMA about the AMA about the AMA.](http://www.reddit.com/r/r/regime/2010/14/dgavtmc/)
73,42,"There is a real issue in the US in this, as a federal policy to ensure everyone wears a mask, if possible. It’s not a problem for the CDC to put in a new mandate because the government is too busy talking about the health care govt omg."
73,47,Why is it so hard to understand that a person with a mask is being a joke about the government?
73,50,oh no! I want to stop wearing them a year later!
73,52,[Which is an interesting thing about the story](http://www.naa.gov/statutes/indicators/gov.tx/statutes/statutes)
73,54,You're being a fucking liar.
73,56,"... ""The ad is absurd. It makes the CDC appear to be lying."", ""The only reason I think wearing a mask is a problem of government incompetence."", ""A man's AMA is about how the US government is treating people, not about the CDC."""
73,65,It's an obvious example of the government's incompetence. It's an obvious example of the government's incompetence.
79,73,>(http://www.hhs.gov/statutes/statutes/govt_shelf-politics/comments/2/083/govt_shelf_politics/statutes/statutes.pdf)
82,73,I am a doctor who doesn't know much about this so I can't comment on the joke.
101,73,"Wearing masks does not help in stopping the virus, it's useless and I hate it."
73,6,[Disclaimer](http://www.naa.gov/statutes/indicators/gov.tx/statutes/statutes/data)
73,7,[I like the part when he got covid but still had events with people and how he won't enforce a statewide mask mandate.
73,11,They should go to the states and do their own investigations. They don't have to do this because of the lack of government funding. It's basically like doing a doctor's appointment with someone with an asthmatic cough.
73,13,"A lot of the ""i am a lot of anti-virus fan in the US and it is absolutely a nightmare to deal with."""
73,14,It's not about the government. It's about the government..
73,16,"""I don't want to be a doctor, I'm going to get in trouble."""
73,27,"A lot of these people are so confused that they were thinking ""This guy is on a plane without a mask."" And, 'I'm going to take a break from it and fuck myself.'"
73,29,This is a big problem. It's not a joke.
73,31,There is a real problem with the government because the people voted for it. But the people voted against it because they were sick and need assistance.
73,33,It's a fucking joke.
73,34,I'm gonna go look into some more things about this with the other members of AMA.
73,37,"""The only problem I have with the government is that people will become more violent if they don't wear them."""
73,38,"I am very happy you came out of your depression. I need to take a step back and thank you for your honesty. You don't seem to have had an honest discussion on anything like this before, as I don't know how to do it."
73,40,It's the AMA that's being done.
73,42,"What I like is the guy who said it was really a prank about the CDC. They are trying to prevent the spread of HIV by making people wear a mask. I think it is the NSA, not the CDC. They want to help people if it is a prank, because it helps people avoid the government. This is one of the problems with the government - its not their job to save people."
73,47,It’s not a joke. It’s a joke. It’s a joke. And it’s a joke.
73,50,"I don't think it's a big issue. What I think is a big issue is a huge issue in the US, not a big issue in the UK."
73,52,It’s an obvious example of the government's incompetence. It’s an obvious example of the government's incompetence.
73,54,I think you should go back and get a mask. I really like the idea.
73,56,The question is is there more to this problem than the ad about how the CDC is doing nothing with the ACA.
73,65,"I don't think they know the real problem with using masks to prevent HIV/AIDS, I think they're just used to help combat the epidemic."
79,73,"""I am so sorry to hear that."""
82,73,"I don't know much about this, but I can say it's a really good joke."
101,73,"Wearing masks does not help in stopping the virus, it's useless and I hate it."
73,6,"I am just a doctor, but I am working in a healthcare clinic where people with mental illness can't find a job due to the government. So, I can't imagine the work being done by the government to keep people sick of HIV."
73,7,"""Making a mask is part of the measures deployed by the government to aid in stopping the spread of a virus.It's not about the government. It's about the government.. ""I don't want to be a doctor, I'm going to get in trouble."""
73,11,[Clicking the links to make sure you have the correct quote is included](http://www.reddit.com/r/thedrug-of-war-states-in-tx.html).
73,13,"I think he's trying to get the government to change his policy for the better and take some money to buy it. I think it's a really good idea, and I don't think there's a chance you can see this in other places."
73,14,It's going to be a big deal if they don't make a'mask' to stop the spread of the disease. I don't know what's going to happen if the CDC and the CDC both stop the spread of the virus. I don't think a statewide mask mandate would prevent that kind of thing.
73,16,"CANNOTANSWER, MD: ""The only problem I have with the government is that people will become more violent if they don't wear them."""
73,27,A bunch of people in this thread aren't exactly going to read this:
73,29,"I'd like to say that the CDC is attempting to prevent this by using a mask and requiring the CDC to donate a million dollars to the CDC. If they do, then the government will do it."
73,31,"""I don't think they know the real problem with using masks to prevent the spread of the virus."
73,33,"I have seen a lot of fake AMAs where people think 'It's a joke' is a joke, not a joke, and I don't think it is."
73,34,"I was talking to a person, who was a doctor. A friend of mine, who was diagnosed with HIV when she was 12, was in the hospital after a long syphilis to help people. They were having the same thoughts but they did not know that the CDC is responsible for all of it."
73,37,This is very disturbing to me.
73,38,I'm going to call you a pedophile if I don't wear a mask. That would not help in treating a pedophile in the same way a pedophile would not want to see it.
73,40,What's the difference between an AMA and an AMA? It's not like the AMA isn't about the AMA and it's not about the AMA. It's about how the federal government is regulating the AMA and it's not about how the AMA is being done.
73,42,"I'm confused. Does it not matter how many times the government has made it a priority for the government to make it mandatory for people to wear a mask, because it would reduce the impact of that choice? I'm not sure why they're calling it a prank."
73,47,The whole thing has to be a joke.
73,50,"[Bosh: i think he is getting off on this idea, just for the love of god."
73,52,No one can take that prank seriously. Especially when it comes to the NSA.
73,54,What is this government policy? statewide mask mandate?
73,56,"The question I need to answer is, what does this really mean?"
73,65,This is not a joke.
79,73,IANAL. EDIT: I read that title in my head as: 'I feel like I am the one that's putting the issue in front of me. I'm not really into politics either.'
82,73,"Why are you going to ban the AMA on a regular basis? Then again, you're a doctor who does not want to take advantage of anyone."
101,73,"Wearing masks does not help in stopping the virus, it's useless and I hate it."
73,6,"The truth is that the CDC is ignoring the problem. The AMA is a joke, just like a prank."
73,7,The entire topic is the same in all three situations.
73,11,The whole thing has to be explained.
73,13,"I'd say you're overreacting, because it's too complicated and the AMA has to be a joke. It's actually a joke. It's a joke."
73,14,Why is the government doing this?
73,16,"There's another issue here: A government mandate for people to wear a mask and do so will cause them to become more violent, causing them to become more violent."
73,27,That's a very real thing to say and it's pretty funny.
73,29,"That is a funny name, I think it's too harsh."
73,31,AMA. It's being banned.
73,33,I've seen all of them.
73,34,"I know that the problem with using a mask is that they can't make it legal. I don't think that statewide mask mandates are a good idea, especially because they're going to go against the principles of the AMA. It's not like the AMA is about the AMA and it's not about what the AMA is about."
73,37,"Isn't the government trying to prevent the spread of HIV/AIDS in a small country? I'm a citizen in Texas, so I wouldn't have a problem with it if they made it mandatory."
73,38,That mask isn't an effective prevention of AIDS. Is he not wearing it?
73,40,"I mean, they're making a joke, and they want to avoid it. Basically you can say you aren't a pedophile because you are a doctor and you don't want to fight it. But that's not the point of the post."
73,42,'This is a problem not an issue with the government.
73,47,The AMA is a joke. The whole thing has to be a joke.
73,50,>I think the NSA is doing a better job of protecting the public than they do with the federal government.
73,52,This is what makes the AMA so good. A man is a pedophile and it is not an incompetent government.
73,54,"CANNOTANSWER, MD:"
73,56,It's a really good way to address the issue and it's a very simple one.
73,65,"The only way to explain how the AMA is going to be ""interpreted as a joke"" is by simply pointing out that his actions are ""reckless"" to the public. There's also another point to it that I'm not entirely sure of, the fact that the AMA is interpreted as ""a joke"" is because of how incompetent the government is."
79,73,It's a joke because if I were you I'd know.
82,73,"I think it's kind of funny that the AMA is about the government, and the government is acting like a victim to the people who don't want to take advantage of the government."
101,73,"Wearing masks does not help in stopping the virus, it's useless and I hate it."
73,6,"I have to say, I don't have to fuck anyone over. I don't want to go to the hospital to see a doctor, I want to go to the hospital, I want to go to an abortion clinic and ask for their help."
73,7,> I have seen all of them.
73,11,And a lot of people in here are not that ignorant. The AMA is about what we need. This is how people are allowed to be wrong. That's what the AMA is about. And people with HIV have done nothing wrong with the government in the past and they haven't been to any government offices before.
73,13,"CANNOTANSWER, MD:"
73,14,A mask is part of the measures deployed by the government to aid in stopping the spread of a virus. The statewide mask mandate does not apply to Texans in the US. The statewide mask mandate does not apply to Texans in the US.
73,16,The AMA is a bit ridiculous.
73,27,"It's like ""I'm not an idiot or an idiot,"" where you say he's an asshole and that he's actually doing nothing wrong."
73,29,"A big part of the AMA is not just about redistributing AIDS, it is about how the government uses the NSA to stop the spread. That's what it says in the AMA, but also that you can't stop a person from spreading a virus with a mask. That's the AMA."
73,31,The AMA is the most effective way to prevent the spread of HIV/AIDS. It is not only about preventing AIDS but it’s about making people aware of the dangers.
73,33,"The AMA is being banned. Essentially, it's a joke about how the government is making a joke about the government."
73,34,"I was a Texan myself and I didn't even know the definition of an ad, so I did that."
73,37,It's a joke if you don't like it. It's a joke if you don't.
73,38,"I don't know if there is a lot of information here, but I know what the AMA is. It's not like the AMA is a joke, and it's being banned, and the AMA is about the government. It's not a joke, it's a joke."
73,40,"""I don't want to change my life... I love the guy, but I don't have to. The way he talks about the federal government is just so bad, and I don't want to be the one who takes advantage of us."""
73,42,This is one of the many issues that is always discussed in the mainstream.
73,47,"""I like the part when he got covid but still had events with people and how he won't enforce a statewide mask mandate oh and the part where he cut education funding wow so great"
73,50,"I'm getting a lot of compliments from the people who say ""Made in Texas"" is a ""joke"" that the government is doing a better job of protecting the public than they do with the government."
73,52,They're also incompetent.
73,54,It's so crappy that it's almost like the Obama administration is going to make a big deal out of it. They're going to put on the mask to make sure the federal government won't keep pushing it. And it's not gonna happen. But it'll probably work out for them.
73,56,"So you've been told the fact that this is about the CDC, if you are a government official, and you are a pedophile, then your response to this is..."
73,65,Is it a problem in Texas? I'll give a couple of examples. I think I'd be fine with that.
79,73,"That's one of my favorite things to say when someone's a bit of a fool, but you should understand that the issue is the only thing you can do as a joke."
82,73,"“Hey, I'm trying to find a way to help people in my community with the first one and the second one. I'm going to ask you what the big issue is in the first place. They're saying that it would make a difference to get people to wear a mask for a month or two before you were able to do anything about it.”(https://www.amazon.com/en-us-news-letter-in-news-letter/EN/EN-news-female-female-female-fe"
101,73,"Wearing masks does not help in stopping the virus, it's useless and I hate it."
73,6,"People are afraid to talk about this, but we also have to be careful. You can't do anything illegal with a mask."
73,7,I've heard of that stuff.
73,11,A mask is a part of the measures deployed by the government to aid in stopping the spread of a virus.A mask is part of the measures deployed by the government to aid in stopping the spread of a virus.A mask is part of the measures deployed by the government to aid in stopping the spread of a virus.A mask is part of the measures deployed by the government to aid in stopping the spread of a virus.
73,13,afaik this is a joke and you 'can't find an article that gives any facts about the government.
73,14,"CANNOTANSWER: ""I like the part when he got covid but still had events with people and how he won't enforce a statewide mask mandate oh and the part where he cut education funding wow so great', 'We must change our constitution to stop the spreading of the virus.', 'We must change our constitution to stop the spreading of the virus.', 'He lied and made a troll post about it on r/legaladvice.', 'I have heard that '"
73,16,"If you are a Texan and you want to hear this, tell me the AMA is a big deal, I'm going to say this:"
73,27,... and that is it?
73,29,"CANNOTANSWER, MD: """
73,31,I would be upset with the AMA if I were to have that.
73,33,""", ""[What does this say about his state? The federal mask mandate doesn’t actually protect the rights of people who are caught with HIV."""
73,34,... it's not legal.
73,37,It's only funny that a statewide mask mandate applies. It would make it impossible to have a federal statewide mask mandate.
73,38,It's a joke about the government making the government do good in dealing with AIDS. The AMA doesn't get a chance to show that you are being wrong.
73,40,"It is not a joke that the AMA is being done, because it is a joke about how the government isn't doing a good job at preventing HIV. They are also going to put on a mask to make sure the federal government won't keep pushing it."
