sender,receiver,message
73,34,"Its not legal. Its just the fact that people feel admonishing them. People who wear masks are promoting a disease they aren't comfortable with, and they can't actually stop it."
73,37,There are two types of people in Texas. This makes a lot of sense to me. It’s all a lot of misinformation. But a lot of that is nonsense and really unhelpful.
73,38,A huge problem is that statewide mask mandates are being passed all over the place. The people who think it's a good idea aren't getting it.
73,40,No! They aren't actually doing it. They're doing it to keep people safe.
73,42,A man has a statewide mask mandate (in a way) but he doesn't need to wear it to prevent a lot of other people from getting sick.
73,47,That's right. The government is actually working to stop the spread of the virus and is trying to make money for the government. It is in no way a good idea and it's not even an issue there. It is not a good idea in any way. The people are being stupid and have a lot of shit to ask about.
73,50,"[It doesn't even sound right to me that he is trying to enforce a statewide mask mandate, but he is doing it. I am pretty sure that it would be a better way to deal with the problems associated with a statewide mask mandate. I am gonna go ahead and say that they are getting a mask mandate. [Hey, I'm trying to find a way to help people in my community with the first one and the second one, I'm going ahead and say that a statewide mask mandate is in effect statewide "
73,52,It's the government's problem. That's just not my thing.
73,54,You are a bad person.
73,56,It's a gimmick. The CDC has already taken action to stop AIDS. I think the CDC needs to take action to stop it.
73,65,"It is not illegal to wear a mask to stop the spread of AIDS, unless you have medical insurance that covers them."
79,73,"In a lot of situations, wearing a mask and being at work in front of an employee is a joke. I don't see that being the joke, but I can tell you that this is not going to be a joke."
82,73,It sounds like someone on the NSA blew his mind.
101,73,"Wearing masks does not help in stopping the virus, it's useless and I hate it."
73,6,> [Annnd you want the CDC to look at this more?
73,7,A person who wears a mask does not want to take the risk of a disease. They are not preventing the spread of a disease.
73,11,... This is just misinformation. The entire subreddit is overdue for all that.
73,13,"Yes, it is an anti-fiscal war. They're not trying to get money from the government. They're promoting a disease they're not comfortable with, and it's a huge problem, which isn't an issue in any way."
73,14,"I have heard that people in Texas get a fecal virus vaccine, but haven't been able to get it in the states. This is an ineffective way to spread the disease, which is what the government is attempting to prevent."
73,16,I'm sorry but this is a big one. This is one of the main parts of this thread.
73,27,"Well, I don't think it's a great idea to take care of a statewide ACA mandate. But, I think the issue is that the government is trying to protect against HIV in general. They are being tried to stop it. The problem is that the CDC has not received any funding for the ACA mandate to address the spread of HIV. (If you are the type of person that's not getting one)"
73,29,It's not like the people that think this is a good idea are a bad person. It's a joke. It's not the government's problem.
73,31,"As a man with a mask, I can tell you I think he's right about it. I think he's wrong about the CDC and he should have voted for a mask mandate. Then I look at the other posts."
73,33,You just described the government. This is not an ad. It is an ad aimed at making a political statement. This is an ad to help people in their communities.
73,34,The CDC does not have funding for a new statewide mask mandate. There is no funding for it.
73,37,I’m an asshole and I’m not even a member of the national guard. I’m not even a member of the national guard. I’m the govt.
73,38,"I'm talking about the government's ""non-state-run"" mask mandate which is supposed to be in effect every ten years, and the CDC is still taking action to stop AIDS. They don't even have any funding for the CDC to bring that in, so they've been trying to make it work."
73,40,"""I'm not going to change my life... I love the guy, but I don't have to. The way he talks about the federal government is just so bad, and I don't want to be the one who takes advantage of us."", ""I just read something about this on the wiki page and I know that it was a good idea to do so."
73,42,"[This is the part where I'm trying to find a way to help people in my community with the first one and the second one, I'm going ahead and say that they are getting a mask mandate. I am pretty sure that it would be a better way to deal with the problems associated with a statewide mask mandate."
73,47,Almost everyone who thinks it's a good idea gets the memo: he doesn't need to wear a mask to stop a disease. And he shouldn't be wearing a mask when he doesn't have health insurance?
73,50,"""Hey, I'm trying to find a way to help people in my community with the first one and the second one, I'm going ahead and say that they are getting a mask mandate."", ""[I don't even sound right to me that he is trying to enforce a statewide mask mandate, but he is doing it. I am pretty sure that it would be a better way to deal with the problems associated with a statewide mask mandate."", ""The fact that the people in his city are on his watch list and that is why they need to"
73,52,"There is not an NSA mandate - that is the same as ""single mandates"""
73,54,"""As a person in Texas, you cannot wear a mask, to prevent a lot of people from getting sick. I believe that the government is trying to help prevent the spread of the virus. That is what the CDC is trying to prevent. It is not legal to wear a mask."""
73,56,People have been doing this for a long time. And not a good enough reason to not be. They're just saying that the government is doing nothing and that the government is doing nothing.
73,65,Yes. You should try. Wearing a mask will not stop the spread of a disease.
79,73,"If you wear a mask to work, you can get help. And it's a joke that everyone can do at any time, regardless of a mask."
82,73,"The way that it sounds is in /r/happenedToObscure, which makes you wonder if that is a real joke?"
101,73,"Wearing masks does not help in stopping the virus, it's useless and I hate it."
73,6,CANNOTANSWER ARE RIGHT NOW DUKE HE SAID THIS TODAY!'
73,7,"There's a lot of stuff here, he was a good president, the state and the federal government, and the CDC isn't a bad idea at all."
73,11,- I believe in the truth.
73,13,"As I have said before a good deal of government policies and programs exist, I'd like to suggest that you read this as ""the issue with the government in the US""."
73,14,"The message was from a guy who wanted to help people in Texas. Then I heard him do the same to a child who was already suffering from AIDS. We had to put a statewide mask mandate because he was scared of getting an HIV vaccine, but he's not the one. We got a mask because he was so sick and they decided to have him go to the hospital and do the shit that was done to him."
73,16,"I hate to be the one making fun of the government. But I know this isn't the one, I don't know how to fix it, and I think that it's just a funny thing to say, but I can't help it."
73,27,'Status is just a joke.''
73,29,And that is the problem. It's a problem. The problem is that the CDC cannot send that funding to the CDC because a statewide mask mandate would be a huge deal-breaker to the CDC.
73,31,I don't think you'll be able to understand why someone has a legitimate concern with the government if they say that's what you're saying unless they're telling you otherwise.
73,33,">I don't know what you mean if you read the title you aren't going to follow it unless you follow the OP's directions. I do know that this is an old ad. I don't see the whole thing as a problem at all unless you follow a different article OP's comment has for you."""
73,34,This is not a joke.
73,37,"There is a government mandate in place called ""Painting,"" and there is a federal one there."
73,38,"As someone who had never been to a CDC clinic, I can assure you I had a great time. If I didn't, my husband would be in the hospital for the next couple of years."
73,40,I'm a Texas democrat so I'm okay with it if you want.
73,42,"I had a conversation with someone today about what the ACA mandate actually says, and they said they are trying to prevent the spread of HIV."
73,47,'The government is working for a reason. It's part of its own agenda. It's part of that agenda that the CDC is trying to perpetuate.
73,50,"I'm not sure what the ""middle"" is, but I'm not sure what's going on. 'I'm sorry, but this is a big one."
73,52,"The CDC has been doing this for a long time. This seems to be a good thing, but I don't think it would help."
73,54,"It's not really an ad, but a very legitimate and honest discussion."
73,56,"I read the headline and it is the same as when you get a fecal virus vaccine, and it varies from state to state. The CDC has an ACA mandate and they say if they're doing something about it and it doesn't actually address the disease it should. This ACA mandate doesn't apply to a statewide one in the US."
73,65,"I like this: ""I want to help the guys in my town who need to help prevent a deadly disease like HIV. And my friends and family who want to help have their kids protect themselves, I want to see the fecal virus vaccine. I've got to go now."
79,73,I don't see any problems with that. I just feel the need to have a piece of information to share and that is good information. There are a lot of issues I see in the general discussion here - it's about the prevention of people having HIV and the government has to ensure that people with HIV are not at risk of being treated poorly. I think it's a good idea to keep people aware that if they are not doing something for their health then they are being abused.
82,73,Vaccines are a good way to prevent a vaccuum. I would be mad at the president.
101,73,"Wearing masks does not help in stopping the virus, it's useless and I hate it."
73,6,"I think you might want to put out a statement and say, ""I don't think the government is ignoring the problem. It's a real problem that we can't solve without the government."""
73,7,"Yes, we've got our way with this. The only real problem with the government is that they're trying to ""make it work"". There's nothing to be done, but a government mandate is important."
73,11,"This post is a big mess of misinformation, it's not a joke at all."
73,13,"""But I have to go now. I don't see any problems with that. I just feel the need to have a piece of information to share and that is good information. I think it's a good idea to keep people aware that if they are not doing something for their health then they are being abused."""
73,14,">I'm sorry, but I don't think it would help. I'm mad at the president. Wearing a mask does not help in stopping the spread of a virus, it's useless and I hate it."
73,16,"It's a great way to help prevent the spread of a virus. I'm not sure why you'd do that, but the CDC isn't going to change what's being done to the CDC."
73,27,''I hate to be the one making fun of the government.''
73,29,"I'm not sure what this is, but I was in Texas for a year, and we had no one to talk to and listened to about it. It was so confusing that it made me curious about the story. I have no idea what to do."
73,31,"And in Texas, it's illegal for businesses and governments to make any money off of this as they refuse to provide those goods. The people voted against it because they are sick and need assistance."
73,33,>I like the part when he got covid but still had events with people and how he won't enforce a statewide mask mandate oh and the part where he cut education funding wow so great. [I like the part when he got covid but still had events with people and how he won't enforce a statewide mask mandate oh and the part where he cut education funding wow so great. I don't even understand what you mean unless you follow the a
73,34,[I don't think they can send that funding to the CDC because they don't have funding for a new statewide mask mandate.''
73,37,"You know, to a little further up there, I just sounded like I had a terrible day with the CDC."
73,38,> [Destination is not a joke.](http://destination.tx.gov/destination/)
73,40,It's not even about the masks. It's about the ACA mandate. It's about the federal government's ability to prevent people who are at risk from a deadly virus.
73,42,The CDC has an ACA mandate that does not cover this ad.
73,47,"The entire thread is about how the government is trying to help people with HIV. The only thing I'm seeing is the public coming out to the state and not their health care provider. ""In his defense, he is absolutely right and it's a misstep that he is trying to do in Texas."""
73,50,"A federal mask mandate is ""a big issue"" in the US, sexist propaganda based on a male politician who's tried to get the CIA to get the CIA to take advantage of his unarmed citizens. ""The CDC is working for a reason. It's part of its own agenda. It's part of that agenda that the CDC is trying to perpetuate."
73,52,"This guy is just trying to make a fun of the ACA, which is not only a joke, but a problem with the CDC because it is actually a policy that prevents people from distributing HIV vaccines. If a federal mandate would work, the CDC would enact a federal mandate, so that would make it easier for people to get the disease."
73,54,"A little bit jarring, but I'll leave it with:"
73,56,The problem is that the CDC cannot send money to the CDC.
73,65,'... and that's the problem.
79,73,"""I think a mask mandate is one thing, but I don't think it's any better for the health of people if they do something like that to help prevent the spread of a virus."" """
82,73,"It's a joke about the government, and he's not a doctor, so he's a doctor. And the AMA is a joke."
101,73,"Wearing masks does not help in stopping the virus, it's useless and I hate it."
73,6,>[[The CDC](http://destination.tx.gov/destination/)
73,7,">(http://www.da.gov/statutes/sba-fiq-report-2004.pdf). I'm a professor, and the government has a long history of helping people in need, especially those battling to get their hands on vaccines."
73,11,>I am mad at the president. Wearing a mask does not help. I'm mad at the president. Wearing a mask does not help. I'm mad at the president. Wearing a mask does not help. I'm mad at the president. Wearing a mask does not help. I'm mad at the president.
73,13,That's a good question to ask.
73,14,"CANNOTANSWER: ""I like the part when he got covid but still had events with people and how he won't enforce a statewide mask mandate"
73,16,I want to be the one making fun of the government and the guy trying to make fun of him. I don't want to be the one making fun of him
73,27,"i think ''The government is not fucking with it'' is a joke about the ACA and not the ACA mandate, but it's about the CDC's ability to prevent people from getting a deadly virus. The CDC has an ACA mandate that does not cover this ad."
73,29,"You guys just aren't the smartest people in the country. We're all being misled, because you should probably be, or you're just being elitist. I don't know what to say, but I think the most effective solution for this is just to have a federal mask."
73,31,I like the part when he got covid but still had events with people and how he won't enforce a statewide mask mandate oh and the part where he cut education funding wow so great.
73,33,"It is not illegal to wear a mask to stop a disease in the US, unless you have medical insurance that covers them. The federal government is not allowed to make it illegal to wear a mask, which would be inappropriate."
73,34,"You're right that the CDC is inherently unpopular with the right people. It seems like this issue isn't a problem, it's a problem. It is not a problem because it's a problem because of the way they handle the issue."
73,37,"I'm not sure what you mean by this. I'm not sure what he says, but he's probably just a bit too adamant that the CDC's mandate isn't going to change."
73,38,[Destination is not a joke.](http://destination.tx.gov/destination/) It's not even about the masks. It's about the ACA mandate.
73,40,I know that he's not a doctor. He's a politician. And the AMA is a joke.
73,42,"This whole thing is just so ridiculous, and it would never be a good one to discuss it with someone like that. The point is that people are all getting sick from this. Not just a sick child. A bunch of petty shit like this. It could not have been done without a mask."
73,47,Why doesn't the government put in a more effective mask to prevent the spread of HIV?
73,50,The question is: will you ever get the opportunity to give me the opportunity to go to the local CDC about a mask mandate?
73,52,".. It was so confusing that it made me curious about the story. I have no idea what to do. And in Texas, it's illegal for businesses and governments to make any money off of this as they refuse to provide those goods. The people voted against it because they are sick and need assistance."
73,54,[[Made in Texas](http://destination.tx.gov/destination/) It's not even about the masks. It's about the ACA mandate. It's about the federal government's ability to prevent people who are at risk from a deadly virus.
73,56,"The president abused his state to keep people from getting an anti-viral drug. This ad is absurd. It's not like the person who made the ad was just pointing out the lack of funding for the government to provide help. If you're not talking about him, then you don't have a right to get the government to help. Likewise, he didn't need the money."
73,65,This is an obvious example of the government's incompetence. What's worse than the CDC having a mask mandate? There aren't so many states where a mask mandate is the only option. The CDC is using it as an excuse to stop the spread of a disease. It's not a problem to do this in Texas.
79,73,"I know a guy from texas who used to talk about it. There was a guy I met that did this for a fun day in the morning who was a doctor and he was great at what he did. He said that his mom was at the doctors office and the doctor was just going to show me a good mask and help him shit he knew what was going on. I was also in a pretty bad mood when he said ""that was a really good idea"""
82,73,I am not a doctor. I don't think it's a joke.
101,73,"Wearing masks does not help in stopping the virus, it's useless and I hate it."
73,6,"I believe that if people like the President do this, they'll be afraid to try and fuck them over."
73,7,The government is still a federal agency. They have the legal right to mandate people to wear masks.
73,11,The issue is the people who don't think the government is incompetent. The people who do think the government is incompetent are people who don't know what to do.
73,13,">I'm glad we're having our sanity up for debate here. We do have a skewed view of the government, and I'm glad we have a clear view of our future."""
73,14,"Its not about what you wear. Its about what you do, whether you wear a mask or not. Its not about what the CDC is doing but it is what it is trying to do. That is something it isn't about the CDC. It is about the federal government's ability to stop the spread of HIV."
73,16,Because a government is trying to protect people and have them pay for healthcare because they are a minority population.
73,27,"I don't understand why you are getting down voted in this thread, so I thought I'd give you a few links. The whole thing is ridiculous and ridiculous and ridiculous. You need to stop posting here and stop being a fool and think, ""More people aren't getting it done."""
73,29,This is why you need to go to the doctor.
73,31,">The government is not allowed to make it illegal to wear a mask, which would be inappropriate. The people voted against it because they are sick and need assistance."
73,33,It's a big issue and it's not a good idea.
73,34,"I think you guys haven't done enough of it yet. I know you've heard a lot of good things about ad redistributing in Texas, but this is the first time I've heard anything about it. It's one thing if you're on the same page but the entire point isn't that it isn't legal, it's that you don't care about your health because they don't want to help. You seem to be saying that they can't get rid of the CDC, and that's the problem with them."
73,37,"The CDC has the capacity to stop and spread HIV/AIDS. That's a good way to prevent HIV in a relatively small country. But you'll never get enough treatment for this problem. This is a huge problem for the government, and I'm guessing it's a problem for Texas."
73,38,"""Making it illegal isn't a problem"""
73,40,>[http://www.reddit.com/r/r/regime/2010/14/2009/15/dgavtmc/](http://www.reddit.com/r/r/regime/2010/14/2009/15/dgavtmc/)
73,42,"What the AMA said is that the CDC is able to implement a new law to prevent the spread of HIV if it was implemented on the state level, and not a mask."
73,47,>[Never heard of a mask mandate here.
73,50,The fact that the people in his city are on his watch list and that is why they need to abide by the law is beyond me.
73,52,What's the point of this?
73,54,">I don't have a problem with your comment, and I'm an EPA inspector. This is going to be a lot of reading. The government is trying to prevent the spread of HIV in the US."
73,56,This isn't a great way to discuss AIDS. It isn't a good way to talk to AIDS or the CDC or to talk to a doctor. It's a ridiculous way to talk about AIDS.
73,65,CANNOTANSWER: I like the part when he got covid but still had events with people and how he won't enforce a statewide mask mandate oh and the part where he cut education funding wow so great. I like the part when he got covid but still had events with people and how he won't enforce a statewide mask mandate oh and the part where he cut education funding wow so great.
79,73,"[I don't think people in Texas are talking about the CDC, not the government]."
82,73,"I don't think you're being funny. I'm just saying I think that if a person can't think of a symptom of a virus that doesn't have a mask, then it's not a health issue, but it's a symptom of a virus."
101,73,"Wearing masks does not help in stopping the virus, it's useless and I hate it."
73,6,"I've never heard of an AMA containing anything that he was trying to do with the CDC but that is completely untrue. I have a lot of questions about how the CDC might be able to help, but it's really beyond me."
73,7,CANNOTANSWER:
73,11,"CANNOTANSWER: I like the part when he got covid but still had events with people and how he won't enforce a statewide mask mandate oh and the part where he cut education funding wow so great. I don't think they will follow the law, but I think they will and this is a good example of how government is being too harsh."""
73,13,I was in California for 5 years before the CDC and the CDC came together and created the AIDS outbreak.
73,14,"A person who has a medical diagnosis for HIV, and the fact that they're wearing a mask in the states, is not a problem. It is a serious problem because it is dangerous to use it. It doesn't really matter that it is an infection that you cannot get. It's just part of the problem that you're being 'funny' and remorseful about that, because you're going to be dead by then."
73,16,"The NSA is not implementing a mask mandate. It isn't the problem. ''Making it illegal'' isn't a problem, it's a problem. You're being silly."
73,27,"CANNOTANSWER: I like the part when he got covid but still had events with people and how he wont enforce a statewide mask mandate oh and the part where he wont enforce a statewide mask mandate oh and the part where he cut education funding wow so great. ''I like the part about what the other commenters are saying.'', 'I was in my 30s when I was young, and my parents were all dressed like that. ''"
73,29,"If there's nothing illegal in Texas, it's in violation of federal law."
73,31,"A mask mandate, yes? This is a lot of stuff. It's really not that bad. It's just that it's ridiculous, that he's not going to change anything, but it's not a good idea."
73,33,I'm a doctor and I'm a doctor too.
73,34,"In my state, a mask is considered a statewide, but hasn't been legally required to protect against HIV."
73,37,I don't think you're being funny. What is wrong with the government?
73,38,"It seems like this is the most recent, if not most ambiguous, question that came out of the conversation."
73,40,It's a big issue for the government. This isn't an issue for the government.
73,42,"We should try it. We could make it illegal and put a mandate in place so that the CDC can do a better job of it. We have to give them the mandate for the right reason to keep it. I think that's what the CDC is doing. That's why they're trying to get a deal in the state, not the state. We need to know what we're talking about. But this isn't a legitimate problem because a mask is more important than getting a mask."
73,47,This is an issue that has become an issue for many people and their parents. There is a clearer picture that the federal government is trying to get to their local government. You see it on the news every time you hear about a policy that is being floated. There is more money to be made for the US government than a mask mandate.
73,50,"Yes. It's a big issue and a problem for tsha. And if I get a chance to do it for my community, I'm going to need a better plan."
73,52,"i have no idea what to do. and in this state, it's illegal to make a mask in the US. It's a big problem for the government."
