sender,receiver,message
19,14,"Is the AMA a joke? AMA isn't a joke, it is a fact."
23,14,A joke is a joke. It's not a joke. It is a joke. It is a joke. It is a joke.
27,14,"The first line of a very well written post about this is, ""It's kind of funny that you think it's a good idea to wear a mask to prevent the spread of a virus."" It goes something along the lines of: ""Is this guy the one that needs a mask to prevent the spread of a deadly virus?"
39,14,"I'm pretty sure it was the same thing. I just felt like I had to read this all through, in a really simple way."
47,14,A lot of things in this post aren't the same thing.
48,14,It's been a lot of time since this post.
53,14,A guy is a dick. That is a joke. The joke isn't about the vaccines. It is about the masks. That's the joke.
61,14,I like the joke because it makes people feel less ashamed.
63,14,> I'm sorry. Is there some reason the CDC has this particular virus? This isn't a joke. The message of the movie is so good that it's even a bit off for a second. It's really not a joke. The fact that he is being sarcastic is enough to suggest that he is being a little immature.
68,14,"It's a crappy joke. What I'm reading is just another AMA, to be more specific, sexism is a term, not a joke."
73,14,"Wearing a mask is part of the measures deployed by the government to aid in stopping the spread of a virus.Statewide mask mandate, which would not be used to protect against HIV."
74,14,"I'm pretty sure the joke is ""This is just part of the measures deployed by the government to aid in stopping the spread of a virus. I've been infected with a venomous virus a few years ago and my phd is still going to be the most devastating because of this."
83,14,You are being silly. You don't believe in the masked system. You believe in the masked system.
14,1,So basically I’m saying this: the government should be taking care of everyone else’s health while they’re working. That way they can protect themselves. I am not saying that you are not being silly.
14,8,"He didn't say he was an idiot because he wasn't being sarcastic - he was just describing a situation where he had to go on an adventure with a man in a smoky ad hominem hat, he was being a dick."
14,11,You think you’re being ridiculous? Well a lot of folks think so.
14,13,What's funny is the AMA was intended as a joke to help us deal with the issue but not to deflect a real message. A joke is a joke. It doesn't make sense to say it's a joke. It is a joke.
16,14,"I love the AMA, but I just can't get into it."
18,14,"So if we need to ban people from wearing masks, we can just ban the government? We can ban people from wearing masks?"
19,14,"AMA is about the government, not the government."
23,14,Vaccines are also a very dangerous drug. Vaccines are a very dangerous drug.
27,14,"if the CDC is not implementing the mandate that addresses the spread of HIV, then we need to give it some credit. the CDC has not done anything on that."
39,14,People who are naive and hate it don't deserve to be vaccinated. People who are naive and hate it deserve to be vaccinated.
47,14,Wearing a mask in an unsanitary environment doesn't help prevent a virus.
48,14,This was in Florida. I'm a grad student.
53,14,The joke is about the masks.
61,14,"It is a joke about what a ""second year"" vaccine is to prevent the spread of the virus, not whether or not the government would be willing to get people into it."
63,14,The reason the CDC is a tad bit like an official or something is because the president's job is to push the health care agenda through the government. It's not like the Obama administration is a tad bit like an official or something.
68,14,My father was a mascot at the age of 11. He never got it off. It was the best time in his life. I can't say what I was doing in school.
73,14,"They need to see how this is misinterpreted. It’s all being cheesy and they need to really look at this more, or else they will become more violent."
74,14,"The idea is to get a vaccine and let people live in it. I'm just being silly. The problem isn't the AIDS, it's the lack of an irrational desire to stop the spread. I would not care how it turns out and I would not wish to be a cliche. The problem isn't the AIDS, it's the lack of an irrational desire to stop the spread. I would not care how it turns out and I would not wish to be a cliche."
83,14,I think it is funny that some people think that they should wear a mask if they can't afford it...
14,1,[A mask is part of the measures deployed by the government to aid in stopping the spread of a virus. You are being silly. You don't believe in the masked system. You believe in the masked system. So basically I’m saying this: the government should be taking care of everyone else’s health while they’re working. That way they can protect themselves. I am not saying that you are not being silly. He didn’t say he was being silly. You don’t believe in the masked system. So basically I’m saying this:
14,8,AIDS? No. Just a pandemic. No. No one should be in a position to do this.
14,11,"""I believe a statewide mask mandate is a joke. I am saying that the issue with the statewide mask mandate is a joke. I am saying that the issue with the statewide mask mandate is a joke."""
14,13,OP  He did not have a mask and no vaccination. He's talking about the government and not his own. The government has failed to respond. The AMA was a joke and the comments I'm seeing came from people that disagree with him.
16,14,"I haven't heard of this one before and can't figure it out. Its pretty fucking funny and all of the posts are all like ""I've been a part of a few school districts that have had pedophiles. A great doctor just has to be the one to tell a man to get a new vaccinated hand."" I am a huge pedophile and he is being a prankster."
18,14,"A lot of the time when I hear someone say ""I can't wear a mask in public, because I don't think i'm safe from the spread of a virus. We are not able to fight off viruses through physical contact, so we must not go through physical contact with the virus (what a bad thing that's)."" ()"
19,14,"What are you talking about? The AMA is just a joke, a nonsensical joke."
23,14,Vaccines are a very dangerous drug.
27,14,It is a joke. Especially in the face of the threat of vaccines.
39,14,Vaccines are for life. Wearing a mask outside while vaccinated is part of the measures deployed by the government to aid in stopping the spread of a virus. There's nothing hilarious about wearing a mask on a run. Wearing a mask outside while vaccinated is part of the measures deployed by the government to aid in stopping the spread of a virus.
47,14,"It seems like the CDC is able to offer a program that covers public health for patients. But, it is not going to do that in the United States."
48,14,"I'm not sure what they mean. ""It's funny that a prank exists. A prank has to be an attempt to inflict a death or even death on those who are not infected. This is why a prank isn't funny."""
53,14,"'...i love wearing a mask because I feel uncomfortable and I'm feeling more comfortable in my own skin. It is not a joke, it's a joke."
61,14,"A new joke about a joke is called a ""joke"" for a reason."
63,14,I can think of a few people in the comments who thought the movie was a joke.
68,14,I think the most popular media has become popular in a number of other countries.
73,14,There's an interesting link about the people that don't want to give their children a mask if the government isn't trying to stop the spread of a virus.
74,14,"We need to find out how to prevent this happening, and the CDC needs to be aware of how and where the issue is."
83,14,Because I'm a man and I don't believe in the masked system.
14,1,statewide mandate is a joke and a sexist joke is a joke.
14,8,"As a person who is already sick in this situation, I have seen people wearing masks at the same time at work when they are'sleeping for fun'. I guess you might not be able to get it off the ground on any sort of job at all."
14,11,"In this context, I am very much of a vaccine prankster. It is not funny, but I also am an apologist and a medical professional."
14,13,"So a ""same as a rapist, and I'm not a rapist, I don't believe in the masked system. I do believe in the masked system."""
16,14,"I have not read the book, nor have I seen it."
18,14,A CDC spokesperson made a joke and a new one aired on TV this past year. I think the whole thing is a joke.
19,14,"I don't know why you're asking a question, it's about the government."
23,14,"That's a bit sarcastic, but I think that's exactly why this is a joke."
27,14,What are you talking about? There is a huge difference between a good idea and a bad idea.
39,14,"""Vaccines are for life. Wearing a mask outside while vaccinated is part of the measures deployed by the government to aid in stopping the spread of a virus."""
47,14,Is this the problem with the new government mandate to prevent the spread of a virus?
48,14,"I've seen a lot of people on here say that santa has to wear his mask for the prank, which is exactly why he can't be funny."
53,14,"Then you don't have time to shave the shaved facial hair, and you don't have time to go into a doctor's office to get the vaccines?"
61,14,"Vaccination is a big deal in the country, especially when it's not the official goal of the government."
63,14,I'm going to bet a couple of comments that some of the comments are not being sarcastic and I'm not sure if this is a joke. They're all completely unrelated to what's mentioned on this sub.
68,14,"I was on a bus from LAX to AZ. One of my friends said the whole we need a mask thing. She sat there, wore the mask, and it made her smile. She was laughing."
73,14,The government is not a panacea for a vesicles infection. It is used as an escape and is not effective.
74,14,"It's funny, but doesn't it make the joke about what the government wants better?"
83,14,"In that case I'm not going to wear a mask on my job, and I don't want to wear a mask in public."
14,1,I'm a doctor who has had to deal with a lot of different diseases a few times over the years. It's very obvious to me that they have to use a different mechanism.
14,8,I think the article is completely misleading and unhelpful.
14,11,>Is this the problem with the new government mandate to prevent the spread of a virus?
14,13,"Despite some of the posts about HIV/AIDS, we think we are a pretty good pacifist."
16,14,I'd be a huge pedophile and I'd do the same.
18,14,"if we want to do something about HIV, we need to do something about HIV."
19,14,We are a nation and the government is a mess. There is nothing wrong with people going out and doing their thing but people are not a bunch of shit.
23,14,It's not a joke. It's a joke.
27,14,So the first line of the post was a joke about a government oversight bill.
39,14,"No, it's a joke. Vaccines are for life, and I'm not going to give you a good idea of what I'm trying to say. But that's the point. I feel like I'm just being a bit smug and I can't understand the point of the joke."
47,14,"Is it an evil idea, isn't it? It's an evil idea, and it should be a sane idea, but in a sane way."
48,14,Why not a'simple' joke? I'm gonna have to ask myself why this is a joke.
53,14,I don't think it's the ad that's telling you that people don't understand the joke.
61,14,It's not a joke. It's a joke about how the government wants to protect people in order to prevent future disease outbreaks.
63,14,If you've seen this movie you know it's overdue.
68,14,It was one of the few occasions in my life where I thought it would make me uncomfortable.
73,14,">Is wearing a mask a problem of government incompetence in Texas? Generally speaking it's not illegal to wear a mask to stop a disease in the US, unless you have medical insurance that covers them. The federal government is not allowed to make it illegal to wear a mask, which would be inappropriate."
74,14,"I was in the hospital three years ago for a colitis scar. I went out on my own and got all the venom but I couldn't get it out until now. I didn't vaccinate until I was 20 and had to get some surgery. I got an AIDS scar a few months later. I also didn't get it back. It didn't get worse. It started as a scar at a hospital and never ended until this past fall. The CDC, on the other hand, was just getting a small scar in the face and the f"
83,14,I read somewhere that they aren't required to make it to the health of people and they don't require you to wear a mask for the purpose of preventing the spread of a virus. It is a joke and they can't make it legal.
14,1,The joke says it's a joke about the federal government incompetence.
14,8,"The CDC, on the other hand, was just getting a small scar in the face and the f I read somewhere that they aren't required to make it to the health of people and they don't require you to wear a mask for the purpose of preventing the spread of a virus. It is a joke and they can't make it legal."
14,11,"Vaccines are for life, and I'm not going to give you a good idea of what I'm trying to say. I'm a doctor who has had to deal with a lot of different diseases a few times over the years. It's very obvious to me that they have to use a different mechanism. I think the article is completely misleading and unhelpful."
14,13,This would be like saying I'd be a huge pedophile and I'd do the same.
16,14,I think you should get a mask.
18,14,"Well, it doesn't matter if it's a joke or not, unless it's a joke that explains why they say things like, ""We're talking about the issue of people who are afraid to take their hands off for a minute or two."""
19,14,"As a government employee, I don't think anyone is going to believe the government is a mess. It is about a joke, that's for sure."
23,14,Vaccines are dangerous and a joke. You're being a bit sarcastic.
27,14,You're talking about a government oversight bill. Is it good to wear a mask to prevent the spread of a virus?
39,14,"I don't think this is a joke, if the guy is talking to you, then I think he's just being an asshole."
47,14,Is wearing a mask part of the measures deployed by the government to aid in stopping the spread of a virus?
48,14,I think we should make a big deal about it. Because the government is trying to get people to take up their own health care. That's why the government has to stop it.
53,14,"As someone who is allergic to HIV and knows it's a dangerous disease, I'm sorry to say the CDC is putting the mask on so many people."
61,14,"I think the joke is overrated, but this guy is bringing it up because he is the guy that's going to get the virus."
63,14,">I don't think it's ironic at all that we are so overreacting to people who are trying to stop the spread of a virus. No, it's not. No. It's just a joke."
68,14,I'm not sure if I understand you but the idea of a AMA about a government invading people is a bit fucked up if you're not the victim of the AMA. You're describing a rabid fan of the government.
73,14,I don't think the public will be comfortable with wearing a mask to prevent the spread of HIV unless the NSA has a mandate for them. I think this is one of the major concerns that the government faces if they don't make it.
74,14,So it's like people get into an accident on the highway and go off on a whim and get to a hospital for a virus?
83,14,"There are things like the ""Fwdr.fl.gov/Css/fwdr"" (the fact that people are ignoring them in front of the camera)."
14,1,"It's like saying, ""I'm a doctor who has had to deal with a lot of different diseases a few times over the years. It's very obvious to me that they have to use a different mechanism."""
14,8,I like the idea that the government is making fun of people who think they're a bit of a douchebag. That they want to keep the public safe is something we should be trying to stop them from doing.
14,11,So we should make a big deal about this.
14,13,"It's a joke, but it makes a pretty good point. The people in this article that I've met who don't think it's funny and the ones who actually do know what it's about are the types that will make them laugh about the article. It's not like that's why this is a joke."
16,14,I love the book. This is a very interesting and engaging read. I am an edgy student who thinks that's how people learn to read. I don't know the context of that.
18,14,...which is really a good thing to have.
19,14,"I'm a guy in a mask. It makes me sad. Seeing my face go off to help people, but I'm not sure what kind of joke that is."
23,14,What's wrong with wearing a mask?
27,14,I don't understand you.
39,14,People who are naive and hate it don't deserve to be vaccinated. There's nothing hilarious about wearing a mask outside while vaccinated is part of the measures deployed by the government to aid in stopping the spread of a virus. There's nothing hilarious about wearing a mask outside while vaccinated is part of the measures deployed by the government to aid in stopping the spread of a virus.
47,14,"CANNOTANSWER: ""Wearing a mask does not help in stopping the spread of a virus, it’s useless and I hate it. I can tell you that it’s just as dangerous as being shot or burned to death. I’m running a half mile in Florida right now!"""
48,14,"There is a lot of information about the AMAs. [NAME] explains ""Winning a mask in a run is a joke."" It's really about how people are trying to fight off HIV, or how people will actually spread it by being infected with a virus, and then it's like ""Hey, I'm not crazy at all about this prank"":"
53,14,I don't think I'm comfortable doing the right things.
61,14,Vaccines are not what the government wants. They are not what the government wants.
63,14,It's a joke. You're a raging maniac
68,14,"Yes, it's a joke."
73,14,I don't think it's a problem with the NSA. I think it's one of the major concerns that the government faces if they don't make it.
74,14,CANNOTANSWER: Wearing a mask does not help in stopping the spread of a virus.
83,14,"People who do not understand the concept of a ""job"" are blaming their own health care and health system, while avoiding the dangers of wearing a mask."
14,1,"> I can tell you that it’s just as dangerous as being shot or burned to death. I’m running a half mile in Florida right now!"""
14,8,"Yes, it's a joke. And it's not only funny, it's very effective."
14,11,> What's wrong with wearing a mask?
14,13,They're not kidding. You can't win a race and win a t shirt while you're there. This is a joke.
16,14,I don't want to go into the context of this sub. I don't care if it's a joke.
18,14,""" I think it's funny that you read the title, but I think it's funny. Because the government doesn't want to have the health of their family protected."" It's not about the vaccine, it's about the treatment of the disease. It's a joke."
19,14,"""We are a nation and the government is a mess. There is nothing wrong with people going out and doing their thing but people are not a bunch of shit."""
23,14,This is all a joke. I think the movie is a joke.
27,14,"It's not a joke, it's a joke. It's a joke, and it's a joke."
39,14,A few days ago I saw some ad with the same title.
47,14,You're not being sarcastic. It's called a joke.
48,14,"You guys are a big fucking fucking troll, I'd say. This is a good example of why people are getting mad at the government."
53,14,'We've heard that people are more likely to be allergic to weed than to get vaccinated'
61,14,"""The government wants to whack away the epidemic by doing something that is stupid and unpopular. The vaccine is not legal or fair"""
63,14,"It's not a joke, it's just a joke."
68,14,"AMA, what? I read it twice..."
73,14,"I have heard that people in Texas get a fecal virus vaccine, but haven't been able to get it in the states. This is an ineffective way to spread the disease, which is what the government is attempting to prevent."
74,14,"> I'm pretty sure the joke is ""Winning a mask is part of the measures deployed by the government to aid in stopping the spread of a virus. This is a very generalised version of the joke. Vaccination is a combination of medication and therapy to help keep people from dying and getting sick. You get a medical mask on and a mask in your eyes. When you bleed out of a mask you can get a mask in your head to prevent future infections. The only thing that matters in a joke."
83,14,I think the joke about wearing a mask on a job is hilarious. It's a joke.
14,1,"""This is all a joke."""
14,8,This is a good example of why people are getting mad at the government.
14,11,I have a good impression that the idea of the government using the government masks to prevent HIV/AIDS is the problem.
14,13,"CANNOTANSWER - People who do not understand the concept of a ""job"" are blaming their own health care and health system, while avoiding the dangers of wearing a mask."
16,14,"I think you are making a joke about a government government. The CDC has to get people to get their hands on vaccines. Getting them to get vaccinated is what the CDC is supposedly trying to do in order to prevent HIV, and even then the CDC can't force a person to get vaccinated."
18,14,It's a joke.
19,14,"In other words, the government is a mess."
23,14,There's nothing wrong with a mask. It is a joke. The mask mandate is to help stop the spread of the disease.
27,14,I've been on Reddit for a long time. It was an intensely informative piece of news that made me grin. I never had a problem with this and I wanted to know if a certain piece of news could change my life.
39,14,"People say that it's racist, but it's not. It's because people want to be in front of a public health issue. It doesn't matter what the government is doing in this country. I know it's not about any specific diseases. The reason that people want to know that is because people are... are. People do, and there's nothing to that in my opinion, but it's just the most important part of the problem."
47,14,"So, the government is bringing a huge hit to the national health system. Its going to end up costing our economy more than it should. It's not even that much of a joke."
48,14,"I think the point is, I don't think people who can't understand what the AMA is about is valid."
53,14,Vaccines are not needed in the US. But it has to do with pandemics.
61,14,"Is there a medical term that identifies as a joke in a movie? Because it's a joke, but I'm not sure what the other commenter means by sexist."
63,14,"""We don't want to see this movie if you're going to go to it with me, and I'm getting the vaccine."""
68,14,A rape joke is not a joke. It's a joke.
73,14,"The message was from a guy who wanted to help people in Texas. Then I heard him do the same to a child who was already suffering from AIDS. We had to put a statewide mask mandate because he was scared of getting an HIV vaccine, but he's not the one. We got a mask because he was so sick and they decided to have him go to the hospital and do the shit that was done to him."
74,14,It's a joke about what the government wants. And to a large extent it's silly.
83,14,Vaccines are not legally required unless you are a doctor. You have to wear a mask on your job unless you are a doctor. It's a joke. It's funny and not legal.
14,1,You can't just run in front of a crowded hospital and then get shot?
14,8,"CANNOTANSWER - People who do not understand the concept of a ""job"" are blaming their own health care and health system."
14,11,"If we can't stop the epidemic of HIV, we'll never stop it."
14,13,Why is it that they're not going to have a doctor that identifies as a joke in a movie?
16,14,"What I’ve heard is that it seems that the CDC doesn’t do much to prevent HIV from spreading, so the idea of going under a mask is pretty egregious. I think it was the wrong idea."
18,14,Vaccines are for life. It's a joke.
19,14,"What about the AMA? The government is a mess, and I'm afraid this is the worst kind of joke you can make."
23,14,"I had a friend who had an AIDS virus (probably from the early 90s), and he wore a mask as well as the joke on the side of a car that he had parked on a side street. His wife was shocked that he couldn't find a doctor who had been using it while he was sick."
27,14,Vaccines are for life. Vaccines are for life. People don't wear them because they're sick. They don't want to.
39,14,I work in public health and the only thing I can say about putting on a mask is that I don't fucking hate putting on a mask if I get sick.
47,14,"The government is also trying to be racist, which is a huge turnoff to the majority of their constituents."
48,14,So the aforementioned joke and the rest of it are all jokes.
53,14,"“...I love wearing a mask because I feel uncomfortable and I'm feeling more comfortable in my own skin. It is not a joke, it's a joke."
61,14,[Mad Men](http://en.wikipedia.org/wiki/FastPill/comments/1u0_8x/FastPill)
63,14,This is a good movie! I haven't seen it.
68,14,"I've heard about these being marketed as something for the private sector because of the prevalence of HIV. AMAs have become the norm here, but I'm not sure what it is. I think it's just a joke to the government that you can't just ""stuff"" it up."
73,14,">I'm sorry, but I don't think it would help. I'm mad at the president. Wearing a mask does not help in stopping the spread of a virus, it's useless and I hate it."
74,14,Vaccination is a combination of medication and therapy to help keep people from dying and getting sick. You get a medical mask and a mask in your eyes.
83,14,"Yes, the government does have some say."
14,1,"No, no, no. I'm just going to say ""I'm not making any progress on this as I haven't seen it. I'm not going to say it as an insult."
14,8,"Yes, they can. But the idea of putting a mask on a job at a job is a real thing, not a sarcastic joke."
